UN201801010008,"2018-01-01 00:58:47",南區,噪音舉發,妨害安寧,"南區中華南路二段233巷14號3樓 噪音舉發",臺南市南區中華南路二段233巷14號,22.960323,120.189559
UN201801010018,"2018-01-01 03:00:17",南區,噪音舉發,妨害安寧,"南區國華街一段60號 噪音舉發",臺南市南區國華街一段60號,22.984218,120.19647
UN201801010034,"2018-01-01 08:40:05",永康區,違規停車,違規停車,"永康區中山東路282號  違規停車",臺南市永康區中山東路282號,23.010328,120.237172
UN201801010035,"2018-01-01 08:42:47",安南區,髒亂及汙染,空氣汙染,髒亂及汙染,709台灣台南市安南區安中路三段407巷3號,23.04957137154822,120.1740708561194
UN201801010102,"2018-01-01 13:47:21",中西區,違規停車,違規停車,"中西區民權路三段111號 違規停車",臺南市中西區民權路三段111號,22.996927,120.196682
UN201801010109,"2018-01-01 14:03:08",中西區,噪音舉發,場所連續噪音,中西區友愛街225號,700台灣台南市中西區友愛街225號,22.9918549,120.1969933
UN201801010117,"2018-01-01 14:34:55",中西區,噪音舉發,妨害安寧,"中西區友愛街國華街口  妨害安寧",700台灣台南市中西區國華街二段174號,22.9919402,120.1971437
UN201801010133,"2018-01-01 15:28:35",中西區,噪音舉發,妨害安寧,"中西區國華街二段友愛街 噪音舉發",700台灣台南市中西區國華街二段友愛街,22.9919362,120.1971468
UN201801010147,"2018-01-01 16:37:51",中西區,違規停車,違規停車,"中西區民族路二段57巷口(萬昌街151號旁) 違規停車",臺南市台南市民族路二段57巷口(萬昌街151號,22.99393,120.210581
UN201801010154,"2018-01-01 16:59:23",南區,違規停車,違規停車,"南區夏林路310號 違規停車",臺南市南區夏林路310號,22.976802,120.195385
UN201801010185,"2018-01-01 19:14:07",中西區,違規停車,違規停車,違規停車,臺南市中西區民族路二段76號,22.994726,120.20925
UN201801010194,"2018-01-01 19:55:15",佳里區,違規停車,違規停車,"佳里區林園街100-106號 違規停車",722台灣台南市佳里區林園街100號,23.165717538607183,120.17814239615825
UN201801010207,"2018-01-01 21:25:23",永康區,違規停車,違規停車,"永康區六合路42巷50號。巷口 違規停車",臺南市永康區六合路42巷50號,23.009208,120.232462
UN201801010219,"2018-01-01 22:14:01",南區,道路維修,路面坑洞,"南區新興路477號 道路維修",臺南市南區新興路477號,22.974906,120.188747
UN201801010223,"2018-01-01 22:47:16",中西區,交通運輸,佔用道路,"中西區府緯街28號 交通運輸",臺南市中西區府緯街28號,22.983947,120.199183
UN201801020010,"2018-01-02 01:09:12",中西區,噪音舉發,場所連續噪音,"中西區金華新路43號3樓 噪音舉發",臺南市中西區金華新路43號,22.993256,120.19278
UN201801020016,"2018-01-02 06:06:12",永康區,違規停車,違規停車,"永康區復華六街67巷5號 違規停車",臺南市永康區復華六街67巷5號,23.012011,120.245841
UN201801020020,"2018-01-02 07:32:30",安平區,違規停車,違規停車,安平區安平路50號右邊、304號右邊違規停車,安平區安平路50號304號,22.9816889,120.2000915
UN201801020034,"2018-01-02 08:19:11",中西區,違規停車,違規停車,"中西區開山路52到90號及對面75到85號 違規停車",臺南市中西區開山路52到90號,22.989829,120.20686
UN201801020061,"2018-01-02 09:09:10",新營區,違規停車,違規停車,"新營區中正路10號 違規停車",臺南市新營區中正路10號,23.30887,120.316291
UN201801020211,"2018-01-02 15:41:39",東區,違規停車,違規停車,"東區中華東路二段185巷4號  違規停車",臺南市東區中華東路二段185巷4號,22.984593,120.232794
UN201801020231,"2018-01-02 16:32:07",中西區,違規停車,違規停車,"中西區衛民街35號與55號 違規停車",臺南市衛民街35號,22.992705,120.211216
UN201801020232,"2018-01-02 16:34:08",永康區,違規停車,違規停車,"永康區大武街52號永康路橋下 違規停車",臺南市永康區大武街52號,23.020351,120.22292
UN201801020239,"2018-01-02 16:46:47",新市區,違規停車,違規停車,"新市區永就里59-3號旁 違規停車",臺南市永就里59-3號,23.064107,120.294022
UN201801020249,"2018-01-02 17:07:31",中西區,違規停車,違規停車,違規停車,臺南市中西區衛民街106號,22.993151,120.209223
UN201801020259,"2018-01-02 17:32:42",安平區,噪音舉發,妨害安寧,"安平區華平路541號 噪音舉發",708台灣台南市安平區華平路541號,22.9946712,120.1755767
UN201801020269,"2018-01-02 18:00:19",永康區,交通運輸,佔用道路,"台南市永康區中正七街22號 佔用道路",臺南市永康區中正七街22號,23.039754,120.239961
UN201801020271,"2018-01-02 18:01:02",永康區,違規停車,違規停車,違規停車,臺南市永康區中正七街22號,23.039754,120.239961
UN201801020283,"2018-01-02 18:45:53",中西區,違規停車,違規停車,中西區衛民街的143號到149號違規停車,臺南市中西區衛民街的143號,22.993375,120.207423
UN201801020286,"2018-01-02 19:07:01",永康區,違規停車,違規停車,"永康區中華路619巷16號 違規停車",臺南市永康區中華路619巷16號,23.014469,120.229466
UN201801020288,"2018-01-02 19:09:18",安平區,違規停車,違規停車,"安平區華平路658號 違規停車",臺南市華平路658號,22.995893,120.17588
UN201801020305,"2018-01-02 19:46:25",中西區,違規停車,違規停車,"中西區府前路一段172號 違規停車",臺南市中西區府前路一段172號,22.989138,120.206681
UN201801020313,"2018-01-02 20:04:41",安南區,違規停車,違規停車,違規停車,臺南市永華路二段149號,22.989247,120.183286
UN201801020335,"2018-01-02 22:47:03",東區,違規停車,違規停車,"東區中華東路三段387號 違規停車",701台灣台南市東區中華東路三段387號,22.9734744,120.2208768
UN201801020345,"2018-01-02 23:42:56",中西區,噪音舉發,場所連續噪音,"中西區金華新路43號3樓 噪音舉發",臺南市中西區金華新路43號,22.993256,120.19278
UN201801030018,"2018-01-03 07:28:30",安平區,違規停車,違規停車,"安'平區安平路304號右邊 違規停車",安平區安平路304號右邊,22.9815774,120.2003207
UN201801030030,"2018-01-03 08:24:22",麻豆區,髒亂及汙染,空氣汙染,"麻豆區仁愛路8號 慈惠堂廟宇 髒亂及汙染",臺南市麻豆區仁愛路8號,23.183203,120.24669
UN201801030056,"2018-01-03 09:18:56",中西區,違規停車,違規停車,中西區民族路二段18號55號/西華南街32號；46號違規停車,臺南市中西區民族路二段18號,22.994593,120.211168
UN201801030057,"2018-01-03 09:19:40",中西區,違規停車,違規停車,違規停車,臺南市西華南街32號,22.993828,120.209542
UN201801030088,"2018-01-03 10:23:07",新市區,違規停車,違規停車,"新市區永就里59-3號旁 違規停車",臺南市新市區永就里59-3號,23.064107,120.294022
UN201801030118,"2018-01-03 11:15:17",中西區,違規停車,違規停車,"中西區西華南街33號  違規停車",臺南市中西區西華南街33號,22.993754,120.209335
UN201801030139,"2018-01-03 11:56:09",中西區,違規停車,違規停車,"中西區開山路52到90號及對面75到85號   違規停車",臺南市開山路52到90號,22.989829,120.20686
UN201801030150,"2018-01-03 12:33:59",中西區,違規停車,違規停車,違規停車,臺南市中西區民族路二段76號,22.994726,120.20925
UN201801030165,"2018-01-03 13:39:50",中西區,違規停車,違規停車,"中西區衛民街143號到149號／152號到158號 違規停車",臺南市衛民街143號,22.993375,120.207423
UN201801030167,"2018-01-03 13:40:41",中西區,違規停車,違規停車,"中西區衛民街35號到55號 違規停車",臺南市衛民街35號,22.992705,120.211216
UN201801030226,"2018-01-03 16:10:47",中西區,違規停車,違規停車,"中西區衛民街的143號到149號/152號到158號/民權路一段的東門圓環到中山路口  違規停車","臺南市衛民 街的143號",22.993375,120.207423
UN201801030230,"2018-01-03 16:21:41",北區,交通運輸,號誌故障,"北區西門路四段5號 交通運輸",臺南市北區西門路四段5號,23.006205,120.205758
UN201801030250,"2018-01-03 17:16:39",安平區,違規停車,違規停車,"安平區華平路656號 違規停車",臺南市安平區華平路656號,22.995837,120.175938
UN201801030260,"2018-01-03 17:40:00",中西區,違規停車,違規停車,"中西區民族路二段29號 違規停車",臺南市中西區民族路二段29號,22.994332,120.210929
UN201801030261,"2018-01-03 17:50:06",東區,違規停車,違規停車,"東區裕農一街86號前 違規停車",臺南市東區裕農一街86號,22.985798,120.238316
UN201801030271,"2018-01-03 18:08:09",永康區,違規停車,違規停車,"永康區六合路42巷1號 違規停車",臺南市六合路42巷1號,23.00944,120.231408
UN201801030283,"2018-01-03 19:04:20",永康區,違規停車,違規停車,"永康區六合路42巷1號 巷口 違規停車",臺南市永康區六合路42巷1號,23.00944,120.231408
UN201801030303,"2018-01-03 20:04:37",永康區,違規停車,違規停車,"永康區六合路42巷1號 違規停車",臺南市六合路42巷1號,23.00944,120.231408
UN201801030326,"2018-01-03 21:06:23",北區,違規停車,違規停車,"北區南園街101巷34弄25號與17號 違規停車",臺南市北區南園街101巷34弄25號,23.009353,120.227811
UN201801030346,"2018-01-03 23:15:23",中西區,噪音舉發,場所連續噪音,"中西區金華新路43號3樓 噪音舉發",臺南市中西區金華新路43號,22.993256,120.19278
UN201801030350,"2018-01-03 23:46:55",中西區,違規停車,違規停車,"中西區西華南街47號 違規停車",臺南市西華南街47號,22.994067,120.209406
UN201801040008,"2018-01-04 02:09:20",中西區,噪音舉發,妨害安寧,"中西區大同路一段252號 噪音舉發",臺南市大同路一段252號,22.981566,120.211733
UN201801040033,"2018-01-04 08:41:44",中西區,違規停車,違規停車,"中西區健康路一段320號   違規停車",臺南市健康路一段320號,22.981569,120.202519
UN201801040047,"2018-01-04 09:02:37",安平區,違規停車,違規停車,"安平區建平八街551號  違規停車",臺南市安平區建平八街551號,22.991957,120.168635
UN201801040056,"2018-01-04 09:19:59",中西區,違規停車,違規停車,"中西區民族路二段18號與42號  違規停車",臺南市中西區民族路二段18號,22.994593,120.211168
UN201801040057,"2018-01-04 09:20:57",永康區,噪音舉發,場所連續噪音,"台南市永康區中山南路428號(美吉加油站)  噪音舉發",臺南市永康區中山南路428號,23.017212,120.238702
UN201801040059,"2018-01-04 09:21:40",中西區,違規停車,違規停車,"中西區民族路二段55到63號  違規停車",臺南市中西區民族路二段55到63號,22.994306,120.209873
UN201801040107,"2018-01-04 11:21:39",中西區,違規停車,違規停車,"中西區廣慈街停車格   違規停車",700台灣台南市中西區廣慈街停車格,22.9967338,120.2065784
UN201801040128,"2018-01-04 12:04:11",中西區,違規停車,違規停車,"中西區開山路52到90號及對面75到85號 違規停車",臺南市開山路52到90號,22.989829,120.20686
UN201801040131,"2018-01-04 12:08:59",永康區,違規停車,違規停車,違規停車,臺南市永康區中華路145號,23.003014,120.234952
UN201801040135,"2018-01-04 12:15:56",中西區,違規停車,違規停車,"中西區永福路一段109號  違規停車",臺南市中西區永福路一段109號,22.984268,120.200007
UN201801040141,"2018-01-04 12:37:11",中西區,違規停車,違規停車,"中西區民族路三段290號前  違規停車",臺南市中西區民族路三段290號,23.000266,120.192257
UN201801040153,"2018-01-04 13:20:36",永康區,違規停車,違規停車,"永康區六合路42巷50號。巷口  違規停車",臺南市永康區六合路42巷50號,23.009208,120.232462
UN201801040208,"2018-01-04 16:12:11",關廟區,噪音舉發,場所連續噪音,"關廟區民族街76巷15號旁 場所連續噪音",臺南市關廟區民族街76巷15號,22.958229,120.33235
UN201801040265,"2018-01-04 17:24:13",中西區,違規停車,違規停車,中西區西華南街33號違規停車,臺南市中西區西華南街33號,22.993754,120.209335
UN201801040266,"2018-01-04 17:27:04",中西區,違規停車,違規停車,"中西區衛民 街35號到55號 違規停車",臺南市中西區衛民街35號,22.992705,120.211216
UN201801040267,"2018-01-04 17:28:32",中西區,違規停車,違規停車,"中西區衛民 街的143號到149號/152號到158號 違規停車",臺南市中西區衛民街143號,22.993375,120.207423
UN201801040269,"2018-01-04 17:32:07",中西區,違規停車,違規停車,"中西區大同路一段142號到210號 違規停車",臺南市中西區大同路一段142號,22.984273,120.211001
UN201801040281,"2018-01-04 18:17:54",中西區,違規停車,違規停車,"中西區青年路109號/大同路一段201號/北門路一段134號/萬昌街與衛民街 違規停車",臺南市青年路109號,22.992177,120.208391
UN201801040284,"2018-01-04 18:25:38",東區,違規停車,違規停車,違規停車,臺南市北門路一段134號,22.992867,120.211826
UN201801040300,"2018-01-04 18:57:35",安平區,違規停車,違規停車,"安平區華平路656號 違規停車",臺南市安平區華平路656號,22.995837,120.175938
UN201801040318,"2018-01-04 20:10:52",北區,騎樓舉發,騎樓舉發,"北區北安路一段191號 騎樓舉發",臺南市北區北安路一段191號,23.018039,120.207709
UN201801040332,"2018-01-04 21:26:35",南區,違規停車,違規停車,"南區長南街29號 違規停車",臺南市長南街29號,22.982809,120.190327
UN201801050008,"2018-01-05 02:21:42",中西區,噪音舉發,場所連續噪音,"中西區金華新路43號3樓 噪音舉發",臺南市中西區金華新路43號,22.993256,120.19278
UN201801050016,"2018-01-05 07:59:55",北區,違規停車,違規停車,"北區大興街565巷8號 違規停車",北區大興街565巷8號,23.007064191569896,120.18120583491827
UN201801050028,"2018-01-05 08:46:11",永康區,違規停車,違規停車,"永康區中山東路239號 違規停車",臺南市永康區中山東路239號,23.010105,120.237505
UN201801050105,"2018-01-05 12:03:46",中西區,違規停車,違規停車,"中西區民族路二段133號 公園路口到忠義路口 違規停車",臺南市中西區民族路二段133號,22.994878,120.207797
UN201801050113,"2018-01-05 12:19:25",永康區,違規停車,違規停車,"永康區中華二路359號 違規停車",台南市永康區中華二路359號,22.9809633,120.2179523
UN201801050128,"2018-01-05 12:47:44",永康區,違規停車,違規停車,"永康區六合路42巷50號 違規停車",臺南市六合路42巷50號,23.009208,120.232462
UN201801050129,"2018-01-05 12:49:21",永康區,違規停車,違規停車,"永康區大武街52號永康陸橋下 違規停車",臺南市永康區大武街52號,23.020351,120.22292
UN201801050131,"2018-01-05 12:57:01",中西區,違規停車,違規停車,"中西區開山路52到90號及對面75到85號 違規停車",臺南市開山路52到90號,22.989829,120.20686
UN201801050132,"2018-01-05 12:59:51",中西區,騎樓舉發,騎樓舉發,"中西區衛民 街的143號到149號/152號到158號 違停",臺南市衛民街的143號,22.993375,120.207423
UN201801050133,"2018-01-05 13:01:32",中西區,騎樓舉發,騎樓舉發,"中西區衛民街35號到55號 騎樓舉發",臺南市中西區衛民街35號,22.992705,120.211216
UN201801050141,"2018-01-05 13:22:41",新市區,違規停車,違規停車,"新市區永就里59-3號 違規停車",臺南市新市區永就里59-3號,23.064107,120.294022
UN201801050157,"2018-01-05 14:07:00",關廟區,噪音舉發,妨害安寧,"關廟區民族街76巷15號旁 噪音舉發",臺南市關廟區民族街76巷15號,22.958229,120.33235
UN201801050170,"2018-01-05 14:08:00",關廟區,噪音舉發,場所連續噪音,"關廟區民族街76巷15號旁 噪音舉發",臺南市關廟區民族街76巷15號,22.958229,120.33235
UN201801050193,"2018-01-05 14:17:28",北區,違規停車,違規停車,"北區臨安路二段69號 違規停車",臺南市北區臨安路二段69號,23.002912,120.196687
UN201801050234,"2018-01-05 15:07:25",中西區,騎樓舉發,騎樓舉發,"中西區衛民 街35號/ 51號/55號 違停","臺南市衛民 街35號",22.992705,120.211216
UN201801050243,"2018-01-05 15:26:53",中西區,違規停車,違規停車,"中西區慶中街198號 違規停車",臺南市中西區慶中街198號,22.984514,120.205694
UN201801050245,"2018-01-05 15:38:40",中西區,違規停車,違規停車,"中西區民族路二段53號到63號 66號違規停車",臺南市民族路二段53號,22.994317,120.210333
UN201801050265,"2018-01-05 16:09:31",東區,交通運輸,交通疏導,交通運輸,臺南市東區崇明路497號,22.972402,120.22541
UN201801050270,"2018-01-05 16:18:11",中西區,違規停車,違規停車,"中西區民族路二段49號 違規停車",臺南市中西區民族路二段49號,22.994301,120.210439
UN201801050271,"2018-01-05 16:19:52",中西區,違規停車,違規停車,"中西區西華南街二到10號 違規停車",臺南市中西區西華南街二到10號,22.993195,120.20943
UN201801050275,"2018-01-05 16:27:28",永康區,違規停車,違規停車,"永康區大武街52號永康路橋下 違規停車",臺南市永康區大武街52號,23.020351,120.22292
UN201801050276,"2018-01-05 16:29:44",中西區,違規停車,違規停車,"中西區忠孝街1號 違規停車",臺南市中西區忠孝街1號,22.997933,120.195976
UN201801050278,"2018-01-05 16:31:06",柳營區,違規停車,違規停車,"柳營區中山東路二段1116號 違規停車",臺南市柳營區中山東路二段1116號,23.279881,120.329703
UN201801050283,"2018-01-05 16:46:38",東區,違規停車,違規停車,"東區崇明路497號 違規停車",臺南市東區崇明路497號,22.972402,120.22541
UN201801050296,"2018-01-05 17:33:47",永康區,違規停車,違規停車,"永康區六合路42巷1號巷口  違規停車",臺南市永康區六合路42巷1號,23.00944,120.231408
UN201801050300,"2018-01-05 17:37:43",中西區,違規停車,違規停車,"中西區衛民街89號以及83號 違規停車",臺南市衛民街89號,22.992754,120.209218
UN201801050304,"2018-01-05 17:56:26",東區,違規停車,違規停車,"東區崇明路497號 違規停車",臺南市東區崇明路497號,22.972402,120.22541
UN201801050341,"2018-01-05 19:19:31",中西區,違規停車,違規停車,"中西區大同路一段142號 違規停車",臺南市大同路一段142號,22.984273,120.211001
UN201801050343,"2018-01-05 19:22:26",安平區,違規停車,違規停車,"安平區安平路446巷與安平路446巷25弄交叉路口 違規停車",安平路446巷安平路446巷25弄,22.99915,120.1732154
UN201801050355,"2018-01-05 20:35:57",中西區,違規停車,違規停車,"中西區民族路二段76號 違規停車",臺南市中西區民族路二段76號,22.994726,120.20925
UN201801050359,"2018-01-05 20:52:12",中西區,違規停車,違規停車,"違規停車 併案A-TB-2018-1008",臺南市民族路二段76號,22.994726,120.20925
UN201801050372,"2018-01-05 22:32:37",中西區,騎樓舉發,騎樓舉發,"中西區成功路437號1樓 騎樓舉發",臺南市中西區成功路437號,23.000846,120.196978
UN201801050373,"2018-01-05 22:42:46",安平區,噪音舉發,妨害安寧,"安平區建平三街127-173號 妨害安寧",708台灣台南市安平區建平三街127號,22.9857113,120.1771253
UN201801060066,"2018-01-06 10:43:15",北區,噪音舉發,妨害安寧,"北區大興街574號 妨害安寧",臺南市北區大興街574號,23.008074,120.179807
UN201801060071,"2018-01-06 11:02:25",東區,違規停車,違規停車,"東區東寧路122號 違規停車",臺南市東區東寧路122號,22.991848,120.221797
UN201801060072,"2018-01-06 11:03:16",中西區,違規停車,違規停車,違規停車,臺南市中西區開山路52到90號,22.989829,120.20686
UN201801060087,"2018-01-06 11:33:18",中西區,騎樓舉發,騎樓舉發,騎樓舉發,臺南市中西區衛民街65號,22.992815,120.21048
UN201801060089,"2018-01-06 11:36:41",中西區,騎樓舉發,騎樓舉發,"中西區衛民街的143號到149號/152號到158號 騎樓舉發",臺南市中西區衛民街143號,22.993375,120.207423
UN201801060090,"2018-01-06 11:38:49",中西區,違規停車,違規停車,"中西區西華南街60號 違規停車",臺南市中西區西華南街60號,22.994113,120.209579
UN201801060091,"2018-01-06 11:39:09",中西區,違規停車,違規停車,"中西區衛民街35號到55號 騎樓舉發",臺南市中西區衛民街35號,22.992705,120.211216
UN201801060094,"2018-01-06 11:58:51",中西區,違規停車,違規停車,"中西區慶中街180號周遭 違規停車",臺南市中西區慶中街180號,22.984173,120.205659
UN201801060100,"2018-01-06 12:25:07",東區,違規停車,違規停車,"東區東寧路10號府城滷味 違規停車",臺南市東區東寧路10號,22.992192,120.218349
UN201801060102,"2018-01-06 12:31:29",東區,違規停車,違規停車,"東區東寧路484號週遭 違規停車",臺南市東區東寧路484號,22.989247,120.230033
UN201801060105,"2018-01-06 12:48:09",安平區,騎樓舉發,騎樓舉發,"安平區華平路656號 騎樓舉發",臺南市安平區華平路656號,22.995837,120.175938
UN201801060128,"2018-01-06 13:53:35",中西區,違規停車,違規停車,"中西區民族路二段76號 違規停車",臺南市中西區民族路二段76號,22.994726,120.20925
UN201801060131,"2018-01-06 13:57:27",北區,違規停車,違規停車,"北區北門路二段237巷41弄2號牆邊 違規停車",臺南市北區北門路二段237巷41弄2號,23.007343,120.213473
UN201801060140,"2018-01-06 14:25:59",永康區,噪音舉發,妨害安寧,永康區中山南路428號(美吉加油站)噪音舉發,臺南市永康區中山南路428號,23.017212,120.238702
UN201801060150,"2018-01-06 14:47:01",中西區,噪音舉發,場所連續噪音,"中西區友愛與國華街 噪音舉發",中西區友愛街225號,22.9918549,120.1969933
UN201801060179,"2018-01-06 16:52:14",安平區,違規停車,違規停車,"安平區華平路658號 違規停車",臺南市安平區華平路658號,22.995893,120.17588
UN201801060196,"2018-01-06 17:38:55",中西區,違規停車,違規停車,違規停車,臺南市中西區民族路二段76號,22.994726,120.20925
UN201801060209,"2018-01-06 18:06:15",中西區,違規停車,違規停車,"中西區民族路二段76號 違規停車",臺南市中西區民族路二段76號,22.994726,120.20925
UN201801060220,"2018-01-06 18:40:42",中西區,違規停車,違規停車,"中西區西華南街26號到32號 違規停車",臺南市中西區西華南街26號,22.99369,120.20951
UN201801060227,"2018-01-06 19:03:26",中西區,違規停車,違規停車,"中西區西華南街32號 違規停車",臺南市西華南街32號,22.993828,120.209542
UN201801060228,"2018-01-06 19:03:40",中西區,違規停車,違規停車,"中西區西門路二段３８７號 違規停車",臺南市西門路二段387號,22.998515,120.200417
UN201801060230,"2018-01-06 19:10:22",安平區,噪音舉發,妨害安寧,"安平區怡平路140巷27弄7號 妨害安寧",臺南市安平區怡平路140巷27弄7號,22.993971,120.179433
