UN201805280005,"2018-05-28 01:21:28",永康區,髒亂及汙染,空氣汙染,"永康焚化爐 空氣污染＆投訴",臺南市永康區王行東路166號,23.039395,120.283617
UN201805280011,"2018-05-28 06:40:13",南區,噪音舉發,場所連續噪音,"南區健康路二段116巷7弄11號後方，淺野屋麵包店 機械噪音",臺南市南區健康路二段116巷7弄11號,22.981904,120.193981
UN201805280021,"2018-05-28 08:03:01",永康區,違規停車,違規停車,"永康區勝學路102號 違規停車",臺南市永康區勝學路102號,23.003094,120.231025
UN201805280022,"2018-05-28 08:05:30",東區,違規停車,違規停車,"東區府連東路37號早餐店 違停",臺南市東區府連東路37號,22.984427,120.217801
UN201805280050,"2018-05-28 09:27:44",柳營區,違規停車,違規停車,柳營區中山西路一段127號違規停車,臺南市柳營區中山西路一段127號,23.278758,120.321485
UN201805280055,"2018-05-28 09:36:25",中西區,違規停車,違規停車,"中西區西門路二段351號 違規停車",臺南市中西區西門路二段351號,22.997981,120.19968
UN201805280068,"2018-05-28 09:59:10",中西區,違規停車,違規停車,"中西區臨安路一段56號與大新街七巷轉角紅線  違規停車",臺南市中西區臨安路一段56號,22.998831,120.190517
UN201805280072,"2018-05-28 10:01:44",中西區,騎樓舉發,騎樓舉發,"中西區衛民街154號  騎樓舉發",臺南市中西區衛民街154號,22.993561,120.207195
