UN201806050260,"2018-06-05 15:52:39",仁德區,違規停車,違規停車,"仁德區大同路三段143號 違規停車",仁德區大同路三段143號,22.9588473,120.2171332
UN201806050263,"2018-06-05 15:55:46",中西區,違規停車,違規停車,"中西區府前路一段307號  違規停車",中西區府前路一段307號,22.9997281,120.2270277
UN201806050271,"2018-06-05 16:14:17",歸仁區,動物救援,犬貓急難救援,"歸仁區中山十一街16號 犬貓急難救援",歸仁區中山十一街16號,22.9683245,120.2763791
UN201806050293,"2018-06-05 17:27:34",東區,違規停車,違規停車,"台南火車站北門路兩邊 違停紅線",台南火車站北門路,22.9997281,120.2270277
UN201806050297,"2018-06-05 17:45:45",安南區,違規停車,違規停車,"安南區安通路四段119巷45弄19號 違規停車",安南區安通路四段119巷45弄19號,23.030453,120.206287
UN201806050304,"2018-06-05 17:58:10",新營區,髒亂及汙染,空氣汙染,"新營區復興路11號 空氣污染",新營區復興路11號,22.9997281,120.2270277
UN201806050306,"2018-06-05 18:02:12",東區,違規停車,違規停車,"東區長榮路一段181號 違停",東區長榮路一段181號,22.9997281,120.2270277
UN201806050308,"2018-06-05 18:11:47",南區,違規停車,違規停車,"南區新興路486號 違停",南區新興路486號,22.974536,120.18584
UN201806050314,"2018-06-05 18:25:51",永康區,違規停車,違規停車,"永康區新行街79號 違規停車",永康區新行街79號,23.0400234,120.2418892
UN201806050316,"2018-06-05 18:28:25",永康區,違規停車,違規停車,"永康區新行街70號 違規停車",永康區新行街70號,23.0397767,120.24197
UN201806050319,"2018-06-05 18:33:49",南區,違規停車,違規停車,"南區萬年三街與萬年二街街口 違規停車",南區萬年三街萬年二街,22.9329816,120.1867649
UN201806050321,"2018-06-05 18:36:09",安南區,違規停車,違規停車,"安南區安和路二段 違規停車",安南區安和路二段,23.0398861,120.2151997
UN201806050325,"2018-06-05 18:41:30",南區,違規停車,違規停車,"南區新興路242號 違停",南區新興路242號,22.9997281,120.2270277
UN201806050328,"2018-06-05 18:46:49",北區,違規停車,違規停車,"北區成功路22巷20號旁 違停",北區成功路22巷20號,22.9985824,120.2091036
UN201806050331,"2018-06-05 18:55:30",永康區,民生管線,漏水、停水、消防栓漏水或損壞,永康區永二街自來水工程,永康區永二街86號,23.0398861,120.2151997
UN201806050332,"2018-06-05 18:55:36",南區,違規停車,違規停車,南區中華西路一段52巷3號對面，停車場出入口,南區中華西路一段52巷3號,23.0055777,120.2169289
UN201806050333,"2018-06-05 19:01:13",中西區,路燈故障,9盞以下路燈故障,"中西區西賢五街23巷1號旁 路燈不亮",中西區西賢五街23巷1號,23.0006531,120.172541
UN201806050335,"2018-06-05 19:10:49",南區,路燈故障,9盞以下路燈故障,"南區竹溪街88號 路燈故障",南區竹溪街88號,22.9798916,120.210004
UN201806050337,"2018-06-05 19:23:56",北區,路燈故障,9盞以下路燈故障,"北區育德二路796號 路燈不亮",北區育德二路796號,23.0200128,120.2014938
UN201806050341,"2018-06-05 19:42:37",新營區,噪音舉發,場所連續噪音,"新營區三興街105-2號 連續噪音",新營區三興街105之2號,23.313995,120.309801
UN201806050345,"2018-06-05 19:54:25",關廟區,違規停車,違規停車,"關廟區中正路與南雄路二段 85度 違規停車",關廟區中正路南雄路二段,22.9624989,120.3284754
UN201806050346,"2018-06-05 19:56:40",佳里區,路燈故障,9盞以下路燈故障,"佳里區延平路225之2號 路燈不亮",佳里區延平路225之2號,22.9997281,120.2270277
UN201806050352,"2018-06-05 20:14:33",安南區,路燈故障,9盞以下路燈故障,"安南區仁安路與智安三街口 路燈不亮",安南區仁安路智安三街,23.0055777,120.2169289
UN201806050353,"2018-06-05 20:19:50",將軍區,噪音舉發,妨害安寧,"將軍區忠嘉里昌安宮 噪音舉發",將軍區忠嘉里昌安宮,22.9997281,120.2270277
UN201806050354,"2018-06-05 20:19:55",安南區,路燈故障,9盞以下路燈故障,"安南區海佃路二段492巷 路燈不亮",安南區海佃路二段492巷,23.0401192,120.1880111
UN201806050355,"2018-06-05 20:21:49",中西區,交通運輸,號誌秒差調整,中西區永福路二段與民權路口號誌不連貫,中西區永福路二段民權路,22.9954068,120.2017982
UN201806050357,"2018-06-05 20:29:32",南區,違規停車,違規停車,"南區萬年三街256號旁 違停",南區萬年三街256號,22.932293,120.1866948
UN201806050358,"2018-06-05 20:35:41",北區,路燈故障,9盞以下路燈故障,"北區開元路66巷7號 路燈故障",北區開元路66巷7號,23.0055777,120.2169289
UN201806050359,"2018-06-05 20:38:21",東區,違規停車,違規停車,"東區富農街一段290號 佔用騎樓/違規停車",東區富農街一段290號,22.9842864,120.2355669
UN201806050366,"2018-06-05 21:09:22",永康區,交通運輸,佔用道路,"永康區永勝街308巷2弄11號 佔用道路",永康區永勝街308巷2弄11號,22.9997281,120.2270277
UN201806050369,"2018-06-05 21:29:14",仁德區,髒亂及汙染,市區道路路面油漬,"仁德區義林路與勝利路口 路面油漬",仁德區義林路勝利路,22.9562454,120.2614079
UN201806050370,"2018-06-05 21:30:15",東區,違規停車,違規停車,"東區前鋒路靠近大學路的大遠百外面 違規停車",東區前鋒路大學路,22.9997281,120.2270277
UN201806050371,"2018-06-05 21:31:13",東區,違規停車,違規停車,"東區裕農一街160巷16號 違規停車",東區裕農一街160巷16號,22.9997281,120.2270277
UN201806050372,"2018-06-05 21:34:22",北區,違規停車,違規停車,"北區南園街96巷6號 違規停車",北區南園街96巷6號,22.9997281,120.2270277
UN201806050374,"2018-06-05 21:37:29",安南區,路燈故障,9盞以下路燈故障,"安南區安中路一段622巷56號 路燈不亮",安南區安中路一段622巷56號,22.9997281,120.2270277
UN201806050376,"2018-06-05 21:47:40",新營區,髒亂及汙染,空氣汙染,"新營區隋唐街小太陽幼兒園附近 髒亂及汙染",新營區隋唐街,23.3083125,120.298639
UN201806050377,"2018-06-05 21:48:07",東區,違規停車,違規停車,"東區裕信路358號 違規停車",東區裕信路358號,22.9795098,120.2449752
UN201806050380,"2018-06-05 21:58:37",中西區,噪音舉發,妨害安寧,"中西區府前路一段61巷23號 噪音舉發",台南市中西區府前路一段61巷23號,22.9880207,120.2097841
UN201806050382,"2018-06-05 22:09:26",中西區,道路維修,路面下陷、凹陷,"中西區中華西路二段168號 路面凹陷",中西區中華西路二段168號,22.9997281,120.2270277
UN201806050383,"2018-06-05 22:10:58",安南區,噪音舉發,妨害安寧,"安南區北安路二段526號，一品來小吃部 妨害安寧",安南區北安路二段526號,22.9997281,120.2270277
UN201806050385,"2018-06-05 22:28:33",中西區,違規停車,違規停車,"中西區西華南街62號 違規停車",中西區西華南街62號,22.9997281,120.2270277
UN201806050386,"2018-06-05 22:28:59",東區,違規停車,違規停車,"東區前鋒路靠近大學路的大遠百外面 違規停車",東區前鋒路,22.9951987,120.213339
UN201806050387,"2018-06-05 22:30:21",中西區,違規停車,違規停車,"中西區環河街102號 違規停車",中西區環河街102號,22.9997281,120.2270277
UN201806050392,"2018-06-05 22:47:35",中西區,噪音舉發,妨害安寧,"中西區臨安路一段72號 妨害安寧",中西區臨安路一段72號,22.9990981,120.1907774
UN201806050394,"2018-06-05 23:19:48",新市區,違規停車,違規停車,"新市區復興路67號 違規停車",新市區復興路67號,23.0816192,120.2953317
UN201806060001,"2018-06-06 00:20:36",中西區,噪音舉發,妨害安寧,"中西區健康路一段110號 妨害安寧",臺南市中西區健康路一段110號,22.981476,120.208946
