UN201806120108,"2018-06-12 11:04:59",永康區,違規停車,違規停車,"永康區正南一街與鹽信街交岔路口 7-11和夾娃娃機店前 違規停車",永康區正南一街鹽信街,23.0254092,120.2266579
UN201806120119,"2018-06-12 11:34:30",永康區,違規停車,違規停車,"永康區中正南路212巷12弄2號  違停",永康區中正南路212巷12弄2號,22.9997281,120.2270277
UN201806120120,"2018-06-12 11:40:57",新市區,違規停車,違規停車,"新市區永就里59之3號  違規停車",新市區永就里59之3號,22.9997281,120.2270277
UN201806120122,"2018-06-12 11:41:52",永康區,違規停車,違規停車,永康區忠孝路239巷違規停車,永康區忠孝路239巷,23.0049621,120.2391439
UN201806120125,"2018-06-12 11:47:14",永康區,道路維修,路面坑洞,"永康區鹽和街205號  路面坑洞",永康區鹽和街205號,23.032181,120.237226
UN201806120128,"2018-06-12 11:51:11",仁德區,民生管線,漏水、停水、消防栓漏水或損壞,"仁德區太子路與中正路三段口，太子路上 漏水",仁德區太子路中正路三段,22.9914368,120.2558153
UN201806120133,"2018-06-12 12:01:04",永康區,髒亂及汙染,道路散落物,"永康區龍橋街5號旁 狗屍體",永康區龍橋街5號,22.9997281,120.2270277
UN201806120134,"2018-06-12 12:05:14",北區,違規停車,違規停車,"北區小東路35號  違規停車",北區小東路35號,22.9997281,120.2270277
UN201806120141,"2018-06-12 12:43:42",北區,違規停車,違規停車,"北區開元路147號附近 違停",北區開元路147號,23.0068857,120.2186281
UN201806120144,"2018-06-12 13:04:42",仁德區,動物救援,遊蕩犬隻捕捉管制,"仁德區都會公園 流浪狗捕捉",仁德區都會公園,22.9358456,120.2240562
UN201806120147,"2018-06-12 13:10:52",東區,違規停車,違規停車,"東區生產路257號 違規停車",東區生產路257號,22.9997281,120.2270277
UN201806120148,"2018-06-12 13:26:41",東區,交通運輸,佔用道路,"東區東成街222巷11之16號 佔用道路",東區東成街222巷11之16號,22.9787893,120.2384492
UN201806120155,"2018-06-12 13:46:35",中西區,違規停車,違規停車,違規停車,中西區健康路一段152號前,22.9814383,120.2077059
UN201806120160,"2018-06-12 14:06:27",下營區,髒亂及汙染,空氣汙染,"下營區中興南路101巷129號旁  空氣汙染",下營區中興南路101巷129號,23.2336078,120.2723111
UN201806120162,"2018-06-12 14:13:15",安南區,違規停車,違規停車,"安南區安和路二段  違規停車",安南區安和路二段,23.0398861,120.2151997
UN201806120169,"2018-06-12 14:28:39",安平區,髒亂及汙染,空氣汙染,"安平區安北路427號  空氣汙染",安平區安北路427號,22.999983,120.1535491
UN201806120174,"2018-06-12 14:43:13",西港區,髒亂及汙染,空氣汙染,"西港區中山路497號旁  空氣汙染",西港區中山路497號,23.1315787,120.2004237
UN201806120179,"2018-06-12 14:53:45",南區,道路維修,人孔蓋聲響、凹陷、漏水,"南區夏林路132號前  孔蓋鬆動",南區夏林路132號,22.9818122,120.1947808
UN201806120185,"2018-06-12 15:07:06",仁德區,噪音舉發,場所連續噪音,"仁德區義林五街16號  噪音",仁德區義林五街16號,23.031911,120.304369
UN201806120190,"2018-06-12 15:15:09",安南區,路燈故障,9盞以下路燈故障,"安南區安和路六段20巷106弄33號-1 號/北安路四段420巷19號   路燈故障","安南區安和路六段20巷106弄33號-1 號北安路四段420巷19號",23.0710198,120.2153451
UN201806120194,"2018-06-12 15:29:05",中西區,違規停車,違規停車,"中西區北門路一段89號 違規停車",中西區北門路一段89號,22.9912501,120.2114025
UN201806120197,"2018-06-12 15:31:21",中西區,違規停車,違規停車,"中西區萬昌街民權路口到青年路  違規停車",中西區萬昌街,22.9916869,120.2105063
UN201806120205,"2018-06-12 16:09:35",安平區,道路維修,路面坑洞,"安平區永華路二段2號  路面坑洞",安平區永華路二段2號,22.9997281,120.2270277
UN201806120213,"2018-06-12 16:30:36",北區,民生管線,漏水、停水、消防栓漏水或損壞,"北區文成二路216號 漏水",北區文成二路216號,23.0151704,120.2046006
UN201806120214,"2018-06-12 16:38:52",永康區,違規停車,違規停車,"東區長榮路一段183號 違規停車",東區長榮路一段183號,22.9997281,120.2270277
UN201806120219,"2018-06-12 16:53:18",中西區,違規停車,違規停車,"中西區民族路二段66號/55-63號/77號 違規停車",中西區民族路二段66號/55-63號/77號,22.9946307,120.210031
UN201806120220,"2018-06-12 16:54:41",中西區,違規停車,違規停車,"中西區西華南街32號/46號/43號  違規停車",中西區西華南街32號/46號/43號,22.9937988,120.2094961
UN201806120229,"2018-06-12 17:14:41",南區,違規停車,違規停車,"南區大同路二段420號 違規停車",南區大同路二段420號,22.9946307,120.210031
UN201806120230,"2018-06-12 17:17:07",北區,違規停車,違規停車,"北區臨安路二段225號 違停",北區臨安路二段225號,23.0042502,120.2004481
UN201806120232,"2018-06-12 17:21:10",南區,違規停車,違規停車,南區新興路242號,南區新興路242號,22.976451,120.1924707
UN201806120233,"2018-06-12 17:24:06",北區,違規停車,違規停車,"北區文賢路跟文賢路365巷口 違停",北區文賢路365巷,23.0078466,120.1928269
UN201806120234,"2018-06-12 17:25:33",北區,違規停車,違規停車,"北區文賢路365巷13號對面 違停",北區文賢路365巷13號,23.0077525,120.193124
UN201806120236,"2018-06-12 17:26:49",北區,違規停車,違規停車,"北區開元路126號 違規停車",北區開元路126號,23.0254092,120.2266579
UN201806120237,"2018-06-12 17:27:39",北區,違規停車,違規停車,"北區開元路501號 違規停車",北區開元路501號,23.0102471,120.2247606
UN201806120239,"2018-06-12 17:28:26",永康區,違規停車,違規停車,"永康區中山南路63號 違規停車",永康區中山南路63號,23.0123393,120.2274748
UN201806120240,"2018-06-12 17:29:00",永康區,違規停車,違規停車,"永康區中山南路70號 違規停車",永康區中山南路70號,23.0124561,120.22873
UN201806120242,"2018-06-12 17:29:42",北區,違規停車,違規停車,"北區北園街6之6號 違規停車",北區北園街6之6號,23.0100845,120.2232753
UN201806120247,"2018-06-12 17:48:14",永康區,違規停車,違規停車,"永康區南台街南台街13巷 違規停車",永康區南台街南台街13巷,22.9997281,120.2270277
UN201806120250,"2018-06-12 17:49:43",永康區,違規停車,違規停車,"永康區南台街43號 違規停車",永康區南台街43號,23.0222441,120.22282
UN201806120252,"2018-06-12 17:50:40",永康區,違規停車,違規停車,"永康區大武街正新街口  違規停車",永康區大武街正新街,23.0199917,120.2226008
UN201806120253,"2018-06-12 17:52:37",新化區,髒亂及汙染,空氣汙染,"新化區崙頂里新灣橋  空氣汙染",新化區崙頂里新灣橋,23.0209513,120.2822273
UN201806120254,"2018-06-12 18:01:25",北區,違規停車,違規停車,"北區西門路四段65巷 違規停車",北區西門路四段65巷,23.0077525,120.193124
UN201806120257,"2018-06-12 18:05:10",北區,交通運輸,佔用道路,"北區開南街275巷2弄1號 交通運輸",北區開南街275巷2弄1號,22.9997281,120.2270277
UN201806120259,"2018-06-12 18:07:18",中西區,違規停車,違規停車,"中西區西門路二段387號 違規停車",中西區西門路二段387號,22.9985471,120.200283
UN201806120261,"2018-06-12 18:07:41",永康區,違規停車,違規停車,"永康區中華路134巷45號 違規停車",永康區中華路134巷45號,22.9997281,120.2270277
UN201806120262,"2018-06-12 18:08:04",永康區,違規停車,違規停車,"永康區南台街3巷12號前 違規停車",永康區南台街3巷12號,22.9997281,120.2270277
UN201806120264,"2018-06-12 18:10:27",善化區,道路維修,路面坑洞,"善化區胡厝寮166號右轉約10公尺 坑洞",善化區胡厝寮166號,23.0077525,120.193124
UN201806120266,"2018-06-12 18:16:02",中西區,違規停車,違規停車,"中西區西華南街48號 違規停車",中西區西華南街48號,23.0102471,120.2247606
UN201806120267,"2018-06-12 18:17:58",北區,違規停車,違規停車,"北區西門路四段380巷口 違規停車",北區西門路四段380巷,22.9997281,120.2270277
UN201806120268,"2018-06-12 18:20:25",永康區,違規停車,違規停車,"永康區復國一路341巷10號 違規停車",永康區復國一路341巷10號,23.011798,120.2460984
UN201806120270,"2018-06-12 18:24:52",南區,違規停車,違規停車,"南區夏林路204號 違規停車",南區夏林路204號,22.9997281,120.2270277
UN201806120271,"2018-06-12 18:27:45",永康區,違規停車,違規停車,"永康區復國一路341巷6號 違規停車",永康區復國一路341巷6號,22.9997281,120.2270277
UN201806120275,"2018-06-12 18:40:44",中西區,違規停車,違規停車,"中西區中正路162號 違規停車",中西區中正路162號,22.9928001,120.1989085
UN201806120277,"2018-06-12 18:46:46",北區,違規停車,違規停車,"北區開南街275巷12弄1號 違規停車",北區開南街275巷12弄1號,23.0055385,120.2291813
UN201806120278,"2018-06-12 18:47:03",北區,民生管線,漏水、停水、消防栓漏水或損壞,"北區中華北路二段194巷50弄與北成路 路面冒水",北區中華北路二段194巷50弄北成路,23.011798,120.2460984
UN201806120281,"2018-06-12 18:51:16",北區,違規停車,違規停車,"北區小東路235號前 違規停車",北區小東路235號,22.9999574,120.2284241
UN201806120282,"2018-06-12 18:58:02",東區,違規停車,違規停車,"東區中華東路三段380巷58號 違規停車",東區中華東路三段380巷58號,22.974913,120.219839
UN201806120286,"2018-06-12 19:07:37",後壁區,路燈故障,9盞以下路燈故障,"後壁區仕安里66-3號 路燈故障",後壁區仕安里66之3號,23.3554486,120.3225195
UN201806120287,"2018-06-12 19:10:07",新化區,違規停車,違規停車,"新化區民治路43巷1號旁, 違規停車",新化區民治路43巷1號,23.031911,120.304369
UN201806120288,"2018-06-12 19:12:34",中西區,噪音舉發,妨害安寧,"中西區衛民街143巷2號空地,音樂聲響",中西區衛民街143巷2號,23.0055385,120.2291813
UN201806120297,"2018-06-12 19:38:05",永康區,違規停車,違規停車,"永康區正南一街與鹽信街交岔路口 7-11和夾娃娃機店前 違規停車",永康區正南一街鹽信街,23.0254092,120.2266579
UN201806120299,"2018-06-12 19:41:24",南區,動物救援,犬貓急難救援,"南區鯤鯓路與濱南路口 狗受傷",南區鯤鯓路濱南路,22.9589709,120.1837704
UN201806120300,"2018-06-12 19:46:58",永康區,違規停車,違規停車,"永康區中華路620號 違停",永康區中華路620號,23.014236,120.2305306
UN201806120302,"2018-06-12 19:54:15",北區,違規停車,違規停車,"北區成功路584號  違規停車",北區成功路584號,23.002089,120.1953092
UN201806120305,"2018-06-12 20:01:20",永康區,交通運輸,佔用道路,"永康區大橋三街109號至211號 佔用道路",永康區大橋三街109號,23.0194908,120.2264042
UN201806120306,"2018-06-12 20:02:02",安南區,交通運輸,佔用道路,"安南區安豐六街200號 佔用道路",安南區安豐六街220號,22.9997281,120.2270277
UN201806120307,"2018-06-12 20:03:20",中西區,違規停車,違規停車,"中西區金華路三段142號 違停",中西區金華路三段142號,22.9894155,120.2413279
UN201806120312,"2018-06-12 20:11:32",中西區,路燈故障,9盞以下路燈故障,"中西區湖美二街32巷口 路燈不亮",中西區湖美二街32巷,23.002089,120.1953092
UN201806120313,"2018-06-12 20:12:14",東區,路燈故障,10盞以上路燈故障,"高速公路裕農出口,裕義路一直到裕農路 10盞以上路燈故障",東區裕義路裕農路,22.9905875,120.2476379
UN201806120316,"2018-06-12 20:26:04",安南區,髒亂及汙染,空氣汙染,"安南區公學路六段642巷 空氣污染",安南區公學路六段642巷,22.9997281,120.2270277
UN201806120322,"2018-06-12 20:47:39",安平區,路燈故障,9盞以下路燈故障,"安平區建平十一街232號 路燈故障",安平區建平十一街232號,22.9950771,120.1786588
UN201806120323,"2018-06-12 20:50:46",南區,違規停車,違規停車,"南區文南路242號與240號停車格 違規停車",南區文南路240號到242號,22.9854731,120.190256
UN201806120324,"2018-06-12 20:51:39",中西區,路燈故障,9盞以下路燈故障,"中西區西門路一段702巷17號旁 路燈不亮",中西區西門路一段702巷17號,22.9997281,120.2270277
UN201806120328,"2018-06-12 21:18:28",中西區,違規停車,違規停車,"中西區北門路一段101號 違停",中西區北門路一段101號,22.9922435,120.2114505
UN201806120331,"2018-06-12 21:35:14",永康區,,,"永康區復國一路與復國一路586巷 號誌故障",永康區復國一路586巷,23.0078424,120.2462833
UN201806120332,"2018-06-12 21:36:33",安平區,違規停車,違規停車,"安平區永華路二段816號/安平區永華路二段828號 違停",安平區永華路二段816號,22.9950771,120.1786588
UN201806120334,"2018-06-12 21:38:46",東區,違規停車,違規停車,"東區北門路一段260號 違停",東區北門路一段260號,22.995011,120.212014
UN201806120335,"2018-06-12 21:44:17",善化區,路燈故障,9盞以下路燈故障,"善化區陽光北一路，介於蓮潭北二街與蓮潭北三街間/善化區蓮潭北三街與陽光北一路口/善化區蓮潭北二街198號附近 路燈不亮",善化區陽光北一路,23.1162393,120.3053066
UN201806120336,"2018-06-12 21:49:24",東區,交通運輸,號誌故障,"東區裕永路與裕農路口 號誌故障",東區裕永路裕農路,22.9894155,120.2413279
UN201806120341,"2018-06-12 22:02:07",中西區,違規停車,違規停車,"中西區民族路二段76號 違規停車",民族路二段76號,22.9947876,120.2089152
UN201806120342,"2018-06-12 22:03:40",北區,違規停車,違規停車,"北區小東路371號 違規停車",北區小東路371號,22.9997281,120.2270277
UN201806120345,"2018-06-12 22:11:58",中西區,違規停車,違規停車,"中西區金華路四段61號 違規停車",中西區金華路四段61號,22.9997281,120.2270277
UN201806120346,"2018-06-12 22:23:25",東區,道路維修,路面下陷、凹陷,"東區中華東路二段關帝廳十字路人行道 路面下陷、凹陷",東區中華東路二段關帝廳,22.9997281,120.2270277
UN201806120347,"2018-06-12 22:25:16",安平區,違規停車,違規停車,"安平區永華路二段500號 違規停車",安平區永華路二段500號,22.9997281,120.2270277
UN201806120349,"2018-06-12 22:35:28",安平區,違規停車,違規停車,"安平區建平十七街257號 違規停車",安平區建平十七街257號,22.9997281,120.2270277
UN201806120350,"2018-06-12 22:47:53",中西區,違規停車,違規停車,"中西區民生路二段112號 違規停車",中西區民生路二段112號,22.9997281,120.2270277
UN201806120352,"2018-06-12 22:52:43",永康區,違規停車,違規停車,"永康區南台街與南台街13巷交岔路口 違規停車",永康區南台街南台街13巷,22.9997281,120.2270277
UN201806120353,"2018-06-12 22:52:55",安平區,違規停車,違規停車,"安平區育平路與永華路二段  違規停車",安平區育平路與永華路二段,22.9997281,120.2270277
UN201806120354,"2018-06-12 22:53:24",永康區,違規停車,違規停車,"永康區南台街43號 違規停車",永康區南台街43號,23.0222441,120.22282
UN201806120355,"2018-06-12 22:54:08",安南區,噪音舉發,妨害安寧,"安南區北安路二段526號(一品來小吃部) 妨害安寧",安南區北安路二段526號,22.9997281,120.2270277
UN201806120356,"2018-06-12 22:54:32",永康區,違規停車,違規停車,"永康區 南台街3巷12號前 違規停車",永康區南台街3巷12號,22.9997281,120.2270277
UN201806120357,"2018-06-12 22:55:28",永康區,違規停車,違規停車,"永康區正南一街與鹽信街交岔路口 7-11和夾娃娃機店前 違規停車",永康區正南一街鹽信街,23.0254092,120.2266579
UN201806120358,"2018-06-12 22:57:57",北區,違規停車,違規停車,"北區開元路501號 違規停車",北區開元路501號,23.0102471,120.2247606
UN201806120359,"2018-06-12 23:00:13",永康區,違規停車,違規停車,永康區中華路530號違規停車,永康區中華路530號,22.9997281,120.2270277
UN201806120360,"2018-06-12 23:01:05",永康區,違規停車,違規停車,"永康區中華路747號 違規停車",永康區中華路747號,22.9997281,120.2270277
UN201806120361,"2018-06-12 23:01:57",永康區,違規停車,違規停車,"永康區中華路725號 違規停車",永康區中華路725號,23.0172196,120.2277237
UN201806120362,"2018-06-12 23:04:31",東區,違規停車,違規停車,"東區小東路190號 違規停車",東區小東路190號,22.9997281,120.2270277
UN201806120363,"2018-06-12 23:16:49",北區,違規停車,違規停車,"北區大武街542巷與大武街542巷43弄交岔路口 違規停車",北區大武街542巷43弄,22.9997281,120.2270277
UN201806120365,"2018-06-12 23:31:33",永康區,違規停車,違規停車,"永康區新行街122巷10弄1號 違規停車",新行街122巷10弄1號，永康國際學苑1館,22.9997281,120.2270277
UN201806120366,"2018-06-12 23:33:22",永康區,違規停車,違規停車,"新民街16巷及新民街 違規停車",新民街16巷及新民街交界，儷塔沙龍旁邊,22.9997281,120.2270277
UN201806120367,"2018-06-12 23:34:30",永康區,違規停車,違規停車,"新民街218巷接新中街 違規停車",新民街218巷接新中街,23.0254092,120.2266579
UN201806120368,"2018-06-12 23:36:58",北區,道路維修,路面坑洞,"北區小東路 路面坑洞",北區小東路,23.0102471,120.2247606
UN201806130005,"2018-06-13 01:08:38",東區,民生管線,漏水、停水、消防栓漏水或損壞,"東區前鋒路119巷 漏水",東區前鋒路119巷,22.9997281,120.2270277
UN201806130006,"2018-06-13 01:56:33",北區,噪音舉發,場所連續噪音,"北區開元路485巷29號12樓之3  場所連續噪音",北區開元路485巷29號11樓之3,22.9997281,120.2270277
UN201806130008,"2018-06-13 05:30:33",歸仁區,交通運輸,佔用道路,"歸仁區民生南街二段278號 佔用道路",歸仁區民生南街二段278號,23.0123393,120.2274748
UN201806130014,"2018-06-13 07:46:20",永康區,噪音舉發,妨害安寧,"永康區大橋國小 妨害安寧",永康區大橋國小,23.0198788,120.2267448
UN201806130015,"2018-06-13 07:47:00",仁德區,髒亂及汙染,市區道路路面油漬,"仁德區中山路，高速公路橋下，往歸仁方向 路面油漬",仁德區中山路,22.9714242,120.2539763
UN201806130016,"2018-06-13 07:47:15",永康區,違規停車,違規停車,"永康區中華二路340巷19號 違規停車",永康區中華二路340巷19號,22.9997281,120.2270277
UN201806130018,"2018-06-13 07:53:16",北區,髒亂及汙染,空氣汙染,"北區長勝路13號 髒亂及汙染",北區長勝路13號,23.0123393,120.2274748
UN201806130022,"2018-06-13 08:13:11",北區,違規停車,違規停車,"北區文成路603號 違規停車",北區文成路603號,22.9997281,120.2270277
UN201806130025,"2018-06-13 08:21:18",北區,民生管線,漏水、停水、消防栓漏水或損壞,"北區北成路402巷與中華北路二段194巷50弄交叉路  漏水",北區北成路402巷中華北路二段194巷50弄,22.9714242,120.2539763
UN201806130030,"2018-06-13 08:27:49",白河區,交通運輸,佔用道路,"白河區中山路與文明街 佔用道路",白河區中山路,22.9997281,120.2270277
UN201806130031,"2018-06-13 08:28:01",中西區,違規停車,違規停車,"中西區忠義路二段109號 違規停車",中西區忠義路二段109號,22.9906348,120.1688476
UN201806130035,"2018-06-13 08:36:38",新化區,髒亂及汙染,空氣汙染,"新化區民生路234巷57弄19號後方  空氣汙染",新化區民生路234巷57弄19號,22.9714242,120.2539763
UN201806130042,"2018-06-13 08:53:20",東區,噪音舉發,妨害安寧,"東區崇德八街46巷2號 噪音",東區崇德八街46巷2號,22.9997281,120.2270277
UN201806130044,"2018-06-13 08:57:05",中西區,髒亂及汙染,空氣汙染,"中西區國華街二段88號旁 空氣汙染",中西區國華街二段88號,22.9895469,120.1966294
UN201806130048,"2018-06-13 09:07:50",東區,交通運輸,佔用道路,東區崇德四街與崇善路交叉口,東區崇德四街,22.9773465,120.2252352
UN201806130052,"2018-06-13 09:21:44",北區,違規停車,違規停車,"北區小東路靠近前鋒路 違規停車",小東路,22.9997281,120.2270277
UN201806130053,"2018-06-13 09:21:58",佳里區,交通運輸,佔用道路,"佳里區義民街 佔用道路",佳里區義民街,23.161442,120.1756258
UN201806130056,"2018-06-13 09:28:48",安南區,路燈故障,9盞以下路燈故障,"安南區北安路二段93巷78號 路燈故障",安南區北安路二段93巷78號,23.0263878,120.2019874
UN201806130057,"2018-06-13 09:31:21",北區,違規停車,違規停車,"北區西華街57號 違規停車",西華街57號,22.9997281,120.2270277
UN201806130058,"2018-06-13 09:32:03",永康區,交通運輸,號誌故障,"永康區復國一路與復華三街口 號誌故障",:永康區復國一路,23.0078424,120.2462833
UN201806130064,"2018-06-13 09:55:28",新營區,髒亂及汙染,道路散落物,"新營區南紙街94號 道路散落物",新營區南紙街94號,23.2988498,120.2942528
UN201806130067,"2018-06-13 10:04:25",安南區,道路維修,路面下陷、凹陷,"安南區修安街68巷，東側出入口水溝旁 路面下陷",安南區修安街68巷,23.0417279,120.2131269
UN201806130069,"2018-06-13 10:09:53",安平區,髒亂及汙染,空氣汙染,"安平區平通路358號 空氣汙染",安平區平通路358號,22.9997281,120.2270277
UN201806130071,"2018-06-13 10:18:43",中西區,路燈故障,9盞以下路燈故障,"中西區頂美三街121巷35號  路燈故障",中西區頂美三街121巷35號,22.9982065,120.1726372
UN201806130083,"2018-06-13 10:35:01",仁德區,交通運輸,交通疏導,"仁德區上86快速道路 交通疏導",仁德區86快速道路,22.9997281,120.2270277
UN201806130088,"2018-06-13 10:41:25",安平區,路燈故障,9盞以下路燈故障,"安平區健康路三段331號前 路燈不亮",安平區健康路三段331號,22.9997281,120.2270277
UN201806130092,"2018-06-13 10:49:32",安平區,噪音舉發,妨害安寧,"永康區國華街102巷80號7樓  妨害安寧",永康區國華街102巷80號7樓,23.01516,120.248286
UN201806130093,"2018-06-13 10:52:13",中西區,交通運輸,佔用道路,"中西區民權路一段25號 佔用道路",中西區民權路一段25號,22.9893559,120.2105674
UN201806130096,"2018-06-13 11:00:06",永康區,違規停車,違規停車,"永康區正新街與大武街交岔路口 違規停車",永康區正新街*大武街,22.9997281,120.2270277
UN201806130101,"2018-06-13 11:07:03",南區,交通運輸,佔用道路,"南區西門路一段333巷 近大成公園 占用道路",南區西門路一段333巷,22.9779074,120.1970982
UN201806130105,"2018-06-13 11:15:24",北區,違規停車,違規停車,"北區開元路501號 違規停車",704台南市北區開元路501號,22.9997281,120.2270277
UN201806130107,"2018-06-13 11:17:40",安平區,違規停車,違規停車,"安平區慶平路華平路交叉口 違規停車",安平區慶平路華平路,22.9968509,120.1758848
UN201806130109,"2018-06-13 11:27:43",安南區,道路維修,路樹傾倒,"安常區長和路一段217巷口 路樹傾倒",安常區長和路一段217巷,22.9997281,120.2270277
UN201806130110,"2018-06-13 11:30:27",南區,違規停車,違規停車,"南區夏林路310號 違停",南區夏林路310號,22.9759935,120.1953123
UN201806130112,"2018-06-13 11:36:09",東區,違規停車,違規停車,"東區崇明路121號前  違規停車",東區崇明路121號前,22.979572,120.21802
UN201806130114,"2018-06-13 11:37:55",安南區,髒亂及汙染,大型廢棄物清運,"安南區海中街138巷路口 髒亂及汙染",安南區海中街138巷,22.9997281,120.2270277
UN201806130122,"2018-06-13 11:47:56",北區,違規停車,違規停車,"北區和緯路二段238號 違規停車",704台南市北區和緯路二段238號,23.012326,120.2066598
UN201806130126,"2018-06-13 11:59:34",龍崎區,髒亂及汙染,市區道路路面油漬,"龍崎區182線24.5K，往內門方向 路面油漬",龍崎區182線24.5K，往內門方向,22.9540045,120.378138
UN201806130127,"2018-06-13 12:04:14",中西區,違規停車,違規停車,"中西區民族路三段19號 違規停車",700台南市中西區民族路三段19號,22.9977113,120.1988885
UN201806130131,"2018-06-13 12:15:10",中西區,路燈故障,9盞以下路燈故障,"中西區大仁街76號 路燈故障",中西區大仁街76號,22.9997281,120.2270277
UN201806130133,"2018-06-13 12:21:05",中西區,違規停車,違規停車,"中西區開山路52巷 違規停車",中西區開山路52巷,22.9893559,120.2105674
UN201806130137,"2018-06-13 12:34:49",東區,噪音舉發,場所連續噪音,"東區長榮路二段32巷142號4樓之9 冷氣滴水",東區長榮路二段32巷142號4樓之9,22.9977113,120.1988885
UN201806130138,"2018-06-13 12:42:05",東區,動物救援,犬貓急難救援,"東區東寧路530號 貓受困",東區東寧路530號,22.988994,120.2310628
UN201806130142,"2018-06-13 13:00:04",東區,違規停車,違規停車,"東區北門路一段280號 違規停車",701台南市東區北門路一段280號,22.9955566,120.2120081
UN201806130143,"2018-06-13 13:04:59",永康區,違規停車,違規停車,"永康區正南一街與鹽信街交岔路口 7-11和夾娃娃機店前 違規停車",永康區正南一街*鹽信街,22.9893559,120.2105674
UN201806130150,"2018-06-13 13:47:33",新市區,髒亂及汙染,空氣汙染,"新市區新市火車站，面對火車站右邊空地 空污",新市區新市火車站,23.0682329,120.2900512
UN201806130153,"2018-06-13 14:04:19",北區,違規停車,違規停車,北區長勝路1號違規停車,北區長勝路1號,23.009246,120.2203638
