UN201806150314,"2018-06-15 19:52:08",中西區,違規停車,違規停車,"中西區五妃街212號對面 違停",中西區五妃街212號,23.0004205,120.1774811
UN201806150317,"2018-06-15 19:54:47",仁德區,路燈故障,10盞以上路燈故障,仁德區土庫里土庫路整條路燈大範圍不亮,仁德區土庫里土庫路,22.976451,120.1924707
UN201806150320,"2018-06-15 20:03:07",中西區,交通運輸,佔用道路,"中西區和緯路5段253號 占用道路",中西區和緯路5段253號,23.0050007,120.1805426
UN201806150322,"2018-06-15 20:06:23",中西區,違規停車,違規停車,"中西區西門路二段387號 違規停車",中西區西門路二段387號,22.9985471,120.200283
UN201806150327,"2018-06-15 20:31:43",安南區,路燈故障,9盞以下路燈故障,"安南區本原街二段510巷 路燈故障",安南區本原街二段510巷,23.054775,120.1789027
UN201806150329,"2018-06-15 20:39:03",中西區,路燈故障,10盞以上路燈故障,"中西區大涼里府前一街、府前二街、金城街 10盞以上路燈故障",中西區府前一街,22.9760813,120.2373064
UN201806150333,"2018-06-15 20:45:51",北區,違規停車,違規停車,"北區開元路501號 違規停車",北區開元路501號,22.9997281,120.2270277
UN201806150334,"2018-06-15 20:47:57",中西區,路燈故障,10盞以上路燈故障,"中西區府前一街103巷28號 路燈故障",中西區府前一街103巷28號,22.9997281,120.2270277
UN201806150336,"2018-06-15 20:56:58",中西區,違規停車,違規停車,"中西區公園路、民族路 違規停車",中西區公園路民族路,22.99568,120.2057441
UN201806150337,"2018-06-15 21:01:20",北區,違規停車,違規停車,"北區和緯路二段238號 違規停車",704台南市北區和緯路二段238號,23.012326,120.2066598
UN201806150346,"2018-06-15 22:02:29",永康區,噪音舉發,場所連續噪音,"永康區成功路127號 場所連續噪音",成功路127號,22.9760813,120.2373064
UN201806150349,"2018-06-15 22:38:40",永康區,違規停車,違規停車,"永康區中正路與中正七街交叉路口 違規停車",永康區中正路,22.9760813,120.2373064
UN201806150351,"2018-06-15 22:57:21",永康區,違規停車,違規停車,"永康區大橋三街199巷內 違規停車",永康區大橋三街199巷內,22.9997281,120.2270277
UN201806150352,"2018-06-15 23:02:47",中西區,違規停車,違規停車,"中西區府前路一段91號 違規停車",中西區府前路一段91號,22.98878,120.2092261
UN201806150353,"2018-06-15 23:18:08",東區,違規停車,違規停車,"東區東門路二段158巷38號對面 紅線違停",臺南市東區東門路二段158巷38號,22.984845,120.220636
UN201806160001,"2018-06-16 00:03:48",新營區,髒亂及汙染,道路散落物,"新營區東山路與新進路交叉口 道路散落物",新營區新進路,23.3018118,120.3177015
UN201806160003,"2018-06-16 00:05:47",新營區,髒亂及汙染,道路散落物,"後鎮派出所往長短樹方向，離派出所約1、2公里處，南85線上坡路段，路中間 狗屍",新營區建國路110號,23.3304977,120.312733
UN201806160004,"2018-06-16 00:30:09",安南區,噪音舉發,妨害安寧,"安南區鹽田路2號 妨害安寧",安南區鹽田路2號,23.0352222,120.1484185
UN201806160005,"2018-06-16 00:31:25",永康區,違規停車,違規停車,"永康區永安路103巷2號 違規停車",永安路103巷2號,23.128627,120.288483
UN201806160006,"2018-06-16 00:34:17",永康區,違規停車,違規停車,"永康區永安路103巷2號 違規停車",永安路103巷2號,23.128627,120.288483
UN201806160007,"2018-06-16 00:47:56",歸仁區,噪音舉發,妨害安寧,"歸仁區民權三街與文化五街交叉口 妨害安寧",歸仁區民權三街,22.9695147,120.2896961
UN201806160008,"2018-06-16 00:58:11",東區,違規停車,違規停車,"東區小東路190號 違規停車",701台南市東區小東路190號,22.9997364,120.2274877
UN201806160010,"2018-06-16 01:14:18",中西區,噪音舉發,妨害安寧,"中西區開山路5號 妨害安寧",中西區開山路5號,22.9918648,120.2057982
UN201806160015,"2018-06-16 02:11:18",中西區,噪音舉發,妨害安寧,"中西區民權路三段428號 妨害安寧",民權路三段428號,22.9991273,120.1881541
UN201806160016,"2018-06-16 03:04:45",南區,違規停車,違規停車,"南區金華路一段154巷44號 違規停車",台南市金華路一段154巷44號,22.965021,120.1911454
UN201806160017,"2018-06-16 03:12:54",中西區,騎樓舉發,騎樓舉發,"中西區大勇街62號 騎樓舉發",大勇街62號,23.315918,120.318801
UN201806160018,"2018-06-16 03:53:28",永康區,髒亂及汙染,空氣汙染,"永康區大灣路1014號 空氣汙染",永康區大灣路1014號,22.9997364,120.2274877
UN201806160021,"2018-06-16 06:22:05",中西區,噪音舉發,妨害安寧,"中西區民生路 妨害安寧",中西區民生路,22.9936111,120.2017016
UN201806160022,"2018-06-16 06:43:52",仁德區,噪音舉發,妨害安寧,"仁德區義林九街 妨害安寧",仁德區義林九街,22.9717025,120.2612373
UN201806160023,"2018-06-16 06:50:05",中西區,噪音舉發,妨害安寧,"中西區大天后宮 妨害安寧",中西區,22.9948212,120.1964522
UN201806160024,"2018-06-16 06:57:09",白河區,違規停車,違規停車,"白河區康樂路2-1號  違規停車",白河區康樂路2-1號,23.0493953,120.1688102
UN201806160025,"2018-06-16 06:59:14",中西區,噪音舉發,妨害安寧,"中西區新美街 妨害安寧",中西區新美街,22.9967757,120.2009418
UN201806160029,"2018-06-16 07:36:23",善化區,噪音舉發,場所連續噪音,"善化區茄拔國小  噪音舉發",善化區茄拔國小,23.1381223,120.3246318
UN201806160030,"2018-06-16 07:52:11",安南區,動物救援,犬貓急難救援,"安南區府安路六段 抽水站後方  狗受困",安南區府安路六段九份子抽水站,22.9973034,120.2010823
UN201806160031,"2018-06-16 07:57:51",官田區,動物救援,犬貓急難救援,"官田區隆本里忠義街92號  貓救援",官田區隆本里忠義街92號,23.1961217,120.316793
UN201806160035,"2018-06-16 08:21:22",中西區,騎樓舉發,騎樓舉發,"中西區衛民街154號   騎樓舉發",中西區衛民街154號,22.9936801,120.207395
UN201806160037,"2018-06-16 08:26:36",東區,髒亂及汙染,空氣汙染,"東區大學路18巷25號   髒亂及汙染",東區大學路18巷25號,23.315918,120.318801
UN201806160038,"2018-06-16 08:29:56",東區,噪音舉發,場所連續噪音,"東區仁和路208巷56號對面  施工噪音",東區仁和路208巷56號,22.967953,120.233692
UN201806160039,"2018-06-16 08:30:58",新市區,違規停車,違規停車,"新市區永就里64號 違停",新市區永就里64號,23.1381223,120.3246318
UN201806160041,"2018-06-16 08:39:12",中西區,違規停車,違規停車,"中西區健康路一段390巷口 違停",中西區健康路一段390巷,22.9819737,120.198548
UN201806160042,"2018-06-16 08:41:38",中西區,噪音舉發,場所連續噪音,"中西區開山路35巷41之2號2樓 噪音",中西區開山路35巷41之2號2樓,22.9909064,120.2064076
UN201806160045,"2018-06-16 08:50:02",中西區,違規停車,違規停車,"中西區萬昌街與興華街的十字路口 違規停車",中西區萬昌街與興華街的十字路口,22.9920589,120.2105536
UN201806160046,"2018-06-16 08:51:10",中西區,騎樓舉發,騎樓舉發,"中西區衛民 街66號 騎樓舉發","中西區衛民 街66號",22.9931499,120.2100427
UN201806160047,"2018-06-16 08:51:35",,,,"善化區蓮潭北二街*陽光二路  違停",善化區蓮潭北二街陽光二路,23.1167996,120.3067435
UN201806160053,"2018-06-16 09:00:21",東區,噪音舉發,場所連續噪音,"東區仁和路208巷50號對面 噪音",東區仁和路208巷50號,22.968044,120.23381
UN201806160056,"2018-06-16 09:14:10",新化區,髒亂及汙染,環境髒亂,"新化區中山路660巷37號 犬隻隨意大小便",新化區中山路660巷37號,22.9931499,120.2100427
UN201806160058,"2018-06-16 09:15:31",中西區,違規停車,違規停車,"中西區西華南街18號 違規停車",中西區西華南街18號,22.9935199,120.2094679
UN201806160060,"2018-06-16 09:21:34",北區,噪音舉發,場所連續噪音,"北區武聖路138號 噪音",北區武聖路138號,23.0065371,120.1902623
UN201806160063,"2018-06-16 09:22:49",東區,噪音舉發,妨害安寧,"東區仁和路208巷 妨害安寧",東區仁和路208巷,22.9681011,120.234297
UN201806160064,"2018-06-16 09:23:48",安平區,違規停車,違規停車,"安平區安平路446巷與安平路446巷與25弄交叉路口 違規停車",安平區安平路446巷安平路446巷25弄,22.99802,120.1735638
UN201806160065,"2018-06-16 09:24:36",新市區,違規停車,違規停車,"新市區仁愛街221號 違規停車",新市區仁愛街221號,23.0759281,120.2934134
UN201806160066,"2018-06-16 09:26:56",中西區,道路維修,路面坑洞,"中西區忠義路一段115巷26號   路面坑洞",中西區忠義路一段115巷26號,22.988309,120.2003798
UN201806160069,"2018-06-16 09:36:49",中西區,違規停車,違規停車,"中西區衛民街106-17到106-52號的騎樓 違規停車",中西區衛民街106之17號,22.9931888,120.2090884
UN201806160072,"2018-06-16 09:54:01",永康區,違規停車,違規停車,"永康區中華路155巷36號/中華路與155巷  違規停車",永康區中華路155巷36號,23.0029811,120.234013
UN201806160075,"2018-06-16 10:11:48",下營區,動物救援,犬貓急難救援,"下營區中山路二段下營國小 仁愛橋貓 受困",下營區中山路二段下營國小,23.2314709,120.2616162
UN201806160076,"2018-06-16 10:13:21",永康區,違規停車,違規停車,"永康區新行街70號 違規停車",永康區新行街70號,23.0397767,120.24197
UN201806160077,"2018-06-16 10:14:18",安南區,噪音舉發,場所連續噪音,"安南區安中路四段197巷19弄  施工噪音",安南區安中路四段197巷19弄,23.0493953,120.1688102
UN201806160081,"2018-06-16 10:26:39",東區,違規停車,違規停車,"東區仁和路107巷63號 違規停車",東區仁和路107巷63號,22.9997281,120.2270277
UN201806160087,"2018-06-16 10:43:17",六甲區,動物救援,犬貓急難救援,"六甲區中華路248巷對面巷內   貓受困",六甲區中華路248巷,23.0493953,120.1688102
UN201806160090,"2018-06-16 10:51:27",北區,違規停車,違規停車,"北區開南街與東豐路451巷交界 違規停車",北區開南街與東豐路451巷,22.9997281,120.2270277
UN201806160093,"2018-06-16 10:58:45",鹽水區,路燈故障,10盞以上路燈故障,"鹽水區和平路*蔦松路 路燈閃爍",鹽水區和平路*蔦松路,22.9997281,120.2270277
UN201806160096,"2018-06-16 11:01:30",永康區,噪音舉發,妨害安寧,"永康區四維街149巷34之1號 妨害安寧",永康區四維街149巷34之1號,23.0347583,120.2510973
UN201806160103,"2018-06-16 11:20:42",東區,交通運輸,號誌故障,中西區府連路開山路與五妃街40巷大同路一段197巷號誌燈,東區大同路一段171號,22.9997281,120.2270277
UN201806160108,"2018-06-16 11:34:23",南區,噪音舉發,妨害安寧,"南區金華路二段144巷往金城街方向,敲鑼打鼓,搖滾樂妨害安寧",南區金華路二段144巷,22.9997281,120.2270277
UN201806160111,"2018-06-16 11:45:43",北區,違規停車,違規停車,"北區公園北路156號 違規停車",北區公園北路156號,23.0222441,120.22282
UN201806160112,"2018-06-16 11:47:47",永康區,違規停車,違規停車,"永康區小東路685巷與小東路647巷10弄 違規停車",永康區小東路685巷與小東路647巷10弄,22.9990506,120.239474
UN201806160114,"2018-06-16 11:56:08",中西區,違規停車,違規停車,"中西區萬昌街與興華街口；青年路附近 違規停車",中西區萬昌街興華街,22.9920589,120.2105536
UN201806160118,"2018-06-16 12:12:07",永康區,違規停車,違規停車,"永康區新行街122巷10弄1號，永康國際學苑1館 違規停車",永康區新行街122巷10弄1號，永康國際學苑1館,23.0410259,120.2426302
UN201806160119,"2018-06-16 12:12:51",安南區,交通運輸,交通疏導,"安南區怡安路與北安路三段路口  交通運輸",安南區怡安路與北安路三段,23.0425019,120.2030492
UN201806160120,"2018-06-16 12:15:55",安南區,違規停車,違規停車,"安南區府安路六段55號圍牆邊 違規停車",安南區府安路六段55號,23.0189533,120.1896279
UN201806160125,"2018-06-16 12:24:34",六甲區,道路維修,路面掏空、塌陷,"六甲區珊瑚路198巷26號  坑洞",六甲區珊瑚路198巷26號,22.9997281,120.2270277
UN201806160126,"2018-06-16 12:25:36",中西區,違規停車,違規停車,"中西區民族路三段19號 違規停車",700台南市中西區民族路三段19號,22.9977113,120.1988885
UN201806160127,"2018-06-16 12:30:14",北區,違規停車,違規停車,"北區和緯路二段229號  違停",北區和緯路二段229號,22.9997281,120.2270277
UN201806160128,"2018-06-16 12:34:13",中西區,違規停車,違規停車,"中西區西門路二段374號郡緯街跟西門路二段轉角   違規停車",中西區西門路二段374號郡緯街跟西門路二段轉角,22.998373,120.2006384
UN201806160129,"2018-06-16 12:38:19",中西區,違規停車,違規停車,"中西區民族路二段76號 違規停車",中西區民族路二段76號,23.0425019,120.2030492
UN201806160131,"2018-06-16 12:41:42",東區,違規停車,違規停車,"東區崇學路4號 違規停車",東區崇學路4號,22.9776502,120.2205298
UN201806160133,"2018-06-16 13:01:07",永康區,道路維修,路面坑洞,"永康區永安路113-1號,113號.每個坑洞都30公分左右",永康區永安路113之1號,23.0440519,120.2456288
UN201806160135,"2018-06-16 13:09:30",永康區,違規停車,違規停車,"永康區南台街36號  違規停車",永康區南台街36號,23.022328,120.223467
UN201806160137,"2018-06-16 13:22:40",中西區,違規停車,違規停車,中西區民族路二段76號違規停車,中西區民族路二段76號,23.0425019,120.2030492
UN201806160139,"2018-06-16 13:23:19",南區,噪音舉發,妨害安寧,"南區大德街177巷建安宮 妨害安寧",南區大德街177巷建安宮,22.985277,120.1959031
UN201806160141,"2018-06-16 13:30:41",中西區,噪音舉發,妨害安寧,"中西區保安路56號 噪音舉發",中西區保安路56號,22.9904092,120.1964584
UN201806160142,"2018-06-16 13:30:47",北區,違規停車,違規停車,"北區勝利路260號 違規停車",北區勝利路260號,23.005656,120.2189069
UN201806160145,"2018-06-16 13:36:12",永康區,髒亂及汙染,空氣汙染,"永康區大灣路1014號 空氣汙染",永康區大灣路1014號,22.9997364,120.2274877
UN201806160146,"2018-06-16 13:44:22",安平區,違規停車,違規停車,"安平區南島路上市府前 違停",安平區南島路,23.0352222,120.1484185
UN201806160147,"2018-06-16 13:44:38",永康區,道路維修,路面下陷、凹陷,"永康區富強路二段275巷口   路面凹陷",永康區富強路二段275巷,23.0266892,120.2720244
UN201806160151,"2018-06-16 13:59:32",中西區,違規停車,違規停車,"中西區尊王路38號  違規停車",中西區尊王路38號,22.9915315,120.196956
UN201806160154,"2018-06-16 14:02:52",仁德區,違規停車,違規停車,"仁德區文賢路二段15巷27號 違規停車",仁德區文賢路二段15巷27號,22.9226319,120.2378865
UN201806160155,"2018-06-16 14:03:06",中西區,違規停車,違規停車,"中西區民權路一段整條路 違停",中西區民權路一段,22.9998521,120.2530293
UN201806160156,"2018-06-16 14:03:06",永康區,違規停車,違規停車,"永康區大武街33號 違規停車",710台南市永康區大武街33號,23.0201967,120.2225314
UN201806160160,"2018-06-16 14:08:07",歸仁區,噪音舉發,妨害安寧,"歸仁區文化街三段20號郭英補習班附近 妨害安寧",歸仁區文化街三段20號,22.9915315,120.196956
UN201806160162,"2018-06-16 14:13:51",中西區,違規停車,違規停車,"中西區西門路一段476號 違規停車",中西區西門路一段476號,22.9834004,120.1976992
UN201806160164,"2018-06-16 14:15:48",中西區,違規停車,違規停車,"中西區西門路一段458號 違規停車",中西區西門路一段458號,22.9829821,120.1977122
UN201806160165,"2018-06-16 14:18:08",北區,髒亂及汙染,環境髒亂,"北區北園街80巷 髒亂及汙染",北區北園街80巷,23.0124368,120.2233833
UN201806160167,"2018-06-16 14:31:35",仁德區,髒亂及汙染,空氣汙染,"仁德區中山路379巷口旁海福冷氣 空氣汙染",仁德區中山路379巷,22.9706944,120.2575851
UN201806160170,"2018-06-16 14:36:35",南區,髒亂及汙染,其他汙染舉發,"南區中華西路一段170號  貓屍",南區中華西路一段170號,22.978931,120.185254
UN201806160173,"2018-06-16 14:41:00",北區,違規停車,違規停車,"北區開元路501號 違規停車",704台南市北區開元路501號,22.9997281,120.2270277
UN201806160176,"2018-06-16 14:53:21",北區,違規停車,違規停車,"北區北忠街58巷 違規停車",北區北忠街58巷,22.9997281,120.2270277
UN201806160177,"2018-06-16 14:56:26",北區,違規停車,違規停車,"北區長榮路五段286號 違規停車",704台南市北區長榮路五段286號,23.0129737,120.2174206
UN201806160179,"2018-06-16 15:02:32",關廟區,道路維修,路樹傾倒,"關廟區關廟國小崇平路  路樹倒塌",關廟區關廟國小崇平路,22.963817,120.326107
UN201806160180,"2018-06-16 15:04:04",永康區,違規停車,違規停車,"永康區中山南路63號  違規停車",台南市永康區中山南路63號,22.978931,120.185254
UN201806160181,"2018-06-16 15:08:05",北區,交通運輸,號誌故障,"北區北門路二段141巷口 號誌故障",北區北門路二段141巷,23.0066926,120.2134872
UN201806160182,"2018-06-16 15:08:21",中西區,違規停車,違規停車,"中西區國華街三段157號對面巷內 違停",中西區國華街三段157號,22.9972548,120.1987475
UN201806160185,"2018-06-16 15:18:40",北區,違規停車,違規停車,"北區成功路282號  黃線違停",北區成功路282號,22.9995579,120.2018973
UN201806160186,"2018-06-16 15:23:31",中西區,違規停車,違規停車,"中西區永福路二段41號  違規停車",台南市中西區永福路二段41號,22.9911514,120.2004453
UN201806160188,"2018-06-16 15:28:19",中西區,違規停車,違規停車,"中西區民生路二段95號   違規停車",700台南市中西區民生路二段95號,22.9997281,120.2270277
UN201806160191,"2018-06-16 15:34:17",東區,違規停車,違規停車,"東區東榮街   違停",東區東榮街,22.9900815,120.215341
UN201806160192,"2018-06-16 15:37:47",中西區,噪音舉發,妨害安寧,"中西區開山路跟大埔街口 廟會噪音/妨害安寧",中西區開山路大埔街,22.9871899,120.2090425
UN201806160194,"2018-06-16 15:40:06",中西區,噪音舉發,場所連續噪音,"中西區府前路*開山路   馬公廟   廟會噪音",中西區府前路開山路,22.9997281,120.2270277
UN201806160196,"2018-06-16 15:41:02",中西區,違規停車,違規停車,"中西區康樂街265號 違停",中西區康樂街265號,22.996422,120.1954403
UN201806160198,"2018-06-16 15:46:30",中西區,交通運輸,交通疏導,"中西區民生路跟西門路  交通阻塞",中西區民生路西門路,22.9997281,120.2270277
UN201806160201,"2018-06-16 16:11:04",南區,違規停車,違規停車,"南區大同路二段136巷10號 違規停車",南區大同路二段136巷10號,22.9900815,120.215341
UN201806160202,"2018-06-16 16:13:21",南區,髒亂及汙染,環境髒亂,"南區夏林路59號門口 環境髒亂",南區夏林路59號,22.9835874,120.1952186
UN201806160203,"2018-06-16 16:14:06",玉井區,違規停車,違規停車,"玉井區中正路 違規停車",玉井區中正路,22.9997281,120.2270277
UN201806160204,"2018-06-16 16:15:47",安平區,違規停車,違規停車,"安平區安平路590號 違規停車",安平區安平路590號,22.9987503,120.1696348
UN201806160206,"2018-06-16 16:20:31",中西區,噪音舉發,妨害安寧,"中西區中山路跟民權路口 妨害安寧/廟會",中西區中山路民權路,22.9936471,120.2066651
UN201806160209,"2018-06-16 16:28:35",東區,違規停車,違規停車,"東區中華東路三段2號 違規停車",東區中華東路三段2號,22.9810983,120.2291068
UN201806160211,"2018-06-16 16:38:02",南區,路燈故障,9盞以下路燈故障,"南區明興路611巷 路燈故障",南區明興路611巷,22.9900815,120.215341
UN201806160212,"2018-06-16 16:48:04",北區,違規停車,違規停車,"北區北門路三段42號 違規停車",北區北門路三段42號,23.013774,120.2172826
UN201806160213,"2018-06-16 17:03:31",南區,違規停車,違規停車,"南區萬年二街61號  違停",南區萬年二街61號,22.9997281,120.2270277
UN201806160216,"2018-06-16 17:09:43",安南區,違規停車,違規停車,"安南區安昌街85巷77號 紅線違停",安南區安昌街85巷77號,23.0709114,120.2182817
UN201806160217,"2018-06-16 17:13:40",中西區,交通運輸,交通疏導,"中西區永華路*西門路 交通疏導",中西區永華路*西門路,22.9874001,120.197584
UN201806160218,"2018-06-16 17:15:59",六甲區,違規停車,違規停車,"六甲區建工街216巷 違規停車",六甲區建工街216巷,23.225442,120.3449036
UN201806160221,"2018-06-16 17:27:56",北區,交通運輸,號誌故障,"北區文成五街跟育德二路口 號誌故障",北區文成五街育德二路,22.9900815,120.215341
UN201806160224,"2018-06-16 17:30:39",永康區,髒亂及汙染,環境髒亂,髒亂及汙染,大灣路37巷20弄19號旁空地,23.0119308,120.2723685
UN201806160225,"2018-06-16 17:41:22",中西區,違規停車,違規停車,"中西區民族路二段76號 違規停車",中西區民族路二段76號,23.0425019,120.2030492
UN201806160226,"2018-06-16 17:44:05",安平區,交通運輸,交通疏導,"中西區西門路一段 交通疏導",中西區西門路一段新光三越,22.9867747,120.1986997
UN201806160227,"2018-06-16 17:46:57",安平區,違規停車,違規停車,"安平區育平五街、健康三街 違規停車",安平區育平五街、健康三街,22.9906348,120.1688476
UN201806160228,"2018-06-16 17:48:00",中西區,違規停車,違規停車,"中西區西華南街10號、32號、38號 違規停車",中西區西華南街10號、32號、38號,23.225442,120.3449036
UN201806160230,"2018-06-16 17:50:21",中西區,違規停車,違規停車,"中西區衛民街99號、101號 違規停車",中西區衛民街99號、101號,23.2268876,120.3456774
UN201806160232,"2018-06-16 17:55:18",東區,交通運輸,號誌故障,"東區大同路跟中華南路三段 號誌故障",東區大同路中華南路三段,22.9997281,120.2270277
UN201806160233,"2018-06-16 17:58:16",南區,交通運輸,交通疏導,"南區大同路與中華南路 交通疏導",南區大同路中華南路,22.9997281,120.2270277
UN201806160234,"2018-06-16 18:00:47",東區,違規停車,違規停車,"東區裕農路43巷48號 違規停車",東區裕農路43巷48號,22.9870652,120.2257052
UN201806160236,"2018-06-16 18:08:07",東區,道路維修,路面坑洞,"東區林森路二段101巷口,出去的內車道",東區林森路二段101巷,22.9900579,120.2236169
UN201806160239,"2018-06-16 18:13:24",南區,髒亂及汙染,空氣汙染,"南區金華路二段76號四海遊龍 空氣汙染",南區金華路二段76號四海遊龍,22.9775693,120.1912587
UN201806160241,"2018-06-16 18:23:35",永康區,違規停車,違規停車,"永康區南台街43號 違規停車",永康區南台街43號,23.0222441,120.22282
UN201806160243,"2018-06-16 18:26:31",東區,違規停車,違規停車,"東區裕農路43巷48號 違規停車",東區裕農路43巷48號,22.9870652,120.2257052
UN201806160244,"2018-06-16 18:29:54",東區,道路維修,路面坑洞,"東區林森路二段79號  路面坑洞",東區林森路二段79號,22.9881969,120.2229308
UN201806160250,"2018-06-16 18:44:26",中西區,噪音舉發,妨害安寧,"中西區新美街大天后宮 妨害安寧/空氣汙染",中西區新美街大天后宮,22.9966165,120.201544
UN201806160251,"2018-06-16 18:47:16",北區,違規停車,違規停車,"北區海安路三段572號 違規停車",北區海安路三段572號,23.0120331,120.2008048
UN201806160253,"2018-06-16 18:56:14",中西區,違規停車,違規停車,"中西區民生路二段112號 違規停車",中西區民生路二段112號,22.9857385,120.2001382
UN201806160255,"2018-06-16 18:57:11",安平區,違規停車,違規停車,安平區中華西路二段49巷24弄98號前多部汽車違停,安平區中華西路二段49巷24弄98號,22.9997281,120.2270277
UN201806160259,"2018-06-16 19:07:51",北區,違規停車,違規停車,"北區公園路798號 違規停車",704台南市北區公園路798號,23.0119248,120.2113719
UN201806160260,"2018-06-16 19:12:51",東區,違規停車,違規停車,"東區裕農路710號  違規停車",東區裕農路710號,22.9997281,120.2270277
UN201806160262,"2018-06-16 19:15:44",東區,違規停車,違規停車,"東區中華東路二段133巷17弄30號 違規停車",中華東路二段133巷17弄30號,22.9858881,120.2342615
UN201806160263,"2018-06-16 19:16:32",中西區,噪音舉發,妨害安寧,"中西區民權路與西門路 妨害安寧",中西區民權路西門路,22.9960967,120.199539
UN201806160264,"2018-06-16 19:16:42",中西區,交通運輸,交通疏導,"中西區西門路二段387號(郡緯街交叉口)   交通疏導",中西區西門路二段387號,22.9881969,120.2229308
UN201806160265,"2018-06-16 19:20:43",南區,路燈故障,9盞以下路燈故障,"南區國民路583巷8弄內 路燈故障",南區國民路583巷8弄,22.9738043,120.2043873
UN201806160266,"2018-06-16 19:23:14",新化區,違規停車,違規停車,"新化區和平街132號 平安安親班 違規停車",新化區和平街132號,23.034331,120.3062258
UN201806160268,"2018-06-16 19:32:09",東區,違規停車,違規停車,"東區東寧路122號  違停",東區東寧路122號,22.9997281,120.2270277
UN201806160269,"2018-06-16 19:37:56",中西區,髒亂及汙染,道路散落物,"中西區府前路一段59號前 散落垃圾",中西區府前路一段59號,22.9888137,120.2100729
