UN201806110003,"2018-06-11 00:51:05",麻豆區,民生管線,停電、漏電、電線掉落、孔蓋鬆動,民生管線,文瑞橋,23.2081641,120.2070512
UN201806110006,"2018-06-11 01:16:06",新營區,噪音舉發,妨害安寧,"新營區長榮路二段961號 妨害安寧",新營區長榮路二段961號,22.932293,120.1866948
UN201806110009,"2018-06-11 03:09:18",東區,噪音舉發,妨害安寧,"東區文化路31號 妨害安寧",東區文化路31號,22.9997281,120.2270277
UN201806110011,"2018-06-11 03:57:41",永康區,髒亂及汙染,空氣汙染,"永康區大灣路1014號 空氣汙染",永康區大灣路1014號,22.9998521,120.2530293
UN201806110012,"2018-06-11 04:55:47",六甲區,民生管線,停電、漏電、電線掉落、孔蓋鬆動,"六甲區中正路146巷26之1號 停電",六甲區中正路146巷26之1號,22.9997281,120.2270277
UN201806110016,"2018-06-11 06:44:44",歸仁區,交通運輸,佔用道路,"歸仁區民生南街二段278號 佔用道路",歸仁區民生南街二段278號,22.9598355,120.2790904
UN201806110020,"2018-06-11 07:29:01",安平區,違規停車,違規停車,"安平區安平路110號/安平路312號 違規停車",安平區安平路110號安平路312號,22.9997281,120.2270277
UN201806110024,"2018-06-11 07:45:08",新市區,違規停車,違規停車,"新市區復興路67號 違規停車",新市區復興路67號,23.0816192,120.2953317
UN201806110026,"2018-06-11 07:46:52",麻豆區,騎樓舉發,騎樓舉發,"麻豆區173縣道42號  騎樓舉發",麻豆區173縣道42號,23.1804236,120.2478566
UN201806110041,"2018-06-11 08:30:19",中西區,違規停車,違規停車,"中西區開山路92號   違規停車",中西區開山路92號,22.9898233,120.2068518
UN201806110056,"2018-06-11 09:06:05",東區,交通運輸,佔用道路,"東區北門路二段16號 佔用人行道",東區北門路二段16號,22.9997281,120.2270277
UN201806110060,"2018-06-11 09:09:15",安南區,髒亂及汙染,大型廢棄物清運,"安南區海中街121巷51號 大型廢棄物清運",安南區海中街121巷51號,22.9997281,120.2270277
UN201806110071,"2018-06-11 09:24:39",安南區,違規停車,違規停車,"安南區安和路二段282號  違規停車",安南區安和路二段282號,23.0419793,120.2162161
UN201806110072,"2018-06-11 09:24:54",中西區,騎樓舉發,騎樓舉發,"中西區衛民街154號  騎樓舉發",中西區衛民街154號,22.9936801,120.207395
UN201806110081,"2018-06-11 09:35:55",中西區,路燈故障,9盞以下路燈故障,"中西區中華西路二段28巷 路燈故障",中西區中華西路二段28巷,22.9895182,120.1881384
UN201806110082,"2018-06-11 09:37:15",中西區,違規停車,違規停車,"中西區民族路二段59號、2號、66號  違規停車",中西區民族路二段59號,22.994358,120.2099209
UN201806110089,"2018-06-11 09:42:56",永康區,違規停車,違規停車,"永康區南台街3巷12號前  違規停車",永康區南台街3巷12號,22.9997281,120.2270277
UN201806110090,"2018-06-11 09:43:47",永康區,違規停車,違規停車,"永康區南台街與南台街13巷交岔路口  違規停車",永康區南台街南台街13巷,22.9936471,120.2066651
UN201806110091,"2018-06-11 09:46:09",中西區,違規停車,違規停車,"中西區舊新南國小前，運河星鑽工程碼頭 妨礙通行",中西區運河星鑽,22.99519,120.191127
UN201806110100,"2018-06-11 10:05:02",東區,違規停車,違規停車,"東區崇學路 違規停車",東區崇學路,22.9936471,120.2066651
UN201806110106,"2018-06-11 10:13:03",永康區,交通運輸,佔用道路,永康區永康區中華西街279號,永康區中華西街279號,23.0179272,120.2263689
UN201806110122,"2018-06-11 10:57:58",中西區,違規停車,違規停車,"中西區民族路二段231號   紅線違停",中西區民族路二段231號,22.9958753,120.2048592
UN201806110123,"2018-06-11 10:58:34",東區,路燈故障,9盞以下路燈故障,"東區裕農路121巷1弄17號  路燈不亮",東區裕農路121巷1弄17號,22.9997281,120.2270277
UN201806110124,"2018-06-11 11:02:41",鹽水區,髒亂及汙染,道路散落物,"鹽水區橋南街4號 道路散落物",鹽水區橋南街4號,23.3169534,120.2671704
UN201806110132,"2018-06-11 11:13:15",永康區,民生管線,電信孔蓋鬆動、電信線路掉落、電信桿傾倒,"永康區忠義街26號和28號中間   中華電信孔蓋鬆動",永康區忠義街26號,22.999304,120.2365495
UN201806110145,"2018-06-11 11:45:09",南區,違規停車,違規停車,"南區萬年三街260號 違規停車",南區萬年三街260號,22.932293,120.1866948
UN201806110146,"2018-06-11 11:45:54",安南區,髒亂及汙染,環境髒亂,"安南區府安路四段 環境髒亂",安南區府安路四段,23.0249058,120.2103066
UN201806110148,"2018-06-11 11:54:06",新營區,違規停車,違規停車,"新營區嘉芳街28巷  紅線違停",新營區嘉芳街28巷,23.3077901,120.2859577
UN201806110153,"2018-06-11 12:30:47",南區,違規停車,違規停車,"南區新孝路128號   違規停車",南區新孝路128號,22.9971367,120.2129498
UN201806110154,"2018-06-11 12:30:59",永康區,違規停車,違規停車,"永康區南台街與南台街3巷交岔路口  違規停車",永康區南台街3巷,22.9997281,120.2270277
UN201806110155,"2018-06-11 12:31:43",永康區,違規停車,違規停車,"永康區南台街43號  違規停車",永康區南台街43號,23.0222441,120.22282
UN201806110156,"2018-06-11 12:32:53",東區,違規停車,違規停車,"東區崇明路339號前公車站  違規停車",東區崇明路339號,22.97593,120.221956
UN201806110157,"2018-06-11 12:33:20",中西區,違規停車,違規停車,"中西區民族路三段19號  違規停車",中西區民族路三段19號,22.9947876,120.2089152
UN201806110158,"2018-06-11 12:38:14",東區,違規停車,違規停車,"台南火車站 違規停車",東區北門路二段4號,22.9971367,120.2129498
UN201806110163,"2018-06-11 12:56:12",永康區,違規停車,違規停車,"永康區大武街與正新街交岔路口  違規停車",永康區大武街正新街,22.9997281,120.2270277
UN201806110164,"2018-06-11 13:00:32",中西區,違規停車,違規停車,"中西區永華路一段36號  違規停車",中西區永華路一段36號,22.9997281,120.2270277
UN201806110165,"2018-06-11 13:10:24",安南區,路燈故障,9盞以下路燈故障,"安南區北安路死段548巷80弄口  路燈故障",安南區北安路死段548巷80弄口,23.0670419,120.2158471
UN201806110168,"2018-06-11 13:15:59",南區,違規停車,違規停車,"南區新孝路128號  違規停車",南區新孝路128號,22.9971367,120.2129498
UN201806110171,"2018-06-11 13:22:21",北區,違規停車,違規停車,"北區海安路三段572號  違規停車",北區海安路三段572號,23.0120331,120.2008048
UN201806110175,"2018-06-11 13:25:29",北區,違規停車,違規停車,"北區公園路546號  違規停車",北區公園路546號,23.006948,120.210186
UN201806110177,"2018-06-11 13:26:39",安南區,髒亂及汙染,空氣汙染,"安南區安和路一段496巷1弄69號  空氣汙染",安南區安和路一段496巷1弄69號,23.0361471,120.215964
UN201806110187,"2018-06-11 13:45:51",南區,違規停車,違規停車,"南區健康路二段180號前  違規停車",南區健康路二段180號,22.9816747,120.192801
UN201806110190,"2018-06-11 13:50:36",南區,違規停車,違規停車,"南區健康路二段185號前  違規停車",南區健康路二段185號,22.9997281,120.2270277
UN201806110191,"2018-06-11 13:53:57",南區,違規停車,違規停車,"南區健康路二段184號前  違規停車",南區健康路二段184號,22.9997281,120.2270277
UN201806110194,"2018-06-11 13:57:11",南區,違規停車,違規停車,"南區健康路二段179號前  違規停車",南區健康路二段179號,23.0401769,120.2433975
UN201806110196,"2018-06-11 14:04:13",安南區,交通運輸,號誌故障,"安南區安和路三段  號誌故障",安南區安和路三段,23.046978,120.2180424
UN201806110201,"2018-06-11 14:13:13",中西區,違規停車,違規停車,"台灣銀行(中西區中正路240號 ) 違規停車","台灣銀行(中西區中正路240號 )",22.993278,120.19691
UN201806110205,"2018-06-11 14:23:33",永康區,違規停車,違規停車,"永康區復華六街67巷 紅線違停",永康區復華六街67巷,23.0117716,120.2457949
UN201806110220,"2018-06-11 15:08:37",安南區,違規停車,違規停車,"安南區安和路二段282號  違規停車",安南區安和路二段282號,23.0419793,120.2162161
UN201806110232,"2018-06-11 15:26:51",南區,道路維修,路面坑洞,"南區三官路46號   坑洞",南區三官路46號,22.9799908,120.1937028
UN201806110238,"2018-06-11 15:35:52",中西區,違規停車,違規停車,"台南市中西區西門路二段381號  違規停車",中西區西門路二段381號,22.9997281,120.2270277
UN201806110243,"2018-06-11 15:47:43",安定區,動物救援,犬貓急難救援,"安定區蘇厝里真護宮後方大排 狗救援",安定區蘇厝里真護宮,22.9997281,120.2270277
UN201806110245,"2018-06-11 15:55:51",東區,違規停車,違規停車,"東區崇善路172號  違規停車",東區崇善路172號,22.9997281,120.2270277
UN201806110251,"2018-06-11 16:21:05",歸仁區,違規停車,違規停車,"歸仁區文化六街*文化街三段   占用道路",歸仁區文化六街文化街三段,22.9708557,120.2863646
UN201806110258,"2018-06-11 16:47:23",南區,道路維修,路面坑洞,"南區金華路一段169號前  坑洞",南區金華路一段169號,22.9997281,120.2270277
UN201806110262,"2018-06-11 16:57:52",北區,違規停車,違規停車,"北區西門路四段19巷巷口 違規停車",西門路四段19巷,22.9997281,120.2270277
UN201806110264,"2018-06-11 17:03:56",仁德區,騎樓舉發,騎樓舉發,"仁德區仁義路18號 騎樓舉發/佔用道路",仁德區仁義路18號,22.9681133,120.2534093
UN201806110265,"2018-06-11 17:13:28",北區,違規停車,違規停車,"北區西門路四段65巷 違規停車",北區西門路四段65巷,22.9997281,120.2270277
UN201806110266,"2018-06-11 17:13:36",仁德區,違規停車,違規停車,"仁德區文華路三段428巷33號 違規停車",仁德區文華路三段428巷33號,22.9997281,120.2270277
UN201806110267,"2018-06-11 17:14:47",北區,違規停車,違規停車,"北區西門路四段65巷130弄 違規停車",北區西門路四段65巷130弄,23.0092555,120.2041663
UN201806110270,"2018-06-11 17:21:48",安平區,違規停車,違規停車,"安平區安平路370號左側邊 違規停車",安平區安平路370號,22.9997281,120.2270277
UN201806110271,"2018-06-11 17:23:19",中西區,違規停車,違規停車,"中西區中山路81號到111號 違規停車",中西區中山路81號到111號,22.9708557,120.2863646
UN201806110273,"2018-06-11 17:24:44",中西區,騎樓舉發,騎樓舉發,"中西區中山 路71號到73號 違規停車","中西區中山 路71號到73號",22.9997281,120.2270277
UN201806110274,"2018-06-11 17:31:49",中西區,路燈故障,9盞以下路燈故障,"中西區西門路二段3號 路燈故障",中西區西門路二段3號,22.99035,120.197505
UN201806110279,"2018-06-11 17:45:18",中西區,動物救援,遊蕩犬隻捕捉管制,"中西區中山國中 遊蕩犬隻捕捉管制",中西區南寧街45號,22.9848031,120.2032338
UN201806110283,"2018-06-11 17:47:58",中西區,違規停車,違規停車,"中西區忠義路一段49號，樹林街二段161號靠近忠義路口 違規停車",中西區忠義路一段49號,22.9997281,120.2270277
UN201806110284,"2018-06-11 17:50:50",中西區,違規停車,違規停車,"中西區公園路10號 違規停車",中西區公園路10號,22.9936866,120.2054323
UN201806110288,"2018-06-11 17:55:32",中西區,違規停車,違規停車,"中西區公園路4號 違規停車",中西區公園路4號,22.9934059,120.205614
UN201806110289,"2018-06-11 17:58:28",中西區,騎樓舉發,騎樓舉發,"中西區忠義路二段18號髮廊外面 違規停車",中西區忠義路二段18號,22.991374,120.2029177
UN201806110290,"2018-06-11 18:01:57",北區,髒亂及汙染,大型廢棄物清運,"北區開元路141巷2弄17號 大型廢棄物清運",開元路141巷2弄17號,23.0065385,120.2191863
UN201806110294,"2018-06-11 18:19:00",東區,違規停車,違規停車,"東區長榮路二段180號 違規停車",東區長榮路二段180號,22.9901221,120.22073
UN201806110295,"2018-06-11 18:23:03",南區,動物救援,,"南區鹽埕路131巷19號 動物救援",鹽埕路131巷19號,22.9684701,120.1873989
UN201806110296,"2018-06-11 18:24:06",永康區,髒亂及汙染,道路散落物,"永康區永大陸橋下永大路三段 道路散落物",永康區永大路三段,23.0348781,120.2594092
UN201806110297,"2018-06-11 18:27:34",永康區,違規停車,違規停車,"永康區南台街與南台街13巷交岔路口 違規停車",南台街,23.0224255,120.2227152
UN201806110298,"2018-06-11 18:28:31",永康區,違規停車,違規停車,"永康區南台街43號 違規停車",710台南市永康區南台街43號,23.0222441,120.22282
UN201806110302,"2018-06-11 18:44:29",北區,違規停車,違規停車,"北區文成三路682巷巷口 違規停車",台南市北區文成三路682巷,23.0171374,120.1993735
UN201806110303,"2018-06-11 18:49:15",永康區,違規停車,違規停車,"永康區中華二路與六合路交叉口 違規停車",中華二路,22.9681133,120.2534093
UN201806110305,"2018-06-11 18:55:45",北區,違規停車,違規停車,"北區開元路 違規停車",北區開元路,22.9684701,120.1873989
UN201806110308,"2018-06-11 19:00:10",南區,道路維修,路面坑洞,"南區鯤鯓路232巷口 路面坑洞",南區鯤鯓路232巷,22.9627599,120.1706915
UN201806110312,"2018-06-11 19:13:39",東區,違規停車,違規停車,"東區長榮路二段248號旁邊全聯前方汽車格,, 違規停車",東區長榮路二段248號,23.0171374,120.1993735
UN201806110315,"2018-06-11 19:18:48",南區,路燈故障,9盞以下路燈故障,"南區鯤鯓路147號,龍岡國小 路燈故障",南區鯤鯓路147號,22.9684701,120.1873989
UN201806110316,"2018-06-11 19:19:40",新市區,路燈故障,10盞以上路燈故障,"新市區大洲里大洲路32號 路燈故障",新市區大洲里大洲路32號,22.9997281,120.2270277
UN201806110318,"2018-06-11 19:22:23",新市區,違規停車,違規停車,"新市區中正路37-39號 違規停車",新市區中正路37-39號,23.0717972,120.2917564
UN201806110319,"2018-06-11 19:24:20",永康區,路燈故障,9盞以下路燈故障,"永康區永大路三段560巷1弄 路燈故障",永康區永大路三段560巷1弄,23.03757,120.2596477
UN201806110320,"2018-06-11 19:26:33",永康區,路燈故障,9盞以下路燈故障,"永康區永大路三段511巷20弄19號 路燈故障",永康區永大路三段511巷20弄19號,22.9997281,120.2270277
UN201806110321,"2018-06-11 19:29:01",東區,路燈故障,9盞以下路燈故障,"東區勝利路12巷與懷恩街路口處,近12巷",東區勝利路12巷懷恩街路,22.9997281,120.2270277
UN201806110323,"2018-06-11 19:33:50",新市區,民生管線,停電、漏電、電線掉落、孔蓋鬆動,"新市區三社里 停電",新市區三社里,22.9997281,120.2270277
UN201806110324,"2018-06-11 19:34:45",仁德區,違規停車,違規停車,"仁德區正義路178號 違規停車",仁德區正義路178號,22.9997281,120.2270277
UN201806110326,"2018-06-11 19:42:59",後壁區,路燈故障,9盞以下路燈故障,"後壁仕安里66-3號 路燈故障",後壁仕安里66-3號,23.3554486,120.3225195
UN201806110332,"2018-06-11 19:51:35",永康區,路燈故障,9盞以下路燈故障,永康區鹽洲二街1號約10盞路燈,永康區鹽洲二街1號,22.9997281,120.2270277
UN201806110333,"2018-06-11 19:54:28",北區,路燈故障,9盞以下路燈故障,"北區勝利路190巷 路燈故障",北區勝利路190巷,22.9997281,120.2270277
UN201806110334,"2018-06-11 19:56:53",鹽水區,交通運輸,號誌故障,"鹽水區南80線與南74線交叉口,往後鎮方向, 紅綠燈故障變閃燈",鹽水區南80線南74線,22.9997281,120.2270277
UN201806110336,"2018-06-11 20:05:14",安平區,違規停車,違規停車,"安平區育平六街39號前 違規停車",安平區育平六街39號,23.3554486,120.3225195
UN201806110340,"2018-06-11 20:14:25",新市區,違規停車,違規停車,"新市區中正路166號 違規停車",中正路166號,22.9947876,120.2089152
UN201806110341,"2018-06-11 20:14:54",北區,違規停車,違規停車,"北區北園街32號 違規停車",北園街32號,23.0111452,120.223123
UN201806110342,"2018-06-11 20:15:15",新市區,違規停車,違規停車,"新市區華興街133號 違規停車",華興街133號,23.0767186,120.2919026
UN201806110343,"2018-06-11 20:16:08",新市區,違規停車,違規停車,"新市區中正路41-89號 違規停車",中正路41-89號,23.0726525,120.2916057
UN201806110345,"2018-06-11 20:22:39",安平區,違規停車,違規停車,"安平區育平六街35號 違規停車",安平區育平六街35號,22.992343,120.1661777
UN201806110347,"2018-06-11 20:30:41",南區,路燈故障,9盞以下路燈故障,"南區水交社路20巷內/南區水交社路80巷內/南區大成路一段與水交社路口 路燈故障",南區水交社路20巷,22.9997281,120.2270277
UN201806110350,"2018-06-11 20:46:57",中西區,違規停車,違規停車,"中西區民生路二段112號 違規停車",700台南市中西區民生路二段112號,22.9947876,120.2089152
UN201806110351,"2018-06-11 20:47:52",北區,違規停車,違規停車,"北區開元路501號 違規停車",704台南市北區開元路501號,23.0102471,120.2247606
UN201806110352,"2018-06-11 20:50:35",新市區,動物救援,遊蕩犬隻捕捉管制,"新市區復興路101號 遊蕩犬隻捕捉管制",復興路101號,23.1548698,120.17226
UN201806110356,"2018-06-11 21:04:16",中西區,道路維修,路面坑洞,"中西區府前路一段361號 路面坑洞",中西區府前路一段361號,23.3554486,120.3225195
UN201806110358,"2018-06-11 21:11:20",安平區,違規停車,違規停車,"安平區安平路370號左側邊 違規停車",安平區安平路370號,22.9997281,120.2270277
UN201806110368,"2018-06-11 21:58:30",善化區,路燈故障,9盞以下路燈故障,"善化區蓮潭北二街168號 路燈故障",善化區蓮潭北二街168號,22.9997281,120.2270277
UN201806110371,"2018-06-11 22:21:20",永康區,違規停車,違規停車,"永康區中正南路404巷，愛買正對面 違停",永康區中正南路404巷,23.0340986,120.2302604
UN201806110372,"2018-06-11 22:24:26",永康區,違規停車,違規停車,"永康區永安路103巷2號 違規停車",永康區永安路103巷2號,23.0440862,120.2456081
UN201806110376,"2018-06-11 23:18:01",永康區,違規停車,違規停車,"永康區新行街122巷10弄1號，永康國際學苑1館 違規停車",永康區新行街122巷10弄1號，永康國際學苑1館,22.992343,120.1661777
UN201806110377,"2018-06-11 23:18:56",永康區,違規停車,違規停車,"永康區新民街16巷及新民街交界，儷塔沙龍旁邊 違規停車",永康區新民街16巷*新民街,23.0401769,120.2433975
UN201806110378,"2018-06-11 23:20:49",永康區,違規停車,違規停車,"永康區新民街218巷接新中街 違規停車",永康區新民街218巷*新中街,23.0395906,120.2436065
UN201806110379,"2018-06-11 23:21:32",北區,噪音舉發,妨害安寧,"北區公園北路191號 妨害安寧",北區公園北路191號,22.9997281,120.2270277
UN201806110381,"2018-06-11 23:51:01",中西區,違規停車,違規停車,"中西區民生路二段106號 違規停車",700台南市中西區民生路二段106號,23.0092555,120.2041663
UN201806120001,"2018-06-12 00:36:23",中西區,違規停車,違規停車,"中西區民生路二段112號 違規停車",700台南市中西區民生路二段112號,22.9947876,120.2089152
UN201806120002,"2018-06-12 00:40:11",北區,違規停車,違規停車,"北區大興街226巷和大興街192巷口，大港里文康活動中心旁轉角 違停",北區大興街226巷大興街192巷,23.0106565,120.1885571
UN201806120003,"2018-06-12 00:55:24",永康區,違規停車,違規停車,"永康區正新街與大武街交岔路口 違規停車",永康區正新街大武街,23.0199917,120.2226008
UN201806120004,"2018-06-12 00:56:40",北區,違規停車,違規停車,"北區北園街20號 違規停車",704台南市北區北園街20號,22.9997281,120.2270277
UN201806120005,"2018-06-12 01:45:10",下營區,髒亂及汙染,空氣汙染,"下營區大和街113巷9號 空氣污染",下營區大和街113巷9號,23.0102471,120.2247606
UN201806120008,"2018-06-12 05:51:58",安南區,髒亂及汙染,空氣汙染,"安南區北安路三段7號前 狗屍",安南區北安路三段7號,23.0396293,120.2023202
UN201806120012,"2018-06-12 06:22:41",永康區,髒亂及汙染,空氣汙染,"永康區大灣路1014號，鍵誠紡織 空氣污染",永康區大灣路1014號,22.9998521,120.2530293
UN201806120014,"2018-06-12 06:38:48",歸仁區,交通運輸,佔用道路,"歸仁區民生南街二段278號 佔用道路",歸仁區民生南街二段278號,22.9598355,120.2790904
UN201806120016,"2018-06-12 07:18:27",永康區,民生管線,漏水、停水、消防栓漏水或損壞,"仁德區太子路*永康區永大路   冒水",永康區永大路,23.0348781,120.2594092
UN201806120017,"2018-06-12 07:33:35",新市區,違規停車,違規停車,"新市區復興路67號  違規停車",新市區復興路67號,23.0816192,120.2953317
UN201806120018,"2018-06-12 07:35:05",東區,路燈故障,9盞以下路燈故障,"東區裕文路*裕信二街 路燈不亮",東區裕文路裕信二街,22.9822977,120.2471497
UN201806120019,"2018-06-12 07:35:07",新市區,違規停車,違規停車,"新市區復興路101號  違規停車",新市區復興路101號,23.082665,120.2952933
UN201806120021,"2018-06-12 07:40:19",北區,交通運輸,號誌故障,"北區前鋒路*東豐路   號誌故障",北區前鋒路東豐路,23.0039345,120.2150772
UN201806120024,"2018-06-12 07:57:10",永康區,違規停車,違規停車,"永康區中華二路340巷19號   違規停車",永康區中華二路340巷19號,23.0094695,120.2309116
UN201806120026,"2018-06-12 08:02:16",白河區,交通運輸,佔用道路,"白河區中山路與文明街口 佔用道路",白河區中山路文明街,23.0348781,120.2594092
UN201806120031,"2018-06-12 08:23:39",中西區,路燈故障,9盞以下路燈故障,"中西區南門路243之3號  路燈不亮",中西區南門路243之3號,23.0039345,120.2150772
UN201806120032,"2018-06-12 08:27:44",東區,違規停車,違規停車,"東區勝利路18號前方人行道上 違停",東區勝利路18號,22.9997281,120.2270277
UN201806120035,"2018-06-12 08:31:37",安南區,髒亂及汙染,空氣汙染,"安南區安中路四段197巷49弄8號   空氣汙染",安南區安中路四段197巷49弄8號,23.0499237,120.1682048
UN201806120036,"2018-06-12 08:33:38",仁德區,噪音舉發,場所連續噪音,"仁德區義林五街16號    妨礙安寧",仁德區義林五街16號,23.031911,120.304369
UN201806120037,"2018-06-12 08:35:40",仁德區,民生管線,漏水、停水、消防栓漏水或損壞,"仁德區太子路與中正路口 水管破裂",仁德區太子路中正路,22.9914368,120.2558153
UN201806120045,"2018-06-12 08:45:22",佳里區,交通運輸,佔用道路,"佳里區建中街37號 佔用道路",佳里區建中街37號,23.1586595,120.1789607
UN201806120048,"2018-06-12 08:59:10",永康區,違規停車,違規停車,"永康區南台街3巷12號前  違規停車",永康區南台街3巷12號,22.9997281,120.2270277
UN201806120051,"2018-06-12 09:11:54",中西區,違規停車,違規停車,"中西區中山 路81到111號 違規停車",民權路二段100號,22.9947974,120.2040704
UN201806120052,"2018-06-12 09:12:25",安平區,違規停車,違規停車,"安平區健康三街592巷 違停",安平區健康三街592巷,22.9970775,120.1699769
UN201806120058,"2018-06-12 09:19:36",永康區,違規停車,違規停車,"永康區南台街與南台街3巷 違規停車",南台街3巷,22.9997281,120.2270277
UN201806120062,"2018-06-12 09:28:58",安平區,路燈故障,9盞以下路燈故障,"安平區健康三街140號  路燈故障",安平區健康三街140號,22.9873282,120.1685439
UN201806120067,"2018-06-12 09:35:22",仁德區,路燈故障,9盞以下路燈故障,"仁德區成功里  路燈故障",仁德區成功里,22.9404559,120.225308
UN201806120069,"2018-06-12 09:42:27",中西區,髒亂及汙染,市區道路路面油漬,"中西區西華南街120巷內   路面油漬",中西區西華南街120巷內,22.9968249,120.210397
UN201806120076,"2018-06-12 10:01:00",中西區,違規停車,違規停車,"中西區民族路三段19號 違規停車",700台南市中西區民族路三段19號,22.9977113,120.1988885
UN201806120080,"2018-06-12 10:07:02",南區,髒亂及汙染,市區道路路面油漬,"南區中華南路*國民路  路面油漬",南區中華南路國民路,22.9689739,120.2098367
UN201806120083,"2018-06-12 10:18:33",安南區,路燈故障,9盞以下路燈故障,"安南區北安路二段93巷78號 路燈故障",安南區北安路二段93巷78號,23.0254092,120.2266579
UN201806120086,"2018-06-12 10:22:14",中西區,違規停車,違規停車,"中西區忠義路二段171號到225號，170到226號 違規停車",中西區忠義路二段171號,22.9964803,120.2040409
UN201806120090,"2018-06-12 10:31:13",安平區,動物救援,遊蕩犬隻捕捉管制,"安平區建平十七街43號附近   捕狗",安平區建平十七街43號,22.9973411,120.1825363
UN201806120097,"2018-06-12 10:44:52",中西區,路燈故障,9盞以下路燈故障,"中西區府連路222號前  路燈故障",中西區府連路222號,22.9997281,120.2270277
UN201806120098,"2018-06-12 10:46:06",歸仁區,動物救援,犬貓急難救援,"歸仁區中山路二段188號 貓受困",歸仁區中山路二段188號,22.9997281,120.2270277
UN201806120099,"2018-06-12 10:48:44",東區,民生管線,停電、漏電、電線掉落、孔蓋鬆動,"東區東和路98號前 孔蓋鬆動",東區東和路98號,22.9985915,120.2270846
UN201806120102,"2018-06-12 10:52:41",南區,違規停車,違規停車,"南區健康路一段113巷，竹溪里活動中心旁 違停",南區健康路一段113巷,22.9800611,120.2094719
