UN201806130168,"2018-06-13 14:41:01",新營區,噪音舉發,場所連續噪音,"新營區土庫里卯舍57號對面鐵工廠 噪音",新營區土庫里卯舍57號,22.9997281,120.2270277
UN201806130171,"2018-06-13 14:51:25",安南區,違規停車,違規停車,安南區安和路二段違規停車,安南區安和路二段,23.0398861,120.2151997
UN201806130173,"2018-06-13 14:53:15",中西區,違規停車,違規停車,中西區西華南街2號到46號違規停車,中西區西華南街2號,22.9933738,120.2094374
UN201806130174,"2018-06-13 14:53:31",安南區,違規停車,違規停車,安南區同安路262巷41號旁公園紅線違停,安南區同安路262巷41號,23.0411233,120.1926058
UN201806130176,"2018-06-13 15:03:57",中西區,噪音舉發,妨害安寧,"中西區衛民街145號對面  妨害安寧",中西區衛民街145號對面,22.9933412,120.2100138
UN201806130192,"2018-06-13 15:58:34",永康區,民生管線,電信孔蓋鬆動、電信線路掉落、電信桿傾倒,"永康區大灣路99號 中華電信孔蓋鬆動",永康區大灣路99號,23.010293,120.2699188
UN201806130196,"2018-06-13 16:06:53",安南區,道路維修,路面掏空、塌陷,"媽祖宮一街345巷 道路維修 路面掏空、塌陷",經度120.11605緯度23.03190,22.9997281,120.2270277
UN201806130197,"2018-06-13 16:07:13",北區,違規停車,違規停車,"北區北門路二段500號 違規停車",北門路二段500號,23.0093481,120.216047
UN201806130199,"2018-06-13 16:09:28",安南區,髒亂及汙染,道路散落物,"安南區台江大道上  路面散落物",安南區台江大道上,22.9997281,120.2270277
UN201806130200,"2018-06-13 16:10:46",龍崎區,動物救援,遊蕩犬隻捕捉管制,"永康區大灣一街292巷42號隔壁空地 遊蕩犬隻捕捉管制",永康區大灣一街292巷42號,23.003277,120.2623512
UN201806130205,"2018-06-13 16:24:14",北區,違規停車,違規停車,"北區和緯路二段137號  違規停車",北區和緯路二段137號,23.0118356,120.2074588
UN201806130208,"2018-06-13 16:32:11",中西區,違規停車,違規停車,"中西區永福路一段17號 違規停車",永福路一段17號,22.9820084,120.1999379
UN201806130209,"2018-06-13 16:34:49",安南區,路燈故障,9盞以下路燈故障,"安南區北安路二段93巷78號  9盞以下路燈故障",安南區北安路二段93巷78號,23.0263878,120.2019874
UN201806130215,"2018-06-13 16:50:34",北區,違規停車,違規停車,"北區西門路三段18號 違停",北區西門路三段18號,23.0000759,120.2016954
UN201806130216,"2018-06-13 16:51:56",中西區,違規停車,違規停車,"中西區健康路一段320號 違規停車",健康路一段320號,22.9816017,120.2025376
UN201806130218,"2018-06-13 16:58:27",東區,違規停車,違規停車,"東區崇明路和崇明七街口 違停",東區崇明路崇明七街,22.979202,120.2184119
UN201806130222,"2018-06-13 17:02:58",安平區,違規停車,違規停車,"安平區育平五街與健康三街口/安平區育平五街35號前/安平區育平五街33-77號前 違規停車",安平區育平五街健康三街,22.9906348,120.1688476
UN201806130223,"2018-06-13 17:05:37",永康區,違規停車,違規停車,"永康區小東路685巷與小東路647巷10弄口 違停",永康區小東路685巷小東路647巷10弄,22.9990506,120.239474
UN201806130224,"2018-06-13 17:06:06",永康區,違規停車,違規停車,"永康區大武街與正新街交岔路口 違規停車",永康區大武街正新街,23.0199917,120.2226008
UN201806130226,"2018-06-13 17:07:21",北區,違規停車,違規停車,"北區開元路501號 違規停車",704台南市北區開元路501號,22.9997281,120.2270277
UN201806130227,"2018-06-13 17:18:43",北區,違規停車,違規停車,"北區成功路2號前 違規停車",北區成功路2號,22.9976771,120.211063
UN201806130232,"2018-06-13 17:28:31",仁德區,噪音舉發,妨害安寧,"仁德區太子一街246號 妨害安寧",仁德區太子一街246號,22.9892768,120.2652347
UN201806130236,"2018-06-13 17:35:43",中西區,違規停車,違規停車,"中西區大同路一段的五妃街口到開山路口雙側紅線黃線 違規停車",中西區大同路一段,22.9997281,120.2270277
UN201806130242,"2018-06-13 18:07:45",安平區,違規停車,違規停車,"安平區國平路與國平路552巷口轉彎處 違規停車",安平區國平路552巷,22.9892768,120.2652347
UN201806130248,"2018-06-13 18:18:09",東區,違規停車,違規停車,"東區大同路二段63號，香圃麵店外面 違規停車",東區大同路二段63號,22.9997281,120.2270277
UN201806130249,"2018-06-13 18:19:17",北區,違規停車,違規停車,"北區西門路四段380巷口 違規停車",北區西門路四段380巷,23.0144659,120.2102989
UN201806130252,"2018-06-13 18:23:28",安平區,違規停車,違規停車,"安平區育平五街、健康三街 違規停車",安平區育平五街健康三街,22.9906348,120.1688476
UN201806130253,"2018-06-13 18:25:03",東區,違規停車,違規停車,"東區北門路一段10號附近 違規停車",東區北門路一段10號,22.9897808,120.2115943
UN201806130254,"2018-06-13 18:26:03",中西區,違規停車,違規停車,"中西區興華街、青年路口 違規停車",中西區興華街青年路,22.9917633,120.2100402
UN201806130256,"2018-06-13 18:27:15",中西區,違規停車,違規停車,"中西區衛民街56號 違規停車",中西區衛民街56號,22.9929782,120.2105053
UN201806130258,"2018-06-13 18:30:38",中西區,違規停車,違規停車,"中西區西華南街42號 違規停車",中西區西華南街42號,22.9997281,120.2270277
UN201806130259,"2018-06-13 18:37:08",東區,違規停車,違規停車,"東區長東街46巷內 紅線違停",東區長東街46巷,22.9633703,120.2292676
UN201806130263,"2018-06-13 18:43:35",北區,違規停車,違規停車,"北區公園路634巷3號 違規停車",北區公園路634巷3號,22.9997281,120.2270277
UN201806130265,"2018-06-13 18:53:28",關廟區,動物救援,犬貓急難救援,"關廟區埤頭里關新路二段68號, 貓受困在水溝 動物救援",關廟區埤頭里關新路二段68號,22.9975118,120.3084735
UN201806130269,"2018-06-13 19:03:32",永康區,違規停車,違規停車,"永康區中山南路63號 違規停車",永康區中山南路63號,23.0123393,120.2274748
UN201806130272,"2018-06-13 19:06:01",北區,違規停車,違規停車,"北區開南街275巷12弄1號 違規停車",北區開南街275巷12弄1號,23.0055385,120.2291813
UN201806130273,"2018-06-13 19:06:21",永康區,違規停車,違規停車,"永康區中山南路70號 違規停車",永康區中山南路70號,22.9997281,120.2270277
UN201806130276,"2018-06-13 19:28:10",中西區,交通運輸,佔用道路,"中西區西門路二段387號 佔用道路/違規停車",中西區西門路二段387號,22.9985471,120.200283
UN201806130278,"2018-06-13 19:30:43",東區,路燈故障,9盞以下路燈故障,"東區東榮街28號門口 路燈閃爍",東區東榮街28號,22.9997281,120.2270277
UN201806130279,"2018-06-13 19:33:24",北區,違規停車,違規停車,"北區林森路三段328號 違規停車",北區林森路三段328號,23.0263878,120.2019874
UN201806130282,"2018-06-13 19:41:37",新市區,違規停車,違規停車,"新市區台19甲線67號  包手幸福豆漿 違規停車",新市區台19甲線67號,23.0816182,120.2953341
UN201806130283,"2018-06-13 19:42:27",新市區,違規停車,違規停車,"新市區中正路323巷9號 違規停車",新市區中正路323巷9號,23.0800452,120.2940027
UN201806130284,"2018-06-13 19:42:58",東區,違規停車,違規停車,"東區崇德十九街62號前 紅線違停",東區崇德十九街62號,22.9681809,120.2292764
UN201806130285,"2018-06-13 19:43:21",新市區,違規停車,違規停車,"新市區中正路376號 違規停車",新市區中正路376號,22.9975118,120.3084735
UN201806130286,"2018-06-13 19:44:23",新市區,違規停車,違規停車,"新市區台19甲線 249號 胖師傅牛排  違規停車",新市區台19甲線249號,23.0788738,120.2920919
UN201806130287,"2018-06-13 19:44:37",安南區,路燈故障,9盞以下路燈故障,路燈故障,安南區安中路4段4巷48弄內,23.0513219,120.165565
UN201806130288,"2018-06-13 19:45:20",新市區,違規停車,違規停車,"新市區台19甲線241號  藏茶 和 小妞滷味 違規停車",新市區台19甲線241號,22.9997281,120.2270277
UN201806130289,"2018-06-13 19:46:47",新市區,違規停車,違規停車,"新市區台19甲線234號 必勝客 和 華南銀行 違規停車",新市區台19甲線234號,23.0761192,120.2918501
UN201806130290,"2018-06-13 19:47:55",新市區,違規停車,違規停車,"新市區台19甲線166號 全聯 門口 轉角 紅線  違規停車",新市區台19甲線166號,23.0744447,120.2915017
UN201806130291,"2018-06-13 19:49:22",新市區,違規停車,違規停車,"新市區台19甲線37號 (寶雅( 中正路) 和 大呼過癮(富強路6號))違規停車",新市區台19甲線37號,22.9997281,120.2270277
UN201806130294,"2018-06-13 19:57:26",南區,噪音舉發,妨害安寧,"南區水萍塭公園，從夏林路大門進去較裡面的位置 妨害安寧",南區水萍塭公園,22.9997281,120.2270277
UN201806130295,"2018-06-13 20:00:07",東區,髒亂及汙染,道路散落物,"東區府東街99號，大亞洲大樓對面 貓屍",東區府東街99號,22.9858996,120.2178456
UN201806130297,"2018-06-13 20:07:17",仁德區,髒亂及汙染,空氣汙染,"仁德區仁義里中山路48巷13號 空氣污染",仁德區仁義里中山路48巷13號,22.9710327,120.267014
UN201806130300,"2018-06-13 20:13:37",南區,違規停車,違規停車,"南區大同路二段136巷 違規停車",南區大同路二段136巷,22.9789537,120.2122767
UN201806130303,"2018-06-13 20:20:49",北區,髒亂及汙染,空氣汙染,"北區公園路295巷50號 空氣污染",北區公園路295巷50號,22.9997281,120.2270277
UN201806130304,"2018-06-13 20:24:48",永康區,違規停車,違規停車,"永康區六合路42巷1號巷口 違規停車",永康區六合路42巷1號,22.9997281,120.2270277
UN201806130306,"2018-06-13 20:34:10",北區,違規停車,違規停車,"北區公園路634巷5號 違規停車",北區公園路634巷5號,23.0079833,120.21035
UN201806130307,"2018-06-13 20:42:29",安平區,違規停車,違規停車,"安平區安平路446巷與安平路446巷25弄交叉路口 違規停車",安平區安平路446巷安平路446巷25弄,22.99802,120.1735638
UN201806130309,"2018-06-13 20:50:40",安平區,違規停車,違規停車,"安平區安平路482號 違規停車",安平區安平路482號,22.9982065,120.1726372
UN201806130315,"2018-06-13 21:18:29",中西區,路燈故障,9盞以下路燈故障,"中西區衛民街35號 路燈故障",中西區衛民街35號,22.9927117,120.2111909
UN201806130316,"2018-06-13 21:35:41",北區,違規停車,違規停車,"北區公園路634巷5號 違規停車",北區公園路634巷5號,23.0079833,120.21035
UN201806130317,"2018-06-13 21:40:30",北區,違規停車,違規停車,"北區公園路798號 違規停車",北區公園路798號,22.99802,120.1735638
UN201806130318,"2018-06-13 21:47:38",新市區,違規停車,違規停車,"新市區仁愛街319號 違規停車",新市區仁愛街319號,23.0779935,120.2939205
UN201806130319,"2018-06-13 21:51:52",安平區,違規停車,違規停車,"安平區永華路二段500號 違規停車",安平區永華路二段500號,22.9904803,120.1753267
UN201806130322,"2018-06-13 21:57:49",安平區,違規停車,違規停車,"安平區建平十七街257號 違規停車",安平區建平十七街257號,22.9972046,120.1750165
UN201806130324,"2018-06-13 22:00:35",新市區,違規停車,違規停車,"新市區台19甲線282號 違規停車",台19甲線282號,22.9997281,120.2270277
UN201806130325,"2018-06-13 22:01:48",東區,路燈故障,9盞以下路燈故障,"東區中華東路一段 9盞以下路燈故障",東區中華東路一段,22.9932436,120.2340407
UN201806130326,"2018-06-13 22:03:43",安平區,違規停車,違規停車,"安平區永華路二段502號，日盛銀行前 違停",安平區永華路二段502號,22.9907667,120.1750866
UN201806130327,"2018-06-13 22:08:56",安平區,違規停車,違規停車,"安平區永華路二段208號 違停",安平區永華路二段208號,22.9997281,120.2270277
UN201806130329,"2018-06-13 22:12:14",永康區,違規停車,違規停車,"永康區中華路與中山南路交叉口 佔用騎樓/違規停車",永康區中華路中山南路,23.0134956,120.2306997
UN201806130330,"2018-06-13 22:15:37",永康區,違規停車,違規停車,"永康區南台街與南台街13巷 違規停車",南台街與南台街13巷交岔路口,22.9997281,120.2270277
UN201806130331,"2018-06-13 22:20:30",中西區,路燈故障,9盞以下路燈故障,"中西區大林街139巷/保安路185巷/大勇街135號 路燈不亮",中西區大林街139巷,22.9897808,120.2115943
UN201806130333,"2018-06-13 22:22:37",安平區,髒亂及汙染,空氣汙染,"安平區育平五街33號 空氣汙染",育平五街33號騎樓,22.9897808,120.2115943
UN201806130335,"2018-06-13 22:29:18",中西區,違規停車,違規停車,"中西區金華路三段142號 違規停車",中西區金華路三段142號,22.9932436,120.2340407
UN201806130337,"2018-06-13 22:38:24",北區,違規停車,違規停車,"北區開元路501號 違規停車",北區開元路501號,22.9997281,120.2270277
UN201806130339,"2018-06-13 22:41:46",安南區,噪音舉發,妨害安寧,"安南區北安路二段526號(一品來小吃部) 妨害安寧",安南區北安路二段526號,23.0102471,120.2247606
UN201806130341,"2018-06-13 22:52:46",安平區,違規停車,違規停車,"安平區永華路二段816號/828號 違規停車",安平區永華路二段816號,22.9897808,120.2115943
UN201806130343,"2018-06-13 23:04:18",安南區,路燈故障,9盞以下路燈故障,"安南區北安路三段181巷16號對面 路燈乙盞故障",安南區北安路三段181巷16號,22.9897808,120.2115943
UN201806130345,"2018-06-13 23:20:13",永康區,違規停車,違規停車,"永康區中華路530號 違規停車",永康區中華路530號,23.0126187,120.2315126
UN201806130346,"2018-06-13 23:35:55",東區,路燈故障,9盞以下路燈故障,"東區裕農路610號門口 路燈故障",東區裕農路610號,22.9997281,120.2270277
UN201806130347,"2018-06-13 23:41:35",南區,噪音舉發,場所連續噪音,南區鹽埕路291巷32弄68號妨害安寧,鹽埕路291巷32弄68號,22.970745,120.187557
UN201806140005,"2018-06-14 06:47:30",善化區,違規停車,違規停車,"善化區陽光三路2號 違規停車",陽光三路2號,23.1143946,120.3094995
UN201806140006,"2018-06-14 06:54:28",善化區,違規停車,違規停車,"善化區陽光三路152號 違規停車",陽光三路152號,23.1144054,120.3097237
UN201806140008,"2018-06-14 07:08:34",安平區,違規停車,違規停車,"安平區國平路552巷口 違規停車",安平區國平路552巷,23.0228084,120.2589725
UN201806140009,"2018-06-14 07:22:10",永康區,違規停車,違規停車,"永康區中華二路330號 違規停車",永康區中華二路330號,22.9947465,120.2089496
UN201806140010,"2018-06-14 07:24:13",歸仁區,交通運輸,交通疏導,"歸仁區大順一街3號對面 交通疏導",歸仁區大順一街3號,23.0228084,120.2589725
UN201806140011,"2018-06-14 07:37:04",安平區,違規停車,違規停車,"安平區安平路312號左側邊 違規停車",安平區安平路312號,22.9947465,120.2089496
UN201806140013,"2018-06-14 07:40:25",永康區,違規停車,違規停車,"永康區中華二路340巷19號 違規停車",永康區中華二路340巷19號,22.9997281,120.2270277
UN201806140015,"2018-06-14 07:46:42",東區,交通運輸,號誌故障,"東區裕文路跟裕義路交叉口  交通號誌故障",東區裕文路裕義路,23.017253,120.2374442
UN201806140016,"2018-06-14 07:47:14",歸仁區,交通運輸,交通疏導,"歸仁區成功路二段，寬薪園建案 交通疏導",歸仁區成功路二段,23.0228084,120.2589725
UN201806140024,"2018-06-14 08:17:07",東區,髒亂及汙染,道路散落物,"東區崇明一街35號到37號  道路散落物",東區崇明一街35號到37號,22.9997281,120.2270277
UN201806140029,"2018-06-14 08:30:59",白河區,交通運輸,佔用道路,"白河區中山路跟文明街  佔用道路",白河區中山路文明街,22.9997281,120.2270277
UN201806140036,"2018-06-14 09:01:00",關廟區,動物救援,遊蕩犬隻捕捉管制,"關廟區關新路一段221巷113號   捕狗",關廟區關新路一段221巷113號,23.0228084,120.2589725
UN201806140040,"2018-06-14 09:11:58",新市區,髒亂及汙染,空氣汙染,"新市區三舍里239號後方   空污",新市區三舍里239號,22.9997281,120.2270277
UN201806140044,"2018-06-14 09:22:21",仁德區,髒亂及汙染,空氣汙染,"仁德區中正路一段與保安路二段口 空污",仁德區中正路一段保安路二段,22.9997281,120.2270277
UN201806140049,"2018-06-14 09:39:52",東區,交通運輸,佔用道路,"東區新樓街131巷對面 佔用道路",東區新樓街131巷,22.9891763,120.2142978
UN201806140050,"2018-06-14 09:40:18",北區,違規停車,違規停車,"北區開元路與開南街口 違規停車",北區開元路開南街,22.9997281,120.2270277
UN201806140051,"2018-06-14 09:40:53",東區,交通運輸,佔用道路,"東區裕農路90巷 佔用道路",東區裕農路90巷,22.9997281,120.2270277
UN201806140056,"2018-06-14 09:45:18",新市區,違規停車,違規停車,"新市區復興路67號 違規停車",新市區復興路67號,23.0816192,120.2953317
UN201806140057,"2018-06-14 09:47:04",仁德區,髒亂及汙染,空氣汙染,"仁德區仁義里中山路48巷13號 空汙",仁德區仁義里中山路48巷13號,22.9710327,120.267014
UN201806140059,"2018-06-14 09:48:34",中西區,違規停車,違規停車,"中西區西門路二段118號 違停",中西區西門路二段118號,22.9906046,120.197553
UN201806140062,"2018-06-14 10:06:04",柳營區,髒亂及汙染,空氣汙染,"柳營區工一路*環園西路 空氣汙染",柳營區工一路*環園西路,23.2838243,120.3534764
UN201806140065,"2018-06-14 10:14:58",南區,髒亂及汙染,空氣汙染,"南區健康路二段45號 髒亂及汙染",南區健康路二段45號,22.9997281,120.2270277
UN201806140068,"2018-06-14 10:22:00",佳里區,違規停車,違規停車,"佳里區延平路191號 違規停車",佳里區延平路191號,23.0816192,120.2953317
UN201806140069,"2018-06-14 10:29:43",永康區,違規停車,違規停車,"永康區仁愛街61號 違規停車",永康區仁愛街61號,23.0437218,120.2387395
UN201806140082,"2018-06-14 11:33:25",安南區,違規停車,違規停車,"安南區安和路二段  違規停車",安南區安和路二段,23.2838243,120.3534764
UN201806140088,"2018-06-14 12:04:22",中西區,違規停車,違規停車,"中西區西華南街28號 違規停車",西華南街28號,22.9937832,120.2095151
UN201806140091,"2018-06-14 12:11:04",南區,噪音舉發,妨害安寧,"南區金華路一段352巷133號 妨害安寧",南區金華路一段352巷133號,22.9682566,120.1936668
UN201806140092,"2018-06-14 12:14:29",中西區,交通運輸,佔用道路,"中西區法華街103號 佔用道路",中西區法華街103號,22.9330341,120.2514893
UN201806140093,"2018-06-14 12:26:39",東區,違規停車,違規停車,"東區中華東路與崇善路口 違規停車",中華東路,22.9843977,120.2321694
UN201806140094,"2018-06-14 12:27:07",新市區,違規停車,違規停車,"新市區光華街155號  違規停車",光華街155號,23.1650787,120.1699982
UN201806140096,"2018-06-14 12:30:20",東區,違規停車,違規停車,"東區崇德路285號 違規停車",崇德路285號前,22.976428,120.2237575
UN201806140099,"2018-06-14 12:35:18",六甲區,動物救援,遊蕩犬隻捕捉管制,"六甲區信義街349巷14弄6號 遊蕩犬隻捕捉管制",信義街349巷14弄6號,23.0255553,120.2266081
UN201806140107,"2018-06-14 12:57:19",安平區,違規停車,違規停車,"安平區建平五街22巷15弄37號 違規停車",安平區建平五街22巷15弄37號,22.9883846,120.175353
UN201806140108,"2018-06-14 12:57:47",永康區,違規停車,違規停車,"永康區中華路7巷跟中華路23巷內 違停",永康區中華路7巷中華路23巷,22.9998822,120.2342892
UN201806140109,"2018-06-14 13:02:14",北區,噪音舉發,妨礙安寧,"北區西門路四段101號 噪音舉發",北區西門路四段101號,23.0255553,120.2266081
UN201806140110,"2018-06-14 13:13:53",永康區,違規停車,違規停車,"永康區南台街與南台街13巷交岔路口 違規停車",永康區南台街南台街13巷,23.0220854,120.2235634
UN201806140114,"2018-06-14 13:34:57",中西區,違規停車,違規停車,"中西區民族路三段19號 違規停車",700台南市中西區民族路三段19號,23.0072575,120.186752
UN201806140118,"2018-06-14 13:42:58",中西區,違規停車,違規停車,"中西區民生路二段95號 違規停車",700台南市中西區民生路二段95號,22.9950893,120.1967133
UN201806140120,"2018-06-14 13:53:25",北區,違規停車,違規停車,"北區和緯路二段238號 違規停車",704台南市北區和緯路二段238號,23.012326,120.2066598
UN201806140123,"2018-06-14 14:07:39",東區,違規停車,違規停車,"東區北門路一段280號 違規停車",701台南市東區北門路一段280號,22.9955566,120.2120081
UN201806140124,"2018-06-14 14:13:50",中西區,髒亂及汙染,空氣汙染,"中西區五妃街212號   空污",中西區五妃街212號,22.9826517,120.2050122
UN201806140126,"2018-06-14 14:16:13",玉井區,動物救援,遊蕩犬隻捕捉管制,"玉井區豐里里 遊蕩犬隻捕捉管制",玉井區豐里里,23.1389991,120.4415242
UN201806140130,"2018-06-14 14:20:53",安南區,違規停車,違規停車,"安南區安和路二段282號  違規停車",安南區安和路二段282號,23.012326,120.2066598
UN201806140132,"2018-06-14 14:26:49",永康區,違規停車,違規停車,"永康區正南一街148號  違規停車",永康區正南一街148號,23.0255553,120.2266081
UN201806140133,"2018-06-14 14:28:41",永康區,違規停車,違規停車,"永康區仁愛街61號 違停",永康區仁愛街61號,23.0437218,120.2387395
UN201806140137,"2018-06-14 14:45:26",安平區,路燈故障,9盞以下路燈故障,"安平區華平路158號到178號中間  路燈故障",安平區華平路158號,22.9883593,120.1747539
UN201806140138,"2018-06-14 14:48:59",安平區,路燈故障,9盞以下路燈故障,"安平區中興街61號 路燈故障",安平區中興街61號,22.9997281,120.2270277
UN201806140143,"2018-06-14 15:01:11",永康區,違規停車,違規停車,"永康區南台街3巷12號 違規停車",南台街3巷12號前,23.0216271,120.224243
UN201806140146,"2018-06-14 15:11:06",中西區,髒亂及汙染,市區道路路面油漬,"中西區民權路三段跟臨安路口  路面油漬",中西區民權路三段臨安路,22.9997281,120.2270277
UN201806140152,"2018-06-14 15:38:07",北區,髒亂及汙染,空氣汙染,"北區長北街200號 空氣汙染",北區長北街200號,23.0042162,120.2052417
UN201806140154,"2018-06-14 15:40:12",東區,交通運輸,佔用道路,"東區長榮路二段32巷35號附近  占用道路",東區長榮路二段32巷35號,22.9997281,120.2270277
UN201806140157,"2018-06-14 15:42:39",北區,違規停車,違規停車,"北區開元路501號 違規停車",704台南市北區開元路501號,23.0102471,120.2247606
UN201806140160,"2018-06-14 15:50:42",柳營區,交通運輸,佔用道路,"柳營區中山西路一段127號旁 佔用道路",柳營區中山西路一段127號,23.2790801,120.3215795
UN201806140162,"2018-06-14 16:06:52",安平區,噪音舉發,場所連續噪音,"安平區永華路二段456號   噪音舉發",安平區永華路二段456號,22.990617,120.176803
UN201806140168,"2018-06-14 16:21:09",永康區,違規停車,違規停車,"永康區大武街33號    違規停車",710台南市永康區大武街33號,23.0201967,120.2225314
UN201806140171,"2018-06-14 16:31:47",中西區,違規停車,違規停車,"中西區中山路6號，52號  違規停車",中西區中山路6號,22.9997281,120.2270277
UN201806140173,"2018-06-14 16:33:39",北區,違規停車,違規停車,"北區開元路380號  違規停車",北區開元路380號,23.0100904,120.2247937
UN201806140174,"2018-06-14 16:33:51",中西區,違規停車,違規停車,"中西區中山路與公園路的路口   違規停車",中西區中山路公園路,22.9997281,120.2270277
UN201806140180,"2018-06-14 16:47:41",中西區,違規停車,違規停車,"中西區忠義路二段18號 16號   違規停車",中西區忠義路二段18號,22.991374,120.2029177
UN201806140181,"2018-06-14 16:53:05",中西區,違規停車,違規停車,"中西區和緯路四段426號   違規停車",中西區和緯路四段426號,23.0072575,120.186752
UN201806140182,"2018-06-14 17:02:05",永康區,違規停車,違規停車,"永康區南台街36號 違規停車",710台南市永康區南台街36號,23.022328,120.223467
UN201806140185,"2018-06-14 17:12:39",安平區,路燈故障,9盞以下路燈故障,"安平區健康路三段331號 路燈故障",安平區健康路三段331號,22.9845382,120.169487
UN201806140186,"2018-06-14 17:15:26",安南區,髒亂及汙染,其他汙染舉發,"土城台十七線 其他汙染舉發",台十七線,22.9997281,120.2270277
UN201806140188,"2018-06-14 17:21:59",中西區,違規停車,違規停車,"中西區衛民 街123號與中西區衛民街143巷口 違規停車",衛民街143巷,22.9931593,120.207525
UN201806140190,"2018-06-14 17:31:08",中西區,違規停車,違規停車,"中西區民族路二段63號 違規停車",中西區民族路二段63號,22.9943593,120.209799
UN201806140191,"2018-06-14 17:31:54",中西區,違規停車,違規停車,"中西區民族路二段76-6號 違規停車",中西區民族路二段76-6號,22.9947465,120.2089496
UN201806140192,"2018-06-14 17:32:42",中西區,違規停車,違規停車,"中西區西華南街46號 違規停車",中西區西華南街46號,22.9947465,120.2089496
UN201806140194,"2018-06-14 17:36:52",中西區,違規停車,違規停車,"中西區民族路二段170號 違規停車",中西區民族路二段170號,22.9997281,120.2270277
