UN201806200072,"2018-06-20 09:04:10",安南區,動物救援,犬貓急難救援,"安南區安和路二段211號 動物救援",安南區安和路二段211號,23.0401531,120.21452
UN201806200077,"2018-06-20 09:12:24",永康區,髒亂及汙染,道路散落物,"永康區小東路上往中華路方向  道路散落物",永康區小東路中華路,22.9997281,120.2270277
UN201806200078,"2018-06-20 09:13:51",永康區,髒亂及汙染,空氣汙染,"永康區大同街956號 髒亂及汙染",永康區大同街956號,23.0231729,120.2625836
UN201806200081,"2018-06-20 09:17:10",東區,道路維修,路面下陷、凹陷,"東區東門路二段91號 道路下陷",東區東門路二段91號,22.986027,120.2212995
UN201806200084,"2018-06-20 09:23:48",北區,交通運輸,號誌故障,"北區開元路與長榮路 號誌故障",北區開元路長榮路,23.0076286,120.2207554
UN201806200085,"2018-06-20 09:24:19",麻豆區,動物救援,遊蕩犬隻捕捉管制,"麻豆區總榮里老人關懷中心廣場  捕狗",麻豆區總榮里老人關懷中心,22.9997281,120.2270277
UN201806200086,"2018-06-20 09:28:36",東區,路燈故障,9盞以下路燈故障,"東區文化路100號 路燈故障",東區文化路100號,22.9997281,120.2270277
UN201806200087,"2018-06-20 09:31:00",中西區,違規停車,違規停車,中西區西寧街37號與25號,中西區西寧街37號,22.9997281,120.2270277
UN201806200088,"2018-06-20 09:32:12",安平區,道路維修,路面坑洞,"安平區民權路與安北路交叉口  路面坑洞",安平區民權路安北路,23.0024808,120.1638924
UN201806200092,"2018-06-20 09:41:57",東區,交通運輸,號誌故障,"東區中華東路凱旋路 號誌故障",東區中華東路凱旋路,22.9927027,120.2341142
UN201806200095,"2018-06-20 09:47:30",安南區,違規停車,違規停車,怡安路二段535巷5弄4號旁空地違規停車,怡安路二段535巷5弄4號,22.9997281,120.2270277
UN201806200097,"2018-06-20 09:55:22",安平區,交通運輸,佔用道路,"安平區平通路31號   占用道路",安平區平通路31號,22.9997281,120.2270277
UN201806200099,"2018-06-20 10:04:37",安南區,道路維修,路面坑洞,"安南區長和路一段2巷 路面坑洞",安南區長和路一段2巷,22.9997281,120.2270277
UN201806200102,"2018-06-20 10:07:29",東區,道路維修,路面坑洞,"東區裕農路125號前  路面坑洞",東區裕農路125號,22.9997281,120.2270277
UN201806200105,"2018-06-20 10:20:24",歸仁區,道路維修,路面坑洞,路面坑洞,歸仁區南丁路271巷,22.9997281,120.2270277
UN201806200116,"2018-06-20 10:35:36",安南區,道路維修,路面下陷、凹陷,"安南區頂安街260巷19號前 路面下陷",安南區頂安街260巷19號,22.9997281,120.2270277
UN201806200117,"2018-06-20 10:38:23",永康區,髒亂及汙染,空氣汙染,"永康區大灣路1014號  空污",永康區大灣路1014號,22.9998521,120.2530293
UN201806200127,"2018-06-20 10:54:22",北區,髒亂及汙染,空氣汙染,北區公園路1076號1078號,北區公園路1076號1078號,23.0185961,120.2159412
UN201806200128,"2018-06-20 10:56:19",南區,路燈故障,9盞以下路燈故障,"南區灣裡路722巷13號、25號、29號、31號前  路燈故障",南區灣裡路722巷13號,22.9997281,120.2270277
UN201806200130,"2018-06-20 11:06:01",永康區,髒亂及汙染,空氣汙染,"永康區三村一街122號到130號，到仁愛街  空氣汙染",永康區三村一街122號,23.0431121,120.239517
UN201806200131,"2018-06-20 11:08:59",東區,動物救援,犬貓急難救援,"東區裕永路與平實八街  動物救援",東區裕永路平實八街,22.993737,120.2398003
UN201806200133,"2018-06-20 11:11:44",東區,道路維修,路樹傾倒,"東區北門路二段16號   路樹倒塌",東區北門路二段16號,22.9990247,120.2128868
UN201806200135,"2018-06-20 11:15:09",仁德區,髒亂及汙染,空氣汙染,"仁德區仁義里中山路48巷13號  空氣汙染",仁德區仁義里中山路48巷13號,22.9997281,120.2270277
UN201806200136,"2018-06-20 11:17:11",安南區,動物救援,犬貓急難救援,"安南區公學路五段   貓咪受困",安南區公學路五段,23.0720927,120.1632126
UN201806200140,"2018-06-20 11:25:21",中西區,路燈故障,10盞以上路燈故障,"中西區郡西路35號  路燈故障",中西區郡西路35號,23.1896001,120.1919429
UN201806200146,"2018-06-20 12:06:36",新市區,違規停車,違規停車,"新市區台19甲線234號  違規停車",新市區台19甲線234號,23.0761192,120.2918501
UN201806200147,"2018-06-20 12:10:43",東區,違規停車,違規停車,"東區崇學路131號135號 違規停車",東區崇學路131號135號,22.9965546,120.1985654
UN201806200148,"2018-06-20 12:11:05",中西區,違規停車,違規停車,中西區公園路67號,中西區公園路67號,22.9997281,120.2270277
UN201806200149,"2018-06-20 12:12:29",永康區,違規停車,違規停車,"永康區中山南路台20線南大附中  違規停車",永康區中山南路,23.1786454,120.1430048
UN201806200150,"2018-06-20 12:14:59",北區,違規停車,違規停車,"北區公園路591號  違規停車",北區公園路591號,23.0120512,120.2112312
UN201806200153,"2018-06-20 12:15:58",安平區,違規停車,違規停車,"安平區建平十七街257號  違規停車",安平區建平十七街257號,22.9972046,120.1750165
UN201806200154,"2018-06-20 12:16:34",關廟區,違規停車,違規停車,"關廟區民族街19巷1號 違規停車",關廟區民族街19巷1號,22.9578627,120.3326434
UN201806200155,"2018-06-20 12:17:53",安平區,違規停車,違規停車,"安平區安平路220號  違規停車",安平區安平路220號,22.9997281,120.2270277
UN201806200158,"2018-06-20 12:25:36",安平區,違規停車,違規停車,"安平區永華路二段500號  違規停車",安平區永華路二段500號,22.9904803,120.1753267
UN201806200159,"2018-06-20 12:26:35",佳里區,道路維修,路面坑洞,"佳里區台19線蕭壟文化園區 路面坑洞",佳里區台19線蕭壟文化園區,23.173179,120.1792288
UN201806200160,"2018-06-20 12:29:56",中西區,違規停車,違規停車,"中西區國華街三段  違規停車",中西區國華街三段,22.9965546,120.1985654
UN201806200161,"2018-06-20 12:33:41",新營區,違規停車,違規停車,"新營區民生路163巷15號 紅線違停",新營區民生路163巷15號,23.3088319,120.3074657
UN201806200165,"2018-06-20 12:36:44",北區,道路維修,路面坑洞,"北區實踐街103巷接近平交道 路面坑洞",北區實踐街103巷,22.9988756,120.1950117
UN201806200166,"2018-06-20 12:37:24",安南區,噪音舉發,妨害安寧,"安南區安和路三段227號 噪音舉發",安南區安和路三段227號,23.0491748,120.2183686
UN201806200167,"2018-06-20 12:43:35",永康區,髒亂及汙染,道路散落物,"永康區南143鄉道2號  動物屍體",永康區南143鄉道2號,22.9965546,120.1985654
UN201806200170,"2018-06-20 12:52:37",安定區,動物救援,遊蕩犬隻捕捉管制,"安定區油車里62之5號南安國小旁 捕犬",安定區油車里62之5號南安國小,23.0981728,120.2249417
UN201806200171,"2018-06-20 12:58:45",麻豆區,違規停車,違規停車,"麻豆區興中路62之1號 違規停車",麻豆區興中路62之1號,23.1837973,120.2623782
UN201806200173,"2018-06-20 13:06:55",中西區,違規停車,違規停車,"中西區民族路二段92號  違規停車",中西區民族路二段92號,22.9954639,120.2063472
UN201806200175,"2018-06-20 13:08:47",北區,違規停車,違規停車,"北區區開南街與東豐路451巷  違規停車",北區區開南街與東豐路451巷,23.0058051,120.227546
UN201806200176,"2018-06-20 13:09:26",中西區,違規停車,違規停車,"中西區民族路二段80-2號   違規停車",中西區民族路二段80-2號,22.9997281,120.2270277
UN201806200180,"2018-06-20 13:17:26",永康區,違規停車,違規停車,"永康區中山北路264巷及164巷口  違規停車",永康區中山北路264巷,22.9997281,120.2270277
UN201806200182,"2018-06-20 13:22:54",中西區,違規停車,違規停車,"中西區永福路二段41號  違規停車",中西區永福路二段41號,22.9911514,120.2004453
UN201806200184,"2018-06-20 13:25:48",永康區,違規停車,違規停車,"永康區中華西街122巷33號對面  違規停車",永康區中華西街122巷33號,22.981477,120.1830353
UN201806200186,"2018-06-20 13:28:09",新市區,違規停車,違規停車,"新市區綠園一街   違規停車",新市區綠園一街,23.0737579,120.2905267
UN201806200188,"2018-06-20 13:36:50",永康區,道路維修,路面坑洞,"永康區大灣東路299號前 坑洞",永康區大灣東路299號,22.9997281,120.2270277
UN201806200196,"2018-06-20 13:49:06",中西區,髒亂及汙染,其他汙染舉發,"中西區林森路*永福路  貓屍",中西區林森路永福路,22.9932292,120.201008
UN201806200198,"2018-06-20 13:56:04",佳里區,違規停車,違規停車,"佳里區光復路239號 違停",佳里區光復路239號,23.1611213,120.1746079
UN201806200208,"2018-06-20 14:07:43",永康區,髒亂及汙染,空氣汙染,"永康區文賢街68巷1號  空氣污染",大灣高中,23.006482,120.273561
UN201806200211,"2018-06-20 14:17:23",永康區,動物救援,遊蕩犬隻捕捉管制,"永康區中正北路1069號  捕狗",永康區中正北路1069號,23.0538431,120.2714998
UN201806200214,"2018-06-20 14:20:38",東區,噪音舉發,妨害安寧,"東區林森路一段153巷17號地下一樓 妨害安寧",東區林森路一段153巷17號,22.983545,120.214616
UN201806200215,"2018-06-20 14:26:42",安南區,道路維修,路面坑洞,"安南區長溪街二段464號  坑洞",安南區長溪街二段464號,23.052817,120.20249
UN201806200217,"2018-06-20 14:34:25",南區,違規停車,違規停車,"南區大同路二段136巷10號後方   違停",南區大同路二段136巷10號,22.9791228,120.2116797
UN201806200219,"2018-06-20 14:38:36",六甲區,道路維修,路面坑洞,"六甲區中華路95號前   路面坑洞",六甲區中華路95號前,22.9997281,120.2270277
UN201806200226,"2018-06-20 14:52:55",中西區,違規停車,違規停車,中西區衛民街156號騎樓違規停車,中西區衛民街156號,22.9936362,120.2071568
UN201806200227,"2018-06-20 14:54:25",中西區,違規停車,違規停車,"中西區中山路61號、73號的騎樓 違規停車",中西區中山路61號,22.9997281,120.2270277
UN201806200230,"2018-06-20 15:00:07",北區,髒亂及汙染,道路散落物,"北區東豐路85巷82號  路面散落物",北區東豐路85巷82號,22.9997281,120.2270277
UN201806200231,"2018-06-20 15:06:11",中西區,違規停車,違規停車,"中西區西華南街32號 違規停車",中西區西華南街32號,22.9997281,120.2270277
UN201806200237,"2018-06-20 15:15:45",南區,髒亂及汙染,空氣汙染,"南區新都路256巷1號及293號  空氣汙染",南區新都路256巷1號,22.9997281,120.2270277
UN201806200238,"2018-06-20 15:15:58",歸仁區,道路維修,路面坑洞,"歸仁區媽廟里和順路一段122號  路面坑洞",歸仁區媽廟里和順路一段122號,22.9932344,120.2900397
UN201806200240,"2018-06-20 15:21:27",永康區,道路維修,路面坑洞,"永康區裕德街跟崑大路  路面坑洞",永康區裕德街崑大路,22.9997281,120.2270277
UN201806200252,"2018-06-20 16:00:29",中西區,違規停車,違規停車,"中西區中山路民族路 違規停車",中西區中山路民族路,22.9947427,120.2085702
UN201806200253,"2018-06-20 16:04:54",北區,違規停車,違規停車,"704台南市北區開元路501號 違規停車",704台南市北區開元路501號,23.0102471,120.2247606
UN201806200257,"2018-06-20 16:17:11",永康區,違規停車,違規停車,"710台南市永康區正南一街148號 違規停車",710台南市永康區正南一街148號,23.0255553,120.2266081
UN201806200259,"2018-06-20 16:18:56",安平區,違規停車,違規停車,"安平區國平路*永華路星巴克前 違規停車",安平區國平路*永華路,22.9997281,120.2270277
UN201806200261,"2018-06-20 16:24:13",東區,交通運輸,號誌故障,"東區林森路一段遠東路 號誌故障",東區林森路一段遠東路,22.9997281,120.2270277
UN201806200262,"2018-06-20 16:24:53",北區,路燈故障,9盞以下路燈故障,"北區長榮路五段376號及383巷口 路燈故障",北區長榮路五段376號,23.0131973,120.2150843
UN201806200264,"2018-06-20 16:26:05",善化區,交通運輸,佔用道路,"善化區南科九路  違規設攤",善化區南科九路,23.1159047,120.2690878
UN201806200267,"2018-06-20 16:35:41",中西區,違規停車,違規停車,"700台南市中西區民族路三段19號 違規停車",700台南市中西區民族路三段19號,23.0255553,120.2266081
UN201806200268,"2018-06-20 16:36:40",中西區,違規停車,違規停車,"中西區民族路二段80-2號 違規停車",中西區民族路二段80-2號,22.9997281,120.2270277
UN201806200271,"2018-06-20 16:46:15",歸仁區,道路維修,路面坑洞,"歸仁區中正南路二段11號   路面坑洞",歸仁區中正南路二段11號,22.9289483,120.2777088
UN201806200274,"2018-06-20 16:50:46",中西區,違規停車,違規停車,"700台南市中西區中山路209號 違規停車",700台南市中西區中山路209號,22.9968458,120.2112234
UN201806200275,"2018-06-20 16:52:22",北區,民生管線,漏水、停水、消防栓漏水或損壞,"北區文賢一路300巷13號  路面漏水",北區文賢一路300巷13號,23.0116876,120.1959266
UN201806200276,"2018-06-20 16:53:32",南區,違規停車,違規停車,南區夏林路224號違規停車,南區夏林路224號,22.9997281,120.2270277
UN201806200277,"2018-06-20 16:54:32",南區,違規停車,違規停車,"南區健康路二段170號 違規停車",南區健康路二段170號,22.9817077,120.1929762
UN201806200278,"2018-06-20 16:55:47",中西區,違規停車,違規停車,中西區衛民街北門路違規停車,中西區衛民街北門路,22.9927797,120.2116965
UN201806200283,"2018-06-20 17:07:23",永康區,噪音舉發,場所連續噪音,"永康區復華三街76巷2號  噪音舉發",永康區復華三街76巷2號,23.0098096,120.2457197
UN201806200284,"2018-06-20 17:08:12",中西區,違規停車,違規停車,"中西區健康路一段322號 違規停車",中西區健康路一段322號,22.9997281,120.2270277
UN201806200285,"2018-06-20 17:09:20",麻豆區,道路維修,路面坑洞,"麻豆區北勢里北勢寮70之11號 道路坑洞",麻豆區北勢里北勢寮70之11號,23.2211402,120.2271399
UN201806200288,"2018-06-20 17:13:31",北區,違規停車,違規停車,"北區北園街20號 違規停車",北區北園街20號,22.9927797,120.2116965
UN201806200289,"2018-06-20 17:15:45",安平區,違規停車,違規停車,"安平區永華四街17巷  違規停車",安平區永華四街17巷,22.98803,120.1793094
UN201806200291,"2018-06-20 17:22:04",東區,違規停車,違規停車,"東區東光路和東平路交叉口 違規停車",東區東光路和東平路,22.995081,120.2314079
UN201806200294,"2018-06-20 17:29:42",中西區,違規停車,違規停車,"中西區武聖路47號到63號 違規停車",中西區武聖路47號,23.0053565,120.1922981
UN201806200296,"2018-06-20 17:38:43",北區,道路維修,路面坑洞,"北區公園北路，台南二中門口右側 路面坑洞",北區公園北路台南二中,22.9997281,120.2270277
UN201806200297,"2018-06-20 17:39:50",安平區,路燈故障,9盞以下路燈故障,"安平區健康路三段331號  路燈故障",安平區健康路三段331號,22.9845382,120.169487
UN201806200298,"2018-06-20 17:48:04",永康區,違規停車,違規停車,"永康區大灣路40巷75弄 違規停車",永康區大灣路40巷75弄,23.013552,120.2688365
UN201806200299,"2018-06-20 17:48:58",永康區,道路維修,人孔蓋凹陷坑洞,"永康區仁愛街永安路 路面坑洞",永康區仁愛街永安路,22.98803,120.1793094
UN201806200300,"2018-06-20 17:53:27",麻豆區,道路維修,路面坑洞,"麻豆區171線道彎進蔥子寮震安宮小路之前 路面坑洞",麻豆區171線道,23.1870514,120.2382768
UN201806200302,"2018-06-20 17:59:01",北區,違規停車,違規停車,違規停車,北區和緯路三段322號,23.0101369,120.1957441
UN201806200304,"2018-06-20 18:01:27",東區,違規停車,違規停車,"東區仁和路*崇善十一街 違規停車",東區仁和路*崇善十一街,22.9712415,120.2331141
UN201806200305,"2018-06-20 18:05:09",柳營區,動物救援,犬貓急難救援,"柳營區旭山里60號  動物救援",柳營區旭山里60號,23.2652659,120.3931511
UN201806200308,"2018-06-20 18:08:26",東區,違規停車,違規停車,"東區林森路二段91巷34號 違規停車",東區林森路二段91巷34號,23.013552,120.2688365
UN201806200310,"2018-06-20 18:10:14",中西區,道路維修,路樹傾倒,"中西區臨安路一段底過民生路近臨安橋 路樹傾倒",中西區臨安路一段*民生路,22.9972046,120.1750165
UN201806200311,"2018-06-20 18:12:14",新市區,違規停車,違規停車,"新市區復興路67號 違規停車",新市區復興路67號,23.0816192,120.2953317
UN201806200312,"2018-06-20 18:14:00",新市區,違規停車,違規停車,"新市區中正路166號 違規停車",新市區中正路166號,23.0744447,120.2915017
UN201806200313,"2018-06-20 18:14:20",中西區,違規停車,違規停車,"中西區西華南街32號 違規停車",中西區西華南街32號,22.9997281,120.2270277
UN201806200315,"2018-06-20 18:16:11",新市區,違規停車,違規停車,"新市區光華街155號 違規停車",新市區光華街155號,23.0772862,120.2955178
UN201806200316,"2018-06-20 18:18:08",新市區,違規停車,違規停車,"新市區仁愛街306號 違規停車",新市區仁愛街306號,23.0772753,120.2939266
UN201806200317,"2018-06-20 18:19:09",中西區,騎樓舉發,騎樓舉發,"中西區青年路靠近萬昌街的騎樓 騎樓舉發",中西區青年路*萬昌街,22.9997281,120.2270277
UN201806200318,"2018-06-20 18:19:09",新市區,違規停車,違規停車,"新市區仁愛街217號 違規停車",新市區仁愛街217號,23.013552,120.2688365
UN201806200319,"2018-06-20 18:21:25",中西區,違規停車,違規停車,"中西區衛民街99、60號 違規停車",中西區衛民街99、60號,22.9929636,120.2086534
UN201806200320,"2018-06-20 18:22:02",中西區,違規停車,違規停車,"中西區府連路117號 違規停車",中西區府連路117號,22.9837162,120.2105031
UN201806200321,"2018-06-20 18:23:01",新市區,違規停車,違規停車,"新市區中正路323巷54號 違規停車",新市區中正路323巷54號,23.0807545,120.293642
UN201806200323,"2018-06-20 18:23:37",北區,違規停車,違規停車,"北區公園南路379號  違停機車道",北區公園南路379號,23.0027823,120.2017577
UN201806200324,"2018-06-20 18:24:05",新市區,違規停車,違規停車,"新市區和平街168巷10號 違規停車",新市區和平街168巷10號,22.9965546,120.1985654
UN201806200326,"2018-06-20 18:28:30",柳營區,髒亂及汙染,空氣汙染,"柳營區環園東路二段8號  空氣汙染",柳營區環園東路二段8號,23.0772753,120.2939266
UN201806200327,"2018-06-20 18:33:30",北區,道路維修,路面坑洞,"北區金華路四段/北區文賢路986之2號 路面坑洞",北區金華路四段,22.9988756,120.1950117
UN201806200329,"2018-06-20 18:36:06",東區,違規停車,違規停車,"東區怡東路33號 違規停車",東區怡東路33號,22.9913531,120.2274665
UN201806200330,"2018-06-20 18:39:15",安平區,道路維修,路面下陷、凹陷,"安平區建平路  路面凹陷",安平區建平路,22.9899758,120.1826244
UN201806200333,"2018-06-20 18:46:54",中西區,違規停車,違規停車,"中西區民族路二段88號 違規停車",中西區民族路二段88號,22.995573,120.2064482
UN201806200336,"2018-06-20 18:52:54",歸仁區,路燈故障,9盞以下路燈故障,"歸仁區民生八街21巷1弄11號對面 路燈故障",歸仁區民生八街21巷1弄11號,22.9965546,120.1985654
UN201806200338,"2018-06-20 18:53:57",南區,路燈故障,9盞以下路燈故障,"南區大同路二段482巷143號 路燈故障",南區大同路二段482巷143號,22.9733608,120.2104464
UN201806200339,"2018-06-20 18:55:12",中西區,騎樓舉發,騎樓舉發,"中西區北門路一段 騎樓舉發",中西區北門路一段,22.9932613,120.2117242
UN201806200340,"2018-06-20 18:58:23",北區,違規停車,違規停車,"北區西門路四段374號花旗銀行口  違規停車",北區西門路四段374號花旗銀行,23.014464,120.209956
UN201806200341,"2018-06-20 19:01:04",仁德區,道路維修,路面坑洞,"仁德區中山路530巷3號 路面坑洞",中山路530巷3號,22.9717962,120.253201
UN201806200342,"2018-06-20 19:02:48",南區,路燈故障,9盞以下路燈故障,"南區中華西路一段137巷85號 路燈故障",南區中華西路一段137巷85號,22.9817457,120.1830725
UN201806200345,"2018-06-20 19:08:08",歸仁區,路燈故障,9盞以下路燈故障,歸仁區中山路三段69號,歸仁區中山路三段69號,22.9677167,120.2863203
UN201806200346,"2018-06-20 19:08:19",安平區,路燈故障,10盞以上路燈故障,"安平區漁光里 路燈故障",安平區漁光里,22.9768729,120.1598341
UN201806200348,"2018-06-20 19:13:51",七股區,路燈故障,10盞以上路燈故障,"七股區城內里98之1  路燈故障'",七股區城內里98之1號,23.1786454,120.1430048
UN201806200349,"2018-06-20 19:17:12",佳里區,路燈故障,10盞以上路燈故障,"佳里區佳化里214號佳興國小 10盞以上路燈故障不亮",佳里區佳化里214號佳興國小,23.1896001,120.1919429
UN201806200354,"2018-06-20 19:33:52",仁德區,道路維修,路面坑洞,"仁德區高速公路下來接中正路(往關廟方向)的十字路口 路面坑洞",仁德區,22.9401228,120.2397336
UN201806200356,"2018-06-20 19:36:53",新營區,道路維修,路面掏空、塌陷,"新營區中正路39巷口  路面掏空",新營區中正路39巷口,22.9768729,120.1598341
UN201806200357,"2018-06-20 19:43:24",東區,路燈故障,9盞以下路燈故障,"東區德東街235巷118弄70號 3盞路燈故障不亮",東區德東街235巷118弄70號,23.0234082,120.1940497
UN201806200358,"2018-06-20 19:50:52",永康區,動物救援,犬貓急難救援,"永康區大灣路770之2號  動物救援",永康區大灣路770之2號,23.0005161,120.259738
UN201806200359,"2018-06-20 19:53:04",安平區,路燈故障,9盞以下路燈故障,"安平區建平五街22巷36弄   路燈故障",安平區建平五街22巷36弄,22.9882482,120.1808292
UN201806200360,"2018-06-20 19:55:47",北區,路燈故障,9盞以下路燈故障,"北區南園街127巷151弄1號到13號  路燈故障",北區南園街127巷151弄1號,23.0090064,120.2284896
UN201806200361,"2018-06-20 19:58:19",新市區,違規停車,違規停車,"新市區中正路台19甲線166號 違規停車",新市區中正路台19甲線166號,23.1061828,120.2946498
UN201806200362,"2018-06-20 19:59:04",南區,違規停車,違規停車,"南區永成路二段881巷72-1號 違規停車",南區永成路二段881巷72-1號,22.9615844,120.1938828
UN201806200363,"2018-06-20 20:04:34",新市區,違規停車,違規停車,"新市區中正路26號 違規停車",新市區中正路26號,23.0707491,120.2923033
UN201806200364,"2018-06-20 20:05:32",新市區,違規停車,違規停車,"新市區中正路台19甲線325號 違規停車",新市區中正路台19甲線325號,23.1061828,120.2946498
UN201806200365,"2018-06-20 20:13:34",安平區,違規停車,違規停車,"安平區國平路與國平路552巷口 違規停車",安平區國平路552巷,22.9964752,120.173249
UN201806200370,"2018-06-20 20:19:59",永康區,民生管線,漏水、停水、消防栓漏水或損壞,"永康區永大路三段618巷近龍中街，龍中公園外道路 民生管線",永康區永大路三段618巷近龍中街,23.0384238,120.2604849
UN201806200372,"2018-06-20 20:23:14",安南區,道路維修,路面坑洞,"安南區安寧街88號前 道路維修",安南區安寧街88號,23.0234082,120.1940497
UN201806200373,"2018-06-20 20:24:32",善化區,髒亂及汙染,空氣汙染,"善化區大同路354號 空氣汙染",善化區大同路354號,23.1312672,120.2906923
UN201806200378,"2018-06-20 20:39:08",新營區,違規停車,違規停車,"新營區復興路511巷75弄口 違規停車",新營區復興路511巷75弄口,23.3040705,120.2970688
UN201806200380,"2018-06-20 20:46:38",東區,違規停車,違規停車,"東區林森路二段91巷34號 違規停車",東區林森路二段91巷34號,23.013552,120.2688365
UN201806200382,"2018-06-20 21:14:50",中西區,違規停車,違規停車,"中西區民族路二段76號 違規停車",民族路二段76號,23.0234082,120.1940497
UN201806200386,"2018-06-20 21:31:12",永康區,違規停車,違規停車,"永康區中華西街122巷33號對面 違規停車",中華西街122巷33號,23.0155821,120.2276587
UN201806200388,"2018-06-20 21:39:18",新市區,道路維修,路面坑洞,"新市大社往山上方向的南140線 路面坑洞",新市區大社,23.093031,120.316525
UN201806200389,"2018-06-20 21:42:17",安南區,髒亂及汙染,空氣汙染,"安南區安中路*安明路 空氣汙染",安南區安中路*安明路,23.0610705,120.1340032
UN201806200390,"2018-06-20 21:43:12",麻豆區,道路維修,路面坑洞,"麻豆區油車里79-35號 路面坑洞",麻豆區油車里79-35號,22.9903382,120.2230668
UN201806200391,"2018-06-20 21:47:16",南區,路燈故障,9盞以下路燈故障,"南區惠南街52號 路燈故障",南區惠南街52號,22.9997281,120.2270277
UN201806200392,"2018-06-20 22:10:27",安南區,噪音舉發,妨害安寧,"安南區北安路二段526號，一品來小吃部 妨害安寧",安南區北安路二段526號,23.0234082,120.1940497
UN201806200399,"2018-06-20 22:30:36",安平區,路燈故障,10盞以上路燈故障,"安平區建平三街17號附近 路燈不亮",安平區建平三街17號,23.0610705,120.1340032
UN201806200401,"2018-06-20 22:35:45",安南區,噪音舉發,妨害安寧,"安南區海環街615號 妨害安寧",安南區海環街615號,22.9903382,120.2230668
UN201806200402,"2018-06-20 22:37:55",東區,路燈故障,10盞以上路燈故障,"東區崇興路 路燈故障",崇興路,22.9684533,120.221693
