UN201806200403,"2018-06-20 22:45:06",永康區,髒亂及汙染,道路散落物,"永康區中華路 道路散落物",永康區中華路,22.9997281,120.2270277
UN201806200405,"2018-06-20 23:02:33",中西區,動物救援,犬貓急難救援,"中西區成功路147號 動物救援",中西區成功路147號,22.9980348,120.2064968
UN201806200406,"2018-06-20 23:06:44",東區,噪音舉發,妨害安寧,"東區北門路二段16號 妨害安寧",東區北門路二段16號,22.9990247,120.2128868
UN201806200409,"2018-06-20 23:20:01",永康區,違規停車,違規停車,"永康區新行街122巷10弄1號 違規停車",新行街122巷10弄1號,23.0396975,120.2416185
UN201806200410,"2018-06-20 23:21:02",永康區,違規停車,違規停車,"永康區新民街16巷及新民街交界 違規停車",新民街16巷,22.9903382,120.2230668
UN201806200411,"2018-06-20 23:21:55",永康區,違規停車,違規停車,"永康區新民街218巷接新中街 違規停車",新民街218巷,22.9903382,120.2230668
UN201806200412,"2018-06-20 23:22:05",南區,噪音舉發,場所連續噪音,"南區金華路二段76號 場所連續噪音",南區金華路二段76號,22.9684533,120.221693
UN201806200413,"2018-06-20 23:24:05",永康區,髒亂及汙染,空氣汙染,"永康區永大一路28號 空氣汙染",永大一路28號,22.9997281,120.2270277
UN201806200414,"2018-06-20 23:27:48",安南區,路燈故障,9盞以下路燈故障,"安南區怡安路一段328巷25號 路燈故障",安南區怡安路一段328巷25號,23.0382671,120.211766
UN201806200415,"2018-06-20 23:29:04",安南區,路燈故障,10盞以上路燈故障,"安南區北安路三段與台江大道 路燈故障",安南區北安路三段,23.0468532,120.2088752
UN201806200416,"2018-06-20 23:37:26",南區,路燈故障,9盞以下路燈故障,"南區惠南街76號前 路燈不亮",南區惠南街76號,22.9997281,120.2270277
UN201806200418,"2018-06-20 23:48:08",北區,噪音舉發,妨害安寧,"北區公園路北路191號 妨害安寧",北區公園路北路191號,22.9997281,120.2270277
UN201806200419,"2018-06-20 23:48:22",東區,道路維修,路面掏空、塌陷,"東區東寧路與長榮路交叉口 路面下陷",東區東寧路長榮路,23.0396975,120.2416185
UN201806210002,"2018-06-21 00:03:24",安平區,路燈故障,9盞以下路燈故障,"安平區文平路和慶平路口 路燈不亮",安平區文平路慶平路,22.9997281,120.2270277
UN201806210003,"2018-06-21 00:13:57",新市區,違規停車,違規停車,"新市區台19甲線67號（復興路），包手幸福豆漿和7-11門口轉角 違規停車",新市區台19甲線67號,22.9997281,120.2270277
UN201806210006,"2018-06-21 00:32:21",安南區,路燈故障,9盞以下路燈故障,"安南區安中路四段4巷48弄24號前 路燈故障",安南區安中路4段4巷48弄24號,23.051741,120.1730087
UN201806210007,"2018-06-21 00:35:38",永康區,髒亂及汙染,空氣汙染,"永康區三村一街122到130號附近 空氣污染",永康區三村一街122號,23.0383765,120.3074132
UN201806210008,"2018-06-21 00:44:40",南區,違規停車,違規停車,"南區文南里建南路145號 違規停車",台南市南區文南里建南路145號,22.984749,120.1901961
UN201806210011,"2018-06-21 01:36:46",仁德區,噪音舉發,妨害安寧,"仁德區文華路三段489號 妨害安寧",仁德區文華路三段489號,22.9718491,120.2434124
UN201806210012,"2018-06-21 01:43:26",安平區,路燈故障,9盞以下路燈故障,"安平區平通路 路燈不亮＆路樹傾斜",安平區平通路,22.9930147,120.1753763
UN201806210013,"2018-06-21 02:30:32",永康區,髒亂及汙染,空氣汙染,"永康區大灣路1014號，鍵誠紡織廠 空氣污染",永康區大灣路1014號,22.9997281,120.2270277
UN201806210014,"2018-06-21 03:27:02",善化區,髒亂及汙染,道路散落物,"善化區星巴克前，路中間 狗屍",善化區大同路2號,23.1269796,120.2938708
UN201806210015,"2018-06-21 05:15:26",永康區,道路維修,路面坑洞,"永康區和平東路153號附近 路面坑洞",永康區和平東路153號,22.9997281,120.2270277
UN201806210021,"2018-06-21 07:02:19",永康區,交通運輸,交通疏導,"永康區大灣交流道，北上右轉閘道口附近平面道路 交通疏導",永康區大灣交流道,23.0025234,120.2478459
UN201806210022,"2018-06-21 07:08:59",永康區,髒亂及汙染,環境髒亂,"永康區中華路23巷府城諾貝爾大樓 髒亂及汙染",永康區中華路23巷府城諾貝爾大樓,22.9930147,120.1753763
UN201806210024,"2018-06-21 07:11:43",中西區,路燈故障,9盞以下路燈故障,"中西區健康路一段30號和42號前 路燈不亮",中西區健康路一段30號,22.9814286,120.2109303
UN201806210027,"2018-06-21 07:25:22",南區,道路維修,路面下陷、凹陷,"南區明興路611巷茶的摩手,紅綠燈旁路面下陷",南區明興路611巷,22.9412465,120.1828978
UN201806210030,"2018-06-21 07:38:08",仁德區,交通運輸,交通疏導,仁德區太子路高速公路便道,仁德區太子路高速公路,22.984749,120.1901961
UN201806210031,"2018-06-21 07:40:24",新市區,違規停車,違規停車,"新市區復興路67號  違規停車",新市區復興路67號,23.0816192,120.2953317
UN201806210032,"2018-06-21 07:42:02",新市區,違規停車,違規停車,"新市區復興路101號 違規停車",新市區復興路101號,22.9997281,120.2270277
UN201806210034,"2018-06-21 07:48:44",善化區,違規停車,違規停車,"善化區光明路68號 違規停車",善化區光明路68號,23.1306332,120.2944782
UN201806210035,"2018-06-21 07:56:53",永康區,道路維修,路面坑洞,"永康區永安路105巷口  坑洞",永康區永安路105巷,23.0434329,120.2453897
UN201806210039,"2018-06-21 08:07:08",東區,交通運輸,交通疏導,"東區裕農路往太子路方向 交通疏導",東區裕農路太子路,22.9997281,120.2270277
UN201806210040,"2018-06-21 08:13:37",永康區,交通運輸,交通疏導,"永康區小東路與中華路 交通疏導",永康區小東路中華路,22.9983426,120.2346331
UN201806210042,"2018-06-21 08:14:52",安南區,違規停車,違規停車,"安南區安中路四段290巷80弄41號 違停",安南區安中路四段290巷80弄41號,22.9997281,120.2270277
UN201806210045,"2018-06-21 08:24:02",柳營區,道路維修,路面坑洞,"柳營區外環道 路面坑洞",柳營區外環道,23.0434329,120.2453897
UN201806210049,"2018-06-21 08:30:08",永康區,違規停車,違規停車,"永康區南台街36號   違規停車",永康區南台街36號,23.022328,120.223467
UN201806210050,"2018-06-21 08:30:30",安南區,道路維修,路面下陷、凹陷,"安南區北安路二段往一段方向  路面下陷",安南區北安路二段,23.0310266,120.20454
UN201806210051,"2018-06-21 08:30:44",北區,道路維修,路面坑洞,"北區北園街87巷151弄20號 路面坑洞",北區北園街87巷151弄20號,23.0816192,120.2953317
UN201806210052,"2018-06-21 08:36:34",安南區,違規停車,違規停車,"安南區安和路一段393號前  違規停車",安南區安和路一段393號,23.0347949,120.2129425
UN201806210055,"2018-06-21 08:47:11",永康區,交通運輸,佔用道路,"永康區中華路911號.913號.915號 佔用道路",永康區中華路911號,23.0434329,120.2453897
UN201806210059,"2018-06-21 08:58:52",六甲區,道路維修,路面坑洞,"六甲區165線道   道路維修",六甲區165線道,23.022328,120.223467
UN201806210063,"2018-06-21 09:17:15",永康區,民生管線,電信孔蓋鬆動、電信線路掉落、電信桿傾倒,"永康區大灣路99號 孔蓋鬆動",永康區大灣路99號,22.9997281,120.2270277
UN201806210064,"2018-06-21 09:19:43",中西區,違規停車,,"中西區中山 路61號、71,73號/81號到111號   違停","中山 路61號71號73號81號111號",23.3063799,120.321692
UN201806210070,"2018-06-21 09:25:05",中西區,違規停車,違規停車,"中西區民族路二段66號 違規停車",中西區民族路二段66號,22.9946307,120.210031
UN201806210073,"2018-06-21 09:29:27",中西區,髒亂及汙染,市區道路路面油漬,"中西區府前路二段370號 路面油漬",中西區府前路二段370號,22.9925359,120.1884232
UN201806210074,"2018-06-21 09:29:52",安平區,噪音舉發,妨礙安寧,"安平區怡平路442巷16號1樓-1  妨礙安寧",安平區怡平路442巷16號1樓-1,23.3063799,120.321692
UN201806210076,"2018-06-21 09:31:13",北區,違規停車,違規停車,"北區開元路501號 違規停車",北區開元路501號,23.0102471,120.2247606
UN201806210083,"2018-06-21 09:45:01",安平區,違規停車,違規停車,"安平區永華路二段與育平路 違規停車",安平區永華路二段育平路,22.9914751,120.1673528
UN201806210085,"2018-06-21 09:52:17",安南區,交通運輸,號誌故障,"安南區功安一街和安中路三段交叉處  號誌故障",安南區功安一街安中路三段,23.0477126,120.1813541
UN201806210098,"2018-06-21 10:16:02",北區,道路維修,路面下陷、凹陷,北區海安路三段219巷巷口　路面下陷,北區海安路三段219巷,22.996748,120.2219242
UN201806210102,"2018-06-21 10:20:49",永康區,噪音舉發,場所連續噪音,"永康區大橋一街53號  噪音/環境汙染",永康區大橋一街53號,23.0168384,120.2270026
UN201806210109,"2018-06-21 10:36:35",永康區,噪音舉發,場所連續噪音,"永康區大橋一街55號附近  施工噪音",永康區大橋一街55號,23.0169373,120.2271604
UN201806210110,"2018-06-21 10:36:39",永康區,動物救援,犬貓急難救援,"永康區鹽行路204巷21號  動物救援",永康區鹽行路204巷21號,23.0428606,120.2314172
UN201806210115,"2018-06-21 10:45:20",中西區,道路維修,路面坑洞,"中西區開山路235巷8號 路面坑洞",中西區開山路235巷8號,22.986463,120.2101153
UN201806210120,"2018-06-21 10:57:16",中西區,髒亂及汙染,空氣汙染,"中西區大勇街101號 空氣汙染",中西區大勇街101號,22.9899039,120.1928922
UN201806210121,"2018-06-21 11:01:09",安平區,髒亂及汙染,空氣汙染,"安平區安北路427號  空氣汙染",安平區安北路427號,22.999983,120.1535491
UN201806210126,"2018-06-21 11:11:42",佳里區,交通運輸,佔用道路,"佳里區新生東路9號 佔用道路",佳里區新生東路9號,23.1622132,120.1823087
UN201806210127,"2018-06-21 11:14:21",安南區,路燈故障,9盞以下路燈故障,"安南區郡安路五段25號 /府安路五段119巷25號 路燈故障",安南區郡安路五段25號,22.9997281,120.2270277
UN201806210128,"2018-06-21 11:14:34",東區,道路維修,路樹傾倒,"東區崇賢三路22號前方 路樹傾倒",東區崇賢三路22號,22.9997281,120.2270277
UN201806210131,"2018-06-21 11:28:52",中西區,違規停車,違規停車,"中西區康樂街上，民族路*民權路 違規停車",中西區康樂街*民族路*民權路,22.9899039,120.1928922
UN201806210133,"2018-06-21 11:31:47",東區,違規停車,違規停車,"東區東榮接115巷2號 違停",東區東榮接115巷2號,22.9928984,120.1826111
UN201806210138,"2018-06-21 11:35:21",安南區,道路維修,路面坑洞,"安南區同安路135號前 路面坑洞",安南區同安路135號,23.0408767,120.1904162
UN201806210143,"2018-06-21 11:43:32",北區,路燈故障,9盞以下路燈故障,"北區長榮路五段384號對面   路燈不亮",北區長榮路五段384號,23.0132482,120.2149252
UN201806210144,"2018-06-21 11:44:39",東區,道路維修,路面坑洞,"東區裕農路991巷 道路維修",東區裕農路991巷,22.9914071,120.246985
UN201806210146,"2018-06-21 11:46:24",北區,道路維修,路面坑洞,"北區臨安路二段91巷巷口   坑洞",北區臨安路二段91巷,23.1622132,120.1823087
UN201806210147,"2018-06-21 11:46:34",永康區,道路維修,路面坑洞,"永康區永安路與 路面坑洞",永康區永安路,23.0462836,120.2437066
UN201806210148,"2018-06-21 11:46:54",永康區,違規停車,違規停車,"永康區復華六街67巷18號  違規停車",永康區復華六街67巷18號,23.0408767,120.1904162
UN201806210150,"2018-06-21 11:49:12",中西區,違規停車,違規停車,"中西區永華路一段38號 違規停車",中西區永華路一段38號,22.987566,120.1961826
UN201806210151,"2018-06-21 11:52:05",中西區,騎樓舉發,騎樓舉發,"中西區永華路一段36號 騎樓舉發",中西區永華路一段36號,22.9997281,120.2270277
UN201806210152,"2018-06-21 11:54:14",中西區,違規停車,違規停車,中西區永華路一段36號違規停車,中西區永華路一段36號,22.9997281,120.2270277
UN201806210157,"2018-06-21 12:02:15",南區,髒亂及汙染,,"南區明興路550號-1 空氣汙染",南區明興路550號-1,23.0462836,120.2437066
UN201806210162,"2018-06-21 12:21:19",新化區,違規停車,違規停車,"新化區忠孝路43-1號  違規停車",新化區忠孝路43-1號,23.0383765,120.3074132
UN201806210163,"2018-06-21 12:24:32",新市區,違規停車,違規停車,"新市區復興路101號  違規停車",新市區復興路101號,22.9997281,120.2270277
UN201806210164,"2018-06-21 12:30:56",安平區,交通運輸,佔用道路,"安平區安北路右轉州平三街  佔用道路",安平區安北路州平三街,22.9981772,120.1492307
UN201806210172,"2018-06-21 12:48:49",北區,違規停車,違規停車,"北區開南街與東豐路451巷交界轉 違規停車",北區開南街*東豐路451巷,22.9997281,120.2270277
UN201806210174,"2018-06-21 13:12:22",新市區,道路維修,路面掏空、塌陷,"新市區大社往山上區方向,統一實業後方圍路面掏空",新市區大社統一實業,23.0993323,120.317346
UN201806210177,"2018-06-21 13:14:08",中西區,違規停車,違規停車,"中西區民族路二段213號 違規停車",中西區民族路二段213號,22.9958195,120.2051427
UN201806210180,"2018-06-21 13:26:24",安定區,動物救援,犬貓急難救援,"安定區安加里258之102號B棟 貓受困",安定區安加里258之102號,23.1135653,120.2382911
UN201806210181,"2018-06-21 13:33:42",東區,道路維修,路面坑洞,"東區大學路上靠育樂街66巷 路面坑洞",東區大學路育樂街66巷,22.9965896,120.2158356
UN201806210182,"2018-06-21 13:41:25",永康區,髒亂及汙染,空氣汙染,"永康區勝華街37巷39號後方 空氣汙染",永康區勝華街37巷39號,23.0054047,120.2339679
UN201806210184,"2018-06-21 13:44:28",北區,路燈故障,10盞以上路燈故障,"北區文成三路129號 路燈故障",北區文成三路129號,23.0993323,120.317346
UN201806210185,"2018-06-21 13:44:48",永康區,違規停車,違規停車,"永康區正南一街148號 違規停車",永康區正南一街148號,23.0255553,120.2266081
UN201806210187,"2018-06-21 13:54:03",佳里區,道路維修,路面坑洞,"佳里區勝利路122號-255號 路面坑洞",佳里區勝利路122號-255號,23.1507867,120.1789852
UN201806210189,"2018-06-21 13:57:07",安平區,違規停車,違規停車,安平區安平路212號/216號,安平區安平路212號,22.9997281,120.2270277
UN201806210191,"2018-06-21 14:01:29",中西區,道路維修,路面下陷、凹陷,"中西區國華街和平街口 路面下陷",中西區國華街和平街,22.9961836,120.1984023
UN201806210196,"2018-06-21 14:24:43",安平區,交通運輸,佔用道路,"安平區光州路150號  占用道路",安平區光州路150號,22.9932331,120.1594779
UN201806210197,"2018-06-21 14:28:32",中西區,違規停車,違規停車,"中西區永福路二段99號 違規停車",中西區永福路二段99號,23.1507867,120.1789852
UN201806210198,"2018-06-21 14:31:36",安平區,違規停車,違規停車,"安平區永華四街17巷19號 違規停車",安平區永華四街17巷19號,22.9879433,120.1793803
UN201806210203,"2018-06-21 14:40:32",北區,違規停車,違規停車,北區開元路501號違規停車,北區開元路501號,23.0102471,120.2247606
UN201806210205,"2018-06-21 14:47:10",白河區,道路維修,路樹傾倒,"白河區關子嶺關嶺里  路樹傾倒",白河區關子嶺關嶺里,23.334893,120.500069
UN201806210206,"2018-06-21 14:47:43",歸仁區,,,"歸仁區 台86高鐵往東區方向第一出口十字路口",歸仁區台86,22.9366793,120.2921473
UN201806210207,"2018-06-21 14:52:06",安南區,道路維修,路面下陷、凹陷,"安南區北安橋  路面下陷",安南區北安橋,23.0110069,120.2110967
UN201806210209,"2018-06-21 14:54:34",安南區,道路維修,路樹傾倒,"安南區北安路四段321號 路樹倒塌",安南區北安路四段321號,23.0626825,120.214082
UN201806210210,"2018-06-21 14:57:35",中西區,道路維修,路面下陷、凹陷,"中西區民族路二段57巷16號-1  路面塌陷",中西區民族路二段57巷16號-1,22.9997281,120.2270277
UN201806210212,"2018-06-21 15:03:15",北區,路燈故障,9盞以下路燈故障,"北區南園街127巷151弄  路燈故障",北區南園街127巷151弄,23.0093034,120.2281916
UN201806210222,"2018-06-21 15:39:27",中西區,違規停車,違規停車,"中西區舊新南國小路橋邊 違規停車",中西區新南國小,23.0168384,120.2270026
UN201806210223,"2018-06-21 15:39:50",中西區,違規停車,違規停車,"中西區臨安路一段72號  違規停車",中西區臨安路一段72號,22.9990981,120.1907774
UN201806210224,"2018-06-21 15:41:24",安南區,違規停車,違規停車,"安南區安中路四段87號,違規停車",安南區安中路四段87號,23.049477,120.1720127
UN201806210225,"2018-06-21 15:41:59",北區,違規停車,違規停車,"北區臨安路二段231號跟233號 違停",北區臨安路二段231號,23.0042962,120.2005657
UN201806210226,"2018-06-21 15:42:19",中西區,噪音舉發,場所連續噪音,"中西區臨安路一段72號  噪音舉發",中西區臨安路一段72號,22.9990981,120.1907774
UN201806210229,"2018-06-21 15:46:07",永康區,髒亂及汙染,空氣汙染,"永康區復興路71巷112弄62號旁 空氣汙染",永康區復興路71巷112弄62號,22.9997281,120.2270277
UN201806210233,"2018-06-21 15:54:39",南區,髒亂及汙染,空氣汙染,"南區金華路二段76號 空氣汙染",南區金華路二段76號,22.9990981,120.1907774
UN201806210237,"2018-06-21 15:59:35",南區,違規停車,違規停車,"南區健康路一段133巷69號   違規停車",南區健康路一段133巷69號,22.9796375,120.2089031
UN201806210240,"2018-06-21 16:03:28",南區,違規停車,違規停車,"南區健康路一段133巷29號  違規停車",健康路一段133巷29號,22.980303,120.2089615
UN201806210241,"2018-06-21 16:07:30",南區,髒亂及汙染,空氣汙染,"南區金華路二段76號,四海遊龍 空氣汙染",南區金華路二段76號,22.9990981,120.1907774
UN201806210245,"2018-06-21 16:23:44",安南區,道路維修,路面坑洞,"安南區仁安路1號  路面坑洞",安南區仁安路1號,23.0498629,120.1754954
UN201806210249,"2018-06-21 16:36:30",中西區,髒亂及汙染,空氣汙染,"中西區大勇街跟大智街路口 空氣汙染",中西區大勇街大智街,22.9997281,120.2270277
UN201806210250,"2018-06-21 16:38:17",北區,路燈故障,9盞以下路燈故障,"北區文賢路502巷57號~62號 路燈故障",北區文賢路502巷57號,23.0060938,120.19543
UN201806210251,"2018-06-21 16:45:52",安平區,民生管線,停電、漏電、電線掉落、孔蓋鬆動,"安平區光州七街112號  孔蓋鬆動",安平區光州七街112號,22.9928877,120.160808
UN201806210256,"2018-06-21 17:01:18",中西區,違規停車,違規停車,"中西區舊新南國小 違規停車",中西區舊新南國小,22.9928984,120.1826111
UN201806210260,"2018-06-21 17:11:45",安定區,民生管線,電信孔蓋鬆動、電信線路掉落、電信桿傾倒,"安定區歷史博物館北方的魚塭區  電信電線桿傾導",安定區歷史博物館,23.0583499,120.2348068
UN201806210261,"2018-06-21 17:18:58",安南區,交通運輸,佔用道路,"安南區海佃路二段113之15號 佔用道路",安南區海佃路二段113之15號,22.9928877,120.160808
UN201806210266,"2018-06-21 17:28:43",中西區,違規停車,違規停車,"中西區健康路一段320號  違規停車",中西區健康路一段320號,22.9928984,120.1826111
UN201806210268,"2018-06-21 17:30:39",中西區,髒亂及汙染,空氣汙染,"中西區尊王路130號  空氣汙染",中西區尊王路130號,23.0405859,120.2434936
UN201806210269,"2018-06-21 17:32:40",永康區,違規停車,違規停車,"永康區中華路203號 違規停車",永康區中華路203號,22.9997281,120.2270277
UN201806210270,"2018-06-21 17:36:49",永康區,違規停車,違規停車,"永康區崑大路35號 違停",永康區崑大路35號,22.9983326,120.2548438
UN201806210272,"2018-06-21 17:39:14",中西區,違規停車,違規停車,"中西區公園路81號 違規停車",中西區公園路81號,22.9997281,120.2270277
UN201806210275,"2018-06-21 17:44:12",中西區,違規停車,違規停車,"中西區公園路85號 違停",中西區公園路85號,22.9955749,120.2055645
UN201806210276,"2018-06-21 17:45:37",東區,違規停車,違規停車,"東區大同路一段281號  違規停車",東區大同路一段281號,22.9928984,120.1826111
UN201806210277,"2018-06-21 17:46:59",中西區,違規停車,違規停車,中西區西華南街18號違規停車,中西區西華南街18號,22.9935199,120.2094679
UN201806210278,"2018-06-21 17:49:30",中西區,違規停車,違規停車,"中西區大同路一段  違規停車",中西區大同路一段,23.0405859,120.2434936
UN201806210280,"2018-06-21 17:53:00",永康區,道路維修,路面坑洞,"永康區大灣東路  路面坑洞",永康區大灣東路,23.0019317,120.2703782
UN201806210282,"2018-06-21 17:53:54",中西區,違規停車,違規停車,中西區大同路二段近大林路口違規停車,中西區大同路二段大林路,22.9997281,120.2270277
UN201806210284,"2018-06-21 17:56:02",麻豆區,交通運輸,佔用道路,"麻豆區博愛路*忠孝路 占用道路",麻豆區博愛路*忠孝路,22.9997281,120.2270277
UN201806210287,"2018-06-21 18:01:43",安南區,違規停車,違規停車,"安南區安中路四段290巷80弄41號 違規停車",安南區安中路四段290巷80弄41號,22.9997281,120.2270277
UN201806210291,"2018-06-21 18:14:53",中西區,違規停車,違規停車,"中西區永福路二段41號 違規停車",台南市中西區永福路二段41號,22.9911514,120.2004453
UN201806210293,"2018-06-21 18:15:24",安南區,交通運輸,佔用道路,"安南區環湖街122號 佔用道路",安南區環湖街122號,23.0585336,120.1358346
UN201806210294,"2018-06-21 18:19:02",北區,路燈故障,9盞以下路燈故障,"北區南園街127巷151弄1號到13號 路燈故障",北區南園街127巷151弄1號,22.9997281,120.2270277
UN201806210299,"2018-06-21 18:29:25",北區,違規停車,違規停車,"北區開元路73巷21號勝安活動中心 違規停車",北區開元路73巷21號勝安活動中心,22.9997281,120.2270277
UN201806210300,"2018-06-21 18:33:50",北區,違規停車,違規停車,"北區開元路71巷32號開元國小 違規停車",北區開元路71巷32號開元國小,23.1319072,120.2959741
UN201806210305,"2018-06-21 18:47:44",永康區,違規停車,違規停車,"永康區鹽忠街130號 違規停車",永康區鹽忠街130號,23.0417914,120.2327215
UN201806210307,"2018-06-21 18:54:34",中西區,違規停車,違規停車,"中西區大同路一段109號先樞機旁邊 違規停車",中西區大同路一段109號,22.9997281,120.2270277
UN201806210309,"2018-06-21 18:55:49",中西區,違規停車,違規停車,"中西區北門路一段靠近青年路口仁愛眼鏡 北門／東寧 違規停車",中西區北門路一段*青年路,22.9915211,120.2116161
UN201806210311,"2018-06-21 18:56:54",南區,道路維修,路面掏空、塌陷,"南區明興路595號往南走電線桿旁 路面塌陷",南區明興路595號,22.941682,120.181942
UN201806210312,"2018-06-21 18:57:18",中西區,違規停車,違規停車,"中西區青年路上與萬昌街口 違規停車",中西區青年路上與萬昌街口,22.9944261,120.2107642
UN201806210313,"2018-06-21 18:58:09",中西區,違規停車,違規停車,中西區西華南街28號違規停車,中西區西華南街28號,22.9997281,120.2270277
UN201806210316,"2018-06-21 19:02:58",南區,路燈故障,9盞以下路燈故障,"南區明興路325號 路燈故障",南區明興路325號,22.9997281,120.2270277
UN201806210317,"2018-06-21 19:03:57",北區,違規停車,違規停車,"北區文成三路682巷巷口 違規停車",文成三路682巷,23.0171374,120.1993735
UN201806210318,"2018-06-21 19:05:21",學甲區,民生管線,停電、漏電、電線掉落、孔蓋鬆動,"學甲區中洲里256-20號 民生管線",學甲區中洲里256-20號,22.9997281,120.2270277
UN201806210321,"2018-06-21 19:14:46",北區,路燈故障,9盞以下路燈故障,"北區南園街127巷151弄內 路燈故障",北區南園街127巷151弄,23.0093034,120.2281916
UN201806210322,"2018-06-21 19:15:03",中西區,交通運輸,佔用道路,"中西區西門路二段366號 佔用道路",西門路二段366號,22.9944261,120.2107642
UN201806210324,"2018-06-21 19:18:12",歸仁區,交通運輸,佔用道路,"歸仁區文化九街12號 佔用道路",歸仁區文化九街12號,22.9997281,120.2270277
UN201806210325,"2018-06-21 19:20:16",南區,路燈故障,9盞以下路燈故障,"南區鯤鯓路102巷38弄6號、17號、20號 路燈故障",南區鯤鯓路102巷38弄6號,22.9601234,120.1722
UN201806210328,"2018-06-21 19:23:53",永康區,路燈故障,10盞以上路燈故障,"永康區新民街 路燈故障",新民街,22.9997281,120.2270277
UN201806210330,"2018-06-21 19:33:37",永康區,違規停車,違規停車,"永康區南台街43號 違規停車",710台南市永康區南台街43號,22.9997281,120.2270277
UN201806210332,"2018-06-21 19:37:01",新市區,髒亂及汙染,道路散落物,"新市區中山路277號前方 道路散落物",新市區中山路277號,23.1319072,120.2959741
UN201806210334,"2018-06-21 19:45:39",東區,路燈故障,9盞以下路燈故障,"東區前鋒路108號 路燈故障",東區前鋒路108號,23.0396975,120.2416185
UN201806210336,"2018-06-21 19:49:41",南區,違規停車,違規停車,"南區健康路二段16號 違規停車",健康路二段16號右邊,22.9997281,120.2270277
