UN201806180001,"2018-06-18 00:02:40",北區,噪音舉發,妨害安寧,"北區大興街285巷26弄，教會附近 妨害安寧",北區大興街285巷26弄,23.0097564,120.1869591
UN201806180002,"2018-06-18 00:05:59",中西區,違規停車,違規停車,"中西區民生路二段108號 違規停車",700台南市中西區民生路二段108號,22.9955973,120.196338
UN201806180003,"2018-06-18 00:29:11",永康區,噪音舉發,妨害安寧,"永康區南興路48巷42號 妨害安寧",南興路48巷42號,22.9973437,120.2637763
UN201806180005,"2018-06-18 00:31:06",中西區,噪音舉發,妨害安寧,中西區中山路82巷13號妨害安寧,中山路82巷13號,22.9936541,120.2080041
UN201806180008,"2018-06-18 01:29:08",北區,噪音舉發,妨害安寧,"北區大興街285巷26弄 妨害安寧",北區大興街285巷26弄,23.0097564,120.1869591
UN201806180010,"2018-06-18 02:18:29",北區,噪音舉發,妨害安寧,"北區和緯路四段117巷 噪音舉發",和緯路四段117巷,23.082665,120.2952933
UN201806180011,"2018-06-18 02:58:52",東區,噪音舉發,妨害安寧,"東區北門路一段(啟聰學校)  妨害安寧",東區北門路一段,22.9932613,120.2117242
UN201806180013,"2018-06-18 04:08:31",六甲區,噪音舉發,妨害安寧,"六甲區中正路422巷7號 妨害安寧",中正路422巷7號,22.9973437,120.2637763
UN201806180019,"2018-06-18 06:56:25",新化區,道路維修,路樹傾倒,"新化區信義路2號 路樹倒塌",新化區信義路2號,23.0346727,120.3034498
UN201806180020,"2018-06-18 07:19:02",北區,違規停車,違規停車,"北區東豐路191巷 違規停車",北區東豐路191巷,23.0038218,120.2196936
UN201806180021,"2018-06-18 07:23:52",安平區,道路維修,路樹傾倒,"安平區中華西路二段73號  路樹傾倒",安平區中華西路二段73號,22.9883051,120.1866657
UN201806180024,"2018-06-18 07:45:27",安南區,道路維修,路面坑洞,"安南區郡安路五段201號前 路面坑洞",安南區郡安路五段201號,23.029281,120.1936919
UN201806180029,"2018-06-18 08:09:47",安南區,道路維修,路樹傾倒,"安南區海尾路  路樹傾倒",安南區海尾路,23.0322906,120.1780287
UN201806180030,"2018-06-18 08:13:25",南區,道路維修,路面坑洞,"ivr南區大同路靠中華路口 路面坑洞",南區大同路中華路,22.9723479,120.2147572
UN201806180031,"2018-06-18 08:18:43",北區,交通運輸,號誌故障,"北區公園路公園南路 號誌故障",北區公園路,22.9883051,120.1866657
UN201806180034,"2018-06-18 08:36:58",安南區,髒亂及汙染,道路散落物,"安南區永續二十街口 道路散落物",安南區永續二十街,23.0233314,120.1772249
UN201806180035,"2018-06-18 08:45:24",中西區,道路維修,路面坑洞,"中西區大勇街34號 路面坑洞",中西區大勇街34號,22.9897865,120.1942475
UN201806180039,"2018-06-18 09:08:45",東區,道路維修,路樹傾倒,"東區北門路二段16號  路樹傾倒",東區北門路二段16號,22.9990247,120.2128868
UN201806180040,"2018-06-18 09:11:34",中西區,民生管線,,"中西區民生路與西門路路口鵝肉店門口積水處,",中西區民生路西門路,22.9723479,120.2147572
UN201806180046,"2018-06-18 09:43:44",永康區,動物救援,犬貓急難救援,"永康區大灣路942巷271弄弄內 犬貓急難救援",永康區大灣路942巷271弄,23.004553,120.256582
UN201806180047,"2018-06-18 09:47:18",中西區,違規停車,違規停車,"中西區西寧街25號跟37號  轉角紅線違停",中西區西寧街25號37號,22.997149,120.1917842
UN201806180050,"2018-06-18 09:55:40",東區,噪音舉發,場所連續噪音,"東區東門路三段179巷自由路 噪音汙染",東區東門路三段179巷自由路,22.977956,120.237654
UN201806180051,"2018-06-18 09:55:47",東區,違規停車,違規停車,"東區大同路二段403巷2號門口 違規停車",東區大同路二段403巷2號,22.9717273,120.2152377
UN201806180053,"2018-06-18 10:02:46",永康區,交通運輸,號誌故障,"永康區崑大路與永大路一段路口 號誌故障",永康區崑大路,22.9984109,120.254558
UN201806180055,"2018-06-18 10:11:28",永康區,違規停車,違規停車,"永康區復國一路328號  違規停車",永康區復國一路328號,23.0104955,120.2464952
UN201806180056,"2018-06-18 10:13:46",善化區,違規停車,違規停車,"善化區陽光二路與蓮潭北二街 違規停車",善化區陽光二路,23.004553,120.256582
UN201806180058,"2018-06-18 10:25:11",北門區,路燈故障,10盞以上路燈故障,"北門區174市道跟台17線交叉處  路燈大範圍放亮",北門區174市道台17線,22.9984109,120.254558
UN201806180062,"2018-06-18 10:34:09",永康區,違規停車,違規停車,"永康區新行街122巷10弄1號  違規停車",永康區新行街122巷10弄1號,22.9997281,120.2270277
UN201806180063,"2018-06-18 10:34:59",永康區,違規停車,違規停車,"永康區新民街16巷及新民街交界 違規停車",永康區新民街16巷,22.9984109,120.254558
UN201806180064,"2018-06-18 10:35:59",永康區,違規停車,違規停車,"永康區新民街218巷接新中街 違規停車",永康區新民街218巷,22.9997281,120.2270277
UN201806180065,"2018-06-18 10:37:08",永康區,違規停車,違規停車,"永康區新民街新中街 違規停車",永康區新民街新中街,23.0104955,120.2464952
UN201806180066,"2018-06-18 10:37:40",東區,道路維修,路面坑洞,"東區中華東路二段182號  路面坑洞",東區中華東路二段182號,22.9997281,120.2270277
UN201806180067,"2018-06-18 10:41:57",南區,髒亂及汙染,空氣汙染,"南區新和路14號 空氣汙染",南區新和路14號,22.9674748,120.1802677
UN201806180069,"2018-06-18 10:46:35",北區,違規停車,違規停車,"北區開南街與東豐路451巷  違規停車",北區開南街與東豐路451巷,22.9997281,120.2270277
UN201806180070,"2018-06-18 10:48:42",新市區,違規停車,違規停車,"新市區復興路101號 違規停車",新市區復興路101號,22.9997281,120.2270277
UN201806180074,"2018-06-18 10:57:28",東區,違規停車,違規停車,"東區富農街二段92巷口 違停",東區富農街二段92巷,22.9997281,120.2270277
UN201806180079,"2018-06-18 11:11:28",中西區,違規停車,違規停車,"中西區西門路與府前路 違規停車",中西區西門路府前路,22.9904496,120.1977651
UN201806180080,"2018-06-18 11:16:14",永康區,民生管線,漏水、停水、消防栓漏水或損壞,"永康區龍橋街505號 右前方200公尺三叉路,路中間鐵蓋冒水",永康區龍橋街505號,23.0448,120.261965
UN201806180081,"2018-06-18 11:17:18",永康區,違規停車,違規停車,"永康區復華六街67巷 違規停車",復華六街67巷,23.0117716,120.2457949
UN201806180083,"2018-06-18 11:18:40",中西區,違規停車,違規停車,"中西區樹林街二段177號前 違規停車",樹林街二段177號前,22.9984109,120.254558
UN201806180084,"2018-06-18 11:19:41",東區,違規停車,違規停車,"東區裕農路575號 違規停車",裕農路575號,22.9887046,120.2340706
UN201806180085,"2018-06-18 11:22:21",安南區,違規停車,違規停車,"安南區怡安路二段535巷5弄4號旁 違規停車",怡安路二段535巷5弄4號,22.9997281,120.2270277
UN201806180086,"2018-06-18 11:23:24",新市區,違規停車,違規停車,"新市區復興路101號 違規停車",復興路101號,23.1548698,120.17226
UN201806180089,"2018-06-18 11:29:29",南區,違規停車,違規停車,"南區新興路245號 違規停車",南區新興路245號,22.9904496,120.1977651
UN201806180092,"2018-06-18 11:35:31",安南區,髒亂及汙染,環境髒亂,"安南區長和路四段616號 環境髒亂",安南區長和路四段616號,22.9997281,120.2270277
UN201806180098,"2018-06-18 11:48:32",中西區,交通運輸,佔用道路,"中西區民生與民權路中間康樂街路段 佔用道路",中西區民生路民權路,22.9997281,120.2270277
UN201806180103,"2018-06-18 12:03:36",中西區,違規停車,違規停車,"中西區民族路二段100號  違規停車",中西區民族路二段100號,22.9957182,120.2061728
UN201806180104,"2018-06-18 12:06:43",南區,髒亂及汙染,空氣汙染,"南區新和路14號  空氣汙染",南區新和路14號,22.9674748,120.1802677
UN201806180106,"2018-06-18 12:10:57",永康區,違規停車,違規停車,"永康區中山南路106-3號 違規停車",永康區中山南路106-3號,23.0130964,120.22989
UN201806180107,"2018-06-18 12:12:07",北區,路燈故障,9盞以下路燈故障,北區開元路148巷2弄5號對面水銀故障不亮,北區開元路148巷2弄5號,23.0066038,120.2193908
UN201806180110,"2018-06-18 12:28:13",新市區,違規停車,違規停車,"新市區復興路101號  違規停車",新市區復興路101號,22.9997281,120.2270277
UN201806180119,"2018-06-18 12:51:19",安南區,違規停車,違規停車,"安南區國安街155巷73弄23號  違規停車",安南區國安街155巷73弄23號,23.0204128,120.1886012
UN201806180120,"2018-06-18 12:51:24",玉井區,交通運輸,號誌故障,"玉井區省道3號跟20號  交通號誌故障",玉井區省道3號省道20號,23.1119128,120.4757091
UN201806180122,"2018-06-18 12:54:56",新市區,違規停車,違規停車,"新市區復興路101號  違規停車",新市區復興路101號,22.9997281,120.2270277
UN201806180123,"2018-06-18 12:58:48",安南區,髒亂及汙染,環境髒亂,"安南區國安街155巷73弄23號  髒亂及汙染",安南區國安街155巷73弄23號,23.0204128,120.1886012
UN201806180124,"2018-06-18 13:08:53",南區,髒亂及汙染,空氣汙染,"南區金華路二段76號  空氣汙染",南區金華路二段76號,22.9775735,120.1913152
UN201806180126,"2018-06-18 13:22:05",東區,違規停車,違規停車,"東區東寧路與長榮路口 違規停車",東區東寧路,22.9908384,120.2253353
UN201806180130,"2018-06-18 13:27:15",玉井區,違規停車,違規停車,"玉井區民權路28號 違規停車",民權路28號,23.1219983,120.4592065
UN201806180137,"2018-06-18 13:35:59",東區,道路維修,路面坑洞,"東區林森路一段341號  路面坑洞",東區林森路一段341號,22.9997281,120.2270277
UN201806180139,"2018-06-18 13:39:49",北區,違規停車,違規停車,"北區南園街153巷28弄30號 違規停車",南園街153巷28弄30號,23.0062156,120.2270604
UN201806180144,"2018-06-18 13:50:14",中西區,違規停車,違規停車,"中西區金華路三段142號  違規停車",中西區金華路三段142號,22.9923747,120.1931495
UN201806180147,"2018-06-18 13:54:57",中西區,違規停車,違規停車,"中西區府前路一段268號 違規停車",中西區府前路一段268號,22.9900949,120.2001341
UN201806180148,"2018-06-18 13:55:19",中西區,違規停車,違規停車,"中西區民族路上忠義路到西門路   違停",中西區民族路忠義路,22.9962673,120.2040788
UN201806180150,"2018-06-18 14:01:07",中西區,違規停車,違規停車,"中西區府前路一段146號 違規停車",府前路一段146號,22.9891245,120.2072645
UN201806180152,"2018-06-18 14:04:48",北區,違規停車,違規停車,"北區開南街與東豐路451巷  違規停車",北區開南街東豐路451巷,23.082665,120.2952933
UN201806180154,"2018-06-18 14:09:02",中西區,違規停車,違規停車,"中西區永華路一段11號旁 違規停車",中西區永華路一段11號,22.9872486,120.1969807
UN201806180157,"2018-06-18 14:27:01",西港區,道路維修,路樹傾倒,"西港往佳里方向的台19線上125.5公里處 路樹傾倒",西港,22.9900949,120.2001341
UN201806180159,"2018-06-18 14:27:50",南區,違規停車,違規停車,"南區夏林路256巷  違規停車",南區夏林路256巷,22.9785149,120.1946601
UN201806180164,"2018-06-18 14:41:50",中西區,違規停車,違規停車,"中西區府前路一段91號  違規停車",中西區府前路一段91號,22.9872486,120.1969807
UN201806180166,"2018-06-18 14:54:35",麻豆區,噪音舉發,妨害安寧,"麻豆區麻佳路一段80號  噪音舉發",麻豆區麻佳路一段80號,23.1844261,120.2395088
UN201806180168,"2018-06-18 14:58:31",中西區,違規停車,違規停車,"中西區民族路三段19號  違規停車",中西區民族路三段19號,22.9962673,120.2040788
UN201806180171,"2018-06-18 15:03:32",東區,違規停車,違規停車,"東區東門路二段158巷  違停",東區東門路二段158巷,22.9848616,120.2207529
UN201806180173,"2018-06-18 15:13:55",中西區,交通運輸,交通疏導,"中西區西門路二段120號  交通疏導",中西區西門路二段120號,22.9935473,120.1990042
UN201806180177,"2018-06-18 15:22:04",新市區,違規停車,違規停車,"新市區復興路101號 違規停車",復興路101號,23.1548698,120.17226
UN201806180179,"2018-06-18 15:23:05",安南區,路燈故障,9盞以下路燈故障,"安南區義吉街 路燈不亮",安南區義吉街,22.9997281,120.2270277
UN201806180183,"2018-06-18 15:36:14",麻豆區,噪音舉發,妨害安寧,"麻豆區麻佳路一段80-20號 妨害安寧",麻豆區麻佳路一段80-20號,23.185565,120.239591
UN201806180184,"2018-06-18 15:36:37",東區,噪音舉發,妨害安寧,"東區東仁拖吊場 妨害安寧＆拖吊場遷移",東區東仁拖吊場,22.9790564,120.2282274
UN201806180194,"2018-06-18 16:01:29",中西區,騎樓舉發,騎樓舉發,"中西區保安路58號 佔用騎樓＆違建",中西區保安路58號,22.9904146,120.1964224
UN201806180203,"2018-06-18 16:19:32",白河區,交通運輸,號誌故障,"白河區國泰路 號誌故障",白河區國泰路,23.3513101,120.4125219
UN201806180204,"2018-06-18 16:22:50",安南區,髒亂及汙染,道路散落物,"安南區公學路 道路散落物",安南區公學路,23.004553,120.256582
UN201806180206,"2018-06-18 16:33:02",永康區,違規停車,違規停車,"永康區中山南路63號 違規停車",710台南市永康區中山南路63號,23.0123393,120.2274748
UN201806180211,"2018-06-18 16:38:55",七股區,道路維修,,"七股區南31-1線 路樹傾倒",七股區南31-1線,22.9997281,120.2270277
UN201806180212,"2018-06-18 16:41:15",南區,違規停車,違規停車,"南區西門路一段547號 違停",南區西門路一段547號,22.9836198,120.1974707
UN201806180214,"2018-06-18 16:48:02",北區,違規停車,違規停車,"北區開元路501號 違規停車",704台南市北區開元路501號,23.004553,120.256582
UN201806180215,"2018-06-18 16:48:16",南區,違規停車,違規停車,"南區金華路二段332號 違規停車",南區金華路二段332號,22.983544,120.191911
UN201806180216,"2018-06-18 16:49:06",永康區,違規停車,違規停車,"永康區大橋一街247巷72號 違規停車",大橋一街247巷72號,23.021063,120.2311919
UN201806180217,"2018-06-18 16:54:34",中西區,違規停車,違規停車,"中西區北門路靠近青年路的合作金庫外 違規停車",北門路,22.9932613,120.2117242
UN201806180219,"2018-06-18 16:55:41",中西區,違規停車,違規停車,"中西區西華南街2到32號 違規停車",西華南街2到32號,22.9952058,120.2097062
UN201806180222,"2018-06-18 17:07:20",南區,違規停車,違規停車,"南區健康路二段120號 違規停車",南區健康路二段120號,22.9817801,120.194343
UN201806180223,"2018-06-18 17:09:14",北區,違規停車,違規停車,"北區海安路三段和文成五街 違停",北區海安路三段文成五街,22.9997281,120.2270277
UN201806180225,"2018-06-18 17:11:36",仁德區,道路維修,路面坑洞,"仁德區裕義路與裕農路口 路面坑洞",仁德區裕義路,22.9836343,120.2479446
UN201806180230,"2018-06-18 17:25:06",北區,違規停車,違規停車,"北區和緯路二段238號 違規停車",704台南市北區和緯路二段238號,23.0448,120.261965
UN201806180235,"2018-06-18 17:47:37",永康區,違規停車,違規停車,"永康區南台街36號 違規停車",710台南市永康區南台街36號,23.022328,120.223467
UN201806180236,"2018-06-18 17:50:34",中西區,違規停車,違規停車,"中西區西門路二段120號 違規停車",西門路二段120號,22.9935473,120.1990042
UN201806180238,"2018-06-18 17:52:59",中西區,違規停車,違規停車,"中西區青年路的北門路口到萬昌街口 違規停車",青年路,22.9897865,120.1942475
UN201806180239,"2018-06-18 17:56:08",善化區,髒亂及汙染,道路散落物,"善化區茄拔，台1線280之19、21號附近 狗屍",善化區台1線280之19號,23.2135864,120.307632
UN201806180240,"2018-06-18 18:02:08",南區,違規停車,違規停車,西門路一段593號騎樓違停,南區西門路一段593號,22.9846979,120.1974694
UN201806180244,"2018-06-18 18:10:06",永康區,違規停車,違規停車,"永康區中山南路330號 違規停車",永康區中山南路330號,22.9997281,120.2270277
UN201806180245,"2018-06-18 18:10:11",東區,違規停車,違規停車,"東區北門路一段280號 違規停車",東區北門路一段280號,22.9955566,120.2120081
UN201806180246,"2018-06-18 18:14:45",南區,髒亂及汙染,空氣汙染,"南區金華路二段76號 空氣汙染",南區金華路二段76號,22.9775735,120.1913152
UN201806180248,"2018-06-18 18:29:18",南區,噪音舉發,場所連續噪音,"南區大同路二段482巷115弄10號附近 場所連續噪音",南區大同路二段482巷115弄10號,22.9802548,120.2112937
UN201806180252,"2018-06-18 18:33:25",新市區,違規停車,違規停車,"新市區復興路101號 違規停車",新市區復興路101號,22.9997281,120.2270277
UN201806180255,"2018-06-18 18:36:13",北區,違規停車,違規停車,"北區開元路290號 違規停車",北區開元路290號,23.008661,120.2227644
UN201806180256,"2018-06-18 18:39:07",北區,違規停車,違規停車,"北區成功路282號前 黃線違停",臺南市北區成功路282號,22.999621,120.201843
UN201806180259,"2018-06-18 18:41:57",南區,道路維修,人孔蓋聲響、凹陷、漏水,"南區金華路一段508號 污水孔蓋",南區金華路一段508號,22.9737026,120.1908414
UN201806180263,"2018-06-18 19:04:01",善化區,違規停車,違規停車,"善化區光復路222號 違規停車",善化區光復路222號,22.9897865,120.1942475
UN201806180265,"2018-06-18 19:07:51",南區,違規停車,違規停車,"南區健康路二段359號，小葉火鍋前 違規停車",南區健康路二段359號,22.98168,120.187567
UN201806180270,"2018-06-18 19:20:08",永康區,違規停車,違規停車,"永康區洲尾街327號 違規停車",永康區洲尾街327號,23.0421441,120.2304249
UN201806180271,"2018-06-18 19:20:48",安平區,違規停車,違規停車,"安平區健康三街與建平七街口 違規停車",安平區健康三街建平七街,22.9900656,120.1687805
UN201806180274,"2018-06-18 19:32:29",安平區,路燈故障,9盞以下路燈故障,安平區建平一街23巷25弄2號,安平區建平一街23巷25弄2號,22.9853335,120.1766308
UN201806180276,"2018-06-18 19:33:46",中西區,違規停車,違規停車,"中西區北門路一段171號 違規停車",中西區北門路一段171號,22.9960634,120.2117343
UN201806180277,"2018-06-18 19:34:45",安平區,噪音舉發,妨害安寧,"安平區安平路75巷18弄14號 妨害安寧",安平區安平路75巷18弄14號,22.9997281,120.2270277
UN201806180279,"2018-06-18 19:38:01",永康區,民生管線,漏水、停水、消防栓漏水或損壞,"永康區永大路三段618巷85弄口 路面冒水",永康區永大路三段618巷85弄,23.0348781,120.2594092
UN201806180280,"2018-06-18 19:43:12",中西區,交通運輸,佔用道路,"中西區法華街103號 佔用道路",中西區法華街103號,23.0421441,120.2304249
UN201806180281,"2018-06-18 19:43:59",永康區,違規停車,違規停車,"永康區中華路734號 違規停車",永康區中華路734號,23.0167221,120.228875
UN201806180283,"2018-06-18 19:49:00",安平區,違規停車,違規停車,"安平區永華路二段35號 違規停車",安平區永華路二段35號,22.98168,120.187567
UN201806180284,"2018-06-18 19:50:59",中西區,違規停車,違規停車,"中西區西寧街25號與37號 違規停車",中西區西寧街25號與37號,22.9853335,120.1766308
UN201806180286,"2018-06-18 19:56:12",安平區,路燈故障,9盞以下路燈故障,"安平區文平路187巷 路燈故障",安平區文平路187巷,22.9870057,120.1755967
UN201806180287,"2018-06-18 19:57:03",中西區,違規停車,違規停車,"中西區民生路二段112號 違規停車",700台南市中西區民生路二段112號,22.9955824,120.1962154
UN201806180291,"2018-06-18 20:15:58",北區,噪音舉發,妨害安寧,"北區開元路108號旁工地 施工噪音",臺南市北區開元路108號,23.006405,120.21793
UN201806180293,"2018-06-18 20:22:11",東區,道路維修,路面坑洞,"東區東門路上近慶東街口 道路維修",東區東門路慶東街,23.185565,120.239591
UN201806180296,"2018-06-18 20:32:11",永康區,違規停車,違規停車,"永康區鹽信街5號 違規停車",永康區鹽信街5號,23.004553,120.256582
UN201806180297,"2018-06-18 20:32:56",北區,違規停車,違規停車,"北區開元路501號 違規停車",北區開元路501號,22.9997281,120.2270277
UN201806180299,"2018-06-18 20:36:06",新市區,違規停車,違規停車,"新市區中正路166號 違規停車",新市區台19甲線166號,23.0744447,120.2915017
UN201806180300,"2018-06-18 20:37:33",新市區,違規停車,違規停車,"新市區復興路101號 違規停車",新市區復興路101號,22.9997281,120.2270277
UN201806180301,"2018-06-18 20:39:11",新市區,違規停車,違規停車,"新市區中正路37號 違規停車",新市區台19甲線37號,22.9997281,120.2270277
UN201806180302,"2018-06-18 20:39:49",中西區,違規停車,違規停車,"中西區西寧街37號與25號 違規停車",中西區西寧街37號與25號,22.997364,120.191717
UN201806180303,"2018-06-18 20:41:35",新市區,違規停車,違規停車,"新市區台中正路241號 違規停車",新市區台19甲線241號,23.185565,120.239591
UN201806180308,"2018-06-18 20:54:38",北區,路燈故障,9盞以下路燈故障,"南園街127巷151弄1至13號.雙側 路燈故障",南園街127巷151弄1號到13號,23.0090064,120.2284896
UN201806180315,"2018-06-18 21:37:30",北區,違規停車,違規停車,"北區賢北街170巷 違規停車",北區賢北街170巷,23.0109252,120.1830697
UN201806180318,"2018-06-18 22:08:19",安南區,噪音舉發,妨害安寧,"安南區北安路二段526號 妨害安寧",安南區北安路二段526號,23.0370185,120.2030762
UN201806180320,"2018-06-18 22:25:16",安平區,噪音舉發,妨害安寧,"安平區府平路400多號 妨害安寧",安平區府平路400多號,22.9869884,120.1675682
UN201806180321,"2018-06-18 22:27:04",安平區,違規停車,違規停車,"安平區育平六街39號 違規停車",安平區育平六街39號,22.9923351,120.1660767
UN201806180322,"2018-06-18 22:32:00",安平區,違規停車,違規停車,"安平區育平路393號 違規停車",安平區育平路393號,22.9946232,120.1674905
UN201806180325,"2018-06-18 22:44:47",中西區,違規停車,違規停車,"中西區民生路二段108號 違規停車",700台南市中西區民生路二段108號,22.9955973,120.196338
UN201806180333,"2018-06-18 23:33:11",永康區,違規停車,違規停車,"永康區新行街122巷10弄1號 違規停車",新行街122巷10弄1號，永康國際學苑1館,23.0410259,120.2426302
UN201806190008,"2018-06-19 00:39:59",永康區,髒亂及汙染,空氣汙染,"永康區大灣路1014號 空氣汙染",臺南市永康區大灣路1014號,22.999921,120.253194
UN201806190025,"2018-06-19 06:40:22",安南區,違規停車,違規停車,"安南區怡安路二段535巷5弄4號 違規停車",臺南市怡安路二段535巷5弄4號,23.044051,120.19575
UN201806190034,"2018-06-19 07:33:32",北區,交通運輸,號誌故障,"北區開元路444號崑山高中 號誌故障",臺南市北區開元路444號,23.010962,120.226048
UN201806190079,"2018-06-19 09:14:18",永康區,違規停車,違規停車,"永康區南台街36號   違規停車",臺南市永康區南台街36號,23.022259,120.223429
UN201806190084,"2018-06-19 09:33:19",安南區,民生管線,停電、漏電、電線掉落、孔蓋鬆動,"安南區安通路四段30號 停電",臺南市安南區安通路四段30號,23.02928,120.212046
UN201806190110,"2018-06-19 10:45:59",北區,違規停車,違規停車,"北區開元路501號 違規停車",臺南市北區開元路501號,23.010454,120.224838
UN201806190116,"2018-06-19 10:58:27",東區,違規停車,違規停車,"東區北門路一段280號 違規停車",臺南市東區北門路一段280號,22.995337,120.211992
UN201806190125,"2018-06-19 11:16:26",關廟區,違規停車,違規停車,"關廟區民族街19巷1號  違規停車",臺南市關廟區民族街19巷1號,22.957887,120.332762
UN201806190138,"2018-06-19 11:54:15",永康區,違規停車,違規停車,"永康區中山南路106之3號. 違規停車",臺南市永康區中山南路106之3號,23.01291,120.22934
UN201806190144,"2018-06-19 12:13:34",南區,違規停車,違規停車,"南區新興路176號  違規停車",臺南市南區新興路176號,22.977548,120.193984
UN201806190147,"2018-06-19 12:21:17",永康區,違規停車,違規停車,"永康區大武街33號 違規停車",臺南市永康區大武街33號,23.020131,120.222541
UN201806190155,"2018-06-19 12:40:32",東區,違規停車,違規停車,"東區北門路一段310號 違規停車",臺南市東區北門路一段310號,22.996322,120.212122
UN201806190186,"2018-06-19 14:05:52",中西區,違規停車,違規停車,"中西區臨安路一段72號 違規停車",臺南市中西區臨安路一段72號,22.99906,120.190805
UN201806190202,"2018-06-19 14:35:06",永康區,道路維修,路面坑洞,"永康區新民街12號  路面毀損",臺南市永康區新民街12號,23.040268,120.243519
UN201806190206,"2018-06-19 14:38:00",新化區,交通運輸,佔用道路,"新化區中山路256號 占用道路",臺南市新化區中山路256號,23.036009,120.307716
UN201806190215,"2018-06-19 14:57:54",北區,違規停車,違規停車,"北區北忠街58巷37號  違規停車",臺南市北區北忠街58巷37號,22.999588,120.211311
UN201806190227,"2018-06-19 15:15:42",永康區,違規停車,違規停車,"永康區中華路1號 違停",臺南市永康區中華路1號,22.998787,120.234278
