UN201806190230,"2018-06-19 15:18:33",南區,違規停車,違規停車,"南區新興路243號  違規停車",臺南市南區新興路243號,22.97663,120.193087
UN201806190248,"2018-06-19 16:06:04",永康區,違規停車,違規停車,"永康區正南一街148號 違規停車",臺南市永康區正南一街148號,23.025642,120.226618
UN201806190252,"2018-06-19 16:13:58",中西區,違規停車,違規停車,"中西區府連路117號，法華街71巷路口 違規停車",臺南市中西區府連路117號,22.983859,120.210397
UN201806190262,"2018-06-19 16:43:33",永康區,違規停車,違規停車,"永康區復國一路375號 違規停車",臺南市永康區復國一路375號,23.012852,120.246352
UN201806190270,"2018-06-19 16:57:09",中西區,違規停車,違規停車,"中西區建業街45號  違規停車",臺南市中西區建業街45號,22.987786,120.204719
UN201806190283,"2018-06-19 17:33:23",永康區,髒亂及汙染,空氣汙染,"永康區中山南路1068號 空氣汙染",臺南市永康區中山南路1068號,23.025602,120.25605
UN201806190293,"2018-06-19 18:03:36",永康區,髒亂及汙染,空氣汙染,"永康區大灣路1014號  空氣汙染",臺南市永康區大灣路1014號,22.999921,120.253194
UN201806190304,"2018-06-19 18:43:34",永康區,交通運輸,號誌秒差調整,"永康區中華路620號至中正南路口，往奇美醫院方向 號誌不連鎖",臺南市永康區中華路620號,23.014217,120.230504
UN201806190305,"2018-06-19 18:45:29",中西區,違規停車,違規停車,"中西區友愛街92號前巷口 違規停車",臺南市中西區友愛街92號,22.991599,120.199293
