UN201806190046,"2018-06-19 08:18:18",安平區,違規停車,違規停車,"安平區文平路400號 紅線違停",安平區文平路400號,22.9922187,120.1787212
UN201806190048,"2018-06-19 08:19:13",東區,交通運輸,號誌故障,"東區東光路凱學路 號誌故障",東區東光路凱學路,22.9997281,120.2270277
UN201806190056,"2018-06-19 08:39:32",善化區,道路維修,路樹傾倒,"善化區進學路 路樹倒塌",善化區進學路,23.1504596,120.287517
UN201806190057,"2018-06-19 08:40:54",歸仁區,道路維修,路面坑洞,"歸仁區大武路三段 道路維修",歸仁區大武路三段,22.915724,120.2687347
UN201806190064,"2018-06-19 08:48:40",中西區,違規停車,違規停車,中西區民族路二段31-55號違規停車,中西區民族路二段31-55號,23.0110042,120.2263303
UN201806190068,"2018-06-19 08:56:13",新營區,違規停車,違規停車,"新營區復興路23號  違規停車",新營區復興路23號,23.302675,120.312934
UN201806190072,"2018-06-19 09:01:30",永康區,違規停車,違規停車,"永康區成功路172巷1號對面、10號對面 違規停車",永康區成功路172巷1號,22.9997281,120.2270277
UN201806190073,"2018-06-19 09:08:14",安南區,違規停車,違規停車,"安南區安中路四段320巷巷口 紅線違停",安南區安中路四段320巷,22.9997281,120.2270277
UN201806190078,"2018-06-19 09:13:33",北區,違規停車,違規停車,"北區實踐街103巷2號 違規停車",北區實踐街103巷2號,23.0136336,120.2200379
UN201806190079,"2018-06-19 09:14:18",永康區,違規停車,違規停車,"永康區南台街36號   違規停車",永康區南台街36號,22.9997281,120.2270277
UN201806190082,"2018-06-19 09:18:20",永康區,違規停車,違規停車,永康區中華路7巷38號的對面違規停車,永康區中華路7巷38號,23.020116,120.2238778
UN201806190083,"2018-06-19 09:30:37",永康區,違規停車,違規停車,"永康區中正南路242巷4弄內 違停",永康區中正南路242巷4弄,22.9997281,120.2270277
UN201806190084,"2018-06-19 09:33:19",安南區,民生管線,停電、漏電、電線掉落、孔蓋鬆動,"安南區安通路四段30號 停電",安南區安通路四段30號,22.9997281,120.2270277
UN201806190085,"2018-06-19 09:33:58",東山區,路燈故障,10盞以上路燈故障,"東山休息站( 路燈放亮",東山休息站,22.9997281,120.2270277
UN201806190105,"2018-06-19 10:34:43",北區,違規停車,違規停車,"北區開南街與開南街275巷轉角 違規停車",北區開南街275巷,22.9997281,120.2270277
UN201806190107,"2018-06-19 10:42:52",永康區,髒亂及汙染,道路散落物,"永康區中山南路471巷 道路散落物",永康區中山南路471巷,22.9997281,120.2270277
UN201806190110,"2018-06-19 10:45:59",北區,違規停車,違規停車,"北區開元路501號 違規停車",704台南市北區開元路501號,23.0102471,120.2247606
UN201806190112,"2018-06-19 10:47:21",中西區,髒亂及汙染,其他汙染舉發,"中西區中正路98號 其他汙染舉發",中西區中正路98號,22.9925402,120.2003572
UN201806190116,"2018-06-19 10:58:27",東區,違規停車,違規停車,"東區北門路一段280號 違規停車",701台南市東區北門路一段280號,22.9955566,120.2120081
UN201806190118,"2018-06-19 11:06:54",永康區,道路維修,人孔蓋或溝蓋聲響鬆動,"永康區大仁街197號 孔蓋鬆動",永康區大仁街197號,22.9997281,120.2270277
UN201806190123,"2018-06-19 11:14:31",仁德區,民生管線,電信孔蓋鬆動、電信線路掉落、電信桿傾倒,"仁德區中正路三段523巷104號前 中華電信電桿倒塌",仁德區中正路三段523巷104號,22.9873612,120.2547733
UN201806190125,"2018-06-19 11:16:26",關廟區,違規停車,違規停車,"關廟區民族街19巷1號  違規停車",關廟區民族街19巷1號,22.9997281,120.2270277
UN201806190126,"2018-06-19 11:17:02",安南區,交通運輸,號誌故障,"安南區安明路四段*安清路一段   號誌故障",安南區安明路四段安清路一段,23.0586312,120.1341886
UN201806190130,"2018-06-19 11:38:04",中西區,違規停車,違規停車,"中西區國華街三段183號  違規停車",中西區國華街三段183號,22.9997281,120.2270277
UN201806190131,"2018-06-19 11:38:39",南化區,髒亂及汙染,道路散落物,"南化區西埔里8號 狗屍體",南化區西埔里8號,22.9997281,120.2270277
UN201806190136,"2018-06-19 11:48:44",東區,噪音舉發,妨礙安寧,"東區衛國街33巷10號 噪音",東區衛國街33巷10號,22.9871826,120.2217464
UN201806190138,"2018-06-19 11:54:15",永康區,違規停車,違規停車,"永康區中山南路106之3號. 違規停車",永康區中山南路106之3號,23.0130964,120.22989
UN201806190144,"2018-06-19 12:13:34",南區,違規停車,違規停車,"南區新興路176號  違規停車",南區新興路176號,22.9775469,120.1939234
UN201806190146,"2018-06-19 12:15:36",南區,騎樓舉發,騎樓舉發,"南區金華路二段84號  佔用騎樓",南區金華路二段84號,22.9871826,120.2217464
UN201806190147,"2018-06-19 12:21:17",永康區,違規停車,違規停車,"永康區大武街33號 違規停車",永康區大武街33號,22.9997281,120.2270277
UN201806190151,"2018-06-19 12:36:18",中西區,違規停車,違規停車,"中西區永福路二段95、99號 違規停車",中西區永福路二段95、99號,22.9932543,120.2009618
UN201806190155,"2018-06-19 12:40:32",東區,違規停車,違規停車,"東區北門路一段310號 違規停車",東區北門路一段310號,22.996334,120.2120668
UN201806190156,"2018-06-19 12:41:49",中西區,違規停車,違規停車,"中西區金華路四段*文賢路32巷  違規停車",中西區金華路四段*文賢路32巷,22.9997281,120.2270277
UN201806190159,"2018-06-19 12:49:58",永康區,髒亂及汙染,道路散落物,"永康區中華路跟中山南路交叉口 散落物",永康區中華路中山南路,23.0134956,120.2306997
UN201806190161,"2018-06-19 12:51:28",北區,違規停車,違規停車,"北區西門路三段18號 違規停車",北區西門路三段18號,23.0000759,120.2016954
UN201806190165,"2018-06-19 13:09:52",永康區,違規停車,違規停車,"永康區中山南路70號  違規停車",永康區中山南路70號,23.0124561,120.22873
UN201806190169,"2018-06-19 13:24:54",安南區,路燈故障,9盞以下路燈故障,"安南區九份子重劃區生態街 路燈故障",安南區九份子重劃區生態街,22.9997281,120.2270277
UN201806190170,"2018-06-19 13:27:38",永康區,道路維修,路面坑洞,"永康區中華路449巷巷口  坑洞",永康區中華路449巷,22.9995685,120.1377085
UN201806190174,"2018-06-19 13:35:20",中西區,交通運輸,號誌故障,"中西區西和路*和真街    號誌故障",中西區西和路和真街,23.0007072,120.1892512
UN201806190178,"2018-06-19 13:40:23",安平區,違規停車,違規停車,"安平區永華路二段280號  違規停車",安平區永華路二段280號,22.9893773,120.1828119
UN201806190180,"2018-06-19 13:48:57",安平區,違規停車,違規停車,"安平區永華路二段857號  違規停車",安平區永華路二段857號,22.9990981,120.1907774
UN201806190186,"2018-06-19 14:05:52",中西區,違規停車,違規停車,"中西區臨安路一段72號 違規停車",中西區臨安路一段72號,22.9990981,120.1907774
UN201806190189,"2018-06-19 14:14:57",中西區,違規停車,違規停車,"中西區西門路一段  違規停車",中西區西門路一段,22.9997281,120.2270277
UN201806190195,"2018-06-19 14:26:18",歸仁區,噪音舉發,妨礙安寧,"歸仁區文化街三段20號郭英補習班附近 妨害安寧",歸仁區文化街三段20號,22.9710235,120.2875562
UN201806190196,"2018-06-19 14:29:54",北區,違規停車,違規停車,"北區開元路126號 違規停車",北區開元路126號,22.9990981,120.1907774
UN201806190202,"2018-06-19 14:35:06",永康區,道路維修,路面坑洞,"永康區新民街12號  路面毀損",永康區新民街12號,23.0402555,120.2435506
UN201806190206,"2018-06-19 14:38:00",新化區,交通運輸,佔用道路,"新化區中山路256號 占用道路",新化區中山路256號,22.9990981,120.1907774
UN201806190215,"2018-06-19 14:57:54",北區,違規停車,違規停車,"北區北忠街58巷37號  違規停車",北區北忠街58巷37號,22.9995583,120.2112863
UN201806190220,"2018-06-19 15:02:47",北區,違規停車,違規停車,"北區林森路三段77號  違規停車",北區林森路三段77號,22.9969604,120.2031003
UN201806190227,"2018-06-19 15:15:42",永康區,違規停車,違規停車,"永康區中華路1號 違停",永康區中華路1號,22.9997281,120.2270277
UN201806190228,"2018-06-19 15:16:38",東區,道路維修,路面坑洞,東區東門路與慶東街711前方路面坑洞,東區東門路慶東街,22.9997281,120.2270277
UN201806190230,"2018-06-19 15:18:33",南區,違規停車,違規停車,"南區新興路243號  違規停車",南區新興路243號,22.9766585,120.1931607
UN201806190234,"2018-06-19 15:24:01",中西區,違規停車,違規停車,"中西區康樂街 民生路~民權路  違停",中西區康樂街,22.9967324,120.1956879
UN201806190238,"2018-06-19 15:46:47",永康區,道路維修,路面坑洞,"永康區大灣交流道  路面坑洞",永康區大灣交流道,22.9997281,120.2270277
UN201806190239,"2018-06-19 15:51:49",永康區,違規停車,違規停車,"永康區鹽忠街130號   違規停車",永康區鹽忠街130號,23.0417914,120.2327215
UN201806190241,"2018-06-19 15:57:06",新市區,違規停車,違規停車,"新市區中正路296號   違規停車",新市區中正路296號,22.9997281,120.2270277
UN201806190243,"2018-06-19 16:00:56",中西區,違規停車,違規停車,"中西區金華路*民生路二段  違停",中西區金華路民生路二段,23.0110042,120.2263303
UN201806190244,"2018-06-19 16:01:14",南區,違規停車,違規停車,"南區夏林路220之2號 違規停車",南區夏林路220之2號,22.9794161,120.194821
UN201806190245,"2018-06-19 16:03:31",東區,違規停車,違規停車,"東區東門路一段257號 違規停車",東區東門路一段257號,22.9997281,120.2270277
UN201806190248,"2018-06-19 16:06:04",永康區,違規停車,違規停車,"永康區正南一街148號 違規停車",永康區正南一街148號,22.9997281,120.2270277
UN201806190249,"2018-06-19 16:06:39",中西區,違規停車,違規停車,"中西區府連路59號 違規停車",中西區府連路59號,22.9828118,120.2097478
UN201806190252,"2018-06-19 16:13:58",中西區,違規停車,違規停車,"中西區府連路117號，法華街71巷路口 違規停車",中西區府連路117號法華街71巷,22.9997281,120.2270277
UN201806190254,"2018-06-19 16:21:48",南區,髒亂及汙染,空氣汙染,"南區健康路二段45號 髒亂及汙染",南區健康路二段45號,22.9794161,120.194821
UN201806190257,"2018-06-19 16:31:49",後壁區,動物救援,遊蕩犬隻捕捉管制,"後壁區長安里119號, 遊蕩犬隻捕捉管制","後壁區長安里119號,",22.9997281,120.2270277
UN201806190260,"2018-06-19 16:42:36",永康區,違規停車,違規停車,"永康區小東路591巷口 違停",永康區小東路591巷,22.9829968,120.2790766
UN201806190262,"2018-06-19 16:43:33",永康區,違規停車,違規停車,"永康區復國一路375號 違規停車",永康區復國一路375號,23.0128209,120.2464532
UN201806190268,"2018-06-19 16:50:38",安南區,違規停車,違規停車,"安南區安中路四段320巷*306巷 違規停車",安南區安中路四段320巷*306巷,22.9997281,120.2270277
UN201806190270,"2018-06-19 16:57:09",中西區,違規停車,違規停車,"中西區建業街45號  違規停車",中西區建業街45號,22.9829968,120.2790766
UN201806190272,"2018-06-19 16:59:45",中西區,違規停車,違規停車,"中西區健康路一段320號 違規停車",中西區健康路一段320號,22.9816017,120.2025376
UN201806190278,"2018-06-19 17:20:29",中西區,違規停車,違規停車,"中西區健康路一段320號 違規停車",中西區健康路一段320號,22.9816017,120.2025376
UN201806190280,"2018-06-19 17:21:03",東區,道路維修,地下道積水,東區東門路東門圓環地下道積水,東區東門路東門圓環地下道,22.9891699,120.2112925
UN201806190282,"2018-06-19 17:29:37",南區,騎樓舉發,騎樓舉發,"南區金華路二段302號 騎樓舉發",南區金華路二段302號,22.9828804,120.191773
UN201806190283,"2018-06-19 17:33:23",永康區,髒亂及汙染,空氣汙染,"永康區中山南路1068號 空氣汙染",永康區中山南路1068號,22.9995583,120.2112863
UN201806190285,"2018-06-19 17:42:37",中西區,交通運輸,佔用道路,"中西區西門路一段跟五妃街交叉路口  佔用道路",中西區西門路一段五妃街,23.311885,120.316014
UN201806190293,"2018-06-19 18:03:36",永康區,髒亂及汙染,空氣汙染,"永康區大灣路1014號  空氣汙染",永康區大灣路1014號,22.9998521,120.2530293
UN201806190294,"2018-06-19 18:08:37",北區,違規停車,違規停車,"北區開元路跟勝利路十字路  紅線違停",北區開元路勝利路,23.006652,120.2184778
UN201806190298,"2018-06-19 18:36:05",永康區,道路維修,路面坑洞,"永康區大灣東路，近大灣二街 坑洞",永康區大灣東路大灣二街,23.0013884,120.2692032
UN201806190302,"2018-06-19 18:40:16",仁德區,道路維修,路面坑洞,"仁德區仁德交流道  路面坑洞",仁德區仁德交流道,22.973321,120.245101
UN201806190304,"2018-06-19 18:43:34",永康區,交通運輸,號誌秒差調整,"永康區中華路620號至中正南路口，往奇美醫院方向 號誌不連鎖",永康區中華路620號,23.014236,120.2305306
UN201806190305,"2018-06-19 18:45:29",中西區,違規停車,違規停車,"中西區友愛街92號前巷口 違規停車",中西區友愛街92號,22.9916852,120.1992381
UN201806190307,"2018-06-19 18:56:43",中西區,違規停車,違規停車,"中西區健康路一段152號前 違規停車",中西區健康路一段152號,22.9997281,120.2270277
UN201806190308,"2018-06-19 18:57:30",安南區,動物救援,犬貓急難救援,"安南區國安街156巷170號 貓躲車中",安南區國安街156巷170號,23.0262707,120.1868616
UN201806190310,"2018-06-19 18:59:26",安南區,路燈故障,9盞以下路燈故障,"安南區義吉街118巷12號 路燈故障",安南區義吉街118巷12號,22.9997281,120.2270277
UN201806190311,"2018-06-19 19:00:44",永康區,交通運輸,交通疏導,"永康區中正南路與中華路口 交通疏導",永康區中正南路中華路,23.0236302,120.2181546
UN201806190314,"2018-06-19 19:06:51",南區,髒亂及汙染,空氣汙染,"區金華路二段76號，四海遊龍 空污",區金華路二段76號,22.9775735,120.1913152
UN201806190315,"2018-06-19 19:10:12",安南區,路燈故障,9盞以下路燈故障,"安南區海佃路二段700巷13號、15號 路燈故障",安南區海佃路二段700巷13號、15號,22.9916852,120.1992381
UN201806190316,"2018-06-19 19:14:12",中西區,路燈故障,9盞以下路燈故障,"中西區郡西路，介於保安路與大勇街間 路燈不亮",中西區郡西路,22.9463672,120.2315981
UN201806190318,"2018-06-19 19:16:12",中西區,路燈故障,9盞以下路燈故障,"中西區西賢一街109巷內 路燈故障",中西區西賢一街109巷內,23.0020367,120.1772193
UN201806190320,"2018-06-19 19:21:19",仁德區,道路維修,路面坑洞,"仁德區文華路二段 路面坑洞",仁德區文華路二段,22.9463672,120.2315981
UN201806190325,"2018-06-19 19:47:12",歸仁區,路燈故障,9盞以下路燈故障,"歸仁區中山路三段*民權路 路燈故障",歸仁區中山路三段*民權路,22.9674094,120.2879064
UN201806190327,"2018-06-19 19:51:10",北區,違規停車,違規停車,"北區開元路501號 違規停車",704台南市北區開元路501號,23.0102471,120.2247606
UN201806190329,"2018-06-19 19:52:26",中西區,動物救援,犬貓急難救援,"中西區南門路225之3號  動物救援",中西區南門路225之3號,22.9997281,120.2270277
UN201806190331,"2018-06-19 19:58:31",南區,路燈故障,9盞以下路燈故障,"南區中華西路一段18巷  路燈故障",南區中華西路一段18巷,22.9651118,120.1842249
UN201806190332,"2018-06-19 19:59:45",中西區,違規停車,違規停車,"中西區中山路209號 違規停車",700台南市中西區中山路209號,22.9968458,120.2112234
UN201806190333,"2018-06-19 20:00:01",東區,路燈故障,9盞以下路燈故障,"東區富農街一段36巷內 路燈故障",東區富農街一段36巷,22.9783786,120.2347327
UN201806190334,"2018-06-19 20:02:43",歸仁區,道路維修,路面坑洞,"歸仁區南丁路，陸軍基地輕航基地前 坑洞",歸仁區南丁路,22.9829968,120.2790766
UN201806190339,"2018-06-19 20:08:15",北區,違規停車,違規停車,"北區東豐路227巷12號 違規停車",北區東豐路227巷12號,22.9997281,120.2270277
UN201806190340,"2018-06-19 20:10:26",中西區,路燈故障,9盞以下路燈故障,"中西區海安路二段*民權路到民族路 西側 路燈故障不亮",中西區海安路二段*民權路*民族路,22.9463672,120.2315981
UN201806190341,"2018-06-19 20:15:09",北區,路燈故障,9盞以下路燈故障,"北區西門路四段533巷8號附近 路燈不亮",北區西門路四段533巷8號,23.021075,120.211149
UN201806190343,"2018-06-19 20:19:57",中西區,路燈故障,9盞以下路燈故障,"中西區五妃街309巷10號 路燈不亮",中西區五妃街309巷10號,22.9783786,120.2347327
UN201806190344,"2018-06-19 20:21:09",安南區,違規停車,違規停車,"安南區安中路四段320巷*306巷  違規停車",安南區安中路四段320巷*306巷,22.9997281,120.2270277
UN201806190347,"2018-06-19 20:31:38",新市區,違規停車,違規停車,"新市區復興路67號 違規停車",新市區復興路67號,22.9997281,120.2270277
UN201806190348,"2018-06-19 20:32:33",新市區,違規停車,違規停車,"新市區復興路101號 違規停車",新市區復興路101號,23.082665,120.2952933
UN201806190349,"2018-06-19 20:33:20",新市區,違規停車,違規停車,"新市區中正路台19甲線166號 違規停車",新市區中正路台19甲線166號,23.1061828,120.2946498
UN201806190350,"2018-06-19 20:34:17",新市區,違規停車,違規停車,"新市區復興路台19甲線37號 違規停車",新市區復興路台19甲線37號,23.1061828,120.2946498
UN201806190353,"2018-06-19 20:35:05",新市區,違規停車,違規停車,"新市區中正路台19甲線241號 違規停車",新市區中正路台19甲線241號,22.9967324,120.1956879
UN201806190354,"2018-06-19 20:35:40",新市區,違規停車,違規停車,"新市區中正路台19甲線252號 違規停車",新市區中正路台19甲線252號,23.1061828,120.2946498
UN201806190356,"2018-06-19 20:38:24",東區,違規停車,違規停車,"東區長榮路二段，長榮中學側門 違停",東區長榮路二段,22.9894751,120.2199954
UN201806190357,"2018-06-19 20:38:25",安平區,違規停車,違規停車,"安平區安平路590號 違規停車",708台南市安平區安平路590號,22.9997281,120.2270277
UN201806190358,"2018-06-19 20:39:42",新市區,違規停車,違規停車,"新市區和平街89號 違規停車",新市區和平街89號,23.080588,120.2932449
UN201806190359,"2018-06-19 20:41:11",東區,動物救援,犬貓急難救援,"東區崇德路1035號 貓闖入住家內",東區崇德路1035號,22.9997281,120.2270277
UN201806190360,"2018-06-19 20:45:38",中西區,違規停車,違規停車,"中西區民族路二段42號 違規停車",中西區民族路二段42號,22.9946351,120.2107863
UN201806190361,"2018-06-19 20:45:47",中西區,道路維修,路面坑洞,"中西區中華西路二段685號，宜得利家居 坑洞",中西區中華西路二段685號,22.9997281,120.2270277
UN201806190364,"2018-06-19 21:03:39",安平區,違規停車,違規停車,"安平區民權路四段502號右側 違規停車",安平區民權路四段502號,22.999752,120.1726934
UN201806190366,"2018-06-19 21:14:17",永康區,髒亂及汙染,空氣汙染,"永康區大灣路1014號 鍵誠紡織 空氣汙染",永康區大灣路1014號,22.9998521,120.2530293
UN201806190371,"2018-06-19 21:39:27",永康區,違規停車,違規停車,"永康區南台街36號 違規停車",710台南市永康區南台街36號,22.9997281,120.2270277
UN201806190374,"2018-06-19 21:43:34",安平區,違規停車,違規停車,"安平區安平路60號左右兩邊 違規停車",安平區安平路60號,22.999752,120.1726934
UN201806190377,"2018-06-19 21:57:59",安平區,違規停車,違規停車,"安平區安平路312號左側邊 違規停車",安平區安平路312號,22.9984768,120.1778887
UN201806190378,"2018-06-19 21:59:33",安平區,違規停車,違規停車,"安平區永華路二段500號 違停",安平區永華路二段500號,22.9904803,120.1753267
UN201806190379,"2018-06-19 22:06:35",北區,違規停車,違規停車,北區開元路501號違規停車,704台南市北區開元路501號,23.0102471,120.2247606
UN201806190380,"2018-06-19 22:13:35",安平區,噪音舉發,場所連續噪音,"安平區育平路172號 場所連續噪音",安平區育平路172號,22.9895443,120.1668889
UN201806190383,"2018-06-19 22:30:26",中西區,路燈故障,9盞以下路燈故障,"中西區武聖路237號 9盞以下路燈故障",中西區武聖路237號,23.0070151,120.1887394
UN201806190384,"2018-06-19 22:33:08",永康區,髒亂及汙染,空氣汙染,"永康區大灣路1014號，鍵誠紡織 空污",永康區大灣路1014號,22.9998521,120.2530293
UN201806190388,"2018-06-19 23:03:29",中西區,違規停車,違規停車,"中西區民生路二段132號 違停",中西區民生路二段132號,22.9957789,120.1958023
UN201806190389,"2018-06-19 23:05:57",中西區,路燈故障,9盞以下路燈故障,"中西區民族路二段，武廟前 路燈不亮",中西區民族路二段,22.99568,120.2057441
UN201806190390,"2018-06-19 23:09:03",安南區,路燈故障,10盞以上路燈故障,"安南區四草大橋，近四草大道 路燈不亮",安南區四草大橋,22.9995685,120.1377085
UN201806190391,"2018-06-19 23:20:29",中西區,違規停車,違規停車,"中西區北門路一段173號 違規停車",中西區北門路一段173號,22.9961358,120.2117247
UN201806190392,"2018-06-19 23:22:02",北區,路燈故障,9盞以下路燈故障,"北區開南街275巷4弄底，柴頭港溪 路燈不亮",北區開南街275巷4弄,23.0042122,120.2290769
UN201806190396,"2018-06-19 23:52:42",新市區,違規停車,違規停車,"新市區復興路67號 違規停車",復興路67號,22.999752,120.1726934
UN201806200002,"2018-06-20 00:28:43",中西區,路燈故障,9盞以下路燈故障,"中西區永華一街148巷 9盞以下路燈故障",中西區永華一街148巷,22.9997281,120.2270277
UN201806200007,"2018-06-20 00:45:10",永康區,道路維修,路面下陷、凹陷,"永康區中華路跟中華二路 路面下陷、凹陷","永康區中華路 中華二路",23.0084725,120.2338582
UN201806200008,"2018-06-20 01:20:20",仁德區,動物救援,犬貓急難救援,"仁德區義林六街43號   犬貓急難救援",仁德區義林六街43號,22.9997281,120.2270277
UN201806200009,"2018-06-20 01:28:02",南區,路燈故障,9盞以下路燈故障,"南區中華西路一段109巷70號 9盞以下路燈故障",南區中華西路一段109巷70號,22.981477,120.1830353
UN201806200012,"2018-06-20 01:49:18",永康區,違規停車,違規停車,"永康區復國一路389巷29弄21號 違規停車",復國一路389巷29弄21號,23.0117613,120.2453194
UN201806200017,"2018-06-20 04:15:57",安平區,噪音舉發,妨害安寧,安平區建平七街26巷/中華西路二段49巷24弄妨害安寧,"安平區建平七街26巷 中華西路二段49巷24弄",22.9884497,120.1861718
UN201806200018,"2018-06-20 05:26:54",安南區,違規停車,違規停車,"安南區怡安路二段535巷5弄4號 違規停車",怡安路二段535巷5弄4號旁空地前,23.0440084,120.1955614
UN201806200021,"2018-06-20 06:20:36",永康區,違規停車,違規停車,"永康區中華西街122巷33號 違規停車",中華西街122巷33號對面,23.015787,120.228056
UN201806200025,"2018-06-20 06:44:43",安定區,交通運輸,佔用道路,"安定區大同里牛肉寮115號之5  佔用道路",安定區大同里牛肉寮115號之5,23.0785398,120.2287669
UN201806200033,"2018-06-20 07:27:19",新市區,違規停車,違規停車,"新市區台19甲線復興路67號 違規停車",新市區台19甲線復興路67號,22.9997281,120.2270277
UN201806200038,"2018-06-20 07:50:59",永康區,違規停車,違規停車,"永康區南台街36號 違規停車",台南市永康區南台街36號,23.022328,120.223467
UN201806200039,"2018-06-20 07:51:00",東區,違規停車,違規停車,東區仁和路108之2號前　違規停車,東區仁和路108之2號,22.9681557,120.2354791
UN201806200040,"2018-06-20 07:55:04",中西區,違規停車,違規停車,"中西區城隍街的青年路口到民權路口雙側 違規停車",中西區城隍街青年路,22.9919116,120.2090264
UN201806200042,"2018-06-20 07:58:20",安平區,違規停車,違規停車,"安平區安平路312號左側邊 違規停車",安平區安平路312號,22.9997281,120.2270277
UN201806200043,"2018-06-20 08:00:27",新市區,違規停車,違規停車,"新市區中正路296號    違規停車",新市區中正路296號,22.9997281,120.2270277
UN201806200047,"2018-06-20 08:10:31",中西區,路燈故障,9盞以下路燈故障,"中西區永華一街148巷 路燈故障",中西區永華一街148巷,22.9997281,120.2270277
UN201806200053,"2018-06-20 08:24:52",安平區,動物救援,遊蕩犬隻捕捉管制,"安平區建平十七街及永華三街交叉處  流浪犬捕捉",安平區建平十七街永華三街交叉處,22.997443,120.182334
UN201806200057,"2018-06-20 08:27:35",東區,路燈故障,9盞以下路燈故障,"東區小東路254巷18弄24號前  路燈不亮",東區小東路254巷18弄24號,22.9979336,120.2300078
UN201806200058,"2018-06-20 08:32:51",北區,噪音舉發,場所連續噪音,"文賢抽水站 噪音",文賢抽水站,23.013958,120.1863323
UN201806200064,"2018-06-20 08:45:29",山上區,民生管線,漏水、停水、消防栓漏水或損壞,"山上區北勢洲90之1號 水管破裂",山上區北勢洲90之1號,23.10695,120.337908
