UN201807040176,"2018-07-04 12:38:57",中西區,道路維修,人孔蓋凹陷坑洞,"中西區中華西路民權路 道路坑洞",中西區中華西路民權路,22.9988862,120.1866528
UN201807040177,"2018-07-04 12:39:01",南區,髒亂及汙染,道路散落物,"南區中華西路一段59號 髒亂及汙染",南區中華西路一段59號,22.996098,120.210078
UN201807040178,"2018-07-04 12:40:31",中西區,違規停車,違規停車,"中西區建業街2號到40號 違規停車",中西區建業街2號到40號,22.9887695,120.2073768
UN201807040180,"2018-07-04 12:40:58",永康區,道路維修,路面坑洞,"永康區中正北路888號 路面坑洞",永康區中正北路888號,23.0429318,120.1866854
UN201807040181,"2018-07-04 12:42:48",中西區,違規停車,違規停車,"中西區南門路211到215號 違規停車",中西區南門路211到215號,22.9849908,120.2042312
UN201807040183,"2018-07-04 12:44:15",中西區,違規停車,違規停車,"中西區南門路19號到23號 違規停車",中西區南門路19號到23號,22.9918649,120.2050316
UN201807040184,"2018-07-04 12:45:25",中西區,違規停車,違規停車,"中西區中山路12號到52號 違規停車",中西區中山路12號到52號,22.9937782,120.2072223
UN201807040186,"2018-07-04 12:46:58",中西區,違規停車,違規停車,"中西區衛民街145到125號 違規停車",中西區衛民街145到125號,23.1595208,120.1343098
UN201807040188,"2018-07-04 12:52:30",歸仁區,違規停車,違規停車,"歸仁區中山路一段與信義北路路口 違規停車",歸仁區中山路一段,23.0181415,120.2567547
UN201807040189,"2018-07-04 12:55:03",中西區,違規停車,違規停車,"中西區民族路國華街 違規停車",中西區民族路國華街,22.9977345,120.1990447
UN201807040190,"2018-07-04 13:00:11",中西區,違規停車,違規停車,"中西區民權路二段236號 違規停車",中西區民權路二段236號,22.9997281,120.2270277
UN201807040192,"2018-07-04 13:05:36",東區,髒亂及汙染,空氣汙染,"東區富農街一段131巷50號  空氣汙染",東區富農街一段131巷50號,22.9819671,120.232954
UN201807040197,"2018-07-04 13:20:51",北區,違規停車,違規停車,"北區北園街8巷 違規停車",北區北園街8巷,23.0921772,120.268004
UN201807040198,"2018-07-04 13:24:33",永康區,道路維修,路面坑洞,"永康區小東路  路面坑洞",永康區小東路,23.0181415,120.2567547
UN201807040203,"2018-07-04 13:44:18",新市區,髒亂及汙染,其他汙染舉發,"新市區中山路138之4號  噪音汙染/環境髒亂",新市區中山路138之4號,23.0879437,120.3058215
UN201807040214,"2018-07-04 14:14:43",中西區,違規停車,違規停車,"中西區西華南街32號35號  違規停車",中西區西華南街32號35號,22.9937988,120.2094961
UN201807040218,"2018-07-04 14:18:46",中西區,違規停車,違規停車,"中西區民族路二段2號到66、3號到63號  號違規停車",中西區民族路二段2號到66號,22.9946526,120.2115926
UN201807040219,"2018-07-04 14:20:24",東區,違規停車,違規停車,"東區前鋒路  違規停車",東區前鋒路,22.9977345,120.1990447
UN201807040236,"2018-07-04 14:43:07",永康區,違規停車,違規停車,永康區成功路172巷1號對面和10號對面違規停車,永康區成功路172巷1號/10號,23.0103457,120.2336333
UN201807040239,"2018-07-04 15:02:50",,,,"柳營區柳營外環道  路面坑洞",柳營區柳營外環道,22.9997281,120.2270277
UN201807040244,"2018-07-04 15:13:59",南區,違規停車,違規停車,"南區體育路競技場與歡喜樓 違規停車",南區體育路競技場歡喜樓,22.9887695,120.2073768
UN201807040245,"2018-07-04 15:15:06",安南區,路燈故障,9盞以下路燈故障,"安南區仁安二街與智安三街路口  路燈故障",安南區仁安二街智安三街路,22.9997281,120.2270277
UN201807040249,"2018-07-04 15:18:44",歸仁區,噪音舉發,妨害安寧,"歸仁區文化街三段20號 妨礙安寧",歸仁區文化街三段20號,22.9710235,120.2875562
UN201807040250,"2018-07-04 15:22:22",中西區,交通運輸,佔用道路,"中西區府前路一段  違規設攤",中西區府前路一段,22.9890622,120.204325
UN201807040251,"2018-07-04 15:25:13",歸仁區,民生管線,漏水、停水、消防栓漏水或損壞,"歸仁區長榮路二段75巷390號 民生管線",歸仁區長榮路二段75巷390號,22.985069,120.1718371
UN201807040258,"2018-07-04 15:41:56",北區,交通運輸,號誌故障,"北區海安路三段71巷1號 號誌故障",北區海安路三段71巷1號,23.0025253,120.1991031
UN201807040259,"2018-07-04 15:42:57",中西區,違規停車,違規停車,"中西區府前路和環河街口，蔥肉餅店附近 違停",中西區府前路環河街,22.9917192,120.1916946
UN201807040261,"2018-07-04 15:51:25",永康區,髒亂及汙染,空氣汙染,"永康區大灣路1014號，鍵誠紡織廠 空氣污染",永康區大灣路1014號,22.9998521,120.2530293
UN201807040262,"2018-07-04 15:52:32",安定區,交通運輸,佔用道路,"安定區蘇林里72之14號 佔用道路",安定區蘇林里72之14號,22.9997281,120.2270277
UN201807040263,"2018-07-04 15:57:51",佳里區,違規停車,違規停車,"佳里區中央公路奇美醫院 違規停車",佳里區中央公路,23.1707331,120.1791798
UN201807040264,"2018-07-04 15:59:39",中西區,路燈故障,9盞以下路燈故障,"中西區中成路50號和56號前各一盞路燈 路燈亮滅",中西區中成路50號,22.9978733,120.2053356
UN201807040266,"2018-07-04 16:04:59",中西區,違規停車,違規停車,"中西區民族路二段227號到243號 違規停車",民族路二段227號,22.9997281,120.2270277
UN201807040268,"2018-07-04 16:10:44",永康區,違規停車,違規停車,"永康區東橋五路353號 違規停車",東橋五路353號,22.9997281,120.2270277
UN201807040269,"2018-07-04 16:13:47",永康區,路燈故障,9盞以下路燈故障,"永康區中山北路264巷11弄整條 路燈不亮",永康區中山北路264巷11弄,23.0282633,120.2654911
UN201807040271,"2018-07-04 16:18:09",中西區,違規停車,違規停車,"中西區西華南街47號 違規停車",西華南街47號,22.9940988,120.2094595
UN201807040277,"2018-07-04 16:37:18",東區,違規停車,違規停車,"東區中華東路三段360號  違規停車",東區中華東路三段360號,22.9738271,120.2206839
UN201807040285,"2018-07-04 16:58:01",南區,違規停車,違規停車,"南區健康路一段345號 違規停車",健康路一段345號,22.9812982,120.2017431
UN201807040286,"2018-07-04 17:00:41",安南區,道路維修,路面下陷、凹陷,"安南區本田路二段和工業二路 路面下陷",安南區本田路二段工業二路,23.0381263,120.1551982
UN201807040291,"2018-07-04 17:15:16",北區,違規停車,違規停車,"北區台南車站公車北站 違規停車",北區台南車站公車北站,22.9997281,120.2270277
UN201807040293,"2018-07-04 17:19:57",中西區,髒亂及汙染,環境髒亂,"中西區民權路一段199巷5號 環境髒亂",中西區民權路一段199巷5號,23.1707331,120.1791798
UN201807040297,"2018-07-04 17:27:19",歸仁區,違規停車,違規停車,"歸仁區文化八街18號 違規停車",歸仁區文化八街18號,23.0168655,120.2379337
UN201807040300,"2018-07-04 17:33:39",中西區,違規停車,違規停車,"中西區民族路二段15、66號 違規停車",中西區民族路二段15、66號,22.9997281,120.2270277
UN201807040301,"2018-07-04 17:34:31",中西區,違規停車,違規停車,"中西區民族路二段55號 違規停車",中西區民族路二段55號,22.994323,120.2100841
UN201807040305,"2018-07-04 17:38:53",中西區,違規停車,違規停車,"中西區大同路一段的開山路口到健康路口雙側紅黃線 違規停車",中西區大同路一段的開山路口到健康路口雙側紅黃線,22.9881415,120.2094113
UN201807040306,"2018-07-04 17:39:32",北區,道路維修,路面下陷、凹陷,"北區西門路三段20號 路面下陷",北區西門路三段20號,23.0001288,120.2017299
UN201807040307,"2018-07-04 17:40:38",北區,道路維修,路面坑洞,"北區中華北路一段，近觀海橋，不上橋往六甲頂方向 路面坑洞",北區中華北路一段,22.9997281,120.2270277
UN201807040308,"2018-07-04 17:40:52",中西區,違規停車,違規停車,"中西區大同路一段250巷 違規停車",中西區大同路一段250巷,22.9816737,120.211336
UN201807040310,"2018-07-04 17:44:46",南區,違規停車,違規停車,"南區夏林路224號 違規停車",南區夏林路224號,22.9793174,120.1949508
UN201807040315,"2018-07-04 18:02:23",中西區,道路維修,路面坑洞,"中西區西門路和民生路交叉口路中間 路面坑洞",中西區西門路民生路,22.9955278,120.1962359
UN201807040319,"2018-07-04 18:10:27",中西區,違規停車,違規停車,"中西區忠孝街93巷 違規停車",中西區忠孝街93巷,23.0008446,120.1962722
UN201807040325,"2018-07-04 18:27:24",中西區,違規停車,違規停車,"中西區大同路三段9號11號13號 違規停車",中西區大同路三段9號,22.9467131,120.2196808
UN201807040327,"2018-07-04 18:32:49",中西區,違規停車,違規停車,"中西區衛民街56號 違規停車",中西區衛民街56號,22.9997281,120.2270277
UN201807040328,"2018-07-04 18:33:36",中西區,違規停車,違規停車,"中西區西華南街32號 違規停車",中西區西華南街32號,22.9997281,120.2270277
UN201807040329,"2018-07-04 18:34:22",中西區,違規停車,違規停車,"中西區興華街2號到12號 違規停車",中西區興華街2號,22.9921735,120.2108596
UN201807040331,"2018-07-04 18:42:35",中西區,違規停車,違規停車,"中西區信義街46巷 違規停車",中西區信義街46巷,23.0003654,120.1963955
UN201807040332,"2018-07-04 18:43:14",東區,違規停車,違規停車,"東區中華東路和東門路台安藥局 違規停車",東區中華東路東門路,22.9811847,120.2294154
UN201807040334,"2018-07-04 18:48:35",永康區,違規停車,違規停車,"永康區中華路與中華路485巷口 違規停車",永康區中華路485巷,23.0114748,120.2314399
UN201807040335,"2018-07-04 19:01:19",麻豆區,路燈故障,9盞以下路燈故障,"麻豆區北勢里120號旁 路燈故障",麻豆區北勢里120號,23.2064745,120.2368486
UN201807040339,"2018-07-04 19:06:02",永康區,違規停車,違規停車,"永康區中山南路和中山南路319巷口，真好味臭臭鍋 違規停車",永康區中山南路中山南路319巷,23.0168655,120.2379337
UN201807040341,"2018-07-04 19:11:49",中西區,路燈故障,9盞以下路燈故障,"中西區南華街37號及40號旁 路燈不亮",中西區南華街37號,22.9897693,120.1911617
UN201807040342,"2018-07-04 19:13:06",學甲區,路燈故障,9盞以下路燈故障,"學甲區頂三寮 路燈故障",學甲區頂三寮,23.2336949,120.1804966
UN201807040345,"2018-07-04 19:20:46",東區,路燈故障,9盞以下路燈故障,"東區崇信街87號前 路燈故障",東區崇信街87號,22.9997281,120.2270277
UN201807040347,"2018-07-04 19:27:03",北區,路燈故障,9盞以下路燈故障,"北區和緯路三段350號 路燈故障",北區和緯路三段350號,23.0099261,120.195025
UN201807040351,"2018-07-04 19:35:18",安南區,違規停車,違規停車,"安南區文案街（應是文安街）與北安路路口 違規停車",安南區文安街北安路,23.0275699,120.2045769
UN201807040355,"2018-07-04 19:44:57",永康區,違規停車,違規停車,"永康區六合路42巷1號，巷口 違規停車",永康區六合路42巷1號,22.9997281,120.2270277
UN201807040357,"2018-07-04 19:48:36",中西區,違規停車,違規停車,"中西區永福路一段72號 違規停車",中西區永福路一段72號,23.0099261,120.195025
UN201807040358,"2018-07-04 19:48:51",永康區,違規停車,違規停車,"永康區中山南路和中山南路319巷口，真好味臭臭鍋 違規停車",永康區中山南路中山南路319巷,23.0168655,120.2379337
UN201807040360,"2018-07-04 19:57:26",東區,路燈故障,9盞以下路燈故障,"東區文東街1～43號、93號 路燈不亮",東區文東街93號,22.961556,120.233676
UN201807040361,"2018-07-04 20:01:44",東區,違規停車,違規停車,東區府連路344巷1弄2號紅線違停,東區府連路344巷1弄2號,23.1707331,120.1791798
UN201807040362,"2018-07-04 20:15:22",柳營區,路燈故障,9盞以下路燈故障,"柳營區義士路一段673巷 路燈故障",柳營區義士路一段673巷,23.2843799,120.3685842
UN201807040365,"2018-07-04 20:26:01",安平區,違規停車,違規停車,"安平區安平路60號左邊 違規停車",安平區安平路60號,22.9997281,120.2270277
UN201807040370,"2018-07-04 21:04:03",安定區,髒亂及汙染,環境髒亂,"安定區海寮里203號之4 環境髒亂",安定區海寮里203號之4,22.961556,120.233676
UN201807040374,"2018-07-04 21:30:20",中西區,違規停車,違規停車,"中西區西華南街32號 違規停車",中西區西華南街32號,22.9997281,120.2270277
UN201807040382,"2018-07-04 22:14:49",七股區,路燈故障,9盞以下路燈故障,"七股區篤加里 9盞以下路燈故障",七股區篤加里,23.1595208,120.1343098
UN201807040383,"2018-07-04 22:43:01",東區,路燈故障,9盞以下路燈故障,"東區自由路三段252號對面 路燈不亮",東區自由路三段252號,23.1595208,120.1343098
UN201807040384,"2018-07-04 22:46:14",永康區,路燈故障,9盞以下路燈故障,"永康區永和街1號～102號之間路段 路燈不亮",永康區永和街1號,23.0181415,120.2567547
UN201807040386,"2018-07-04 22:56:35",永康區,動物救援,遊蕩犬隻捕捉管制,"永康區龍安街265號 捕犬",永康區龍安街265號,22.9997281,120.2270277
UN201807040387,"2018-07-04 22:57:24",佳里區,髒亂及汙染,道路散落物,"佳里區安北路網球場，安北路上停放的一台遊覽車旁，靠近路中間 動物屍體",佳里區安北路,22.9997281,120.2270277
UN201807040389,"2018-07-04 23:17:50",東區,噪音舉發,妨害安寧,"東區北門路二段28號，傳奇聚庫PUB 妨害安寧",臺南市東區北門路二段28號,23.000517,120.213375
UN201807040390,"2018-07-04 23:59:50",安南區,噪音舉發,妨害安寧,"安南區北安路二段526號 妨害安寧",安南區北安路二段526號,23.0370185,120.2030762
UN201807050002,"2018-07-05 00:06:58",北區,路燈故障,9盞以下路燈故障,"北區武聖路114巷10號 9盞以下路燈故障",臺南市北區武聖路114巷10號,23.006554,120.191106
UN201807050009,"2018-07-05 03:57:59",永康區,髒亂及汙染,空氣汙染,"永康區大灣路1014號 空氣汙染",臺南市永康區大灣路1014號,22.999921,120.253194
UN201807050054,"2018-07-05 09:37:45",永康區,違規停車,違規停車,"永康區小東路637號   違停",臺南市永康區小東路637號,22.998689,120.23822
UN201807050056,"2018-07-05 09:42:25",北區,違規停車,違規停車,"北區林森路三段181號  違規停車",臺南市北區林森路三段181號,23.006539,120.223982
UN201807050091,"2018-07-05 10:52:34",安南區,違規停車,違規停車,"安南區安和路二段282號  違規停車",臺南市安南區安和路二段282號,23.041963,120.216315
UN201807050123,"2018-07-05 11:58:34",中西區,違規停車,違規停車,"中西區衛民街145號  違規停車",臺南市中西區衛民街145號,22.993399,120.207231
UN201807050130,"2018-07-05 12:20:14",安南區,動物救援,犬貓急難救援,"安南區安寧街54號 犬救援",臺南市安南區安寧街54號,23.022594,120.194252
UN201807050135,"2018-07-05 12:36:42",中西區,違規停車,違規停車,"中西區中山路2號到52號  違規停車",臺南市中西區中山路2號,22.992715,120.205643
UN201807050136,"2018-07-05 12:38:00",中西區,違規停車,違規停車,"中西區西華南街58號  違規停車",臺南市中西區西華南街58號,22.994066,120.20957
UN201807050138,"2018-07-05 12:39:06",中西區,違規停車,違規停車,"中西區衛民街145號  違規停車",臺南市中西區衛民街145號,22.993399,120.207231
UN201807050145,"2018-07-05 13:15:56",永康區,違規停車,違規停車,"永康區六合路42巷50號。巷口  違規停車",臺南市永康區六合路42巷50號,23.009208,120.232462
UN201807050164,"2018-07-05 14:31:22",永康區,髒亂及汙染,空氣汙染,"永康區大灣路1014號 空氣汙染",臺南市永康區大灣路1014號,22.999921,120.253194
UN201807050169,"2018-07-05 14:54:12",東區,騎樓舉發,騎樓舉發,"東區中華東路二段163號  騎樓舉發",臺南市東區中華東路二段163號,22.985113,120.233061
UN201807050183,"2018-07-05 15:36:48",南區,髒亂及汙染,其他汙染舉發,"台南機場門口附近，往86快速道路方向大排水溝 水污染",臺南市南區機場路775號,22.948048,120.21616
