UN201807090004,"2018-07-09 01:37:49",永康區,道路維修,路面坑洞,永康區和平路269巷360弄,永康區和平路269巷360弄,22.9997281,120.2270277
UN201807090005,"2018-07-09 02:39:50",永康區,動物救援,遊蕩犬隻捕捉管制,"永康區鹽洲二街/鹽忠街 遊蕩犬隻捕捉管制","永康區鹽洲二街 鹽忠街",22.9997281,120.2270277
UN201807090007,"2018-07-09 02:50:18",安南區,噪音舉發,妨害安寧,"安南區鹽田路2號 妨害安寧",安南區鹽田路2號,23.0352222,120.1484185
UN201807090008,"2018-07-09 04:38:42",北區,噪音舉發,場所連續噪音,"北區開元路485巷24號 場所連續噪音",北區開元路485巷24號,23.0110962,120.2243803
UN201807090012,"2018-07-09 06:56:07",新化區,噪音舉發,場所連續噪音,"新化區唪口里54之6號 場所連續噪音",新化區唪口里54之6號,22.9997281,120.2270277
UN201807090013,"2018-07-09 06:57:50",新營區,違規停車,違規停車,"新營區復興路1號 違規停車",復興路1號,23.0792851,120.2955182
UN201807090014,"2018-07-09 06:59:51",新營區,違規停車,違規停車,"新營區復興路1號 違規停車",復興路1號,23.0792851,120.2955182
UN201807090015,"2018-07-09 07:00:30",東區,道路維修,路面坑洞,"東區淨修街310號  路面坑洞",東區淨修街310號,22.9739738,120.2379253
UN201807090016,"2018-07-09 07:03:10",安南區,違規停車,違規停車,"安南區安中路四段320巷接近306巷   違停",安南區安中路四段320巷接近306巷,23.0596165,120.1656008
UN201807090018,"2018-07-09 07:13:50",安定區,道路維修,路面坑洞,"安定區安定東路   道路維修",安定區安定東路,23.1209313,120.2492634
UN201807090020,"2018-07-09 07:24:17",新市區,違規停車,違規停車,"新市區中正路67號  違規停車",新市區台19甲線67號,23.0816182,120.2953341
UN201807090022,"2018-07-09 07:39:25",新市區,違規停車,違規停車,"新市區復興路101號  違規停車",新市區復興路101號,23.082665,120.2952933
UN201807090023,"2018-07-09 07:48:39",中西區,違規停車,違規停車,"中西區健康路一段150巷口 違規停車",中西區健康路一段150巷口,23.0792851,120.2955182
UN201807090027,"2018-07-09 08:04:20",新市區,違規停車,違規停車,"新市區復興路67號 違規停車",新市區台19甲線67號,23.0816182,120.2953341
UN201807090031,"2018-07-09 08:22:54",東區,民生管線,電信孔蓋鬆動、電信線路掉落、電信桿傾倒,"東區崇善路913巷36號,中華電信傾斜",東區崇善路913巷36號,23.0816182,120.2953341
UN201807090033,"2018-07-09 08:25:12",東區,民生管線,漏水、停水、消防栓漏水或損壞,"東區仁和里仁和路111巷54號前路中央 自來水管破裂",東區仁和里仁和路111巷54號前路中央,23.0792851,120.2955182
UN201807090041,"2018-07-09 08:41:25",西港區,民生管線,停電、漏電、電線掉落、孔蓋鬆動,"西港區新興街50號   停電",西港區新興街50號,23.0816182,120.2953341
UN201807090042,"2018-07-09 08:41:37",歸仁區,違規停車,違規停車,"歸仁區仁愛三街與成功六街116巷口 違停",歸仁區仁愛三街成功六街116巷,22.9997281,120.2270277
UN201807090047,"2018-07-09 08:48:13",永康區,違規停車,違規停車,"永康區中華路58巷52號 違規停車",永康區中華路58巷52號,23.0018866,120.2363198
UN201807090052,"2018-07-09 09:00:07",安南區,民生管線,漏水、停水、消防栓漏水或損壞,"安南區安中路四段119號  水管破裂",安南區安中路四段119號,23.0492737,120.170495
UN201807090056,"2018-07-09 09:05:56",永康區,違規停車,違規停車,"永康區富強路一段304號  違規停車",永康區富強路一段304號,23.0196506,120.275429
UN201807090058,"2018-07-09 09:07:57",安南區,路燈故障,9盞以下路燈故障,"安南區北安路四段705巷188弄10號 路燈故障",安南區北安路四段705巷188弄10號,23.0675272,120.2122504
UN201807090067,"2018-07-09 09:22:59",中西區,噪音舉發,妨礙安寧,"中西區西門路一段715巷41號 妨礙安寧",中西區西門路一段715巷41號,22.9997281,120.2270277
UN201807090070,"2018-07-09 09:33:28",東區,噪音舉發,場所連續噪音,"東區裕豐街115巷4號  施工噪音",東區裕豐街115巷4號,22.9868247,120.2267877
UN201807090071,"2018-07-09 09:34:57",永康區,髒亂及汙染,空氣汙染,"永康區民族路126巷 空氣污染",永康區民族路126巷,22.9997281,120.2270277
UN201807090073,"2018-07-09 09:38:05",南區,違規停車,違規停車,"南區健康路一段113巷  違規停車",南區健康路一段113巷,22.9800611,120.2094719
UN201807090074,"2018-07-09 09:38:24",新化區,噪音舉發,場所連續噪音,"新化區大德路59號  噪音舉發",新化區大德路59號,22.9997281,120.2270277
UN201807090088,"2018-07-09 10:03:15",永康區,違規停車,違規停車,"永康區中華路1號 違停",永康區中華路1號,22.9997281,120.2270277
UN201807090094,"2018-07-09 10:14:49",安南區,路燈故障,9盞以下路燈故障,"安南區海佃路二段618 路燈",安南區海佃路二段618,22.9997281,120.2270277
UN201807090110,"2018-07-09 10:39:36",東區,違規停車,違規停車,"東區崇善路813號  違規停車",東區崇善路813號,22.9997281,120.2270277
UN201807090119,"2018-07-09 10:54:59",新化區,噪音舉發,場所連續噪音,"新化區中正路707巷76號  噪音舉發",新化區中正路707巷76號,23.041464,120.3013939
UN201807090121,"2018-07-09 10:58:26",南區,違規停車,違規停車,"南區新興路242號 違停",南區新興路242號,22.976451,120.1924707
UN201807090129,"2018-07-09 11:15:46",永康區,違規停車,違規停車,"永康區東橋十街32之86號  違規停車",永康區東橋十街32之86號,23.0217064,120.2320943
UN201807090130,"2018-07-09 11:16:06",北區,噪音舉發,場所連續噪音,"北區大興街96巷71號  噪音舉發",北區大興街96巷71號,23.0134121,120.1911862
UN201807090132,"2018-07-09 11:17:08",東區,違規停車,違規停車,"東區裕和路  違規停車",東區裕和路,22.9997281,120.2270277
UN201807090151,"2018-07-09 11:41:12",中西區,違規停車,違規停車,"中西區府中街94號  違規停車",中西區府中街94號,22.9902805,120.2057519
UN201807090153,"2018-07-09 11:43:06",安南區,道路維修,路面坑洞,"安南區安和路三段，離科技五路不到十公尺處，靠近水溝邊 路面坑洞",安南區安和路三段,22.9997281,120.2270277
UN201807090161,"2018-07-09 12:01:17",安南區,髒亂及汙染,空氣汙染,"安南區安和路一段496巷1弄69號  空氣汙染",安南區安和路一段496巷1弄69號,23.0361471,120.215964
UN201807090162,"2018-07-09 12:02:04",新市區,髒亂及汙染,道路散落物,"新市區遠東科技大學 貓屍體",新市區遠東科技大學,23.0645351,120.2944186
UN201807090165,"2018-07-09 12:03:41",中西區,違規停車,違規停車,"中西區西華南街2號 違規停車",中西區西華南街2號,22.9997281,120.2270277
UN201807090171,"2018-07-09 12:23:58",東區,違規停車,違規停車,"東區自由路二段69巷與仁和路139巷51弄路口轉角 違規停車",自由路二段69巷仁和路139巷51弄,23.0361471,120.215964
UN201807090175,"2018-07-09 12:33:41",北區,違規停車,違規停車,"北區開元路靠近長榮路 違規停車",北區開元路長榮路,22.9997281,120.2270277
UN201807090178,"2018-07-09 12:37:53",歸仁區,噪音舉發,妨害安寧,"歸仁區文化街三段20號   妨害安寧",歸仁區文化街三段20號,22.9710235,120.2875562
UN201807090181,"2018-07-09 12:38:18",中西區,違規停車,違規停車,"中西區健康路一段152號前  違規停車",中西區健康路一段152號,23.0196506,120.275429
UN201807090185,"2018-07-09 13:01:59",仁德區,髒亂及汙染,空氣汙染,"仁德區中山路379巷口  空污",仁德區中山路379巷口,22.9706944,120.2575851
UN201807090186,"2018-07-09 13:08:09",東區,違規停車,違規停車,"東區勝利路167號  違規停車",東區勝利路167號,22.9958176,120.2179419
UN201807090187,"2018-07-09 13:08:49",中西區,違規停車,違規停車,"中西區民族路二段10號、30號、66號、63號  違規停車",中西區民族路二段63號,22.9943593,120.209799
UN201807090190,"2018-07-09 13:14:54",中西區,騎樓舉發,騎樓舉發,"中西區衛民街49號   騎樓舉發",中西區衛民街49號,22.9927881,120.2109284
UN201807090195,"2018-07-09 13:38:17",仁德區,違規停車,違規停車,"仁德區保安路    違停",仁德區保安路,22.9906793,120.1944743
UN201807090201,"2018-07-09 13:58:56",安平區,髒亂及汙染,道路散落物,"安平區四草大橋接四草大道  狗屍體",安平區四草大橋,22.9965016,120.1409454
UN201807090203,"2018-07-09 14:09:20",北區,動物救援,犬貓急難救援,"北區西門路四段100號  貓咪受困",北區西門路四段100號,22.9997281,120.2270277
UN201807090206,"2018-07-09 14:11:27",安南區,民生管線,漏水、停水、消防栓漏水或損壞,"安南區本田路*安中路四段  冒水",安南區本田路安中路四段,22.9997281,120.2270277
UN201807090210,"2018-07-09 14:28:09",北區,道路維修,路面坑洞,"北區賢北街25巷39號前  路面坑洞",北區賢北街25巷39號前,22.9927881,120.2109284
UN201807090215,"2018-07-09 14:41:56",東區,道路維修,路面坑洞,"東區長東街 68號/76號 路面坑洞","東區長東街 68號/76號",22.9636466,120.2294739
UN201807090216,"2018-07-09 14:45:19",北區,交通運輸,號誌故障,"北區文成路*文賢路  號誌故障",北區文成路文賢路,22.9997281,120.2270277
UN201807090223,"2018-07-09 14:58:44",南區,交通運輸,佔用道路,"南區健康路二段393號 佔用道路",南區健康路二段393號,22.9818768,120.1867589
UN201807090225,"2018-07-09 15:08:40",安平區,路燈故障,9盞以下路燈故障,"安平區健康三街17巷 9盞以下路燈故障",安平區健康三街17巷,22.9854063,120.167418
UN201807090226,"2018-07-09 15:09:56",中西區,違規停車,違規停車,"中西區成功路453號 違規停車",中西區成功路453號,22.9997281,120.2270277
UN201807090227,"2018-07-09 15:10:21",東區,交通運輸,號誌故障,"東區平實路*後甲二路 號誌故障",東區平實路*後甲二路,22.9997281,120.2270277
UN201807090232,"2018-07-09 15:25:35",玉井區,髒亂及汙染,空氣汙染,"玉井區台84道路尾端，過走馬瀨農場門口再往前10公尺左右的右側岔路 動物糞便",玉井區台84道路尾端,22.9997281,120.2270277
UN201807090234,"2018-07-09 15:29:37",東區,違規停車,違規停車,"東區勝利路41號光華高中前停車格 違規停車",臺南市東區勝利路41號,22.988718,120.217083
UN201807090235,"2018-07-09 15:29:57",歸仁區,髒亂及汙染,空氣汙染,"歸仁區中正北路二段319巷11號  空氣汙染",歸仁區中正北路二段319巷11號,22.9845466,120.2923814
UN201807090239,"2018-07-09 15:34:03",東區,違規停車,違規停車,"東區東門路二段132號元氣早餐前 違規停車",東區東門路二段132號,22.9859011,120.2207041
UN201807090241,"2018-07-09 15:37:42",東區,違規停車,違規停車,"東區東門路二段348號周遭 違規停車",東區東門路二段348號,22.9827416,120.2268699
UN201807090244,"2018-07-09 15:43:57",中西區,違規停車,違規停車,"中西區西華南街10號，33號 違規停車",中西區西華南街10號,22.9997281,120.2270277
UN201807090251,"2018-07-09 15:58:44",北區,違規停車,違規停車,"北區開南街257巷與開南街轉角及附近紅線及人行道違停 違規停車",北區開南街257巷,23.0041563,120.2283287
UN201807090256,"2018-07-09 16:05:58",中西區,違規停車,違規停車,"中西區民族路二段76之6號  違規停車",中西區民族路二段76之6號,22.9947876,120.2089152
UN201807090267,"2018-07-09 16:19:34",東區,路燈故障,9盞以下路燈故障,"東區德東街235巷118弄72號   路燈不亮",東區德東街235巷118弄72號,22.962531,120.234312
UN201807090271,"2018-07-09 16:25:55",北區,動物救援,犬貓急難救援,"北區東豐路451巷11號  動物救援",北區東豐路451巷11號,23.0083738,120.2100558
UN201807090272,"2018-07-09 16:26:39",中西區,交通運輸,佔用道路,"中西區和緯路與武聖路,公園附近有違規設攤",中西區和緯路武聖路,23.007443,120.1878897
UN201807090273,"2018-07-09 16:28:23",北區,髒亂及汙染,空氣汙染,"北區文賢路1122巷107弄2之12號 排放廢水",北區文賢路1122巷107弄2之12號,22.9997281,120.2270277
UN201807090275,"2018-07-09 16:29:38",仁德區,髒亂及汙染,空氣汙染,"仁德區中清路248巷底 空氣汙染",仁德區中清路248巷,22.9752441,120.2567477
UN201807090283,"2018-07-09 16:50:45",關廟區,路燈故障,9盞以下路燈故障,"關廟區埤頭里關新一街125號前 路燈不亮",關廟區埤頭里關新一街125號,22.9997281,120.2270277
UN201807090287,"2018-07-09 16:56:38",中西區,路燈故障,9盞以下路燈故障,"中西區中華西路二段791巷15號  路燈不亮",中西區中華西路二段791巷15號,23.0046712,120.1862294
UN201807090288,"2018-07-09 16:58:34",北區,違規停車,違規停車,"北區開元路71巷32號  違規停車",北區開元路71巷32號,23.0018866,120.2363198
UN201807090289,"2018-07-09 16:59:37",中西區,違規停車,違規停車,"中西區健康路一段152號  違規停車",中西區健康路一段152號,23.0196506,120.275429
UN201807090296,"2018-07-09 17:15:32",中西區,違規停車,違規停車,"中西區民族路二段209號 違規停車",中西區民族路二段209號,22.9957595,120.2052386
UN201807090298,"2018-07-09 17:17:51",中西區,違規停車,違規停車,"中西區民族路二段97號 違規停車",中西區民族路二段97號,23.0018866,120.2363198
UN201807090304,"2018-07-09 17:37:31",永康區,違規停車,違規停車,"永康區仁愛街108巷與三村一街138巷交叉口  紅線違停",永康區仁愛街108巷三村一街138巷,23.0448578,120.240011
UN201807090306,"2018-07-09 17:45:50",南區,違規停車,違規停車,"南區新興路242號前  黃線違停",南區新興路242號,22.976451,120.1924707
UN201807090307,"2018-07-09 17:48:00",楠西區,路燈故障,9盞以下路燈故障,"楠西區龜丹7、9號 路燈不亮",楠西區龜丹9號,23.133161,120.50696
UN201807090309,"2018-07-09 17:53:23",永康區,違規停車,違規停車,"永康區中華路134巷45號 違規停車",永康區中華路134巷45號,23.003054,120.236327
UN201807090317,"2018-07-09 18:08:57",歸仁區,民生管線,電信孔蓋鬆動、電信線路掉落、電信桿傾倒,"歸仁區保大路三段211號前 寬頻孔蓋聲響",歸仁區保大路三段211號,22.9973432,120.2768149
UN201807090320,"2018-07-09 18:12:09",新化區,違規停車,違規停車,"新化區唪口里唪口112之2號對面 紅線違停",新化區唪口里唪口112之2號,23.042192,120.295142
UN201807090323,"2018-07-09 18:19:16",新營區,違規停車,違規停車,"新營區仁愛街與三民路口 違規停車",新營區仁愛街三民路,22.9997281,120.2270277
UN201807090324,"2018-07-09 18:21:28",東區,違規停車,違規停車,"東區裕農路575號 違規停車",東區裕農路575號,22.9887046,120.2340706
UN201807090326,"2018-07-09 18:22:14",永康區,違規停車,違規停車,"永康區中華路58巷52號 違規停車",永康區中華路58巷52號,23.0018866,120.2363198
UN201807090329,"2018-07-09 18:25:30",新化區,違規停車,違規停車,"新化區中正路599號 違規停車",新化區中正路599號,22.9902805,120.2057519
UN201807090332,"2018-07-09 18:29:09",新營區,違規停車,違規停車,"新營區仁愛街與三民路口 違規停車",新營區仁愛街三民路,22.9997281,120.2270277
UN201807090337,"2018-07-09 18:42:16",東區,違規停車,違規停車,"東區凱旋路與東光路交叉路口 違規停車",東區凱旋路東光路,22.9929755,120.2311891
UN201807090339,"2018-07-09 18:43:01",新營區,違規停車,違規停車,"新營區公園路與中華路口 違規停車",新營區公園路中華路,22.9997281,120.2270277
UN201807090340,"2018-07-09 18:45:11",永康區,違規停車,違規停車,"永康區永正路，永康國中圍牆邊 違規停車",永康區永正路,23.0125541,120.1996527
UN201807090341,"2018-07-09 18:47:30",新市區,違規停車,違規停車,"新市區復興路101號，丹丹漢堡門口轉角 違規停車",新市區復興路101號,23.082665,120.2952933
UN201807090343,"2018-07-09 18:52:09",安平區,違規停車,違規停車,"安平區古堡街1號對面 違停",安平區古堡街1號,22.9994777,120.1613893
UN201807090344,"2018-07-09 18:53:06",新市區,違規停車,違規停車,"新市區台19甲線282號（地圖對應為中正路），秀芳鮮花店和旁邊的夾娃娃機店門口 違規停車",新市區台19甲線282號,23.0775944,120.2919656
UN201807090346,"2018-07-09 19:01:15",安南區,路燈故障,9盞以下路燈故障,"安南區公學路五段332巷內 路燈故障",安南區公學路五段332巷,22.9997281,120.2270277
UN201807090347,"2018-07-09 19:05:40",永康區,違規停車,違規停車,"永康區崑大路33號和35號 違規停車",永康區崑大路33號,22.9980239,120.2572417
UN201807090348,"2018-07-09 19:07:49",新市區,違規停車,違規停車,"新市區中正路166號 違規停車",新市區中正路166號,23.0744447,120.2915017
UN201807090349,"2018-07-09 19:08:48",永康區,路燈故障,9盞以下路燈故障,"永康區正南一街*中正南路 路燈故障",永康區正南一街*中正南路,22.9997281,120.2270277
UN201807090350,"2018-07-09 19:09:20",東區,違規停車,違規停車,"東區崇德路642號 違規停車",東區崇德路642號,22.970004,120.22741
UN201807090351,"2018-07-09 19:12:24",北區,違規停車,違規停車,"北區西門路四段380巷口 違規停車",北區西門路四段380巷口,23.0144659,120.2102989
UN201807090357,"2018-07-09 19:22:24",北區,路燈故障,9盞以下路燈故障,"北區公園路904巷21號前 路燈不亮",北區公園路904巷21號,22.9980239,120.2572417
UN201807090358,"2018-07-09 19:26:05",新市區,違規停車,違規停車,"新市區華興街55號 違規停車",新市區華興街55號,23.0769159,120.2938847
UN201807090359,"2018-07-09 19:35:14",永康區,路燈故障,10盞以上路燈故障,"永康區中正南路靠近TOYOTA附近 路燈閃爍",永康區中正南路214號,22.9997281,120.2270277
UN201807090360,"2018-07-09 19:37:43",安平區,路燈故障,9盞以下路燈故障,"安平區府前三街82號 路燈故障",安平區府前三街82號,23.0276616,120.2013239
UN201807090363,"2018-07-09 19:41:47",北區,違規停車,違規停車,"北區海安路三段和文成一路 違規停車",北區海安路三段文成一路,22.9997281,120.2270277
UN201807090364,"2018-07-09 19:43:16",麻豆區,髒亂及汙染,市區道路路面油漬,"麻豆區謝厝寮3之6號前  路面油漬",麻豆區謝厝寮3之6號,23.158253,120.241801
UN201807090367,"2018-07-09 19:47:33",安平區,路燈故障,9盞以下路燈故障,"安平區永華六街，從怡平路到永華路二段之間路段 路燈不亮",安平區永華六街,22.9938787,120.1770558
UN201807090373,"2018-07-09 20:08:47",永康區,髒亂及汙染,空氣汙染,"永康區大灣路1014號 鍵誠紡織  空氣汙染",永康區大灣路1014號,22.9997281,120.2270277
UN201807090376,"2018-07-09 20:15:48",龍崎區,路燈故障,10盞以上路燈故障,"龍崎區182縣道25K 路燈故障不亮",龍崎區182縣道25K,22.9997281,120.2270277
UN201807090378,"2018-07-09 20:22:52",北區,違規停車,違規停車,"北區公園路上，和緯路至公園北路段雙向 違規停車",北區公園路,23.0083738,120.2100558
UN201807090379,"2018-07-09 20:29:52",新市區,違規停車,違規停車,"新市全聯福利中心前 違規停車",新市區中正路162號,23.0744441,120.2915069
UN201807090382,"2018-07-09 20:33:21",新市區,違規停車,違規停車,"新市區全聯福利中心前面 違規停車",新市區中正路162號,23.0744441,120.2915069
UN201807090388,"2018-07-09 20:56:48",新市區,違規停車,違規停車,"新市區富強路6號，寶雅門口人行道 違規停車",新市區富強路6號,23.0726525,120.2916057
UN201807090391,"2018-07-09 21:02:30",永康區,路燈故障,9盞以下路燈故障,"永康區三民街96號到150號 路燈故障",永康區三民街96號到150號,23.052746,120.247681
UN201807090396,"2018-07-09 21:29:18",安南區,路燈故障,9盞以下路燈故障,"安南區溪東一街上，近安富街 路燈故障",安南區溪東一街*安富街,23.0276616,120.2013239
UN201807090398,"2018-07-09 21:32:59",中西區,騎樓舉發,騎樓舉發,"中西區西華南街32號騎樓 騎樓舉發",中西區西華南街32號,22.9937988,120.2094961
UN201807090401,"2018-07-09 21:48:31",永康區,違規停車,違規停車,"永康區仁愛街108巷與三村一街138巷交叉口 違規停車",永康區仁愛街108巷*三村一街138巷,22.9997281,120.2270277
UN201807090403,"2018-07-09 21:54:10",中西區,違規停車,違規停車,"中西區西華南街32，33，62號 違規停車",中西區西華南街62號,22.9997281,120.2270277
UN201807090404,"2018-07-09 21:55:35",中西區,違規停車,違規停車,"中西區民族路二段55-1號 違規停車",中西區民族路二段55-1號,22.994323,120.2100841
UN201807090405,"2018-07-09 22:00:50",南區,路燈故障,9盞以下路燈故障,"南區德興路215巷40號 9盞以下路燈故障",南區德興路215巷40號,22.9605951,120.1937024
UN201807090408,"2018-07-09 22:14:29",佳里區,噪音舉發,妨害安寧,"佳里區佳東路888之1號 噪音舉發",佳東路888之1號保安宮,23.1673843,120.1821268
UN201807090409,"2018-07-09 22:15:55",永康區,噪音舉發,妨害安寧,"永康區中華二路340巷內 妨害安寧",永康區中華二路340巷,22.9997281,120.2270277
UN201807090411,"2018-07-09 22:21:21",安定區,民生管線,漏水、停水、消防栓漏水或損壞,"安定區中沙里沙崙35號 路面漏水",安定區中沙里沙崙35號,23.074096,120.208403
UN201807090413,"2018-07-09 22:31:14",佳里區,噪音舉發,妨害安寧,"佳里區佳東路888之1號保安宮 妨害安寧",佳里區佳東路888之1號保安宮,23.1673843,120.1821268
UN201807090417,"2018-07-09 22:56:12",東區,違規停車,違規停車,"東區大學路靠近前鋒路 違規停車",東區大學路*前鋒路,22.9935794,120.2132615
UN201807090418,"2018-07-09 22:58:01",中西區,違規停車,違規停車,"中西區西華南街62，33號 違規停車",中西區西華南街62，33號,22.994134,120.210059
UN201807090422,"2018-07-09 23:20:55",佳里區,噪音舉發,妨害安寧,"佳里區佳東路888之1號保安宮 噪音舉發",佳里區佳東路888之1號保安宮,23.1673843,120.1821268
UN201807100006,"2018-07-10 01:43:29",中西區,噪音舉發,妨害安寧,中西區臨安路一段62號妨害安寧,臨安路一段62號,22.9989795,120.1906282
UN201807100010,"2018-07-10 04:11:20",安南區,噪音舉發,場所連續噪音,"安南區同安路420號5樓之2 場所連續噪音",安南區同安路420號5樓之2,22.9644559,120.2516045
UN201807100014,"2018-07-10 05:29:55",中西區,路燈故障,9盞以下路燈故障,"中西區樹林街二段 慶中街  9盞以下路燈故障","中西區樹林街二段 慶中街",22.9997281,120.2270277
UN201807100016,"2018-07-10 06:01:44",北區,噪音舉發,場所連續噪音,"北區開元路485巷29號11樓之3 場所連續噪音",北區開元路485巷29號11樓之3,22.9997281,120.2270277
UN201807100021,"2018-07-10 07:01:17",新市區,違規停車,違規停車,"新市區中正路67號  違規停車",新市區台19甲線67號,23.0816182,120.2953341
UN201807100022,"2018-07-10 07:10:16",東區,道路維修,路面下陷、凹陷,"東區樹林街一段183巷1號~3號   路面下陷",東區樹林街一段183巷1號,22.9864118,120.2125447
UN201807100024,"2018-07-10 07:20:49",新市區,違規停車,違規停車,"新市區中正路310號   違規停車",新市區台19甲線310號,22.9997281,120.2270277
UN201807100026,"2018-07-10 07:31:41",安南區,交通運輸,佔用道路,"安南區安中路一段同安路交叉口 佔用道路",安南區安中路一段同安路,23.0442674,120.1934715
UN201807100032,"2018-07-10 07:54:40",新市區,違規停車,違規停車,"新市區復興路101號  違規停車",新市區復興路101號,22.9864118,120.2125447
UN201807100034,"2018-07-10 08:06:07",東區,道路維修,路面下陷、凹陷,"東區大同里樹林街一段183巷內  路面下陷",東區大同里樹林街一段183巷內,22.9997281,120.2270277
UN201807100041,"2018-07-10 08:26:35",六甲區,交通運輸,佔用道路,"六甲區信義街349巷11弄24號對面  占用道路",六甲區信義街349巷11弄24號,22.9997281,120.2270277
UN201807100042,"2018-07-10 08:27:54",永康區,路燈故障,9盞以下路燈故障,"永康區中山北路701號 路燈",永康區中山北路701號,23.0308021,120.275442
UN201807100046,"2018-07-10 08:42:15",,,,"東區自由路一段196巷 人孔蓋鬆動",東區自由路一段196巷,22.9684839,120.2372862
UN201807100047,"2018-07-10 08:44:07",中西區,違規停車,違規停車,"中西區開山路86號  違規停車",中西區開山路86號,22.9900518,120.2066853
UN201807100048,"2018-07-10 08:45:56",東區,道路維修,路面坑洞,"永康區復興路   路面破損",永康區復興路,22.9986742,120.2452568
UN201807100053,"2018-07-10 08:55:19",麻豆區,違規停車,違規停車,"麻豆區自由路新生北路  違規停車",麻豆區自由路新生北路,23.1903058,120.2431449
UN201807100058,"2018-07-10 09:02:50",東區,違規停車,違規停車,"東區中華東路二段165號  違規停車",東區中華東路二段165號,22.9849163,120.2333101
UN201807100072,"2018-07-10 09:28:03",新市區,違規停車,違規停車,"新市區復興路101號  違規停車",新市區復興路101號,22.9864118,120.2125447
UN201807100074,"2018-07-10 09:28:57",北區,違規停車,違規停車,"北區北園街6號前，機車紅線違停  紅線違停",北區北園街6號前,23.0102013,120.2233187
