UN201807110278,"2018-07-11 17:57:24",新市區,違規停車,違規停車,"新市區中正路166號 違規停車",新市區台19甲線166號,23.0744447,120.2915017
UN201807110279,"2018-07-11 17:58:24",中西區,違規停車,違規停車,中西區南門路257號左邊違規停車,中西區南門路257號,22.9997281,120.2270277
UN201807110281,"2018-07-11 18:12:36",永康區,交通運輸,佔用道路,"永康區公園路和永大路口，人行道上攤販 佔用道路",永康區公園路永大路,22.9997281,120.2270277
UN201807110283,"2018-07-11 18:20:39",安平區,違規停車,違規停車,"安平區育平五街、健康三街、育平五街33-77號 違規停車",安平區育平五街健康三街,22.9906348,120.1688476
UN201807110286,"2018-07-11 18:22:36",佳里區,髒亂及汙染,道路散落物,"佳里區佳化里214號 (佳興國小)前面的道路上(100公尺以內) 道路散落物",佳里區佳化里214號,22.9997281,120.2270277
UN201807110287,"2018-07-11 18:25:42",善化區,違規停車,違規停車,"善化區建國路222號，虎掌飯外面人行道 違規停車",善化區建國路222號,23.1329092,120.2964465
UN201807110288,"2018-07-11 18:26:22",安平區,違規停車,違規停車,"安平區永華十一街17巷31號，消防栓前 違停",安平區永華十一街17巷31號,22.9899913,120.161165
UN201807110289,"2018-07-11 18:26:23",北區,違規停車,違規停車,"北區公園路546號 違規停車",北區公園路546號,23.007013,120.210167
UN201807110290,"2018-07-11 18:27:31",仁德區,道路維修,路面坑洞,"仁德區中正西路337號對面 路面坑洞",仁德區中正七路337號,22.9401228,120.2397336
UN201807110294,"2018-07-11 18:44:00",北區,違規停車,違規停車,"北區西門路四段40號 違規停車",北區西門路四段40號,22.9997281,120.2270277
UN201807110296,"2018-07-11 18:56:40",東區,違規停車,違規停車,"東區長東街46巷 違規停車",東區長東街46巷,22.9997281,120.2270277
UN201807110297,"2018-07-11 18:57:51",北區,噪音舉發,妨害安寧,"北區實踐街39巷29號,對面城堭館宮廟",北區實踐街39巷29號,23.0152902,120.2185283
UN201807110299,"2018-07-11 19:02:25",東區,路燈故障,9盞以下路燈故障,"東區東平路99巷口與東興路口 路燈故障",東區東平路99巷,23.007013,120.210167
UN201807110300,"2018-07-11 19:04:03",仁德區,髒亂及汙染,空氣汙染,"仁德區太子四街三爺宮溪,附近有很多工廠疑似排放廢水,",仁德區太子四街三爺宮溪,22.9879713,120.2496283
UN201807110305,"2018-07-11 19:09:31",安南區,髒亂及汙染,環境髒亂,"安南區府安路四段沿線 環境髒亂",府安路四段沿線,23.0249058,120.2103066
UN201807110306,"2018-07-11 19:11:44",南區,違規停車,違規停車,"南區新興路242號前 違停",南區新興路242號,22.9997281,120.2270277
UN201807110307,"2018-07-11 19:13:06",東區,路燈故障,9盞以下路燈故障,"南區鯤鯓路101巷702號往下約50公尺   路燈故障",南區鯤鯓路101巷702號,22.95294,120.1741436
UN201807110309,"2018-07-11 19:16:13",安平區,違規停車,違規停車,"安平區永華路二段500號 違停",安平區永華路二段500號,22.9901581,120.1777551
UN201807110310,"2018-07-11 19:23:27",安南區,違規停車,違規停車,"安南區仁安八街和智安四街口 紅線違停",安南區仁安八街智安四街,23.0497044,120.1840444
UN201807110311,"2018-07-11 19:24:29",中西區,交通運輸,佔用道路,"中西區西門路二段387號(郡緯街交叉口) 佔用道路",西門路二段387號,22.9901581,120.1777551
UN201807110312,"2018-07-11 19:27:26",東區,違規停車,違規停車,"東區建東街43巷口 違規停車",東區建東街43巷,22.9902909,120.2363072
UN201807110317,"2018-07-11 19:33:29",安平區,違規停車,違規停車,"安平區永華路二段648號  違規停車",安平區永華路二段648號,22.9909726,120.1735742
UN201807110318,"2018-07-11 19:37:44",安平區,違規停車,違規停車,"安平區永華路二段500號: 違規停車",安平區永華路二段500號:,22.9901581,120.1777551
UN201807110320,"2018-07-11 19:44:38",中西區,路燈故障,9盞以下路燈故障,"中西區和善街43巷 9盞以下路燈故障",中西區和善街43巷,23.0009782,120.1904035
UN201807110321,"2018-07-11 19:49:53",安平區,路燈故障,9盞以下路燈故障,"安平區華平路128號 路燈故障",安平區華平路128號,22.9901581,120.1777551
UN201807110322,"2018-07-11 19:49:53",南區,違規停車,違規停車,"南區新興路93巷21號 違規停車",新興路93巷21號,22.9784757,120.1967963
UN201807110323,"2018-07-11 19:55:02",北區,違規停車,違規停車,"北區勝利路260號 違規停車",北區勝利路260號,22.9997281,120.2270277
UN201807110328,"2018-07-11 20:09:02",安南區,路燈故障,9盞以下路燈故障,"安南區公學路四段122巷370弄 路燈故障",安南區公學路四段122巷370弄,23.0795667,120.1780238
UN201807110329,"2018-07-11 20:20:53",東區,道路維修,寬頻管線、孔蓋損壞,"東區崇德路827號前 寬頻孔蓋聲響",臺南市東區崇德路827號,22.965645,120.227838
UN201807110330,"2018-07-11 20:24:24",安南區,路燈故障,9盞以下路燈故障,"安南區安中路四段與育英街口 路燈故障",安南區安中路四段,23.0514535,120.1655028
UN201807110336,"2018-07-11 20:41:00",龍崎區,民生管線,停電、漏電、電線掉落、孔蓋鬆動,"龍崎區中坑里大溪口16-1號 民生管線",龍崎區中坑里大溪口16-1號,22.9997281,120.2270277
UN201807110340,"2018-07-11 20:50:25",永康區,路燈故障,10盞以上路燈故障,"永康區忠孝路整段 路燈故障",永康區忠孝路,23.0093424,120.2416746
UN201807110351,"2018-07-11 21:26:46",將軍區,路燈故障,9盞以下路燈故障,"將軍區台17線,151K處 路燈故障",將軍區台17線,23.2029742,120.1341326
UN201807110364,"2018-07-11 22:12:24",中西區,路燈故障,9盞以下路燈故障,"中西區湖美街10號 9盞以下路燈故障",中西區湖美街10號,22.9992472,120.1801479
UN201807110368,"2018-07-11 22:24:26",仁德區,髒亂及汙染,空氣汙染,"仁德區中山路379巷口 空氣汙染",仁德區中山路379巷,22.9706944,120.2575851
UN201807110370,"2018-07-11 22:29:58",仁德區,髒亂及汙染,空氣汙染,"仁德區中山路379巷口 空氣汙染",仁德區中山路379巷,22.9706944,120.2575851
UN201807110375,"2018-07-11 22:50:17",六甲區,路燈故障,9盞以下路燈故障,"六甲區中山路277巷18號 路燈故障",六甲區中山路277巷18號,23.2318416,120.3453222
UN201807110378,"2018-07-11 22:56:32",東區,路燈故障,9盞以下路燈故障,"北門路靠近民族路口 路燈故障",北門路,23.0053912,120.2149101
UN201807120001,"2018-07-12 00:28:40",安南區,噪音舉發,妨害安寧,"安南區北安路二段526號 妨害安寧",臺南市安南區北安路二段526號,23.036526,120.203251
UN201807120008,"2018-07-12 04:49:49",永康區,違規停車,違規停車,"永康區中正北路523號之8 違規停車",臺南市永康區中正北路523號,23.042413,120.256825
UN201807120009,"2018-07-12 06:21:18",永康區,違規停車,違規停車,"永康區八德街263號 中山路383巷 違規停車",臺南市永康區八德街263號,23.036664,120.252933
