UN201807100075,"2018-07-10 09:36:25",永康區,違規停車,違規停車,"永康區中華路147號旁巷內  違停",永康區中華路147號,22.9997281,120.2270277
UN201807100079,"2018-07-10 09:40:46",永康區,違規停車,違規停車,"永康區中華路155巷巷內  違規停車",永康區中華路155巷,23.0023227,120.2340165
UN201807100085,"2018-07-10 09:49:22",歸仁區,民生管線,漏水、停水、消防栓漏水或損壞,"歸仁區中正南路一段*大順三街口  冒水",歸仁區中正南路一段大順三街口,22.9997281,120.2270277
UN201807100090,"2018-07-10 10:02:25",永康區,違規停車,違規停車,"永康區中華路58巷52號 違規停車",永康區中華路58巷52號,23.0018866,120.2363198
UN201807100092,"2018-07-10 10:06:29",歸仁區,噪音舉發,場所連續噪音,"歸仁區文化十二街71巷22號   施工噪音 / 違建",歸仁區文化十二街71巷22號,22.9719185,120.2825393
UN201807100098,"2018-07-10 10:13:55",安南區,道路維修,路面坑洞,"安南區長和路一段823巷尾  路面坑洞",安南區長和路一段823巷尾,23.0877436,120.2168085
UN201807100106,"2018-07-10 10:30:21",中西區,違規停車,違規停車,"中西區民權路三段447巷1號  違規停車",中西區民權路三段447巷1號,23.0396552,120.2394901
UN201807100110,"2018-07-10 10:34:18",仁德區,路燈故障,9盞以下路燈故障,"仁德區中正路二段862巷37號 路燈故障",仁德區中正路二段862巷37號,22.9642343,120.2543657
UN201807100111,"2018-07-10 10:39:04",東區,髒亂及汙染,道路散落物,"東區長榮路二段長榮女中,隔壁美髮店前馬路中間",東區長榮路二段長榮女中,22.9911165,120.2211482
UN201807100112,"2018-07-10 10:40:44",歸仁區,道路維修,寬頻管線、孔蓋損壞,"歸仁區保大路三段211號 寬頻孔蓋",歸仁區保大路三段211號,22.9973432,120.2768149
UN201807100114,"2018-07-10 10:41:35",東區,道路維修,地下道積水,"東區東門路一段   地下道積水",東區東門路一段,22.9877793,120.2150952
UN201807100142,"2018-07-10 11:33:00",東區,髒亂及汙染,環境髒亂,"東區長榮路二段135號附近  貓屍",東區長榮路二段135號,22.9911009,120.2209796
UN201807100144,"2018-07-10 11:35:19",安平區,違規停車,違規停車,"安平區怡平路495號對面   違規停車",安平區怡平路495號,22.9997281,120.2270277
UN201807100151,"2018-07-10 11:51:56",永康區,違規停車,違規停車,"永康區中山南路南大附中往新化方向   違規停車",永康區台20線南大附中往新化方向的路邊,23.0232968,120.2521762
UN201807100156,"2018-07-10 11:59:34",東區,違規停車,違規停車,"東區東門路二段158巷底近光華街口 違規停車",東區東門路二段158巷光華街,22.9840018,120.2200484
UN201807100158,"2018-07-10 12:06:34",關廟區,道路維修,路面坑洞,"關廟區保東路90號 坑洞",關廟區保東路90號,22.9997281,120.2270277
UN201807100160,"2018-07-10 12:13:01",中西區,違規停車,違規停車,"中西區西賢一街88巷口/西賢一街67巷口 違停紅線",中西區西賢一街88巷,22.9997281,120.2270277
UN201807100161,"2018-07-10 12:16:02",中西區,違規停車,違規停車,"中西區民族路二段從赤嵌樓到西門圓環  違規停車",中西區民族路二段,22.99568,120.2057441
UN201807100162,"2018-07-10 12:24:19",善化區,違規停車,違規停車,"善化區月眉園路 違規停車",善化區月眉園路,23.1101719,120.3039114
UN201807100166,"2018-07-10 12:37:51",中西區,違規停車,違規停車,"中西區西賢一街88巷/66巷口 違規停車",中西區西賢一街88巷,22.9997281,120.2270277
UN201807100177,"2018-07-10 13:10:23",中西區,民生管線,電信孔蓋鬆動、電信線路掉落、電信桿傾倒,"中西區府前路二段199號前  孔蓋鬆動",中西區府前路二段199號,22.932293,120.1866948
UN201807100181,"2018-07-10 13:22:37",安平區,違規停車,違規停車,"安平區安平路168號～174號  安平區安平路370號  違規停車",安平區安平路370號,22.9997281,120.2270277
UN201807100185,"2018-07-10 13:51:23",東區,髒亂及汙染,環境髒亂,"東區長榮路二段169號前   垃圾",東區長榮路二段169號,22.991813,120.2213288
UN201807100189,"2018-07-10 13:58:11",北區,違規停車,違規停車,"北區成功路200號周遭  違規停車",北區成功路200號,22.9990269,120.2036134
UN201807100191,"2018-07-10 14:03:19",永康區,違規停車,違規停車,"永康區中正南路52巷62弄弄口  違規停車",永康區中正南路52巷62弄,23.020667,120.2186555
UN201807100192,"2018-07-10 14:05:15",北區,動物救援,遊蕩犬隻捕捉管制,"北區北安路一段262巷  野狗捕捉",北區北安路一段262巷,22.9997281,120.2270277
UN201807100199,"2018-07-10 14:18:07",歸仁區,交通運輸,佔用道路,"歸仁區歸仁大道 佔用道路",歸仁區歸仁大道,22.9249849,120.2865972
UN201807100202,"2018-07-10 14:30:54",將軍區,路燈故障,9盞以下路燈故障,"七股區台17線156K  路燈故障",七股區台17線156K,23.0592896,120.1339731
UN201807100207,"2018-07-10 14:42:40",中西區,交通運輸,號誌故障,"中西區民生綠園  號誌故障",中西區民生綠園,22.9997281,120.2270277
UN201807100209,"2018-07-10 14:46:38",中西區,交通運輸,號誌故障,"中西區民生綠圓  號誌故障",中西區民生綠圓,22.992601,120.2050138
UN201807100210,"2018-07-10 14:50:48",東區,違規停車,違規停車,"東區東平路1號  違規停車",東區東平路1號,22.9997281,120.2270277
UN201807100213,"2018-07-10 15:04:44",南區,違規停車,違規停車,"南區萬年三街256號旁 違規停車",南區萬年三街256號,22.932293,120.1866948
UN201807100216,"2018-07-10 15:15:38",南區,噪音舉發,場所連續噪音,"南區新城街31號  噪音/空氣汙染",南區新城街31號,23.082665,120.2952933
UN201807100221,"2018-07-10 15:27:08",永康區,髒亂及汙染,小廣告、旗幟,"永康區復華一街28巷25弄22號 廣告單",永康區復華一街28巷25弄22號,23.006106,120.245553
UN201807100223,"2018-07-10 15:36:56",中西區,騎樓舉發,騎樓舉發,"中西區樹林街2段200號/208號/214號  騎樓舉發",中西區樹林街2段200號,22.9858592,120.2051792
UN201807100226,"2018-07-10 15:38:36",歸仁區,噪音舉發,妨礙安寧,"歸仁區文化街三段20號  妨礙安寧",歸仁區文化街三段20號,22.9564466,120.1863935
UN201807100229,"2018-07-10 15:40:31",中西區,違規停車,違規停車,"中西區樹林街2段216號  違規停車",中西區樹林街2段216號,22.9997281,120.2270277
UN201807100233,"2018-07-10 15:55:14",安南區,違規停車,違規停車,"安南區安中路四段87號 違規停車",安南區安中路四段87號,23.049477,120.1720127
UN201807100244,"2018-07-10 16:31:18",南區,道路維修,路面坑洞,"南區西門路一段跟新都路口 坑洞",南區西門路一段新都路,22.9674774,120.1977738
UN201807100249,"2018-07-10 16:39:47",安南區,交通運輸,號誌故障,"安南區長溪路三段公學路二段 號誌故障",安南區長溪路三段公學路二段,22.9997281,120.2270277
UN201807100258,"2018-07-10 17:20:46",中西區,違規停車,違規停車,"中西區健康路一段312號 違規停車",中西區健康路一段312號,22.9674774,120.1977738
UN201807100259,"2018-07-10 17:21:48",中西區,違規停車,違規停車,"中西區民族路二段2-42號/西華南街43號10號/武德街/大同路一段   違規停車",中西區民族路二段2-42號,22.9997281,120.2270277
UN201807100267,"2018-07-10 17:36:11",安南區,道路維修,人孔蓋凹陷坑洞,"安南區怡安路二段83之2號旁邊 坑洞",安南區怡安路二段83之2號,22.9997281,120.2270277
UN201807100271,"2018-07-10 17:45:39",鹽水區,噪音舉發,妨害安寧,"鹽水區武德里後厝51-12號  妨害安寧",鹽水區武德里後厝51-12號,22.9997281,120.2270277
UN201807100273,"2018-07-10 17:48:45",安平區,民生管線,漏水、停水、消防栓漏水或損壞,"安平區慶平路跟健康三街 台水孔蓋",安平區慶平路健康三街,22.9976403,120.1696149
UN201807100276,"2018-07-10 18:05:28",中西區,違規停車,違規停車,"中西區健康路一段152號前 違規停車",中西區健康路一段152號,22.9997281,120.2270277
UN201807100279,"2018-07-10 18:22:01",安平區,違規停車,違規停車,"安平區育平五街、健康三街/育平五街33-77 違規停車",安平區育平五街健康三街,22.9906348,120.1688476
UN201807100281,"2018-07-10 18:23:13",中西區,違規停車,違規停車,"中西區西華南街10號，42號 違規停車",中西區西華南街42號,22.9939617,120.2095661
UN201807100286,"2018-07-10 18:41:31",中西區,違規停車,違規停車,"中西區成功路275號, 違規停車",中西區成功路275號,22.9994114,120.2018182
UN201807100287,"2018-07-10 18:44:59",北區,噪音舉發,場所連續噪音,"北區南園街101巷21弄7號  工廠噪音",北區南園街101巷21弄7號,23.0082095,120.2260542
UN201807100292,"2018-07-10 19:08:56",安定區,髒亂及汙染,環境髒亂,"安定區新吉24號 環境髒亂",台南支線聯絡道240號,23.0877436,120.2168085
UN201807100294,"2018-07-10 19:11:23",東區,違規停車,違規停車,"東區青年路293巷 違規停車",東區青年路293巷的路口,22.9919011,120.213612
UN201807100297,"2018-07-10 19:15:47",東區,路燈故障,9盞以下路燈故障,"東區崇學路101號 路燈故障",東區崇學路101號,22.9787911,120.221976
UN201807100298,"2018-07-10 19:18:00",安南區,路燈故障,9盞以下路燈故障,"安南區海東一街海東二街 路燈故障",安南區海東一街海東二街,22.9997281,120.2270277
UN201807100303,"2018-07-10 19:29:14",東區,違規停車,違規停車,"東區榮譽街122號 違規停車",東區榮譽街122號,22.9752184,120.2185273
UN201807100309,"2018-07-10 19:48:49",安南區,髒亂及汙染,小廣告、旗幟,"安南區育安一街158號 小廣告、旗幟",育安一街158號,23.0498428,120.2144586
UN201807100312,"2018-07-10 20:06:12",中西區,違規停車,違規停車,"中西區民族路二段76號 違規停車",中西區民族路二段76號,22.9997281,120.2270277
UN201807100317,"2018-07-10 20:28:00",中西區,路燈故障,9盞以下路燈故障,"中西區西門路一段704號 路燈故障",中西區西門路一段704號,22.9896826,120.1977484
UN201807100318,"2018-07-10 20:30:21",安南區,路燈故障,9盞以下路燈故障,"安南區安中路一段506號/800號旁邊巷口 路燈故障",安南區安中路一段506號,22.9997281,120.2270277
UN201807100320,"2018-07-10 20:43:36",中西區,路燈故障,9盞以下路燈故障,"中西區永華一街139號前 路燈故障",地點:中西區永華一街139號,22.932293,120.1866948
UN201807100322,"2018-07-10 20:47:32",南區,違規停車,違規停車,"南區德南街與文南路口 違規停車",南區德南街,22.9997281,120.2270277
UN201807100323,"2018-07-10 20:48:07",永康區,髒亂及汙染,空氣汙染,永康區蔦松二街髒亂及汙染,永康區蔦松二街大成飼料廠,23.0411336,120.2537658
UN201807100324,"2018-07-10 20:49:13",南區,路燈故障,9盞以下路燈故障,"南區德興路215巷40號對面 路燈故障",南區德興路215巷40號,22.9605951,120.1937024
UN201807100326,"2018-07-10 21:01:06",永康區,噪音舉發,妨害安寧,"永康區自強路255巷35弄2號 妨害安寧",永康區自強路255巷35弄2號,22.9997281,120.2270277
UN201807100327,"2018-07-10 21:05:00",安平區,違規停車,違規停車,"安平區永華路二段500號 違規停車",安平區永華路二段500號,22.9901581,120.1777551
UN201807100328,"2018-07-10 21:16:31",安平區,違規停車,違規停車,"安平區育平六街39號 違規停車",安平區育平六街39號,22.9923351,120.1660767
UN201807100329,"2018-07-10 21:26:53",東區,違規停車,違規停車,"東區富農街二段43巷富農街二段T字路口 違規停車",富農街二段43巷,22.9861962,120.2351851
UN201807100330,"2018-07-10 21:34:15",南區,路燈故障,9盞以下路燈故障,"南區明興路1811巷口 路燈故障",南區明興路181巷,22.9564466,120.1863935
UN201807100331,"2018-07-10 21:41:49",永康區,違規停車,違規停車,"永康區中山南路482號 違規停車","台20線, 482",22.9997281,120.2270277
UN201807100332,"2018-07-10 21:54:51",永康區,噪音舉發,場所連續噪音,"永康區中正七街7號 噪音舉發",中正七街7號,23.0396552,120.2394901
UN201807100335,"2018-07-10 22:23:22",北區,路燈故障,9盞以下路燈故障,"北區和緯路與育德二路 路燈故障",和緯路與育德二路路口,22.9997281,120.2270277
UN201807100336,"2018-07-10 22:30:28",東區,路燈故障,9盞以下路燈故障,"東區大學路 路燈故障",東區大學路,22.9960318,120.2209979
UN201807100337,"2018-07-10 22:31:52",安平區,違規停車,違規停車,"安平區國平路與國平路552巷口 違規停車",國平路552巷,22.9901581,120.1777551
UN201807100341,"2018-07-10 23:24:33",官田區,路燈故障,9盞以下路燈故障,"官田區工業路25號 路燈故障",工業路25號,22.9997281,120.2270277
UN201807110002,"2018-07-11 00:46:51",新化區,髒亂及汙染,道路散落物,"新化區中正路690之59號  道路散落物",新化區中正路690之59號,23.0464405,120.3032367
UN201807110010,"2018-07-11 05:50:12",永康區,髒亂及汙染,道路散落物,"永康區中正北路199號 道路散落物",永康區中正北路199號,23.0419983,120.2441
UN201807110016,"2018-07-11 07:31:35",麻豆區,違規停車,違規停車,"麻豆區謝安里1號附近後壁寮公車站牌旁 違規停車",麻豆區謝安里1號,23.181745,120.2361613
UN201807110022,"2018-07-11 07:48:38",南區,違規停車,違規停車,"南區三官路176巷15號 違規停車",南區三官路176巷15號,22.9783401,120.192803
UN201807110028,"2018-07-11 08:12:45",南區,民生管線,漏水、停水、消防栓漏水或損壞,"南區萬年路167號，南寧高中 漏水",南區萬年路167號,22.9354049,120.186556
UN201807110033,"2018-07-11 08:29:48",南區,民生管線,電信孔蓋鬆動、電信線路掉落、電信桿傾倒,"南區公英一街3號斜前方機車道上 電信孔蓋鬆動",南區公英一街3號,22.9708916,120.2148204
UN201807110035,"2018-07-11 08:35:37",七股區,動物救援,犬貓急難救援,"七股區台17線 狗受困",七股區台17線,22.9997281,120.2270277
UN201807110036,"2018-07-11 08:36:12",歸仁區,噪音舉發,妨害安寧,"歸仁區文化街三段20號 妨害安寧",歸仁區文化街三段20號,22.9710235,120.2875562
UN201807110039,"2018-07-11 08:43:03",東區,噪音舉發,妨害安寧,"東區裕農路345巷11號 噪音/空氣汙染",東區裕農路345巷11號,22.9997281,120.2270277
UN201807110046,"2018-07-11 08:57:42",中西區,騎樓舉發,騎樓舉發,"中西區衛民 街154號 騎樓舉發",中西區衛民街154號,22.9710235,120.2875562
UN201807110047,"2018-07-11 08:58:23",永康區,髒亂及汙染,道路散落物,"永康區中正路760號，茶的魔手對面 貓屍",永康區中正路760號,22.9997281,120.2270277
UN201807110049,"2018-07-11 09:00:32",白河區,髒亂及汙染,道路散落物,"白河區富民路與忠孝街口  地面散落物",白河區富民路忠孝街,22.9997281,120.2270277
UN201807110053,"2018-07-11 09:11:58",永康區,違規停車,違規停車,"永康區中華路58巷52號 違規停車",永康區中華路58巷52號,23.0018866,120.2363198
UN201807110056,"2018-07-11 09:16:56",東區,違規停車,違規停車,"東區林森路二段186號 違規停車",東區林森路二段186號,22.9890811,120.22406
UN201807110057,"2018-07-11 09:17:55",永康區,違規停車,違規停車,"永康區新行街122巷10弄1號 違規停車",永康區新行街122巷10弄1號,22.9997281,120.2270277
UN201807110060,"2018-07-11 09:37:02",西港區,交通運輸,交通疏導,"西港大橋  交通疏導",西港大橋,23.1069983,120.2054106
UN201807110062,"2018-07-11 09:44:14",中西區,違規停車,違規停車,"中西區府前路一段196巷 違規停車",中西區府前路一段196巷,22.9894791,120.2054164
UN201807110073,"2018-07-11 10:00:28",北區,交通運輸,佔用道路,"北區東豐路451巷7號  佔用道路",北區東豐路451巷7號,23.0032303,120.2279719
UN201807110074,"2018-07-11 10:00:42",南區,噪音舉發,妨害安寧,"南區灣裡路582號，米爾頓幼兒園 妨害安寧",南區灣裡路582號,22.9198802,120.1826385
UN201807110076,"2018-07-11 10:01:40",中西區,道路維修,路面下陷、凹陷,"中西區中華西路和永華路口，永華路上，往西內車道 路面下陷",中西區永華路,22.9997281,120.2270277
UN201807110077,"2018-07-11 10:02:33",北區,髒亂及汙染,環境髒亂,"北區文成三路跟育德一街口 環境髒亂",北區文成三路育德一街,23.0170403,120.2056164
UN201807110079,"2018-07-11 10:04:14",安平區,噪音舉發,場所連續噪音,"安平區永華路二段819號旁工地 施工噪音",安平區永華路二段819號,22.9997281,120.2270277
UN201807110081,"2018-07-11 10:06:22",北區,違規停車,違規停車,"北區勝利路397號 違規停車",北區勝利路397號,23.004266,120.2186426
UN201807110089,"2018-07-11 10:21:40",安南區,髒亂及汙染,道路散落物,"安南區北安路四段438號前  路面散落物",安南區北安路四段438號,23.0646423,120.2144029
UN201807110092,"2018-07-11 10:23:23",麻豆區,路燈故障,9盞以下路燈故障,"麻豆區油車里139之5號前 路燈故障",麻豆區油車里139之5號,22.9997281,120.2270277
UN201807110101,"2018-07-11 10:37:09",永康區,違規停車,違規停車,"永康區東橋十街，小橋公園前紅線 違規停車",永康區東橋十街,23.0225916,120.2333659
UN201807110110,"2018-07-11 10:45:38",南區,交通運輸,佔用道路,"南區灣裡路170、172號附近店面 佔用道路",南區灣裡路172號,22.9288356,120.1813326
UN201807110113,"2018-07-11 10:53:11",安平區,違規停車,違規停車,"安平區健康路三段331號 違規停車",安平區健康路三段331號,22.9997281,120.2270277
UN201807110115,"2018-07-11 11:01:59",中西區,交通運輸,佔用道路,中西區開山路133號,"中西區開山路133號 佔用道路",22.9873636,120.2081762
UN201807110123,"2018-07-11 11:29:23",安平區,噪音舉發,妨害安寧,"安平區平通路580巷103號對面 妨害安寧",安平區平通路580巷103號,22.9962274,120.1704419
UN201807110124,"2018-07-11 11:30:31",中西區,違規停車,違規停車,"中西區府中街100號 違規停車",中西區府中街100號,22.9901768,120.2056336
UN201807110128,"2018-07-11 11:41:27",新營區,路燈故障,9盞以下路燈故障,"新營區工業街55之16號前 路燈閃爍",新營區工業街55之16號,23.3017484,120.3221221
UN201807110133,"2018-07-11 11:53:47",東區,騎樓舉發,騎樓舉發,"東區北門路一段從東門圓環到火車站 騎樓舉發",東區北門路一段,22.9932613,120.2117242
UN201807110135,"2018-07-11 11:59:00",東區,髒亂及汙染,空氣汙染,"東區富農街一段131巷50號 空氣汙染",東區富農街一段131巷50號,22.9819671,120.232954
UN201807110136,"2018-07-11 12:08:38",中西區,騎樓舉發,騎樓舉發,"中西區西華南街32號騎樓香檳色汽車紅線佔據騎樓 騎樓舉發",中西區西華南街32號,23.0225916,120.2333659
UN201807110138,"2018-07-11 12:13:43",中西區,違規停車,違規停車,"中西區西華南街38號 違規停車",中西區西華南街38號,22.9938798,120.2095962
UN201807110139,"2018-07-11 12:14:16",安南區,髒亂及汙染,市區道路路面油漬,"安南區安明路一段九份大道郡安路 路面油漬",安南區安明路一段九份大道郡安路,23.0169777,120.1796707
UN201807110140,"2018-07-11 12:15:15",中西區,違規停車,違規停車,"中西區民族路二段30-66號、55-63號 違規停車",中西區民族路二段30到66號,22.9997281,120.2270277
UN201807110145,"2018-07-11 12:33:40",永康區,髒亂及汙染,市區道路路面油漬,"永康區正強街和中正路口，中正路上，曼都髮型前 路面油漬",永康區中正路,23.0337658,120.245643
UN201807110147,"2018-07-11 12:46:18",中西區,交通運輸,號誌故障,"中西區青年路2號  行人號誌燈故障",中西區青年路2號,22.9997281,120.2270277
UN201807110155,"2018-07-11 13:07:06",仁德區,違規停車,違規停車,"仁德區中正路一段200巷1號 違規停車",仁德區中正路一段200巷1號,23.0337658,120.245643
UN201807110156,"2018-07-11 13:11:35",麻豆區,噪音舉發,妨害安寧,"麻豆區油車里油車47號 妨害安寧",麻豆區油車里油車47號,23.1906688,120.2443232
UN201807110159,"2018-07-11 13:18:59",中西區,違規停車,違規停車,"中西區西華南街52號 違規停車",中西區西華南街52號,22.9941902,120.209591
UN201807110169,"2018-07-11 13:35:23",中西區,違規停車,違規停車,違規停車,中西區府前路跟開山路的十字路口,22.9888462,120.2078995
UN201807110170,"2018-07-11 13:38:21",東區,違規停車,違規停車,"東區東寧路西段24號 違停",東區東寧路西段24號,22.9997281,120.2270277
UN201807110173,"2018-07-11 13:41:42",六甲區,交通運輸,佔用道路,"六甲區水林里信義街349巷11弄24號對面 佔用道路",六甲區水林里信義街349巷11弄24號,22.9997281,120.2270277
UN201807110176,"2018-07-11 13:58:30",東區,路燈故障,9盞以下路燈故障,"東區中華東路三段399巷16弄31號左前方停車場外 路燈不亮",東區中華東路三段399巷16弄31號,22.9727194,120.2193025
UN201807110178,"2018-07-11 14:07:56",善化區,交通運輸,佔用道路,"善化區文昌路19之1號 占用道路",善化區文昌路19之1號,23.1294018,120.2920405
UN201807110182,"2018-07-11 14:21:45",新市區,違規停車,違規停車,"新市區銘傳街46號 違規停車",新市區銘傳街46號,23.074182,120.291868
UN201807110184,"2018-07-11 14:25:47",安平區,違規停車,違規停車,"安平區永華路二段500號 違停",安平區永華路二段500號,22.9901581,120.1777551
UN201807110186,"2018-07-11 14:30:06",永康區,噪音舉發,妨害安寧,"永康區中正北路523號-8前  妨害安寧",永康區中正北路523號之8,23.04248,120.256785
UN201807110191,"2018-07-11 14:41:31",安定區,髒亂及汙染,空氣汙染,"安定區中榮里 空氣汙染",安定區中榮里,23.0935618,120.2440609
UN201807110199,"2018-07-11 15:01:08",仁德區,動物救援,遊蕩犬隻捕捉管制,"仁德區保仁路195號  動物管制",仁德區保仁路195號,22.959636,120.2194546
UN201807110204,"2018-07-11 15:07:25",中西區,騎樓舉發,騎樓舉發,"中西區西門路一段580號 騎樓舉發",中西區西門路一段580號,22.9862967,120.1976876
UN201807110208,"2018-07-11 15:18:32",中西區,違規停車,違規停車,"中西區民族路二段與公園路口 違停",中西區民族路二段公園路,22.99568,120.2057441
UN201807110213,"2018-07-11 15:26:35",歸仁區,髒亂及汙染,空氣汙染,"歸仁區保吉路73巷41號 空氣汙染",歸仁區保吉路73巷41號,22.9997281,120.2270277
UN201807110219,"2018-07-11 15:38:53",善化區,髒亂及汙染,空氣汙染,"善化區建國路78巷 空氣污染",善化區建國路78巷,23.1295117,120.2971654
UN201807110225,"2018-07-11 15:48:39",中西區,違規停車,違規停車,"中西區西門路一段580號 違規停車",中西區西門路一段580號,22.9862967,120.1976876
UN201807110226,"2018-07-11 15:50:40",北區,違規停車,違規停車,"北區東豐路451巷26號對面險坡路段 違規停車",北區東豐路451巷26號,23.0032884,120.2280098
UN201807110233,"2018-07-11 16:02:45",安南區,違規停車,違規停車,"安南區安和路二段85度c 違規停車",安南區安和路二段85度c,23.0419265,120.2162246
UN201807110234,"2018-07-11 16:04:21",南區,道路維修,路面坑洞,"南區大成路二段158號  路面坑洞",南區大成路二段158號,22.9750481,120.1933937
UN201807110239,"2018-07-11 16:26:15",北區,噪音舉發,妨害安寧,"北區海安路三段2號2樓3樓 噪音舉發",北區海安路三段2號,22.9997281,120.2270277
UN201807110244,"2018-07-11 16:33:48",安平區,交通運輸,佔用道路,"安平區建平十二街192巷1號 交通運輸",安平區建平十二街192巷1號,22.9956404,120.1778703
UN201807110247,"2018-07-11 16:35:12",安平區,違規停車,違規停車,"安平區永華路二段500號 違規停車",安平區永華路二段500號,22.9901581,120.1777551
UN201807110252,"2018-07-11 16:46:58",西港區,動物救援,遊蕩犬隻捕捉管制,"西港區南港里中港48號  貓咪捕捉",西港區南港里中港48號,23.109158,120.193799
UN201807110254,"2018-07-11 16:47:55",東區,違規停車,違規停車,"東區府東街47號 違停",東區府東街47號,22.985384,120.2195444
UN201807110255,"2018-07-11 16:48:51",東區,噪音舉發,妨害安寧,"東區文化二街186巷8號 噪音舉發",東區文化二街186巷8號,22.9758462,120.2332527
UN201807110257,"2018-07-11 16:52:36",永康區,動物救援,犬貓急難救援,"永康區中正一街28號 捕狗",永康區中正一街28號,22.9997281,120.2270277
UN201807110259,"2018-07-11 16:57:46",北區,違規停車,違規停車,"北區成功路2號前 違規停車",北區成功路2號,22.9976771,120.211063
UN201807110261,"2018-07-11 17:02:18",仁德區,交通運輸,佔用道路,"仁德區太子二街118號左斜對面 佔用道路",仁德區太子二街118號,22.9997281,120.2270277
UN201807110262,"2018-07-11 17:05:33",永康區,道路維修,路面坑洞,"永康區中正北路327號旁 路面坑洞",永康區中正北路327號,23.0421331,120.247938
UN201807110267,"2018-07-11 17:19:02",永康區,違規停車,違規停車,"永康區國聖街214號 違停",永康區國聖街214號,22.9997281,120.2270277
UN201807110270,"2018-07-11 17:25:08",新營區,違規停車,違規停車,"新營區隋唐街69巷22號 違規停車",新營區隋唐街69巷22號,23.306995,120.301193
UN201807110271,"2018-07-11 17:36:06",中西區,違規停車,違規停車,"中西區健康路一段298號和320號 違規停車",中西區健康路一段298號和320號,22.9997281,120.2270277
