UN201808240392,"2018-08-24 11:23:38",中西區,違規停車,違規停車,"中西區民權路三段103號 違規停車",臺南市中西區民權路三段103號,22.996881,120.196798
UN201808240397,"2018-08-24 11:30:10",東區,路燈故障,10盞以上路燈故障,東區中華東路二段41巷路口整排路燈放亮中,東區中華東路二段41巷,22.9997281,120.2270277
UN201808240424,"2018-08-24 11:51:24",永康區,道路維修,路樹傾倒,"永康區永大路二段102號 路樹倒塌",永康區永大路二段102號,23.0027928,120.260358
UN201808240439,"2018-08-24 12:05:55",中西區,交通運輸,號誌故障,交通運輸,中西區西門路二段129號,22.9930838,120.1984836
UN201808240442,"2018-08-24 12:15:19",安南區,髒亂及汙染,道路散落物,"安南區土城國小前 道路散落物",城安路,23.0667003,120.1286276
UN201808240448,"2018-08-24 12:27:59",東區,道路維修,路面掏空、塌陷,"東區青年路434號達俊診前 路面塌陷",東區青年路434號,22.9997281,120.2270277
UN201808240466,"2018-08-24 12:51:40",中西區,違規停車,違規停車,"中西區西華南街65號 違規停車",中西區西華南街65號,22.9947618,120.2095867
UN201808240471,"2018-08-24 12:55:18",新營區,髒亂及汙染,空氣汙染,"新營區東昌路 空氣汙染",新營區東昌路,23.3172954,120.3284179
UN201808240472,"2018-08-24 12:56:19",善化區,違規停車,違規停車,違規停車,臺南市善化區光復路55號,23.128475,120.292734
UN201808240505,"2018-08-24 13:31:54",新市區,道路維修,路面坑洞,"新市區新港社大道轉永康區省道 路面坑洞",新市區新港社大道,23.0751809,120.2764506
UN201808240512,"2018-08-24 13:35:46",中西區,道路維修,路面坑洞,"中西區中華西路二段685號 坑洞",中西區中華西路二段685號,23.002427,120.1866771
UN201808240524,"2018-08-24 13:44:28",南區,路燈故障,9盞以下路燈故障,"南區智南街整條街 路燈不亮",南區智南街,22.9837227,120.1869885
UN201808240537,"2018-08-24 14:04:37",仁德區,道路維修,路面坑洞,"仁德區中正路二段727號與仁義六街口  路面坑洞",仁德區中正路二段727號仁義六街,22.9997281,120.2270277
UN201808240546,"2018-08-24 14:11:53",東區,道路維修,路面坑洞,"東區中華東路二段148號 坑洞",東區中華東路二段148號,22.9997281,120.2270277
UN201808240547,"2018-08-24 14:14:25",安平區,髒亂及汙染,空氣汙染,"安平區建平五街184巷15弄35號 空氣汙染",安平區建平五街184巷15弄35號,22.9883967,120.1753684
UN201808240569,"2018-08-24 14:37:07",永康區,道路維修,路面坑洞,"永康區大橋二街*大橋一街73巷 路面坑洞",永康區大橋二街*大橋一街73巷,23.0187262,120.2271662
UN201808240570,"2018-08-24 14:37:32",中西區,違規停車,違規停車,"中西區民族路二段77號旁停車場外 違規停車",臺南市中西區民族路二段77號,22.994373,120.209331
UN201808240579,"2018-08-24 14:47:12",鹽水區,髒亂及汙染,市區道路路面油漬,"鹽水區歡雅里尾寮86號 路面油漬",鹽水區歡雅里尾寮86號,23.0187262,120.2271662
UN201808240585,"2018-08-24 14:51:31",東區,道路維修,路面坑洞,"東區中華東路三段 坑洞",東區中華東路三段,22.9754681,120.2243507
UN201808240587,"2018-08-24 14:56:00",中西區,違規停車,違規停車,"中西區民族路二段77號旁邊停車場外面 違規停車",臺南市中西區民族路二段77號,22.994373,120.209331
UN201808240593,"2018-08-24 15:06:20",新化區,髒亂及汙染,空氣汙染,"新化區正新路361號3樓，非法私人神壇 空氣污染",新化區正新路361號3樓,22.9997281,120.2270277
UN201808240600,"2018-08-24 15:14:39",安平區,動物救援,犬貓急難救援,"安平區建平一街219號 貓受困",安平區建平一街219號,22.9997281,120.2270277
UN201808240630,"2018-08-24 15:45:04",南區,道路維修,路面坑洞,"南區大同路二段過生產路往南沿線 路面坑洞",南區大同路二段*生產路,22.9645121,120.2163957
UN201808240659,"2018-08-24 16:05:46",北區,道路維修,路面坑洞,"北區公園路892巷39號 路面坑洞",北區公園路892巷39號,23.0137183,120.213687
UN201808240685,"2018-08-24 16:23:37",中西區,違規停車,違規停車,"中西區樹林街二段222號 違規停車",臺南市中西區樹林街二段222號,22.985901,120.204462
UN201808240692,"2018-08-24 16:32:06",中西區,騎樓舉發,騎樓舉發,"中西區西華南街31號騎樓 騎樓舉發",臺南市中西區西華南街31號,22.993715,120.209332
UN201808240693,"2018-08-24 16:33:40",中西區,騎樓舉發,騎樓舉發,"中西區西華南街33號騎樓靠馬路處 騎樓舉發",臺南市中西區西華南街33號,22.993754,120.209335
UN201808240704,"2018-08-24 16:42:57",安平區,道路維修,路面坑洞,"安平區永華九街55號 坑洞",安平區永華九街55號,22.9907926,120.1701411
UN201808240715,"2018-08-24 16:50:08",南區,道路維修,路面坑洞,"南區金華路一段97號前 路面坑洞",南區金華路一段97號,22.9634029,120.1895657
UN201808240749,"2018-08-24 17:16:18",東區,民生管線,停電、漏電、電線掉落、孔蓋鬆動,"東區崇善路182巷15號 停電",東區崇善路182巷15號,22.9783823,120.2250468
UN201808240759,"2018-08-24 17:26:59",新市區,道路維修,路面坑洞,"新市區富強路跟新港社大道十字路口 坑洞",新市區富強路新港社大道,23.0644502,120.2812064
UN201808240782,"2018-08-24 17:49:30",安平區,路燈故障,9盞以下路燈故障,"安平區育平九街(育平路~國平路)/安平區育平路(慶平路~育平九街口) 路燈故障",安平區育平九街,22.9997281,120.2270277
UN201808240793,"2018-08-24 17:57:15",北區,髒亂及汙染,空氣汙染,"北區文成三路696號非凡補習班 空氣汙染",北區文成三路696號非凡補習班,23.0160371,120.1992685
UN201808240816,"2018-08-24 18:33:28",後壁區,路燈故障,10盞以上路燈故障,"後壁區新港東 路燈故障",後壁區新港東,23.340369,120.32928
UN201808240836,"2018-08-24 18:55:27",北區,路燈故障,9盞以下路燈故障,"北區公園北路88巷54號 路燈故障不亮",北區公園北路88巷54號,23.005837,120.2108263
UN201808240850,"2018-08-24 19:17:07",北區,路燈故障,10盞以上路燈故障,"北區中華北路一段181巷 路燈大範圍不亮",北區中華北路一段181巷,23.0101916,120.1841267
UN201808240857,"2018-08-24 19:34:13",永康區,違規停車,違規停車,"永康區六合路42巷1號，巷口 違規停車",永康區六合路42巷1號,23.0094651,120.2314746
UN201808240859,"2018-08-24 19:35:30",東區,路燈故障,9盞以下路燈故障,"(防)東區怡東路與東平路,,怡東路上二個路燈不亮",東區怡東路東平路,22.9954693,120.228728
UN201808240862,"2018-08-24 19:38:47",南區,路燈故障,10盞以上路燈故障,"南區中華南路一段173號 路燈",南區中華南路一段173號,22.9997281,120.2270277
UN201808240865,"2018-08-24 19:46:45",安南區,路燈故障,9盞以下路燈故障,"安南區育安街86巷旁 路燈故障",安南區育安街86巷,23.0470745,120.2156637
UN201808240872,"2018-08-24 19:59:55",安南區,路燈故障,9盞以下路燈故障,"安南區海佃路二段206巷15號 路燈故障",安南區海佃路二段206巷15號,23.0351735,120.1891117
UN201808240880,"2018-08-24 20:27:20",永康區,髒亂及汙染,空氣汙染,"永康交流道附近，全能生技 空氣污染",臺南市永康區蔦松二街3號,23.043696,120.255107
UN201808240881,"2018-08-24 20:32:25",安南區,道路維修,路面坑洞,"安南區安明路和北汕尾路口，安明路往南汽車道上 路面坑洞",安南區安明路,22.9997281,120.2270277
UN201808240892,"2018-08-24 20:59:36",永康區,路燈故障,9盞以下路燈故障,"永康區復國二路190巷內 路燈故障",永康區復國二路190巷,22.9997281,120.2270277
UN201808240894,"2018-08-24 21:05:19",安平區,路燈故障,9盞以下路燈故障,"安平區怡平路390號 路燈故障",安平區怡平路390號,22.9935525,120.1772128
UN201808240902,"2018-08-24 21:17:03",中西區,違規停車,違規停車,"中西區中山路117號 違規停車",中西區中山路117號,22.9997281,120.2270277
UN201808240904,"2018-08-24 21:21:01",中西區,違規停車,違規停車,"中西區中山路63號 違規停車",中西區中山路63號,22.993904,120.2068855
UN201808240905,"2018-08-24 21:22:11",中西區,違規停車,違規停車,"中西區衛民街137號附近 違規停車",中西區衛民街137號,22.9933597,120.2075258
UN201808240908,"2018-08-24 21:30:06",北區,路燈故障,9盞以下路燈故障,"北區實踐街39巷 路燈故障",北區實踐街39巷,23.0158426,120.2187397
UN201808240914,"2018-08-24 21:37:08",北區,路燈故障,9盞以下路燈故障,北區北門路三段98號到142號9盞以下路燈故障,北區北門路三段,23.014433,120.2173611
UN201808240918,"2018-08-24 21:41:36",新營區,道路維修,路面坑洞,"新營區復興路 路面坑洞",新營區復興路,23.3063146,120.2947167
UN201808240924,"2018-08-24 22:00:51",中西區,路燈故障,9盞以下路燈故障,"中西區建業街37巷23號 路燈故障",中西區建業街37巷23號,22.9872696,120.2054486
UN201808240925,"2018-08-24 22:01:25",中西區,違規停車,違規停車,"中西區西華南街66號 違規停車",臺南市西華南街66號,22.994188,120.209597
UN201808240935,"2018-08-24 22:29:22",中西區,路燈故障,9盞以下路燈故障,"中西區信義街108巷24號,55號,57號 路燈故障",中西區信義街108巷24號,23.0012963,120.1953868
UN201808240936,"2018-08-24 22:32:44",中西區,違規停車,違規停車,"中西區西華南街33號 違規停車",臺南市西華南街33號,22.993754,120.209335
UN201808240942,"2018-08-24 22:51:27",永康區,交通運輸,號誌故障,"永康區永大路二段與文化路口 號誌故障",永康區永大路二段,22.9997281,120.2270277
UN201808240949,"2018-08-24 23:19:22",安平區,路燈故障,9盞以下路燈故障,"安平區國勝路105號附近 路燈不亮",臺南市安平區國勝路105號,23.002272,120.160716
UN201808240950,"2018-08-24 23:25:36",永康區,路燈故障,9盞以下路燈故障,"永康區龍橋街403巷39號 路燈故障",龍橋街403巷39號,23.0426785,120.2627531
UN201808240953,"2018-08-24 23:51:30",新市區,民生管線,漏水、停水、消防栓漏水或損壞,"新市區社內里12-5號 路面漏水",新市區社內里12-5號,23.077065,120.2848666
UN201808250001,"2018-08-25 00:00:57",永康區,道路維修,路面坑洞,"永康區永華路213號 路面坑洞",永康區永華路213號,23.0108134,120.2593723
UN201808250005,"2018-08-25 00:29:40",仁德區,路燈故障,10盞以上路燈故障,"仁德區土庫路整條 路燈不亮",仁德區土庫路,22.9929382,120.2109472
UN201808250006,"2018-08-25 00:33:38",南區,交通運輸,號誌故障,"南區建南路和中華西路口 號誌故障",南區建南路中華西路,22.9852244,120.1864138
UN201808250008,"2018-08-25 00:42:58",仁德區,道路維修,路面坑洞,"仁德區文華路三段和文宏路口 路面坑洞",仁德區文華路三段文宏路,22.9744598,120.2441368
UN201808250009,"2018-08-25 00:45:37",東區,違規停車,違規停車,"東區北門路二段28號 違規停車",臺南市東區北門路二段28號,23.000517,120.213375
UN201808250011,"2018-08-25 01:03:37",東區,路燈故障,9盞以下路燈故障,東區長榮路二段、三段路燈不亮,東區長榮路二段、三段,22.9927976,120.2217637
UN201808250016,"2018-08-25 01:30:32",安南區,路燈故障,9盞以下路燈故障,"安南區頂安街526巷9弄2號 9盞以下路燈故障",安南區頂安街526巷9弄2號,23.043872,120.205663
UN201808250017,"2018-08-25 02:00:26",永康區,民生管線,停電、漏電、電線掉落、孔蓋鬆動,"永康區富強路一段2巷 變電箱爆炸",永康區富強路一段2巷,22.9997281,120.2270277
UN201808250029,"2018-08-25 05:59:42",永康區,道路維修,路面坑洞,"永康區復興路71巷口 路面坑洞",永康區復興路71巷,22.9947626,120.247503
UN201808250043,"2018-08-25 07:15:51",永康區,髒亂及汙染,道路散落物,"永康區中正北路403號 道路散落物",永康區中正北路403號,22.9997281,120.2270277
UN201808250046,"2018-08-25 07:24:55",安南區,民生管線,停電、漏電、電線掉落、孔蓋鬆動,"安南區北汕尾一路656號   電線脫落",安南區北汕尾一路656號,23.0217995,120.1224871
UN201808250050,"2018-08-25 07:33:28",中西區,騎樓舉發,騎樓舉發,"中西區西華南街33號  騎樓舉發",臺南市中西區西華南街33號,22.993754,120.209335
UN201808250052,"2018-08-25 07:37:19",中西區,騎樓舉發,騎樓舉發,"中西區西華南街2號10號  騎樓舉發",臺南市中西區西華南街2號,22.993195,120.20943
UN201808250061,"2018-08-25 08:05:59",新市區,動物救援,犬貓急難救援,"新市區富安五街接堤防   狗受困",新市區富安五街,23.0819342,120.2911969
UN201808250063,"2018-08-25 08:10:02",安南區,路燈故障,9盞以下路燈故障,安南區義安街86巷跟義吉街　9盞以下路燈故障,安南區義安街86巷義吉街,23.0316661,120.1954102
UN201808250064,"2018-08-25 08:12:34",東區,路燈故障,9盞以下路燈故障,"東區德東街189巷3號  路燈故障",東區德東街189巷3號,22.9997281,120.2270277
UN201808250068,"2018-08-25 08:19:53",安定區,道路維修,路面坑洞,"安定區港南里港口23之50號 坑洞",安定區港南里港口23之50號,22.9497722,120.1841301
UN201808250070,"2018-08-25 08:21:58",永康區,道路維修,路面坑洞,"永康區尚頂路167號  路面坑洞",永康區尚頂路167號,23.0794703,120.2934883
UN201808250086,"2018-08-25 08:54:21",南區,噪音舉發,妨害安寧,"南區金華路二段71巷2號  噪音舉發",南區金華路二段71巷2號,22.979025,120.1908027
UN201808250100,"2018-08-25 09:16:44",仁德區,道路維修,路面坑洞,"仁德區中山路546號整條  路面坑洞",仁德區中山路546號,22.9997281,120.2270277
UN201808250103,"2018-08-25 09:21:40",北區,交通運輸,佔用道路,"北區東興路二段59號    佔用道路",臺南市北區東興路二段59號,23.001156,120.228279
UN201808250104,"2018-08-25 09:22:51",中西區,騎樓舉發,騎樓舉發,"中西區西華南街33號 騎樓舉發",臺南市中西區西華南街33號,22.993754,120.209335
UN201808250111,"2018-08-25 09:29:25",中西區,騎樓舉發,騎樓舉發,"中西區西華南街2到10號 騎樓舉發",臺南市中西區西華南街2號,22.993195,120.20943
UN201808250112,"2018-08-25 09:31:36",中西區,騎樓舉發,騎樓舉發,"中西區衛民街34號旁 騎樓舉發",臺南市中西區衛民街34號,22.992919,120.210937
UN201808250122,"2018-08-25 09:38:45",七股區,交通運輸,號誌故障,"七股區南32跟29路口 號誌故障",七股區南32,22.9929382,120.2109472
UN201808250123,"2018-08-25 09:40:16",中西區,道路維修,路樹傾倒,"中西區南門路/友愛街口 道路維修",中西區南門路友愛街,22.990803,120.2048108
UN201808250139,"2018-08-25 10:08:05",仁德區,違規停車,違規停車,"仁德區保華路二空路交叉口 違規停車",仁德區保華路*二空路,22.9584847,120.2233682
UN201808250143,"2018-08-25 10:12:38",南區,噪音舉發,場所連續噪音,"IVR 南區大同路二段110號9樓之3  噪音汙染",南區大同路二段110號9樓之3,22.9799709,120.2124527
UN201808250146,"2018-08-25 10:18:31",安平區,道路維修,路樹傾倒,"安平區王城路 路樹傾倒",安平區王城路,23.0029595,120.1553677
UN201808250149,"2018-08-25 10:23:53",北區,路燈故障,9盞以下路燈故障,"北區中華北路一段53巷61號前  路燈故障",北區中華北路一段53巷61號,23.0071867,120.1842903
UN201808250158,"2018-08-25 10:33:20",北區,交通運輸,佔用道路,"北區東興路二段59號 佔用道路",臺南市北區東興路二段59號,23.001156,120.228279
UN201808250161,"2018-08-25 10:37:55",中西區,路燈故障,10盞以上路燈故障,"中西區文賢路115號附近/中西區信義街120號附近 路燈不亮",中西區文賢路115號,23.0016754,120.1944199
UN201808250164,"2018-08-25 10:41:32",中西區,違規停車,違規停車,"中西區民族路三段282號 違規停車",臺南市中西區民族路三段282號,23.00022,120.192438
UN201808250169,"2018-08-25 10:50:30",中西區,髒亂及汙染,空氣汙染,"中西區府前一街117號 空氣汙染",中西區府前一街117號,22.9956994,120.1875659
UN201808250172,"2018-08-25 10:53:09",南區,交通運輸,號誌故障,"南區中華南路一段西門路口 交通運輸",南區中華南路一段西門路,22.9637338,120.198452
UN201808250173,"2018-08-25 10:56:43",官田區,道路維修,路面掏空、塌陷,"官田區大崎里往大井方向 路坍方",官田區大崎里,23.191679,120.3954282
UN201808250174,"2018-08-25 10:57:25",安定區,道路維修,路面坑洞,"安定區安定郵局旁道路通往堤防道路，堤防道路上往西港大橋方向 路面坑洞",安定區堤防道路,23.121593,120.237118
UN201808250176,"2018-08-25 10:59:34",新營區,道路維修,路面坑洞,"新營區長榮路跟東仁街口 坑洞",新營區長榮路東仁街,23.3196715,120.3190006
UN201808250178,"2018-08-25 11:01:58",佳里區,道路維修,路面坑洞,"佳里區佳南路以南但未至東向 道路維修",佳里區佳南路,23.082665,120.2952933
UN201808250180,"2018-08-25 11:05:53",新營區,違規停車,違規停車,"新營區新北里三興街301巷 違規停車",新營區新北里三興街301巷,23.3184672,120.3079248
UN201808250183,"2018-08-25 11:08:47",永康區,違規停車,違規停車,"永康區六合路42巷50號。巷口 違規停車",臺南市永康區六合路42巷50號,23.009208,120.232462
UN201808250190,"2018-08-25 11:18:56",仁德區,道路維修,路面坑洞,"仁德區中山路542號 道路維修",仁德區中山路542號,22.9715145,120.2532211
UN201808250193,"2018-08-25 11:22:15",安南區,動物救援,犬貓急難救援,"安南區城北路194巷11號 犬隻救援",安南區城北路194巷11號,23.0655054,120.1319054
UN201808250203,"2018-08-25 11:36:00",關廟區,道路維修,路面掏空、塌陷,"關廟區南雄路一段6號常藝藤家具前 路面塌陷",關廟區南雄路一段6號常藝藤家具前,22.932006,120.339809
UN201808250208,"2018-08-25 11:45:59",佳里區,道路維修,路面坑洞,"佳里區子龍里南47 1.4K 路面坑洞","佳里區子龍里南47 1.4K",22.9997281,120.2270277
UN201808250209,"2018-08-25 11:47:21",中西區,違規停車,違規停車,"中西區永福路二段37號 違規停車",臺南市中西區永福路二段37號,22.991058,120.200434
UN201808250217,"2018-08-25 11:57:56",南區,違規停車,違規停車,"南區健康路二段141號 違規停車",南區健康路二段141號,22.9814047,120.1937234
UN201808250224,"2018-08-25 12:14:42",北區,道路維修,路面坑洞,"北區長榮路五段311號北區中華北路上北安橋安南區台江大道   路面坑洞",北區長榮路五段311號北區中華北路上北安橋安南區台江大道,23.0267661,120.1931565
UN201808250238,"2018-08-25 12:36:54",東區,路燈故障,9盞以下路燈故障,"東區大同路一段175巷143弄1號 路燈故障",東區大同路一段175巷143弄1號,22.9826187,120.2138353
UN201808250245,"2018-08-25 12:45:17",安平區,路燈故障,9盞以下路燈故障,"安平區永華八街6號  路燈故障",安平區永華八街6號,22.9997281,120.2270277
UN201808250255,"2018-08-25 12:56:10",南區,路燈故障,9盞以下路燈故障,"南區健康路一段175巷與體育路21巷口 路燈不亮",南區健康路一段175巷體育路21巷,22.9806061,120.2079595
UN201808250258,"2018-08-25 12:58:03",中西區,違規停車,違規停車,"中西區民族路二段76號 違規停車",臺南市中西區民族路二段76號,22.994726,120.20925
UN201808250261,"2018-08-25 13:02:05",南區,違規停車,違規停車,"南區大同路二段428號  違規停車",臺南市南區大同路二段428號,22.974057,120.214147
UN201808250268,"2018-08-25 13:11:29",北區,髒亂及汙染,空氣汙染,"北區大興街76巷91號到120號  髒亂及汙染",北區大興街76巷91號120號或121號150號,23.0134366,120.1917947
UN201808250272,"2018-08-25 13:22:18",北區,違規停車,違規停車,"北區開元路307號  違規停車",臺南市北區開元路307號,23.00817,120.221424
UN201808250274,"2018-08-25 13:24:02",歸仁區,道路維修,路面掏空、塌陷,"歸仁區大埔路二段8巷內 路面掏空",歸仁區大埔路二段8巷,23.0130042,120.2849532
UN201808250282,"2018-08-25 13:46:30",麻豆區,道路維修,路面坑洞,"麻豆區麻佳路一段轉進麻豆轉運站 路面坑洞",麻豆區麻佳路一段,23.1835305,120.2379423
UN201808250290,"2018-08-25 14:08:17",永康區,路燈故障,9盞以下路燈故障,"永康區大同街639巷8號、16號 路燈故障",永康區大同街639巷8號、16號,23.0180916,120.263518
UN201808250299,"2018-08-25 14:22:26",永康區,道路維修,路面坑洞,"永康區中華路155巷48號/永安路 坑洞",永康區中華路155巷48號,23.3495164,120.415087
UN201808250300,"2018-08-25 14:23:04",安平區,路燈故障,9盞以下路燈故障,"IVR  安平區世平三街12巷24號   路燈故障",安平區世平三街12巷24號,22.9959061,120.1492802
UN201808250312,"2018-08-25 14:50:14",東區,民生管線,漏水、停水、消防栓漏水或損壞,"東區裕孝路跟裕英街口 漏水",東區裕孝路裕英街,22.9867825,120.2435222
UN201808250316,"2018-08-25 14:57:56",中西區,動物救援,遊蕩犬隻捕捉管制,"中西區民權路四段西湖公園 捕犬",中西區民權路四段西湖公園,22.9997281,120.2270277
UN201808250318,"2018-08-25 14:58:52",永康區,道路維修,路面坑洞,"永康區南興路5號/59號 坑洞",永康區南興路5號,22.9942098,120.2583118
UN201808250323,"2018-08-25 15:23:56",中西區,路燈故障,9盞以下路燈故障,"中西區環河街129巷  路燈故障",中西區環河街129巷,22.9966096,120.1908315
UN201808250337,"2018-08-25 15:47:54",北區,騎樓舉發,騎樓舉發,"北區開元路380號 騎樓舉發",臺南市北區開元路380號,23.01007,120.224837
UN201808250345,"2018-08-25 16:09:01",柳營區,髒亂及汙染,空氣汙染,"柳營區環園東路二段8號 空氣汙染",柳營區環園東路二段8號,23.2782989,120.361654
UN201808250346,"2018-08-25 16:09:48",新市區,違規停車,違規停車,"新市區中正路301巷15弄23號 違規停車",新市區中正路301巷15弄23號,23.0796201,120.2927569
UN201808250348,"2018-08-25 16:10:59",新市區,交通運輸,佔用道路,"新市區中正路301巷15弄41號 佔用道路",新市區中正路301巷15弄41號,23.0794177,120.2923445
UN201808250350,"2018-08-25 16:11:27",中西區,違規停車,違規停車,"中西區民權路三段103號 違規停車",台南市中西區民權路三段103號,22.9968511,120.196791
UN201808250351,"2018-08-25 16:11:40",新市區,違規停車,違規停車,"新市區中正路321號 違規停車",新市區中正路321號,22.9997281,120.2270277
UN201808250353,"2018-08-25 16:16:06",中西區,噪音舉發,妨害安寧,"中西區臨安路一段72號 噪音舉發",中西區臨安路一段72號,22.9990981,120.1907774
UN201808250355,"2018-08-25 16:19:12",白河區,髒亂及汙染,空氣汙染,"白河區中山路*中正路 白河市場門口前，鹹酥雞店家 空氣汙染",白河區中山路*中正路,23.3495164,120.415087
UN201808250356,"2018-08-25 16:19:48",中西區,違規停車,違規停車,"中西區西華南街上靠近中山路口 紅線違停",中西區西華南街中山路,22.9956924,120.209798
UN201808250359,"2018-08-25 16:28:54",東區,騎樓舉發,騎樓舉發,"東區崇德路654號 騎樓舉發",東區崇德路654號,22.9695507,120.2273851
UN201808250362,"2018-08-25 16:36:04",白河區,道路維修,路面掏空、塌陷,"白河區關子嶺172乙線7.3公里處 路面塌陷",白河區關子嶺172乙線,23.334893,120.500069
UN201808250368,"2018-08-25 16:45:41",中西區,違規停車,違規停車,"中西區中山路117號 違規停車",中西區中山路117號,22.9946964,120.2080708
UN201808250369,"2018-08-25 16:47:17",仁德區,民生管線,漏水、停水、消防栓漏水或損壞,"仁德區仁義路227號對面 孔蓋冒水",仁德區仁義路227號,22.9687675,120.2587395
UN201808250370,"2018-08-25 16:49:26",東區,違規停車,違規停車,"東區中華東路三段357巷19號 違規停車",東區中華東路三段357巷19號,22.9997281,120.2270277
UN201808250373,"2018-08-25 16:52:28",安南區,交通運輸,號誌故障,"安南區北安路二段59號 號誌故障",安南區北安路二段59號,23.025893,120.204802
UN201808250377,"2018-08-25 16:56:56",南區,道路維修,路面坑洞,"南區體育路上，大林路往竹溪寺方向 路面坑洞",南區體育路,22.9775807,120.2072552
UN201808250378,"2018-08-25 16:58:53",東區,違規停車,違規停車,"東區東安路187號 違規停車",東區東安路187號,22.994956,120.226704
UN201808250386,"2018-08-25 17:06:27",中西區,路燈故障,9盞以下路燈故障,"中西區湖美街24號 路燈故障",中西區湖美街24號,23.0000781,120.1801953
UN201808250387,"2018-08-25 17:09:23",中西區,違規停車,違規停車,"中西區民權路一段222號 違規停車",中西區民權路一段222號,22.9925487,120.2075508
UN201808250389,"2018-08-25 17:12:21",中西區,騎樓舉發,騎樓舉發,"中西區衛民街106-36，106-52號騎樓 違規停車",中西區衛民街106-36，106-52號騎樓,22.9933568,120.2087867
UN201808250392,"2018-08-25 17:13:55",中西區,騎樓舉發,騎樓舉發,"中西區衛民街110，112號騎樓 騎樓舉發",中西區衛民街110號,22.9997281,120.2270277
UN201808250394,"2018-08-25 17:18:17",東區,民生管線,漏水、停水、消防栓漏水或損壞,"東區裕英街123號到125號之間 漏水",東區裕英街123號,22.9868484,120.2437553
UN201808250398,"2018-08-25 17:23:41",安平區,違規停車,違規停車,"安平區四草大橋 違規停車",安平區四草大橋,22.9965016,120.1409454
