UN201808200006,"2018-08-20 04:52:15",六甲區,噪音舉發,場所連續噪音,"六甲區中正路７號 場所連續噪音",中正路７號,22.9997281,120.2270277
UN201808200010,"2018-08-20 08:01:07",永康區,民生管線,漏水、停水、消防栓漏水或損壞,"永康區洲尾街3號前方 民生管線",永康區洲尾街3號,23.029767,120.2135854
UN201808200017,"2018-08-20 08:18:24",七股區,路燈故障,9盞以下路燈故障,"七股區三股里147號 路燈",七股區三股里147號,23.1201853,120.0723009
UN201808200020,"2018-08-20 08:24:16",安南區,髒亂及汙染,空氣汙染,"安南區總安街一段64號 空氣污染",安南區總安街一段64號,23.0506802,120.2174623
UN201808200027,"2018-08-20 08:35:18",善化區,噪音舉發,場所連續噪音,"善化區昌隆里201之11號 噪音",善化區昌隆里201之11號,23.1402613,120.3089541
UN201808200034,"2018-08-20 08:44:50",中西區,違規停車,違規停車,"中西區衛民街37號 違規停車",臺南市中西區衛民街37號,22.992723,120.211181
UN201808200040,"2018-08-20 08:51:12",永康區,違規停車,違規停車,"永康區中正南路35號 違規停車",臺南市永康區中正南路35號,23.0201,120.216003
UN201808200042,"2018-08-20 08:59:10",永康區,噪音舉發,場所連續噪音,"永康區大灣路942巷641弄5號 噪音舉發",永康區大灣路942巷641弄5號,23.012709,120.257008
UN201808200046,"2018-08-20 09:06:53",永康區,違規停車,違規停車,"永康區復興路35號 違停",臺南市永康區復興路35號,22.998486,120.249581
UN201808200047,"2018-08-20 09:07:04",仁德區,髒亂及汙染,空氣汙染,"仁德區中山路379巷1號對面 空氣汙染",仁德區中山路379巷1號,22.9708894,120.2575627
UN201808200050,"2018-08-20 09:14:38",南區,髒亂及汙染,空氣汙染,"南區明興路1055巷47號  空氣汙染",南區明興路1055巷47號,22.9310012,120.1845513
UN201808200051,"2018-08-20 09:15:46",中西區,髒亂及汙染,環境髒亂,"中西區樹林街二段328巷口 環境髒亂",中西區樹林街二段328巷,22.9866077,120.2008093
UN201808200054,"2018-08-20 09:20:04",仁德區,道路維修,路面坑洞,"仁德區德崙路181號  路面坑洞",仁德區德崙路181號,22.9444618,120.2552997
UN201808200060,"2018-08-20 09:31:59",中西區,路燈故障,9盞以下路燈故障,"中西區國華街三段269巷15號  路燈故障",中西區國華街三段269巷15號,22.999723,120.199313
UN201808200153,"2018-08-20 12:18:47",南區,髒亂及汙染,空氣汙染,"南區中華西路一段59號 空氣汙染",南區中華西路一段59號,22.9724101,120.18321
UN201808200159,"2018-08-20 12:25:23",歸仁區,違規停車,違規停車,"歸仁區中正南路一段87號 違規停車",歸仁區中正南路一段87號,22.9645464,120.2935255
UN201808200161,"2018-08-20 12:29:12",永康區,違規停車,違規停車,永康區中華路58巷76號違規停車,臺南市永康區中華路58巷76號,23.002076,120.237319
UN201808200166,"2018-08-20 12:42:15",中西區,違規停車,違規停車,中西區中山路117號違規停車,臺南市中西區中山路117號,22.994736,120.208179
UN201808200167,"2018-08-20 12:54:49",北區,違規停車,違規停車,"北區臨安路二段193號 違停",臺南市北區臨安路二段193號,23.003755,120.199072
UN201808200171,"2018-08-20 13:11:11",東區,交通運輸,佔用道路,"東區崇德路46號  佔用道路",臺南市東區崇德路46號,22.981389,120.217567
UN201808200174,"2018-08-20 13:11:31",中西區,違規停車,違規停車,"中西區民族路二段29-63號 違規停車",臺南市中西區民族路二段29號,22.994332,120.210929
UN201808200175,"2018-08-20 13:13:21",中西區,道路維修,路面坑洞,"中西區五妃街221號  路面坑洞",中西區五妃街221號,22.9825184,120.2035195
UN201808200176,"2018-08-20 13:17:09",中西區,違規停車,違規停車,"中西區府前路一段174號 違規停車",臺南市中西區府前路一段174號,22.989141,120.206489
UN201808200180,"2018-08-20 13:30:13",南區,交通運輸,號誌故障,南區新興路與西門路,南區新興路西門路,22.9997281,120.2270277
UN201808200188,"2018-08-20 13:50:02",中西區,交通運輸,佔用道路,"中西區尊王路32號 佔用道路",臺南市中西區尊王路32號,22.991485,120.197242
UN201808200199,"2018-08-20 14:08:29",安南區,髒亂及汙染,環境髒亂,"安南區安和路一段150巷41號門口 髒亂及汙染",安南區安和路一段150巷41號,22.9997281,120.2270277
UN201808200203,"2018-08-20 14:11:20",安定區,路燈故障,10盞以上路燈故障,"安定區南134市道，港南里港口240-6號附近 路燈放亮",安定區南134市道，港南里港口240-6號附近,23.0886362,120.2393723
UN201808200205,"2018-08-20 14:14:26",北區,交通運輸,佔用道路,"北區公園路599-5號 佔用道路",臺南市北區公園路599之5號,23.014306,120.212532
UN201808200211,"2018-08-20 14:21:06",永康區,違規停車,違規停車,"永康區中華路1號 違規停車",臺南市永康區中華路1號,22.998787,120.234278
UN201808200218,"2018-08-20 14:32:48",東區,髒亂及汙染,空氣汙染,"東區崇善五街46巷6號 揚塵",東區崇善五街46巷6號,22.9736061,120.230512
UN201808200220,"2018-08-20 14:35:03",永康區,違規停車,違規停車,"永康區六合路42巷50號。巷口 違規停車",臺南市永康區六合路42巷50號,23.009208,120.232462
UN201808200221,"2018-08-20 14:39:42",歸仁區,,,"歸仁區郭英文理補習班(歸仁區文化街三段20號) 施工噪音",歸仁區郭英文理補習班,22.9709551,120.2875783
UN201808200223,"2018-08-20 14:42:54",柳營區,髒亂及汙染,空氣汙染,"柳營區環園東路二段8號  空氣汙染",柳營區環園東路二段8號,23.2782989,120.361654
UN201808200226,"2018-08-20 14:46:47",西港區,動物救援,犬貓急難救援,"西港區歇腳居民宿 大排溝有犬隻掉入待救援",西港區歇腳居民宿,22.9997281,120.2270277
UN201808200230,"2018-08-20 14:54:14",南區,違規停車,違規停車,"南區永成路二段617號 違規停車",臺南市南區永成路二段617號,22.954132,120.195303
UN201808200233,"2018-08-20 14:59:33",東區,違規停車,違規停車,"東區崇德路678號 違規停車",臺南市東區崇德路678號,22.96735,120.227379
UN201808200235,"2018-08-20 15:05:16",中西區,違規停車,違規停車,"中西區北門路一段159號周遭 違規停車",臺南市中西區北門路一段159號,22.995804,120.211666
UN201808200236,"2018-08-20 15:09:39",東區,違規停車,違規停車,"東區崇德路763號 違規停車",臺南市東區崇德路763號,22.967195,120.22768
UN201808200246,"2018-08-20 15:25:46",白河區,道路維修,路面掏空、塌陷,"白河區關子嶺紅葉隧道往172市道方向   路面坍方",白河區關子嶺紅葉隧道,23.3413755,120.5037151
UN201808200247,"2018-08-20 15:29:25",北區,道路維修,路面下陷、凹陷,"北區文賢路996號 路面下陷",北區文賢路996號,23.0125861,120.194221
UN201808200273,"2018-08-20 16:32:26",中西區,違規停車,違規停車,"中西區中山路58號一擊旁邊的巷口 違規停車",臺南市中西區中山路58號,22.993684,120.207053
UN201808200275,"2018-08-20 16:37:57",中西區,違規停車,違規停車,"中西區中山路100號 違規停車",臺南市中西區中山路100號,22.99459,120.208511
UN201808200284,"2018-08-20 16:51:08",永康區,髒亂及汙染,道路散落物,"永康區中華路330號 路面散落物",永康區中華路330號,23.008311,120.234364
UN201808200292,"2018-08-20 17:24:55",善化區,動物救援,遊蕩犬隻捕捉管制,"善化區什乃里牛墟 犬隻捕捉",善化區什乃里牛墟,23.1411252,120.2822846
UN201808200296,"2018-08-20 17:38:08",中西區,違規停車,違規停車,"中西區民權路一段8號到202號 違規停車",臺南市中西區民權路一段8號,22.989363,120.210982
UN201808200297,"2018-08-20 17:43:19",中西區,違規停車,違規停車,"中西區民權路二段150號到280號 違規停車",臺南市中西區民權路二段150號,22.995137,120.202923
UN201808200298,"2018-08-20 17:50:58",中西區,違規停車,違規停車,"中西區民族路二段243號 違規停車",臺南市中西區民族路二段243號,22.995986,120.204636
UN201808200304,"2018-08-20 18:01:53",安平區,違規停車,違規停車,"安平區安平路108號,162號,240號與288號的右邊 違規停車",臺南市安平區安平路108號,22.998305,120.184003
UN201808200311,"2018-08-20 18:07:26",南區,噪音舉發,場所連續噪音,"南區大成路二段57號 空氣汙染/場所連續噪音",南區大成路二段57號,22.9747111,120.195919
UN201808200317,"2018-08-20 18:16:07",北區,交通運輸,號誌故障,"北區公園南路北門路 號誌故障",北區公園南路北門路,22.9997281,120.2270277
UN201808200327,"2018-08-20 18:34:53",永康區,道路維修,路面下陷、凹陷,"永康區中山路與埔園街交叉口 路面下陷、凹陷",永康區中山路,23.0886362,120.2393723
UN201808200329,"2018-08-20 18:44:47",中西區,違規停車,違規停車,"中西區民族路二段76號 違規停車",臺南市中西區民族路二段76號,22.994726,120.20925
UN201808200333,"2018-08-20 19:08:06",新營區,路燈故障,9盞以下路燈故障,"新營區南昌街64之1號 路燈不亮",新營區南昌街64之1號,23.2999333,120.3078967
UN201808200334,"2018-08-20 19:10:39",中西區,違規停車,違規停車,"中西區西華南街65號 違規停車",臺南市西華南街65號,22.994684,120.209521
UN201808200337,"2018-08-20 19:14:51",七股區,路燈故障,9盞以下路燈故障,"七股區三股里147號 路燈故障",七股區三股里147號,23.1201853,120.0723009
UN201808200338,"2018-08-20 19:16:43",永康區,道路維修,路面坑洞,"永康區復興路71巷91號 路面坑洞",永康區復興路71巷91號,22.9997281,120.2270277
UN201808200342,"2018-08-20 19:24:56",安南區,路燈故障,9盞以下路燈故障,"安南區大眾六街148巷39弄 路燈不亮",安南區大眾六街148巷39弄,23.0195893,120.1273701
UN201808200343,"2018-08-20 19:26:29",歸仁區,動物救援,犬貓急難救援,"歸仁區成功路二段80號  動物救援",歸仁區成功路二段80號,23.2999333,120.3078967
UN201808200345,"2018-08-20 19:29:54",安平區,交通運輸,號誌故障,"安平區安億路與慶平路口 號誌故障",安億路,22.9940061,120.1598021
UN201808200352,"2018-08-20 19:41:26",中西區,噪音舉發,妨害安寧,"中西區臨安路一段72號 妨害安寧",臨安路一段72號,22.9990981,120.1907774
UN201808200355,"2018-08-20 19:51:43",安平區,違規停車,違規停車,"安平區建平九街60巷33號旁 違停",臺南市安平區建平九街60巷33號,22.9922,120.180736
UN201808200360,"2018-08-20 20:16:09",中西區,違規停車,違規停車,"中西區法華街103號 違停",臺南市中西區法華街103號,22.983671,120.209909
UN201808200364,"2018-08-20 20:43:48",中西區,路燈故障,9盞以下路燈故障,"中西區海安路二段，近中正路，寶雅前/中西區中山路209號，定食8前 路燈不亮",中西區海安路二段中正路,22.9932953,120.1960021
UN201808200366,"2018-08-20 20:48:11",南區,路燈故障,9盞以下路燈故障,"南區公英一街31號 路燈故障",南區公英一街31號,22.9997281,120.2270277
UN201808200367,"2018-08-20 20:52:26",鹽水區,路燈故障,9盞以下路燈故障,路燈故障,鹽水區親水公園水月橋,23.0886362,120.2393723
UN201808200369,"2018-08-20 20:57:02",南區,髒亂及汙染,空氣汙染,"南區新建路35巷 空污",南區新建路35巷,22.9669869,120.1852862
UN201808200371,"2018-08-20 21:06:51",歸仁區,動物救援,犬貓急難救援,"歸仁區成功八街1號 犬貓急難救援",歸仁區成功八街1號,22.9584189,120.2988704
UN201808200372,"2018-08-20 21:10:19",永康區,髒亂及汙染,空氣汙染,"永康區蔦松二街3號 空氣汙染",710台南市永康區蔦松二街3號,23.0403405,120.2533669
UN201808200373,"2018-08-20 21:12:33",永康區,路燈故障,9盞以下路燈故障,"永康區鹽行里中正南路與正南五街交叉路口 路燈故障",中正南路,23.0301817,120.2254047
UN201808200376,"2018-08-20 21:14:58",永康區,路燈故障,9盞以下路燈故障,"永康區中正北路318巷42號 路燈故障",中正北路318巷,23.0398287,120.2495304
UN201808200377,"2018-08-20 21:16:20",永康區,路燈故障,9盞以下路燈故障,"永康區中正北路與永安路交叉路口 路燈故障",中正北路,22.9997281,120.2270277
UN201808200382,"2018-08-20 21:34:27",永康區,道路維修,路面坑洞,"永康區中正南路360巷5號 路面坑洞",永康區中正南路360巷5號,23.0403405,120.2533669
UN201808200385,"2018-08-20 21:49:10",東區,路燈故障,9盞以下路燈故障,"東區中華東路三段399巷20弄 路燈故障",東區中華東路三段399巷20弄,22.9723024,120.2191736
UN201808210003,"2018-08-21 02:32:48",永康區,髒亂及汙染,空氣汙染,"永康區大灣路1014號 空氣汙染",臺南市永康區大灣路1014號,22.999921,120.253194
UN201808210006,"2018-08-21 04:38:00",北區,噪音舉發,場所連續噪音,"北區公園南路371號 場所連續噪音",公園南路371號,23.002802,120.201849
UN201808210008,"2018-08-21 06:01:38",中西區,噪音舉發,妨害安寧,"中西區忠義路一段62號 妨害安寧",臺南市中西區忠義路一段62號,22.986673,120.201887
UN201808210024,"2018-08-21 07:59:14",永康區,道路維修,路面坑洞,"永康區復興路246巷跟復興路 道路坑洞",永康區復興路246巷,22.9997281,120.2270277
UN201808210029,"2018-08-21 08:09:34",東區,路燈故障,,"東區富農街一段188巷95號101號 路燈故障",東區富農街一段188巷95號101號,22.9820381,120.236794
UN201808210031,"2018-08-21 08:12:54",北區,噪音舉發,場所連續噪音,"北區西門路三段175號 噪音汙染",臺南市北區西門路三段175號,23.004272,120.204499
UN201808210036,"2018-08-21 08:27:04",東區,違規停車,違規停車,"東區崇德十九街62號  紅線違停",臺南市東區崇德十九街62號,22.968164,120.22935
UN201808210066,"2018-08-21 09:35:37",永康區,交通運輸,號誌故障,"永康區中正二街跟正南五街口  號誌故障",永康區中正二街正南五街,23.0330929,120.2401981
UN201808210090,"2018-08-21 10:14:43",東區,髒亂及汙染,環境髒亂,"東區長榮路二段24巷63號附近工地 砂石痕",東區長榮路二段24巷63號,22.986844,120.220443
UN201808210097,"2018-08-21 10:30:34",中西區,路燈故障,9盞以下路燈故障,"中西區民生路二段上，海安路至康樂街中間 路燈不亮",中西區民生路二段,22.9997281,120.2270277
UN201808210102,"2018-08-21 10:39:03",東區,噪音舉發,妨礙安寧,"東區中華東路二段96巷1弄1號   妨害安寧",臺南市東區中華東路二段96巷1弄1號,22.985089,120.232467
UN201808210104,"2018-08-21 10:46:20",安平區,髒亂及汙染,道路散落物,"安平區健康路三段雙側 道路散落物",安平區健康路三段,22.9844916,120.168999
UN201808210106,"2018-08-21 10:49:12",中西區,違規停車,違規停車,"中西區臨安路一段72號 違規停車",臺南市中西區臨安路一段72號,22.99906,120.190805
UN201808210129,"2018-08-21 11:35:06",北區,髒亂及汙染,空氣汙染,"北區北門路和長榮路交叉口的大光國小 空氣汙染",北區大光國小,23.0126359,120.2177672
UN201808210139,"2018-08-21 11:54:51",北區,髒亂及汙染,空氣汙染,"北區長榮路五段277號 空氣汙染",北區長榮路五段277號,22.9997281,120.2270277
UN201808210140,"2018-08-21 11:55:40",新營區,路燈故障,9盞以下路燈故障,"新營區大仁街6之2號 路燈不亮",新營區大仁街6之2號,22.99259,120.1960301
UN201808210143,"2018-08-21 11:57:54",鹽水區,動物救援,犬貓急難救援,"鹽水區岸內里北門路9巷71號  動物救援",鹽水區岸內里北門路9巷71號,23.3252845,120.2705903
UN201808210160,"2018-08-21 12:54:29",東區,交通運輸,佔用道路,"東區莊敬路155號，成大學府特區 佔用道路",東區莊敬路155號,22.9958696,120.2327635
UN201808210164,"2018-08-21 13:04:24",仁德區,路燈故障,9盞以下路燈故障,"仁德區上崙里中正路一段774巷8之1號對面 路燈不亮",仁德區上崙里中正路一段774巷8之1號,22.9405126,120.2488908
UN201808210166,"2018-08-21 13:05:36",永康區,道路維修,路面坑洞,"永康區永大路一段336號前  路面坑洞",永康區永大路一段336號前,23.0001478,120.2593992
UN201808210173,"2018-08-21 13:24:53",大內區,道路維修,路面坑洞,"大內區內溝里一鄰57-4號旁  道路坑洞",大內區內溝里一鄰57之4號,22.9681809,120.2292764
UN201808210187,"2018-08-21 14:01:03",北區,民生管線,漏水、停水、消防栓漏水或損壞,"北區開元路442巷49號  民生管線漏水",北區開元路442巷49號,23.009557,120.2277712
UN201808210191,"2018-08-21 14:13:20",東區,道路維修,路面坑洞,"東區自由路二段172號前 坑洞",東區自由路二段172號,22.9997281,120.2270277
UN201808210213,"2018-08-21 15:12:29",麻豆區,道路維修,路面坑洞,"麻豆區麻豆口32之1號  路面坑洞",麻豆區麻豆口32之1號,22.9997281,120.2270277
UN201808210223,"2018-08-21 15:36:12",中西區,違規停車,違規停車,"中西區民權路二段100號 違停",臺南市中西區民權路二段100號,22.994796,120.204014
UN201808210252,"2018-08-21 16:39:48",安南區,交通運輸,交通疏導,"安南區安中路一段和北安路口 交通疏導",安南區安中路一段北安路,22.9997281,120.2270277
UN201808210258,"2018-08-21 16:48:02",南區,違規停車,違規停車,"南區健康路二段141號前 違停",南區健康路二段141號,22.9997281,120.2270277
UN201808210264,"2018-08-21 16:58:03",永康區,噪音舉發,場所連續噪音,"永康區中華路長億城 施工噪音",永康區中華路,23.0146285,120.2299508
UN201808210284,"2018-08-21 17:38:02",安平區,道路維修,路面坑洞,"安平區建平路與建平四街口，建平路上 坑洞",安平區建平路建平四街,22.9862333,120.1818364
UN201808210286,"2018-08-21 17:45:11",北區,違規停車,違規停車,"北區成功路2號前 違規停車",臺南市北區成功路2號,22.997791,120.211428
UN201808210294,"2018-08-21 18:15:40",中西區,違規停車,違規停車,"中西區民族路二段56號、西華南街38號 違規停車",臺南市中西區民族路二段56號,22.994583,120.210594
UN201808210298,"2018-08-21 18:31:19",永康區,道路維修,路面坑洞,"永康區龍中街和龍埔街交叉口，龍中街上 路面坑洞",永康區龍中街,23.0361633,120.2620918
UN201808210311,"2018-08-21 19:19:05",仁德區,髒亂及汙染,空氣汙染,"仁德區中正路過保安路，豐年果糖工廠 空氣污染",仁德區中正路,22.957183,120.2527291
UN201808210312,"2018-08-21 19:19:41",仁德區,路燈故障,9盞以下路燈故障,"仁德區中山路46巷口/仁德區林頂街237號對面 路燈不亮",仁德區中山路46巷,22.9695334,120.2698143
UN201808210313,"2018-08-21 19:19:53",安南區,路燈故障,9盞以下路燈故障,"安南區大眾六街148巷39弄2號 路燈故障",安南區大眾六街148巷39弄2號,22.9710046,120.2879235
UN201808210314,"2018-08-21 19:20:28",南區,路燈故障,9盞以下路燈故障,"南區鯤鯓路66巷，三角公園旁巷口 路燈不亮",南區鯤鯓路66巷,22.959126,120.1856295
UN201808210317,"2018-08-21 19:23:42",北區,路燈故障,10盞以上路燈故障,"東區東光路一段39號，東光國小附近 10盞以上路燈不亮",東區東光路一段39號,22.9915576,120.2307921
UN201808210320,"2018-08-21 19:35:35",善化區,路燈故障,9盞以下路燈故障,"善化區興華路274號 路燈不亮",善化區興華路274號,23.1271535,120.2955694
UN201808210330,"2018-08-21 20:09:47",中西區,路燈故障,9盞以下路燈故障,"中西區湖美街101巷口 路燈不亮",中西區湖美街101巷,23.1271535,120.2955694
UN201808210331,"2018-08-21 20:12:35",仁德區,路燈故障,9盞以下路燈故障,"仁德區長興四街82巷5號 路燈故障",仁德區長興四街82巷5號,22.9726441,120.2477294
UN201808210332,"2018-08-21 20:14:48",仁德區,路燈故障,9盞以下路燈故障,"仁德區義林南路，由德糖路到德崙路之間路段 路燈不亮",仁德區義林南路,22.9997281,120.2270277
UN201808210334,"2018-08-21 20:30:12",安南區,路燈故障,9盞以下路燈故障,"安南區公學路四段397號 路燈故障",安南區公學路四段397號,23.0648418,120.1708837
UN201808210336,"2018-08-21 20:41:20",仁德區,交通運輸,佔用道路,"仁德區林頂街233號 佔用道路",臺南市仁德區林頂街233號,22.972404,120.264467
UN201808210337,"2018-08-21 20:46:52",下營區,路燈故障,9盞以下路燈故障,"下營區仁和三街71巷70號 路燈故障",下營區仁和三街71巷70號,22.968217,120.2504013
UN201808210345,"2018-08-21 21:25:45",中西區,違規停車,違規停車,"中西區民族路二段68號與55-1號 違規停車",臺南市中西區民族路二段68號,22.994629,120.210077
UN201808210348,"2018-08-21 21:27:48",東區,違規停車,違規停車,"東區前鋒路靠近大學路口 違規停車",東區前鋒路,22.9951987,120.213339
UN201808210351,"2018-08-21 21:40:48",北區,違規停車,違規停車,"北區和緯路二段161號 違規停車",和緯路二段161號,22.9997281,120.2270277
UN201808210354,"2018-08-21 22:00:45",中西區,噪音舉發,妨害安寧,"中西區臨安路一段72號 妨害安寧",臨安路一段72號,22.9700561,120.234247
UN201808210355,"2018-08-21 22:15:54",中西區,違規停車,違規停車,"中西區民族路二段92號 違規停車",中西區民族路二段92號,22.9954639,120.2063472
UN201808210356,"2018-08-21 22:22:45",安平區,違規停車,違規停車,"安平區建平十七街31號 違規停車",安平區建平十七街31號,22.9971963,120.1833767
UN201808210359,"2018-08-21 22:45:33",新市區,違規停車,違規停車,"新市區復興路67號 違規停車",復興路67號,23.303158,120.311744
UN201808210360,"2018-08-21 22:49:42",新市區,噪音舉發,場所連續噪音,"新市區華美街與南港街交叉口 場所連續噪音/妨害安寧",新市區華美街,23.075659,120.2985068
UN201808210362,"2018-08-21 23:25:39",北區,交通運輸,號誌故障,"北區臨安路二段與金華路五段口 號誌故障",北區臨安路二段,23.0035392,120.1991802
UN201808210364,"2018-08-21 23:35:59",東區,噪音舉發,妨害安寧,"東區崇善十三街17號 噪音舉發",東區崇善十三街17號,22.9700561,120.234247
UN201808210365,"2018-08-21 23:37:49",永康區,髒亂及汙染,空氣汙染,"永康區三村一街。仁愛街 髒亂及汙染",永康區三村一街。仁愛街,22.9997281,120.2270277
UN201808210366,"2018-08-21 23:40:43",北區,路燈故障,9盞以下路燈故障,"北區西門路三段26巷的立人國小對面/北區成功路280號 路燈故障",北區成功路280號,22.9995785,120.2019777
UN201808220016,"2018-08-22 06:49:23",新營區,違規停車,違規停車,"新營區民治路228號 違規停車",臺南市新營區民治路228號,23.30804,120.304344
UN201808220028,"2018-08-22 08:19:56",東區,交通運輸,佔用道路,"東區大學路西段89號  佔用道路",臺南市東區大學路西段89號,23.001702,120.214197
UN201808220036,"2018-08-22 08:49:27",仁德區,民生管線,漏水、停水、消防栓漏水或損壞,"仁德區德崙路48巷13號  水管漏水",仁德區德崙路48巷13號,22.946265,120.2520629
UN201808220037,"2018-08-22 08:52:25",歸仁區,髒亂及汙染,其他汙染舉發,"歸仁區忠孝北路35號與37號對面 垃圾",歸仁區忠孝北路35號37號,22.9664129,120.3021954
UN201808220040,"2018-08-22 08:55:32",北區,噪音舉發,妨害安寧,"北區民德國中 噪音舉發",北區民德國中,23.0054258,120.2053713
UN201808220050,"2018-08-22 09:23:01",中西區,違規停車,違規停車,"中西區民族路二段55-63號 違規停車",臺南市中西區民族路二段55號,22.994309,120.210166
UN201808220052,"2018-08-22 09:25:13",中西區,違規停車,違規停車,"中西區忠義路二段73號 違停",臺南市中西區忠義路二段73號,22.99241,120.202751
UN201808220056,"2018-08-22 09:26:48",中西區,路燈故障,9盞以下路燈故障,"中西區華平路980號  路燈故障",中西區華平路980號,23.0013632,120.1757137
UN201808220058,"2018-08-22 09:30:51",仁德區,髒亂及汙染,空氣汙染,"仁德區保安路二段與中正路一段   空氣汙染",仁德區保安路二段中正路一段,22.9379002,120.2479562
UN201808220120,"2018-08-22 11:36:02",中西區,違規停車,違規停車,"中西區開山路52號90號   違規停車",臺南市中西區開山路52號,22.991184,120.205957
UN201808220121,"2018-08-22 11:37:53",中西區,騎樓舉發,騎樓舉發,"中西區衛民街88號   騎樓舉發",臺南市中西區衛民街88號,22.993053,120.209707
UN201808220137,"2018-08-22 13:14:51",安平區,道路維修,路面坑洞,"安平區建平路健康三街 路面坑洞",安平區建平路健康三街,22.9900978,120.1684936
UN201808220138,"2018-08-22 13:16:42",中西區,噪音舉發,場所連續噪音,"中西區忠義路一段96旁  連續噪音",中西區忠義路一段96旁,22.9878472,120.2020776
UN201808220144,"2018-08-22 13:33:45",歸仁區,髒亂及汙染,空氣汙染,"歸仁區保吉路73巷41號，眼鏡框噴漆工廠 空污",歸仁區保吉路73巷41號,23.0053204,120.2763022
UN201808220152,"2018-08-22 14:02:17",麻豆區,路燈故障,9盞以下路燈故障,"麻豆區新生南路跟中興街口  路燈故障",麻豆區新生南路中興街,23.1810525,120.2412825
UN201808220155,"2018-08-22 14:19:34",中西區,違規停車,違規停車,"中西區永華路一段36號38號40號  違規停車",臺南市中西區永華路一段36號,22.98755,120.196225
UN201808220156,"2018-08-22 14:21:01",永康區,交通運輸,號誌故障,"永康區尚頂路59巷26號   號誌故障",永康區尚頂路59巷26號,23.0264292,120.2312307
