UN201808250402,"2018-08-25 17:33:15",安平區,天然災害,路樹問題,"安平區安平路承天橋下 路樹倒塌",安平區安平路承天橋下,22.9997281,120.2270277
UN201808250412,"2018-08-25 17:47:11",東區,違規停車,違規停車,"東區育樂街166-3號 違規停車",東區育樂街166-3號,22.9997281,120.2270277
UN201808250413,"2018-08-25 17:50:44",仁德區,噪音舉發,妨害安寧,"仁德區太子一街246號對面黃色鴿舍  妨害安寧",仁德區太子一街246號對面黃色鴿舍,22.9889121,120.2643169
UN201808250414,"2018-08-25 17:51:46",東區,違規停車,違規停車,"東區育樂街166號  違規停車",東區育樂街166號,22.9950806,120.21461
UN201808250416,"2018-08-25 17:56:48",北門區,天然災害,路燈故障毀損,"北門區中樞里8號 路燈故障",北門區中樞里8號,23.248044,120.142009
UN201808250417,"2018-08-25 17:58:04",仁德區,道路維修,路面坑洞,"仁德區中正路一段618號 路面坑洞",仁德區中正路一段618號,22.9997281,120.2270277
UN201808250419,"2018-08-25 18:01:50",安平區,違規停車,違規停車,"安平區育平九街國平路停車場 違規停車",安平區育平九街國平路,22.9997281,120.2270277
UN201808250420,"2018-08-25 18:02:27",中西區,違規停車,違規停車,"中西區中華西路二段582號 違規停車",中西區中華西路二段582號,23.0065798,120.1862283
UN201808250424,"2018-08-25 18:20:35",麻豆區,道路維修,人孔蓋凹陷坑洞,"麻豆交流道 坑洞",麻豆交流道,23.184677,120.241621
UN201808250427,"2018-08-25 18:24:19",歸仁區,違規停車,違規停車,"歸仁區長榮路中正南路 違規停車",歸仁區長榮路中正南路,22.9101947,120.2726327
UN201808250430,"2018-08-25 18:29:39",南區,路燈故障,10盞以上路燈故障,"南區西門路永華路 路燈故障",南區西門路永華路,22.9873866,120.1973187
UN201808250432,"2018-08-25 18:37:31",南區,民生管線,漏水、停水、消防栓漏水或損壞,"南區金華路一段484巷75號  漏水",南區金華路一段484巷75號,22.9721389,120.1925872
UN201808250434,"2018-08-25 18:40:16",中西區,違規停車,違規停車,"中西區民族路二段59、95號 違規停車",中西區民族路二段59號,22.994358,120.2099209
UN201808250435,"2018-08-25 18:45:13",北區,髒亂及汙染,空氣汙染,"北區長榮路五段長勝路長榮新城 空氣汙染",北區長榮路五段長勝路,23.0129233,120.2167907
UN201808250436,"2018-08-25 18:46:32",東區,動物救援,犬貓急難救援,"東區林森路二段12號 動物救援",東區林森路二段12號,22.9858452,120.2227712
UN201808250438,"2018-08-25 18:46:43",東區,路燈故障,9盞以下路燈故障,"東區裕農路661巷與建東街43巷口 路燈不亮",東區裕農路661巷建東街43巷,22.9902835,120.2363439
UN201808250439,"2018-08-25 18:52:49",佳里區,違規停車,違規停車,"佳里區長安街和平街 違規停車",佳里區長安街和平街,23.1621394,120.1739849
UN201808250440,"2018-08-25 18:52:57",北區,路燈故障,9盞以下路燈故障,"北區長榮路五段383巷內 路燈故障不亮",北區長榮路五段383巷,23.0127503,120.214951
UN201808250441,"2018-08-25 18:54:01",安平區,路燈故障,9盞以下路燈故障,"安平區漁光路83號附近 路燈不亮",安平區漁光路83號,22.9755491,120.1618198
UN201808250442,"2018-08-25 18:55:24",安南區,路燈故障,9盞以下路燈故障,"安南區安興街43巷 路燈故障",安南區安興街43巷,23.0693237,120.1638315
UN201808250450,"2018-08-25 19:09:26",東區,路燈故障,9盞以下路燈故障,"東區裕農路70號 路燈故障",東區裕農路70號,23.0127503,120.214951
UN201808250451,"2018-08-25 19:10:44",中西區,違規停車,違規停車,"中西區臨安路一段72號 違規停車",中西區臨安路一段72號,22.9990981,120.1907774
UN201808250455,"2018-08-25 19:15:42",中西區,路燈故障,9盞以下路燈故障,"中西區海安路一段，介於友愛街與中正路口 路燈不亮",中西區海安路一段,22.9997281,120.2270277
UN201808250456,"2018-08-25 19:16:24",柳營區,路燈故障,9盞以下路燈故障,"柳營區中山西路三段432號對面那盞 路燈故障",柳營區中山西路三段432號,22.9997281,120.2270277
UN201808250458,"2018-08-25 19:19:10",學甲區,路燈故障,9盞以下路燈故障,"學甲區中山東路農會倉庫後方 路燈故障",學甲區中山東路農會倉庫後方,22.9997281,120.2270277
UN201808250459,"2018-08-25 19:20:33",學甲區,路燈故障,9盞以下路燈故障,"學甲區新達里中山路6之1號後方 路燈不亮",學甲區新達里中山路6之1號,23.235405,120.176885
UN201808250460,"2018-08-25 19:21:28",中西區,天然災害,路燈故障毀損,"中西區西賢一街63號 路燈故障",中西區西賢一街63號,23.0007627,120.1774647
UN201808250461,"2018-08-25 19:24:17",北區,違規停車,違規停車,"北區大興街300巷口 違停",北區大興街300巷,23.0109202,120.1855036
UN201808250462,"2018-08-25 19:27:48",南區,路燈故障,9盞以下路燈故障,"南區明興路352號 路燈不亮",南區明興路352號,22.9497722,120.1841301
UN201808250463,"2018-08-25 19:29:51",北區,路燈故障,9盞以下路燈故障,"北區文賢路572巷 路燈故障",北區文賢路572巷,23.0081498,120.1945758
UN201808250464,"2018-08-25 19:33:44",安南區,道路維修,路面坑洞,"安南區怡安路二段113號對面/ 安南區北安路三段181巷66號對面 /安南區北安路三段145巷39弄 路面坑洞","安南區怡安路二段113號對面/ 安南區北安路三段181巷66號對面 /安南區北安路三段145巷39弄",22.9997281,120.2270277
UN201808250465,"2018-08-25 19:34:32",安南區,路燈故障,9盞以下路燈故障,"安中路一段560巷36弄2號附近 路燈故障",安中路一段560巷36弄2號,23.0412763,120.2005917
UN201808250467,"2018-08-25 19:41:11",北區,路燈故障,9盞以下路燈故障,"北區育德二路51巷58號 路燈故障",北區育德二路51巷58號,23.0078329,120.2013395
UN201808250468,"2018-08-25 19:42:07",麻豆區,路燈故障,10盞以上路燈故障,"麻豆區安業里安業112號後方 10盞以上路燈不亮",麻豆區安業里安業112號,23.1593308,120.2463372
UN201808250469,"2018-08-25 19:42:28",中西區,道路維修,路面坑洞,"中西區金華路三段139號  路面坑洞",中西區金華路三段139號,22.991899,120.1927227
UN201808250470,"2018-08-25 19:46:48",北區,天然災害,自來水問題,"北區長榮路五段816號到848號 漏水",北區長榮路五段816號,23.013521,120.2124437
UN201808250471,"2018-08-25 19:48:20",東區,路燈故障,9盞以下路燈故障,"東區裕信六街裕華三街 路燈故障",東區裕信六街裕華三街,23.0109202,120.1855036
UN201808250472,"2018-08-25 19:49:37",北區,路燈故障,9盞以下路燈故障,"中西區湖美街32巷 路燈故障",中西區湖美街32巷,23.0004395,120.1804526
UN201808250476,"2018-08-25 19:56:29",東區,路燈故障,9盞以下路燈故障,"東區東安路134巷內 路燈故障",東區東安路134巷,22.9939678,120.2275663
UN201808250477,"2018-08-25 19:58:32",中西區,違規停車,違規停車,"中西區健康路一段188號 違規停車",中西區健康路一段188號,22.9814058,120.2062781
UN201808250478,"2018-08-25 19:59:33",中西區,道路維修,路樹傾倒,"中西區環河街與河中街37巷口，近運河這一側 樹倒",中西區環河街河中街37巷,22.9955173,120.1926354
UN201808250481,"2018-08-25 20:04:43",北區,騎樓舉發,騎樓舉發,"北區海安路三段26號 騎樓舉發",北區海安路三段26號,22.9997281,120.2270277
UN201808250482,"2018-08-25 20:06:16",永康區,道路維修,路面坑洞,"永康區尚頂路167號附近 坑洞",永康區尚頂路167號,23.0794703,120.2934883
UN201808250485,"2018-08-25 20:14:43",中西區,違規停車,違規停車,"中西區民族路二段76號 違規停車",中西區民族路二段76號,22.9947876,120.2089152
UN201808250486,"2018-08-25 20:18:04",永康區,路燈故障,9盞以下路燈故障,永康區鹽田路329巷6弄,永康區鹽田路329巷6弄,23.0316366,120.1413297
UN201808250494,"2018-08-25 20:37:45",東區,天然災害,路燈故障毀損,"東區中華東路二段22巷14弄2號  路燈故障",東區中華東路二段22巷14弄2號,23.0216762,120.2335044
UN201808250495,"2018-08-25 20:38:18",永康區,道路維修,路面坑洞,"永康區中正北路735號附近，南下方向 坑洞",永康區中正北路735號,23.0467303,120.2623466
UN201808250497,"2018-08-25 20:42:26",安南區,路燈故障,10盞以上路燈故障,"台17線國姓橋北上到七股 路燈故障",台17線國姓橋,23.081767,120.1355656
UN201808250499,"2018-08-25 20:48:13",北區,路燈故障,9盞以下路燈故障,"北區公園路128號後方 路燈故障",北區公園路128號後方,22.9997281,120.2270277
UN201808250505,"2018-08-25 21:05:33",南區,天然災害,路燈故障毀損,"南區新興路533巷15弄 路燈故障",南區新興路533巷15弄,22.9741281,120.1874499
UN201808250506,"2018-08-25 21:06:49",北區,路燈故障,9盞以下路燈故障,"北區國華街四段9巷6號旁 路燈不亮",北區國華街四段9巷6號,23.0007614,120.1999002
UN201808250507,"2018-08-25 21:07:14",安平區,天然災害,路燈故障毀損,"安平區安平路426巷18號 路燈故障",安平區安平路426巷18號,22.9988016,120.1743186
UN201808250508,"2018-08-25 21:09:14",東區,違規停車,違規停車,東區前鋒路靠近大學路口違規停車,東區前鋒路大學路,22.9997281,120.2270277
UN201808250509,"2018-08-25 21:09:32",東區,噪音舉發,妨害安寧,"東區林森路二段91巷22號 妨害安寧",東區林森路二段91巷22號,22.9900157,120.223233
UN201808250511,"2018-08-25 21:15:13",新化區,道路維修,路面坑洞,"新化區全興里竹仔腳249之8號 坑洞",新化區全興里竹仔腳249之8號,23.0196557,120.2991646
UN201808250512,"2018-08-25 21:20:26",東區,路燈故障,9盞以下路燈故障,"東區大同路一段175巷110號附近 路燈不亮",東區大同路一段175巷110號,22.9997281,120.2270277
UN201808250515,"2018-08-25 21:25:14",安平區,違規停車,違規停車,"安平區建平十七街33號 違規停車",安平區建平十七街33號,22.9973212,120.1831576
UN201808250516,"2018-08-25 21:26:03",東區,路燈故障,9盞以下路燈故障,"東區東安路134巷 路燈不亮",東區東安路134巷,22.9939678,120.2275663
UN201808250519,"2018-08-25 21:33:52",東區,民生管線,漏水、停水、消防栓漏水或損壞,"東區大同二段61巷123號, 噴水","東區大同二段61巷123號,",22.9809829,120.2142487
UN201808250520,"2018-08-25 21:36:01",永康區,噪音舉發,妨礙安寧,永康區富強路二段189巷163號噪音舉發,永康區富強路二段189巷163號,23.0249162,120.2745232
UN201808250521,"2018-08-25 21:39:46",南區,動物救援,犬貓急難救援,"南區明興路1087巷7弄8號後方 貓受困",南區明興路1087巷7弄8號,22.9292852,120.1858919
UN201808250523,"2018-08-25 21:45:53",東區,違規停車,違規停車,台南市東區東寧路201巷30-6號違規停車,台南市東區東寧路201巷30-6號,22.9920044,120.2259325
UN201808250524,"2018-08-25 21:49:50",永康區,交通運輸,佔用道路,"永康區東橋一路89號旁 佔用道路",永康區東橋一路89號,23.017441,120.2345227
UN201808250526,"2018-08-25 21:58:41",安南區,民生管線,停電、漏電、電線掉落、孔蓋鬆動,"安南區海佃路二段150巷66弄22號 停電",安南區海佃路二段150巷66弄22號,23.0334523,120.1917648
UN201808250527,"2018-08-25 22:02:08",安平區,違規停車,違規停車,"安平區建平十七街31號 違規停車",安平區建平十七街31號,22.9971963,120.1833767
UN201808250530,"2018-08-25 22:06:13",安南區,路燈故障,9盞以下路燈故障,"安南區安中路一段560巷12弄2號 路燈故障",安南區安中路一段560巷12弄2號,23.0408923,120.2003869
UN201808250531,"2018-08-25 22:10:14",安南區,噪音舉發,妨害安寧,"安南區北安路二段526號，一品來小吃部 妨害安寧",臺南市安南區北安路二段526號,23.036526,120.203251
UN201808250532,"2018-08-25 22:11:18",中西區,違規停車,違規停車,"中西區西華南街2到10、43號 違規停車",中西區西華南街43號,22.9933738,120.2094374
UN201808250534,"2018-08-25 22:16:59",新市區,違規停車,違規停車,"新市區復興路67號，包手幸福豆漿和7-11門口轉角 違規停車",新市區復興路67號,23.017441,120.2345227
UN201808250536,"2018-08-25 22:20:07",北區,路燈故障,9盞以下路燈故障,"北區公園路593巷62號 路燈故障",北區公園路593巷62號,23.0138895,120.2102435
UN201808250538,"2018-08-25 22:27:41",安平區,路燈故障,10盞以上路燈故障,"安平區世平四街 路燈故障",安平區世平四街,22.9997281,120.2270277
UN201808250542,"2018-08-25 22:49:51",北區,民生管線,漏水、停水、消防栓漏水或損壞,北區開南街與東豐路451巷交界的T字路口路中央民生管線,北區開南街東豐路451巷,23.0039096,120.2284188
UN201808250545,"2018-08-25 23:04:02",南區,噪音舉發,妨礙安寧,"南區金華路一段280號 妨害安寧",南區金華路一段280號,22.9682331,120.1903968
UN201808250546,"2018-08-25 23:07:50",仁德區,髒亂及汙染,道路散落物,"仁德區中正路二段台灣銀行前 貓屍",仁德區中正路二段台灣銀行前,22.9653019,120.253241
UN201808250547,"2018-08-25 23:13:06",東區,噪音舉發,妨害安寧,"東區文東街72號 妨害安寧",東區文東街72號,22.9997281,120.2270277
UN201808250548,"2018-08-25 23:17:00",安南區,天然災害,路樹問題,"安南區安明路 路樹傾斜",安南區安明路,22.9997281,120.2270277
UN201808250550,"2018-08-25 23:29:27",中西區,噪音舉發,妨害安寧,"中西區臨安路一段72號，非法民宿 妨害安寧",中西區臨安路一段72號,22.9990981,120.1907774
UN201808250551,"2018-08-25 23:32:08",歸仁區,交通運輸,佔用道路,"歸仁區忠孝南路25巷31號 佔用道路",歸仁區忠孝南路25巷31號,22.9646469,120.3035419
UN201808250552,"2018-08-25 23:40:11",新市區,路燈故障,10盞以上路燈故障,"新市區新市火車站到中華路遠東工專之間路段 路燈不亮",臺南市新市區中華路49號,23.064823,120.294736
UN201808250556,"2018-08-25 23:53:43",白河區,騎樓舉發,騎樓舉發,"白河區白河市場，中山路和中正路口 騎樓舉發",白河區白河市場,22.9653019,120.253241
UN201808260013,"2018-08-26 00:56:30",東區,噪音舉發,妨害安寧,"東區小東路240號，必熊燒烤店 妨害安寧",臺南市東區小東路240號,22.99944,120.228636
UN201808260026,"2018-08-26 02:00:34",南區,噪音舉發,妨害安寧,"南區中華南路二段233巷14號 妨害安寧",臺南市南區中華南路二段233巷14號,22.960323,120.189559
UN201808260058,"2018-08-26 08:48:12",中西區,違規停車,違規停車,"中西區西湖街220號  違規停車",臺南市中西區西湖街220號,23.003695,120.182625
UN201808260081,"2018-08-26 09:42:17",北區,噪音舉發,場所連續噪音,"北區武聖路138號  噪音舉發",臺南市北區武聖路138號,23.006549,120.190285
