UN201808280293,"2018-08-28 13:17:38",中西區,違規停車,違規停車,"中西區中正路7號到19號 違規停車",臺南市中西區中正路7號,22.992013,120.203553
UN201808280296,"2018-08-28 13:21:58",歸仁區,道路維修,路面掏空、塌陷,"歸仁區崙頂一街5號前，水溝旁 路面崩塌",歸仁區崙頂一街5號,22.9596458,120.2969526
UN201808280298,"2018-08-28 13:28:56",永康區,違規停車,違規停車,"永康區六合路42巷50號。巷口 違規停車",臺南市永康區六合路42巷50號,23.009208,120.232462
UN201808280308,"2018-08-28 13:51:18",中西區,動物救援,犬貓急難救援,"中西區府前路二段191號 ,貓受困待救援",中西區府前路二段191號,22.9997281,120.2270277
UN201808280316,"2018-08-28 14:02:18",東區,民生管線,漏水、停水、消防栓漏水或損壞,"東區大同路二段61巷107號   漏水",東區大同路二段61巷107號,22.9806698,120.2140425
UN201808280323,"2018-08-28 14:15:41",安平區,天然災害,路樹問題,"安平區永華路二段869號 路樹倒塌",安平區永華路二段869號,22.92482,120.294939
UN201808280332,"2018-08-28 14:28:13",中西區,違規停車,違規停車,中西區中正路42號及周邊違規停車,臺南市中西區中正路42號,22.992128,120.202216
UN201808280333,"2018-08-28 14:28:54",永康區,道路維修,路面坑洞,"永康區龍橋街接龍潭街 （靠近龍潭國小舊大門附近）道路維修",永康區龍橋街接龍潭街,23.0359782,120.2655316
UN201808280342,"2018-08-28 14:42:47",新營區,動物救援,犬貓急難救援,"新營區開元路124號前   貓咪受困",新營區開元路124號前,23.3111501,120.325405
UN201808280347,"2018-08-28 14:50:59",中西區,路燈故障,9盞以下路燈故障,"中西區永福路一段108巷   路燈故障不亮",中西區永福路一段108巷,22.9997281,120.2270277
UN201808280351,"2018-08-28 15:08:30",北區,道路維修,路面坑洞,"北區西門路和成功路口，交叉口正中央、中西區中華西路和民生路口，中華西路二段內車道上 路面坑洞",北區西門路成功路,22.9997201,120.2012466
UN201808280356,"2018-08-28 15:14:43",北區,交通運輸,號誌秒差調整,"北區公園北路144巷口 號誌不連貫",北區公園北路144巷,23.0051136,120.2086317
UN201808280375,"2018-08-28 15:52:06",中西區,違規停車,違規停車,"中西區衛民街154號旁、158、147號 違規停車",臺南市中西區衛民街154號,22.993561,120.207195
UN201808280377,"2018-08-28 15:57:16",中西區,違規停車,違規停車,"中西區中正路7號到21號、中正路8號到土地銀行 違規停車",臺南市中西區中正路7號,22.992013,120.203553
UN201808280387,"2018-08-28 16:11:47",安平區,噪音舉發,妨害安寧,"安平區建平五街184巷8號2樓之二 妨害安寧",臺南市安平區建平五街184巷8號,22.988222,120.176702
UN201808280397,"2018-08-28 16:23:40",仁德區,民生管線,電信孔蓋鬆動、電信線路掉落、電信桿傾倒,"仁德區德洋二街10號與31巷1號   孔蓋鬆動",仁德區德洋二街10號31巷1號,22.9997281,120.2270277
UN201808280401,"2018-08-28 16:36:54",東區,道路維修,路面坑洞,"東區中華東路二段156號 坑洞",東區中華東路二段156號,22.9838889,120.2316076
UN201808280412,"2018-08-28 16:58:31",永康區,道路維修,路面坑洞,"永康區尚頂路167號 路面坑洞",永康區尚頂路167號,23.0299658,120.2274261
UN201808280415,"2018-08-28 17:04:04",永康區,道路維修,路面坑洞,"永康區大灣東路218巷巷口   道路坑洞",永康區大灣東路218巷巷口,22.998168,120.2667297
UN201808280418,"2018-08-28 17:11:31",仁德區,道路維修,,"仁德區文華路三段69號 路面坑洞",仁德區文華路三段69號,22.9606344,120.2406116
UN201808280419,"2018-08-28 17:16:31",善化區,民生管線,停電、漏電、電線掉落、孔蓋鬆動,"善化區田寮里157之2號 電線掉落",善化區田寮里157之2號,22.9946351,120.2107863
UN201808280420,"2018-08-28 17:19:07",安平區,路燈故障,9盞以下路燈故障,"安平區國平路318號  路燈故障",安平區國平路318號,22.9920955,120.1713126
UN201808280422,"2018-08-28 17:21:22",中西區,違規停車,違規停車,"中西區西華南街32號 違規停車",臺南市中西區西華南街32號,22.993828,120.209542
UN201808280429,"2018-08-28 17:34:11",仁德區,動物救援,犬貓急難救援,"仁德區長興一街22巷38號前 犬救援",仁德區長興一街22巷38號,22.9942445,120.2665693
UN201808280430,"2018-08-28 17:42:14",南區,違規停車,違規停車,"南區金華路上*健康路 違規停車",南區金華路*健康路,22.981529,120.1914933
UN201808280432,"2018-08-28 17:48:34",安平區,道路維修,,"安平區健康路三段跟建平路(新樂橋)  路面坑洞",安平區健康路三段建平路,22.9843238,120.1699748
UN201808280433,"2018-08-28 17:52:05",中西區,違規停車,違規停車,"中西區西華南街32號 違規停車",臺南市中西區西華南街32號,22.993828,120.209542
UN201808280435,"2018-08-28 17:55:05",中西區,違規停車,違規停車,"中西區健康路一段352號左邊 違規停車",臺南市中西區健康路一段352號,22.981565,120.199787
UN201808280436,"2018-08-28 17:55:37",中西區,違規停車,違規停車,"中西區民族路二段42、46、66、47、95號 違規停車",臺南市中西區民族路二段42號,22.994585,120.210894
UN201808280438,"2018-08-28 17:58:56",中西區,道路維修,路面坑洞,"中西區火車站前圓環，中山路到成功路 路面坑洞",中西區火車站前圓環，中山路到成功路,22.9972343,120.211936
UN201808280447,"2018-08-28 18:11:47",安平區,髒亂及汙染,空氣汙染,"安平區育平路與健康路三段口，空地 空污",安平區育平路健康路三段,22.9997281,120.2270277
UN201808280449,"2018-08-28 18:15:13",關廟區,違規停車,違規停車,"關廟區南雄路一段1001號 違規停車",臺南市關廟區南雄路一段1001號,22.956055,120.328656
UN201808280450,"2018-08-28 18:15:41",中西區,道路維修,路面坑洞,"中華西路二段宜得利家居前，機車道和汽車道中間 路面坑洞",中西區中華西路二段685號,23.002427,120.1866771
UN201808280456,"2018-08-28 18:29:44",中西區,騎樓舉發,騎樓舉發,中西區西華南街32號騎樓舉發,臺南市中西區西華南街32號,22.993828,120.209542
UN201808280457,"2018-08-28 18:30:16",北區,路燈故障,10盞以上路燈故障,"北區中華北路一段460號和大和路交叉口 路燈不亮",北區中華北路一段460號大和路,23.015531,120.188871
UN201808280463,"2018-08-28 18:45:45",南區,路燈故障,9盞以下路燈故障,"南區萬年三街256號旁 路燈不亮",南區萬年三街256號,22.932293,120.1866948
UN201808280465,"2018-08-28 18:46:04",東區,路燈故障,9盞以下路燈故障,"東區東安路134巷及東寧路201巷 路燈故障",東區東安路134巷、東寧路201巷,22.9945065,120.2264993
UN201808280466,"2018-08-28 18:47:53",中西區,路燈故障,9盞以下路燈故障,"中西府前一街9巷12弄 路燈不亮",中西府前一街9巷12弄,22.9938425,120.1878616
UN201808280467,"2018-08-28 18:55:31",北區,路燈故障,9盞以下路燈故障,"北區育德三街221巷12號旁 路燈不亮",北區育德三街221巷12號,23.0165659,120.2009143
UN201808280468,"2018-08-28 19:00:06",安南區,路燈故障,9盞以下路燈故障,"安南區智安二街53巷5號前 路燈不亮",安南區智安二街53巷5號,23.0513926,120.1774506
UN201808280469,"2018-08-28 19:07:37",安南區,路燈故障,9盞以下路燈故障,"安南區智安二街53巷和50巷內 路燈不亮",安南區智安二街53巷,23.0514512,120.1775209
UN201808280470,"2018-08-28 19:19:23",永康區,路燈故障,9盞以下路燈故障,"永康區東橋三路113號附近 路燈不亮",永康區東橋三路113號,23.0196834,120.2347566
UN201808280475,"2018-08-28 19:28:51",安平區,路燈故障,9盞以下路燈故障,"安平區世平一街100號附近 路燈不亮",安平區世平一街100號,22.9929962,120.1478436
UN201808280478,"2018-08-28 19:37:01",北區,違規停車,違規停車,北區臨安路二段193號及197號違規停車,臺南市北區臨安路二段193號,23.003755,120.199072
UN201808280479,"2018-08-28 19:42:15",中西區,路燈故障,9盞以下路燈故障,"中西區大福街24巷8號前 路燈閃爍",中西區大福街24巷8號,23.0514512,120.1775209
UN201808280480,"2018-08-28 19:47:02",北區,路燈故障,9盞以下路燈故障,"北區立賢路一段682巷12弄 路燈故障",北區立賢路一段682巷12弄,23.0102988,120.2022828
UN201808280481,"2018-08-28 19:48:10",安平區,路燈故障,9盞以下路燈故障,"安平區建平十二街24巷內 路燈不亮",安平區建平十二街24巷,22.9997281,120.2270277
UN201808280482,"2018-08-28 19:48:45",善化區,道路維修,路面坑洞,"善化區文昌路107巷，近題陞企業，往南科方向 坑洞",善化區文昌路107巷,23.1188896,120.2881488
UN201808280483,"2018-08-28 20:01:41",永康區,動物救援,犬貓急難救援,"永康區永華路和永興路口 犬救援",永康區永華路永興路,23.0192544,120.2574297
UN201808280489,"2018-08-28 20:26:10",安南區,路燈故障,9盞以下路燈故障,"安南區安中路一段560巷25弄2號 路燈不亮",安南區安中路一段560巷25弄2號,23.0415885,120.2000174
UN201808280490,"2018-08-28 20:26:42",中西區,騎樓舉發,騎樓舉發,中西區西華南街32號騎樓舉發,臺南市中西區西華南街32號,22.993828,120.209542
UN201808280491,"2018-08-28 20:26:55",安平區,路燈故障,9盞以下路燈故障,"安平區漁光橋 路燈不亮",安平區漁光橋,22.9997281,120.2270277
UN201808280496,"2018-08-28 20:40:04",中西區,噪音舉發,場所連續噪音,"中西區臨安路一段72號 噪音舉發",臺南市中西區臨安路一段72號,22.99906,120.190805
UN201808280499,"2018-08-28 20:55:28",關廟區,路燈故障,9盞以下路燈故障,"關廟區大仁街130巷20號 路燈不亮",關廟區大仁街130巷20號,22.9543619,120.3269759
UN201808280506,"2018-08-28 21:19:17",南區,道路維修,路面坑洞,"南區新興路251號 坑洞",南區新興路251號,22.9765387,120.1930124
UN201808280515,"2018-08-28 21:41:18",南區,道路維修,路面坑洞,"南區金華路一段258號 路面坑洞",南區金華路一段258號,22.967746,120.190493
UN201808280517,"2018-08-28 21:43:38",中西區,騎樓舉發,騎樓舉發,"中西區西華南街32號騎樓 騎樓舉發",臺南市中西區西華南街32號,22.993828,120.209542
UN201808280518,"2018-08-28 21:47:23",永康區,違規停車,違規停車,"永康區六合路42巷1號。巷口 違規停車",臺南市永康區六合路42巷1號,23.00944,120.231408
UN201808280520,"2018-08-28 21:56:14",永康區,道路維修,路面坑洞,"永康區復國一路1號 坑洞",永康區復國一路1號,23.002256,120.245959
UN201808280521,"2018-08-28 21:56:20",中西區,騎樓舉發,騎樓舉發,"中西區西華南街32號 騎樓舉發",臺南市中西區西華南街32號,22.993828,120.209542
UN201808280524,"2018-08-28 22:22:40",白河區,路燈故障,9盞以下路燈故障,"白河區裕農路201號附近 路燈不亮",白河區裕農路201號,22.9997281,120.2270277
UN201808280526,"2018-08-28 22:41:10",安南區,道路維修,路面掏空、塌陷,"安南區安和路一段355號前 道路維修",安南區安和路一段355號前,23.0339051,120.212541
UN201808280529,"2018-08-28 23:08:00",安南區,道路維修,路面坑洞,"安南區郡安路五段213號 坑洞",安南區郡安路五段213號,22.9997281,120.2270277
UN201808280532,"2018-08-28 23:42:01",北區,道路維修,路面坑洞,"北區長榮路五段305號 坑洞",北區長榮路五段305號,23.0127472,120.216667
UN201808280533,"2018-08-28 23:47:18",北區,道路維修,路面坑洞,"北區北園街87巷151弄9號 路面坑洞",北區北園街87巷151弄9號,22.9997281,120.2270277
UN201808280534,"2018-08-28 23:48:21",中西區,噪音舉發,妨害安寧,"中西區臨安路一段72號 妨害安寧",臨安路一段72號,22.9997281,120.2270277
UN201808280536,"2018-08-28 23:54:42",中西區,噪音舉發,妨害安寧,"中西區臨安路一段72號 妨害安寧",臨安路一段72號,22.9997281,120.2270277
UN201808280537,"2018-08-28 23:55:08",中西區,噪音舉發,妨害安寧,"中西區臨安路一段72號 妨害安寧",臨安路一段72號,22.9997281,120.2270277
UN201808280538,"2018-08-28 23:59:55",新市區,違規停車,違規停車,"新市區復興路67號 違規停車",復興路67號,23.0816192,120.2953317
UN201808290001,"2018-08-29 00:08:06",中西區,噪音舉發,妨害安寧,"中西區臨安路一段72號 妨害安寧",臨安路一段72號,22.9997281,120.2270277
UN201808290003,"2018-08-29 00:22:12",中西區,噪音舉發,妨害安寧,"中西區臨安路一段72號 妨害安寧",臨安路一段72號,22.9997281,120.2270277
UN201808290005,"2018-08-29 00:31:04",中西區,噪音舉發,妨害安寧,"中西區臨安路一段72號 妨害安寧",臨安路一段72號,22.9997281,120.2270277
UN201808290016,"2018-08-29 06:31:50",永康區,道路維修,路面坑洞,"永康區復興路408號 路面坑洞",臺南市永康區復興路408號,22.998689,120.240193
UN201808290035,"2018-08-29 08:10:08",安平區,違規停車,違規停車,"安平區安平路246號   違規停車",臺南市安平區安平路246號,22.998564,120.179287
UN201808290042,"2018-08-29 08:27:42",北區,道路維修,路面坑洞,"北區西門路四段330巷12號到14號   路面坑洞",臺南市北區西門路四段330巷12號,23.013414,120.20998
UN201808290078,"2018-08-29 09:43:02",東區,違規停車,違規停車,"東區林森路一段395號 違規停車",臺南市東區林森路一段395號,22.985519,120.221626
UN201808290088,"2018-08-29 10:06:12",東區,道路維修,路面坑洞,"東區勝利路100號  道路維修",臺南市東區勝利路100號,22.994473,120.218139
UN201808290100,"2018-08-29 10:39:22",永康區,違規停車,違規停車,"永康區中華路58巷52號  違規停車",臺南市永康區中華路58巷52號,23.001829,120.237398
UN201808290105,"2018-08-29 10:47:48",北區,違規停車,違規停車,"北區公園路856號  違規停車",臺南市北區公園路856號,23.013763,120.212463
UN201808290132,"2018-08-29 11:46:24",北區,違規停車,違規停車,"北區公園南路206號 違規停車",臺南市北區公園南路206號,23.001917,120.205963
UN201808290145,"2018-08-29 12:14:19",中西區,違規停車,違規停車,"中西區民族路二段149號 違規停車",臺南市中西區民族路二段149號,22.995059,120.20721
UN201808290148,"2018-08-29 12:23:42",永康區,道路維修,路面坑洞,"永康區王行路1132號  路面坑洞",臺南市永康區王行路1132號,23.052373,120.273926
UN201808290164,"2018-08-29 13:12:18",永康區,髒亂及汙染,小廣告、旗幟,"永康區仁愛街108巷23號 髒亂及汙染",臺南市永康區仁愛街108巷23號,23.044727,120.240791
UN201808290166,"2018-08-29 13:18:56",仁德區,民生管線,停電、漏電、電線掉落、孔蓋鬆動,"仁德區德崙路418號、420號 停電",臺南市仁德區德崙路418號,22.942244,120.260292
UN201808290183,"2018-08-29 14:02:41",安南區,道路維修,路面掏空、塌陷,"安南區安中路三段381號 路面塌陷",臺南市安南區安中路三段381號,23.049024,120.174806
UN201808290186,"2018-08-29 14:10:22",南區,髒亂及汙染,空氣汙染,"南區新都路256巷1號跟293號  空氣汙染",臺南市南區新都路256巷1號,22.969053,120.198465
UN201808290190,"2018-08-29 14:17:22",永康區,違規停車,違規停車,"永康區中華路58巷52號   違規停車",臺南市永康區中華路58巷52號,23.001829,120.237398
UN201808290260,"2018-08-29 16:55:56",北區,道路維修,路面坑洞,"北區中華北路一段143號  路面坑洞",臺南市北區中華北路一段143號,23.009802,120.185153
UN201808290273,"2018-08-29 17:28:26",中西區,違規停車,違規停車,"中西區臨安路一段72號 違規停車",臺南市中西區臨安路一段72號,22.99906,120.190805
