UN201812050220,"2018-12-05 17:05:47",中西區,噪音舉發,妨害安寧,"中西區永福路一段4號 噪音舉發",臺南市中西區永福路一段4號,22.98521,120.200184
UN201812050222,"2018-12-05 17:09:13",中西區,違規停車,違規停車,"中西區萬昌街151號 違規停車",臺南市中西區萬昌街151號,22.994057,120.210683
UN201812050226,"2018-12-05 17:13:51",新化區,路燈故障,9盞以下路燈故障,"新化區新和庄76號 路燈故障",新化區新和庄76號,23.0267815,120.3527462
UN201812050227,"2018-12-05 17:14:06",北區,交通運輸,號誌故障,"北區公園路585之1號 號誌故障",北區公園路585之1號,23.0109503,120.2107528
UN201812050230,"2018-12-05 17:28:35",南區,違規停車,違規停車,"南區健康路一段425號左邊 違規停車",南區健康路一段425號,22.9810841,120.198716
UN201812050231,"2018-12-05 17:30:05",安南區,騎樓舉發,騎樓舉發,"安南區安和路五段250號 騎樓舉發",安南區安和路五段250號,23.0676269,120.2170785
UN201812050233,"2018-12-05 17:34:28",北區,路燈故障,9盞以下路燈故障,"北區育德一街221巷2之1號 路燈不亮",北區育德一街221巷2之1號,23.0164455,120.205333
UN201812050240,"2018-12-05 17:57:16",東區,違規停車,違規停車,"東區龍山街75號,人行道車輛 違規停車",東區龍山街75號,22.9831141,120.2225664
UN201812050242,"2018-12-05 17:59:31",麻豆區,髒亂及汙染,空氣汙染,"麻豆區新生北路698巷 空氣汙染",麻豆區新生北路698巷,23.1898119,120.2511632
UN201812050243,"2018-12-05 18:01:38",北區,違規停車,違規停車,"北區開元路和開元路485巷口 紅線違停",北區開元路開元路485巷,23.0102068,120.2247447
UN201812050244,"2018-12-05 18:03:54",北區,交通運輸,號誌故障,"北區公園路587號旁 號誌故障",北區公園路587號,23.0113443,120.2109085
UN201812050248,"2018-12-05 18:17:01",仁德區,路燈故障,10盞以上路燈故障,"仁德區中正西路227號附近 路燈不亮",仁德區中正西路227號,22.9177405,120.2203621
UN201812050249,"2018-12-05 18:17:13",中西區,路燈故障,9盞以下路燈故障,"中西區頂美一街70巷與頂美二街口,路燈故障",中西區頂美一街70巷頂美二街,23.0012148,120.1846135
UN201812050250,"2018-12-05 18:23:25",東區,違規停車,違規停車,"東區崇德路580號 違規停車",東區崇德路580號,22.9716221,120.227339
UN201812050257,"2018-12-05 18:40:29",安平區,騎樓舉發,騎樓舉發,"安平區怡平路364號 違規停車",安平區怡平路364號,22.9934529,120.177716
UN201812050260,"2018-12-05 18:52:30",中西區,騎樓舉發,騎樓舉發,"中西區衛民街108、110號騎樓 騎樓舉發",中西區衛民街108號,22.9933989,120.2085591
UN201812050261,"2018-12-05 18:53:31",中西區,騎樓舉發,騎樓舉發,"中西區西華南街48到38號騎樓 騎樓舉發",中西區西華南街48號,22.994015,120.2095829
UN201812050263,"2018-12-05 18:55:08",善化區,違規停車,違規停車,"善化區金華路223巷 紅線違停",善化區興華路223巷,23.1270539,120.2987942
UN201812050270,"2018-12-05 19:11:41",新化區,路燈故障,9盞以下路燈故障,"新化區復興路114巷3號 路燈不亮",新化區復興路114巷3號,23.0293262,120.3121492
UN201812050277,"2018-12-05 19:35:18",東區,違規停車,違規停車,"東區長榮路三段84號 違規停車",東區長榮路三段84號,22.9942618,120.2219214
UN201812050283,"2018-12-05 20:07:29",永康區,違規停車,違規停車,"永康區中山南路和中山南路319巷口 違規停車",永康區中山南路中山南路319巷,23.0168655,120.2379337
UN201812050285,"2018-12-05 20:14:20",中西區,違規停車,違規停車,"中西區西華南街60號 違規停車",中西區西華南街60號,22.9943494,120.2095425
UN201812050286,"2018-12-05 20:17:20",關廟區,髒亂及汙染,道路散落物,"關廟區布袋清水寺，過國道3號涵洞下約100公尺處，北上車道路邊 狗屍",臺南市關廟區南雄南路171號,22.920398,120.348102
UN201812050306,"2018-12-05 21:13:09",東區,噪音舉發,妨害安寧,"東區文化二街186巷 妨害安寧",東區文化二街186巷,22.9758455,120.2332891
UN201812050313,"2018-12-05 21:45:26",永康區,騎樓舉發,騎樓舉發,"永康區勝學路260巷熱帶嶼大樓 佔用騎樓",臺南市永康區勝學路260巷8號,23.006876,120.231675
UN201812050314,"2018-12-05 21:46:51",永康區,違規停車,違規停車,"永康區國華街102巷26號旁 違停",永康區國華街102巷26號,23.0141123,120.2474812
UN201812050315,"2018-12-05 21:48:38",北區,髒亂及汙染,空氣汙染,"北區開元路212巷142號，紅樹林海鮮碳烤 空氣污染",臺南市北區開元路212巷142號,23.004784,120.224396
UN201812050317,"2018-12-05 21:59:07",東區,違規停車,違規停車,"東區裕農路19巷4號到10號 違規停車",台南市東區裕農路19巷4號,22.9852675,120.2245053
UN201812050318,"2018-12-05 21:59:37",安南區,違規停車,違規停車,"安南區公學路五段697巷171號 違停",臺南市安南區公學路五段697巷171號,23.071521,120.159324
UN201812050321,"2018-12-05 22:31:14",永康區,噪音舉發,妨害安寧,"永康區永埔街17巷私人公廟 妨害安寧",永康區永埔街17巷,23.0276191,120.258693
UN201812050322,"2018-12-05 22:31:38",永康區,噪音舉發,妨害安寧,"永康區中華路826號85℃ 妨害安寧",永康區中華路826號,23.0190529,120.2257794
UN201812050333,"2018-12-05 23:36:48",南區,噪音舉發,場所連續噪音,"南區健康路二段與惠南街路口 噪音舉發",台南市南區健康路二段*惠南街路,22.9819625,120.1877042
UN201812050336,"2018-12-05 23:57:30",永康區,道路維修,路面坑洞,"永康區復國一路6巷28號門口 道路維修",永康區復國一路6巷28號,23.0021774,120.2471182
UN201812060003,"2018-12-06 01:52:55",安平區,髒亂及汙染,空氣汙染,"安平區安北路152巷7號 空氣汙染",臺南市安平區安北路152巷7號,23.003728,120.161205
UN201812060008,"2018-12-06 05:28:53",永康區,髒亂及汙染,空氣汙染,"永康區大灣路1014號鍵誠紡織 空氣汙染",臺南市永康區大灣路1014號,22.999921,120.253194
UN201812060018,"2018-12-06 08:04:42",安平區,交通運輸,公車動態LED跑馬燈資訊顯示異常,"安平區府前路二段612號 交通運輸",安平區府前路二段612號,22.9933302,120.1844429
UN201812060027,"2018-12-06 08:48:38",永康區,髒亂及汙染,空氣汙染,"永康區大灣路1014號 空氣汙染",永康區大灣路1014號,22.9998521,120.2530293
UN201812060034,"2018-12-06 09:14:34",北區,道路維修,人孔蓋或溝蓋聲響鬆動,"北區西門路四段463號   汙水孔蓋鬆動",北區西門路四段463號,23.0182029,120.2120847
UN201812060040,"2018-12-06 09:25:20",七股區,髒亂及汙染,空氣汙染,"七股區看坪里3之13號後面 空氣汙染",七股區看坪里3之13號,23.1196109,120.1518917
UN201812060048,"2018-12-06 09:36:44",中西區,路燈故障,9盞以下路燈故障,"中西區湖美街106號 路燈故障",中西區湖美街106號,23.0033055,120.1800482
UN201812060054,"2018-12-06 09:53:28",中西區,違規停車,違規停車,中西區開山路52到90號及對面75到85號違規停車,臺南市中西區開山路52號,22.991184,120.205957
UN201812060056,"2018-12-06 09:55:22",北區,民生管線,停電、漏電、電線掉落、孔蓋鬆動,"北區大興街233巷  電線低垂",北區大興街233巷,23.0090991,120.1889469
UN201812060080,"2018-12-06 10:44:37",中西區,路燈故障,9盞以下路燈故障,"中西區開山路93號 路燈故障",中西區開山路93號,22.9896755,120.2069315
UN201812060100,"2018-12-06 11:19:52",北區,噪音舉發,妨害安寧,"北區臨安路二段310號    連續噪音",臺南市北區臨安路二段310號,23.004794,120.202977
UN201812060111,"2018-12-06 11:57:17",東區,民生管線,停電、漏電、電線掉落、孔蓋鬆動,"東區成功三街131號 漏水",東區成功三街131號,22.9575534,120.2313768
UN201812060122,"2018-12-06 12:25:08",永康區,違規停車,違規停車,"永康區大勇路1號 違規停車",臺南市永康區大勇路1號,23.007798,120.260405
UN201812060123,"2018-12-06 12:26:09",東區,髒亂及汙染,道路散落物,"東區林森路一段崇明路 路面散落物",東區林森路一段崇明路,22.9821352,120.2158967
UN201812060126,"2018-12-06 12:34:55",東區,髒亂及汙染,市區道路路面油漬,"東區中華東路與東平路,路面碎片",東區中華東路東平路,22.9946483,120.2342987
UN201812060128,"2018-12-06 12:36:46",下營區,髒亂及汙染,空氣汙染,"下營區忍裡里工業街2巷15-2號  空氣汙染",下營區忍裡里工業街2巷15-2號,23.2319349,120.2542924
UN201812060131,"2018-12-06 12:41:44",中西區,髒亂及汙染,市區道路路面油漬,"中西區中華西路靠和緯路  路面油漬",中西區中華西路和緯路,23.0069011,120.1862777
UN201812060135,"2018-12-06 12:47:13",安南區,髒亂及汙染,道路散落物,"安南區安和路一段87號 路面掉落物",安南區安和路一段87號,23.0278621,120.214499
UN201812060157,"2018-12-06 13:52:21",安南區,髒亂及汙染,道路散落物,"安南區安和路一段1號 路面落掉物",安南區安和路一段1號,23.025937,120.215093
UN201812060166,"2018-12-06 14:21:12",安南區,髒亂及汙染,道路散落物,"安南區安通路三段安和路 髒亂及汙染",安南區安通路三段安和路,23.029767,120.2135854
UN201812060171,"2018-12-06 14:31:22",南區,髒亂及汙染,空氣汙染,"南區新都路256巷1號 空氣汙染",臺南市南區新都路256巷1號,22.969053,120.198465
UN201812060172,"2018-12-06 14:31:39",學甲區,髒亂及汙染,空氣汙染,"學甲區中洲里南鄉道1-1    空氣汙染",學甲區中洲里南鄉道1-1,23.2438768,120.1596769
UN201812060195,"2018-12-06 15:22:21",永康區,髒亂及汙染,空氣汙染,"永康區大灣路1014號 空氣汙染",永康區大灣路1014號,22.9998521,120.2530293
UN201812060198,"2018-12-06 15:40:08",新市區,動物救援,犬貓急難救援,"新市區社內里   動物救援",新市區社內里,23.0765802,120.2801166
UN201812060204,"2018-12-06 15:53:18",永康區,髒亂及汙染,空氣汙染,"永康區正南五街289巷51號 空污",永康區正南五街289巷51號,23.0350455,120.2368236
UN201812060205,"2018-12-06 15:53:19",新市區,動物救援,犬貓急難救援,"新市區社內12之5號 狗受困",新市區社內12之5號,23.0771529,120.2852965
UN201812060232,"2018-12-06 17:23:49",南區,違規停車,違規停車,南區健康路一段367號左邊違規停車,臺南市南區健康路一段367號,22.98128,120.199879
UN201812060240,"2018-12-06 17:52:10",仁德區,路燈故障,9盞以下路燈故障,"仁德區行大街140號 路燈故障",仁德區行大街140號,22.9152559,120.2209273
UN201812060242,"2018-12-06 17:56:13",中西區,違規停車,違規停車,"中西區西華南街33號 違規停車",臺南市中西區西華南街33號,22.993754,120.209335
UN201812060256,"2018-12-06 18:58:34",中西區,路燈故障,9盞以下路燈故障,"中西區保安路與海安路一段口，海安路一段上 路燈不亮",中西區保安路海安路一段,22.9905286,120.1953282
UN201812060257,"2018-12-06 19:01:38",北區,違規停車,違規停車,"北區海安路三段763巷口 違停",北區海安路三段763巷,23.0152982,120.2004429
UN201812060265,"2018-12-06 19:26:33",中西區,交通運輸,號誌秒差調整,"中西區西寧街跟民生路二段路口 交通運輸",中西區西寧街民生路二段,22.996826,120.192024
UN201812060266,"2018-12-06 19:27:42",北區,道路維修,路面坑洞,"北區武聖路36巷11號 坑洞",北區武聖路36巷11號,23.0058187,120.1924901
UN201812060269,"2018-12-06 19:30:08",安平區,路燈故障,9盞以下路燈故障,"安平區建平九街40號 路燈不亮",安平區建平九街40號,22.9911206,120.1812765
UN201812060277,"2018-12-06 20:02:00",七股區,動物救援,犬貓急難救援,"七股區大潭里56號 狗受傷",七股區大潭里56號,23.1831187,120.1412609
UN201812060283,"2018-12-06 20:22:31",新化區,違規停車,違規停車,"新化區忠孝路161巷口 違規停車",新化區忠孝路161巷,23.0371761,120.3034356
UN201812060286,"2018-12-06 20:30:23",東區,髒亂及汙染,空氣汙染,"東區文化二街186巷 空氣汙染",東區文化二街186巷,22.9758455,120.2332891
UN201812060288,"2018-12-06 20:35:43",中西區,違規停車,違規停車,"中西區民族路二段55-1號 違規停車",中西區民族路二段55-1號,22.994323,120.2100841
UN201812060290,"2018-12-06 20:39:44",中西區,違規停車,違規停車,"中西區西門路一段660號 違停",臺南市中西區西門路一段660號,22.988373,120.197721
UN201812060292,"2018-12-06 20:44:32",中西區,違規停車,違規停車,"中西區西寧街18號、28號、25號與37號 違停",中西區西寧街18號,22.997354,120.1917757
UN201812060294,"2018-12-06 20:47:59",中西區,噪音舉發,妨害安寧,"中西區臨安路一段72號  妨害安寧",臺南市中西區臨安路一段72號,22.99906,120.190805
UN201812060296,"2018-12-06 20:54:48",中西區,違規停車,違規停車,"中西區萬昌街衛民街 違規停車",中西區萬昌街衛民街,22.9928605,120.210664
UN201812060297,"2018-12-06 20:58:34",中西區,騎樓舉發,騎樓舉發,"中西區西華南街18，29號騎樓 騎樓舉發",臺南市中西區西華南街18號,22.993517,120.209444
UN201812060302,"2018-12-06 21:17:06",永康區,違規停車,違規停車,"永康區中華西街230巷15號轉角 違停",永康區中華西街230巷15號,23.0173979,120.2265392
UN201812060305,"2018-12-06 21:37:19",中西區,噪音舉發,妨害安寧,"中西區南寧街83巷36號  妨害安寧",臺南市中西區南寧街83巷36號,22.984376,120.198353
UN201812060307,"2018-12-06 21:43:42",安定區,路燈故障,9盞以下路燈故障,"安定區安定國小旁 路燈故障",安定區安定國小,23.1228575,120.2463276
UN201812060311,"2018-12-06 22:04:46",中西區,噪音舉發,場所連續噪音,"中西區青年路15號 場所連續噪音",中西區青年路15號,22.9925242,120.2060653
UN201812060314,"2018-12-06 22:15:58",中西區,民生管線,漏水、停水、消防栓漏水或損壞,"中西區開山路89巷口 漏水",中西區開山路89巷,22.9897226,120.2074071
UN201812060317,"2018-12-06 22:36:21",中西區,噪音舉發,場所連續噪音,"中西區五妃街&西門路一段口 噪音舉發",中西區五妃街西門路一段,22.9826285,120.1976626
UN201812070005,"2018-12-07 02:27:53",永康區,髒亂及汙染,空氣汙染,"永康區大灣路1014號 空氣汙染",臺南市永康區大灣路1014號,22.999921,120.253194
UN201812070049,"2018-12-07 09:05:29",中西區,騎樓舉發,騎樓舉發,"中西區衛民街138號   騎樓舉發",臺南市中西區衛民街138號,22.993445,120.207772
UN201812070073,"2018-12-07 09:56:30",中西區,噪音舉發,妨害安寧,"中西區武聖路69巷38號 妨害安寧",臺南市中西區武聖路69巷38號,23.004936,120.191278
UN201812070148,"2018-12-07 13:54:05",中西區,違規停車,違規停車,"中西區萬昌街151號 違規停車",臺南市中西區萬昌街151號,22.994057,120.210683
UN201812070165,"2018-12-07 14:38:12",南區,噪音舉發,妨害安寧,"南區文南路105巷8號    妨害安寧",臺南市南區文南路105巷8號,22.984687,120.189403
UN201812070212,"2018-12-07 16:38:32",安南區,違規停車,違規停車,"安南區海佃路二段72號 違規停車",臺南市安南區海佃路二段72號,23.031287,120.190409
UN201812070214,"2018-12-07 16:48:36",歸仁區,髒亂及汙染,空氣汙染,"歸仁區中山路三段313號 道路施工",臺南市歸仁區中山路三段313號,22.968108,120.280095
UN201812070215,"2018-12-07 16:51:07",安平區,違規停車,違規停車,"安平區華平路196號 違規停車",臺南市安平區華平路196號,22.989471,120.174926
UN201812070224,"2018-12-07 17:14:59",中西區,騎樓舉發,騎樓舉發,"中西區西華南街38到48號騎樓 騎樓舉發",臺南市中西區西華南街38號,22.993886,120.209524
UN201812070225,"2018-12-07 17:16:01",中西區,騎樓舉發,騎樓舉發,"中西區衛民街108、110號騎樓 騎樓舉發",臺南市中西區衛民街108號,22.993346,120.208667
UN201812070227,"2018-12-07 17:23:40",安平區,道路維修,寬頻管線、孔蓋損壞,"安平區健康三街592巷55號斜前面 台電",臺南市安平區健康三街592巷55號,22.997078,120.170839
UN201812070232,"2018-12-07 17:34:48",新營區,動物救援,犬貓急難救援,"新營區中正路41號 貓受困",臺南市新營區中正路41號,23.31526,120.316352
UN201812070234,"2018-12-07 17:38:04",中西區,違規停車,違規停車,"中西區民族路二段76號 違規停車",臺南市中西區民族路二段76號,22.994726,120.20925
UN201812070236,"2018-12-07 17:42:06",中西區,違規停車,違規停車,"中西區西華南街38號 違規停車",臺南市中西區西華南街38號,22.993886,120.209524
UN201812070237,"2018-12-07 17:43:03",中西區,違規停車,違規停車,"中西區民族路二段55-1號 違規停車",臺南市中西區民族路二段55-1號,22.994309,120.210166
UN201812070244,"2018-12-07 18:03:59",東區,違規停車,違規停車,"東區東門路三段15號，聯邦證券前 違停",臺南市東區東門路三段15號,22.98081,120.230176
UN201812070245,"2018-12-07 18:07:07",關廟區,違規停車,違規停車,"關廟區南雄路一段1001號，關廟全聯前面 違規停車",臺南市關廟區南雄路一段1001號,22.956055,120.328656
UN201812070259,"2018-12-07 18:35:56",南區,違規停車,違規停車,"南區夏林路204號前 違停",臺南市南區夏林路204號,22.979814,120.194859
UN201812070269,"2018-12-07 19:17:11",北區,違規停車,違規停車,"北區海安路三段600號 違規停車",臺南市北區海安路三段600號,23.012578,120.200766
UN201812070270,"2018-12-07 19:20:16",中西區,違規停車,違規停車,"中西區民族路二段1-68，2到71號 違規停車",臺南市中西區民族路二段71號,22.994351,120.209457
UN201812070273,"2018-12-07 19:26:16",東區,違規停車,違規停車,"東區東門路二段158巷38號前 違停",臺南市東區東門路二段158巷38號,22.984845,120.220636
UN201812070278,"2018-12-07 19:40:45",東區,違規停車,違規停車,"東區東門路二段158巷38號前 違停",臺南市東區東門路二段158巷38號,22.984845,120.220636
UN201812070279,"2018-12-07 19:41:16",東區,違規停車,違規停車,"東區北門路一段310號附近 違規停車",臺南市東區北門路一段310號,22.996322,120.212122
UN201812070282,"2018-12-07 19:53:04",中西區,違規停車,違規停車,"中西區萬昌街151號旁巷子 違規停車",臺南市中西區萬昌街151號,22.994057,120.210683
UN201812070296,"2018-12-07 20:39:09",安平區,違規停車,違規停車,"安平區安平路578號 違規停車",臺南市安平區安平路578號,22.998716,120.169994
UN201812070302,"2018-12-07 21:29:16",中西區,噪音舉發,妨害安寧,"中西區臨安路一段72號 妨害安寧",臺南市中西區臨安路一段72號,22.99906,120.190805
UN201812070311,"2018-12-07 22:37:04",北區,違規停車,違規停車,"北區長榮路四段158號 違規停車",臺南市北區長榮路四段158號,23.006712,120.221665
UN201812070314,"2018-12-07 22:48:43",永康區,髒亂及汙染,空氣汙染,"永康區大灣路1014號鍵誠紡織 空氣汙染",臺南市永康區大灣路1014號,22.999921,120.253194
UN201812070317,"2018-12-07 23:02:44",中西區,噪音舉發,妨害安寧,"中西區臨安路一段72號 妨害安寧",臺南市中西區臨安路一段72號,22.99906,120.190805
UN201812070319,"2018-12-07 23:40:09",永康區,動物救援,犬貓急難救援,"永康區中正南路200號 狗受傷",臺南市永康區中正南路200號,23.024458,120.219522
