UN201812240004,"2018-12-24 00:20:04",南區,噪音舉發,妨害安寧,"南區中華南路二段233巷14號3樓 妨害安寧",臺南市南區中華南路二段233巷14號,22.960323,120.189559
UN201812240006,"2018-12-24 00:30:22",中西區,噪音舉發,妨害安寧,"中西區大同路一段252號 妨害安寧",臺南市中西區大同路一段252號,22.981566,120.211733
UN201812240010,"2018-12-24 01:58:14",安平區,噪音舉發,妨害安寧,"安平區慶平路88號 噪音舉發",臺南市安平區慶平路88號,22.997116,120.181904
UN201812240011,"2018-12-24 02:06:06",中西區,噪音舉發,場所連續噪音,"中西區府前路二段208號 妨害安寧",臺南市中西區府前路二段208號,22.991757,120.192411
UN201812240014,"2018-12-24 05:13:58",新營區,噪音舉發,妨害安寧,"新營區新進路286號 妨害安寧",臺南市新營區新進路286號,23.30182,120.316274
UN201812240015,"2018-12-24 05:21:26",新營區,噪音舉發,妨害安寧,"新營區新進路286號  噪音舉發",臺南市新營區新進路286號,23.30182,120.316274
UN201812240023,"2018-12-24 07:38:06",善化區,道路維修,路樹傾倒,"善化區建國路29號 路樹傾倒",臺南市善化區建國路29號,23.126715,120.297341
UN201812240034,"2018-12-24 08:14:19",北區,違規停車,違規停車,"北區北門路二段71號 違規停車",臺南市北區北門路二段71號,22.998837,120.212395
UN201812240041,"2018-12-24 08:32:57",中西區,違規停車,違規停車,"中西區民族路二段76號 違規停車",臺南市中西區民族路二段76號,22.994726,120.20925
UN201812240044,"2018-12-24 08:36:32",東區,交通運輸,佔用道路,"東區勝利路54號(海鷗早餐) 交通運輸",臺南市東區勝利路54號,22.99152,120.21789
UN201812240054,"2018-12-24 09:06:55",仁德區,髒亂及汙染,空氣汙染,"仁德區中山路552號 空氣汙染",臺南市仁德區中山路552號,22.971642,120.252622
UN201812240069,"2018-12-24 09:41:57",安平區,噪音舉發,妨礙安寧,"安平區永華路二段819號    妨害安寧",臺南市安平區永華路二段819號,22.990885,120.168528
UN201812240086,"2018-12-24 10:22:10",中西區,違規停車,違規停車,"中西區北門路一段155至163號 違停",臺南市中西區北門路一段155號,22.995677,120.211677
UN201812240092,"2018-12-24 10:26:14",東區,噪音舉發,妨害安寧,"東區裕農路589號 妨害安寧",臺南市東區裕農路589號,22.988691,120.234369
UN201812240095,"2018-12-24 10:28:13",仁德區,交通運輸,佔用道路,"仁德區中正路二段417號    佔用道路",臺南市仁德區中正路二段417號,22.95396,120.25203
UN201812240097,"2018-12-24 10:32:02",中西區,民生管線,電信孔蓋鬆動、電信線路掉落、電信桿傾倒,"中西區樹林街二段63號前 中華電信孔蓋聲響",臺南市中西區樹林街二段63號,22.985576,120.205736
UN201812240133,"2018-12-24 11:53:00",中西區,違規停車,違規停車,"中西區海安路二段340號至362號 違停",臺南市中西區海安路二段340號,22.999717,120.198625
UN201812240146,"2018-12-24 12:33:33",北區,違規停車,違規停車,"北區臨安路二段189號 違停",臺南市北區臨安路二段189號,23.003736,120.198992
UN201812240147,"2018-12-24 12:42:16",永康區,髒亂及汙染,小廣告、旗幟,"永康區小東路483號 違規廣告",臺南市永康區小東路483號,22.998716,120.235441
UN201812240149,"2018-12-24 12:52:00",永康區,髒亂及汙染,空氣汙染,"永康區大灣路1014號，鍵誠紡織 空污",臺南市永康區大灣路1014號,22.999921,120.253194
UN201812240151,"2018-12-24 13:01:53",北區,違規停車,違規停車,"開元路成大城附近 違停",臺南市北區開元路501號,23.010454,120.224838
UN201812240155,"2018-12-24 13:11:52",中西區,噪音舉發,場所連續噪音,"中西區南門路239號   連續噪音",臺南市中西區南門路239號,22.983044,120.204058
UN201812240167,"2018-12-24 13:48:52",永康區,違規停車,違規停車,"永康區六合路42巷50號 違規停車",臺南市永康區六合路42巷50號,23.009208,120.232462
UN201812240171,"2018-12-24 14:06:39",永康區,違規停車,違規停車,"永康區中華路458號 違規停車",臺南市永康區中華路458號,23.010736,120.23274
UN201812240195,"2018-12-24 15:36:57",東區,違規停車,違規停車,"東區府連路435號 違停",臺南市東區府連路435號,22.986309,120.216988
UN201812240229,"2018-12-24 16:38:43",安南區,髒亂及汙染,空氣汙染,"安南區安中路五段188號，康寧大學附近 空污",臺南市安南區安中路五段188號,23.055803,120.158835
UN201812240244,"2018-12-24 17:39:19",中西區,騎樓舉發,騎樓舉發,"中西區衛民街108、110號 騎樓舉發",臺南市中西區衛民街108號,22.993346,120.208667
UN201812240245,"2018-12-24 17:42:13",中西區,違規停車,違規停車,"中西區民族路二段30號、35號 違規停車",臺南市中西區民族路二段30號,22.994719,120.210848
UN201812240246,"2018-12-24 17:43:31",中西區,違規停車,違規停車,"中西區民族路二段68號巷內、新光三越旁紅線 違規停車",臺南市中西區民族路二段68號,22.994629,120.210077
UN201812240268,"2018-12-24 18:32:53",北區,違規停車,違規停車,"北區海安路三段600號 違規停車",臺南市北區海安路三段600號,23.012578,120.200766
UN201812240270,"2018-12-24 18:33:31",中西區,違規停車,違規停車,"中西區西華南街33號 違規停車",臺南市中西區西華南街33號,22.993754,120.209335
UN201812240271,"2018-12-24 18:35:28",中西區,違規停車,違規停車,"中西區民族路二段66號 違規停車",臺南市中西區民族路二段66號,22.994656,120.210177
UN201812240274,"2018-12-24 18:41:05",北區,交通運輸,佔用道路,"北區東豐路181號，亞芙餐廳 佔用道路",臺南市北區東豐路181號,23.003536,120.219444
UN201812240282,"2018-12-24 19:14:18",東區,違規停車,違規停車,"東區崇德十九街62號前 違規停車",臺南市東區崇德十九街62號,22.968164,120.22935
UN201812240289,"2018-12-24 19:35:31",北區,噪音舉發,場所連續噪音,"北區東興路二段51號 南北房屋 場所連續噪音",臺南市北區東興路二段51號,23.000601,120.228449
UN201812240297,"2018-12-24 20:18:27",中西區,噪音舉發,妨害安寧,"中西區臨安路一段72號 噪音舉發",臺南市中西區臨安路一段72號,22.99906,120.190805
UN201812240307,"2018-12-24 21:03:38",北區,違規停車,違規停車,"北區小東路373號 違規停車/機車待轉區",臺南市北區小東路373號,22.999012,120.231875
UN201812240313,"2018-12-24 22:19:19",永康區,髒亂及汙染,空氣汙染,永康區大灣路1014號鍵誠紡織　空氣汙染,臺南市永康區大灣路1014號,22.999921,120.253194
UN201812240318,"2018-12-24 23:04:08",東區,違規停車,違規停車,"東區東寧路201巷30-6號 違規停車",臺南市東區東寧路201巷30-6號,22.992005,120.225865
UN201812240321,"2018-12-24 23:22:37",中西區,違規停車,違規停車,"中西區民族路二段77號停車場外槽化線 違規停車",臺南市中西區民族路二段77號,22.994373,120.209331
