UN201812240004,"2018-12-24 00:20:04",南區,噪音舉發,妨害安寧,"南區中華南路二段233巷14號3樓 妨害安寧",臺南市南區中華南路二段233巷14號,22.960323,120.189559
UN201812240006,"2018-12-24 00:30:22",中西區,噪音舉發,妨害安寧,"中西區大同路一段252號 妨害安寧",臺南市中西區大同路一段252號,22.981566,120.211733
UN201812240010,"2018-12-24 01:58:14",安平區,噪音舉發,妨害安寧,"安平區慶平路88號 噪音舉發",臺南市安平區慶平路88號,22.997116,120.181904
UN201812240011,"2018-12-24 02:06:06",中西區,噪音舉發,場所連續噪音,"中西區府前路二段208號 妨害安寧",臺南市中西區府前路二段208號,22.991757,120.192411
UN201812240014,"2018-12-24 05:13:58",新營區,噪音舉發,妨害安寧,"新營區新進路286號 妨害安寧",臺南市新營區新進路286號,23.30182,120.316274
UN201812240015,"2018-12-24 05:21:26",新營區,噪音舉發,妨害安寧,"新營區新進路286號  噪音舉發",臺南市新營區新進路286號,23.30182,120.316274
UN201812240023,"2018-12-24 07:38:06",善化區,道路維修,路樹傾倒,"善化區建國路29號 路樹傾倒","善化區建國路29號,",23.1269189,120.2972926
UN201812240034,"2018-12-24 08:14:19",北區,違規停車,違規停車,"北區北門路二段71號 違規停車",臺南市北區北門路二段71號,22.998837,120.212395
UN201812240041,"2018-12-24 08:32:57",中西區,違規停車,違規停車,"中西區民族路二段76號 違規停車",臺南市中西區民族路二段76號,22.994726,120.20925
UN201812240044,"2018-12-24 08:36:32",東區,交通運輸,佔用道路,"東區勝利路54號(海鷗早餐) 交通運輸",臺南市東區勝利路54號,22.99152,120.21789
UN201812240054,"2018-12-24 09:06:55",仁德區,髒亂及汙染,空氣汙染,"仁德區中山路552號 空氣汙染",仁德區中山路552號,22.9715868,120.2526124
UN201812240068,"2018-12-24 09:36:21",東區,民生管線,漏水、停水、消防栓漏水或損壞,"東區仁和路111巷63號 漏水",東區仁和路111巷63號,22.9712381,120.234704
UN201812240069,"2018-12-24 09:41:57",安平區,噪音舉發,妨礙安寧,"安平區永華路二段819號    妨害安寧",臺南市安平區永華路二段819號,22.990885,120.168528
UN201812240071,"2018-12-24 09:45:21",歸仁區,交通運輸,號誌故障,"歸仁區中山路三段193號    號誌燈不亮",歸仁區中山路三段193號,22.9678898,120.2831685
UN201812240086,"2018-12-24 10:22:10",中西區,違規停車,違規停車,"中西區北門路一段155至163號 違停",臺南市中西區北門路一段155號,22.995677,120.211677
UN201812240092,"2018-12-24 10:26:14",東區,噪音舉發,妨害安寧,"東區裕農路589號 妨害安寧",臺南市東區裕農路589號,22.988691,120.234369
UN201812240095,"2018-12-24 10:28:13",仁德區,交通運輸,佔用道路,"仁德區中正路二段417號    佔用道路",臺南市仁德區中正路二段417號,22.95396,120.25203
UN201812240097,"2018-12-24 10:32:02",中西區,民生管線,電信孔蓋鬆動、電信線路掉落、電信桿傾倒,"中西區樹林街二段63號前 中華電信孔蓋聲響",中西區樹林街二段63號,22.9855524,120.2056703
UN201812240100,"2018-12-24 10:36:56",白河區,動物救援,犬貓急難救援,"白河區新興路555號 貓受傷",白河區新興路555號,23.3528043,120.4158138
UN201812240111,"2018-12-24 10:58:46",安平區,路燈故障,9盞以下路燈故障,"安平區安北路722巷150號 路燈不亮",安平區安北路722巷150號,22.9985188,120.1453699
UN201812240126,"2018-12-24 11:35:16",東區,交通運輸,號誌故障,"東區崇德八街口與崇德路 號誌故障",東區崇德八街口與崇德路,22.974023,120.227495
UN201812240133,"2018-12-24 11:53:00",中西區,違規停車,違規停車,"中西區海安路二段340號至362號 違停",臺南市中西區海安路二段340號,22.999717,120.198625
UN201812240146,"2018-12-24 12:33:33",北區,違規停車,違規停車,"北區臨安路二段189號 違停",臺南市北區臨安路二段189號,23.003736,120.198992
UN201812240147,"2018-12-24 12:42:16",永康區,髒亂及汙染,小廣告、旗幟,"永康區小東路483號 違規廣告",永康區小東路483號,22.9984826,120.2353436
UN201812240149,"2018-12-24 12:52:00",永康區,髒亂及汙染,空氣汙染,"永康區大灣路1014號，鍵誠紡織 空污",永康區大灣路1014號,22.9998521,120.2530293
UN201812240151,"2018-12-24 13:01:53",北區,違規停車,違規停車,"開元路成大城附近 違停",臺南市北區開元路501號,23.010454,120.224838
UN201812240155,"2018-12-24 13:11:52",中西區,噪音舉發,場所連續噪音,"中西區南門路239號   連續噪音",中西區南門路239號,22.9830616,120.2040745
UN201812240163,"2018-12-24 13:41:59",安南區,動物救援,犬貓急難救援,"安南區海佃路二段461巷31號 犬救援",安南區海佃路二段461巷31號,23.040798,120.186492
UN201812240167,"2018-12-24 13:48:52",永康區,違規停車,違規停車,"永康區六合路42巷50號 違規停車",臺南市永康區六合路42巷50號,23.009208,120.232462
UN201812240171,"2018-12-24 14:06:39",永康區,違規停車,違規停車,"永康區中華路458號 違規停車",臺南市永康區中華路458號,23.010736,120.23274
UN201812240193,"2018-12-24 15:30:38",安南區,路燈故障,9盞以下路燈故障,"安南區安興街696巷   路燈故障",安南區安興街696巷,23.0731405,120.1563307
UN201812240195,"2018-12-24 15:36:57",東區,違規停車,違規停車,"東區府連路435號 違停",臺南市東區府連路435號,22.986309,120.216988
UN201812240215,"2018-12-24 16:17:00",安南區,噪音舉發,妨害安寧,台南市安南區海佃路二段472號噪音舉發,台南市安南區海佃路二段472號,23.0397806,120.1880842
UN201812240223,"2018-12-24 16:28:42",永康區,道路維修,路面坑洞,永康區復興路358前道路維修,永康區復興路358號,22.998777,120.2412428
UN201812240229,"2018-12-24 16:38:43",安南區,髒亂及汙染,空氣汙染,"安南區安中路五段188號，康寧大學附近 空污",安南區安中路五段188號,23.058852,120.154343
UN201812240244,"2018-12-24 17:39:19",中西區,騎樓舉發,騎樓舉發,"中西區衛民街108、110號 騎樓舉發",臺南市中西區衛民街108號,22.993346,120.208667
UN201812240245,"2018-12-24 17:42:13",中西區,違規停車,違規停車,"中西區民族路二段30號、35號 違規停車",臺南市中西區民族路二段30號,22.994719,120.210848
UN201812240246,"2018-12-24 17:43:31",中西區,違規停車,違規停車,"中西區民族路二段68號巷內、新光三越旁紅線 違規停車",臺南市中西區民族路二段68號,22.994629,120.210077
UN201812240255,"2018-12-24 18:00:11",永康區,違規停車,違規停車,"永康區中正南路208號路邊 妨礙通行",永康區中正南路208號,23.0249964,120.2199657
UN201812240256,"2018-12-24 18:02:06",安平區,髒亂及汙染,空氣汙染,"西港區後營里後營350號，鑫興鋁業對面 空污",西港區後營里後營350號,23.1440531,120.2209801
UN201812240260,"2018-12-24 18:13:03",新市區,路燈故障,9盞以下路燈故障,"新市區仁愛街160之1號 路燈不亮",新市區仁愛街160之1號,23.0740954,120.2932071
UN201812240261,"2018-12-24 18:14:16",善化區,髒亂及汙染,空氣汙染,"善化區東昌派出所(善化區東勢寮101號)往東北方附近 髒亂及汙染",善化區東勢寮101號,23.155631,120.31796
UN201812240267,"2018-12-24 18:31:17",鹽水區,髒亂及汙染,空氣汙染,"鹽水區南門路201巷33弄17號對面 空污",鹽水區南門路201巷33弄17號,23.3115064,120.2715478
UN201812240268,"2018-12-24 18:32:53",北區,違規停車,違規停車,"北區海安路三段600號 違規停車",臺南市北區海安路三段600號,23.012578,120.200766
UN201812240270,"2018-12-24 18:33:31",中西區,違規停車,違規停車,"中西區西華南街33號 違規停車",臺南市中西區西華南街33號,22.993754,120.209335
UN201812240271,"2018-12-24 18:35:28",中西區,違規停車,違規停車,"中西區民族路二段66號 違規停車",臺南市中西區民族路二段66號,22.994656,120.210177
UN201812240274,"2018-12-24 18:41:05",北區,交通運輸,佔用道路,"北區東豐路181號，亞芙餐廳 佔用道路",臺南市北區東豐路181號,23.003536,120.219444
UN201812240279,"2018-12-24 18:53:18",安南區,路燈故障,9盞以下路燈故障,"安南區海環街121巷20號  9盞以下路燈故障",安南區海環街121巷20號,23.0376779,120.1854327
UN201812240282,"2018-12-24 19:14:18",東區,違規停車,違規停車,"東區崇德十九街62號前 違規停車",臺南市東區崇德十九街62號,22.968164,120.22935
UN201812240289,"2018-12-24 19:35:31",北區,噪音舉發,場所連續噪音,"北區東興路二段51號 南北房屋 場所連續噪音",北區東興路二段51號,23.0010813,120.2283304
UN201812240293,"2018-12-24 20:00:57",中西區,違規停車,違規停車,"中西區西華南街 違規停車",中西區西華南街,22.9955627,120.2097732
UN201812240295,"2018-12-24 20:08:36",北區,違規停車,違規停車,"北區西門路四段155號，肯德基前 違停",北區西門路四段155號,23.0095238,120.2076714
UN201812240297,"2018-12-24 20:18:27",中西區,噪音舉發,妨害安寧,"中西區臨安路一段72號 噪音舉發",中西區臨安路一段72號,22.9990981,120.1907774
UN201812240298,"2018-12-24 20:19:25",仁德區,路燈故障,9盞以下路燈故障,"仁德區德南路251巷 路燈不亮",仁德區德南路251巷,22.9458201,120.2576894
UN201812240299,"2018-12-24 20:21:58",安平區,動物救援,犬貓急難救援,"安平區慶平路文平路 動物救援",安平區慶平路文平路,22.9969299,120.1792798
UN201812240301,"2018-12-24 20:26:02",永康區,路燈故障,9盞以下路燈故障,"永康區永大路二段1236號前 路燈故障",永康區永大路二段1236號,23.0210494,120.261801
UN201812240302,"2018-12-24 20:28:47",永康區,路燈故障,9盞以下路燈故障,"永康區中山南路325號 路燈故障",永康區中山南路325號,23.0172301,120.2380288
UN201812240303,"2018-12-24 20:35:32",安平區,路燈故障,9盞以下路燈故障,"安平區安平路638號 路燈不亮",安平區安平路638號,22.9990345,120.1680966
UN201812240307,"2018-12-24 21:03:38",北區,違規停車,違規停車,"北區小東路373號 違規停車/機車待轉區",北區小東路373號,22.9989054,120.2319979
UN201812240308,"2018-12-24 21:10:31",永康區,路燈故障,9盞以下路燈故障,"永康區大灣路537巷10號幼稚園角落 路燈故障",永康區大灣路537巷10號,23.000584,120.262911
UN201812240309,"2018-12-24 21:18:54",歸仁區,民生管線,漏水、停水、消防栓漏水或損壞,"歸仁區文化街三段686號 消防栓漏水",歸仁區文化街三段686號,22.970583,120.2732837
UN201812240313,"2018-12-24 22:19:19",永康區,髒亂及汙染,空氣汙染,永康區大灣路1014號鍵誠紡織　空氣汙染,永康區大灣路1014號鍵誠紡織,22.9998521,120.2530293
UN201812240316,"2018-12-24 22:37:44",安南區,噪音舉發,妨害安寧,"安南區鹽田路2號 妨害安寧",安南區鹽田路2號,23.0352222,120.1484185
UN201812240318,"2018-12-24 23:04:08",東區,違規停車,違規停車,"東區東寧路201巷30-6號 違規停車",東區東寧路201巷30-6號,22.9920044,120.2259325
UN201812240321,"2018-12-24 23:22:37",中西區,違規停車,違規停車,"中西區民族路二段77號停車場外槽化線 違規停車",中西區民族路二段77號停車場外槽化線,22.9944472,120.2093463
UN201812250001,"2018-12-25 00:26:30",中西區,噪音舉發,妨害安寧,"中西區大同路一段252號 妨害安寧",臺南市中西區大同路一段252號,22.981566,120.211733
UN201812250006,"2018-12-25 01:46:05",東區,噪音舉發,場所連續噪音,"東區崇德路514號 妨害安寧",臺南市東區崇德路514號,22.973413,120.227327
UN201812250007,"2018-12-25 01:56:46",永康區,髒亂及汙染,空氣汙染,"永康區大灣路1014號鍵誠紡織 空氣汙染",臺南市永康區大灣路1014號,22.999921,120.253194
UN201812250008,"2018-12-25 02:06:54",中西區,噪音舉發,妨害安寧,"中西區民族路二段76之17號2樓卡拉OK店 妨害安寧",臺南市中西區民族路二段76之17號,22.994726,120.20925
UN201812250011,"2018-12-25 03:49:59",中西區,噪音舉發,妨害安寧,"中西區開山路5號2樓卡拉OK店 妨害安寧",臺南市中西區開山路5號,22.991998,120.205692
UN201812250015,"2018-12-25 04:50:15",南區,噪音舉發,妨害安寧,"南區中華西路一段155號 妨害安寧",臺南市南區中華西路一段155號,22.981833,120.185705
UN201812250021,"2018-12-25 07:29:10",善化區,交通運輸,佔用道路,"善化區大同路213巷14號   佔用道路",臺南市善化區大同路213巷14號,23.128551,120.291052
UN201812250027,"2018-12-25 08:11:23",佳里區,騎樓舉發,騎樓舉發,"佳里區延平路80號 騎樓違停",臺南市佳里區延平路80號,23.155314,120.17948
UN201812250036,"2018-12-25 08:40:51",南區,違規停車,違規停車,"南區惠南街82號 違規停車",臺南市南區惠南街82號,22.979905,120.188213
UN201812250056,"2018-12-25 09:35:17",中西區,違規停車,違規停車,"中西區民族路二段42號、66號、35號、55-63號 違規停車",臺南市中西區民族路二段42號,22.994585,120.210894
UN201812250082,"2018-12-25 10:52:21",中西區,交通運輸,佔用道路,"中西區府連路106號    佔用道路",臺南市中西區府連路106號,22.983499,120.210492
UN201812250085,"2018-12-25 10:55:51",中西區,違規停車,違規停車,"中西區開山路52號    違規停車",臺南市開山路52到90號,22.989829,120.20686
UN201812250097,"2018-12-25 11:16:04",東區,違規停車,違規停車,"東區裕農路574號前 違規停車",臺南市東區裕農路574號,22.988367,120.234247
UN201812250123,"2018-12-25 12:25:04",中西區,違規停車,違規停車,"中西區開山路52號  違規停車",臺南市中西區開山路52號,22.991184,120.205957
UN201812250130,"2018-12-25 12:43:36",南區,髒亂及汙染,空氣汙染,"中華西路環球水泥 揚塵",臺南市南區中華西路一段59號,22.971315,120.183199
UN201812250132,"2018-12-25 12:52:06",中西區,違規停車,違規停車,"中西區衛民街90號 違規停車",臺南市中西區衛民街90號,22.993056,120.20967
UN201812250178,"2018-12-25 14:58:27",南區,違規停車,違規停車,"南區惠南街82號前   紅線違停",臺南市南區惠南街82號,22.979905,120.188213
UN201812250184,"2018-12-25 15:06:27",中西區,違規停車,違規停車,"西區衛民街106號與56號 違規停車",臺南市衛民街106號,22.993151,120.209223
UN201812250187,"2018-12-25 15:10:51",中西區,違規停車,違規停車,"中西區萬昌街151號 違規停車",臺南市台南市萬昌街151號,22.994057,120.210683
UN201812250208,"2018-12-25 16:11:58",中西區,違規停車,違規停車,"中西區西華南街47號與32號 違規停車",臺南市西華南街47號,22.994067,120.209406
UN201812250215,"2018-12-25 16:36:23",永康區,髒亂及汙染,空氣汙染,"永康區大灣路1014號 空氣汙染",臺南市永康區大灣路1014號,22.999921,120.253194
UN201812250222,"2018-12-25 16:47:12",永康區,髒亂及汙染,空氣汙染,"永康區忠孝路239巷28弄2號 空氣汙染",臺南市永康區忠孝路239巷28弄2號,23.005057,120.23919
UN201812250227,"2018-12-25 16:56:15",中西區,騎樓舉發,騎樓舉發,"中西區衛民街86號    騎樓舉發",臺南市中西區衛民街86號,22.993053,120.209735
UN201812250228,"2018-12-25 16:57:02",中西區,騎樓舉發,騎樓舉發,"中西區西華南街38號  騎樓舉發",臺南市中西區西華南街38號,22.993886,120.209524
