UN201902180009,"2019-02-18 01:55:00",永康區,噪音舉發,妨害安寧,"永康區中華一路203巷6號 妨害安寧",臺南市永康區中華一路203巷6號,23.003864,120.233574
UN201902180010,"2019-02-18 02:01:47",北區,動物救援,犬貓急難救援,"北區西華街81號 貓受傷",北區西華街81號,23.0001286,120.2105065
UN201902180019,"2019-02-18 06:58:53",永康區,髒亂及汙染,其他汙染舉發,"永康區仁愛街108巷71弄  其他汙染舉發",永康區仁愛街108巷71弄,23.0446825,120.2413584
UN201902180032,"2019-02-18 08:14:20",歸仁區,髒亂及汙染,道路散落物,"歸仁區南丁路271巷的路口的20公尺處 道路散落物",歸仁區南丁路271巷,22.9810386,120.2762948
UN201902180034,"2019-02-18 08:19:57",中西區,髒亂及汙染,道路散落物,"中西區健康路一段18號 動物屍體",中西區健康路一段18號,22.9813968,120.2114834
UN201902180054,"2019-02-18 09:05:22",中西區,違規停車,違規停車,"中西區民族路二段1號 違規停車",臺南市中西區民族路二段1號,22.994331,120.211105
UN201902180091,"2019-02-18 10:31:35",安平區,動物救援,遊蕩犬隻捕捉管制,"安平區國平南路96號 遊蕩犬隻捕捉管制",安平區國平南路96號,22.9816138,120.1676064
UN201902180095,"2019-02-18 10:35:51",安南區,髒亂及汙染,環境髒亂,"安南區宜居一街與永續路 環境髒亂",安南區宜居一街永續路,23.0171204,120.1800857
UN201902180099,"2019-02-18 10:38:58",玉井區,動物救援,犬貓急難救援,"玉井區豐里里60-1號 犬貓急難救援",玉井區豐里里60-1號,23.1288864,120.2387336
UN201902180103,"2019-02-18 10:41:20",仁德區,動物救援,遊蕩犬隻捕捉管制,"仁德區文華路三段366號 流浪犬",.仁德區文華路三段366號,22.9683992,120.242889
UN201902180110,"2019-02-18 11:03:05",北區,噪音舉發,妨害安寧,"北區林森路三段181號斜對面 妨害安寧",臺南市北區林森路三段181號,23.006539,120.223982
UN201902180138,"2019-02-18 11:44:09",柳營區,交通運輸,號誌故障,"柳營區柳營路二段59號 號誌故障",柳營區柳營路二段59號,23.2774211,120.3123203
UN201902180139,"2019-02-18 11:44:16",歸仁區,髒亂及汙染,空氣汙染,"歸仁區文化街三段307號 空氣汙染",歸仁區文化街三段307號,22.9704458,120.2798298
UN201902180142,"2019-02-18 11:56:57",安南區,動物救援,遊蕩犬隻捕捉管制,"安南區安和路一段220巷129弄 流浪狗捕捉",安南區安和路一段220巷129弄,23.0329291,120.2155222
UN201902180165,"2019-02-18 13:28:53",安南區,噪音舉發,場所連續噪音,"安南區青砂街一段572巷89號 場所連續噪音",安南區青砂街一段572巷89號,23.0747893,120.1230651
UN201902180190,"2019-02-18 14:17:42",永康區,路燈故障,9盞以下路燈故障,"永康區中山南路471巷  路燈不亮",永康區中山南路471巷,23.0241005,120.2495742
UN201902180191,"2019-02-18 14:18:13",東區,路燈故障,9盞以下路燈故障,"東區中華東路二段243巷72弄9號 路燈故障",東區中華東路二段243巷72弄9號,22.9826861,120.2336725
UN201902180201,"2019-02-18 14:39:28",安平區,民生管線,電信孔蓋鬆動、電信線路掉落、電信桿傾倒,"安平區永華路二段551號 民生管線",安平區永華路二段551號,22.9899912,120.1774505
UN201902180221,"2019-02-18 15:20:38",中西區,髒亂及汙染,其他汙染舉發,"中西區海安路二段&民權路三段口 垃圾未清",中西區海安路二段民權路三段,22.9968325,120.1972877
UN201902180225,"2019-02-18 15:26:22",六甲區,髒亂及汙染,道路散落物,"六甲區和平街204號  狗屍體",六甲區和平街204號,23.2265713,120.3424727
UN201902180254,"2019-02-18 16:56:00",中西區,違規停車,違規停車,"中西區萬昌街151號 違規停車",臺南市中西區萬昌街151號,22.994057,120.210683
UN201902180269,"2019-02-18 17:20:50",後壁區,道路維修,路面坑洞,"後壁區土溝里92之1號旁 路面坑洞",後壁區土溝里92之1號,23.3537687,120.3320868
UN201902180272,"2019-02-18 17:25:55",仁德區,髒亂及汙染,空氣汙染,"仁德區保學路 空氣汙染",仁德區保學路,22.919843,120.2354183
UN201902180278,"2019-02-18 17:31:53",中西區,路燈故障,9盞以下路燈故障,"中西區西賢街98號門路, 路燈故障",中西區西賢街98號,23.0014952,120.1789208
UN201902180294,"2019-02-18 18:16:52",永康區,違規停車,違規停車,"永康區八德街140巷2弄口 違規停車",永康區八德街140巷2弄口,23.037094,120.258359
UN201902180300,"2019-02-18 18:24:28",中西區,違規停車,違規停車,"中西區民族路二段42-48號，47號 違規停車",臺南市中西區民族路二段42號,22.994585,120.210894
UN201902180305,"2019-02-18 18:33:10",南區,路燈故障,9盞以下路燈故障,"南區明興路887號對面 路燈故障",南區明興路887號,22.9343159,120.1820203
UN201902180309,"2019-02-18 18:51:39",安南區,噪音舉發,妨害安寧,"安南區台江大道三段600號 妨害安寧",安南區台江大道三段600號,23.0639886,120.1630074
UN201902180310,"2019-02-18 18:52:06",六甲區,髒亂及汙染,道路散落物,"六甲區林鳳營111-8號 道路散落物(狗屍)",六甲區林鳳營111之8號,23.2443334,120.3151239
UN201902180311,"2019-02-18 18:57:24",安平區,路燈故障,9盞以下路燈故障,"安平區怡平路475號 路燈故障",安平區怡平路475號,22.9938244,120.1729471
UN201902180313,"2019-02-18 19:02:28",安南區,路燈故障,9盞以下路燈故障,"安南區安中路一段622巷88弄30號 路燈故障",安南區安中路一段622巷88弄30號,23.0420252,120.1999727
UN201902180321,"2019-02-18 19:19:09",北區,噪音舉發,場所連續噪音,"北區公園路569巷33號 施工噪音",北區公園路569巷33號,23.0105148,120.2106313
UN201902180326,"2019-02-18 19:26:30",下營區,路燈故障,9盞以下路燈故障,"下營區中山路一段水利會 路燈故障",下營區中山路一段水利會,23.2379776,120.2682473
UN201902180331,"2019-02-18 19:43:29",善化區,髒亂及汙染,道路散落物,"善化區興華路265號 路面散落物",善化區興華路265號,23.1269504,120.2959632
UN201902180333,"2019-02-18 19:49:33",新市區,路燈故障,9盞以下路燈故障,"新市區仁愛街160之1號 路燈故障",新市區仁愛街160之1號,23.0740954,120.2932071
UN201902180336,"2019-02-18 19:51:31",中西區,路燈故障,9盞以下路燈故障,"中西區湖美二街26巷與32巷中間/中西區和緯路五段89巷*中華西路二段851巷 路燈故障",中西區湖美二街26巷,23.0002308,120.1822792
UN201902180340,"2019-02-18 19:58:48",安平區,違規停車,違規停車,"安平區慶平路499號轉角紅線處 違規停車",臺南市安平區慶平路499號,22.997011,120.172911
UN201902180343,"2019-02-18 20:03:18",安南區,路燈故障,9盞以下路燈故障,"安南區總安街一段146巷118弄9號 路燈故障",安南區總安街一段146巷118弄9號,23.0536433,120.2156461
UN201902180348,"2019-02-18 20:19:50",安平區,違規停車,違規停車,"安平區安平路372號周遭 違規停車",臺南市安平區安平路372號,22.998317,120.175777
UN201902180351,"2019-02-18 20:32:28",南區,路燈故障,9盞以下路燈故障,"南區西門路一段56號 路燈故障",南區西門路一段56號,22.9697315,120.1975687
UN201902180352,"2019-02-18 20:35:08",北區,髒亂及汙染,道路散落物,北區小東路往西近勝利路,北區小東路*勝利路,23.0009893,120.2185587
UN201902180353,"2019-02-18 20:39:18",仁德區,路燈故障,10盞以上路燈故障,"仁德區德善路270號到400號 10盞以上路燈故障",仁德區德善路270號到400號,22.9465759,120.2582718
UN201902180354,"2019-02-18 20:48:38",麻豆區,髒亂及汙染,空氣汙染,"麻豆區北勢里太子宅16-2號 空氣汙染",麻豆區北勢里太子宅16之2號,23.1934625,120.2500606
UN201902180365,"2019-02-18 21:43:40",新化區,髒亂及汙染,市區道路路面油漬,"新化區中興路與護安街 路面油漬",新化區中興路護安街,23.0345631,120.3096007
UN201902180366,"2019-02-18 21:47:18",安南區,違規停車,違規停車,"安南區仁安四街和功安二街路口 違規停車",安南區仁安四街和功安二街路口,23.0499081,120.1806616
UN201902180369,"2019-02-18 22:01:09",南區,噪音舉發,場所連續噪音,"南區新興路261號,妨害安寧",南區新興路261號,22.9764305,120.1928561
UN201902180372,"2019-02-18 22:49:25",北區,違規停車,違規停車,"北區文賢一路23巷20號 違規停車",北區文賢一路23巷20號,23.0044633,120.1956527
UN201902180375,"2019-02-18 22:59:28",仁德區,髒亂及汙染,空氣汙染,髒亂及汙染,仁德區田厝一街,22.9403644,120.2442151
UN201902180376,"2019-02-18 23:01:54",安南區,噪音舉發,妨害安寧,"安南區安和路五段250號 妨害安寧",安南區安和路五段250號,23.0676269,120.2170785
UN201902180378,"2019-02-18 23:28:56",鹽水區,噪音舉發,妨害安寧,"鹽水區鹽水國中 妨害安寧",鹽水區鹽水國中,23.3227,120.271058
UN201902180379,"2019-02-18 23:37:32",安平區,噪音舉發,妨害安寧,"安平區慶平路88號 妨害安寧",安平區慶平路88號,22.9971518,120.181982
UN201902190001,"2019-02-19 00:04:55",永康區,髒亂及汙染,空氣汙染,"永康區龍橋街425號 空氣汙染",永康區龍橋街425號,23.0430731,120.262388
UN201902190011,"2019-02-19 05:58:58",永康區,髒亂及汙染,空氣汙染,"永康區大灣路1014號 空氣汙染",永康區大灣路1014號,22.9998521,120.2530293
UN201902190028,"2019-02-19 08:14:08",歸仁區,交通運輸,號誌故障,"歸仁區歸仁大道與歸仁十三路口  號誌燈故障",歸仁區歸仁大道歸仁十三路,22.9230276,120.2874919
UN201902190038,"2019-02-19 08:35:26",中西區,噪音舉發,妨害安寧,"中西區開山路152號  妨害安寧",臺南市中西區開山路152號,22.987814,120.207628
UN201902190040,"2019-02-19 08:42:17",北區,噪音舉發,場所連續噪音,"北區成功路86號   音響噪音",北區成功路86號,22.9983895,120.2062615
UN201902190043,"2019-02-19 08:47:16",安南區,違規停車,違規停車,"安南區同安路235號    違規停車",臺南市安南區同安路235號,23.042496,120.192062
UN201902190061,"2019-02-19 09:17:31",永康區,動物救援,遊蕩犬隻捕捉管制,"永康區永二街267號 流浪犬",永康區永二街267號,23.0164055,120.2511749
UN201902190064,"2019-02-19 09:19:31",北區,噪音舉發,妨害安寧,"北區成功路86號 噪音",臺南市北區成功路86號,22.998548,120.206247
UN201902190065,"2019-02-19 09:20:34",東區,違規停車,違規停車,"東區中華東路三段79號 違規停車",臺南市東區中華東路三段79號,22.979161,120.227949
UN201902190076,"2019-02-19 10:06:28",安平區,髒亂及汙染,空氣汙染,"安平區延平街70巷附近 空氣汙染",安平區延平街70巷,23.0007991,120.1633172
UN201902190079,"2019-02-19 10:23:07",南區,髒亂及汙染,道路散落物,"南區新和東路51號 道路散落物",南區新和東路51號,22.9673594,120.1858848
UN201902190080,"2019-02-19 10:23:14",中西區,違規停車,違規停車,"中西區西門路二段395號   違規停車",臺南市中西區西門路二段395號,22.998748,120.200514
UN201902190086,"2019-02-19 10:32:43",永康區,髒亂及汙染,其他汙染舉發,"永康區大灣路1014號 空氣污染",永康區大灣路1014號,22.9998521,120.2530293
UN201902190091,"2019-02-19 10:43:19",新營區,路燈故障,9盞以下路燈故障,"新營區文昌街26號之1 路燈故障",新營區文昌街26號之1,23.3063845,120.3195315
UN201902190105,"2019-02-19 11:09:50",安南區,髒亂及汙染,空氣汙染,"安南區工業一路85號 髒亂及汙染",安南區工業一路85號,23.0454433,120.1492168
UN201902190111,"2019-02-19 11:19:46",安南區,髒亂及汙染,環境髒亂,"安南區府安路五段鹽水溪橋到北安路 環境髒亂",安南區府安路五段鹽水溪橋,23.0202025,120.1924856
UN201902190115,"2019-02-19 11:28:35",永康區,髒亂及汙染,道路散落物,"永康區中正路970巷    道路散落物",永康區中正路970巷,23.0408337,120.2386645
UN201902190125,"2019-02-19 11:56:01",新營區,髒亂及汙染,空氣汙染,"新營區八德路2號 空污",新營區八德路2號,23.3035467,120.2855104
UN201902190132,"2019-02-19 12:16:46",中西區,髒亂及汙染,環境髒亂,"中西區友愛東街15號,環境髒亂",中西區友愛東街15號,22.991806,120.2072299
UN201902190146,"2019-02-19 13:33:28",柳營區,髒亂及汙染,空氣汙染,"柳營區工一路環東路 空氣汙染",柳營區工一路環東路,23.2823382,120.3626532
UN201902190154,"2019-02-19 13:50:27",南區,交通運輸,號誌故障,"南區新興路利南街 號誌燈故障",南區新興路利南街,22.9748719,120.1875712
UN201902190156,"2019-02-19 13:53:56",中西區,髒亂及汙染,小廣告、旗幟,"中西區西賢二街與西賢一街137巷口    髒亂及汙染",中西區西賢二街西賢一街137巷,23.0027115,120.1763983
UN201902190161,"2019-02-19 14:08:34",仁德區,交通運輸,佔用道路,"麻豆區中華街8號 佔用道路",麻豆區中華街8號,23.1841995,120.247086
UN201902190171,"2019-02-19 14:57:09",官田區,動物救援,遊蕩犬隻捕捉管制,"官田區度頭里新中118號 捕犬",官田區度頭里新中118號,23.15926,120.340117
UN201902190191,"2019-02-19 15:38:20",安平區,違規停車,違規停車,"安平區古堡街62號    紅線違停",臺南市安平區古堡街62號,23.002231,120.161404
UN201902190192,"2019-02-19 15:39:03",永康區,違規停車,違規停車,"永康區六合路42巷50號。巷口  違規停車",臺南市永康區六合路42巷50號,23.009208,120.232462
UN201902190209,"2019-02-19 16:32:57",新營區,髒亂及汙染,市區道路路面油漬,"新營區中正路新營高工 路面油漬",新營區中正路新營高工,23.3132992,120.3174744
UN201902190230,"2019-02-19 17:13:51",佳里區,髒亂及汙染,空氣汙染,"佳里區安南路280號 空氣汙染",佳里區安南路280號,23.1521779,120.1736039
UN201902190233,"2019-02-19 17:27:43",安平區,噪音舉發,妨礙安寧,"安平區安平路183號的隔壁  妨礙安寧",臺南市安平區安平路183號,23.000094,120.160815
UN201902190239,"2019-02-19 18:01:49",北區,違規停車,違規停車,"北區成功路48號 違規停車",臺南市北區成功路48號,22.998048,120.207852
UN201902190252,"2019-02-19 18:48:08",安平區,違規停車,違規停車,"安平區華平路育平九街 違規停車",安平區華平路育平九街,22.9946942,120.1756118
UN201902190253,"2019-02-19 18:52:16",東區,噪音舉發,妨礙安寧,"東區東興路17號  妨礙安寧",臺南市東區東興路17號,22.9905,120.228521
UN201902190258,"2019-02-19 19:16:46",善化區,髒亂及汙染,道路散落物,"善化區中正路2號田園別莊MOTEL,貓屍",善化區中正路2號田園別莊MOTEL,23.1184676,120.2945968
UN201902190259,"2019-02-19 19:31:53",東區,路燈故障,9盞以下路燈故障,"東區崇明路606號  路燈故障",東區崇明路606號,22.9725165,120.2250091
UN201902190267,"2019-02-19 19:52:26",安南區,路燈故障,9盞以下路燈故障,"安南區海佃路一段284巷27號 路燈故障",安南區海佃路一段284巷27號,23.0266947,120.1923327
UN201902190271,"2019-02-19 20:07:12",中西區,路燈故障,9盞以下路燈故障,"中西區金城街與府前一街交接口,府前一街上有四盞路燈",中西區金城街府前一街,22.9928742,120.1886977
UN201902190274,"2019-02-19 20:28:56",南區,動物救援,犬貓急難救援,"南區大林路111巷4弄旁小公園 犬貓急難救援",南區大林路111巷4弄,22.9746959,120.2115208
UN201902190275,"2019-02-19 20:31:39",安平區,違規停車,違規停車,"安平區安平路370號左側邊 違規停車",臺南市安平區安平路370號,22.998341,120.176132
UN201902190281,"2019-02-19 21:19:51",永康區,髒亂及汙染,空氣汙染,"永康區洲尾街335巷附近 空氣汙染",永康區洲尾街335巷,23.0421441,120.2304249
UN201902190282,"2019-02-19 21:22:34",北區,路燈故障,9盞以下路燈故障,"北區公園路1092巷30弄10號旁 路燈故障",北區公園路1092巷30弄10號,23.0188944,120.2172063
UN201902190288,"2019-02-19 21:53:32",麻豆區,動物救援,犬貓急難救援,"麻豆區新生南路218巷107號 犬貓急難救援",麻豆區新生南路218巷107號,23.1799645,120.2405775
UN201902190289,"2019-02-19 22:04:27",安南區,噪音舉發,妨害安寧,"安南區公學路四段二巷 妨害安寧",安南區公學路四段二巷,23.0704318,120.1807639
UN201902190291,"2019-02-19 22:07:54",北區,噪音舉發,場所連續噪音,"北區文賢路112巷107弄 場所連續噪音",北區文賢路112巷107弄,23.0015392,120.1945979
UN201902190292,"2019-02-19 22:09:23",永康區,噪音舉發,妨害安寧,"永康區中山北路164巷78弄5號之一 妨害安寧",永康區中山北路164巷78弄5號之一,23.0264843,120.2627806
UN201902190293,"2019-02-19 22:20:17",安南區,噪音舉發,妨害安寧,"安南區北安路二段520、526號 妨害安寧",安南區北安路二段520、526號,23.0369045,120.2031173
UN201902190294,"2019-02-19 22:28:26",歸仁區,噪音舉發,妨害安寧,"歸仁區六甲里六甲一街42號 妨害安寧",歸仁區六甲里六甲一街42號,22.9516869,120.2768395
UN201902190295,"2019-02-19 22:29:40",安平區,違規停車,違規停車,"安平區國平路與國平路552巷 違規停車",國平路552巷口,22.9965088,120.1730064
UN201902190297,"2019-02-19 22:38:04",佳里區,髒亂及汙染,空氣汙染,"佳里區佳化里3-3號 空氣汙染",佳里區佳化里3-3號,23.188872,120.192559
UN201902190302,"2019-02-19 23:16:58",歸仁區,噪音舉發,場所連續噪音,"歸仁區凱旋路二段211巷 場所連續噪音",凱旋路二段211巷,22.952546,120.288751
UN201902190303,"2019-02-19 23:30:08",永康區,違規停車,違規停車,"永康區新民街16巷1弄 違規停車",新民街16巷1弄,23.0407726,120.2425224
UN201902200058,"2019-02-20 09:45:14",中西區,違規停車,違規停車,"中西區西華南街68號     違規停車",臺南市中西區西華南街68號,22.994221,120.209598
UN201902200063,"2019-02-20 10:01:02",仁德區,動物救援,遊蕩犬隻捕捉管制,"仁德區文華路三段366號    流浪犬",臺南市仁德區文華路三段366號,22.968409,120.242971
UN201902200091,"2019-02-20 11:07:12",東區,違規停車,違規停車,"東區仁和路55號  違規停車",臺南市東區仁和路55號,22.971868,120.236382
UN201902200120,"2019-02-20 12:19:28",中西區,違規停車,違規停車,"中西區開山路58號 違規停車",臺南市中西區開山路58號,22.990612,120.206336
UN201902200128,"2019-02-20 12:50:49",安平區,違規停車,違規停車,"安平區郡平路174號 違規停車",臺南市安平區郡平路174號,22.989264,120.167871
UN201902200134,"2019-02-20 13:13:54",南區,噪音舉發,場所連續噪音,"南區健康路一段133巷40號 噪音舉發",臺南市南區健康路一段133巷40號,22.979748,120.208789
UN201902200142,"2019-02-20 13:35:59",安南區,髒亂及汙染,空氣汙染,"安南區工業一路85號 髒亂及汙染",臺南市安南區工業一路85號,23.047633,120.145944
UN201902200193,"2019-02-20 15:46:01",永康區,髒亂及汙染,空氣汙染,"永康區大灣路1014號    空氣汙染",臺南市永康區大灣路1014號,22.999921,120.253194
