UN201903180002,"2019-03-18 00:40:06",永康區,髒亂及汙染,空氣汙染,"永康區中山南路5號 空氣汙染 食安、畫紅線",永康區中山南路5號,23.0132631,120.232296
UN201903180003,"2019-03-18 00:43:31",永康區,違規停車,違規停車,"永康區中山南路5號 違規停車",臺南市永康區中山南路5號,23.011514,120.226246
UN201903180005,"2019-03-18 00:52:24",北區,噪音舉發,場所連續噪音,"北區成功路2號 場所連續噪音",臺南市北區成功路2號,22.997791,120.211428
UN201903180008,"2019-03-18 01:01:06",麻豆區,噪音舉發,妨害安寧,麻豆區中正路53號妨害安寧,臺南市麻豆區中正路53號,23.185109,120.248724
UN201903180012,"2019-03-18 03:14:44",仁德區,動物救援,犬貓急難救援,"仁德區仁德三街 犬貓急難救援",仁德區仁德三街,22.9683855,120.2513863
UN201903180015,"2019-03-18 05:56:29",新化區,髒亂及汙染,空氣汙染,"新化區竹仔腳路 空氣汙染",新化區竹仔腳路,23.0196077,120.3003327
UN201903180016,"2019-03-18 06:05:04",永康區,髒亂及汙染,空氣汙染,"永康區大灣路1014號 空氣汙染",永康區大灣路1014號,22.9998521,120.2530293
UN201903180019,"2019-03-18 07:14:14",後壁區,交通運輸,號誌故障,"後壁區南80與省道 號誌故障",後壁區南80,23.3587352,120.3160817
UN201903180042,"2019-03-18 08:46:47",北區,路燈故障,9盞以下路燈故障,"北區康樂街499號後方 路燈不亮",北區康樂街499號,23.0026437,120.1979934
UN201903180059,"2019-03-18 09:11:52",永康區,違規停車,違規停車,"永康區中華路58巷52號  違規停車",臺南市永康區中華路58巷52號,23.001829,120.237398
UN201903180069,"2019-03-18 09:26:23",安南區,路燈故障,9盞以下路燈故障,"安南區郡安路三段50號 路燈故障",安南區郡安路三段50號,23.0295886,120.2152532
UN201903180080,"2019-03-18 09:45:40",安平區,民生管線,漏水、停水、消防栓漏水或損壞,"安平區育平九街372巷88號對面空地 冒水",安平區育平九街372巷88號,22.994896,120.1669995
UN201903180084,"2019-03-18 09:49:53",永康區,交通運輸,號誌故障,"永康區正南一街與105巷口 號誌故障",永康區正南一街與105巷,23.0245914,120.2288615
UN201903180086,"2019-03-18 09:53:59",北區,動物救援,遊蕩犬隻捕捉管制,"北區台南公園  遊蕩犬隻捕捉",北區台南公園,23.0024696,120.2116084
UN201903180099,"2019-03-18 10:15:51",東區,路燈故障,9盞以下路燈故障,"東區光華街119巷15號  路燈故障",東區光華街119巷15號,22.9848089,120.2173734
UN201903180101,"2019-03-18 10:20:50",南區,道路維修,路面坑洞,"南區永成路三段101正對面 道路維修",南區永成路三段101號,22.965176,120.195307
UN201903180107,"2019-03-18 10:25:55",北區,民生管線,電信孔蓋鬆動、電信線路掉落、電信桿傾倒,"北區大武街348號 中華電信孔蓋鬆動",北區大武街348號,23.0168691,120.2176429
UN201903180108,"2019-03-18 10:26:56",東區,違規停車,違規停車,"東區中華東路二段185巷6號 違規停車",臺南市東區中華東路二段185巷6號,22.984563,120.232836
UN201903180113,"2019-03-18 10:36:46",中西區,民生管線,漏水、停水、消防栓漏水或損壞,"中西區府前路與忠義路口 民生管線",中西區府前路,22.9891387,120.2040586
UN201903180138,"2019-03-18 11:20:34",仁德區,民生管線,漏水、停水、消防栓漏水或損壞,"仁德區二空路65號 消防栓漏水",仁德區二空路65號,22.958628,120.2232425
UN201903180139,"2019-03-18 11:21:24",麻豆區,動物救援,犬貓急難救援,"麻豆區埤頭里苓子林20號，麻豆新樓醫院對面公車站後方 狗受困",麻豆區埤頭里苓子林20號,23.1802047,120.2327989
UN201903180158,"2019-03-18 12:00:27",北區,違規停車,違規停車,"北區海安路三段572號 違規停車",臺南市北區海安路三段572號,23.011998,120.200802
UN201903180171,"2019-03-18 12:34:44",六甲區,動物救援,犬貓急難救援,"六甲區四維街二巷內 犬貓急難救援",六甲區四維街二巷,23.2321681,120.3543868
UN201903180178,"2019-03-18 13:03:36",中西區,違規停車,違規停車,"中西區民族路二段121號 違規停車",臺南市中西區民族路二段121號,22.994805,120.20804
UN201903180181,"2019-03-18 13:09:43",東區,動物救援,遊蕩犬隻捕捉管制,"東區大同路二段765號 流浪犬捕捉'",東區大同路二段765號,22.966064,120.216643
UN201903180189,"2019-03-18 13:17:45",中西區,違規停車,違規停車,"中西區民族路二段123號 違規停車",臺南市中西區民族路二段123號,22.994818,120.20799
UN201903180193,"2019-03-18 13:28:07",南區,路燈故障,9盞以下路燈故障,"南區灣裡路400巷33號 路燈故障",南區灣裡路400巷33號,22.9243182,120.1815179
UN201903180202,"2019-03-18 13:49:24",安平區,民生管線,漏水、停水、消防栓漏水或損壞,"安平區健康二街64號 民生管線",安平區健康二街64號,22.9854847,120.1728449
UN201903180204,"2019-03-18 13:50:10",仁德區,道路維修,寬頻管線、孔蓋損壞,"仁德區中正路二段840號 孔蓋鬆動",仁德區中正路二段840號,22.9636174,120.253589
UN201903180206,"2019-03-18 13:51:31",東區,動物救援,遊蕩犬隻捕捉管制,"東區長榮路二段24巷 流浪狗",東區長榮路二段24巷,22.9872611,120.2191274
UN201903180210,"2019-03-18 14:06:26",永康區,騎樓舉發,騎樓舉發,"永康區小東路483號  騎樓舉發",臺南市永康區小東路483號,22.998716,120.235441
UN201903180226,"2019-03-18 14:31:41",新營區,髒亂及汙染,空氣汙染,"新營區民治路跟健康路口 空氣汙染/噪音",新營區民治路健康路,23.3105788,120.3123667
UN201903180235,"2019-03-18 15:03:20",北區,髒亂及汙染,環境髒亂,"北區育德一街凱德公園，愛麗絲幼兒園對面轉角處，石頭標示前人行道邊 環境髒亂",北區育德一街凱德公園,23.0159919,120.2050041
UN201903180241,"2019-03-18 15:17:23",北區,動物救援,犬貓急難救援,"北區海安路三段338巷102號對面 犬救援",北區海安路三段338巷102號,23.0089531,120.2021321
UN201903180248,"2019-03-18 15:28:24",中西區,違規停車,違規停車,"中西區民生路二段279號與307號 違停",臺南市中西區民生路二段279號,22.996558,120.191812
UN201903180257,"2019-03-18 15:46:05",東區,交通運輸,號誌故障,"東區大同路二段樹林街一段 號誌故障",東區大同路二段樹林街一段,22.9778509,120.2137615
UN201903180259,"2019-03-18 15:49:00",中西區,道路維修,路面掏空、塌陷,"中西區南門路229號前 路面掏空",臺南市中西區南門路229號,22.983707,120.204128
UN201903180262,"2019-03-18 16:01:31",東區,違規停車,違規停車,"東區中華東路二段185巷6號對面 違規停車",臺南市東區中華東路二段185巷6號,22.984563,120.232836
UN201903180270,"2019-03-18 16:09:37",永康區,噪音舉發,場所連續噪音,"永康區中正路970巷27號 場所連續噪音",永康區中正路970巷27號,23.0411701,120.2393354
UN201903180294,"2019-03-18 17:24:33",安南區,動物救援,犬貓急難救援,"安南區安明路一段 狗受困",安南區安明路一段,23.0169777,120.1796707
UN201903180301,"2019-03-18 17:50:56",安平區,動物救援,遊蕩犬隻捕捉管制,"安平區四鯤鯓碼頭管制站 狗",安平區四鯤鯓碼頭管制站,22.9674101,120.1656514
UN201903180305,"2019-03-18 18:00:31",善化區,動物救援,遊蕩犬隻捕捉管制,"善化區復興街121巷 遊蕩犬隻捕捉管制",善化區復興街121巷,23.1312165,120.2854897
UN201903180306,"2019-03-18 18:05:28",永康區,髒亂及汙染,空氣汙染,"永康區大灣路1014號 空氣污染",永康區大灣路1014號,22.9998521,120.2530293
UN201903180308,"2019-03-18 18:09:49",麻豆區,髒亂及汙染,環境髒亂,"麻豆區新生南路577巷38號 環境髒亂",麻豆區新生南路577巷38號,23.17686,120.251215
UN201903180315,"2019-03-18 18:26:43",善化區,路燈故障,9盞以下路燈故障,"善化區中正路537巷25號 路燈故障",善化區中正路537巷25號,23.1330816,120.2933571
UN201903180318,"2019-03-18 18:31:19",中西區,違規停車,違規停車,"中西區民族路二段42號 違規停車",臺南市民族路二段42號,22.994585,120.210894
UN201903180319,"2019-03-18 18:32:21",中西區,違規停車,違規停車,"中西區西華南街38號 違規停車",臺南市西華南街38號,22.993886,120.209524
UN201903180320,"2019-03-18 18:32:42",新營區,路燈故障,10盞以上路燈故障,"新營區新北街 路燈故障",新營區新北街,23.3111323,120.3026995
UN201903180321,"2019-03-18 18:33:17",中西區,違規停車,違規停車,"中西區衛民街118號 違規停車",臺南市衛民街118號,22.993313,120.208313
UN201903180322,"2019-03-18 18:34:48",中西區,違規停車,違規停車,"中西區中山路2號到100號與1號到107號 違規停車",臺南市中山路2號,23.234637,120.26121
UN201903180329,"2019-03-18 18:39:52",安南區,動物救援,犬貓急難救援,"安南區培安四街北安路三段 貓受傷",安南區培安四街北安路三段,23.0496162,120.2129137
UN201903180330,"2019-03-18 18:41:51",安南區,路燈故障,9盞以下路燈故障,"安南區海環街256巷及海中街71巷 路燈不亮",安南區海環街256巷及海中街71巷,23.0397538,120.184352
UN201903180333,"2019-03-18 18:46:42",北區,路燈故障,9盞以下路燈故障,"北區民德路95巷臨安路二段249巷 路燈故障",北區民德路95巷臨安路二段249巷,23.0050814,120.2006324
UN201903180335,"2019-03-18 18:51:08",官田區,髒亂及汙染,道路散落物,"官田區官田里官田281號 道路散落物",官田區官田里官田281號,23.188952,120.340108
UN201903180338,"2019-03-18 18:56:40",安南區,道路維修,路面坑洞,"安南區怡安路培安路 路面下陷",安南區怡安路培安路,23.0407885,120.2124326
UN201903180342,"2019-03-18 19:04:17",後壁區,路燈故障,10盞以上路燈故障,"後壁區台一線 路燈故障",後壁區台一線,23.3647651,120.3606723
UN201903180345,"2019-03-18 19:19:32",中西區,違規停車,違規停車,"中西區衛民街83號 違規停車",臺南市中西區衛民街83號,22.992855,120.209435
UN201903180346,"2019-03-18 19:20:28",中西區,違規停車,違規停車,"中西區西華南街2號 違規停車",臺南市中西區西華南街2號,22.993195,120.20943
UN201903180349,"2019-03-18 19:31:20",安南區,路燈故障,9盞以下路燈故障,"安南區海中街54巷內 路燈不亮",安南區海中街54巷,23.0402089,120.1859933
UN201903180351,"2019-03-18 19:35:38",東區,髒亂及汙染,道路散落物,"東區自由路二段256號 道路散落物",東區自由路二段256號,22.9753388,120.2374742
UN201903180354,"2019-03-18 19:43:15",東區,路燈故障,9盞以下路燈故障,"東區林森路一段395號，國泰銀行前，分隔島上第一柱 路燈故障",東區林森路一段395號,22.9854815,120.2215695
UN201903180357,"2019-03-18 19:54:01",中西區,違規停車,違規停車,"中西區北門路一段155號到標檢局 違停",臺南市中西區北門路一段155號,22.995677,120.211677
UN201903180359,"2019-03-18 19:55:41",永康區,交通運輸,佔用道路,"永康區中山南路5號 佔用道路",臺南市永康區中山南路5號,23.011514,120.226246
UN201903180362,"2019-03-18 20:05:07",東區,違規停車,違規停車,"東區裕農路446巷6號 違規停車",裕農路446巷6號,22.987869,120.2316539
UN201903180366,"2019-03-18 20:18:05",新化區,髒亂及汙染,空氣汙染,"新化區中山路12號旁 空氣污染",新化區中山路12號,23.054245,120.3229681
UN201903180373,"2019-03-18 20:52:50",安南區,違規停車,違規停車,"安南區安富街361號 違規停車",安南區安富街361號,23.0259273,120.1929044
UN201903180375,"2019-03-18 20:59:59",東區,違規停車,違規停車,"東區東門路三段226巷轉228巷 違停",東區東門路三段226巷,22.9767221,120.2345396
UN201903180376,"2019-03-18 21:00:56",中西區,騎樓舉發,騎樓舉發,"中西區衛民街139到123號 騎樓舉發",臺南市中西區衛民街123號,22.993229,120.207877
UN201903180378,"2019-03-18 21:06:20",永康區,路燈故障,10盞以上路燈故障,"永康區中正路393號前 路燈不亮＆安全防護",永康區中正路393號,23.0358474,120.242942
UN201903180379,"2019-03-18 21:06:39",永康區,髒亂及汙染,空氣汙染,"永康區中山南路5號 空氣汙染",永康區中山南路5號,23.0132631,120.232296
UN201903180383,"2019-03-18 21:22:49",中西區,違規停車,違規停車,"中西區中正路271巷 違規停車",中西區中正路271巷,22.9931073,120.1963781
UN201903180384,"2019-03-18 21:24:42",官田區,髒亂及汙染,空氣汙染,"官田區中山路二段68巷與58巷一帶 空氣汙染",官田區中山路二段68巷,23.1945682,120.3066864
UN201903180387,"2019-03-18 21:43:21",安平區,動物救援,遊蕩犬隻捕捉管制,"安平區世平四街 遊蕩犬隻捕捉管制",安平區世平四街,22.9964781,120.1503205
UN201903180388,"2019-03-18 21:51:38",官田區,髒亂及汙染,空氣汙染,"官田區中山路二段131號附近 空氣汙染",官田區中山路二段131號,23.1953775,120.3039476
UN201903180389,"2019-03-18 22:02:13",永康區,違規停車,違規停車,"永康區中華路58巷52號 違規停車",中華路58巷52號,23.0018866,120.2363198
UN201903180398,"2019-03-18 22:55:52",安南區,噪音舉發,妨害安寧,"安南區安和路五段250號 妨害安寧",安南區安和路五段250號,23.0676269,120.2170785
UN201903180403,"2019-03-18 23:39:01",中西區,噪音舉發,妨害安寧,"中西區永華路一段250巷8號  妨害安寧",中西區永華路一段250巷8號,22.9889208,120.1906756
UN201903190001,"2019-03-19 00:12:10",新市區,髒亂及汙染,空氣汙染,"新市區新和里富中街277號 空氣汙染",新市區新和里富中街277號,23.0818425,120.2912738
UN201903190002,"2019-03-19 00:34:57",永康區,髒亂及汙染,空氣汙染,"永康區大灣路1014號 空氣汙染",永康區大灣路1014號,22.9998521,120.2530293
UN201903190013,"2019-03-19 05:06:38",永康區,動物救援,遊蕩犬隻捕捉管制,"永康區中華二路133號 遊蕩犬隻捕捉管制",永康區中華二路133號,23.008392,120.239016
UN201903190016,"2019-03-19 05:41:43",永康區,髒亂及汙染,空氣汙染,"永康區大灣路1014號 空氣汙染",永康區大灣路1014號,22.9998521,120.2530293
UN201903190021,"2019-03-19 07:13:01",中西區,路燈故障,9盞以下路燈故障,"中西區民族路    路燈故障",中西區民族路赤崁東街,22.9966232,120.2031681
UN201903190038,"2019-03-19 08:14:48",南區,違規停車,違規停車,"南區府緯街132號  紅線違停",臺南市南區府緯街132號,22.983976,120.195795
UN201903190042,"2019-03-19 08:24:51",北區,動物救援,犬貓急難救援,"北區北安路與中華北路二段     犬隻受傷",北區北安路中華北路二段,23.021873,120.2055997
UN201903190045,"2019-03-19 08:35:49",東區,髒亂及汙染,空氣汙染,"東區崇善七街38號  噪音/空氣汙染",東區崇善七街38號,22.9726294,120.2307738
UN201903190052,"2019-03-19 08:48:54",東區,噪音舉發,場所連續噪音,"東區崇善七街38號 噪音",東區崇善七街38號,22.9726294,120.2307738
UN201903190065,"2019-03-19 09:28:39",永康區,噪音舉發,妨害安寧,"永康區復興路33巷10弄附近 噪音舉發",台南市永康區復興路33巷10弄,22.998224,120.2493107
UN201903190068,"2019-03-19 09:31:23",北區,道路維修,路面下陷、凹陷,"北區開元路333巷10弄 路面凹陷",北區開元路333巷10弄,23.0084908,120.2194899
UN201903190091,"2019-03-19 10:16:03",安南區,髒亂及汙染,空氣汙染,"安南區公學路五段656巷 空氣汙染",安南區公學路五段656巷,23.0797162,120.1610104
UN201903190108,"2019-03-19 10:46:21",安平區,髒亂及汙染,環境髒亂,"安平區永華九街55號 垃圾清理",臺南市安平區永華九街55號,22.990792,120.170123
UN201903190109,"2019-03-19 10:47:07",北區,道路維修,路面坑洞,"北區北成路212號  路面凹陷",臺南市北區北成路212號,23.020646,120.206563
UN201903190132,"2019-03-19 11:47:07",永康區,髒亂及汙染,空氣汙染,"永康區大灣路1014號 空污",永康區大灣路1014號,22.9998521,120.2530293
UN201903190152,"2019-03-19 12:19:20",南區,交通運輸,佔用道路,"南區金華路一段352巷133號 佔用道路",臺南市南區金華路一段352巷133號,22.96842,120.193609
UN201903190161,"2019-03-19 12:45:51",中西區,違規停車,違規停車,"中西區開山路52到90號及對面75到85號  違規停車",臺南市中西區開山路52號,22.991184,120.205957
UN201903190165,"2019-03-19 12:53:25",中西區,騎樓舉發,騎樓舉發,"中西區環河街102號 佔用騎樓",臺南市中西區環河街102號,22.995335,120.192699
UN201903190166,"2019-03-19 12:53:27",永康區,髒亂及汙染,空氣汙染,"永康區永春街20巷21號   空氣汙染",永康區永春街20巷21號,23.0166279,120.2568402
UN201903190167,"2019-03-19 12:59:20",南區,髒亂及汙染,空氣汙染,"南區中華西路一段39號   空氣汙染",臺南市南區中華西路一段39號,22.968177,120.182945
UN201903190169,"2019-03-19 13:08:06",新營區,違規停車,違規停車,"新營區大智街1號   違規停車",臺南市新營區大智街1號,23.31493,120.317199
UN201903190170,"2019-03-19 13:08:37",東區,道路維修,,"東區東門路一段202號   寬頻孔蓋",東區東門路一段202號,22.9871411,120.216268
UN201903190173,"2019-03-19 13:19:30",南區,髒亂及汙染,市區道路路面油漬,"南區安平商港  路面油漬",南區安平商港,22.9700877,120.1716911
UN201903190174,"2019-03-19 13:21:36",仁德區,路燈故障,10盞以上路燈故障,"仁德區仁湖橋   路燈不亮",仁德區仁湖橋,22.9073891,120.2344553
UN201903190178,"2019-03-19 13:27:21",中西區,違規停車,違規停車,"台南市中西區民族路二段78號 違停",臺南市中西區民族路二段78號,22.995315,120.207507
UN201903190188,"2019-03-19 13:55:46",仁德區,道路維修,人孔蓋或溝蓋聲響鬆動,"仁德區中正路二段840號  寬頻人孔蓋鬆動",仁德區中正路二段840號,22.9636174,120.253589
UN201903190196,"2019-03-19 14:20:38",永康區,路燈故障,9盞以下路燈故障,"永康區復興路244號 路燈故障",永康區復興路244號,22.9987689,120.2435308
UN201903190206,"2019-03-19 14:49:52",安定區,噪音舉發,場所連續噪音,"安定區海寮201之25號   施工噪音  /  沒消防設備",安定區海寮201之25號,23.09651,120.210567
UN201903190214,"2019-03-19 15:08:15",南區,路燈故障,9盞以下路燈故障,"南區喜樹路252巷27弄口 路燈故障",南區喜樹路252巷27弄,22.9408119,120.1773854
UN201903190232,"2019-03-19 15:55:44",麻豆區,交通運輸,號誌故障,"麻豆區大同街56號    號誌故障",台南市麻豆區旁邊的紅綠燈,23.1901687,120.2602457
UN201903190237,"2019-03-19 16:15:06",仁德區,路燈故障,10盞以上路燈故障,"仁德區文賢路二段，台鐵高架橋下方往仁湖橋方向，尚未到瓦窯溝之前路段 路燈不亮",仁德區文賢路二段,22.912144,120.2478765
UN201903190240,"2019-03-19 16:24:04",北區,民生管線,停電、漏電、電線掉落、孔蓋鬆動,"北區公園路583-1號 孔蓋鬆動",北區公園路583-1號,23.0109224,120.2107428
UN201903190246,"2019-03-19 16:28:33",中西區,騎樓舉發,騎樓舉發,"中西區西華南街46/48號  騎樓舉發",臺南市中西區西華南街46號,22.993964,120.209545
UN201903190250,"2019-03-19 16:38:27",東區,違規停車,違規停車,"東區長榮酒店四周 違停＆加強取締",臺南市東區中華東路三段336巷1號,22.974417,120.220646
UN201903190252,"2019-03-19 16:41:50",南區,動物救援,犬貓急難救援,"南區永成路二段730巷111號 捕抓流浪狗",南區永成路二段730巷111號,22.9542641,120.1971164
UN201903190270,"2019-03-19 17:22:19",中西區,違規停車,違規停車,"中西區民族路二段2、18號  違規停車",臺南市中西區民族路二段2號,22.994621,120.211607
UN201903190274,"2019-03-19 17:29:57",安平區,民生管線,漏水、停水、消防栓漏水或損壞,"安平區世平路69號  漏水",安平區世平路69號,22.9967723,120.1489778
UN201903190289,"2019-03-19 18:19:57",中西區,違規停車,違規停車,"中西區衛民街62號 違規停車",臺南市中西區衛民街62號,22.993127,120.210295
UN201903190291,"2019-03-19 18:23:57",北區,路燈故障,9盞以下路燈故障,"北區開元地下道 路燈不亮",北區開元地下道,23.008515,120.2079953
UN201903190294,"2019-03-19 18:28:23",永康區,髒亂及汙染,空氣汙染,"永康區大灣路1014號 空汙",永康區大灣路1014號,22.9998521,120.2530293
UN201903190296,"2019-03-19 18:32:00",中西區,違規停車,違規停車,"中西區健康路一段310巷 違規停車",中西區健康路一段310巷,22.982061,120.2028041
UN201903190303,"2019-03-19 18:48:37",關廟區,路燈故障,10盞以上路燈故障,"關廟區關新路一段836號  路燈故障",關廟區關新路一段836號,22.995672,120.3084722
UN201903190304,"2019-03-19 18:49:31",,,,"新市區仁愛街160之1號 路燈故障",新市區仁愛街160之1號,23.0740954,120.2932071
UN201903190305,"2019-03-19 18:58:53",東區,路燈故障,9盞以下路燈故障,"東區東門路二段104巷5號旁 路燈故障",東區東門路二段104巷5號,22.9859488,120.2202555
UN201903190307,"2019-03-19 19:07:14",南區,髒亂及汙染,道路散落物,"南區明興路1081號 道路散落物",南區明興路1081號,22.9292807,120.1856803
UN201903190308,"2019-03-19 19:07:30",中西區,路燈故障,9盞以下路燈故障,"中西區西賢一街109巷西賢二街 路燈故障",中西區西賢一街109巷西賢二街,23.002016,120.176392
UN201903190323,"2019-03-19 19:54:26",安南區,噪音舉發,場所連續噪音,"安南區環館路和環館三路口 施工噪音",安南區環館路和環館三路,23.0642605,120.2345267
UN201903190326,"2019-03-19 20:23:33",東區,路燈故障,9盞以下路燈故障,"東區東門路二段104巷 路燈故障",東區東門路二段104巷,22.9861777,120.2202286
UN201903190327,"2019-03-19 20:23:38",安南區,噪音舉發,場所連續噪音,"安南區安中路一段52號 連續噪音",安南區安中路一段52號,23.0341922,120.2109223
UN201903190328,"2019-03-19 20:24:57",東區,違規停車,違規停車,"東區中華東路三段229號 違規停車",臺南市東區中華東路三段229號,22.975612,120.224957
UN201903190329,"2019-03-19 20:31:46",東區,違規停車,違規停車,"東區中華東路三段229號 違規停車",臺南市東區中華東路三段229號,22.975612,120.224957
UN201903190334,"2019-03-19 20:42:08",新化區,路燈故障,9盞以下路燈故障,"新化區民權街216號前到中正路和民權街口 路燈故障",新化區民權街216號,23.0410099,120.3057279
UN201903190339,"2019-03-19 21:01:48",安南區,違規停車,違規停車,"安南區北安路三段145巷63號 妨礙出入",安南區北安路三段145巷63號,23.0414547,120.2013198
UN201903190341,"2019-03-19 21:12:12",永康區,違規停車,違規停車,"永康區中華路737號 違規停車",永康區中華路737號,23.0179426,120.2268787
UN201903190344,"2019-03-19 21:20:32",善化區,違規停車,違規停車,"善化區中正路文昌路 違停",善化區中正路文昌路,23.130135,120.2939549
UN201903190347,"2019-03-19 21:46:09",中西區,路燈故障,10盞以上路燈故障,"中西區民族路二段212號 大範圍路燈故障",中西區民族路二段212號,22.9974831,120.2025928
UN201903190348,"2019-03-19 21:52:55",新營區,違規停車,違規停車,"新營區大智街7號 違規停車",新營區大智街7號,23.3149509,120.317357
UN201903190351,"2019-03-19 22:14:50",永康區,違規停車,違規停車,"永康區新中街31巷 違規停車",永康區新中街31巷,23.0357762,120.2392855
UN201903190352,"2019-03-19 22:25:02",永康區,噪音舉發,妨害安寧,"永康區新行街113號 妨害安寧",永康區新行街113號,23.0407871,120.2419152
UN201903190354,"2019-03-19 22:36:56",永康區,違規停車,違規停車,"永康區中華路58巷52號 違規停車",永康區中華路58巷52號,23.0018866,120.2363198
UN201903190356,"2019-03-19 23:07:15",安南區,噪音舉發,妨害安寧,"安南區北安路二段526號 妨害安寧",安南區北安路二段526號,23.0370185,120.2030762
UN201903190358,"2019-03-19 23:16:34",麻豆區,動物救援,遊蕩犬隻捕捉管制,"麻豆區大埕里21-16號，和豐會館 遊蕩犬隻捕捉管制",麻豆區大埕里21-16號,23.187337,120.249614
UN201903190359,"2019-03-19 23:24:28",新營區,噪音舉發,妨害安寧,"新營區民族路69號旁 妨害安寧",新營區民族路69號,23.3121815,120.3183199
UN201903200001,"2019-03-20 00:01:25",安平區,噪音舉發,妨害安寧,"安平區慶平路88號 妨害安寧",臺南市安平區慶平路88號,22.997116,120.181904
UN201903200006,"2019-03-20 00:47:29",中西區,噪音舉發,場所連續噪音,"中西區府前路二段208號 噪音舉發",臺南市中西區府前路二段208號,22.991757,120.192411
UN201903200025,"2019-03-20 08:11:03",安南區,道路維修,路面下陷、凹陷,"安南區安和路一段427號 道路維修",臺南市安南區安和路一段427號,23.035325,120.213088
UN201903200044,"2019-03-20 09:06:21",安平區,髒亂及汙染,大型廢棄物清運,"安平區永華九街55號 大型廢棄物清運",臺南市安平區永華九街55號,22.990792,120.170123
UN201903200088,"2019-03-20 10:56:22",永康區,髒亂及汙染,空氣汙染,"永康區大灣路1014號 空汙",臺南市永康區大灣路1014號,22.999921,120.253194
UN201903200115,"2019-03-20 11:58:15",中西區,違規停車,違規停車,"中西區民族路二段246號 違規停車",臺南市中西區民族路二段246號,22.997373,120.201373
UN201903200141,"2019-03-20 13:31:40",中西區,違規停車,違規停車,"中西區西華南街65號 違規停車",臺南市中西區西華南街65號,22.994684,120.209521
