UN201904010003,"2019-04-01 00:20:48",南區,髒亂及汙染,空氣汙染,"南區中華南路二段241號 空氣汙染",臺南市南區中華南路二段241號,22.961349,120.187882
UN201904010009,"2019-04-01 06:30:27",新化區,髒亂及汙染,空氣汙染,"新化區正新路361號3樓 空氣汙染",臺南市新化區正新路361號,23.039896,120.302562
UN201904010012,"2019-04-01 07:43:00",永康區,違規停車,違規停車,"永康區中華路58巷52號  違規停車",臺南市永康區中華路58巷52號,23.001829,120.237398
UN201904010014,"2019-04-01 07:47:45",永康區,違規停車,違規停車,"永康區中華路463號旁巷口   違規停車",臺南市永康區中華路463號,23.011028,120.232106
UN201904010092,"2019-04-01 10:17:35",中西區,違規停車,違規停車,"中西區府連路36號  違規停車",臺南市中西區府連路36號,22.982777,120.209987
UN201904010120,"2019-04-01 11:15:04",永康區,違規停車,違規停車,"永康區中華路58巷52號 違規停車",臺南市永康區中華路58巷52號,23.001829,120.237398
UN201904010121,"2019-04-01 11:15:12",中西區,違規停車,違規停車,"中西區衛民街129號 違規停車",臺南市中西區衛民街129號,22.99328,120.207732
UN201904010122,"2019-04-01 11:16:48",中西區,違規停車,違規停車,"中西區西華南街7號 違規停車",臺南市中西區西華南街7號,22.993251,120.209226
UN201904010124,"2019-04-01 11:20:04",永康區,違規停車,違規停車,"永康區中華路185號 違規停車",臺南市永康區中華路185號,23.004367,120.235122
UN201904010125,"2019-04-01 11:20:20",中西區,違規停車,違規停車,"中西區府連路106號108號 違規停車",臺南市中西區府連路106號,22.983499,120.210492
UN201904010130,"2019-04-01 11:23:59",南區,髒亂及汙染,空氣汙染,"南區永成路三段340號 空氣汙染",臺南市南區永成路三段340號,22.96796,120.195498
UN201904010146,"2019-04-01 11:52:55",中西區,違規停車,違規停車,"中西區青年路112號 違規停車",臺南市中西區青年路112號,22.991863,120.208648
UN201904010151,"2019-04-01 11:55:27",中西區,違規停車,違規停車,"中西區西華南街66號 違規停車",臺南市中西區西華南街66號,22.994188,120.209597
UN201904010156,"2019-04-01 12:08:45",中西區,違規停車,違規停車,"中西區民族路二段76-1號 違規停車",臺南市民族路二段76-1號,22.994752,120.209188
UN201904010159,"2019-04-01 12:18:23",安南區,違規停車,違規停車,"安南區海佃路一段126號  違停",臺南市安南區海佃路一段126號,23.023313,120.19201
UN201904010174,"2019-04-01 13:03:46",永康區,違規停車,違規停車,"永康區中華路58巷52號 違規停車",臺南市永康區中華路58巷52號,23.001829,120.237398
