UN201904130202,"2019-04-13 19:16:13",永康區,違規停車,違規停車,"永康區六合路42巷1號巷口 違規停車",臺南市永康區六合路42巷1號,23.00944,120.231408
UN201904130203,"2019-04-13 19:20:30",安南區,交通運輸,號誌故障,"安南區環館北路跟環館五路口 號誌故障",安南區環館北路跟環館五路,23.063751,120.229988
UN201904130204,"2019-04-13 19:21:03",安平區,路燈故障,9盞以下路燈故障,"安平區安北路422號前  路燈故障",安平區安北路422號,22.9998348,120.1527114
UN201904130205,"2019-04-13 19:25:53",新市區,路燈故障,9盞以下路燈故障,"新市區善新大道1號 路燈故障",新市區善新大道1號,23.1110085,120.3108212
UN201904130208,"2019-04-13 19:28:48",中西區,違規停車,,"中西區民族路二段131號 佔用騎樓/違停",臺南市中西區民族路二段131號,22.994871,120.207853
UN201904130209,"2019-04-13 19:41:19",永康區,交通運輸,佔用道路,"永康區永大路一段跟中正路三段  佔用道路",永康區永大路一段中正路三段,22.9935679,120.2566264
UN201904130211,"2019-04-13 19:54:33",安平區,騎樓舉發,騎樓舉發,"安平區中華西路二段67號及中華西路二段49巷3號 騎樓舉發",安平區中華西路二段67號,22.9882049,120.1866632
UN201904130215,"2019-04-13 20:13:55",新市區,髒亂及汙染,空氣汙染,"新市區豐華里47之90號 空氣汙染",新市區豐華里47之90號,23.0893527,120.2591881
UN201904130217,"2019-04-13 20:27:54",中西區,違規停車,違規停車,"中西區海安路一段 違規停車",中西區海安路一段,22.9904939,120.1954738
UN201904130219,"2019-04-13 20:37:19",安平區,交通運輸,佔用道路,"安平區中華西路二段與中華西路二段49巷口 騎樓舉發",安平區中華西路二段49巷,22.9876726,120.1849522
UN201904130221,"2019-04-13 20:59:20",中西區,違規停車,違規停車,"中西區民族路二段57巷38號旁 違規停車",中西區民族路二段57巷38號,22.9934363,120.2097833
UN201904130223,"2019-04-13 21:11:56",永康區,違規停車,違規停車,"永康區中山東路280號 違規停車",永康區中山東路280號,23.0103801,120.237112
UN201904130224,"2019-04-13 21:12:20",安南區,路燈故障,9盞以下路燈故障,"安南區北安路三段680巷11號對面 路燈故障",安南區北安路三段680巷11號,23.0538236,120.2135086
UN201904130225,"2019-04-13 21:13:29",安平區,路燈故障,10盞以上路燈故障,"安平區永華路二段206號 路燈故障",安平區永華路二段206號,22.9898614,120.1824124
UN201904130227,"2019-04-13 21:36:46",永康區,違規停車,違規停車,"永康區東橋一路312號 違規停車",永康區東橋一路312號,23.0202628,120.2327326
UN201904130229,"2019-04-13 21:40:09",南區,路燈故障,9盞以下路燈故障,"南區國民路567巷7弄 路燈故障",南區國民路567巷7弄,22.973119,120.2050926
UN201904130230,"2019-04-13 21:44:17",中西區,噪音舉發,妨害安寧,"中西區臨安路一段72號 噪音舉發",中西區臨安路一段72號,22.9990981,120.1907774
UN201904130231,"2019-04-13 21:49:15",安南區,路燈故障,9盞以下路燈故障,"安南區公學路六段和慈興七街 路燈故障",安南區公學路六段慈興七街,23.0782884,120.1482682
UN201904130232,"2019-04-13 21:51:57",中西區,違規停車,違規停車,"中西區環河街92號 違規停車",中西區環河街92號,22.9945921,120.192689
UN201904130235,"2019-04-13 22:13:54",新化區,髒亂及汙染,空氣汙染,"新化區中山路/民生/信義路 空氣汙染",新化區中山路,23.0432734,120.3143793
UN201904130238,"2019-04-13 23:44:22",東區,噪音舉發,妨害安寧,"東區林森路一段156號 妨害安寧",東區林森路一段156號,22.981484,120.2150055
UN201904140016,"2019-04-14 05:33:04",中西區,髒亂及汙染,道路散落物,"中西區西門路二段420號 道路散落物",臺南市中西區西門路二段420號,22.99934,120.201237
UN201904140020,"2019-04-14 06:41:50",永康區,髒亂及汙染,空氣汙染,"永康區大灣路1014號 空氣汙染",臺南市永康區大灣路1014號,22.999921,120.253194
UN201904140025,"2019-04-14 07:30:39",永康區,噪音舉發,妨害安寧,"永康區大灣路1014號 空氣污染",臺南市永康區大灣路1014號,22.999921,120.253194
UN201904140026,"2019-04-14 07:34:06",下營區,噪音舉發,妨害安寧,"下營區中營里1154號, 妨害安寧",臺南市下營區中營里1154號,23.215277,120.277553
UN201904140027,"2019-04-14 07:46:05",新化區,髒亂及汙染,空氣汙染,"新化區中山路/民生路/信義路 空氣汙染",新化區中山路,23.0432734,120.3143793
UN201904140036,"2019-04-14 08:31:43",北區,交通運輸,佔用道路,"北區南園街101巷34弄105號   佔用道路",臺南市北區南園街101巷34弄105號,23.008715,120.227863
UN201904140038,"2019-04-14 08:48:11",歸仁區,噪音舉發,妨害安寧,"歸仁區大仁五街61號/36號 妨害安寧",臺南市歸仁區大仁五街61號,22.972701,120.29822
UN201904140040,"2019-04-14 08:53:30",南區,民生管線,停電、漏電、電線掉落、孔蓋鬆動,"南區體育路43巷27號   停電",臺南市南區體育路43巷27號,22.979403,120.208145
UN201904140059,"2019-04-14 09:50:18",永康區,違規停車,違規停車,"永康區復國二路46號 違規停車",臺南市永康區復國二路46號,23.005023,120.247362
UN201904140067,"2019-04-14 10:15:28",東區,違規停車,違規停車,"東區北門路二段2號  違規停車",臺南市東區北門路二段2號,22.996429,120.212487
UN201904140068,"2019-04-14 10:27:25",北區,違規停車,違規停車,"北區小東路423巷1號    違停",臺南市北區小東路423巷1號,22.999236,120.232674
UN201904140074,"2019-04-14 10:44:25",北區,違規停車,違規停車,"北區小東路423巷1號  違停",臺南市北區小東路423巷1號,22.999236,120.232674
UN201904140104,"2019-04-14 12:19:57",北區,噪音舉發,妨害安寧,"北區海安路三段731號  妨害安寧",臺南市北區海安路三段731號,23.012236,120.200292
UN201904140109,"2019-04-14 12:44:23",永康區,噪音舉發,場所連續噪音,"永康區復國路50號 噪音舉發",臺南市永康區復國路50號,23.001087,120.246566
UN201904140116,"2019-04-14 13:27:30",安平區,噪音舉發,妨礙安寧,"安平區建平路256號後方的建平七街  妨礙安寧",臺南市安平區建平路256號,22.988636,120.182444
UN201904140121,"2019-04-14 14:05:01",中西區,違規停車,違規停車,"中西區南門路39號 違規停車",臺南市中西區南門路39號,22.99036,120.204886
UN201904140137,"2019-04-14 15:09:56",安南區,交通運輸,佔用道路,"安南區同安路237巷188號    交通運輸",臺南市安南區同安路237巷188號,23.044395,120.18974
UN201904140158,"2019-04-14 16:11:48",永康區,違規停車,違規停車,"永康區中華路58巷52號 違規停車",臺南市永康區中華路58巷52號,23.001829,120.237398
UN201904140159,"2019-04-14 16:19:10",安平區,噪音舉發,妨礙安寧,"安平區郡平路188號 妨害安寧",臺南市安平區郡平路188號,22.989493,120.167729
UN201904140171,"2019-04-14 16:57:23",東區,違規停車,違規停車,"東區中華東路三段360號德安百貨  違規停車",臺南市東區中華東路三段360號,22.973835,120.220701
UN201904140181,"2019-04-14 17:45:23",新市區,違規停車,違規停車,"新市區和平街209號  違規停車",臺南市新市區和平街209號,23.079155,120.291251
UN201904140186,"2019-04-14 18:12:22",新營區,違規停車,違規停車,"新營區大智街1號 違規停車",臺南市新營區大智街1號,23.31493,120.317199
UN201904140191,"2019-04-14 18:23:10",安南區,交通運輸,佔用道路,"安南區安中路一段678號旁 占用道路",臺南市安南區安中路一段678號,23.042543,120.196834
UN201904140198,"2019-04-14 18:57:19",佳里區,違規停車,違規停車,"佳里區興化里佳里興606號 違規停車",臺南市佳里區興化里佳里興606號,23.181699,120.183662
UN201904140226,"2019-04-14 20:25:25",安平區,交通運輸,佔用道路,"安平區中華西路二段23號 占用道路",臺南市安平區中華西路二段23號,22.987096,120.186459
UN201904140234,"2019-04-14 21:02:41",中西區,違規停車,違規停車,"中西區民族路二段66號旁邊的向內紅線 違規停車",臺南市中西區民族路二段66號,22.994656,120.210177
UN201904140243,"2019-04-14 21:43:40",中西區,違規停車,違規停車,"中西區西華南街33號 違規停車",臺南市中西區西華南街33號,22.993754,120.209335
