UN201904170285,"2019-04-17 22:32:58",新營區,髒亂及汙染,道路散落物,"新營區復興路10、12號  道路散落物",新營區復興路10或12號,23.302605,120.312978
UN201904170286,"2019-04-17 22:46:19",安平區,噪音舉發,妨害安寧,"安平區永華八街2號 施工噪音",安平區永華八街2號,22.9890183,120.1718991
UN201904170287,"2019-04-17 22:53:36",白河區,髒亂及汙染,空氣汙染,"白河區新厝宅71-115號 空汙",白河區新厝宅71-115號,23.3486112,120.4079818
UN201904170289,"2019-04-17 22:56:04",永康區,違規停車,違規停車,"永康區中山北路164巷138號 違規停車",永康區中山北路164巷138號,23.0265087,120.2644429
UN201904170290,"2019-04-17 22:57:14",東區,噪音舉發,,"東區府連路204巷29弄1號 噪音",東區府連路204巷29弄1號,22.9843758,120.2131667
UN201904170291,"2019-04-17 23:00:33",關廟區,髒亂及汙染,空氣汙染,"關廟區南雄路一段590號 空汙",關廟區南雄路一段590號,22.9455543,120.333035
UN201904170293,"2019-04-17 23:03:55",安平區,噪音舉發,妨害安寧,"安平區郡平路建平8街 施工噪音",安平區郡平路建平8街,22.9899543,120.1689215
UN201904170296,"2019-04-17 23:35:03",中西區,道路維修,,"中西區開山路134號 人孔蓋或溝蓋聲響",開山路134號,22.9885915,120.2078437
UN201904180096,"2019-04-18 10:40:38",永康區,髒亂及汙染,空氣汙染,"永康區大灣路1014號  空氣/水汙染",臺南市永康區大灣路1014號,22.999921,120.253194
UN201904180150,"2019-04-18 12:39:28",中西區,違規停車,違規停車,"中西區民族路二段76號  違規停車",臺南市中西區民族路二段76號,22.994726,120.20925
UN201904180154,"2019-04-18 12:50:03",中西區,違規停車,違規停車,"中西區民族路二段66號、47號、42號、76號  違規停車",臺南市中西區民族路二段66號,22.994656,120.210177
UN201904180173,"2019-04-18 13:48:57",中西區,違規停車,違規停車,"中西區開山路65號   違規停車",臺南市中西區開山路65號,22.990479,120.206696
UN201904180205,"2019-04-18 15:02:37",中西區,髒亂及汙染,道路散落物,"中西區中山路166號對面    道路散落物",臺南市中西區中山路166號,22.99563,120.210167
UN201904180220,"2019-04-18 15:58:57",仁德區,道路維修,路面坑洞,"仁德區保仁路68號，仁和國小旁 坑洞",臺南市仁德區保仁路68號,22.960205,120.222237
UN201904180223,"2019-04-18 16:03:53",永康區,交通運輸,佔用道路,"永康區大橋一街181巷31號 佔用道路",臺南市永康區大橋一街181巷31號,23.019149,120.2303
