UN201905100185,"2019-05-10 14:54:24",中西區,違規停車,違規停車,"中西區民族路二段76號  76-1號   違規停車",臺南市中西區民族路二段76號,22.994726,120.20925
UN201905100189,"2019-05-10 15:04:49",北區,動物救援,犬貓急難救援,"北區公園路164號 犬貓急難救援",北區公園路164號,22.999301,120.208077
UN201905100191,"2019-05-10 15:07:54",永康區,噪音舉發,妨礙安寧,"永康區四維街149巷34之1號 妨礙安寧",臺南市永康區四維街149巷34之1號,23.035003,120.250806
UN201905100194,"2019-05-10 15:13:37",安南區,違規停車,違規停車,"安南區海佃路一段126號~130號 違規停車",臺南市安南區海佃路一段126號,23.023313,120.19201
UN201905100196,"2019-05-10 15:15:39",北區,交通運輸,號誌故障,"北區和緯路二段  號誌故障",北區和緯路二段,23.0121824,120.2057685
UN201905100198,"2019-05-10 15:21:03",永康區,動物救援,犬貓急難救援,"永康區和平東路56號 貓受困",永康區和平東路56號,23.056521,120.2684366
UN201905100206,"2019-05-10 15:45:19",中西區,路燈故障,9盞以下路燈故障,"中西區南華街22號 路燈故障不亮",中西區南華街22號,22.9891641,120.191271
UN201905100208,"2019-05-10 15:51:00",新營區,違規停車,違規停車,"新營區民治路8-68號 違規停車",臺南市新營區民治路8-68號,23.311226,120.320603
UN201905100214,"2019-05-10 16:08:18",中西區,髒亂及汙染,小廣告、旗幟,"中西區頂美三街西湖街 髒亂及汙染",中西區頂美三街西湖街,23.0033855,120.1861274
UN201905100218,"2019-05-10 16:18:49",南區,交通運輸,號誌故障,"南區新興路和新興路230巷、267巷三叉口 號誌故障",南區新興路230巷,22.9770509,120.1925305
UN201905100224,"2019-05-10 16:33:04",北區,噪音舉發,場所連續噪音,"北區南園街101巷21弄7號  施工噪音",北區南園街101巷21弄7號,23.0082521,120.2260275
UN201905100227,"2019-05-10 16:42:11",東區,交通運輸,佔用道路,"東區中華東路二段75號 交通運輸",臺南市東區中華東路二段75號,22.98658,120.233572
UN201905100228,"2019-05-10 16:43:35",東區,交通運輸,號誌秒差調整,"東區仁和路*城東街   號誌調整",東區仁和路城東街,22.9666049,120.2361057
UN201905100234,"2019-05-10 17:01:08",中西區,噪音舉發,場所連續噪音,"中西區南門路209巷29之2號   噪音",中西區南門路209巷29之2號,22.9850308,120.2054487
UN201905100248,"2019-05-10 17:35:03",南區,交通運輸,佔用道路,"南區金華路二段33巷78號 佔用道路",南區金華路二段33巷78號,22.9772601,120.1888518
UN201905100254,"2019-05-10 17:41:44",永康區,違規停車,違規停車,"永康區大同街和大同街50巷口 違規停車",大同街和大同街50巷口,23.00861,120.2704761
UN201905100259,"2019-05-10 17:53:02",中西區,違規停車,違規停車,"中西區西華南街35號 違規停車",西華南街35號,22.9938716,120.2093781
UN201905100260,"2019-05-10 17:54:08",中西區,違規停車,違規停車,"中西區民族路二段42號 違規停車",民族路二段42,22.9946351,120.2107863
UN201905100263,"2019-05-10 17:57:08",東區,交通運輸,號誌故障,"東區自由路一段與二段ok便利商店路 號燈故障",東區自由路一段二段,22.9706092,120.2376332
UN201905100266,"2019-05-10 18:09:50",安平區,違規停車,違規停車,"安平區永華九街與永華路二段交叉口 違規停車",:安平區永華九街,22.989949,120.1701378
UN201905100267,"2019-05-10 18:10:03",中西區,違規停車,違規停車,"中西區西門路二段136巷口 違規停車",中西區西門路二段136巷,22.9936237,120.1993564
UN201905100268,"2019-05-10 18:11:05",北區,違規停車,違規停車,"北區公園路772巷口 違停",北區公園路772巷,23.011056,120.2117583
UN201905100270,"2019-05-10 18:22:38",中西區,違規停車,違規停車,"中西區民族路二段76，76-1號 違規停車",中西區民族路二段76號,22.9947876,120.2089152
UN201905100272,"2019-05-10 18:27:04",永康區,違規停車,違規停車,"永康區中山路78號 違規停車",永康區中山路78號,23.0280775,120.2569788
UN201905100274,"2019-05-10 18:33:52",東區,違規停車,違規停車,"東區崇道路19巷和崇德路530巷口 違停",東區崇道路19巷和崇德路530巷,22.9728268,120.2254714
UN201905100275,"2019-05-10 18:38:25",永康區,髒亂及汙染,,"永康區大灣路1014號 空氣汙染",永康區大灣路1014號,22.9998521,120.2530293
UN201905100278,"2019-05-10 18:49:25",中西區,路燈故障,9盞以下路燈故障,"中西區南華街16號 路燈故障",中西區南華街16號,22.988897,120.1912338
UN201905100279,"2019-05-10 18:53:39",新營區,路燈故障,9盞以下路燈故障,"新營區中營里民族路3號 路燈不亮",新營區中營里民族路3號,23.3056229,120.31846
UN201905100281,"2019-05-10 18:56:30",安平區,交通運輸,號誌故障,"安平區府前四街與建平十六街口 號誌故障",安平區府前四街,22.9947662,120.185046
UN201905100284,"2019-05-10 19:02:10",北區,交通運輸,號誌故障,"北區育德路和西門路四段65巷口 號誌故障",北區育德路和西門路四段65巷,23.0084138,120.2048673
UN201905100288,"2019-05-10 19:15:16",北區,違規停車,違規停車,"北區西華街67號 違規停車",北區西華街67號,22.9999019,120.2105714
UN201905100290,"2019-05-10 19:25:14",北區,違規停車,違規停車,"北區西門路四段111號 違停",北區西門路四段111號,23.0083436,120.2067954
UN201905100292,"2019-05-10 19:30:31",中西區,違規停車,違規停車,"中西區中正路7號騎樓 違規停車",台南市中西區中正路7號,22.9920063,120.2035497
UN201905100294,"2019-05-10 19:32:44",永康區,路燈故障,9盞以下路燈故障,"永康區中山北路610號附近 路燈故障",永康區中山北路610號,23.030386,120.276403
UN201905100295,"2019-05-10 19:36:17",中西區,違規停車,違規停車,"中西區民族路二段66號旁巷內 違規停車",中西區民族路二段66號,22.9946307,120.210031
UN201905100302,"2019-05-10 19:50:57",佳里區,違規停車,違規停車,"佳里區光復路9號前 違規停車",佳里區光復路9號,23.1556989,120.175131
UN201905100306,"2019-05-10 20:08:23",永康區,違規停車,違規停車,"永康區復華六街46號  違停",永康區復華六街46號,23.012414,120.247009
UN201905100309,"2019-05-10 20:49:40",麻豆區,違規停車,違規停車,"麻豆區中正路223號 違規停車",麻豆區中正路223號,23.1887971,120.2520012
UN201905100311,"2019-05-10 21:04:01",永康區,違規停車,違規停車,"永康區大橋一街139巷22弄53號 違規停車",永康區大橋一街139巷22弄53號,23.0189761,120.229764
UN201905100313,"2019-05-10 21:06:28",北區,民生管線,漏水、停水、消防栓漏水或損壞,"北區小東路299巷26弄1號附近 停水",北區小東路299巷26弄1號,22.9999757,120.2308041
UN201905100316,"2019-05-10 21:24:30",官田區,路燈故障,10盞以上路燈故障,"官田區大崎66號 路燈不亮",官田區大崎66號,23.186013,120.374319
UN201905100317,"2019-05-10 21:30:13",官田區,路燈故障,9盞以下路燈故障,"官田區南119鄉道2.5K至3K，往玉井方向 路燈不亮",官田區南119鄉道,23.1740398,120.3638449
UN201905100318,"2019-05-10 21:31:12",佳里區,違規停車,違規停車,"佳里區四維二街151巷口 違規停車",佳里區四維二街151巷,23.1513084,120.1773751
UN201905100322,"2019-05-10 21:38:14",東區,違規停車,違規停車,"東區東寧路329號 違規停車",東區東寧路329號,22.9902621,120.227605
UN201905100329,"2019-05-10 21:58:18",永康區,違規停車,違規停車,"永康區大同街819號 違規停車",永康區大同街819號,23.0226822,120.2627308
UN201905100332,"2019-05-10 22:10:53",學甲區,噪音舉發,妨害安寧,"學甲區三民路中學路 噪音舉發",學甲區三民路中學路,23.2399038,120.1794702
UN201905100337,"2019-05-10 23:08:18",中西區,噪音舉發,妨害安寧,"中西區大同路一段252號 妨害安寧",中西區大同路一段252號,22.9815896,120.2117084
UN201905100339,"2019-05-10 23:31:55",北區,噪音舉發,妨害安寧,"北區中華北路一段105巷21號 噪音舉發",北區中華北路一段105巷21號,23.0086175,120.1847954
UN201905100341,"2019-05-10 23:43:18",北區,噪音舉發,場所連續噪音,"北區成功路40巷2號 噪音舉發",北區成功路40巷2號,22.9983417,120.2082032
UN201905110002,"2019-05-11 00:48:32",南區,噪音舉發,妨害安寧,"南區大同路二段578號 噪音",臺南市南區大同路二段578號,22.970166,120.215
UN201905110003,"2019-05-11 00:56:21",東區,噪音舉發,妨害安寧,"東區崇明路391號 噪音",臺南市東區崇明路391號,22.974067,120.223606
UN201905110017,"2019-05-11 07:13:57",北區,噪音舉發,妨害安寧,"北區南園街101巷34弄41號 噪音舉發",臺南市北區南園街101巷34弄41號,23.00903,120.227715
UN201905110034,"2019-05-11 08:06:17",北區,髒亂及汙染,空氣汙染,"北區育德二路490號 空氣汙染",臺南市北區育德二路490號,23.018579,120.201947
UN201905110077,"2019-05-11 09:09:49",北區,噪音舉發,場所連續噪音,"北區武聖路138號 噪音舉發",臺南市北區武聖路138號,23.006549,120.190285
UN201905110098,"2019-05-11 09:41:50",後壁區,交通運輸,號誌故障,"後壁區上茄苳146之33號 號誌故障",臺南市後壁區上茄苳146之33號,23.38637,120.372805
UN201905110104,"2019-05-11 09:49:17",中西區,違規停車,違規停車,"中西區民族路二段76號   違規停車",臺南市中西區民族路二段76號,22.994726,120.20925
UN201905110105,"2019-05-11 09:50:15",永康區,髒亂及汙染,空氣汙染,"永康區大灣路1014號 空污",臺南市永康區大灣路1014號,22.999921,120.253194
UN201905110126,"2019-05-11 10:35:15",北區,噪音舉發,妨害安寧,"北區武聖路138號 噪音舉發",臺南市北區武聖路138號,23.006549,120.190285
UN201905110129,"2019-05-11 10:37:51",北區,噪音舉發,場所連續噪音,"北區武聖路138號 噪音舉發",臺南市北區武聖路138號,23.006549,120.190285
UN201905110146,"2019-05-11 11:10:55",北區,噪音舉發,妨害安寧,"北區武聖路138號 噪音舉發",臺南市北區武聖路138號,23.006549,120.190285
