UN201905080122,"2019-05-08 12:33:21",南區,髒亂及汙染,環境髒亂,"南區新都路155號附近 環境髒亂",新都路155號,22.9709759,120.2020625
UN201905080129,"2019-05-08 12:49:50",安平區,噪音舉發,妨害安寧,"安平區永華路二段821號 工地施工噪音",安平區永華路二段821號,22.9911351,120.1685557
UN201905080133,"2019-05-08 13:01:54",中西區,違規停車,違規停車,"中西區西華南街2號 違規停車",臺南市中西區西華南街2號,22.993195,120.20943
UN201905080138,"2019-05-08 13:15:07",安平區,動物救援,犬貓急難救援,"安平區建平12街130號 流浪狗",安平區建平12街130號,22.9953215,120.1809413
UN201905080148,"2019-05-08 13:44:31",中西區,道路維修,人孔蓋或溝蓋聲響鬆動,"中西區西門路二段184號與186號 人孔蓋噪音",中西區西門路二段184號186號,22.9943122,120.1993192
UN201905080153,"2019-05-08 14:07:56",白河區,動物救援,遊蕩犬隻捕捉管制,"白河運動公園 捕狗",白河運動公園,23.353951,120.415156
UN201905080154,"2019-05-08 14:08:26",安平區,違規停車,違規停車,"安平區怡平路495號對面   違規停車",臺南市安平區怡平路495號,22.99393,120.172458
UN201905080155,"2019-05-08 14:08:40",大內區,路燈故障,9盞以下路燈故障,大內區南182之1線內郭里71號,大內區南182之1線內郭里71號,23.1184611,120.3873245
UN201905080160,"2019-05-08 14:25:33",中西區,髒亂及汙染,環境髒亂,"中西區和緯路五段195號   髒亂及汙染",中西區和緯路五段195號,23.0050341,120.1823878
UN201905080175,"2019-05-08 14:52:59",安南區,路燈故障,9盞以下路燈故障,"安南區城西街一段61巷口   路燈不亮",安南區城西街一段61巷,23.0601499,120.1284583
UN201905080183,"2019-05-08 15:15:23",安南區,路燈故障,9盞以下路燈故障,"安南區安明路二段&安明路三段 路燈故障",安南區安明路二段安明路三段,23.0401635,120.1583139
UN201905080184,"2019-05-08 15:15:59",安平區,動物救援,遊蕩犬隻捕捉管制,"安平區安平路第一公墓附近/安平區安億橋附近 遊蕩犬隻捕捉管制",安平區安平路,22.9986364,120.1694833
UN201905080211,"2019-05-08 16:14:53",中西區,違規停車,違規停車,"中西區永福路一段39號旁   違規停車",臺南市中西區永福路一段39號,22.982416,120.2
UN201905080213,"2019-05-08 16:21:06",北區,民生管線,電信孔蓋鬆動、電信線路掉落、電信桿傾倒,"北區公園路918巷10弄33號 電纜線掉落",北區公園路918巷10弄33號,23.0139188,120.2138373
UN201905080218,"2019-05-08 16:32:18",中西區,騎樓舉發,騎樓舉發,"中西區西華南街46號   騎樓舉發",臺南市中西區西華南街46號,22.993964,120.209545
UN201905080226,"2019-05-08 16:53:46",麻豆區,動物救援,犬貓急難救援,"麻豆區謝厝寮53號附近柚子園  動物救援",麻豆區謝厝寮53號,23.148727,120.2372472
UN201905080228,"2019-05-08 17:01:51",安南區,民生管線,天然氣外洩,"安南區海佃路二段150巷及176巷附近 瓦斯外洩",安南區海佃路二段150巷,23.0346343,120.1915497
UN201905080244,"2019-05-08 17:34:34",永康區,違規停車,違規停車,"永康區中華二路285號 違規停車",臺南市永康區中華二路285號,23.008396,120.234643
UN201905080248,"2019-05-08 17:42:28",仁德區,髒亂及汙染,道路散落物,"仁德區民安路 道路散落物",仁德區民安路,22.9575636,120.2445221
UN201905080253,"2019-05-08 17:50:49",永康區,髒亂及汙染,空氣汙染,"永康區中正二街 空氣汙染",永康區中正二街,23.0304822,120.2353168
UN201905080254,"2019-05-08 17:53:41",歸仁區,交通運輸,號誌故障,"歸仁區台39線六甲三街 號誌故障",歸仁區台39線六甲三街,22.9522148,120.2739647
UN201905080261,"2019-05-08 18:15:12",東區,髒亂及汙染,道路散落物,"東區仁和路崇善一街 路面清理",東區仁和路崇善一街,22.9758244,120.2292515
UN201905080263,"2019-05-08 18:21:44",中西區,違規停車,違規停車,"中西區衛民街54-118號；西華南街2-42號 違規停車",臺南市中西區衛民街118號,22.993313,120.208313
UN201905080264,"2019-05-08 18:22:11",柳營區,髒亂及汙染,環境髒亂,"柳營區建國路80號 髒亂及汙染",柳營區建國路80號,23.2779852,120.320793
UN201905080265,"2019-05-08 18:22:43",東區,民生管線,漏水、停水、消防栓漏水或損壞,"東區小東路小東公園 漏水",東區小東路小東公園,23.0008012,120.2255972
UN201905080270,"2019-05-08 18:27:07",永康區,交通運輸,號誌故障,"永康區東橋七路東橋六街 號誌故障",永康區東橋七路東橋六街,23.0211345,120.2370713
UN201905080271,"2019-05-08 18:31:34",官田區,道路維修,路面坑洞,"官田區南118縣道二鎮陸橋 路面坑洞",官田區南118縣道二鎮陸橋,23.2164226,120.315099
UN201905080273,"2019-05-08 18:41:27",白河區,路燈故障,10盞以上路燈故障,"白河區關子嶺紅葉隧道 路燈故障",白河區關子嶺紅葉隧道,23.3413755,120.5037151
UN201905080279,"2019-05-08 18:55:10",西港區,髒亂及汙染,道路散落物,"西港區西港大橋 路面散落物",西港區西港大橋,23.1069983,120.2054106
UN201905080281,"2019-05-08 18:58:25",永康區,違規停車,違規停車,"永康區中華二路285號 違規停車",臺南市永康區中華二路285號,23.008396,120.234643
UN201905080282,"2019-05-08 18:59:12",中西區,違規停車,違規停車,"中西區西華南街32號 違規停車",臺南市中西區西華南街32號,22.993828,120.209542
UN201905080283,"2019-05-08 19:00:05",六甲區,路燈故障,10盞以上路燈故障,"六甲區中華路98號前，信義街到中正路之間路段 路燈不亮",六甲區中華路98號,23.2246883,120.3475038
UN201905080289,"2019-05-08 19:11:08",中西區,違規停車,違規停車,"中西區西華南街32號 違規停車",臺南市中西區西華南街32號,22.993828,120.209542
UN201905080291,"2019-05-08 19:29:03",善化區,違規停車,違規停車,"善化區興華路258之3號 違規停車",臺南市善化區興華路258之3號,23.127228,120.296445
UN201905080297,"2019-05-08 19:50:08",東區,道路維修,路面掏空、塌陷,"東區裕永路和平實八街口 人行道塌陷",東區裕永路和平實八街,22.9918741,120.2408273
UN201905080298,"2019-05-08 19:53:42",南區,路燈故障,9盞以下路燈故障,"南區南門路295號 路燈故障",南區南門路295號,22.9775051,120.2037429
UN201905080299,"2019-05-08 19:54:32",安平區,路燈故障,9盞以下路燈故障,"安平區建平十二街，慶平公園旁 路燈故障",安平區建平十二街95號,22.9952776,120.1795271
UN201905080300,"2019-05-08 20:11:41",東區,違規停車,違規停車,"東區怡東路86巷（近怡東路頭） 違規停車",東區怡東路86巷,22.9928255,120.2280885
UN201905080302,"2019-05-08 20:21:03",中西區,違規停車,違規停車,"中西區民族路二段76號 違規停車",中西區民族路二段76號,22.9947876,120.2089152
UN201905080304,"2019-05-08 20:38:16",東區,違規停車,違規停車,"東區東寧路226號旁巷子 違停",臺南市東區東寧路226號,22.990795,120.225
UN201905080305,"2019-05-08 20:38:56",東區,路燈故障,9盞以下路燈故障,"東區崇明路145號 路燈故障",東區崇明路145號,22.9792275,120.2187159
UN201905080306,"2019-05-08 20:42:13",東區,噪音舉發,場所連續噪音,"東區林森路大東夜市 連續噪音",東區林森路大東夜市,22.9826132,120.2193412
UN201905080319,"2019-05-08 21:32:53",中西區,違規停車,違規停車,"中西區民族路二段76號 違規停車",中西區民族路二段76號,22.9947876,120.2089152
UN201905080320,"2019-05-08 21:40:39",永康區,髒亂及汙染,空氣汙染,"永康區大灣路1014號 空氣污染",臺南市永康區大灣路1014號,22.999921,120.253194
UN201905080322,"2019-05-08 21:56:08",北區,民生管線,漏水、停水、消防栓漏水或損壞,"北區海安路三段文元國小 漏水",北區海安路三段文元國小,23.0153635,120.199927
UN201905080323,"2019-05-08 21:57:12",中西區,違規停車,違規停車,"中西區民族路二段50號 違規停車",民族路二段50號騎樓,22.9946274,120.2106146
UN201905080324,"2019-05-08 21:58:01",中西區,違規停車,違規停車,"中西區民族路二段59號 違規停車",民族路二段59號,22.994358,120.2099209
UN201905080327,"2019-05-08 22:09:12",東區,噪音舉發,妨害安寧,"東區林森路二段105號 妨害安寧",東區林森路二段105號,22.9899747,120.2237012
UN201905080333,"2019-05-08 22:56:29",中西區,違規停車,違規停車,"中西區西華南街66／62號 違規停車",中西區西華南街66號,22.9941969,120.2096134
UN201905080334,"2019-05-08 22:58:32",中西區,違規停車,違規停車,"中西區民族路二段66號旁 違規停車",中西區民族路二段66號,22.9946307,120.210031
UN201905080336,"2019-05-08 23:05:42",中西區,違規停車,違規停車,"中西區民族路二段76號 違規停車",中西區民族路二段76號,22.9947876,120.2089152
UN201905080338,"2019-05-08 23:26:57",中西區,路燈故障,9盞以下路燈故障,"中西區五妃街125號，與慶中街路口，每朝漢堡右轉往阿柏快餐，轉角第一柱 路燈故障",中西區五妃街125號,22.9824417,120.2078948
UN201905090039,"2019-05-09 09:00:13",北區,違規停車,違規停車,"北區開元路286號 違停",臺南市北區開元路286號,23.008483,120.222651
UN201905090047,"2019-05-09 09:13:38",中西區,違規停車,違規停車,"中西區衛民街106-18號  違規停車",臺南市中西區衛民街106-18號,22.993176,120.209001
UN201905090057,"2019-05-09 09:29:31",東區,違規停車,違規停車,"東區裕農路8號 違停",臺南市東區裕農路8號,22.984938,120.224773
UN201905090064,"2019-05-09 09:44:01",東區,噪音舉發,妨礙安寧,"東區崇學路137號隔壁 妨礙安寧",臺南市東區崇學路137號,22.979333,120.222573
UN201905090067,"2019-05-09 09:52:26",永康區,違規停車,違規停車,永康區中華路862號違規停車,臺南市永康區中華路862號,23.019081,120.225669
UN201905090086,"2019-05-09 10:27:41",永康區,髒亂及汙染,空氣汙染,"永康區大灣路1014號 空氣汙染",臺南市永康區大灣路1014號,22.999921,120.253194
UN201905090093,"2019-05-09 10:36:43",永康區,違規停車,違規停車,"永康區中華路58巷52號 違規停車",臺南市永康區中華路58巷52號,23.001829,120.237398
