UN201905060023,"2019-05-06 08:04:52",東區,髒亂及汙染,空氣汙染,"東區府連東路37號   髒亂及汙染",臺南市東區府連東路37號,22.984427,120.217801
UN201905060059,"2019-05-06 09:54:19",永康區,噪音舉發,妨害安寧,"永康區四維街149巷34-1號 妨礙安寧",臺南市永康區四維街149巷34-1號,23.035003,120.250806
UN201905060093,"2019-05-06 11:22:04",中西區,違規停車,違規停車,"中西區民族路二段238號 違規停車",臺南市中西區民族路二段238號,22.997259,120.201768
UN201905060114,"2019-05-06 12:36:52",中西區,騎樓舉發,騎樓舉發,"中西區臨安路一段72號  騎樓舉發",臺南市中西區臨安路一段72號,22.99906,120.190805
UN201905060115,"2019-05-06 12:37:32",安平區,髒亂及汙染,其他汙染舉發,"安平區慶平路531對面之安平河  髒亂及汙染",臺南市安平區慶平路531號,22.997173,120.171899
UN201905060125,"2019-05-06 13:17:15",安平區,違規停車,違規停車,"安平區永華路二段791號  違規停車",臺南市安平區永華路二段791號,22.991015,120.169792
UN201905060127,"2019-05-06 13:31:33",中西區,違規停車,違規停車,"中西區民權路一段153號   違規停車",臺南市中西區民權路一段153號,22.991014,120.208342
UN201905060144,"2019-05-06 14:17:55",安平區,違規停車,違規停車,"安平區安平路252號  安平區安平路270號    安平區安平路334號  違規停車",臺南市安平區安平路252號,22.998586,120.179128
UN201905060188,"2019-05-06 16:21:17",永康區,髒亂及汙染,空氣汙染,"永康區大灣路1014號 空氣汙染",臺南市永康區大灣路1014號,22.999921,120.253194
