UN201905200002,"2019-05-20 00:10:52",南區,路燈故障,9盞以下路燈故障,"南區德興路與永興三街 路燈故障",德興路與永興三街,22.9648177,120.192107
UN201905200028,"2019-05-20 08:08:06",東區,違規停車,違規停車,"東區東安路288號  違規停車",臺南市東區東安路288號,22.99745,120.227543
UN201905200035,"2019-05-20 08:25:06",玉井區,路燈故障,9盞以下路燈故障,"玉井區玉南公路  路燈不亮",玉井區玉南公路,23.1060822,120.4703258
UN201905200038,"2019-05-20 08:30:38",北區,噪音舉發,場所連續噪音,"北區佑民街37號   連續噪音",北區佑民街37號,22.9991241,120.20572
UN201905200066,"2019-05-20 09:23:46",東區,路燈故障,9盞以下路燈故障,"東區莊敬路205巷   路燈故障",東區莊敬路205巷,22.9970978,120.232319
UN201905200067,"2019-05-20 09:25:39",歸仁區,髒亂及汙染,空氣汙染,"歸仁區保吉路73巷41號   空汙",臺南市歸仁區保吉路73巷41號,23.006954,120.276392
UN201905200070,"2019-05-20 09:27:14",新營區,違規停車,違規停車,"新營區民治路8-68號巷口處 違停",臺南市新營區民治路8之68號,23.311226,120.320603
UN201905200074,"2019-05-20 09:30:25",永康區,髒亂及汙染,空氣汙染,"永康區文賢街68巷1號  空氣汙染",臺南市永康區文賢街68巷1號,23.00633,120.272652
UN201905200083,"2019-05-20 09:46:58",北區,道路維修,人孔蓋或溝蓋聲響鬆動,"IVR 水溝蓋 北區中華西路二段 孔蓋脫落",北區中華西路二段,22.9965373,120.1865011
UN201905200084,"2019-05-20 09:47:42",北區,民生管線,漏水、停水、消防栓漏水或損壞,"北區勝利路190巷59號 民生管線",北區勝利路190巷59號,23.0044571,120.219958
UN201905200093,"2019-05-20 10:04:00",中西區,違規停車,違規停車,"中西區民族路二段76號 違規停車",臺南市民族路二段76號,22.994726,120.20925
UN201905200094,"2019-05-20 10:07:56",玉井區,交通運輸,號誌故障,"玉井區86東向隧道  號誌故障",玉井區86東向隧道,23.1060822,120.4703258
UN201905200116,"2019-05-20 10:58:20",七股區,路燈故障,9盞以下路燈故障,"七股區後港里台17線  9盞以下路燈故障",七股區後港里台17線,23.1833609,120.1333092
UN201905200169,"2019-05-20 12:45:12",永康區,動物救援,犬貓急難救援,"永康區龍中街697號 犬貓急難救援",永康區龍中街697號,23.041304,120.2612764
UN201905200172,"2019-05-20 12:50:58",佳里區,髒亂及汙染,道路散落物,"佳里區佳東路79號開始  道路散落物",佳里區佳東路79號,23.1699839,120.1808658
UN201905200177,"2019-05-20 13:03:06",下營區,噪音舉發,妨礙安寧,"下營區下營外環道  妨礙安寧",下營區下營外環道,23.236368,120.262464
UN201905200178,"2019-05-20 13:04:59",柳營區,路燈故障,9盞以下路燈故障,"柳營區旭山里山仔腳3號之16   路燈故障",柳營區旭山里山仔腳3號之16,23.270347,120.384743
UN201905200193,"2019-05-20 13:50:48",麻豆區,動物救援,犬貓急難救援,"麻豆區文昌路 犬貓急難救援",麻豆區文昌路,23.1866465,120.2531788
UN201905200194,"2019-05-20 13:52:19",安平區,噪音舉發,場所連續噪音,"安平區怡平路364號   連續噪音",安平區怡平路364號,22.9934529,120.177716
UN201905200204,"2019-05-20 14:08:18",永康區,違規停車,違規停車,"永康區中山南路20號  違規停車",臺南市永康區中山南路20號,23.011856,120.227165
UN201905200208,"2019-05-20 14:19:07",仁德區,道路維修,人孔蓋或溝蓋聲響鬆動,"仁德區中山路288號   孔蓋隆起",仁德區中山路288號,22.9709137,120.2591615
UN201905200211,"2019-05-20 14:26:11",南區,道路維修,路樹傾倒,"南區永成路二段479巷   路樹倒塌",南區永成路二段479巷,22.9479123,120.1955751
UN201905200225,"2019-05-20 15:21:39",後壁區,道路維修,路樹傾倒,"後壁區台172甲線往白河方向 路樹倒塌",後壁區台172甲線,23.3599977,120.3842561
UN201905200235,"2019-05-20 15:39:17",東區,路燈故障,9盞以下路燈故障,"東區前鋒路137巷17號 路燈故障",東區前鋒路137巷17號,22.9939611,120.212735
UN201905200240,"2019-05-20 15:42:57",下營區,道路維修,路樹傾倒,"下營區毛營里觀音寺200公尺前  路樹倒塌",下營區毛營里觀音寺,23.219533,120.283783
UN201905200248,"2019-05-20 15:51:04",東區,道路維修,地下道積水,"東區四維地下道 積水",東區四維地下道,22.994437,120.2124723
UN201905200250,"2019-05-20 15:54:29",南區,道路維修,人孔蓋或溝蓋聲響鬆動,"南區夏林路與五妃街口對面  孔蓋",南區夏林路五妃街,22.9826657,120.1949718
UN201905200283,"2019-05-20 16:44:15",安平區,道路維修,路面下陷、凹陷,"安平區安北路410號前 路面凹陷",安平區安北路410號,22.9999897,120.1529937
UN201905200286,"2019-05-20 16:47:44",後壁區,道路維修,路樹傾倒,"後壁區172甲線 路樹傾倒",後壁區172甲線,23.3599977,120.3842561
UN201905200296,"2019-05-20 17:14:40",中西區,民生管線,電信孔蓋鬆動、電信線路掉落、電信桿傾倒,"中西區府前路一段321號 圓形人孔蓋",中西區府前路一段321號,22.989732,120.1999028
UN201905200302,"2019-05-20 17:32:34",永康區,動物救援,遊蕩犬隻捕捉管制,"永康區中華路103號 遊蕩狗",永康區中華路103號,23.0019781,120.234592
UN201905200307,"2019-05-20 17:43:28",中西區,民生管線,漏水、停水、消防栓漏水或損壞,"中西區中正路跟西門路口  水管漏水",中西區中正路西門路,22.9927805,120.1985826
UN201905200327,"2019-05-20 18:25:53",東區,騎樓舉發,騎樓舉發,"東區北門路一段294號 騎樓舉發",臺南市東區北門路一段294號,22.995775,120.212029
UN201905200333,"2019-05-20 18:34:22",善化區,髒亂及汙染,空氣汙染,"善化區小新里小新營340號  髒亂及汙染",善化區小新里小新營340號,23.1219149,120.318951
UN201905200339,"2019-05-20 18:53:17",永康區,路燈故障,9盞以下路燈故障,路燈故障,永康區中正北路566號,23.0443081,120.260541
UN201905200343,"2019-05-20 19:03:11",永康區,路燈故障,9盞以下路燈故障,"永康區中正北路（正北一路交叉口到南科聯絡道之間）路段，分隔島上 路燈故障",永康區中正北路,23.0480009,120.2643381
UN201905200345,"2019-05-20 19:13:21",新市區,違規停車,違規停車,"新市區南科三路第四停車場 違規停車",新市區南科三路第四停車場,23.0986755,120.2801027
UN201905200347,"2019-05-20 19:37:23",東區,髒亂及汙染,空氣汙染,"東區育樂街35之28號 碳烤攤",東區育樂街35之28號,22.995369,120.2169165
UN201905200355,"2019-05-20 20:05:40",西港區,違規停車,違規停車,"西港區中山路52號  違規停車","121 西港區中山路52號",23.1160766,120.2042728
UN201905200357,"2019-05-20 20:09:11",西港區,違規停車,違規停車,"西港區新興街8-185號   違規停車",西港區新興街8-185號,23.1181492,120.2028298
UN201905200369,"2019-05-20 20:44:16",玉井區,路燈故障,9盞以下路燈故障,"玉井區玉田里217號  路燈故障",玉井區玉田里217號,23.1202824,120.4602459
UN201905200370,"2019-05-20 20:48:14",中西區,騎樓舉發,騎樓舉發,"中西區西華南街46到38號騎樓  騎樓舉發",臺南市中西區西華南街46號,22.993964,120.209545
UN201905200371,"2019-05-20 21:01:46",東區,違規停車,違規停車,"東區凱旋路338號 違規停車",東區凱旋路338號,22.9938921,120.226053
UN201905200374,"2019-05-20 21:12:12",中西區,路燈故障,9盞以下路燈故障,"中西區臨安路一段212巷跟臨安路一段交叉口  路燈故障",中西區臨安路一段212巷臨安路一段,23.0015382,120.1936063
UN201905200375,"2019-05-20 21:16:51",東區,噪音舉發,場所連續噪音,"東區大同路二段553號  場所連續噪音",東區大同路二段553號,22.968831,120.216209
UN201905200377,"2019-05-20 21:28:30",安南區,動物救援,遊蕩犬隻捕捉管制,"安南區培安路151號  動物救援",安南區培安路151號,23.0442026,120.2114158
UN201905200380,"2019-05-20 21:41:32",善化區,路燈故障,9盞以下路燈故障,"善化區西拉雅大道左轉陽光大道 路燈故障",善化區西拉雅大道左轉陽光大道,23.1084657,120.3033776
UN201905200381,"2019-05-20 21:42:18",中西區,違規停車,違規停車,"中西區西華南街60／62號 違規停車",臺南市中西區西華南街60號,22.994113,120.209579
UN201905200386,"2019-05-20 22:30:02",東區,路燈故障,9盞以下路燈故障,"東區龍山街111號 路燈故障",東區龍山街111號,22.9839413,120.2232838
UN201905200389,"2019-05-20 23:03:07",北區,噪音舉發,妨害安寧,"北區和緯路五段234巷4弄8號 妨害安寧",北區和緯路五段234巷4弄8號,23.0056052,120.1814682
UN201905200394,"2019-05-20 23:34:58",東區,噪音舉發,場所連續噪音,"東區東寧路120巷47前 噪音舉發",東寧路120巷47前,22.9911036,120.2222297
