UN201906240014,"2019-06-24 07:37:53",永康區,噪音舉發,場所連續噪音,"永康區鹽行路128巷隔壁  施工噪音",永康區鹽行路128巷,23.04303,120.2335802
UN201906240015,"2019-06-24 07:41:05",南區,路燈故障,9盞以下路燈故障,"南區永成路三段469號至481號之間 路燈故障",南區永成路三段469號,22.9730882,120.1952307
UN201906240020,"2019-06-24 07:57:35",新市區,道路維修,路面坑洞,"新市區中山路78巷11號 路面坑洞",新市區中山路78巷11號,23.0758643,120.3008589
UN201906240030,"2019-06-24 08:34:08",中西區,髒亂及汙染,道路散落物,"中西區府前路一段，介於莉莉冰果室與國術館之間 鼠屍",中西區府前路一段,22.9891387,120.2040586
UN201906240040,"2019-06-24 08:50:26",安南區,違規停車,違規停車,"安南區安中路四段87號 違停",臺南市安南區安中路四段87號,23.049491,120.17214
UN201906240048,"2019-06-24 09:08:59",中西區,違規停車,違規停車,"中西區民族路二段66號   違規停車",臺南市中西區民族路二段66號,22.994656,120.210177
UN201906240053,"2019-06-24 09:17:57",永康區,路燈故障,9盞以下路燈故障,"永康區大灣一街242巷  路燈不亮",永康區大灣一街242巷,23.0010411,120.2679599
UN201906240070,"2019-06-24 09:37:57",仁德區,髒亂及汙染,空氣汙染,"仁德區中山路154號 空氣汙染",仁德區中山路154號,22.970313,120.2643127
UN201906240081,"2019-06-24 09:46:03",北區,民生管線,停電、漏電、電線掉落、孔蓋鬆動,"北區賢北街170巷21號 台電孔蓋鬆動",北區賢北街170巷21號,23.0108404,120.1827598
UN201906240084,"2019-06-24 09:54:34",安南區,路燈故障,9盞以下路燈故障,"安南區城西街一段237號 路燈故障",安南區城西街一段237號,23.0600276,120.1254681
UN201906240085,"2019-06-24 09:59:52",安南區,動物救援,犬貓急難救援,"台灣歷史博物館旁邊山海圳綠道 犬貓急難救援",安南區郡安路四段,23.0281577,120.2098305
UN201906240108,"2019-06-24 10:47:39",安南區,違規停車,違規停車,"安南區同安路235號 違規停車",臺南市安南區同安路235號,23.042496,120.192062
UN201906240114,"2019-06-24 10:58:49",北區,違規停車,違規停車,"北區忠義路三段79號 違規停車",臺南市北區忠義路三段79號,23.000487,120.205605
UN201906240119,"2019-06-24 10:59:38",南區,道路維修,路面坑洞,"南區健康路一段&西門路口一段 道路維修",南區健康路一段西門路口一段,22.9815625,120.1974728
UN201906240122,"2019-06-24 11:07:18",東區,違規停車,違規停車,東區中華東路三段261號前　違規停車,臺南市東區中華東路三段261號,22.97512,120.224443
UN201906240135,"2019-06-24 11:29:08",善化區,髒亂及汙染,道路散落物,"善化區公所往光明路約500公尺處 道路散落物",善化區光明路,23.1310224,120.2952225
UN201906240142,"2019-06-24 11:45:55",將軍區,交通運輸,號誌故障,"將軍區南19鄉道49號 號誌故障",將軍區南19鄉道49號,23.1969768,120.1581034
UN201906240143,"2019-06-24 11:47:19",七股區,道路維修,路面坑洞,"七股區西部濱海公路 路面坑洞",七股區西部濱海公路,23.1206666,120.131713
UN201906240155,"2019-06-24 12:20:10",東區,道路維修,路面下陷、凹陷,"東區裕孝路127號 路面凹陷",東區裕孝路127號,22.987327,120.2436057
UN201906240160,"2019-06-24 12:34:57",新營區,髒亂及汙染,環境髒亂,"新營區延平路140巷56之8號 環境汙染",新營區延平路140巷56之8號,23.2978991,120.3119798
UN201906240170,"2019-06-24 13:08:41",白河區,動物救援,犬貓急難救援,"白河區河東里139-3號 犬貓急難救援",白河區河東里139-3號,23.3387183,120.4366991
UN201906240184,"2019-06-24 13:50:13",永康區,噪音舉發,場所連續噪音,"永康區南台街3巷6號旁 噪音",永康區南台街3巷6號,23.0218351,120.224193
UN201906240210,"2019-06-24 14:37:24",仁德區,違規停車,違規停車,"仁德區中正路二段1050號   違規停車",臺南市仁德區中正路二段1050號,22.967952,120.252889
UN201906240223,"2019-06-24 14:56:20",東區,違規停車,違規停車,"東區中華東路三段261號  違規停車",臺南市東區中華東路三段261號,22.97512,120.224443
UN201906240225,"2019-06-24 14:59:42",安定區,交通運輸,號誌故障,"安定區海龍派出所   交通運輸",安定區海龍派出所,23.087846,120.2287036
UN201906240233,"2019-06-24 15:22:50",仁德區,髒亂及汙染,道路散落物,"仁德區仁德交流道 道路散落物",仁德區仁德交流道,22.9396333,120.2555398
UN201906240235,"2019-06-24 15:24:04",中西區,騎樓舉發,騎樓舉發,"中西區西華南街38到48號騎樓 騎樓舉發",臺南市西華南街38號,22.993886,120.209524
UN201906240237,"2019-06-24 15:25:05",中西區,騎樓舉發,騎樓舉發,"中西區衛民街108到120號騎樓 騎樓舉發",臺南市衛民街108號,22.993346,120.208667
UN201906240244,"2019-06-24 15:37:01",永康區,道路維修,路面坑洞,"永康區太子路760號，電動車旁國1便道 路面坑洞",永康區太子路760號,22.9910915,120.2487831
UN201906240260,"2019-06-24 15:59:27",中西區,民生管線,電信孔蓋鬆動、電信線路掉落、電信桿傾倒,"中西區慶中街61號與63號之間  民生管線",中西區慶中街61號,22.9852923,120.2058262
UN201906240273,"2019-06-24 16:19:12",中西區,違規停車,違規停車,"中西區湖美街106-20號 違規停車",中西區湖美街106-20號,23.0036555,120.180005
UN201906240281,"2019-06-24 16:33:26",新營區,髒亂及汙染,空氣汙染,"新營紙廠-新營區南紙街94號或新營舒潔工廠/新營舒潔工廠-新營區太子路321號  空氣汙染",新營區南紙街94號,23.2988498,120.2942528
UN201906240285,"2019-06-24 16:37:33",安平區,路燈故障,9盞以下路燈故障,"安平區州平路  路燈不亮",安平區州平路,22.9992949,120.1469087
UN201906240302,"2019-06-24 17:34:04",中西區,違規停車,違規停車,中西區民族路二段95號、61號、47號、30-66號違規停車,中西區民族路二段95號61號47號30-66號,22.9944969,120.2090221
UN201906240307,"2019-06-24 17:47:53",永康區,交通運輸,佔用道路,"永康區仁愛街18號 佔用道路",永康區仁愛街18號,23.042032,120.2379289
UN201906240309,"2019-06-24 17:53:08",東區,違規停車,違規停車,"東區長榮路二段32巷73號 違停",東區長榮路二段32巷73號,22.9883142,120.2202681
UN201906240310,"2019-06-24 18:00:35",西港區,違規停車,違規停車,"西港區新興街8-185號 違規停車",西港區新興街8-185號,23.1181492,120.2028298
UN201906240317,"2019-06-24 18:13:55",永康區,髒亂及汙染,空氣汙染,"永康區和平東路117號 空汙",永康區和平東路117號,23.0551505,120.2655781
UN201906240324,"2019-06-24 18:33:39",永康區,道路維修,路面下陷、凹陷,"永康區中正路866號 路面坑洞",永康區中正路866號,23.0389363,120.239895
UN201906240326,"2019-06-24 18:55:02",南區,路燈故障,10盞以上路燈故障,"南區夏林路福吉路 路燈故障",南區夏林路福吉路,22.9832126,120.1949492
UN201906240328,"2019-06-24 19:01:29",北區,道路維修,路面坑洞,"北區海安路三段與文成三路 路面坑洞",北區海安路三段文成三路,23.0159976,120.2003873
UN201906240332,"2019-06-24 19:11:57",東區,違規停車,違規停車,"東區東寧路與長榮路路口 違停",東區東寧路長榮路,22.9920405,120.2215323
UN201906240334,"2019-06-24 19:23:02",北區,違規停車,違規停車,"北區成功路282號 違停",北區成功路282號,22.9995579,120.2018973
UN201906240335,"2019-06-24 19:26:19",永康區,動物救援,遊蕩犬隻捕捉管制,"永康區蔦松一街74巷21號 動物捕捉",永康區蔦松一街74巷21號,23.0460281,120.257323
UN201906240339,"2019-06-24 19:32:47",安平區,路燈故障,9盞以下路燈故障,"安平區平通路126號 路燈故障",安平區平通路126號,22.9925783,120.1798529
UN201906240340,"2019-06-24 19:33:48",東區,違規停車,違規停車,"東區裕農路448之1號 違規停車",東區裕農路448之1號,22.9880251,120.2320457
UN201906240342,"2019-06-24 19:35:47",東區,路燈故障,9盞以下路燈故障,"東區仁和路106之2號 路燈故障",東區仁和路106之2號,22.9737231,120.233167
UN201906240343,"2019-06-24 19:37:50",北區,路燈故障,9盞以下路燈故障,"北區和緯路一段68號 路燈不亮",北區和緯路一段68號,23.0096598,120.2148331
UN201906240345,"2019-06-24 19:41:30",中西區,路燈故障,9盞以下路燈故障,"中西區頂美三街121巷71弄10號 路燈故障",中西區頂美三街121巷71弄10號,23.0026022,120.184888
UN201906240348,"2019-06-24 19:49:39",東區,路燈故障,9盞以下路燈故障,"東區大同路二段61巷2號 路燈故障",東區大同路二段61巷2號,22.979554,120.2131706
UN201906240349,"2019-06-24 20:02:55",歸仁區,動物救援,犬貓急難救援,"歸仁區大通路和平路 貓受傷",歸仁區大通路和平路,22.9678665,120.2951792
UN201906240350,"2019-06-24 20:06:31",東區,違規停車,違規停車,"東區中華東路二段355號 違規停車",東區中華東路二段355號,22.981183,120.229685
UN201906240353,"2019-06-24 20:10:01",永康區,違規停車,違規停車,"永康區中華路和華興街 違規停車",永康區中華路華興街,23.0007836,120.2348585
UN201906240358,"2019-06-24 20:24:57",安南區,路燈故障,9盞以下路燈故障,安南區安和路四段36巷202號208號對面,安南區安和路四段36巷202號,23.0510583,120.223258
UN201906240359,"2019-06-24 20:29:49",歸仁區,路燈故障,10盞以上路燈故障,"歸仁區中山11街中山路三段高鐵橋 大範圍路燈不亮",歸仁區中山11街中山路三段高鐵橋,22.968756,120.276518
UN201906240362,"2019-06-24 20:47:30",南區,違規停車,違規停車,"南區德興路10號 違規停車",南區德興路10號,22.9669343,120.1921269
UN201906240363,"2019-06-24 20:58:05",東區,違規停車,違規停車,"東區林森路二段36巷  違規停車",東區林森路二段36巷,22.9863323,120.2230015
UN201906240366,"2019-06-24 21:06:17",六甲區,違規停車,違規停車,"六甲區中正路394號 違規停車",六甲區中正路394號,23.2270588,120.3514201
UN201906240367,"2019-06-24 21:14:14",柳營區,髒亂及汙染,空氣汙染,"柳營區中山東路2段956號 空汙",柳營區中山東路2段956號,23.2776687,120.3486354
UN201906240370,"2019-06-24 21:21:43",歸仁區,路燈故障,9盞以下路燈故障,"歸仁區八甲里大明三街21巷 路燈故障",歸仁區八甲里大明三街21巷,22.9758401,120.2985083
UN201906240372,"2019-06-24 21:32:55",歸仁區,動物救援,犬貓急難救援,"歸仁區民生十二街199號 貓受傷",歸仁區民生十二街199號,22.9547485,120.2739138
UN201906240373,"2019-06-24 21:37:25",安平區,路燈故障,9盞以下路燈故障,"安平區平通路148號 路燈故障",安平區平通路148號,22.9927021,120.1792063
UN201906240375,"2019-06-24 21:48:48",關廟區,髒亂及汙染,道路散落物,"關廟區中山路二段75號 路面散落物",關廟區中山路二段75號,22.958764,120.3274242
UN201906240376,"2019-06-24 21:50:09",安平區,違規停車,違規停車,"安平區國平路591巷56號 違規停車",安平區國平路591巷56號,22.9964772,120.1705697
UN201906240380,"2019-06-24 22:13:50",南區,髒亂及汙染,道路散落物,"南區中華南路二段110號 貓屍體",南區中華南路二段110號,22.9619937,120.1924816
UN201906240382,"2019-06-24 22:30:33",南區,違規停車,違規停車,"南區中華南路二段315巷12弄4號 違規停車",南區中華南路二段315巷12弄4號,22.9603486,120.1851479
UN201906240384,"2019-06-24 22:43:39",佳里區,髒亂及汙染,空氣汙染,"佳里區佳化里214號 空汙",佳里區佳化里214號,23.1896001,120.1919429
UN201906240386,"2019-06-24 22:55:24",北區,髒亂及汙染,空氣汙染,"北區海安路三段760號  空汙",北區海安路三段760號,23.0152922,120.2006061
UN201906240389,"2019-06-24 23:20:41",善化區,髒亂及汙染,空氣汙染,"善化區小新里小新營399號 空氣汙染",善化區小新里小新營399號,23.125444,120.3131
UN201906250004,"2019-06-25 01:17:26",北區,違規停車,違規停車,"北區勝利路214號 違規停車",臺南市北區勝利路214號,23.004501,120.21897
UN201906250005,"2019-06-25 02:07:12",安南區,道路維修,寬頻管線、孔蓋損壞,"安南區海佃路一段126-12號 孔蓋損壞",安南區海佃路一段126-12號,23.0231403,120.1919698
UN201906250007,"2019-06-25 04:36:59",永康區,路燈故障,9盞以下路燈故障,"永康區中正北路35號附近 路燈不亮",永康區中正北路35號,23.041583,120.238311
UN201906250016,"2019-06-25 06:19:22",南區,道路維修,路面掏空、塌陷,"南區德興路和中華南路二段交叉口，全家便利商店前快車道上 路面淘空",南區德興路和中華南路二段,22.9617129,120.1925822
UN201906250017,"2019-06-25 06:26:01",南區,交通運輸,號誌故障,"南區中華西路與新信路口 號誌故障",南區中華西路與新信路,22.9732136,120.1837283
UN201906250058,"2019-06-25 08:45:16",歸仁區,髒亂及汙染,空氣汙染,"歸仁區大埔路二段250巷50號 空氣汙染",歸仁區大埔路二段250巷50號,23.009958,120.2761648
UN201906250059,"2019-06-25 08:45:58",北區,髒亂及汙染,空氣汙染,北區正覺街125號,北區正覺街125號,23.0183878,120.2129776
UN201906250060,"2019-06-25 08:48:19",安南區,路燈故障,9盞以下路燈故障,"安南區海佃路一段95巷25號-9 路燈故障",安南區海佃路一段95巷25號-9,23.0217601,120.1909512
UN201906250073,"2019-06-25 09:16:40",仁德區,噪音舉發,場所連續噪音,"仁德區文華路三段189巷112號 場所連續噪音",文華路三段189巷112號,22.964278,120.2395568
UN201906250090,"2019-06-25 09:58:58",中西區,違規停車,違規停車,"中西區民族路二段76號   違規停車",臺南市中西區民族路二段76號,22.994726,120.20925
UN201906250093,"2019-06-25 10:02:39",永康區,道路維修,路面坑洞,"永康區龍中街 道路坑洞",永康區龍中街,23.0360182,120.2621007
UN201906250119,"2019-06-25 10:58:40",安南區,騎樓舉發,騎樓舉發,"安南區安和路一段159巷121弄24號 騎樓舉發",臺南市安南區安和路一段159巷121弄24號,23.031386,120.210754
UN201906250133,"2019-06-25 11:17:01",安南區,路燈故障,9盞以下路燈故障,"安南區本原街二段510巷32弄2號 路燈故障",安南區本原街二段510巷32弄2號,23.0550023,120.1786999
UN201906250149,"2019-06-25 11:42:22",中西區,違規停車,違規停車,"中西區海安路二段330巷1號     違停",臺南市中西區海安路二段330巷1號,22.999492,120.198528
UN201906250176,"2019-06-25 13:11:38",北區,髒亂及汙染,市區道路路面油漬,"北區中華西路跟和緯路口 路面油漬",北區中華西路和緯路,23.0084483,120.1859189
UN201906250194,"2019-06-25 14:05:04",安南區,髒亂及汙染,空氣汙染,"安南區安和路三段227號附近 空氣汙染",安南區安和路三段227號,23.0491748,120.2183686
UN201906250196,"2019-06-25 14:09:14",新市區,髒亂及汙染,空氣汙染,"新市區邱永漢工業區 空氣汙染",新市區邱永漢工業區,23.0785788,120.2991633
UN201906250206,"2019-06-25 14:26:03",東區,路燈故障,9盞以下路燈故障,"東區榮譽街105號 路燈故障",東區榮譽街105號,22.9752741,120.218203
UN201906250207,"2019-06-25 14:33:13",龍崎區,道路維修,路樹傾倒,"龍崎區182縣道21K  路樹倒塌",龍崎區182縣道,22.9480277,120.3918652
UN201906250215,"2019-06-25 14:54:11",中西區,違規停車,違規停車,"中西區永福路二段99號、103號 違規停車",臺南市中西區永福路二段99號,22.99329,120.200962
UN201906250224,"2019-06-25 15:09:42",永康區,道路維修,路面坑洞,"永康區中山南路1112號 路面坑洞",永康區中山南路1112號,23.0258464,120.2570642
UN201906250241,"2019-06-25 15:56:32",安南區,噪音舉發,妨礙安寧,"安南區安中路一段743號 噪音",安南區安中路一段743號,23.0433766,120.1946079
UN201906250248,"2019-06-25 16:14:10",東區,交通運輸,佔用道路,"東區裕農路8號   佔用道路",臺南市東區裕農路8號,22.984938,120.224773
UN201906250258,"2019-06-25 16:45:04",永康區,道路維修,路面坑洞,"永康區永大路三段高架橋   道路維修",永康區永大路三段高架橋,23.0346505,120.2594398
UN201906250266,"2019-06-25 16:58:19",安南區,道路維修,路面坑洞,"安南區安吉路一段601巷進入 坑洞",安南區安吉路一段601巷,23.0509102,120.1880916
UN201906250271,"2019-06-25 17:25:52",新營區,動物救援,遊蕩犬隻捕捉管制,"新營區民生路43-1號 遊蕩犬隻捕捉",新營區民生路43-1號,23.3064915,120.3087691
UN201906250272,"2019-06-25 17:26:02",東區,違規停車,違規停車,"東區東和路33號  違規停車",臺南市東區東和路33號,22.998604,120.229846
UN201906250278,"2019-06-25 17:31:38",北區,違規停車,違規停車,"北區勝利路138號 違規停車",臺南市北區勝利路138號,23.00221,120.21923
UN201906250284,"2019-06-25 17:43:40",仁德區,髒亂及汙染,市區道路路面油漬,"仁德區新田二街1號 路面油漬",仁德區新田二街1號,22.957533,120.2638735
UN201906250288,"2019-06-25 17:50:41",新營區,違規停車,違規停車,"新營區民治中心戶政事務所 違規停車",新營區民治中心戶政事務所,23.3115707,120.3140249
UN201906250289,"2019-06-25 17:52:17",永康區,髒亂及汙染,空氣汙染,永康區三村一街仁愛街,永康區三村一街仁愛街,23.0430901,120.2386157
UN201906250303,"2019-06-25 18:21:44",東區,髒亂及汙染,空氣汙染,"東區中華東路三段256號 空氣汙染",東區中華東路三段256號,22.9757974,120.2244811
UN201906250306,"2019-06-25 18:28:04",新市區,違規停車,違規停車,"新市區中正路162號 違規停車",新市區中正路162號,23.0742766,120.2914554
UN201906250307,"2019-06-25 18:32:57",永康區,動物救援,遊蕩犬隻捕捉管制,"永康區蔦松一街74巷21號 流浪狗捕捉",永康區蔦松一街74巷21號,23.0460281,120.257323
UN201906250315,"2019-06-25 18:50:01",中西區,違規停車,違規停車,"中西區大德街38號 違規停車",中西區大德街38號,22.9894749,120.195734
UN201906250317,"2019-06-25 18:52:17",麻豆區,髒亂及汙染,環境髒亂,"麻豆區溪美派出所 環境髒亂",麻豆區溪美派出所,23.1540857,120.2868909
UN201906250319,"2019-06-25 18:54:57",新市區,違規停車,違規停車,"新市區永就里永就81號之3 違規停車",新市區永就里永就81號之3,23.0627495,120.2932765
UN201906250321,"2019-06-25 18:59:42",永康區,噪音舉發,場所連續噪音,"永康區中山北路164巷110弄12號 連續噪音",永康區中山北路164巷110弄12號,23.0261722,120.2632132
UN201906250325,"2019-06-25 19:14:30",中西區,路燈故障,9盞以下路燈故障,"中西區友愛東街30號 路燈故障",中西區友愛東街30號,22.991552,120.2067557
UN201906250329,"2019-06-25 19:19:18",中西區,路燈故障,9盞以下路燈故障,"中西區正興街116號前 路燈不亮",中西區正興街116號,22.9945361,120.1963814
UN201906250332,"2019-06-25 19:28:28",中西區,違規停車,違規停車,"中西區金華路三段218號 違規停車",臺南市中西區金華路三段218號,22.994674,120.193804
UN201906250340,"2019-06-25 19:48:49",南區,路燈故障,9盞以下路燈故障,"南區興南街2巷 路燈故障",南區興南街2巷,22.925152,120.17889
UN201906250344,"2019-06-25 19:59:23",新市區,路燈故障,9盞以下路燈故障,"新市區富中街富安一街 路燈故障",新市區富中街富安一街,23.0797685,120.285442
UN201906250345,"2019-06-25 20:03:38",安南區,交通運輸,號誌故障,"安南區公學路五段527巷 號誌故障",安南區公學路五段527巷,23.0718454,120.1605473
UN201906250346,"2019-06-25 20:05:36",中西區,路燈故障,9盞以下路燈故障,"中西區光賢街19號對面 路燈故障",中西區光賢街19號,23.0044294,120.1874945
UN201906250347,"2019-06-25 20:06:38",北區,違規停車,違規停車,"北區立賢路一段31號 違規停車",臺南市北區立賢路一段31號,23.009153,120.206748
UN201906250349,"2019-06-25 20:09:46",下營區,髒亂及汙染,空氣汙染,"下營區和平街跟39號 空氣汙染",下營區和平街跟39號,23.2371016,120.2640896
UN201906250351,"2019-06-25 20:14:51",安南區,民生管線,漏水、停水、消防栓漏水或損壞,"安南區安中路一段702巷 停水",安南區安中路一段702巷,23.043641,120.1976776
UN201906250352,"2019-06-25 20:23:32",關廟區,髒亂及汙染,道路散落物,"關廟區南雄路一段1133號 道路散落物",關廟區南雄路一段1133號,22.9583192,120.3275955
UN201906250354,"2019-06-25 20:28:48",龍崎區,路燈故障,10盞以上路燈故障,"龍崎區182縣道 路燈故障十盞以上",龍崎區182縣道,22.9480277,120.3918652
UN201906250356,"2019-06-25 20:31:06",中西區,噪音舉發,妨害安寧,"中西區銀同里活動中心 妨害安寧",中西區銀同里活動中心,22.9922404,120.2055998
UN201906250358,"2019-06-25 20:33:15",安南區,路燈故障,9盞以下路燈故障,"安南區安興街192號 路燈故障",安南區安興街192號,23.0683391,120.1608637
UN201906250363,"2019-06-25 21:02:50",南區,髒亂及汙染,道路散落物,"南區明興路465號 路面散落物",南區明興路465號,22.9462001,120.183524
UN201906250368,"2019-06-25 21:24:46",東區,民生管線,漏水、停水、消防栓漏水或損壞,"東區中華東路三段336巷 民生管線",東區中華東路三段336巷,22.9747347,120.221018
UN201906250369,"2019-06-25 21:26:27",南區,違規停車,違規停車,"南區五妃街386巷19號 違規停車",臺南市南區五妃街386巷19號,22.983453,120.196089
UN201906250370,"2019-06-25 21:29:12",仁德區,髒亂及汙染,市區道路路面油漬,"仁德區大同路二段和保仁路 路面油漬",仁德區大同路二段保仁路,22.9708543,120.2150973
UN201906250374,"2019-06-25 21:48:35",中西區,路燈故障,9盞以下路燈故障,"中西區友愛東街20號 路燈故障",中西區友愛東街20號,22.9917792,120.2070063
UN201906250382,"2019-06-25 22:17:21",新營區,路燈故障,9盞以下路燈故障,"新營雙營橋 路燈故障",南紙街162巷9號,23.296408,120.2938559
UN201906250383,"2019-06-25 22:19:53",安南區,噪音舉發,妨害安寧,"安南區安和路五段250號 妨害安寧",安和路5段250號,23.0676269,120.2170785
UN201906250384,"2019-06-25 22:25:12",北區,違規停車,違規停車,"北區開元路右轉北園街 違規停車",北區開元路北園街,23.0091751,120.223352
UN201906250385,"2019-06-25 22:26:17",善化區,髒亂及汙染,道路散落物,"善化區益民寮17之2號 道路散落物",善化區益民寮17之2號,23.1165669,120.3000251
UN201906250386,"2019-06-25 22:27:44",南區,路燈故障,9盞以下路燈故障,"南區大成路二段29巷 路燈故障",南區大成路二段29巷,22.9742819,120.1969189
UN201906250388,"2019-06-25 22:54:42",北區,道路維修,路面下陷、凹陷,"北區小東路423巷 道路維修",北區小東路423巷,23.0002208,120.2329086
UN201906250389,"2019-06-25 22:56:42",南區,道路維修,路面下陷、凹陷,"南區永成路大成路 路面凹陷",南區永成路大成路,22.9749324,120.1953783
UN201906250392,"2019-06-25 23:23:19",中西區,違規停車,違規停車,"中西區美麗街10號對面圍牆 違規停車",中西區美麗街10號,23.0000316,120.189243
UN201906250393,"2019-06-25 23:36:58",東區,路燈故障,9盞以下路燈故障,"東區崇善路25巷70號 9盞以下路燈故障",東區崇善路25巷70號,22.9832988,120.2218006
UN201906260002,"2019-06-26 00:26:47",新營區,路燈故障,10盞以上路燈故障,"新營區南紙街156巷7號 路燈故障",南紙街156巷7號,23.2968823,120.2939087
UN201906260009,"2019-06-26 03:24:36",安南區,髒亂及汙染,空氣汙染,"安南區本田路三段71號 空氣汙染",臺南市安南區本田路三段71號,23.041327,120.159657
UN201906260023,"2019-06-26 07:28:05",南區,路燈故障,9盞以下路燈故障,"南區夏林路1號之20前  景觀燈故障",臺南市南區夏林路1號,22.987274,120.195129
UN201906260032,"2019-06-26 07:58:52",鹽水區,動物救援,遊蕩犬隻捕捉管制,"鹽水區清泉路180號 動物捕捉",鹽水區清泉路180號,23.3252839,120.2684111
UN201906260039,"2019-06-26 08:21:21",安南區,交通運輸,佔用道路,"安南區同安路237巷188號 佔用道路",臺南市安南區同安路237巷188號,23.044395,120.18974
UN201906260041,"2019-06-26 08:30:59",北區,道路維修,路面掏空、塌陷,"北區開元路394號  路面掏空",北區開元路394號,23.0102447,120.225005
UN201906260045,"2019-06-26 08:42:20",安南區,髒亂及汙染,環境髒亂,"安南區海德一路 環境髒亂",安南區海德一路,23.0322211,120.1880077
UN201906260050,"2019-06-26 08:55:42",中西區,噪音舉發,場所連續噪音,"中西區永華路一段98巷11號  連續噪音",中西區永華路一段98巷11號,22.9881295,120.1942159
UN201906260085,"2019-06-26 10:08:09",北區,道路維修,路面坑洞,"北區開元路上近485巷口 路面坑洞",北區開元路485巷,23.0108791,120.224417
UN201906260100,"2019-06-26 10:36:50",中西區,違規停車,違規停車,"中西區青年路112號 違規停車",臺南市中西區青年路112號,22.991863,120.208648
UN201906260106,"2019-06-26 10:50:53",北區,民生管線,漏水、停水、消防栓漏水或損壞,"北區北門路二段73號 民生管線",北區北門路二段73號,22.9989299,120.212362
UN201906260108,"2019-06-26 10:53:53",安平區,交通運輸,號誌故障,"安平區世平路1號 號誌故障",安平區世平路1號,22.9935902,120.1517736
UN201906260127,"2019-06-26 11:22:45",北區,動物救援,犬貓急難救援,北區實踐街7巷2號,北區實踐街7巷2號,23.014936,120.2164586
