UN201906260151,"2019-06-26 12:28:50",中西區,違規停車,違規停車,"中西區公園路36號 違規停車",臺南市中西區公園路36號,22.99457,120.205637
UN201906260155,"2019-06-26 12:43:17",中西區,交通運輸,佔用道路,"中西區北門路一段101號   佔用道路",臺南市中西區北門路一段101號,22.992288,120.211372
UN201906260179,"2019-06-26 14:08:39",關廟區,髒亂及汙染,空氣汙染,"關廟區關新路一段769號 空氣汙染",關廟區關新路一段769號,22.9936306,120.3085418
UN201906260182,"2019-06-26 14:17:05",中西區,道路維修,人孔蓋或溝蓋聲響鬆動,"中西區西賢街123號   雨水孔蓋鬆動",中西區西賢街123號,23.0023283,120.1787317
UN201906260201,"2019-06-26 14:55:13",東區,交通運輸,號誌故障,"東區東明里怡東路86巷 號誌故障",東區東明里怡東路86巷,22.9928255,120.2280885
UN201906260221,"2019-06-26 15:46:54",南區,路燈故障,9盞以下路燈故障,"南區大德街170巷 路燈故障",南區大德街170巷,22.9867853,120.1949523
UN201906260228,"2019-06-26 16:04:25",仁德區,違規停車,違規停車,"仁德區民安路一段363號 違規停車",臺南市仁德區民安路一段363號,22.95603,120.247825
UN201906260230,"2019-06-26 16:07:04",佳里區,民生管線,停電、漏電、電線掉落、孔蓋鬆動,"後壁區新家里 電線垂落",後壁區新家里,23.3689041,120.3060706
UN201906260237,"2019-06-26 16:29:31",安平區,噪音舉發,場所連續噪音,"安平區建平一街39號 場所連續噪音＆違建",安平區建平一街39號,22.9838061,120.1805068
UN201906260250,"2019-06-26 17:10:55",北區,路燈故障,9盞以下路燈故障,"北區育德一街87巷17號 路燈故障",北區育德一街87巷17號,23.0156295,120.2048139
UN201906260280,"2019-06-26 18:42:36",仁德區,髒亂及汙染,空氣汙染,"仁德區中正路一段過保安路二段，中正路旁 空氣污染",仁德區中正路一段,22.9264628,120.2420578
UN201906260290,"2019-06-26 19:29:14",永康區,髒亂及汙染,空氣汙染,"永康區永大一路31號 空氣汙染",永康區永大一路31號,23.0179476,120.2614227
UN201906260305,"2019-06-26 19:55:07",北區,路燈故障,9盞以下路燈故障,"北區長榮路五段452巷16號之1 路燈故障",北區長榮路五段452巷16號之1,23.0139366,120.21421
UN201906260307,"2019-06-26 19:57:40",安平區,路燈故障,9盞以下路燈故障,"安平區育平路育平八街 路燈故障",安平區育平路育平八街,22.9944394,120.1676016
UN201906260312,"2019-06-26 20:09:46",南區,違規停車,違規停車,"台南市立棒球場與游泳池及對面五妃廟 違規停車",臺南市南區健康路一段257號,22.981157,120.207182
UN201906260315,"2019-06-26 20:27:08",南區,路燈故障,9盞以下路燈故障,"南區中華南路二段300巷4弄11號 路燈故障",南區中華南路二段300巷4弄11號,22.9622212,120.1883013
UN201906260317,"2019-06-26 20:28:27",安南區,違規停車,違規停車,"安南區海佃路一段142號 違規停車",安南區海佃路一段142號,23.0238514,120.1918378
UN201906260328,"2019-06-26 21:26:50",歸仁區,髒亂及汙染,道路散落物,"歸仁區新豐高中的天橋往歸仁國中方向約50公尺左右 道路散落物",歸仁區中正北路一段148號,22.9718056,120.2955613
UN201906260335,"2019-06-26 22:07:34",永康區,噪音舉發,妨害安寧,"永康區新行街113號 妨害安寧",新行街113號,23.0407871,120.2419152
UN201906260344,"2019-06-26 23:16:33",南區,違規停車,違規停車,南區金華路二段240號,南區金華路二段240號,22.9811421,120.1915977
UN201906260345,"2019-06-26 23:29:03",東區,違規停車,違規停車,"東區中華東路一段10巷4弄6號 違規停車","6 Alley 4, Lane 10, Section 1, Zhonghua East Road",22.9977401,120.2339764
UN201906270028,"2019-06-27 08:07:14",柳營區,交通運輸,號誌故障,"ivr 國道三號柳營交流道 號誌燈故障",國道三號柳營交流道,23.2835718,120.3516125
UN201906270029,"2019-06-27 08:08:16",仁德區,動物救援,遊蕩犬隻捕捉管制,"仁德區都會公園  流浪犬",仁德區都會公園,22.9369957,120.2248916
UN201906270036,"2019-06-27 08:39:34",安平區,違規停車,違規停車,"安平區慶平路386號 違停",臺南市安平區慶平路386號,22.997093,120.17719
UN201906270054,"2019-06-27 09:24:11",佳里區,動物救援,犬貓急難救援,"佳里區塭內里蛤寮 狗",佳里區塭內里蛤寮,23.12542,120.162014
UN201906270069,"2019-06-27 09:54:14",北區,髒亂及汙染,小廣告、旗幟,"北區開南街143巷10弄33號 廣告張貼",北區開南街143巷10弄33號,23.0058267,120.2269695
UN201906270074,"2019-06-27 10:02:34",永康區,動物救援,犬貓急難救援,"永康中山南路12之5號  貓咪受困",永康中山南路12之5號,23.013443,120.232028
UN201906270090,"2019-06-27 10:32:13",永康區,動物救援,犬貓急難救援,"永康區永正路23號   貓咪受困",永康區永正路23號,23.0256258,120.2542159
UN201906270109,"2019-06-27 10:53:54",安定區,道路維修,路面坑洞,"安定區國道八號  道路坑洞",安定區國道八號,23.0897268,120.2156225
UN201906270115,"2019-06-27 11:00:57",南區,髒亂及汙染,環境髒亂,南區大成路二段29巷和西門路一段173巷道路,南區大成路二段29巷西門路一段173巷道路,22.9742905,120.1975022
UN201906270118,"2019-06-27 11:05:50",永康區,髒亂及汙染,環境髒亂,"永康區龍橋街291巷 髒亂及汙染",永康區龍橋街291巷,23.0401034,120.2635457
UN201906270121,"2019-06-27 11:08:36",南區,路燈故障,9盞以下路燈故障,"南區永成路三段461巷口對面 路燈不亮",南區永成路三段461巷,22.9729494,120.1945442
UN201906270125,"2019-06-27 11:14:11",仁德區,噪音舉發,場所連續噪音,"仁德區文善街107號後方 連續噪音",臺南市仁德區文善街107號,22.972883,120.242472
UN201906270129,"2019-06-27 11:31:43",南區,路燈故障,9盞以下路燈故障,"南區興南街2巷17號  路燈不亮",南區興南街2巷17號,22.925152,120.17889
UN201906270132,"2019-06-27 11:48:31",北區,髒亂及汙染,空氣汙染,"北區大武街203號之3 空氣汙染",北區大武街203號之3,23.0141258,120.2159238
UN201906270146,"2019-06-27 12:44:26",中西區,路燈故障,9盞以下路燈故障,"中西區永福路一段233巷  路燈故障",中西區永福路一段233巷,22.988862,120.1994626
UN201906270164,"2019-06-27 13:18:54",中西區,路燈故障,9盞以下路燈故障,"中西區正興街116號前 路燈不亮",中西區正興街116號,22.9945361,120.1963814
UN201906270167,"2019-06-27 13:26:39",東區,民生管線,停電、漏電、電線掉落、孔蓋鬆動,東區東門路一段137號道路維修,東門路一段137,22.9997281,120.2270277
UN201906270180,"2019-06-27 13:54:27",白河區,道路維修,路面坑洞,"白河區關子嶺 路面坑洞",白河區關子嶺,23.334893,120.500069
UN201906270181,"2019-06-27 13:56:32",安南區,民生管線,漏水、停水、消防栓漏水或損壞,"安南區環館三路與環館路交叉口  漏水",安南區環館三路環館路,23.0632067,120.2346128
UN201906270194,"2019-06-27 14:36:28",安南區,道路維修,路面坑洞,"安南區本田路一段和四草大道 路面坑洞",安南區本田路一段四草大道,23.0280185,120.1330046
UN201906270197,"2019-06-27 14:41:54",麻豆區,交通運輸,佔用道路,"麻豆區興國路25號，郵局對面 佔用道路",麻豆區興國路25號,23.1812941,120.2479925
UN201906270218,"2019-06-27 15:31:55",安南區,髒亂及汙染,道路散落物,"安南區海尾路 動物救援",安南區海尾路,23.0323197,120.178075
UN201906270241,"2019-06-27 16:12:56",歸仁區,路燈故障,9盞以下路燈故障,"歸仁區六甲路321巷36號 路燈故障",歸仁區六甲路321巷36號,22.9519835,120.2757055
UN201906270245,"2019-06-27 16:17:06",中西區,交通運輸,佔用道路,"中西區郡西路118號 交通運輸",中西區郡西路118號,22.9905492,120.194696
UN201906270249,"2019-06-27 16:24:09",北區,路燈故障,9盞以下路燈故障,"北區大和路&大興街口 路燈故障",北區大和路大興街,23.010899,120.1901655
UN201906270256,"2019-06-27 16:57:08",麻豆區,民生管線,漏水、停水、消防栓漏水或損壞,"麻豆區中正路80之44號 民生管線",麻豆區中正路80之44號,23.1860969,120.249869
UN201906270262,"2019-06-27 17:20:23",北區,違規停車,違規停車,"北區北園街124巷10弄11號對面 違規停車",北區北園街124巷10弄11號,23.0137634,120.2237822
UN201906270266,"2019-06-27 17:24:24",歸仁區,路燈故障,9盞以下路燈故障,"歸仁區六甲路321巷38號 路燈故障",歸仁區六甲路321巷38號,22.9519835,120.2757055
UN201906270275,"2019-06-27 17:46:05",安平區,路燈故障,9盞以下路燈故障,"安平區安平路226號前 路燈不亮",安平區安平路226號,22.9985955,120.1800817
UN201906270277,"2019-06-27 17:52:39",北區,髒亂及汙染,道路散落物,"北區北安路一段育德路 狗屍",北區北安路一段育德路,23.0181106,120.2079143
UN201906270279,"2019-06-27 18:01:33",歸仁區,動物救援,遊蕩犬隻捕捉管制,"歸仁區廣興街170巷 狗遊蕩捕捉",歸仁區廣興街170巷,23.0160793,120.2813785
UN201906270283,"2019-06-27 18:19:37",東區,違規停車,違規停車,"東區崇明路42號 違規停車",東區崇明路42號,22.9811008,120.2163941
UN201906270285,"2019-06-27 18:23:03",北區,違規停車,違規停車,"北區臨安海安路 違規停車",北區臨安海安路口,23.003892,120.199615
UN201906270288,"2019-06-27 18:27:21",南區,路燈故障,9盞以下路燈故障,"南區新興路107號前 路燈不亮",南區新興路107號,22.9785639,120.1958651
UN201906270294,"2019-06-27 18:43:17",永康區,交通運輸,號誌故障,"永康區西門路小北路 號誌故障",永康區西門路小北路,23.020804,120.2147961
UN201906270297,"2019-06-27 18:49:43",東區,髒亂及汙染,道路散落物,"東區中華東路三段 貓屍",東區中華東路三段,22.9750213,120.2239385
UN201906270299,"2019-06-27 18:54:29",南區,違規停車,違規停車,"南區文南路294號 違規停車",南區文南路294號,22.9867814,120.1902115
UN201906270300,"2019-06-27 19:00:37",中西區,路燈故障,9盞以下路燈故障,"中西區湖美二街106巷46弄11號 路燈故障",中西區湖美二街106巷46弄11號,23.0031133,120.1822883
UN201906270305,"2019-06-27 19:26:54",中西區,路燈故障,9盞以下路燈故障,"中西區友愛街56號 路燈故障",中西區友愛街56號,22.9913716,120.2004233
UN201906270306,"2019-06-27 19:30:05",東區,違規停車,違規停車,"東區育樂街46巷2號 違規停車",育樂街46巷2號,22.9955447,120.2169855
UN201906270307,"2019-06-27 19:30:54",永康區,髒亂及汙染,環境髒亂,"永康區中華路23巷1-1號 環境髒亂",中華路23巷1-1號,22.99965,120.234184
UN201906270310,"2019-06-27 19:40:45",新市區,路燈故障,9盞以下路燈故障,"新市區富中街跟富安一街口 路燈故障不亮",新市區富中街富安一街,23.0797685,120.285442
UN201906270312,"2019-06-27 19:46:20",北區,民生管線,漏水、停水、消防栓漏水或損壞,":北區育德路與立賢路一段交叉口 民生管線",:北區育德路,23.0116157,120.2062941
UN201906270330,"2019-06-27 20:35:32",山上區,動物救援,遊蕩犬隻捕捉管制,"山上區明和里232號 遊蕩犬隻捕捉管制",山上區明和里232號,23.106015,120.350878
UN201906270339,"2019-06-27 21:03:49",南區,違規停車,違規停車,"南區中華南路一段56號 違規停車",中華南路一段56號,22.9721551,120.2133727
UN201906270346,"2019-06-27 21:26:04",安南區,路燈故障,9盞以下路燈故障,"安南區安和路六段20巷106弄47號 路燈故障",安南區安和路六段20巷106弄47號,23.0704637,120.2167466
UN201906270347,"2019-06-27 21:28:18",北區,交通運輸,號誌故障,"北區和緯路五段湖美二街 號誌故障",北區和緯路五段湖美二街,23.0050454,120.1820006
UN201906270361,"2019-06-27 22:42:24",中西區,違規停車,違規停車,"中西區中華西路二段200巷 府前一街 違規停車","中華西路二段200巷 府前一街",22.9960892,120.187442
UN201906270363,"2019-06-27 23:08:28",後壁區,路燈故障,9盞以下路燈故障,"後壁區臺1線與南74線路口 路燈故障",後壁區南74線,23.3305976,120.3139296
UN201906270366,"2019-06-27 23:32:52",仁德區,噪音舉發,妨害安寧,"仁德區仁義路21巷1號騎樓 妨害安寧",仁德區仁義路21巷1號,22.9682641,120.2531845
UN201906280002,"2019-06-28 00:42:17",仁德區,路燈故障,9盞以下路燈故障,"仁德區大同路3段239號 路燈故障",臺南市仁德區大同路三段239號,22.955723,120.217797
UN201906280013,"2019-06-28 07:27:38",安南區,違規停車,違規停車,"安南區海佃路一段152號 違停",臺南市安南區海佃路一段152號,23.02399,120.191921
UN201906280019,"2019-06-28 08:04:37",中西區,道路維修,路面下陷、凹陷,"中西區民族路二段319號   道路維修",臺南市中西區民族路二段319號,22.996628,120.202839
UN201906280034,"2019-06-28 08:41:21",安平區,違規停車,違規停車,"安平區慶平路386號 違規停車",臺南市安平區慶平路386號,22.997093,120.17719
UN201906280062,"2019-06-28 09:57:20",安南區,違規停車,違規停車,"安南區海佃路一段152號 違停",臺南市安南區海佃路一段152號,23.02399,120.191921
UN201906280066,"2019-06-28 10:00:11",永康區,交通運輸,佔用道路,"永康區中華二路260號  佔用道路",臺南市永康區中華二路260號,23.008595,120.23319
UN201906280071,"2019-06-28 10:11:42",北區,動物救援,遊蕩犬隻捕捉管制,"北區和緯路三段228號 動物救援",臺南市北區和緯路三段228號,23.010746,120.197476
UN201906280122,"2019-06-28 11:29:00",中西區,違規停車,違規停車,"中西區民族路二段238號 違規停車",臺南市中西區民族路二段238號,22.997259,120.201768
UN201906280141,"2019-06-28 12:22:50",東區,違規停車,違規停車,"東區建東街45號 違停",臺南市東區建東街45號,22.990404,120.23669
UN201906280166,"2019-06-28 13:45:55",安平區,髒亂及汙染,空氣汙染,"安平區安平路590號 空氣汙染",臺南市安平區安平路590號,22.998773,120.169732
UN201906280185,"2019-06-28 14:19:39",中西區,違規停車,違規停車,"中西區民權路二段254號  違規停車",臺南市中西區民權路二段254號,22.996012,120.200491
UN201906280197,"2019-06-28 14:42:04",安平區,道路維修,路面坑洞,"安平區怡平路6號前 坑洞",臺南市安平區怡平路6號,22.992835,120.183004
UN201906280248,"2019-06-28 16:21:09",中西區,違規停車,違規停車,"中西區民族路二段66號旁巷內 違規停車",臺南市中西區民族路二段66號,22.994656,120.210177
UN201906280263,"2019-06-28 16:59:39",中西區,違規停車,違規停車,"中西區西華南街35號 違規停車",臺南市中西區西華南街35號,22.993889,120.209278
UN201906280265,"2019-06-28 17:02:44",中西區,違規停車,違規停車,"中西區民族路二段57巷38號 違規停車",臺南市中西區民族路二段57巷38號,22.993777,120.210601
UN201906280267,"2019-06-28 17:07:22",中西區,違規停車,違規停車,"中西區民族路二段7號 違規停車",臺南市中西區民族路二段7號,22.994343,120.21139
UN201906280292,"2019-06-28 18:06:42",中西區,違規停車,違規停車,"中西區衛民街106號、101號 違規停車",臺南市中西區衛民街106號,22.993151,120.209223
UN201906280311,"2019-06-28 19:06:03",永康區,違規停車,違規停車,"永康區小東路637號 違停",臺南市永康區小東路637號,22.998689,120.23822
UN201906280320,"2019-06-28 19:36:07",北區,違規停車,違規停車,"704台南市北區西門路四段101號 違規停車",臺南市北區西門路四段101號,23.007491,120.206236
UN201906280321,"2019-06-28 19:42:46",北區,路燈故障,9盞以下路燈故障,"北區海安路三段500巷100弄1號旁、13號旁 路燈不亮",臺南市北區海安路三段500巷100弄1號,23.010623,120.201033
UN201906280322,"2019-06-28 19:48:30",東區,髒亂及汙染,空氣汙染,"東區中華東路三段513號 空氣汙染",臺南市東區中華東路三段513號,22.972573,120.21658
UN201906280323,"2019-06-28 19:51:44",中西區,違規停車,違規停車,"中西區府前路一段63號 違規停車",臺南市中西區府前路一段63號,22.988605,120.209701
UN201906280335,"2019-06-28 20:37:26",永康區,路燈故障,9盞以下路燈故障,"永康區東橋十二街2號 路燈故障",臺南市永康區東橋十二街2號,23.023539,120.232954
