UN201907240072,"2019-07-24 09:01:33",安南區,違規停車,違規停車,"安南區同安路235號 違規停車",臺南市安南區同安路235號,23.042496,120.192062
UN201907240080,"2019-07-24 09:12:41",安南區,交通運輸,號誌故障,"安南區安中路一段546號 號誌故障",安南區安中路一段546號,23.0396705,120.2015284
UN201907240087,"2019-07-24 09:25:29",西港區,髒亂及汙染,市區道路路面油漬,"西港大橋西港端 路面油漬",西港大橋西港端,23.1069983,120.2054106
UN201907240109,"2019-07-24 09:48:42",安南區,違規停車,違規停車,"安南區同安路235號 違規停車",臺南市安南區同安路235號,23.042496,120.192062
UN201907240129,"2019-07-24 10:19:02",東區,髒亂及汙染,道路散落物,"東區東門路三段16號 道路散落物",東區東門路三段16號,22.9804097,120.2301882
UN201907240130,"2019-07-24 10:19:52",北區,交通運輸,號誌故障,"北區與臨安路二段165巷與康樂街 號誌故障",北區與臨安路二段165巷康樂街,23.0034653,120.198342
UN201907240151,"2019-07-24 11:02:41",歸仁區,路燈故障,9盞以下路燈故障,"歸仁區沙崙里233號 路燈故障",歸仁區沙崙里233號,22.9321981,120.3031871
UN201907240157,"2019-07-24 11:17:59",安南區,交通運輸,號誌故障,"安南區工明二路跟台江大道二段口 號誌故障",安南區工明二路台江大道二段,23.0576654,120.2065882
UN201907240158,"2019-07-24 11:18:18",安南區,路燈故障,9盞以下路燈故障,"安南區大安街243巷5號 路燈故障",安南區大安街243巷5號,23.0353201,120.194286
UN201907240172,"2019-07-24 11:34:34",中西區,髒亂及汙染,空氣汙染,"中西區民權路二段225號   髒亂及汙染",中西區民權路二段225號,22.9953381,120.2015765
UN201907240174,"2019-07-24 11:37:52",安南區,髒亂及汙染,空氣汙染,"安南區安興街195號 空氣汙染",安南區安興街195號,23.0682109,120.1614572
UN201907240183,"2019-07-24 12:00:02",安南區,路燈故障,9盞以下路燈故障,"安南區長和路四段160巷5弄152號 9盞以下路燈故障",安南區長和路四段160巷5弄152號,23.0683909,120.2069404
UN201907240184,"2019-07-24 12:03:15",永康區,髒亂及汙染,其他汙染舉發,"永康區大灣路1014號 其他汙染舉發",永康區大灣路1014號,22.9998521,120.2530293
UN201907240192,"2019-07-24 12:23:48",安南區,違規停車,違規停車,"安南區安中路四段87號 違規停車",臺南市安南區安中路四段87號,23.049491,120.17214
UN201907240204,"2019-07-24 12:46:29",安平區,路燈故障,9盞以下路燈故障,"安平區安港路安北路 路燈故障",安平區安港路安北路,23.1157954,120.202514
UN201907240209,"2019-07-24 12:58:15",中西區,路燈故障,9盞以下路燈故障,"中西區湖美二街46巷19號 路燈故障",中西區湖美二街46巷19號,23.001759,120.1822485
UN201907240219,"2019-07-24 13:23:17",安南區,髒亂及汙染,市區道路路面油漬,"安南區北安路二段63巷口   路面油漬",安南區北安路二段63巷,23.0257927,120.2031049
UN201907240223,"2019-07-24 13:34:23",安南區,違規停車,違規停車,"安南區同安路235號   違規停車",臺南市安南區同安路235號,23.042496,120.192062
UN201907240232,"2019-07-24 13:50:10",東區,髒亂及汙染,其他汙染舉發,"東區仁和路208巷37號 其他汙染舉發",東區仁和路208巷37號,22.9677208,120.2339979
UN201907240259,"2019-07-24 14:41:44",永康區,髒亂及汙染,空氣汙染,"康區環工路36-1號 空氣汙染",環工路36-1號,23.0436431,120.270041
UN201907240260,"2019-07-24 14:45:05",中西區,道路維修,人孔蓋或溝蓋聲響鬆動,"中西區湖美一街26巷21號旁，湖美二街上 雨水孔蓋鬆動",中西區湖美一街26巷21號,23.0002903,120.18186
UN201907240268,"2019-07-24 15:06:06",安南區,違規停車,違規停車,"安南區同安路235號 違規停車",臺南市安南區同安路235號,23.042496,120.192062
UN201907240270,"2019-07-24 15:11:48",新化區,髒亂及汙染,道路散落物,"新化區南175線機車道 道路散落物",新化區中興路325號,23.0258367,120.3273431
UN201907240274,"2019-07-24 15:18:19",南區,髒亂及汙染,道路散落物,"南區國民路和國民路583巷口，機車待轉區旁 道路散落物＆果實",南區國民路和國民路583巷,22.9738569,120.2051683
UN201907240293,"2019-07-24 15:55:02",北區,髒亂及汙染,小廣告、旗幟,"北區和緯路三段333號對面的變電箱 小廣告、旗幟",北區和緯路三段333號,23.0097593,120.1958396
UN201907240296,"2019-07-24 16:00:12",北區,髒亂及汙染,小廣告、旗幟,"北區文賢一路文賢路546巷 小廣告",北區文賢一路文賢路546巷,23.0075812,120.1961447
UN201907240299,"2019-07-24 16:04:51",安南區,路燈故障,9盞以下路燈故障,"安南區本原街510巷32弄2號 路燈故障",安南區本原街510巷32弄2號,23.0550023,120.1786999
UN201907240341,"2019-07-24 17:09:23",安南區,違規停車,違規停車,"安南區同安路235號 違規停車",臺南市安南區同安路235號,23.042496,120.192062
UN201907240354,"2019-07-24 17:43:08",麻豆區,髒亂及汙染,空氣汙染,"麻豆區麻口里10之3號 空氣汙染",麻豆區麻口里10之3號,23.1780997,120.2236562
UN201907240358,"2019-07-24 17:53:09",安平區,動物救援,遊蕩犬隻捕捉管制,"安平區水鳥公園 捕狗",安平區水鳥公園,23.002768,120.1541515
UN201907240376,"2019-07-24 18:27:29",永康區,交通運輸,號誌故障,"永康區中正北路952之12號 號誌故障",永康區中正北路952之12號,23.0559423,120.2744316
UN201907240389,"2019-07-24 18:55:02",佳里區,違規停車,違規停車,"佳里區光復路197號197-1號 違規停車",臺南市佳里區光復路197號,23.160105,120.174576
UN201907240393,"2019-07-24 19:08:29",永康區,路燈故障,9盞以下路燈故障,"永康區成功路99號 路燈故障",永康區成功路99號,23.0098574,120.2335863
UN201907240401,"2019-07-24 19:20:47",東區,交通運輸,佔用道路,"東區東門路二段267號 佔用道路",臺南市東區東門路二段267號,22.983845,120.225974
UN201907240409,"2019-07-24 19:41:14",北區,違規停車,違規停車,"北區東豐路227巷12號 違停",北區東豐路227巷12號,23.0038214,120.2205599
UN201907240413,"2019-07-24 19:44:52",鹽水區,路燈故障,10盞以上路燈故障,"鹽水區朝琴路178號 大範圍路燈不亮",鹽水區朝琴路178號,23.323961,120.2739
UN201907240416,"2019-07-24 19:49:32",南區,髒亂及汙染,空氣汙染,"南區夏林路280號 空氣汙染",南區夏林路280號,22.9772641,120.1951451
UN201907240423,"2019-07-24 20:12:27",安定區,噪音舉發,場所連續噪音,"安定區蘇林里1之22號 妨礙安寧",安定區蘇林里1之22號,23.1312267,120.2573885
UN201907240426,"2019-07-24 20:19:43",南區,路燈故障,9盞以下路燈故障,"南區公英五街1號 路燈故障",南區公英五街1號,22.9695848,120.2141825
UN201907240427,"2019-07-24 20:24:50",東區,路燈故障,9盞以下路燈故障,"東區仁和路139巷82號 路燈故障",東區仁和路139巷82號,22.9689458,120.2367638
UN201907240433,"2019-07-24 20:35:56",安南區,髒亂及汙染,環境髒亂,"安南區北安路二段60巷46號 環境髒亂",安南區北安路二段60巷46號,23.0271968,120.206123
UN201907240447,"2019-07-24 21:19:22",永康區,違規停車,違規停車,"永康區龍安街39巷5號 違規停車",永康區龍安街39巷5號,23.0331449,120.2639409
UN201907240449,"2019-07-24 21:20:53",東區,路燈故障,9盞以下路燈故障,"東區生產路618巷 路燈故障",東區生產路618巷,22.9656281,120.2316042
UN201907240450,"2019-07-24 21:24:12",東區,路燈故障,10盞以上路燈故障,"東區崇善十一街54巷16號 路燈故障",東區崇善十一街54巷16號,22.9704263,120.2325319
UN201907240451,"2019-07-24 21:25:09",安南區,路燈故障,9盞以下路燈故障,"安南區長溪路三段405巷40弄307號 路燈故障",安南區長溪路三段405巷40弄307號,23.0660237,120.1930651
UN201907240452,"2019-07-24 21:27:07",東區,道路維修,路面坑洞,"東區裕義路316號 路面坑洞",東區裕義路316號,22.9828573,120.2477994
UN201907240459,"2019-07-24 21:45:16",東區,噪音舉發,場所連續噪音,"東區樹林街一段79號 噪音舉發",樹林街一段79號,22.9859883,120.2150205
UN201907240465,"2019-07-24 22:00:35",南區,路燈故障,9盞以下路燈故障,"南區新建路26巷 路燈故障",南區新建路26巷,22.9693072,120.1845239
UN201907240468,"2019-07-24 22:09:07",新營區,違規停車,違規停車,"新營區民生路385巷13弄 違規停車",新營區民生路385巷13弄,23.3128748,120.3041638
UN201907240473,"2019-07-24 22:23:14",東區,噪音舉發,妨害安寧,東區文化二街186巷8號妨害安寧,文化二街186巷8號,22.9758401,120.2332835
UN201907240475,"2019-07-24 22:31:06",六甲區,路燈故障,9盞以下路燈故障,"六甲區林鳳營火車站 路燈故障",六甲區林鳳營火車站,23.2425712,120.3210204
UN201907240478,"2019-07-24 22:44:47",安南區,噪音舉發,妨害安寧,"安南區府安路四段218號 妨害安寧",安南區府安路四段218號,23.024567,120.20566
UN201907240485,"2019-07-24 23:12:45",安南區,噪音舉發,妨害安寧,"安南區府安路四段220號 妨害安寧",安南區府安路四段220號,23.0247031,120.2056536
UN201907240487,"2019-07-24 23:15:38",北區,路燈故障,9盞以下路燈故障,"北區文賢路1122巷146號 路燈故障",台南市北區文賢路1122巷146號,23.0169544,120.1974828
UN201907240490,"2019-07-24 23:22:02",南區,違規停車,違規停車,"南區金華路二段147巷37弄32號，金華公園旁停車場柵欄口 違規停車",南區金華路二段147巷37弄32號,22.980222,120.1895023
UN201907240493,"2019-07-24 23:44:30",永康區,髒亂及汙染,空氣汙染,"永康區大灣路1014號 空氣汙染",永康區大灣路1014號,22.9998521,120.2530293
UN201907250008,"2019-07-25 01:25:09",永康區,髒亂及汙染,空氣汙染,"永康區大灣路1014號 空氣汙染",臺南市永康區大灣路1014號,22.999921,120.253194
