UN201907290021,"2019-07-29 08:08:41",永康區,交通運輸,號誌故障,"永康區中正路529號 號誌故障",臺南市永康區中正路529號,23.039316,120.238472
UN201907290067,"2019-07-29 09:21:43",東區,違規停車,違規停車,"東區東寧路122號 違停",臺南市東區東寧路122號,22.991848,120.221797
UN201907290076,"2019-07-29 09:32:41",中西區,違規停車,違規停車,"中西區西華南街2-58號、民族路二段43-63號 違規停車",臺南市中西區西華南街58號,22.994066,120.20957
UN201907290077,"2019-07-29 09:32:57",安平區,違規停車,違規停車,"慶平路412號前 違停",臺南市安平區慶平路412號,22.997021,120.175597
UN201907290120,"2019-07-29 10:36:02",永康區,噪音舉發,妨害安寧,"永康區四維街149巷34之1號 妨害安寧",臺南市永康區四維街149巷34之1號,23.035003,120.250806
UN201907290192,"2019-07-29 12:48:15",中西區,違規停車,違規停車,"中西區民族路二段76號 違規停車",臺南市中西區民族路二段76號,22.994726,120.20925
UN201907290205,"2019-07-29 13:17:19",安南區,違規停車,違規停車,"安南區同安路235號  違規停車",臺南市安南區同安路235號,23.042496,120.192062
