UN201601070138,"2016-01-07 13:30:00",永康區,違規停車,違規停車,"勝學路34號 違規停車",臺南市台南市勝學路34號,23.001292,120.230886
UN201601070143,"2016-01-07 13:36:00",安平區,道路維修,路面坑洞,"安平區安平路850巷2號 坑洞",臺南市安平區安平路850巷2號,23.000184,120.158812
UN201601070170,"2016-01-07 14:29:00",安南區,路燈故障,9盞以下路燈故障,安南區安中路四段197巷49弄28號斜對面,臺南市安南區安中路四段197巷49弄28號,23.048784,120.168629
UN201601070172,"2016-01-07 14:35:00",中西區,違規停車,違規停車,"中西區赤崁街35號 違停",中西區赤崁街35號,22.9971255,120.2033208
UN201601070185,"2016-01-07 15:15:00",南區,違規停車,違規停車,"南區國民路165巷19號 違規停車",臺南市南區國民路165巷19號,22.966763,120.211829
UN201601070194,"2016-01-07 15:32:00",永康區,道路維修,路面坑洞,"永康區忠孝路70號前路中央 路面坑洞",臺南市永康區忠孝路70號,23.002906,120.240042
UN201601070196,"2016-01-07 15:44:00",永康區,違規停車,違規停車,"永康區大橋二街與中華路口 違停",永康區大橋二街與中華路口,23.019223,120.2277673
UN201601070207,"2016-01-07 14:58:00",東區,噪音舉發,防疫建議,"東區崇德十六街2之3號 噪音",東區崇德十六街2之3號,22.9695327,120.2278381
UN201601070211,"2016-01-07 16:24:00",永康區,違規停車,違規停車,"永康區中正路888號對面 違規停車",永康區中正路888號對面,23.039283246700187,120.23947890847921
UN201601070213,"2016-01-07 16:33:00",永康區,違規停車,違規停車,"永康區中華路912巷南臺科大周邊 違規停車",永康區中華路912巷南臺科大周邊,23.02062092826617,120.22512171417475
UN201601070221,"2016-01-07 16:49:00",永康區,違規停車,違規停車,"永康區中正路874號對面 違規停車",永康區中正路874號對面,23.03900093833328,120.23976758122443
UN201601070229,"2016-01-07 16:58:00",中西區,道路維修,人孔蓋聲響、凹陷、漏水,"中西區新美街71號 孔蓋聲響",臺南市中西區新美街71號,22.995492,120.200322
UN201601070242,"2016-01-07 17:27:00",中西區,違規停車,違規停車,"中西區西華南街65號前面及對面 違規停車",中西區西華南街65號前面及對面,22.994556687412896,120.20957093685865
UN201601070247,"2016-01-07 17:30:00",東區,違規停車,違規停車,"東區崇德路2號之一 違規停車",臺南市東區崇德路2號,22.982273,120.217253
UN201601070256,"2016-01-07 18:06:00",中西區,違規停車,違規停車,"中西區府緯街4巷1號前 違規停車",700台灣台南市中西區府緯街4巷一號前,22.984168534541297,120.19972890615463
UN201601070259,"2016-01-07 18:13:00",東區,路燈故障,9盞以下路燈故障,"東區凱旋路48號 路燈故障",臺南市東區凱旋路48號,22.993043,120.231977
UN201601070261,"2016-01-07 18:15:00",中西區,違規停車,違規停車,"中西區五妃街與健康路一段交叉口 違規停車",700台灣台南市中西區五妃街與健康路一段交叉口,22.982821229158386,120.20058687776327
UN201601070271,"2016-01-07 18:46:00",永康區,違規停車,違規停車,"永康區永安路365巷111^115號 違規停車",710台灣台南市永康區永安路365巷111^115號,23.040328862372647,120.24188384413719
UN201601070287,"2016-01-07 19:31:00",中西區,交通運輸,佔用道路,"中西區健康路/西門路 佔用道路",中西區健康路/西門路,22.9814998,120.1976489
UN201601070289,"2016-01-07 19:39:00",北區,違規停車,違規停車,"北區文成路/西門路口 違停",北區文成路/西門路口,23.0121133,120.2088016
UN201601070290,"2016-01-07 19:41:00",安平區,路燈故障,9盞以下路燈故障,"安平區育平七街123號 路燈故障",臺南市安平區育平七街123號,22.99307,120.165135
UN201601070291,"2016-01-07 19:47:00",東區,違規停車,違規停車,東區長榮路三段66巷和長榮路三段違規停車,長榮路三段66巷和長榮路三段轉角紅線,22.906594,120.3117384
UN201601070293,"2016-01-07 19:51:00",南區,騎樓舉發,騎樓舉發,"南區大同路二段162號 騎樓違停",南區大同路二段162號,22.9781879,120.2131587
UN201601070295,"2016-01-07 20:08:00",北區,違規停車,違規停車,"北區公園路512號 違停",北區公園路512號,23.0064066,120.2103275
UN201601070296,"2016-01-07 20:10:00",東區,違規停車,違規停車,"東區怡東路58巷和東興路交叉路口轉彎處紅線 違規停車",東區怡東路58巷和東興路交叉路口轉彎處紅線,22.9916876,120.2288634
UN201601070297,"2016-01-07 20:12:00",東區,違規停車,違規停車,"東區東安路48巷和東安路交叉路口 違規停車",東區東安路48巷和東安路交叉路口轉彎處紅線,22.9920111,120.2262493
UN201601070298,"2016-01-07 20:13:00",新營區,違規停車,違規停車,"中西區民生路一段28號門口 違規停車",700台灣台南市中西區民生路一段28號門口,22.99486285372619,120.19822485744953
UN201601070300,"2016-01-07 20:14:00",新營區,動物救援,遊蕩犬隻捕捉管制,"新營區三民路6之2號 流浪狗",新營區三民路6之2號,23.3073779,120.3220077
UN201601070307,"2016-01-07 20:34:00",北區,路燈故障,9盞以下路燈故障,"北區育德一街55號 路燈故障",臺南市北區育德一街55號,23.014693,120.205094
UN201601070309,"2016-01-07 20:45:00",中西區,違規停車,違規停車,"中西區南寧街27號旁的轉角 違規違停",臺南市中西區南寧街27號,22.984468,120.204962
UN201601070310,"2016-01-07 20:52:00",東區,違規停車,違規停車,"東區裕農一街76～88號前 違規停車",東區裕農一街76^88號前,22.9861012,120.2383466
UN201601070312,"2016-01-07 21:06:00",中西區,違規停車,違規停車,"中西區金華路四段78號 違停、佔用道路",中西區金華路四段78號,22.9980051,120.194988
UN201601070313,"2016-01-07 21:08:00",南區,違規停車,違規停車,"南區中華南路一段55號前 違停",臺南市南區中華南路一段55號,22.971755,120.213435
UN201601070320,"2016-01-07 21:58:00",南區,違規停車,違規停車,"南區文南路與金華路二段385巷路口 違規停車",南區文南路與金華路2段385巷路口,22.9849818,120.1899424
UN201601070321,"2016-01-07 22:04:00",安南區,動物救援,遊蕩犬隻捕捉管制,"安南區府安路五段105巷底到重劃區(目前施工區)一帶 捕犬",709台灣台南市安南區府安路五段105巷底,23.0249059,120.2000209
UN201601070322,"2016-01-07 22:04:00",東區,噪音舉發,妨礙安寧,"東區林森路二段86號 妨礙安寧",東區林森路二段86號,22.986863,120.223257
UN201601070323,"2016-01-07 22:18:00",南區,髒亂及汙染,空氣汙染,"南區金華路二段200號(廣東沙茶爐) 空氣汙染",臺南市南區金華路二段200號,22.980204,120.191515
UN201601070325,"2016-01-07 23:07:00",北區,噪音舉發,妨礙安寧,"北區公園路788巷37弄6號 妨礙安寧、空氣汙染",臺南市北區公園路788巷37弄6號,23.011469,120.212168
UN201601070326,"2016-01-07 23:22:00",東區,噪音舉發,妨礙安寧,"東區中華東路一段209號(燒出名堂)燒烤店  妨礙安寧",東區中華東路一段209號(燒出名堂),22.9902371,120.2337975
UN201601070327,"2016-01-07 23:25:00",南區,噪音舉發,妨礙安寧,"南區南明街43號4樓之8 妨礙安寧",臺南市南區南明街43號,22.984459,120.188125
UN201601070328,"2016-01-07 23:30:00",永康區,違規停車,違規停車,"永康區中華路703巷3弄26號 違規停車",701台灣台南市永康區中華路703巷3弄26號,22.997163708391966,120.21296594291925
UN201601080001,"2016-01-08 00:06:00",永康區,噪音舉發,妨礙安寧,"永康區永二街459巷21號 妨礙安寧",臺南市永康區永二街459巷21號,23.019262,120.245377
UN201601080004,"2016-01-08 00:14:00",安南區,噪音舉發,妨礙安寧,"安南區同安路225巷28號對面鐵工廠旁 妨礙安寧",安南區同安路225巷28號對面鐵工廠旁,23.0391753,120.1884986
UN201601080007,"2016-01-08 03:21:00",佳里區,髒亂及汙染,空氣汙染,"佳里區四維三街100號對面 空汙",佳里區四維三街100號對面,23.1505732,120.1751235
UN201601080008,"2016-01-08 05:27:00",東區,噪音舉發,妨礙安寧,"東區裕農路752號 妨礙安寧/噪音",臺南市東區裕農路752號,22.988732,120.238186
UN201601080009,"2016-01-08 05:41:00",東區,噪音舉發,妨礙安寧,"東區崇學路135巷10號 妨礙安寧",臺南市東區崇學路135巷10號,22.979502,120.222328
UN201601080010,"2016-01-08 06:45:00",永康區,違規停車,違規停車,"永康區中華路703巷3弄26號 違規停車",701台灣台南市永康區中華路703巷3弄26號,22.997163708391966,120.21296594291925
UN201601080013,"2016-01-08 07:22:00",北區,違規停車,違規停車,"北區勝利路214號 違規停車",704台灣台南市北區勝利路214號,23.00451,120.2189761
UN201601080014,"2016-01-08 07:21:00",北區,動物救援,犬貓急難救援,"北區大武街354之9號附近 犬貓救援",臺南市北區大武街354之9號,23.016705,120.217916
UN201601080017,"2016-01-08 07:32:00",北區,違規停車,違規停車,"北區北門路二段547巷和北門路二段口交叉口 違規停車",北區北門路二段547巷和北門路二段口交叉口,22.9983177,120.2123577
UN201601080018,"2016-01-08 07:46:00",北區,民生管線,漏水、停水、消防栓漏水或損壞,"北區公園路918巷10弄37號前方 漏水",臺南市北區公園路918巷10弄37號,23.013766,120.213848
UN201601080024,"2016-01-08 08:16:00",南區,違規停車,違規停車,"南區大同路二段750巷26號 違規停車",702台灣台南市南區大同路二段750巷26號,22.9659562,120.2158002
UN201601080033,"2016-01-08 08:33:00","北 區",違規停車,違規停車,"永康區大橋二街51巷45弄75號 違規停車",710台灣台南市永康區大橋二街51巷45弄75號,23.0167349730259,120.22349528968334
UN201601080039,"2016-01-08 08:43:00",北區,髒亂及汙染,場所連續噪音,"北區實踐街39巷99弄13號-1到13號-3 噪音/空氣汙染/環境髒亂",臺南市北區實踐街39巷99弄13號,23.016326,120.218429
UN201601080044,"2016-01-08 09:00:00",中西區,民生管線,漏水、停水、消防栓漏水或損壞,中西區府前路一段155號前路中央路面滲水,臺南市中西區府前路一段155號,22.988708,120.206647
UN201601080047,"2016-01-08 09:01:00",安平區,路燈故障,9盞以下路燈故障,"安平區安北路131巷12號的東邊 路燈故障",臺南市安平區安北路131巷12號,23.002272,120.162489
UN201601080048,"2016-01-08 09:02:00",南區,路燈故障,9盞以下路燈故障,"南區明興路619巷214號 路燈",臺南市南區明興路619巷214號,22.940505,120.186085
UN201601080049,"2016-01-08 09:04:00",永康區,違規停車,違規停車,"永康區新中街303號 違規停車",710台灣台南市永康區新中街303號,23.040043779411818,120.2437949180603
UN201601080066,"2016-01-08 09:42:00",中西區,髒亂及汙染,小廣告、旗幟,"中西區青年路112號 小廣告",臺南市中西區青年路112號,22.991863,120.208648
UN201601080071,"2016-01-08 09:58:00",安南區,路燈故障,9盞以下路燈故障,"安南區府安路三段331號 路燈故障",臺南市安南區府安路三段331號,23.027713,120.217228
UN201601080078,"2016-01-08 10:18:00",中西區,違規停車,違規停車,"中西區北門路一段兩側 違規停車",701台灣台南市中西區北門路一段,22.994411937170252,120.21198995411397
UN201601080080,"2016-01-08 10:23:00",新營區,違規停車,違規停車,"下營區中山路一段127號 違規停車",735台灣台南市下營區中山路一段127號,23.235492051682566,120.26379849761724
UN201601080081,"2016-01-08 10:24:00",新營區,違規停車,違規停車,"下營區中山路一段302-324號 違規停車",735台灣台南市下營區中山路一段302-324號,23.23706449427621,120.26691388338806
UN201601080084,"2016-01-08 10:27:00",中西區,違規停車,違規停車,"中西區公園路113號 違規停車",臺南市中西區公園路113號,22.996532,120.206031
UN201601080085,"2016-01-08 10:28:00",中西區,違規停車,違規停車,"中西區公園路86號 違規停車",臺南市中西區公園路86號,22.996315,120.206226
UN201601080092,"2016-01-08 10:41:00",新營區,違規停車,違規停車,"下營區中山路一段302-324號 違規停車",735台灣台南市下營區中山路一段302-324號,23.23681371803546,120.26639286428689
UN201601080097,"2016-01-08 11:01:00",安南區,噪音舉發,場所連續噪音,"安南區北安路二段32巷24號 噪音",臺南市安南區北安路二段32巷24號,23.025371,120.206433
UN201601080108,"2016-01-08 11:13:00",永康區,違規停車,違規停車,"永康區中正路545號前.890號周圍.888號對面 違規停車",永康區中正路545號前.890號周圍.888號對面,23.039342793635374,120.23943834006785
UN201601080113,"2016-01-08 11:15:00",永康區,違規停車,違規停車,"永康區中正六街67號對面 違規停車",永康區中正六街67號對面,23.03695626761863,120.23761745542288
UN201601080114,"2016-01-08 11:19:00",永康區,違規停車,違規停車,"永康區中正南路652號 違停",臺南市永康區中正南路652號,23.03878,120.234449
UN201601080117,"2016-01-08 11:21:00",永康區,違規停車,違規停車,"永康區中山南路119巷2-8號 違規停車",710台灣台南市永康區中山南路119巷2-8號,23.013673,120.2301683
UN201601080121,"2016-01-08 11:35:00",北區,違規停車,違規停車,"北區育德一街（立賢路到和緯路之間） 違規停車",北區育德一街（立賢路到和緯路之間）,23.0150561,120.2052315
UN201601080127,"2016-01-08 11:42:00",新市區,違規停車,違規停車,"新市區永就59-3號旁 違規停車",臺南市新市區永就59-3號,23.064107,120.294022
UN201601080129,"2016-01-08 11:47:00",永康區,違規停車,違規停車,"永康區中正七街1.22.23.27.68.70號 違規停車",永康區中正七街1.22.23.27.68.70號,23.039877172207355,120.23996371775866
UN201601080131,"2016-01-08 11:09:00",新營區,路燈故障,9盞以下路燈故障,"新營區角帶里2鄰21號 路燈",臺南市新營區角帶里2鄰21號,23.28426,120.264102
UN201601080132,"2016-01-08 11:49:00",中西區,違規停車,違規停車,"中西區衛民街127號到141號 違規停車",臺南市中西區衛民街127號,22.993252,120.207773
UN201601080133,"2016-01-08 11:51:00",東區,違規停車,違規停車,"東區林森路一段機車專用道(監理站→大同路方向 靠近地下道) 違規停車",701台灣台南市東區林森路一段機車專用道,22.9821378,120.2152753
UN201601080139,"2016-01-08 12:05:00",南區,違規停車,違規停車,"南區金華路二段27巷40號 違規停車",702台灣台南市南區金華路二段27巷40號,22.976853054750048,120.18949250859828
UN201601080143,"2016-01-08 12:08:00",中西區,違規停車,違規停車,"中西區海安路一段166號 違停",臺南市中西區海安路一段166號,22.990089,120.195485
UN201601080146,"2016-01-08 12:23:00",永康區,違規停車,違規停車,"永康區中正七街22.70號 違規停車",永康區中正七街22.70號,23.040625051822808,120.24049781262875
UN201601080147,"2016-01-08 12:26:00",南區,違規停車,違規停車,"南區金華路二段27巷45號 違規停車",702台灣台南市南區金華路二段27巷45號,22.9767253,120.1893465
UN201601080148,"2016-01-08 12:25:00",安南區,噪音舉發,妨礙安寧,"安南區北安路二段398號對面 妨礙安寧",臺南市安南區北安路二段398號,23.033589,120.204355
UN201601080149,"2016-01-08 12:31:00",中西區,髒亂及汙染,空氣汙染,"中西區環河街運河邊 空氣汙染",台南市環河街,23.00376,120.2120462
UN201601080151,"2016-01-08 12:32:00",北區,違規停車,違規停車,"北區東豐路239與241號前 違停",臺南市北區東豐路239與241號,23.003236,120.221316
UN201601080156,"2016-01-08 12:45:00","東 區",違規停車,違規停車,"東區大學路22巷11號 違規停車",701台灣台南市東區大學路22巷11號,22.995538145519138,120.22133409976958
UN201601080167,"2016-01-08 13:20:00","東 區",違規停車,違規停車,"東區大學路西段89號 違規停車",701台灣台南市東區大學路西段89號,22.996866806210736,120.21407000720501
UN201601080170,"2016-01-08 13:32:00",北區,違規停車,違規停車,"北區公園路599之8號 違停",臺南市北區公園路599之8號,23.01459,120.212764
UN201601080171,"2016-01-08 13:32:00",南區,違規停車,違規停車,"南區金華路二段385巷42號 違停",臺南市南區金華路二段385巷42號,22.986739,120.190454
UN201601080174,"2016-01-08 13:38:00",南區,交通運輸,佔用道路,"南區文南路286號 佔用道路",臺南市南區文南路286號,22.986534,120.190192
UN201601080175,"2016-01-08 13:40:00","東 區",違規停車,違規停車,"東區大學路3號  違規停車",701台灣台南市東區大學路3號,22.99553907141965,120.22119596600531
UN201601080182,"2016-01-08 13:56:00",安南區,交通運輸,佔用道路,"安南區開安六街240號 佔用道路",臺南市安南區開安六街240號,23.049667,120.226553
UN201601080194,"2016-01-08 14:22:00",中西區,違規停車,違規停車,"中西區西華南街65號 違規停車",臺南市中西區西華南街65號,22.994684,120.209521
UN201601080198,"2016-01-08 14:36:00",仁德區,違規停車,違規停車,"仁德區中正西路59-5號 違規停車",臺南市仁德區中正西路59-5號,22.917904,120.22374
UN201601080201,"2016-01-08 14:42:00",中西區,違規停車,違規停車,"中西區中山路164巷5號 違規停車",700台灣台南市中西區中山路164巷5號,22.99500204806041,120.21034844219685
UN201601080207,"2016-01-08 14:49:00",安平區,噪音舉發,場所連續噪音,"安平區平豐路和府平路口 空氣/噪音汙染",安平區平豐路和府平路口,22.9872662,120.1643602
UN201601080213,"2016-01-08 15:01:00",永康區,民生管線,人孔蓋聲響、凹陷、漏水,永康區王行路741號前人孔蓋鬆動,臺南市永康區王行路741號,23.052033,120.27357
UN201601080216,"2016-01-08 15:05:00",中西區,違規停車,違規停車,"東區前鋒路160號 違規停車",701台灣台南市東區前鋒路160號,22.995432901453658,120.21344907581806
UN201601080243,"2016-01-08 16:04:00",新營區,違規停車,違規停車,"新營區中興路28號  違規停車",730台灣台南市新營區中興路28號,23.30267925785152,120.31697530299424
UN201601080244,"2016-01-08 16:08:00",永康區,噪音舉發,妨礙安寧,"永康區信義街104號  妨礙安寧",臺南市永康區信義街104號,23.010693,120.270733
UN201601080250,"2016-01-08 16:17:00",南區,民生管線,停電、漏電、電線掉落、孔蓋鬆動,"南區西門路一段421號 孔蓋",臺南市南區西門路一段421號,22.980382,120.197448
UN201601080252,"2016-01-08 16:26:00",中西區,違規停車,違規停車,"中西區國華街二段靠永華路一段路口 違規停車",700台灣台南市中西區國華街二段36號,22.9877914,120.1961829
UN201601080254,"2016-01-08 16:29:00",南區,交通運輸,佔用道路,"南區文南路286號 佔用道路",臺南市南區文南路286號,22.986534,120.190192
UN201601080255,"2016-01-08 16:29:00",新營區,違規停車,違規停車,"鹽水區文武街160號 違規停車",737台灣台南市鹽水區文武街160號,23.322543988766835,120.26516005396844
UN201601080259,"2016-01-08 16:37:00",永康區,違規停車,違規停車,"永康區新中街(中正路到正南五街) 違規停車",永康區新中街(中正路到正南五街),23.036259893883184,120.24038549512626
UN201601080264,"2016-01-08 16:43:00",永康區,違規停車,違規停車,"永康區新中街1號寶貝熊便利商店周邊 違規停車",永康區新中街1號寶貝熊便利商店周邊,23.035282126015623,120.2385662868619
UN201601080266,"2016-01-08 16:43:00",永康區,違規停車,違規停車,"永康區中華路912巷南臺科大周邊 違規停車",永康區中華路912巷南臺科大周邊,23.02062154541843,120.2251123264432
UN201601080272,"2016-01-08 16:52:00",永康區,髒亂及汙染,環境髒亂,"永康區正南三路與尚頂路交叉路口周邊 髒亂及汙染",永康區正南三路與尚頂路交叉路口周邊,23.02631465486651,120.23191574960948
UN201601080273,"2016-01-08 16:53:00",北區,違規停車,違規停車,"北區大武街597巷南康橋上 違規停車",北區大武街597巷南康橋上,23.01839854463838,120.22164791822433
UN201601080281,"2016-01-08 17:03:00",中西區,違規停車,違規停車,"中西區興華街37～45號 違規停車",臺南市興華街37～45號,22.992724,120.211459
UN201601080284,"2016-01-08 17:08:00",東區,違規停車,違規停車,"東區182縣道(東門路二段)79-89號 違規停車",701台灣台南市東區182縣道79-89號,22.9858009,120.2214676
UN201601080289,"2016-01-08 17:23:00",安平區,騎樓舉發,騎樓舉發,"安平區華平路656號 騎樓舉發",708台灣台南市安平區華平路656號,22.996021773351817,120.17580360174179
UN201601080295,"2016-01-08 17:38:00",東區,違規停車,違規停車,"東區榮譽街84巷55號 違規停車",台南市東區榮譽接街84巷55號,22.912057,120.2714917
UN201601080296,"2016-01-08 17:45:00","東 區",違規停車,違規停車,"東區台南車站前站機車臨時停放區 違規停車",東區台南車站前站機車臨時停放區,22.996861250862256,120.21212339401247
UN201601080297,"2016-01-08 17:56:00",中西區,違規停車,違規停車,"中西區開山路192號 違規停車",700台灣台南市中西區開山路192號,22.98675415032394,120.2092571184039
UN201601080304,"2016-01-08 18:07:00",永康區,交通運輸,佔用道路,"永康區正新街65號對面 佔用道路",臺南市永康區正新街65號,23.020181,120.222183
UN201601080311,"2016-01-08 18:10:00",南區,路燈故障,9盞以下路燈故障,"南區鯤鯓路101巷700號^710號  路燈不亮",臺南市南區鯤鯓路101巷700號,22.955447,120.173875
UN201601080318,"2016-01-08 18:47:00",中西區,違規停車,違規停車,"中西區西門路一段676巷口 違規停車",700台灣台南市中西區西門路一段676巷口,22.9896135,120.1986721
UN201601080321,"2016-01-08 18:47:00",中西區,違規停車,違規停車,"中西區民生路二段97號週邊 違停",臺南市中西區民生路二段97號,22.995096,120.19674
UN201601080322,"2016-01-08 18:53:00",永康區,交通運輸,佔用道路,"永康區復國二路242號附近 佔用道路",臺南市永康區復國二路242號,23.013131,120.248674
UN201601080326,"2016-01-08 19:08:00",中西區,違規停車,違規停車,"中西區武英街17號 違規停車",臺南市中西區武英街17號,22.989105,120.191982
UN201601080327,"2016-01-08 19:10:00",永康區,違規停車,違規停車,"永康區中正六街270號    違規停車",710台灣台南市永康區中正六街270號,23.04022272766117,120.23842111229897
UN201601080328,"2016-01-08 19:07:00",東區,違規停車,違規停車,"IVR-東區慶東街96號(光華女中的後門)  違停",臺南市東區慶東街96號,22.988219,120.216292
UN201601080329,"2016-01-08 19:15:00","東 區",違規停車,違規停車,"東區崇德路179號   違規停車",701台灣台南市東區崇德路179號,22.979560169788744,120.21964464336634
UN201601080333,"2016-01-08 19:35:00",中西區,違規停車,違規停車,"中西區西華南街65號前面及對面   違規停車",中西區西華南街65號前面及對面,22.99459434096871,120.20957730710506
UN201601080338,"2016-01-08 19:54:00",南區,噪音舉發,妨害安寧,"南區大同路   噪音舉發",台南市大同路,22.9651148,120.2162503
UN201601080340,"2016-01-08 20:02:00",南區,違規停車,違規停車,"南區文南路與金華路2段385巷路口 違規停車",南區文南路與金華路2段385巷路口,22.9849818,120.1899424
UN201601080342,"2016-01-08 19:47:00",南區,違規停車,違規停車,"南區大成路二段130號  違停",臺南市南區大成路二段130號,22.975132,120.194266
UN201601080344,"2016-01-08 20:11:00",永康區,違規停車,違規停車,"永康區中華路214巷2號 違規停車",710台灣台南市永康區中華路214巷2號,23.005121,120.2358976
UN201601080349,"2016-01-08 20:20:00",東區,違規停車,違規停車,"東區崇善路55號 違規停車",701台灣台南市東區崇善路55號,22.982007,120.2216403
UN201601080350,"2016-01-08 20:25:00",永康區,違規停車,違規停車,"永康區中正路970巷27號前  違規停車",臺南市永康區中正路970巷27號,23.041057,120.239318
UN201601080351,"2016-01-08 20:08:00",南區,髒亂及汙染,空氣汙染,"南區中華南路一段(台南空軍基地北側)   空汙",南區中華南路一段(台南空軍基地北側),22.9674379,120.2051518
UN201601080357,"2016-01-08 20:33:00",永康區,噪音舉發,妨礙安寧,"永康區中山北路66號   妨礙安寧",臺南市永康區中山北路66號,23.026398,120.259014
UN201601080359,"2016-01-08 20:51:00",安平區,違規停車,違規停車,"安平區安平路52號及左右兩邊 違規停車",安平區安平路52號及左右兩邊,22.9983823,120.1854403
UN201601080360,"2016-01-08 20:33:00",南區,路燈故障,9盞以下路燈故障,"南區鯤鯓路145號、127號、137巷口   路燈不亮",南區鯤鯓路145號、127號、137巷口,22.9602894,120.1701153
UN201601080362,"2016-01-08 21:07:00",永康區,違規停車,違規停車,"永康區中山南路43巷31-1號 違規停車",710台灣台南市永康區中山南路43巷31-1號,23.0127441,120.226223
UN201601080365,"2016-01-08 21:27:00",北區,違規停車,違規停車,"北區開元路68巷2-4號 違規停車",704台灣台南市北區開元路68巷2-4號,23.006120751032284,120.21697285330356
UN201601080368,"2016-01-08 21:41:00",安平區,噪音舉發,場所連續噪音,"安平區建平十五街56號後方(慶平路)  噪音",臺南市安平區建平十五街56號,22.996496,120.182629
