UN201601080372,"2016-01-08 22:00:00",永康區,違規停車,違規停車,"永康區鹽行路98巷巷口  違停",永康區鹽行路98巷巷口,23.0423211,120.2320089
UN201601080374,"2016-01-08 22:36:00",南區,違規停車,違規停車,"南區文南路290號   違規停車",文南路290號,22.9865746,120.190273
UN201601080379,"2016-01-08 22:51:00",中西區,違規停車,違規停車,"中西區民權路四段166號、168號、170號  違停",中西區民權路四段166號、168號、170號,22.9991852,120.181774
UN201601080380,"2016-01-08 23:30:00",北區,噪音舉發,妨害安寧,"北區東豐路253號一樓 妨礙安寧",臺南市北區東豐路253號,23.003153,120.221795
UN201601080381,"2016-01-08 23:20:00",北區,噪音舉發,妨礙安寧,"北區大興街352巷33號  妨礙安寧",臺南市北區大興街352巷33號,23.009661,120.183966
UN201601090007,"2016-01-09 00:45:00",北區,噪音舉發,妨礙安寧,"北區大興街325巷33號 妨礙安寧",臺南市北區大興街325巷33號,23.009635,120.18664
UN201601090008,"2016-01-09 01:02:00",南區,噪音舉發,妨害安寧,"南區金華路一段154巷36號2樓 噪音舉發",臺南市南區金華路一段154巷36號2樓,22.9649141,120.191085
UN201601090009,"2016-01-09 01:07:00",麻豆區,噪音舉發,妨害安寧,"麻豆區中正路53-10號 妨礙安寧",台南市麻豆區中正路53-10號,23.185464,120.248854
UN201601090010,"2016-01-09 01:14:00",安南區,噪音舉發,妨害安寧,"安南區郡安路5段184巷52弄18號 噪音舉發",709台灣台南市安南區郡安路5段184巷52弄18號,23.0277733,120.1914915
UN201601090012,"2016-01-09 01:22:00",中西區,噪音舉發,場所連續噪音,"中西區友愛街 363號B1f 噪音舉發","台南市中西區友愛街 363號B1f",22.9925865,120.1938423
UN201601090016,"2016-01-09 06:12:00",北區,髒亂及汙染,空氣汙染,"北區臨安路二段74號 空氣汙染",臺南市北區臨安路二段74號,23.002759,120.197259
UN201601090019,"2016-01-09 07:11:00",安南區,噪音舉發,妨礙安寧,"安南區公學路六段655號 妨礙安寧",臺南市安南區公學路六段655號,23.078375,120.143299
UN201601090028,"2016-01-09 08:19:00",安南區,噪音舉發,妨礙安寧,"安南區郡安路五段184巷52弄 妨礙安寧",709台灣台南市安南區郡安路5段184巷52弄18號,23.0277733,120.1914915
UN201601090031,"2016-01-09 08:35:00",安南區,噪音舉發,妨礙安寧,"安南區安吉路/安中路口 四海豆漿隔壁 妨礙安寧",安南區安吉路/安中路口,23.0462218,120.1883467
UN201601090037,"2016-01-09 09:00:00",東區,違規停車,違規停車,"東區崇善路476號 違規停車",701台灣台南市東區崇善路476號,22.9726962,120.2295632
UN201601090039,"2016-01-09 09:03:00",永康區,噪音舉發,妨礙安寧,"永康區復華一街143號 妨礙安寧",臺南市永康區復華一街143號,23.005318,120.242034
UN201601090041,"2016-01-09 09:08:00",安南區,噪音舉發,場所連續噪音,安南區安中路四段320巷129弄30之25號,臺南市安南區安中路四段320巷129弄30之25號,23.053494,120.168901
UN201601090045,"2016-01-09 09:17:00",北區,違規停車,違規停車,"北區長榮路五段41巷 違規停車",704台灣台南市北區長榮路五段41巷,23.0099798,120.2185006
UN201601090052,"2016-01-09 09:24:00",安南區,交通運輸,交通疏導,"安南區北安路二段 交通疏導",安南區北安路二段,23.0322561,120.2042032
UN201601090059,"2016-01-09 10:07:00",東區,違規停車,違規停車,"東區仁和路109巷75號 違規停車",台南市東區仁和路109巷75號,22.9716301,120.235044
UN201601090071,"2016-01-09 10:28:00",東區,交通運輸,佔用道路,"東區林森路二段90號大樓後側  佔用道路",臺南市東區林森路二段90號,22.987403,120.223448
UN201601090086,"2016-01-09 10:59:00",新營區,違規停車,違規停車,"東區崇明路88號 違規停車",701台灣台南市東區崇明路88號,22.980158679625386,120.21718304604292
UN201601090087,"2016-01-09 10:59:00",安南區,噪音舉發,場所連續噪音,"安南區郡安路5段164巷5弄26號 噪音舉發",臺南市郡安路5段164巷5弄26號,23.028427,120.197371
UN201601090089,"2016-01-09 11:01:00",新營區,髒亂及汙染,道路散落物,髒亂及汙染,730台灣台南市新營區復興路682巷39弄,23.307146279014173,120.29595516622065
UN201601090095,"2016-01-09 11:07:00",東區,噪音舉發,場所連續噪音,"東區仁和路靠近城東街  施工噪音",東區仁和路靠近城東街,22.9730468,120.2320059
UN201601090099,"2016-01-09 11:07:00",東區,違規停車,違規停車,"東區林森路二段90號後方地下停車場出入口    違停",東區林森路二段90號後方地下停車場出入口,22.9876728,120.2234309
UN201601090101,"2016-01-09 11:28:00",北區,違規停車,違規停車,"北區開元路249巷2號前 違規停車",臺南市北區開元路249巷2號,23.008905,120.219021
UN201601090107,"2016-01-09 11:33:00",南區,違規停車,違規停車,違規停車,台南市安南區安和路一段,23.0306171,120.2129914
UN201601090115,"2016-01-09 11:43:00",中西區,違規停車,違規停車,"中西區北門路一段163號 違規停車",700台灣台南市中西區北門路一段163號,22.99589893760183,120.21172441542149
UN201601090116,"2016-01-09 11:44:00",北區,違規停車,違規停車,"北區北園街87巷慈愛醫院旁 違規停車",北區北園街87巷慈愛醫院旁,23.0125508,120.2211546
UN201601090121,"2016-01-09 11:52:00",東區,違規停車,違規停車,"東區大學路18號 違規停車",701台灣台南市東區大學路28號,22.99591807282652,120.22145915776493
UN201601090124,"2016-01-09 11:59:00",安定區,交通運輸,號誌故障,"安定區中沙里中崙1-20號 號誌故障",臺南市安定區中沙里中崙1-20號,23.073791,120.214072
UN201601090129,"2016-01-09 12:14:00",東區,動物救援,犬貓急難救援,"東區大同路一段197巷99號 狗受困",臺南市東區大同路一段197巷99號,22.984033,120.213255
UN201601090135,"2016-01-09 12:29:00",安南區,違規停車,違規停車,"安南區安中路四段290巷291弄13號旁巷口/ 安中路四段320巷97弄3號對面    違停",臺南市安南區安中路四段290巷291弄13號,23.052644,120.171371
UN201601090139,"2016-01-09 12:59:00",安南區,違規停車,違規停車,"安南區安中路六段與城西街交叉口 違規停車",709台灣台南市安南區安中路六段與城西街交叉口,23.062060959174946,120.12990128248931
UN201601090140,"2016-01-09 12:59:00",中西區,違規停車,違規停車,"中西區西華南街65號前面及對面 違規停車",中西區西華南街65號前面及對面,22.994625821802394,120.20959038287401
UN201601090145,"2016-01-09 13:07:00",安平區,騎樓舉發,騎樓舉發,"安平區華平路656號 佔用騎樓",708台灣台南市安平區華平路656號,22.99603195822054,120.17580326646568
UN201601090147,"2016-01-09 13:22:00",中西區,違規停車,違規停車,"中西區北門路一段163號 違規停車",700台灣台南市中西區北門路一段163號,22.995872086556183,120.21173413842915
UN201601090152,"2016-01-09 13:43:00",仁德區,違規停車,違規停車,"仁德區文華路二段的(駕訓班～中華醫專)、文華路/文賢路口～仁德國中 違停",仁德區文華路二段的(駕訓班～中華醫專)、文華路/文賢路口～仁德國中,22.9466746,120.2316596
UN201601090153,"2016-01-09 13:47:00",東區,道路維修,路面坑洞,"東區長榮路一段227號 道路凹陷",701台南市東區台南市東區長榮路一段227號,23.0006449,120.2221947
UN201601090158,"2016-01-09 13:58:00",北區,違規停車,違規停車,"北區西華街57號 違規停車","J3台灣郵局銷售中心, 西華街北區台南市台灣 704",22.9978343,120.2106007
UN201601090162,"2016-01-09 14:18:00",中西區,違規停車,違規停車,"中西區中山路151號前.125號周圍 違規停車",中西區中山路151號前.125號周圍,22.995877333312656,120.21011475473641
UN201601090163,"2016-01-09 14:25:00",安平區,違規停車,違規停車,"安平區平通路580巷117號 違規停車",臺南市安平區平通路580巷117號,22.996618,120.17051
UN201601090166,"2016-01-09 14:33:00",南區,違規停車,違規停車,"南區府緯街132號 違停",南區府緯街132號,22.984171,120.195966
UN201601090175,"2016-01-09 15:08:00",中西區,違規停車,違規停車,"中西區西華南街65號前面及對面 違規停車",中西區西華南街65號前面及對面,22.9946514385538,120.2095917239785
UN201601090178,"2016-01-09 15:33:00",中西區,噪音舉發,妨礙安寧,"中西區正興街64-1號 妨礙安寧",中西區正興街64-1號,22.9943246,120.1976064
UN201601090180,"2016-01-09 15:38:00",北區,噪音舉發,妨礙安寧,"北區富北街11號2F3F 噪音舉發",臺南市北區富北街11號,22.998951,120.211372
UN201601090188,"2016-01-09 15:48:00",安平區,違規停車,違規停車,"安平區安平路370號 違停",臺南市安平區安平路370號,22.998341,120.176132
UN201601090193,"2016-01-09 15:59:00",北區,違規停車,違規停車,"北區北門路二段19號 違規停車",臺南市北區北門路二段19號,22.997821,120.212198
UN201601090198,"2016-01-09 16:11:00",中西區,違規停車,違規停車,"中西區南華街與金華路三段92巷交叉路口 違規停車",700台灣台南市中西區南華街與金華路三段92巷交叉路口,22.9903233,120.1916221
UN201601090200,"2016-01-09 16:14:00",東區,違規停車,違規停車,"東區中華東路三段377巷底轉入巴克禮公園便道(巴克禮公園二期入口前) 違規停車",701台灣台南市東區中華東路三段377巷底(巴克禮公園二期入口前),22.972530305031160,120.22219379524540
UN201601090202,"2016-01-09 16:17:00",北區,違規停車,違規停車,"北區北安路一段2號 違規停車",臺南市北區北安路一段2號,23.015209,120.212576
UN201601090205,"2016-01-09 16:29:00",永康區,交通運輸,佔用道路,"永康區中山南路104巷口(靠近中山南路) 佔用道路",永康區中山南路104巷口(靠近中山南路),23.0127614,120.2292452
UN201601090220,"2016-01-09 17:28:00","北 區",違規停車,違規停車,"北區北門路二段.三段沿線(和緯路到實踐街) 違規停車",北區北門路二段.三段沿線(和緯路到實踐街),23.009268860294927,120.21576650440691
UN201601090224,"2016-01-09 17:37:00",東區,違規停車,違規停車,"東區中華東路二段125號 違規停車",701台灣台南市東區中華東路二段125號,22.9847897,120.2323406
UN201601090226,"2016-01-09 17:42:00",中西區,違規停車,違規停車,"中西區中山路151.143.125號 違規停車",中西區中山路151.143.125號,22.995893073580824,120.21009061485529
UN201601090230,"2016-01-09 17:55:00",中西區,違規停車,違規停車,"中西區西華南街65號前面及對面 違規停車",中西區西華南街65號前面及對面,22.994691252531265,120.20962793380022
UN201601090233,"2016-01-09 18:00:00","東 區",違規停車,違規停車,"東區台南車站前站機車臨時停放區 違規停車",東區台南車站前站機車臨時停放區,22.996905076383026,120.21215189248325
UN201601090235,"2016-01-09 18:04:00",安南區,噪音舉發,妨礙安寧,"安南區怡安路一段308號附近 廟會妨礙安寧",臺南市安南區怡安路一段308號,23.041783,120.208687
UN201601090237,"2016-01-09 18:00:00",中西區,騎樓舉發,佔用道路,"中西區神農街54號 / 海安路二段237號    佔用道路",臺南市中西區神農街54號,22.997411,120.197084
UN201601090240,"2016-01-09 18:15:00",東區,違規停車,違規停車,"東區東光路二段2號   違規停車",701台灣台南市東區東光路二段2號,22.9951367,120.2313498
UN201601090243,"2016-01-09 18:26:00",南區,噪音舉發,妨礙安寧,"南區大同路  極限運動場旁靠近竹溪寺邊    噪音舉發",台南市大同路,22.9651148,120.2162503
UN201601090245,"2016-01-09 18:32:00",東區,違規停車,違規停車,"東區東平路3號路口   違規停車",東平路3號路口,22.995975478484294,120.21899588406087
UN201601090250,"2016-01-09 18:50:00",東區,民生管線,漏水、停水、消防栓漏水或損壞,"東區生產路618巷1弄2號 漏水",臺南市東區生產路618巷1弄2號,22.965535,120.231775
UN201601090252,"2016-01-09 18:53:00",北區,違規停車,違規停車,"北區海安路三段600號   違規停車",北區海安路三段600號,23.0125771,120.200778
UN201601090256,"2016-01-09 19:14:00",永康區,違規停車,違規停車,"永康區中華路663號 違停",臺南市永康區中華路663號,23.015696,120.229109
UN201601090258,"2016-01-09 19:17:00",永康區,違規停車,違規停車,"永康區南台街13巷36號 違規停車",710台灣台南市永康區南台街13巷36號,23.021250422109603,120.22325657308102
UN201601090259,"2016-01-09 19:25:00","南 區",違規停車,違規停車,"南區體育路41巷口 違規停車",702台灣台南市南區體育路41巷口,22.97971357869992,120.20704329013826
UN201601090262,"2016-01-09 19:27:00",安南區,路燈故障,9盞以下路燈故障,"安南區府安路五段11巷35弄132號 路燈",臺南市安南區府安路五段11巷35弄132號,23.025311,120.201805
UN201601090265,"2016-01-09 19:28:00",永康區,路燈故障,9盞以下路燈故障,"永康區新民街16巷1弄3號對面  路燈不亮",臺南市永康區新民街16巷1弄3號,23.040541,120.243253
UN201601090266,"2016-01-09 19:38:00",中西區,違規停車,違規停車,"中西區府緯街4巷27號 違規停車",700台灣台南市中西區府緯街4巷27號,22.98424724268774,120.19973896443844
UN201601090267,"2016-01-09 19:39:00",中西區,違規停車,違規停車,"中西區府緯街四巷一號前 違規停車",700台灣台南市中西區府緯街四巷一號前,22.99717018961733,120.21296594291925
UN201601090268,"2016-01-09 19:41:00",南區,違規停車,違規停車,"南區文南路與德南街口 違規停車",台南市南區文南路與德南街口,22.9849818,120.1899424
UN201601090270,"2016-01-09 19:49:00",南區,路燈故障,9盞以下路燈故障,"南區大同路二段670巷14號 路燈",臺南市南區大同路二段670巷14號,22.968181,120.215124
UN201601090275,"2016-01-09 20:10:00",東區,違規停車,違規停車,"東區裕農路448之8號 違規停車",裕農路448之8號,22.9880972,120.2319983
UN201601090278,"2016-01-09 20:12:00",南區,違規停車,違規停車,"南區文南路與德南街口  違規停車",台南市南區文南路與德南街口,22.9849818,120.1899424
UN201601090279,"2016-01-09 20:08:00",東區,違規停車,違規停車,"東區衛國街112巷1號前方  違停",東區衛國街112巷1號前方,22.9874217,120.2252497
UN201601090280,"2016-01-09 20:23:00",北區,噪音舉發,妨礙安寧,"北區北園街38號附近 妨礙安寧",北區北區北園街38號附近,23.0123662,120.222908
UN201601090283,"2016-01-09 20:49:00",北區,違規停車,違規停車,"北區和緯路二段30巷  違規停車",台南市北區和緯路二段30巷,23.0120605,120.2103339
UN201601090290,"2016-01-09 21:31:00",南區,違規停車,違規停車,"安南區安中路一段702巷95-96號 違規停車",709台灣台南市安南區安中路一段702巷95-96號,23.0433151,120.1987968
UN201601090291,"2016-01-09 21:13:00",歸仁區,噪音舉發,妨礙安寧,"歸仁區中山路三段*民生北街   妨礙安寧",歸仁區中山路三段*民生北街,22.9683016,120.2809393
UN201601090297,"2016-01-09 22:18:00",安南區,動物救援,遊蕩犬隻捕捉管制,"慶安路220巷5號 動物捕抓",慶安路220巷5號,23.044805,120.214126
UN201601090299,"2016-01-09 22:32:00",安平區,噪音舉發,妨礙安寧,"安平區健康二街419巷47號 妨礙安寧",臺南市安平區健康二街419巷47號,22.992763,120.17268
UN201601090300,"2016-01-09 22:35:00",北區,噪音舉發,妨礙安寧,"北區大興街325巷33號 妨礙安寧",北區大興街325巷33號,23.0097659,120.1863784
UN201601090303,"2016-01-09 23:35:00",中西區,交通運輸,佔用道路,"中西區海安路二段15號～53號 佔用道路",中西區海安路二段15號～53號,22.9941603,120.1963372
UN201601100001,"2016-01-10 00:05:00",南區,噪音舉發,妨礙安寧,"南區明興路1395巷14號 喧嘩妨礙安寧",臺南市南區明興路1395巷14號,22.921471,120.185129
UN201601100004,"2016-01-10 00:39:00",東區,違規停車,違規停車,"東區中華東路一段207巷209號 妨礙安寧跟違停",東區中華東路一段207巷209號,22.9902371,120.2337975
UN201601100005,"2016-01-10 01:38:00",中西區,噪音舉發,妨礙安寧,"中西區觀亭街*慈音街口 妨礙安寧",中西區觀亭街*慈音街口,22.9970723,120.205695
UN201601100009,"2016-01-10 03:07:00",北區,噪音舉發,妨礙安寧,"北區大興街325巷33號 妨礙安寧",北區大興街325巷33號,23.0097659,120.1863784
UN201601100010,"2016-01-10 06:36:00",北區,噪音舉發,妨礙安寧,"北區大興街200號周遭 廟會",北區大興街200號周遭,23.0107898,120.1884041
UN201601100011,"2016-01-10 06:37:00",北區,噪音舉發,妨礙安寧,"北區和緯路四段黃昏市場 廟會妨礙安寧",北區和緯路四段黃昏市場,23.008397,120.1900374
UN201601100015,"2016-01-10 07:36:00",北區,噪音舉發,妨礙安寧,"北區大興街好市多附近 廟會",北區大興街好市多附近,23.0101774,120.1856447
UN201601100017,"2016-01-10 07:17:00",北區,民生管線,漏水、停水、消防栓漏水或損壞,"北區文賢三街265巷口處 漏水",北區文賢三街265巷口處,23.0142669,120.1981473
UN201601100023,"2016-01-10 08:24:00",安南區,道路維修,路面坑洞,"安南區安中路一段701巷38號旁 坑洞",臺南市安南區安中路一段701巷38號,23.041778,120.194909
UN201601100025,"2016-01-10 08:32:00",南區,髒亂及汙染,空氣汙染,"南區金華路二段200號 空氣污染",臺南市南區金華路二段200號,22.980204,120.191515
UN201601100026,"2016-01-10 08:40:00",東區,違規停車,違規停車,"東區崇善路52號對面忠孝國中圍牆旁 違規停車",臺南市崇善路52號,22.981275,120.2221
UN201601100035,"2016-01-10 09:31:00",安南區,噪音舉發,場所連續噪音,"安南區海環街615號 噪音",臺南市安南區海環街615號,23.043237,120.18486
UN201601100042,"2016-01-10 09:56:00",關廟區,噪音舉發,場所連續噪音,"關廟區中央路50幾號 噪音",臺南市關廟區中央路50幾號,22.959681,120.331863
UN201601100046,"2016-01-10 10:17:00",永康區,噪音舉發,妨礙安寧,"永康區四維街149巷34之1號 妨礙安寧",臺南市永康區四維街149巷34之1號,23.035003,120.250806
UN201601100061,"2016-01-10 11:08:00",北區,違規停車,違規停車,"北區北忠街58巷56號前 違規停車",北忠街58巷56前整條機車紅線違停,22.9999128,120.2112126
UN201601100067,"2016-01-10 11:21:00","東 區",違規停車,違規停車,"東區東興路20巷 違規停車",東興路20巷,22.98998355411693,120.2283738926053
UN201601100070,"2016-01-10 11:26:00","東 區",違規停車,違規停車,"東區東興路83號對面 違規停車",東興路83號對面,22.991899616128425,120.22882383316755
UN201601100074,"2016-01-10 11:33:00",仁德區,違規停車,違規停車,"仁德區文山路206號  違規停車",臺南市仁德區文山路206號,22.975893,120.245841
UN201601100080,"2016-01-10 11:59:00",中西區,違規停車,違規停車,"中西區民族路二段上(公園路-西門路) 違停",中西區民族路二段上(公園路-西門路),22.9956728,120.2057033
UN201601100087,"2016-01-10 12:25:00",南區,騎樓舉發,騎樓舉發,"南區文南路289號 騎樓舉發",臺南市南區文南路289號,22.986782,120.189973
UN201601100088,"2016-01-10 12:28:00",安南區,違規停車,違規停車,"安南區長溪路一段168巷128弄 違規停車",709台灣台南市安南區長溪路一段168巷128弄,23.0374516,120.2118872
UN201601100089,"2016-01-10 12:29:00",安南區,違規停車,違規停車,"安南區長溪路一段168巷60弄49號 違規停車",709台灣台南市安南區長溪路一段168巷60弄49號,23.0374564,120.2118839
UN201601100090,"2016-01-10 12:31:00",安南區,違規停車,違規停車,"安南區長溪路一段168巷60弄41-17號 違規停車",709台灣台南市安南區長溪路一段168巷60弄41-17號,23.0372618,120.2111749
UN201601100094,"2016-01-10 12:44:00",中西區,違規停車,違規停車,"中西區南寧街91號對面 違規停車",臺南市中西區南寧街91號,22.984985,120.198272
UN201601100101,"2016-01-10 13:02:00",中西區,違規停車,違規停車,"中西區西門路381號 違規停車",台南市中西區西門路381號,22.998449,120.200221
UN201601100103,"2016-01-10 13:09:00",永康區,違規停車,違規停車,"永康區中華路663號 違停",臺南市永康區中華路663號,23.015696,120.229109
UN201601100104,"2016-01-10 13:16:00",安平區,違規停車,違規停車,"安平區國平路591巷62號 違停",臺南市安平區國平路591巷62號,22.996685,120.170227
UN201601100109,"2016-01-10 13:34:00",北區,交通運輸,佔用道路,"北區北園街8巷 佔用車道",北區北園街8巷,23.0104694,120.2231497
UN201601100112,"2016-01-10 13:45:00",安南區,噪音舉發,場所連續噪音,"安南區海環街365巷口 噪音",安南區海環街365巷口,23.0395321,120.1810203
UN201601100114,"2016-01-10 13:46:00",北區,違規停車,違規停車,"北區成功路176號 違規停車",704台灣台南市北區成功路176號,22.998853,120.204067
UN201601100116,"2016-01-10 13:59:00",北區,違規停車,違規停車,"北區忠義路三段16-20號  違規停車",臺南市北區忠義路三段16-20號,22.999048,120.20532
UN201601100117,"2016-01-10 13:59:00",中西區,違規停車,違規停車,"中西區西華南街65號前面及對面 違規停車",中西區西華南街65號前面及對面,22.99470637566692,120.2096091583371
UN201601100121,"2016-01-10 14:13:00",永康區,路燈故障,9盞以下路燈故障,"永康區文賢街356巷17弄1號側面 路燈不亮",臺南市永康區文賢街356巷17弄1號,23.012565,120.267724
UN201601100124,"2016-01-10 14:24:00",安南區,噪音舉發,妨礙安寧,"安南區頂安街501號 妨礙安寧",臺南市安南區頂安街501號,23.04325,120.206783
UN201601100126,"2016-01-10 14:31:00",永康區,違規停車,違規停車,"永康區中山北路164巷137-1號 違規停車",710台灣台南市永康區中山北路164巷137-1號,23.0266145,120.2641562
UN201601100130,"2016-01-10 14:42:00",中西區,違規停車,違規停車,"中西區中山路151號前.125號周圍 違規停車",中西區中山路151號前.125號周圍,22.995924245479063,120.21010234951973
UN201601100132,"2016-01-10 14:53:00","東 區",違規停車,違規停車,"東區台南車站前站機車臨時停放區 違規停車",東區台南車站前站機車臨時停放區,22.996864954427934,120.212156586349
UN201601100135,"2016-01-10 14:57:00",中西區,違規停車,違規停車,"中西區民族路三段3號4號至10號 違停",臺南市中西區民族路三段3號,22.99752,120.199425
UN201601100139,"2016-01-10 15:22:00",仁德區,違規停車,違規停車,"仁德區民安路二段57號 違規停車",717台灣台南市仁德區民安路二段57號,22.9525398,120.2537661
UN201601100141,"2016-01-10 15:25:00",永康區,噪音舉發,妨礙安寧,"永康區四維街149巷34之1號 妨礙安寧",永康區四維街149巷34之1號,23.0320641,120.2528054
UN201601100142,"2016-01-10 15:25:00",北區,違規停車,違規停車,"北區長榮路/勝利路口人行道 違規停車",長榮路/勝利路口人行道,23.0128246,120.2169737
UN201601100143,"2016-01-10 15:27:00","北 區",違規停車,違規停車,"北區北門路二段.三段兩側(和緯路到實踐街) 違規停車",北區北門路二段.三段兩側(和緯路到實踐街),23.009218249540154,120.21574538201092
UN201601100147,"2016-01-10 15:44:00",南區,違規停車,違規停車,"南區南寧街166號對面 違停",臺南市南區南寧街166號,22.985199,120.197226
UN201601100148,"2016-01-10 15:18:00",安平區,噪音舉發,妨礙安寧,"台南政府南側的廣場 噪音",台南政府南側的廣場,22.9998999,120.2268758
UN201601100149,"2016-01-10 15:55:00",北區,噪音舉發,妨礙安寧,"北區長榮路五段上鐵軌附近 廟會妨礙安寧",北區長榮路五段上鐵軌附近,23.0128505,120.2166802
UN201601100150,"2016-01-10 16:10:00",永康區,交通運輸,號誌故障,紅綠燈撞斷,710台灣台南市永康區八德街與永大路三段口,23.0364105,120.2606198
UN201601100158,"2016-01-10 16:20:00",中西區,違規停車,違規停車,"中西區西華南街沿線兩側(成功路到民族路) 違規停車",中西區西華南街沿線兩側(成功路到民族路),22.99589708580576,120.20974460989235
UN201601100159,"2016-01-10 16:21:00",北區,違規停車,違規停車,"北區北園街99巷3弄口 違停",北區北園街99巷3弄口,23.0123662,120.222908
UN201601100160,"2016-01-10 16:24:00",北區,交通運輸,佔用道路,"北區北門路二段49號和欣客運旁 佔用道路",臺南市北區北門路二段49號,22.998373,120.212308
UN201601100161,"2016-01-10 16:30:00","東 區",違規停車,違規停車,"東區北門路一段146號周邊 違規停車",東區北門路一段146號周邊,22.99291473525841,120.2116674184799
UN201601100163,"2016-01-10 16:44:00",中西區,違規停車,違規停車,違規停車,702台灣台南市南區健康路一段133巷17號,22.98083095827103,120.20889736711979
UN201601100165,"2016-01-10 16:46:00","南 區",噪音舉發,妨害安寧,噪音舉發,702台灣台南市南區健康路一段133巷17號,22.980688662656807,120.20894464105368
UN201601100166,"2016-01-10 16:48:00","南 區",違規停車,違規停車,違規停車,702台灣台南市南區健康路一段133巷11號,22.980669216606774,120.2089463174343
UN201601100170,"2016-01-10 16:54:00",永康區,違規停車,違規停車,違規停車,臺南市永康區中正路161-163號,23.030791,120.251196
