UN201601050338,"2016-01-05 20:22:00",永康區,動物救援,犬貓急難救援,"永康區中正南路343號 犬貓救援",臺南市永康區中正南路343號,23.029352,120.224218
UN201601050339,"2016-01-05 20:26:00",安平區,違規停車,違規停車,安平區安平路500巷25弄42號違規停車,安平路500巷25弄42號側邊,22.9995519,120.1711331
UN201601050343,"2016-01-05 20:40:00",東區,路燈故障,9盞以下路燈故障,"東區中華東路三段452巷8弄22號前 路燈故障",臺南市東區中華東路三段452巷8弄22號,22.973984,120.219552
UN201601050344,"2016-01-05 20:42:00",中西區,噪音舉發,妨礙安寧,"中西區民族路二段1號(年輕人眼鏡) 妨礙安寧",中西區民族路二段1號(年輕人眼鏡),22.9943265,120.2115075
UN201601050345,"2016-01-05 20:45:00",仁德區,動物救援,遊蕩犬隻捕捉管制,"仁德區新田二街(大成鋼側門) 捕犬",仁德區新田二街(大成鋼側門),22.9606325,120.2653375
UN201601050347,"2016-01-05 20:45:00",中西區,違規停車,違規停車,"中西區民生路二段82號 違規停車",700台灣台南市中西區民生路二段82號,22.9953331,120.196922
UN201601050352,"2016-01-05 21:09:00",歸仁區,違規停車,違規停車,歸仁區中正北路歸仁衛生所旁違規停車,711台灣台南市歸仁區中正北路歸仁衛生所旁,22.9670299,120.2938658
UN201601050354,"2016-01-05 21:11:00",歸仁區,違規停車,違規停車,歸仁區中正北路歸仁衛生所旁違規停車,711台灣台南市歸仁區中正北路歸仁衛生所旁,22.9670986,120.2917622
UN201601050355,"2016-01-05 21:12:00",南區,違規停車,違規停車,"南區文南路290號與文南路292號中間 違規停車",臺南市南區文南路290號,22.986607,120.190197
UN201601050358,"2016-01-05 21:17:00",安平區,動物救援,犬貓急難救援,"安平區平通路/建平路口 動物受困",安平區平通路/建平路口,22.992143,120.1831306
UN201601050361,"2016-01-05 21:26:00",南區,違規停車,違規停車,"南區文南路與德南街口 違規停車",台南市南區文南路與德南街口,22.9849818,120.1899424
UN201601050370,"2016-01-05 22:08:00",永康區,違規停車,違規停車,永康區中華二路340巷11號違規停車,710台灣台南市永康區中華二路340巷11號,23.0093944,120.2310629
UN201601050373,"2016-01-05 22:11:00",北區,交通運輸,佔用道路,"北區公園路1092巷37號 佔用道路",北區公園路1092巷37號,23.0191536,120.2175629
UN201601050379,"2016-01-05 23:11:00",東區,違規停車,違規停車,"東區中華東路一段207巷 紅線違停",東區中華東路一段207巷,22.9902807,120.2344104
UN201601050381,"2016-01-05 23:32:00",東區,噪音舉發,場所連續噪音,"東區府連路233號 妨礙安寧",701台灣台南市東區府連路233號,22.985393655672361,120.21368356902440
UN201601050386,"2016-01-05 23:58:00",中西區,噪音舉發,妨礙安寧,"中西區湖美街97號 妨礙安寧",臺南市中西區湖美街97號,23.001585,120.179863
UN201601060003,"2016-01-06 07:10:00",安南區,噪音舉發,防疫建議,"安南區公學路六段655號""慈興宮""擴音器叫賣","安南區公學路六段655號""慈興宮""",23.0787441,120.143639
UN201601060004,"2016-01-06 07:22:00",新化區,違規停車,違規停車,"新化區民治路119號 .違規停車",712台灣台南市新化區民治路119號,23.032539771719335,120.3051457554102
UN201601060007,"2016-01-06 07:46:00",新化區,違規停車,違規停車,"新化區正新路97號 違規停車",712台灣台南市新化區正新路97號,23.032783525092228,120.30308112502098
UN201601060008,"2016-01-06 07:50:00",永康區,髒亂及汙染,道路散落物,永康區中山路200號機車道,臺南市永康區中山路200號,23.030826,120.256016
UN201601060010,"2016-01-06 08:04:00",東區,路燈故障,9盞以下路燈故障,"東區林森路二段200號之2 路燈",臺南市東區林森路二段200號,22.98979,120.224397
UN201601060011,"2016-01-06 08:08:00",中西區,髒亂及汙染,空氣汙染,"中西區大勇街101號 香包",臺南市中西區大勇街101號,23.003237,120.1889
UN201601060024,"2016-01-06 08:44:00",永康區,違規停車,違規停車,"永康區新中街(中正路到正南五街)  違規停車",永康區新中街(中正路到正南五街),23.036268224471954,120.24038348346949
UN201601060029,"2016-01-06 09:00:00",安平區,路燈故障,9盞以下路燈故障,"安平區安北路131巷12號東側一盞 路燈故障",臺南市安平區安北路131巷12號,23.002272,120.162489
UN201601060031,"2016-01-06 09:03:00",新營區,違規停車,違規停車,"新營區中山路138-1號(新營國小南側門) 違規停車",臺南市新營區中山路138-1號,23.305171,120.317248
UN201601060034,"2016-01-06 09:05:00",中西區,違規停車,違規停車,"中西區大同路一段98號 違停",臺南市中西區大同路一段98號,22.986087,120.211053
UN201601060035,"2016-01-06 09:08:00",北區,違規停車,違規停車,"北區中華北路ㄧ段143號 違規停車",臺南市中華北路ㄧ段143號,23.020488,120.20027
UN201601060037,"2016-01-06 09:10:00",北區,違規停車,違規停車,"北區小東路321-330號 違停",臺南市北區小東路321-330號,22.999225,120.23084
UN201601060041,"2016-01-06 09:13:00",北區,違規停車,違規停車,"北區西華街65號到105號 違規停車",臺南市西華街65號,22.999343,120.210567
UN201601060042,"2016-01-06 09:14:00",北區,交通運輸,號誌故障,"北區小東路和勝利路口往北方向 號誌",北區小東路和勝利路口往北方向,23.0006965,120.2231046
UN201601060043,"2016-01-06 09:16:00",中西區,違規停車,違規停車,"中西區西華南街58號到68號 違規停車",臺南市西華南街58號,22.994066,120.20957
UN201601060048,"2016-01-06 09:36:00",北區,違規停車,違規停車,"北區小東路321號至330號和323號  違停",臺南市北區小東路321號,22.999225,120.23084
UN201601060059,"2016-01-06 10:02:00",中西區,違規停車,違規停車,"中西區公園路86號 違規停車",700台灣台南市中西區公園路86號,22.9963957,120.206228
UN201601060061,"2016-01-06 10:02:00",東區,騎樓舉發,妨礙安寧,"東區崇德十六街2之3號 妨礙安寧",臺南市東區崇德十六街2之3號,22.969567,120.227973
UN201601060089,"2016-01-06 10:44:00",中西區,違規停車,違規停車,"中西區開山路76號到132號+77號到87號 違規停車",臺南市開山路76號,22.990099,120.206607
UN201601060090,"2016-01-06 10:22:00",仁德區,道路維修,路面掏空、塌陷,"仁德區大發路*太子路   路面塌陷",仁德區大發路*太子路,22.9912895,120.2514973
UN201601060091,"2016-01-06 10:48:00",仁德區,違規停車,違規停車,"仁德區大同路三段687號  違規停車",臺南市仁德區大同路三段687號,22.948298,120.219545
UN201601060094,"2016-01-06 10:47:00",安南區,路燈故障,9盞以下路燈故障,"安南區郡安路五段159號 海佃國小旁  路燈不亮",臺南市安南區郡安路五段159號,23.028638,120.201488
UN201601060100,"2016-01-06 11:00:00",北區,違規停車,違規停車,"北區成功路2號 違規停車",臺南市北區成功路2號,22.997791,120.211428
UN201601060104,"2016-01-06 11:17:00",永康區,違規停車,違規停車,"永康區中正路888號對面.545號前/中正七街1號.27號 違規停車",永康區中正路888號對面.545號前/中正七街1號.27號,23.039289108834883,120.23948796093464
UN201601060108,"2016-01-06 11:24:00",南區,髒亂及汙染,空氣汙染,"南區新都路465號 空氣污染",臺南市新都路465號,22.966312,120.192876
UN201601060123,"2016-01-06 12:05:00",安平區,違規停車,違規停車,"安平區郡平路育平路道健康三街 違規停車",708台灣台南市安平區郡平路育平路道健康三街,22.989084773394005,120.16813717782499
UN201601060126,"2016-01-06 12:12:00",中西區,違規停車,違規停車,"中西區慶中街180號 違規停車",臺南市慶中街180號,22.984173,120.205659
UN201601060131,"2016-01-06 12:26:00",中西區,違規停車,違規停車,"中西區府緯街4巷1號 違規停車",700台灣台南市中西區府緯街4巷1號,22.984275639341085,120.19951634109022
UN201601060132,"2016-01-06 12:28:00",中西區,交通運輸,交通疏導,"中西區府緯街4巷2號 違停",700台灣台南市中西區府緯街4巷2號,22.98411822303541,120.19966017454863
UN201601060133,"2016-01-06 12:30:00",中西區,違規停車,違規停車,中西區府緯街61號違規停車,700台灣台南市中西區府緯街61號,22.98393302714681,120.19813500344753
UN201601060134,"2016-01-06 12:25:00",北區,路燈故障,9盞以下路燈故障,"北區林森路三段226號   路燈不亮",臺南市北區林森路三段226號,23.006402,120.224965
UN201601060135,"2016-01-06 12:32:00",中西區,違規停車,違規停車,"中西區慶中街180號+182號 違規停車",臺南市中西區慶中街180號,22.984173,120.205659
UN201601060140,"2016-01-06 12:39:00",中西區,違規停車,違規停車,"中西區西華南街68號 違規停車",中西區西華南街68號,22.9946044,120.2095694
UN201601060141,"2016-01-06 12:32:00",中西區,動物救援,犬貓急難救援,"中西區西門路二段427號旁 空地內   狗受困","中西區西門路二段427號旁 空地內",22.9994914,120.2008004
UN201601060144,"2016-01-06 13:01:00",南區,違規停車,違規停車,"南區永華路跟文南路口 違規停車",台南市永華路252號,23.257222,120.119399
UN201601060146,"2016-01-06 13:07:00",東區,路燈故障,9盞以下路燈故障,"東區裕聖里裕敬路418號前 路燈",臺南市東區裕聖里裕敬路418號,22.979743,120.247252
UN201601060149,"2016-01-06 13:15:00",中西區,違規停車,違規停車,"中西區西華南街42號  違規停車",西華南街42號,22.9939617,120.2095661
UN201601060154,"2016-01-06 13:34:00",安南區,噪音舉發,場所連續噪音,"安南區惠安街34號 噪音",安南區惠安街34號,23.0269621,120.210404
UN201601060171,"2016-01-06 14:09:00",中西區,違規停車,違規停車,"中西區府緯街41號對面 違規停車",700台灣台南市中西區府緯街41號對面,22.983902161140694,120.19856482744217
UN201601060172,"2016-01-06 14:13:00",龍崎區,路燈故障,9盞以下路燈故障,"龍崎區產業道路 路燈故障",718台灣台南市龍崎產業道路,22.9732467,120.3671502
UN201601060184,"2016-01-06 14:45:00",中西區,違規停車,違規停車,"中西區西門路一段548號 違規停車",700台灣台南市中西區西門路一段548號,22.9855869,120.1980755
UN201601060198,"2016-01-06 15:32:00",永康區,違規停車,違規停車,"永康區中華路1002號 違規停車",台南市永康區中華路1002號,23.0219751,120.22129
UN201601060201,"2016-01-06 15:45:00",永康區,違規停車,違規停車,"永康區中正路(中正六街到新行街) 違規停車",永康區中正路(中正六街到新行街),23.03918019650148,120.23954596370459
UN201601060203,"2016-01-06 15:47:00",中西區,違規停車,違規停車,"中西區西華南街65號前面及對面  違規停車",中西區西華南街65號前面及對面,22.994586007805626,120.2095840126276
UN201601060204,"2016-01-06 15:48:00",永康區,違規停車,違規停車,"永康區中華路912巷南臺科大周邊 違規停車",永康區中華路912巷南臺科大周邊,23.020660426005485,120.22517133504152
UN201601060211,"2016-01-06 15:56:00",中西區,違規停車,違規停車,"中西區中山路151號前.125號周圍 違規停車",中西區中山路151號前.125號周圍,22.995867765697763,120.2101107314229
UN201601060214,"2016-01-06 16:01:00",永康區,違規停車,違規停車,"永康區中華路和大橋二街口 違停",永康區中華路和大橋二街口,23.0146459,120.2299338
UN201601060215,"2016-01-06 16:03:00",南區,違規停車,違規停車,"南區西門路一段341號 違規停車",702台灣台南市南區西門路一段341號,22.9779541,120.1974008
UN201601060218,"2016-01-06 16:09:00",佳里區,違規停車,違規停車,"佳里區平等街160號 違停",佳里區平等街160號,23.1872602,120.24855
UN201601060220,"2016-01-06 16:15:00","東 區",違規停車,違規停車,"東區台南車站前站機車臨時停放區 違規停車",東區台南車站前站機車臨時停放區,22.996778846499453,120.21212171763183
UN201601060224,"2016-01-06 16:30:00",中西區,違規停車,違規停車,"中西區民生路二段57號^97號 違規停車",臺南市民生路二段57號,22.994844,120.197651
UN201601060231,"2016-01-06 16:46:00",中西區,交通運輸,佔用道路,"中西區西門路二段259號 佔用道路",臺南市中西區西門路二段259號,22.995769,120.199371
UN201601060239,"2016-01-06 17:02:00","東 區",違規停車,違規停車,"東區北門路一段146號   違規停車",東區北門路一段146號,22.99308356095917,120.21166540682317
UN201601060242,"2016-01-06 17:16:00",東區,違規停車,違規停車,"東區東安路51號   違規停車",台南市東區東安路51號,22.9921174,120.2260855
UN201601060256,"2016-01-06 17:48:00",歸仁區,違規停車,違規停車,"歸仁區中正北路歸仁衛生所前公車站牌   違規停車",711台灣台南市歸仁區中正北路歸仁衛生所前公車站牌,22.9669818,120.2938221
UN201601060259,"2016-01-06 17:46:00",安南區,路燈故障,9盞以下路燈故障,"安南區北安路三段752巷22弄109號對面   路燈不亮",臺南市安南區北安路三段752巷22弄109號,23.052371,120.214936
UN201601060260,"2016-01-06 17:55:00",東區,違規停車,違規停車,"東區凱旋路38號   違規停車",臺南市東區凱旋路38號,22.993013,120.232267
UN201601060270,"2016-01-06 18:03:00",永康區,違規停車,違規停車,"永康區忠孝路429巷17弄7號  違停",臺南市永康區忠孝路429巷17弄7號,23.017802,120.2427
UN201601060271,"2016-01-06 18:16:00",中西區,違規停車,違規停車,中西區中山路16號違規停車,700台灣台南市中西區中山路16號,22.993050712045846,120.20604091852420
UN201601060276,"2016-01-06 18:23:00",中西區,違規停車,違規停車,"中西區民族路二段113號 違規停車",700台灣台南市中西區民族路二段113號,22.994567784559191,120.20854038042603
UN201601060278,"2016-01-06 18:28:00",永康區,違規停車,違規停車,"永康區復華三街 違規停車",701台灣台南市永康區復華三街,22.997163708391966,120.21296594291925
UN201601060286,"2016-01-06 18:47:00",永康區,路燈故障,9盞以下路燈故障,"永康區自強路140巷10號 路燈故障",710台灣台南市永康區自強路140巷10號,23.025055917730217,120.24872205568090
UN201601060289,"2016-01-06 18:52:00",安平區,違規停車,違規停車,安平區育平五街8號違規停車,708台灣台南市安平區育平五街8號,22.990653106355492,120.16947361694952
UN201601060290,"2016-01-06 18:52:00",東區,路燈故障,9盞以下路燈故障,"東區裕農路621巷41弄7-1號 路燈故障",東區裕農路621巷41弄7-1號,22.9903471,120.235271
UN201601060294,"2016-01-06 19:04:00",西港區,路燈故障,9盞以下路燈故障,"西港區 路燈故障",臺南市西港區電線桿號,23.106377,120.180865
UN201601060296,"2016-01-06 19:20:00",中西區,違規停車,違規停車,中西區民生路一段160號違規停車,臺南市民生路一段160號,22.994268,120.200287
UN201601060298,"2016-01-06 19:20:00",永康區,違規停車,違規停車,"永康區復華三街 違規停車",701台灣台南市富國里復華三街,22.997163708391966,120.21296594291925
UN201601060301,"2016-01-06 19:37:00",中西區,違規停車,違規停車,"中西區中山路79號 違規停車",臺南市中西區中山路79號,22.994049,120.20712
UN201601060303,"2016-01-06 19:39:00",中西區,違規停車,違規停車,"中西區永福路一段與五妃街  違規停車",700台灣台南市中西區永福路一段與五妃街轉角,22.981705718038583,120.19853096455336
UN201601060306,"2016-01-06 19:41:00",中西區,違規停車,違規停車,"中西區府緯街四巷一號前 違規停車",700台灣台南市中西區府緯街四巷一號前,22.98290765464927,120.20059291273355
UN201601060309,"2016-01-06 19:54:00",中西區,違規停車,違規停車,中西區開山路192號違規停車,700台灣台南市中西區開山路192號,22.98654889553762,120.20939726382494
UN201601060315,"2016-01-06 20:11:00","東 區",違規停車,違規停車,"東 區崇德二十五街跟崇德路口違規停車",崇德二十五街跟崇德路口,22.965389621110965,120.22756520658733
UN201601060318,"2016-01-06 20:07:00",永康區,動物救援,犬貓急難救援,"永康區中正路423號 狗受困",臺南市永康區中正路423號,23.035494,120.241623
UN201601060320,"2016-01-06 20:19:00",南區,違規停車,違規停車,"南區文南路290/292號前 違規停車",臺南市文南路290號,22.986607,120.190197
UN201601060321,"2016-01-06 20:22:00",中西區,違規停車,違規停車,"中西區金華路四段98號 違規停車",中西區金華路四段98號,22.998508,120.194944
UN201601060326,"2016-01-06 20:47:00",南區,違規停車,違規停車,"南區文南路與金華路2段385巷路口 違規停車",南區文南路與金華路2段385巷路口,22.9849818,120.1899424
UN201601060327,"2016-01-06 20:48:00",東區,違規停車,違規停車,東區裕農一街80^88號前違規停車,臺南市裕農一街80^88號,22.983101,120.238347
UN201601060328,"2016-01-06 20:50:00",北區,違規停車,違規停車,"北區育德一街跟育德路199巷 違停",北區育德一街跟育德路199巷,23.0150561,120.2052315
UN201601060329,"2016-01-06 20:53:00",東區,違規停車,違規停車,"東區裕農一街76號 違規停車",東區裕農一街76號轉角紅線,22.9861012,120.2383466
UN201601060333,"2016-01-06 21:02:00",歸仁區,違規停車,違規停車,"歸仁區中正北路一段 違規停車",711台灣台南市歸仁區中正北路一段公車候車亭,22.9678915,120.2939133
UN201601060335,"2016-01-06 21:17:00",北區,違規停車,違規停車,北區富台新村違規停車,台南市北區富台新村,23.007976,120.221527
UN201601060338,"2016-01-06 21:43:00",新化區,交通運輸,號誌故障,新化區那拔里牧場1號,臺南市新化區那拔里牧場1號,23.05978,120.328487
UN201601060344,"2016-01-06 22:35:00",永康區,動物救援,遊蕩犬隻捕捉管制,"永康區勝利國小後面操場出入口處 流浪犬",永康區勝利國小後面操場出入口處,23.0211779,120.2628111
UN201601060346,"2016-01-06 22:57:00",中西區,違規停車,違規停車,中西區金華路3段79違規停車,台南市中西區金華路3段79,22.9902101,120.1922863
UN201601060348,"2016-01-06 22:57:00",中西區,違規停車,違規停車,中西區開山路192號違規停車,700台灣台南市中西區開山路192號,22.986583464786627,120.20937580615283
UN201601060350,"2016-01-06 23:00:00",東區,噪音舉發,妨礙安寧,東區中華東路一段207巷、209號妨礙安寧、違停,東區中華東路一段209號,22.9902371,120.2337975
UN201601060351,"2016-01-06 23:01:00",南區,噪音舉發,妨礙安寧,"南區新都路377、或379號(鬍鬚檳榔攤)  妨礙安寧",臺南市南區新都路377或379號,22.967048,120.195121
UN201601060352,"2016-01-06 23:08:00",東區,路燈故障,9盞以下路燈故障,東區衛國街110巷13號路燈故障,701台灣台南市東區衛國街110巷13號,22.9870677,120.2254932
UN201601060354,"2016-01-06 23:16:00",中西區,違規停車,違規停車,中西區民權路2段151號違規停車,台南市中西區民權路2段151,22.9948283,120.2031185
UN201601060356,"2016-01-06 23:32:00",北區,噪音舉發,妨礙安寧,"北區公園路788巷37弄6號前 妨礙安寧",北區公園路788巷37弄6號前,23.0114819,120.2120735
UN201601060357,"2016-01-06 23:57:00",北區,,妨礙安寧,"北區大興街325巷33號 妨礙安寧",臺南市北區大興街325巷33號,23.009635,120.18664
UN201601070002,"2016-01-07 00:38:00",中西區,噪音舉發,妨礙安寧,"中西區海安路二段268號 妨礙安寧/噪音",臺南市中西區海安路二段268號,22.997838,120.19787
UN201601070003,"2016-01-07 00:43:00",善化區,違規停車,違規停車,"善化區陽光三路/蓮潭南街交叉口 違規停車","741台灣台南市善化區陽光三路 蓮潭南街交叉口",23.1128987,120.309146
UN201601070004,"2016-01-07 00:48:00",安南區,噪音舉發,妨礙安寧,"安南區郡安路五段184巷52弄18號 妨礙安寧",709台灣台南市安南區郡安路五段184巷52弄18號,23.029799,120.1916746
UN201601070006,"2016-01-07 00:51:00",鹽水區,噪音舉發,妨礙安寧,"鹽水區文武街和康樂路口 妨礙安寧",鹽水區文武街和康樂路口,23.3214378,120.2708742
UN201601070011,"2016-01-07 02:56:00",中西區,噪音舉發,場所連續噪音,"中西區永福路一段115號 噪音",700台灣台南市中西區永福路一段115號,22.984162670010893,120.19978489726782
UN201601070016,"2016-01-07 07:04:00",安南區,,妨礙安寧,"安南區公學路六段655號""慈興宮""擴音器叫賣",臺南市安南區公學路六段655號,23.078375,120.143299
UN201601070017,"2016-01-07 07:15:00",中西區,違規停車,違規停車,中西區南寧街16號對面巷口,臺南市中西區南寧街16號,22.984629,120.20503
UN201601070019,"2016-01-07 07:27:00",永康區,動物救援,犬貓急難救援,永康區中正路423號旁外牆,臺南市永康區中正路423號,23.035494,120.241623
UN201601070021,"2016-01-07 07:34:00",中西區,違規停車,違規停車,"衛民街 違規停車",衛民街,22.9929702,120.2099622
UN201601070022,"2016-01-07 07:48:00",新營區,噪音舉發,場所連續噪音,"新營區民生路420巷20號旁 噪音",臺南市新營區民生路420巷20號,23.31533,120.304462
UN201601070024,"2016-01-07 08:09:00",北區,違規停車,違規停車,"北區小東路279號機車店 違停",臺南市北區小東路279號,22.999787,120.229028
UN201601070025,"2016-01-07 07:58:00",安南區,髒亂及汙染,空氣汙染,"安南區海佃路四段490巷27號旁 空氣汙染",臺南市安南區海佃路四段490巷27號,23.064816,120.173805
UN201601070027,"2016-01-07 08:16:00",永康區,動物救援,遊蕩犬隻捕捉管制,"永康區正北一路160巷15號附近 捕狗",永康區正北一路160巷15號附近,23.0515,120.260274
UN201601070031,"2016-01-07 08:32:00",佳里區,髒亂及汙染,場所連續噪音,"佳里區新生路441巷38號 噪音",臺南市佳里區新生路441巷38號,23.15818,120.171901
UN201601070033,"2016-01-07 08:38:00",中西區,違規停車,違規停車,"萬昌街+興華街 違規停車",萬昌街+興華街,22.9920383,120.2104726
UN201601070035,"2016-01-07 08:46:00",永康區,違規停車,違規停車,"永康區中正路581號.890號 違規停車",永康區中正路581號.890號,23.03937981762325,120.23931361734867
UN201601070038,"2016-01-07 08:40:00",中西區,噪音舉發,妨礙安寧,"中西區金華路四段12號 妨礙安寧",臺南市中西區金華路四段12號,22.996517,120.194183
UN201601070046,"2016-01-07 09:12:00",中西區,違規停車,違規停車,"中西區公園路86號 違規停車",臺南市中西區公園路86號,22.996315,120.206226
UN201601070075,"2016-01-07 10:09:00",東區,騎樓舉發,騎樓舉發,"東區東安路83-85號 騎樓舉發",701台灣台南市東區東安路83-85號,22.9923793,120.2263565
UN201601070076,"2016-01-07 10:11:00",東區,違規停車,違規停車,"東區崇學路228號 違規停車",臺南市東區崇學路228號,22.982494,120.22595
UN201601070078,"2016-01-07 10:13:00",南區,動物救援,犬貓急難救援,"南區健康路二段300號 貓受困",臺南市南區健康路二段300號,22.981929,120.189176
UN201601070091,"2016-01-07 10:59:00",永康區,髒亂及汙染,環境髒亂,"永康區王行路1018巷57號 髒亂及汙染",710台灣台南市永康區王行路1018巷57號,23.051735079606846,120.27558613568544
UN201601070095,"2016-01-07 11:15:00",中西區,民生管線,停電、漏電、電線掉落、孔蓋鬆動,"中西區永福路二段110號右前方的快車道 孔蓋鬆動",臺南市中西區永福路二段110號,22.993337,120.201196
UN201601070100,"2016-01-07 11:28:00",永康區,違規停車,違規停車,"永康區中正七街1.2.22.23.27.68.70號 違規停車",永康區中正七街1.2.22.23.27.68.70號,23.0395038479085,120.23944772779942
UN201601070101,"2016-01-07 11:41:00",新營區,交通運輸,佔用道路,"新營區民權路19-2號 佔用道路",臺南市新營區民權路19-2號,23.304001,120.312983
UN201601070104,"2016-01-07 11:46:00",永康區,交通運輸,佔用道路,"永康區中華路687號 佔用道路",永康區中華路687號,23.0162744,120.2287571
UN201601070105,"2016-01-07 11:48:00",中西區,違規停車,違規停車,"中西區開山路76號到132號+77號到87號 違規停車",臺南市中西區開山路76號,22.990099,120.206607
UN201601070111,"2016-01-07 12:03:00",北區,違規停車,違規停車,"北區東豐路239號/241號前 違停",北區東豐路239號/241號前,23.0032654,120.2210776
UN201601070112,"2016-01-07 12:05:00",安平區,違規停車,違規停車,"安平區郡平路(育平路～健康三街) 違規停車",708台灣台南市安平區郡平路,22.98908137826319,120.16803156584501
UN201601070117,"2016-01-07 12:23:00",北區,噪音舉發,妨礙安寧,"北區開南街169號 妨礙安寧/噪音",臺南市北區開南街169號,23.005343,120.22631
UN201601070120,"2016-01-07 12:32:00",永康區,違規停車,違規停車,"永康區中正路890號周圍、888號對面 違規停車",永康區中正路890號周圍.888號對面,23.03926936269598,120.23950204253197
UN201601070122,"2016-01-07 12:39:00",安平區,違規停車,違規停車,"安平區古堡街120-1號對面 違停",臺南市安平區古堡街120-1號,23.003339,120.159172
UN201601070129,"2016-01-07 13:04:00",永康區,違規停車,違規停車,"永康區中正路888號對面 違規停車",永康區中正路888號對面,23.03920364505661,120.23950707167386
UN201601070134,"2016-01-07 13:15:00",東區,違規停車,違規停車,"東區東和路146號 違規停車",台南市東區東和路146號,22.9985726,120.2257858
