UN201601230268,"2016-01-23 19:44:00",北區,路燈故障,9盞以下路燈故障,"北區長榮路四段58巷29號旁  路燈不亮",臺南市北區長榮路四段58巷29號,23.004745,120.22372
UN201601230271,"2016-01-23 20:18:00",中西區,違規停車,違規停車,中西區府緯街33號違規停車,700台灣台南市中西區府緯街33號,22.983911729603342,120.19838511943819
UN201601230272,"2016-01-23 20:18:00",中西區,違規停車,違規停車,中西區府緯街41號對面違規停車,700台灣台南市中西區府緯街41號對面,22.984116679737394,120.19858594983816
UN201601230273,"2016-01-23 20:20:00",中西區,違規停車,違規停車,中西區府緯四巷27號旁違規停車,700台灣台南市中西區府緯四巷27號旁,22.983950620767143,120.19895005971193
UN201601230276,"2016-01-23 20:10:00",中西區,民生管線,漏水、停水、消防栓漏水或損壞,"中西區忠義路一段36號前  路面冒水",臺南市中西區忠義路一段36號,22.985674,120.20195
UN201601230277,"2016-01-23 20:26:00",中西區,民生管線,漏水、停水、消防栓漏水或損壞,"中西區民權路四段112巷 8號 路面漏水",中西區民權路四段112巷8號,23.0001102,120.183456
UN201601230280,"2016-01-23 20:38:00",東區,噪音舉發,妨礙安寧,"東區崇明路269 號(匯豐銀行) 妨礙安寧","東區崇明路269 號(匯豐銀行)",22.9764912,120.2211883
UN201601230284,"2016-01-23 20:44:00",北區,違規停車,違規停車,北區北安路一段100號違規停車,臺南市北區北安路一段100號,23.016801,120.210292
UN201601230286,"2016-01-23 21:00:00",北區,違規停車,違規停車,"北區開元路249巷10號前   違規停車",臺南市北區開元路249巷10號,23.00898,120.218898
UN201601230291,"2016-01-23 21:17:00",永康區,違規停車,違規停車,"永康區中華路522號至526號 違停",永康區中華路522號至526號,23.0124826,120.2316018
UN201601230292,"2016-01-23 21:19:00",南區,民生管線,漏水、停水、消防栓漏水或損壞,"南區大林路111巷10弄12號 漏水",臺南市南區大林路111巷10弄12號,22.974659,120.211237
UN201601230295,"2016-01-23 21:32:00",中西區,違規停車,違規停車,"中西區民生路二段76號   違規停車",700台灣台南市中西區民生路二段76號,22.9952655,120.1970713
UN201601230296,"2016-01-23 21:34:00",永康區,噪音舉發,妨礙安寧,"永康區富強路一段2巷 妨礙安寧",永康區富強路一段2巷,23.0123691,120.2781852
UN201601230297,"2016-01-23 21:13:00",永康區,違規停車,違規停車,"永康區大橋一街247巷77號對面  違停",永康區大橋一街247巷77號對面,23.0213056,120.2307326
UN201601230298,"2016-01-23 21:42:00",中西區,民生管線,漏水、停水、消防栓漏水或損壞,"中西區永福路二段40號前柏油路面  滲水",臺南市中西區永福路二段40號,22.991549,120.200758
UN201601230301,"2016-01-23 22:19:00",南區,路燈故障,9盞以下路燈故障,"南區喜樹路192號對面 路燈故障",臺南市南區喜樹路192號,22.942411,120.179252
UN201601230302,"2016-01-23 22:24:00",中西區,違規停車,違規停車,"中西區西門路二段246號 違規停車",臺南市中西區西門路二段246號,22.995552,120.199603
UN201601230303,"2016-01-23 22:23:00",安南區,噪音舉發,妨礙安寧,"安南區安和路四段123號 妨礙安寧",臺南市安南區安和路四段123號,23.053267,120.218491
UN201601230305,"2016-01-23 22:27:00",中西區,違規停車,違規停車,"中西區民生路二段46號 違規停車",臺南市中西區民生路二段46號,22.995043,120.197977
UN201601230306,"2016-01-23 21:51:00",安南區,噪音舉發,妨礙安寧,"安南區安中路四段290巷170號隔壁   妨礙安寧",安南區安中路四段290巷170號隔壁,23.0517056,120.1702315
UN201601230307,"2016-01-23 22:32:00",玉井區,路燈故障,10盞以上路燈故障,"玉井區  路燈故障",710台灣台南市玉井區,23.0048763,120.2359306
UN201601230312,"2016-01-23 23:50:00",鹽水區,噪音舉發,妨礙安寧,"鹽水區康樂路/文武街口 妨礙安寧",鹽水區康樂路/文武街口,23.319523,120.268191
UN201601240001,"2016-01-24 00:10:00",安平區,路燈故障,10盞以上路燈故障,"安平區光州六街 路燈故障",708台灣台南市安平區光州六街,22.99112368836391,120.16321834176779
UN201601240002,"2016-01-24 00:17:00",東區,噪音舉發,妨礙安寧,"東區自由路二段175巷23號 妨礙安寧",701台灣台南市東區自由路二段175巷23號,22.9765701,120.2363854
UN201601240004,"2016-01-24 00:25:00",東區,噪音舉發,妨礙安寧,"東區北門路二段28號 妨礙安寧",東區北門路二段28號,23.0005508,120.2131922
UN201601240008,"2016-01-24 02:54:00",麻豆區,噪音舉發,妨礙安寧,"麻豆區和平路11號 妨礙安寧",臺南市麻豆區和平路11號,23.178365,120.243523
UN201601240010,"2016-01-24 03:15:00",永康區,噪音舉發,妨礙安寧,"永康區永二街395號 噪音汙染/妨礙安寧",永康區永二街395號,23.0193901,120.247457
UN201601240014,"2016-01-24 04:18:00",永康區,噪音舉發,場所連續噪音,"永康區育樂街180號 妨礙安寧",臺南市永康區育樂街180號,23.03509,120.268911
UN201601240016,"2016-01-24 04:33:00",南區,交通運輸,號誌故障,"南區明興路320號跟喜樹路口 號誌燈傾倒",臺南市南區明興路320號,22.950543,120.18437
UN201601240022,"2016-01-24 05:57:00",永康區,噪音舉發,妨礙安寧,"永康區龍潭里 妨礙安寧",永康區龍潭里,23.0286236,120.2656955
UN201601240025,"2016-01-24 06:07:00",永康區,噪音舉發,妨害安寧,"永康區永明街88號 噪音舉發",710台灣台南市永康區永明街88號,23.0249547,120.2596422
UN201601240028,"2016-01-24 06:16:00",永康區,噪音舉發,場所連續噪音,"永康區永二街395號 噪音舉發",永康區永二街395號,23.0193901,120.247457
UN201601240048,"2016-01-24 08:35:00",永康區,噪音舉發,妨害安寧,"永康區開天宮廟會 妨礙安寧",永康區開天宮廟會,23.0211779,120.2628111
UN201601240052,"2016-01-24 08:55:00",北區,道路維修,路面下陷、凹陷,"北區開南街63號前方 路面下陷",臺南市北區開南街63號,23.007526,120.22319
UN201601240063,"2016-01-24 09:40:00",中西區,違規停車,違規停車,"西華南街2號到20號 違規停車",臺南市西華南街2號,22.993195,120.20943
UN201601240064,"2016-01-24 09:43:00",中西區,違規停車,違規停車,"西華南街32號 違規停車",臺南市西華南街32號,22.993828,120.209542
