UN201601200019,"2016-01-20 07:10:00",安南區,,妨礙安寧,"安南區公學路六段655號 妨礙安寧",臺南市安南區公學路六段655號,23.078375,120.143299
UN201601200023,"2016-01-20 07:39:00",新營區,違規停車,違規停車,"新營區中華路52巷11號 違規停車",730台灣台南市新營區中華路52巷11號,23.3051629,120.3107523
UN201601200024,"2016-01-20 07:54:00","東 區",違規停車,違規停車,"東區榮譽街平交道旁 違規停車",702台灣台南市東區榮譽街,22.96263473300804,120.19562713801861
UN201601200033,"2016-01-20 08:19:00",南區,違規停車,違規停車,"南區大同路二段732號  違規停車",702台灣台南市南區大同路二段732號,22.9657904,120.2160383
UN201601200038,"2016-01-20 08:38:00",中西區,違規停車,違規停車,"中西區健康路一段150巷口 違規停車",台南市中西區健康路一段,22.9813992,120.2045893
UN201601200041,"2016-01-20 08:46:00",中西區,違規停車,違規停車,"中西區衛民街110～150號 違規停車",臺南市衛民街110～150號,22.993591,120.207097
UN201601200047,"2016-01-20 09:00:00",學甲區,噪音舉發,妨礙安寧,"學甲區自強路9號 妨礙安寧",臺南市學甲區自強路9號,23.228474,120.182551
UN201601200048,"2016-01-20 09:05:00",中西區,違規停車,違規停車,"中西區開山路76號到80號 違規停車",臺南市開山路76號,22.990099,120.206607
UN201601200050,"2016-01-20 09:07:00",中西區,違規停車,違規停車,"中西區萬昌街(衛民街口^青年路口)/興華街(北門路口^青年路口) 違規停車",萬昌街+興華街,22.9920383,120.2104726
UN201601200054,"2016-01-20 09:13:00",永康區,交通運輸,佔用道路,"永康區東橋一路跟東橋六街轉角處招牌 佔用道路",永康區東橋一路跟東橋六街轉角處,23.0202135,120.2324126
UN201601200059,"2016-01-20 09:23:00",北區,噪音舉發,場所連續噪音,"北區前鋒路318號 噪音舉發",704台灣台南市北區前鋒路318號,23.0044883,120.2166315
UN201601200068,"2016-01-20 09:32:00",中西區,噪音舉發,妨害安寧,"中西區金華路三段與金華新路43號交叉口 噪音",中西區金華路三段與金華新路43號交叉口,22.9922473,120.1929857
UN201601200086,"2016-01-20 10:11:00",北區,交通運輸,號誌故障,北區文賢路好市多　號誌故障,台南市北區文賢路好市多,23.0117004,120.1938507
UN201601200092,"2016-01-20 10:18:00",東區,違規停車,違規停車,"東區崇明十一街5號附近紅線十字路口 違停",東區崇明十一街5號附近紅線十字路口,22.975966,120.2225307
UN201601200099,"2016-01-20 10:48:00",永康區,違規停車,違規停車,永康區中華路1002號　違規停車,臺南市永康區中華路1002號,23.021797,120.221381
UN201601200101,"2016-01-20 10:52:00",永康區,髒亂及汙染,空氣汙染,"永康區中正北路831號 空氣汙染",臺南市永康區中正北路831號,23.048834,120.264662
UN201601200103,"2016-01-20 10:55:00",南區,違規停車,違規停車,"南區健康路二段122號 違停",臺南市南區健康路二段122號,22.981662,120.194275
UN201601200111,"2016-01-20 10:55:00",中西區,違規停車,違規停車,"中西區忠義路二段54號 違停",臺南市中西區忠義路二段54號,22.993062,120.203209
UN201601200115,"2016-01-20 11:15:00",六甲區,交通運輸,道路散落物,"六甲區裕農街71號  狗屍體",臺南市六甲區裕農街71號,23.228406,120.35711
UN201601200118,"2016-01-20 11:22:00",中西區,違規停車,違規停車,中西區仁愛街2號　違規停車,臺南市中西區仁愛街2號,22.995362,120.197679
UN201601200120,"2016-01-20 11:25:00",中西區,違規停車,違規停車,中西區中山路151.125.166號　違規停車,中西區中山路151.125.166號,22.99592115915283,120.21013151854277
UN201601200121,"2016-01-20 11:12:00",永康區,民生管線,電信孔蓋鬆動、電信線路掉落、電信桿傾倒,"永康區中正南路377號門口 孔蓋",臺南市永康區中正南路377號,23.030157,120.224879
UN201601200123,"2016-01-20 11:29:00",北區,違規停車,違規停車,北區北門路二段49號違規停車,臺南市北區北門路二段49號,22.998373,120.212308
UN201601200127,"2016-01-20 11:42:00",安平區,騎樓舉發,騎樓舉發,安平區華平路656號騎樓舉發,708台灣台南市安平區華平路656號,22.996014983438904,120.17582640051842
UN201601200138,"2016-01-20 11:51:00",中西區,髒亂及汙染,空氣汙染,"中西區友愛街207號  空汙",臺南市中西區友愛街207號,22.991852,120.19733
UN201601200140,"2016-01-20 12:05:00",安平區,違規停車,違規停車,安平區郡平路(健康三街-育平路)，違規停車,708台灣台南市安平區郡平路,22.98915144140029,120.16801647841932
UN201601200142,"2016-01-20 12:12:00","北 區",違規停車,違規停車,北區北門路二段兩側(長榮路到和緯路)違規停車,北區北門路二段兩側(長榮路到和緯路),23.012642147736404,120.21691951900719
UN201601200148,"2016-01-20 12:27:00",中西區,違規停車,違規停車,中西區國華街一段59-61號違規停車,702台灣台南市南區國華街一段59-61號,22.983835799203668,120.19640028476714
UN201601200149,"2016-01-20 12:29:00",中西區,違規停車,違規停車,中西區西華南街65號前面及對面違規停車,中西區西華南街65號前面及對面,22.99469958568786,120.20953305065633
UN201601200150,"2016-01-20 12:30:00",中西區,違規停車,違規停車,中西區萬昌街+興華街違規停車,萬昌街+興華街,22.9920383,120.2104726
UN201601200153,"2016-01-20 12:34:00",中西區,道路維修,路面掏空、塌陷,"中西區海安路一段41號   人行道塌陷",臺南市中西區海安路一段41號,22.988775,120.194726
UN201601200154,"2016-01-20 12:37:00",歸仁區,噪音舉發,妨礙安寧,"歸仁區大順三街16號 妨礙安寧",臺南市歸仁區大順三街16號,22.964968,120.291469
UN201601200203,"2016-01-20 13:37:00",安平區,違規停車,違規停車,"安平區怡平路139號 違規停車",臺南市怡平路139號,22.993059,120.179102
UN201601200247,"2016-01-20 14:34:00",北區,違規停車,違規停車,"北區西門路四段271號 隔壁人行道上 違停",臺南市北區西門路四段271號,23.013093,120.208899
UN201601200255,"2016-01-20 14:49:00",中西區,噪音舉發,寬頻管線、孔蓋損壞,"中西區西門路一段478號 孔蓋聲響",臺南市中西區西門路一段478號,22.983445,120.197767
UN201601200256,"2016-01-20 14:53:00",中西區,違規停車,違規停車,"中西區衛民街(西華南街口-中山路口) 違規停車",衛民街,22.9929702,120.2099622
UN201601200268,"2016-01-20 15:04:00",中西區,違規停車,違規停車,"中西區中山路209.151.143.125號 違規停車",中西區中山路209.151.143.125號,22.99678008102211,120.21133046597242
UN201601200275,"2016-01-20 15:10:00",南區,騎樓舉發,騎樓舉發,"南區文南路283號 騎樓舉發",臺南市文南路283號,22.986622,120.189946
UN201601200309,"2016-01-20 15:38:00",仁德區,道路維修,路面坑洞,"仁德區亞航街31號前/亞航街198巷方向 坑洞",臺南市仁德區亞航街31號,22.952829,120.218797
UN201601200322,"2016-01-20 15:51:00",中西區,違規停車,違規停車,"中西區仁愛街2號 違規停車",700，臺南市中西區仁愛街2號,22.9951277,120.1975655
UN201601200352,"2016-01-20 16:18:00",東區,違規停車,違規停車,"東區府東街41巷2號 違規停車",臺南市東區府東街41巷2號,22.98465,120.219404
UN201601200433,"2016-01-20 17:41:00",東區,噪音舉發,妨害安寧,"東區東平路12巷7號 妨害安寧",臺南市東區東平路12巷7號,22.995118,120.233597
UN201601200439,"2016-01-20 17:53:00",東區,違規停車,違規停車,"東區前鋒路92號/衛民街地下道口附近 違規停車",701台灣台南市東區前鋒路92號,22.9924326,120.2129991
UN201601200441,"2016-01-20 17:57:00",新市區,違規停車,違規停車,"新市區社內里76之15號 違停",新市區社內里76之15號,23.0765802,120.2801166
UN201601200445,"2016-01-20 18:04:00","北 區",路燈故障,9盞以下路燈故障,北區長榮路五段246巷整段.實踐街整段路燈故障,北區長榮路五段246巷整段.實踐街整段,23.013229710173675,120.21843329071999
UN201601200450,"2016-01-20 18:09:00",東區,路燈故障,9盞以下路燈故障,"東區裕誠街162號-168號  路燈故障",臺南市東區裕誠街162號,22.988901,120.242222
UN201601200455,"2016-01-20 18:22:00",柳營區,髒亂及汙染,空氣汙染,"柳營區神農里356號 空氣汙染",臺南市柳營區神農里356號,23.25916,120.368679
UN201601200475,"2016-01-20 18:57:00",南區,違規停車,違規停車,"南區三官路/三官路222巷 交叉口  違停",南區三官路/三官路222巷,22.9770744,120.1917274
UN201601200479,"2016-01-20 19:08:00",東區,違規停車,違規停車,"東區大同路二段97巷  違停",東區大同路二段97巷,22.9720392,120.2165698
UN201601200480,"2016-01-20 19:06:00",東區,違規停車,違規停車,"東區建東街45號 違停",東區建東街45號,22.9904136,120.2366742
UN201601200482,"2016-01-20 19:14:00",中西區,違規停車,違規停車,"中西區府緯街4巷6號 違規停車",700台灣台南市中西區府緯街4巷6號,22.9842006351242,120.19942615181208
UN201601200485,"2016-01-20 19:17:00",東區,路燈故障,9盞以下路燈故障,"東區中華東路三段452巷8弄22號 路燈故障",東區中華東路三段452巷8弄22號,22.9806481,120.2287226
UN201601200489,"2016-01-20 19:27:00",東區,違規停車,違規停車,"東區中華東路三段399巷25號 違規停車",701台灣台南市東區中華東路三段399巷25號,22.972306455942913,120.22066506190185
UN201601200499,"2016-01-20 19:43:00",東區,噪音舉發,妨礙安寧,"東區東平路12巷7號(樂器行)夢工廠音樂  妨礙安寧",東區東平路12巷7號(夢工廠音樂),22.9951712,120.233507
UN201601200508,"2016-01-20 20:07:00",東區,違規停車,違規停車,東區怡東路22號違規停車,701台灣台南市東區怡東路22號,22.9912166,120.2272916
UN201601200512,"2016-01-20 20:14:00",東區,違規停車,違規停車,崇善路52號對面，忠孝國中圍牆旁的紅線違規停車,臺南市崇善路52號,22.981275,120.2221
UN201601200517,"2016-01-20 20:25:00",安南區,路燈故障,9盞以下路燈故障,"安南區安中路一段622巷181號 路燈不亮",安南區安中路一段622巷181號,23.035788,120.207681
UN201601200523,"2016-01-20 20:45:00",中西區,違規停車,違規停車,"西華南街  違規停車",西華南街,22.9954612,120.2097537
UN201601200546,"2016-01-20 22:33:00",安平區,路燈故障,10盞以上路燈故障,"安平區怡平路8號(金城國中)週邊 路燈故障",臺南市安平區怡平路8號,22.993126,120.18111
UN201601200552,"2016-01-20 23:02:00",南區,噪音舉發,妨害安寧,"南區敬南街41號 妨礙安寧",臺南市南區敬南街41號,22.985714,120.189436
UN201601200553,"2016-01-20 23:02:00",新市區,違規停車,違規停車,"新市區和平街與民生路二巷巷口 違規停車",台灣台南市新市區和平街與民生路二巷巷口,23.079012844538234,120.29117269940571
UN201601200559,"2016-01-20 23:37:00",中西區,違規停車,違規停車,"中西區民族路二段/西華南街口 違規停車",中西區民族路二段西華南街口,22.9956728,120.2057033
UN201601200561,"2016-01-20 23:42:00",中西區,交通運輸,佔用道路,"中西區海安路一段161號 尊王路92號(佔用道路)/ 保安路182號(騎樓舉發)",臺南市中西區海安路一段161號,22.991651,120.195481
UN201601200562,"2016-01-20 23:51:00",官田區,噪音舉發,妨礙安寧,"官田區渡頭里三塊厝13號 妨礙安寧",官田區渡頭里三塊厝13號,23.167207,120.3464333
UN201601200563,"2016-01-20 23:58:00",永康區,噪音舉發,場所連續噪音,"永康區忠孝路378號2樓 噪音/妨礙安寧",永康區忠孝路378號2樓,23.018268,120.2435958
UN201601210002,"2016-01-21 00:07:00",新市區,違規停車,違規停車,"新市區和平街與民生路二巷巷口 違規停車",744台灣台南市新市區和平街與民生路二巷巷口,23.0789027,120.2910488
UN201601210003,"2016-01-21 00:15:00",東區,噪音舉發,妨礙安寧,"東區府連路251號 妨礙安寧",東區府連路251號,22.9856615,120.2139652
UN201601210007,"2016-01-21 04:22:00",永康區,噪音舉發,妨礙安寧,"永康區永信路11巷15號釣蝦場吵架 妨礙安寧",710台灣台南市永康區永信路11巷15號,23.0172763,120.2616987
UN201601210009,"2016-01-21 04:58:00",東區,噪音舉發,妨礙安寧,"東區裕農路752號  妨礙安寧",東區裕農路752號,22.9887731,120.238152
UN201601210010,"2016-01-21 05:11:00",佳里區,噪音舉發,妨礙安寧,"佳里區平等街18號 妨礙安寧",佳里區平等街18號,23.1574094,120.1815081
UN201601210034,"2016-01-21 08:45:00",安南區,動物救援,犬貓急難救援,"安南區開安三街(小雅檳榔攤) 動物救援",安南區開安三街(小雅檳榔攤),23.0471618,120.2269913
UN201601210040,"2016-01-21 09:02:00",後壁區,髒亂及汙染,其他汙染舉發,"後壁區烏樹里28號 廢水",臺南市後壁區烏樹里28號,23.335002,120.377712
UN201601210057,"2016-01-21 09:50:00",安南區,動物救援,犬貓急難救援,安南區安和路一段321巷68號對面空地動物救援,臺南市安和路一段321巷68號,23.032616,120.210733
UN201601210063,"2016-01-21 10:06:00",北區,民生管線,人孔蓋聲響、凹陷、漏水,"北區文賢路1122巷153號 汙水人孔蓋鬆動",北區文賢路1122巷153號,23.01728,120.1979481
UN201601210070,"2016-01-21 10:20:00",中西區,道路維修,人孔蓋聲響、凹陷、漏水,"中西區南華街41號 孔蓋損壞",臺南市中西區南華街41號,22.989883,120.191237
UN201601210076,"2016-01-21 10:36:00",中西區,民生管線,瓦斯管溝修補、孔蓋鬆動,"中西區民族路二段43號 孔蓋鬆動",臺南市中西區民族路二段43號,22.994308,120.210574
UN201601210079,"2016-01-21 10:39:00",南區,道路維修,路面下陷、凹陷,"南區金華路一段214號前 柏油路凹陷",臺南市金華路一段214號,22.966575,120.190196
UN201601210080,"2016-01-21 10:38:00",安南區,動物救援,犬貓急難救援,安南區青砂街二段附近的空地,安南區青砂街二段,23.0755404,120.1091308
UN201601210085,"2016-01-21 10:46:00",南區,交通運輸,佔用道路,"南區尊南街226號 佔用道路",臺南市南區尊南街226號,22.979488,120.189089
UN201601210091,"2016-01-21 11:05:00",中西區,違規停車,違規停車,"700台灣台南市中西區萬昌街28號 違規停車",700台灣台南市中西區萬昌街28號,22.9902087,120.2099865
UN201601210102,"2016-01-21 11:30:00",東區,違規停車,違規停車,"701台灣台南市東區中華東路二段133巷57弄17弄39弄 違規停車",701台灣台南市東區中華東路二段133巷57弄32號,22.985919271684814,120.23481376745917
UN201601210108,"2016-01-21 11:44:00",中西區,違規停車,違規停車,中西區西華南街2-68號違規停車,臺南市西華南街2-68號,22.993195,120.20943
UN201601210109,"2016-01-21 11:42:00",永康區,髒亂及汙染,其他汙染舉發,"永康區中華二路206巷52弄13號 空氣汙染",臺南市永康區中華二路206巷52弄13號,23.01033,120.235853
UN201601210115,"2016-01-21 12:01:00",中西區,違規停車,違規停車,"中西區開山路76號到132號+77號到87號 違規停車",臺南市開山路76號,22.990099,120.206607
UN201601210117,"2016-01-21 12:07:00",安平區,違規停車,違規停車,"708台灣台南市安平區郡平路上從健康三街至育平路 違規停車",708台灣台南市安平區郡平路,22.98910699606642,120.16803726553917
UN201601210129,"2016-01-21 12:37:00",仁德區,違規停車,違規停車,"仁德區保學路45巷26號 違停",臺南市仁德區保學路45巷26號,22.919965,120.235617
UN201601210132,"2016-01-21 12:53:00",安平區,民生管線,漏水、停水、消防栓漏水或損壞,"安平區永華路二段2號(市議會)  消防栓漏水",臺南市安平區永華路二段2號,22.989985,120.185897
UN201601210135,"2016-01-21 12:57:00",安平區,騎樓舉發,騎樓舉發,安平區華平路656號騎樓舉發,708台灣台南市安平區華平路656號,22.996024551043362,120.1758062839508
UN201601210138,"2016-01-21 13:00:00",中西區,違規停車,違規停車,"中西區民族路二段北門路口到西華南街口 違規停車",民族路二段,22.9956728,120.2057033
UN201601210151,"2016-01-21 13:20:00",中西區,違規停車,違規停車,中西區民生路一段78號違規停車,700台灣台南市中西區民生路一段78號,22.9934258,120.2028347
UN201601210153,"2016-01-21 13:22:00",中西區,違規停車,違規停車,中西區民生路一段78號違規停車,700台灣台南市中西區民生路一段78號,22.9934309,120.2027809
UN201601210156,"2016-01-21 13:24:00",關廟區,噪音舉發,妨礙安寧,"關廟區深坑里南雄路一段210號 妨礙安寧",臺南市關廟區深坑里南雄路一段210號,22.935283,120.336796
UN201601210159,"2016-01-21 13:41:00",新化區,髒亂及汙染,空氣汙染,新化區知義里新和庄22號髒亂及汙染,712台灣台南市新化區知義里新和庄22號,23.02212677139045,120.32810948789118
UN201601210174,"2016-01-21 14:27:00",北區,路燈故障,9盞以下路燈故障,"北區文成一路97號對面  路燈故障",臺南市北區文成一路97號,23.01383,120.206253
UN201601210183,"2016-01-21 14:40:00",中西區,違規停車,違規停車,中西區西華南街32號違規停車,臺南市西華南街32號,22.993828,120.209542
UN201601210186,"2016-01-21 14:43:00",佳里區,髒亂及汙染,環境髒亂,"佳里區建中街42號 佔用道路/環境髒亂",臺南市佳里區建中街42號,23.158825,120.179017
UN201601210189,"2016-01-21 14:49:00",中西區,違規停車,違規停車,"中西區南華街58號和金華路三段92巷交叉口 違停",臺南市中西區南華街58號,22.990175,120.191519
UN201601210194,"2016-01-21 14:52:00",安平區,交通運輸,佔用道路,"安平區建平五街184巷38號  佔用道路",安平區建平五街184巷38號,22.9889178,120.1767709
UN201601210203,"2016-01-21 15:07:00",中西區,違規停車,違規停車,"中西區南華街58號 違停",中西區南華街58號,22.9901682,120.1914935
UN201601210206,"2016-01-21 15:11:00",中西區,違規停車,違規停車,中西區西華南街65號前面及對面違規停車,中西區西華南街65號前面及對面,22.99470637566692,120.20955014973879
UN201601210207,"2016-01-21 15:12:00",新營區,噪音舉發,妨礙安寧,"新營區民族路74號對面的碳烤店 噪音汙染",新營區民族路74號對面的碳烤店,23.3114963,120.3184839
UN201601210211,"2016-01-21 15:30:00",永康區,交通運輸,交通疏導,"永康區中正南路/中華路口  交通疏導",永康區中正南路/中華路,23.023611,120.2182712
UN201601210216,"2016-01-21 15:12:00",北區,路燈故障,9盞以下路燈故障,"北區富北街68號 路燈故障",臺南市北區富北街68號,22.999378,120.21161
UN201601210219,"2016-01-21 15:26:00",仁德區,噪音舉發,妨礙安寧,"仁德區文華路三段483號  新華芳機車行  妨礙安寧","仁德區文華路三段483號  新華芳機車行",22.9717994,120.2434749
UN201601210229,"2016-01-21 16:12:00",安南區,髒亂及汙染,空氣汙染,"安南區海佃路四段490巷27號 空氣汙染",安南區海佃路四段490巷27號,23.0647815,120.1739841
UN201601210230,"2016-01-21 16:16:00",中西區,噪音舉發,妨礙安寧,"中西區大埔街45號   妨礙安寧",臺南市中西區大埔街45號,22.986967,120.208742
UN201601210234,"2016-01-21 16:00:00",新市區,髒亂及汙染,空氣汙染,"新市區中正路276號 空氣",臺南市新市區中正路276號,23.07748,120.291959
UN201601210242,"2016-01-21 16:52:00",鹽水區,違規停車,違規停車,"737台灣台南市鹽水區朝琴路53號 違規停車",臺南市鹽水區朝琴路53號,23.321247,120.26887
UN201601210245,"2016-01-21 16:59:00",東區,民生管線,漏水、停水、消防栓漏水或損壞,"701台灣台南市東區小東路機車專用道 民生管線",701台灣台南市東區小東路機車專用道,23.0012528,120.2150779
UN201601210246,"2016-01-21 16:59:00",東區,民生管線,漏水、停水、消防栓漏水或損壞,民生管線,701台灣台南市東區小東路機車專用道,23.0012528,120.2150779
UN201601210258,"2016-01-21 17:25:00",東區,違規停車,違規停車,"東區崇學路94號摩斯漢堡對面巷子 違停",臺南市東區崇學路94號,22.978981,120.222798
UN201601210261,"2016-01-21 17:22:00",中西區,違規停車,違規停車,"中西區忠義路二段54號 違停",臺南市中西區忠義路二段54號,22.993062,120.203209
UN201601210262,"2016-01-21 17:36:00",安平區,騎樓舉發,騎樓舉發,安平區華平路656號騎樓舉發,708台灣台南市安平區華平路656號,22.995944306597888,120.175796225667
