UN201601220003,"2016-01-22 00:20:00",北區,民生管線,漏水、停水、消防栓漏水或損壞,"北區公園北路156號之1前 漏水",北區公園北路156號之1前,23.0053642,120.2074383
UN201601220010,"2016-01-22 02:58:00","北 區",噪音舉發,場所連續噪音,"北區西門路四段341巷26號到30號 噪音舉發",704台灣台南市北區西門路四段341巷26號到30號,23.01566664743653,120.20896274596451
UN201601220013,"2016-01-22 03:45:00",佳里區,噪音舉發,妨礙安寧,"佳里區平等街18號 妨礙安寧",臺南市佳里區平等街18號,23.157453,120.181512
UN201601220015,"2016-01-22 05:33:00",東區,民生管線,漏水、停水、消防栓漏水或損壞,"東區中華東路三段399巷21弄2號 停水",臺南市中華東路三段399巷21弄2號,22.972565,120.220652
UN201601220023,"2016-01-22 07:50:00",南區,違規停車,違規停車,"南區健康路一段1號(忠烈祠大門) 紅線違停",臺南市南區健康路一段1號,22.979762,120.211237
UN201601220025,"2016-01-22 07:53:00",北區,民生管線,漏水、停水、消防栓漏水或損壞,"北區東豐路492號轉角處 水管破裂",臺南市北區東豐路492號,23.001334,120.22743
UN201601220026,"2016-01-22 07:58:00",新化區,違規停車,違規停車,"新化區正新路97號 違規停車",712台灣台南市新化區正新路97號,23.032765320741635,120.30308481305838
UN201601220031,"2016-01-22 08:18:00",南區,違規停車,違規停車,"南區大同路750巷26號 違規停車",702台灣台南市南區大同路750巷26號,22.9657554,120.2157693
UN201601220047,"2016-01-22 08:54:00",北區,民生管線,漏水、停水、消防栓漏水或損壞,"北區小東路跟東豐路交叉路口492號 水管破裂",臺南市北區小東路跟東豐路交叉路口492號,22.998992,120.232105
UN201601220057,"2016-01-22 09:19:00",東區,違規停車,違規停車,東區崇德路64號轉角處,臺南市東區崇德路64號,22.980752,120.217846
UN201601220058,"2016-01-22 09:20:00",北區,民生管線,漏水、停水、消防栓漏水或損壞,"北區東豐路488號門口前方的轉角處 漏水",臺南市北區東豐路488號,23.001377,120.22742
UN201601220060,"2016-01-22 09:20:00",中西區,違規停車,違規停車,"中西區永華路一段32號騎樓 違停",臺南市中西區永華路一段32號,22.987593,120.196406
UN201601220065,"2016-01-22 09:32:00",中西區,民生管線,漏水、停水、消防栓漏水或損壞,"中西區中正路316號人行道 漏水",臺南市中西區中正路316號,22.993566,120.195259
UN201601220069,"2016-01-22 09:39:00",中西區,違規停車,違規停車,"中西區公園路86號 違規停車",臺南市中西區公園路86號,22.996315,120.206226
UN201601220071,"2016-01-22 09:39:00",中西區,違規停車,違規停車,"中西區公園路86號 違規停車",臺南市中西區公園路86號,22.996315,120.206226
UN201601220073,"2016-01-22 09:44:00",東區,違規停車,違規停車,"東區衛國街112巷1號前 違停",臺南市東區衛國街112巷1號,22.987426,120.223683
UN201601220080,"2016-01-22 09:52:00",南區,噪音舉發,場所連續噪音,"南區慶南街142號 噪音",臺南市南區慶南街142號,22.97879,120.190168
UN201601220083,"2016-01-22 09:55:00",北區,路燈故障,9盞以下路燈故障,"北區實踐街7巷3號之1 路燈",臺南市北區實踐街7巷3號,23.014967,120.216587
UN201601220093,"2016-01-22 10:14:00",中西區,民生管線,漏水、停水、消防栓漏水或損壞,"中西區民生路二段155號  路面漏水",臺南市中西區民生路二段155號,22.995532,120.195436
UN201601220094,"2016-01-22 10:20:00",南區,違規停車,違規停車,"西門路一段477號 違規停車",臺南市西門路一段477號,22.982101,120.197427
UN201601220097,"2016-01-22 10:26:00",北區,交通運輸,號誌故障,"北區文賢路227號前方 號誌",臺南市北區文賢路227號,23.005416,120.193463
UN201601220098,"2016-01-22 10:26:00",安南區,髒亂及汙染,空氣汙染,"安南區本田路二段377號 空氣汙染",臺南市安南區本田路二段377號,23.035385,120.149184
UN201601220130,"2016-01-22 11:14:00",柳營區,交通運輸,佔用道路,"柳營區旭山里新吉庄40之14號  佔用道路",臺南市柳營區旭山里新吉庄40之14號,23.264883,120.386378
UN201601220134,"2016-01-22 11:18:00",中西區,違規停車,違規停車,"中西區廣慈街11號 違規停車",臺南市中西區廣慈街11號,22.995887,120.206457
UN201601220136,"2016-01-22 11:26:00",南區,違規停車,違規停車,"南區中華西路一段137巷53號與55號項口 違規停車",702台灣台南市南區中華西路一段137巷53號與55號項口,22.9818358,120.1839727
UN201601220149,"2016-01-22 11:45:00",中西區,違規停車,違規停車,"西華南街32號 違規停車",臺南市西華南街32號,22.993828,120.209542
UN201601220152,"2016-01-22 11:50:00",南區,民生管線,電信孔蓋鬆動、電信線路掉落、電信桿傾倒,"南區樹林街二段285號 電信孔蓋鬆動",臺南市南區樹林街二段285號,22.986286,120.19524
UN201601220163,"2016-01-22 12:10:00",安平區,騎樓舉發,騎樓舉發,安平區華平路656號騎樓舉發,708台灣台南市安平區華平路656號,22.995944923863032,120.17577979713678
UN201601220170,"2016-01-22 12:21:00",永康區,違規停車,違規停車,永康區正強街286號違規停車,710台灣台南市永康區正強街286號,23.030665915645436,120.25154769206540
UN201601220173,"2016-01-22 12:23:00",東區,噪音舉發,妨礙安寧,"東區崇德十六街2號之3(2樓) 妨礙安寧",臺南市東區崇德十六街2號,22.969554,120.227841
UN201601220175,"2016-01-22 12:26:00",安南區,道路維修,路面坑洞,"南區金華路二段85號,全聯前方的汽車道上 坑洞","南區金華路二段85號,全聯前方的汽車道上",22.9792804,120.1911231
UN201601220176,"2016-01-22 12:26:00",中西區,噪音舉發,妨礙安寧,"中西區府前一街117號  妨礙安寧",臺南市中西區府前一街117號,22.99566,120.1875
UN201601220177,"2016-01-22 12:28:00",安平區,違規停車,違規停車,安平區郡平路(健康三街-育平路)違規停車,708台灣台南市安平區郡平路,22.98907890907707,120.16801580786704
UN201601220179,"2016-01-22 12:32:00",東區,民生管線,漏水、停水、消防栓漏水或損壞,"東區崇善二街9號  漏水",東區崇善二街9號,22.9779078,120.2284912
UN201601220181,"2016-01-22 12:38:00",東區,違規停車,違規停車,東區東門路二段140號違規停車,臺南市東區東門路二段140號,22.985794,120.220985
UN201601220182,"2016-01-22 12:45:00",北區,民生管線,漏水、停水、消防栓漏水或損壞,"北區東豐路488號待轉區 漏水",北區東豐路488號待轉區,23.0014052,120.2274857
UN201601220184,"2016-01-22 12:50:00",東區,騎樓舉發,騎樓舉發,東區裕農路752號騎樓舉發,701台灣台南市東區裕農路752號,22.9856942,120.2350391
UN201601220199,"2016-01-22 13:33:00",中西區,路燈故障,9盞以下路燈故障,"中西區西賢街80號旁 路燈故障",臺南市中西區西賢街80號,23.001345,120.17895
UN201601220200,"2016-01-22 13:36:00",中西區,違規停車,違規停車,"中西區友愛街92號 違停",臺南市中西區友愛街92號,22.991599,120.199293
UN201601220219,"2016-01-22 14:11:00",中西區,違規停車,違規停車,"中西區青年路164巷口 違規停車",700台灣台南市中西區青年路164巷口,22.9911401,120.2050584
UN201601220220,"2016-01-22 14:11:00",南區,違規停車,違規停車,"南區中華西路一段137巷53號與55號巷口 違規停車",702台灣台南市南區中華西路一段137巷53號與55號巷口,22.9817959,120.1839742
UN201601220222,"2016-01-22 14:14:00",中西區,道路維修,路面坑洞,"中西區武聖路66號之1的轉角處 坑洞",臺南市中西區武聖路66號,23.005479,120.191963
UN201601220229,"2016-01-22 14:31:00",安平區,違規停車,違規停車,"安平區平通路425號 違停",臺南市安平區平通路425號,22.99307,120.174212
UN201601220232,"2016-01-22 14:36:00",安平區,髒亂及汙染,其他汙染舉發,"安平區安港路1號,海巡署這邊的碼頭海面  其他汙染舉發","安平區安港路1號,海巡署這邊的碼頭海面",22.9909068,120.1478681
UN201601220234,"2016-01-22 14:40:00",安南區,違規停車,違規停車,"安南區海佃路二段155號 違規停車",709台灣台南市安南區海佃路二段155號,23.0333373,120.1879435
UN201601220240,"2016-01-22 14:50:00",北區,噪音舉發,場所連續噪音,北區南園街101巷21弄7號,臺南市北區南園街101巷21弄7號,23.00853,120.225766
UN201601220244,"2016-01-22 14:59:00",南區,民生管線,漏水、停水、消防栓漏水或損壞,"南區健康路一段137號路邊 漏水",臺南市南區健康路一段137號,22.981094,120.208836
UN201601220245,"2016-01-22 15:00:00",南區,違規停車,違規停車,"南區西門路一段483號  違停",臺南市南區西門路一段483號,22.982208,120.197395
UN201601220246,"2016-01-22 15:00:00",東區,違規停車,違規停車,"東區東安路37號 違停",臺南市東區東安路37號,22.991658,120.22607
UN201601220248,"2016-01-22 15:00:00",北區,民生管線,漏水、停水、消防栓漏水或損壞,"北區文賢二街228號  路面冒水",臺南市北區文賢二街228號,23.011004,120.197388
UN201601220250,"2016-01-22 15:10:00",南區,違規停車,違規停車,"南區西門路一段483號前 違停",臺南市南區西門路一段483號,22.982208,120.197395
UN201601220253,"2016-01-22 15:06:00",中西區,路燈故障,9盞以下路燈故障,"中西區忠義路二段147巷1弄10號  路燈不亮",臺南市中西區忠義路二段147巷1弄10號,22.995752,120.202746
UN201601220255,"2016-01-22 15:23:00",南區,,漏水、停水、消防栓漏水或損壞,"南區南門路297號路中央 水管破裂",臺南市南區南門路297號,22.977418,120.20378
UN201601220268,"2016-01-22 15:39:00",中西區,違規停車,違規停車,"安平區平通路425號前 違停",安平區平通路425號前,22.9931456,120.1743382
UN201601220277,"2016-01-22 15:51:00",官田區,道路維修,路面下陷、凹陷,"官田區南118線,南廍二號橋西側的柏油路面 路面下陷","臺南市官田區南118線,南廍二號",23.17907,120.353996
UN201601220291,"2016-01-22 16:29:00",安平區,騎樓舉發,騎樓舉發,安平區華平路656號騎樓舉發,708台灣台南市安平區華平路656號,22.99597084899667,120.1757848262787
UN201601220304,"2016-01-22 16:59:00",中西區,違規停車,違規停車,"中西區西華南街65號前面及對面 違規停車",中西區西華南街65號前面及對面,22.994614402285137,120.20956825464964
UN201601220309,"2016-01-22 17:23:00",東區,違規停車,違規停車,"東區東門路和林森路交叉口 東區民族路一段1號前方 東區勝利路41號前方 違停","臺南市東區東門路和林森路交叉口 東區民族路一段1號",22.981107,120.229713
UN201601220313,"2016-01-22 17:29:00",永康區,交通運輸,佔用道路,"永康區忠孝路203巷42弄8號 佔用道路",臺南市永康區忠孝路203巷42弄8號,23.00387,120.238865
UN201601220314,"2016-01-22 17:31:00",中西區,違規停車,違規停車,"中西區忠義路二段75號 違停",臺南市中西區忠義路二段75號,22.992465,120.202763
UN201601220315,"2016-01-22 17:33:00",中西區,違規停車,違規停車,"中西區中山路125.143.151.209號 違規停車",中西區中山路125.143.151.209號,22.99545944395298,120.20939692854883
UN201601220319,"2016-01-22 17:34:00",新營區,違規停車,佔用道路,"新營區民治路*健康路 交叉處(號誌燈下)  佔用道路","臺南市新營區民治路*健康路 交叉處(號",23.310991,120.321773
UN201601220320,"2016-01-22 17:46:00",中西區,民生管線,漏水、停水、消防栓漏水或損壞,"中西區民權路二段149號 漏水",中西區民權路二段149號,22.9947952,120.2032474
UN201601220342,"2016-01-22 18:37:00",北區,民生管線,漏水、停水、消防栓漏水或損壞,"北區海安路三段985巷17號 漏水",臺南市北區海安路三段985巷17號,23.019293,120.19917
UN201601220356,"2016-01-22 19:04:00","東 區",違規停車,違規停車,"東區崇善十二街2-4號   違規停車",701台灣台南市東區崇善十二街2-4號,22.96919308963341,120.2316176891327
UN201601220357,"2016-01-22 19:04:00",安平區,騎樓舉發,騎樓舉發,"安平區華平路656號  騎樓舉發",708台灣台南市安平區華平路656號,22.995990910108564,120.17579086124897
UN201601220359,"2016-01-22 19:06:00",安平區,違規停車,違規停車,"安平區建平十二街133號   違規停車",臺南市安平區建平十二街133號,22.995472,120.178042
UN201601220362,"2016-01-22 19:15:00","東 區",違規停車,違規停車,"東區崇善路658號   違規停車",701台灣台南市東區崇善路658號,22.96822347925932,120.23130353540182
UN201601220366,"2016-01-22 19:20:00",北區,違規停車,違規停車,"北區北安路一段1號  違規停車",臺南市北區北安路一段1號,23.014801,120.212749
UN201601220369,"2016-01-22 19:30:00",中西區,違規停車,違規停車,"府前路2段216號  違規停車",臺南市台南市府前路2段216號,22.991752,120.192236
UN201601220377,"2016-01-22 19:54:00",南區,路燈故障,9盞以下路燈故障,"南區新建路3巷30號  路燈故障",臺南市南區新建路3巷30號,22.976328,120.186978
UN201601220389,"2016-01-22 20:31:00",善化區,髒亂及汙染,空氣汙染,"善化區善新西路 (目加溜灣大道天橋下方)     空汙","善化區善新西路 (目加溜灣大道天橋下方)",23.1136426,120.3033598
UN201601220392,"2016-01-22 20:49:00",南區,噪音舉發,妨礙安寧,"南區灣裡路304之2號  妨礙安寧",臺南市南區灣裡路304之2號,22.926367,120.182125
UN201601220396,"2016-01-22 20:56:00",中西區,騎樓舉發,騎樓舉發,"中西區開山路/府中街  佔用騎樓",中西區開山路/府中街,22.9902043,120.2066365
UN201601220402,"2016-01-22 21:19:00",中西區,違規停車,違規停車,"萬昌街+興華街   違規停車",萬昌街+興華街,22.9920383,120.2104726
UN201601220408,"2016-01-22 21:26:00",安平區,路燈故障,9盞以下路燈故障,"安平區安平路550巷45弄31號   路燈故障",708台灣台南市安平區安平路550巷45弄31號,22.9998917,120.1704907
UN201601220410,"2016-01-22 21:31:00",中西區,交通運輸,佔用道路,中西區海安路一段161號(瑪果)佔用道路,中西區海安路一段161號,22.9916675,120.1954665
UN201601220412,"2016-01-22 21:33:00",中西區,違規停車,違規停車,"中西區府緯街49號   違規停車",700台灣台南市中西區府緯街49號,22.983849071593685,120.19855175167321
UN201601220413,"2016-01-22 21:35:00",中西區,違規停車,違規停車,"中西區府緯街4巷6號   違規停車",700台灣台南市中西區府緯街4巷6號,22.98435558206138,120.19953813403846
UN201601220419,"2016-01-22 21:38:00",永康區,違規停車,佔用道路,"永康區中華路34號  佔用道路",臺南市永康區中華路34號,23.000962,120.235135
UN201601220427,"2016-01-22 22:17:00",安平區,路燈故障,10盞以上路燈故障,"安平區光州六街56號 路燈故障",708台灣台南市安平區光州六街56號,22.99094992190902,120.16385469585657
UN201601220429,"2016-01-22 22:18:00",東區,路燈故障,9盞以下路燈故障,"東區東平路99巷16-3號 路燈不亮",臺南市東區東平路99巷16-3號,22.99474,120.230717
UN201601220433,"2016-01-22 22:27:00",安平區,路燈故障,10盞以上路燈故障,"安平區郡平路454號周邊  路燈不亮",臺南市安平區郡平路454號,22.98956,120.160917
UN201601220438,"2016-01-22 22:54:00",永康區,違規停車,違規停車,"永康區中華路703巷3弄26號  違規停車",701台灣台南市永康區中華路703巷3弄26號,22.997163708391966,120.21296594291925
UN201601220442,"2016-01-22 23:13:00",東區,道路維修,漏水、停水、消防栓漏水或損壞,"東區大學路西段23號門前   路面冒水",臺南市東區大學路西段23號,22.99625,120.217552
UN201601230001,"2016-01-23 00:02:00",佳里區,噪音舉發,場所連續噪音,"佳里區光明街3號 噪音",佳里區光明街3號,23.1661301,120.1712249
UN201601230009,"2016-01-23 02:22:00",麻豆區,噪音舉發,妨礙安寧,"麻豆區中正路80號附近的碳烤店 妨礙安寧",臺南市麻豆區中正路80號,23.185703,120.250071
UN201601230017,"2016-01-23 05:56:00",中西區,髒亂及汙染,空氣汙染,"中西區開山路/樹林街台南大學附設小學附近區域 空氣汙染",中西區開山路/樹林街,22.9861944,120.2098717
UN201601230019,"2016-01-23 07:27:00",東區,違規停車,違規停車,"東區崇善路52號 對面忠孝國中的圍牆旁 違規停車",臺南市東區崇善路52號,22.981275,120.2221
UN201601230022,"2016-01-23 07:54:00",仁德區,髒亂及汙染,空氣汙染,"仁德區文賢路一段564號(上鼎嫩骨飯) 空氣汙染",臺南市仁德區文賢路一段564號,22.93128,120.230917
UN201601230025,"2016-01-23 08:08:00",南區,違規停車,違規停車,"南區健康路一段1號(忠烈祠大門) 違停",南區健康路一段1號(忠烈祠大門),22.981638,120.199245
UN201601230027,"2016-01-23 08:22:00",善化區,民生管線,停電、漏電、電線掉落、孔蓋鬆動,"善化區南科北路和興農路T字路口 電線",善化區南科北路和興農路T字路口,23.1315647,120.27372
UN201601230028,"2016-01-23 08:30:00",中西區,違規停車,違規停車,"701台灣台南市東區勝利路87-89號 違規停車",701台灣台南市東區勝利路87-89號,22.991552,120.2177001
UN201601230031,"2016-01-23 08:39:00",東區,違規停車,違規停車,"東區勝利路87-89號 違規停車",701台灣台南市東區勝利路87-89號,22.991649,120.2177063
UN201601230033,"2016-01-23 08:51:00",北區,違規停車,違規停車,"北區開元路249巷10號前 違規停車",704台灣台南市北區開元路249巷10號前,23.0080509,120.2200885
UN201601230034,"2016-01-23 08:51:00",北區,違規停車,違規停車,"北區開元路249巷10號前 違規停車",臺南市北區開元路249巷10號,23.00898,120.218898
UN201601230039,"2016-01-23 09:02:00",北區,違規停車,違規停車,"北區開元路331號 違停",北區開元路331號,23.0083455,120.2217137
UN201601230040,"2016-01-23 09:00:00",麻豆區,道路維修,路面坑洞,"麻豆區中興里自由路23號 坑洞",臺南市麻豆區中興里自由路23號,23.182094,120.24422
UN201601230041,"2016-01-23 09:13:00",安南區,道路維修,路面坑洞,"安南區安和路五段3號 坑洞",臺南市安南區安和路五段3號,23.063484,120.218526
UN201601230043,"2016-01-23 09:17:00",南區,交通運輸,佔用道路,"南區尊南街224號前 違規設攤",臺南市南區尊南街224號,22.979453,120.189091
UN201601230047,"2016-01-23 09:25:00",南區,違規停車,違規停車,"南區西門路一段479號前方 違停",南區西門路一段479號前方,22.9822624,120.1974098
UN201601230056,"2016-01-23 10:00:00",東區,髒亂及汙染,空氣汙染,"東區立德八路17號  空氣汙染",臺南市東區立德八路17號,22.976801,120.2145
UN201601230067,"2016-01-23 10:37:00",北區,違規停車,違規停車,"北區公園北路156號 違停",臺南市北區公園北路156號,23.005257,120.207983
UN201601230074,"2016-01-23 11:01:00",東區,違規停車,違規停車,"東區中華東路二段335號  違停",臺南市東區中華東路二段335號,22.981512,120.22996
UN201601230081,"2016-01-23 11:16:00",永康區,道路維修,路面坑洞,"永康區復興路310號 坑洞",臺南市永康區復興路310號,22.998777,120.242124
UN201601230085,"2016-01-23 11:26:00",中西區,違規停車,違規停車,"開山路76號到132號+77號到87號 違規停車",臺南市開山路76號,22.990099,120.206607
UN201601230097,"2016-01-23 11:39:00",中西區,違規停車,違規停車,"中西區府前路一段38號 違停",臺南市中西區府前路一段38號,22.989071,120.209998
UN201601230100,"2016-01-23 11:53:00",中西區,違規停車,違規停車,"中西區民族路二段173巷11號 違規停車",臺南市中西區民族路二段173巷11號,22.994343,120.206309
UN201601230108,"2016-01-23 12:04:00",安平區,騎樓舉發,騎樓舉發,"安平區郡平路174號 騎樓",臺南市安平區郡平路174號,22.989264,120.167871
UN201601230110,"2016-01-23 12:07:00",永康區,違規停車,違規停車,"永康區中華路481-3號 違停",臺南市永康區中華路481-3號,23.01143,120.23185
UN201601230128,"2016-01-23 13:18:00",南區,髒亂及汙染,場所連續噪音,"南區中華南路二段300巷2弄23號4樓 噪音",臺南市南區中華南路二段300巷2弄23號,22.961938,120.188896
UN201601230142,"2016-01-23 14:03:00",中西區,民生管線,漏水、停水、消防栓漏水或損壞,"中西區永福路二段46號前方 漏水",臺南市中西區永福路二段46號,22.991628,120.200782
UN201601230149,"2016-01-23 14:25:00",安平區,違規停車,違規停車,"安平區華平路703號 違規停車",臺南市安平區華平路703號,22.997135,120.175808
UN201601230153,"2016-01-23 14:30:00",中西區,違規停車,違規停車,"中西區中正路79號 違規停車",臺南市中西區中正路79號,22.992103,120.201224
UN201601230154,"2016-01-23 14:30:00",歸仁區,動物救援,犬貓急難救援,"歸仁區文化街三段770巷和民生十二街71巷交叉口 動物救援",歸仁區文化街三段770巷和民生十二街71巷交叉口,22.9705071,120.2798267
UN201601230155,"2016-01-23 14:33:00",中西區,違規停車,違規停車,"中西區忠義路二段24號 違規停車",臺南市中西區忠義路二段24號,22.991413,120.202838
UN201601230158,"2016-01-23 14:35:00",東區,違規停車,違規停車,"東榮街（九號公園旁路段） 違規停車",臺南市東榮街（九號,22.991133,120.215486
UN201601230164,"2016-01-23 14:53:00",中西區,違規停車,違規停車,"中西區永福路二段150號 違停",臺南市中西區永福路二段150號,22.994486,120.20161
UN201601230165,"2016-01-23 14:54:00",東區,違規停車,違規停車,"東區東安路30至50號中間 違停",臺南市東區東安路30至50號,22.992093,120.226457
UN201601230174,"2016-01-23 15:01:00",安平區,違規停車,違規停車,"安平區平通路425號  違停",臺南市安平區平通路425號,22.99307,120.174212
UN201601230177,"2016-01-23 15:40:00",東區,違規停車,違規停車,"東區北門路二段16號 違規停車",701台灣台南市東區北門路二段16號,22.9989027,120.2131781
UN201601230181,"2016-01-23 15:54:00",永康區,違規停車,違規停車,"永康區中正南路533號（愛買永康店) 違規停車",臺南市永康區中正南路533號,23.034572,120.228964
UN201601230197,"2016-01-23 16:41:00",永康區,噪音舉發,妨害安寧,"永康區四維街149巷34-1號 妨礙安寧",臺南市永康區四維街149巷34-1號,23.035003,120.250806
UN201601230202,"2016-01-23 17:02:00",永康區,交通運輸,號誌故障,"永康區大安街*文賢街(往大安街方向)  號誌燈故障",永康區大安街*文賢街(往大安街方向),23.0075955,120.2651956
UN201601230207,"2016-01-23 17:22:00",南區,違規停車,違規停車,"南區夏林路312號前 違停",臺南市南區夏林路312號,22.975797,120.195163
UN201601230208,"2016-01-23 17:25:00",中西區,違規停車,違規停車,"中西區萬昌街(衛民街口-青年路口)+中西區興華街(北門路口-青年路口) 違規停車",中西區萬昌街(衛民街口-青年路口)+中西區興華街(北門路口-青年路口),22.9916954,120.2104669
UN201601230211,"2016-01-23 17:28:00",北區,違規停車,違規停車,"北區勝利路214號 違規停車",臺南市北區勝利路214號,23.004501,120.21897
UN201601230212,"2016-01-23 17:33:00",安平區,騎樓舉發,騎樓舉發,"安平區華平路656號 騎樓舉發",708台灣台南市安平區華平路656號,22.995987823783842,120.17582472413778
UN201601230222,"2016-01-23 18:05:00",安南區,路燈故障,10盞以上路燈故障,安南區長溪路一段407巷25-27號路燈故障,709台灣台南市安南區長溪路一段407巷25-27號,23.0390383,120.2049722
UN201601230223,"2016-01-23 18:06:00",安平區,路燈故障,10盞以上路燈故障,安平區光州六街62號路燈故障,708台灣台南市安平區光州六街62號,22.991099305517825,120.1632522046566
UN201601230227,"2016-01-23 18:16:00",東區,違規停車,違規停車,東區東門路二段365巷28號違規停車,東門路二段365巷28號,22.9829952,120.2284173
UN201601230230,"2016-01-23 18:23:00",白河區,路燈故障,9盞以下路燈故障,"白河區廣安里枋子林37之200號 路燈故障不亮",臺南市白河區廣安里枋子林37之200號,23.393491,120.386826
UN201601230234,"2016-01-23 18:28:00",北區,噪音舉發,妨礙安寧,"北區北成路50號  妨礙安寧",臺南市北區北成路50號,23.01897,120.210362
UN201601230248,"2016-01-23 19:04:00",南區,交通運輸,號誌故障,"南區明興路323號 號誌燈",臺南市南區明興路323號,22.950454,120.184686
UN201601230252,"2016-01-23 19:11:00",安南區,民生管線,漏水、停水、消防栓漏水或損壞,"安南區國安街156巷118號前方   路面漏水",臺南市安南區國安街156巷118號,23.025026,120.187241
UN201601230255,"2016-01-23 19:25:00",南區,違規停車,違規停車,金華路三段違規停車,台南市金華路三段,22.9922473,120.1929857
UN201601230259,"2016-01-23 19:30:00",南區,違規停車,違規停車,"南區金華路三段113號  違規停車",臺南市南區金華路三段113號,22.979906,120.191183
UN201601230262,"2016-01-23 19:46:00",中西區,交通運輸,佔用道路,"中西區海安路二段35號 佔用人行道、騎樓",臺南市中西區海安路二段35號,22.994107,120.196036
UN201601230263,"2016-01-23 19:49:00",中西區,騎樓舉發,騎樓舉發,"民族路二段63號   騎樓舉發",臺南市民族路二段63號,22.994306,120.209873
UN201601230267,"2016-01-23 20:06:00",中西區,違規停車,違規停車,中西區衛民街69號違規停車,臺南市衛民街69號,22.992892,120.209701
