UN201602150010,"2016-02-15 01:00:00",麻豆區,噪音舉發,妨害安寧,"麻豆區中正路53-10號 噪音舉發",台南市麻豆區中正路53-10號,23.185464,120.248854
UN201602150050,"2016-02-15 08:22:00",新市區,民生管線,漏水、停水、消防栓漏水或損壞,"新市區忠孝街179巷1弄6號 漏水",臺南市新市區忠孝街179巷1弄6號,23.075093,120.294146
UN201602150054,"2016-02-15 08:25:00",永康區,民生管線,漏水、停水、消防栓漏水或損壞,"永康區大灣路602號門口 地面漏水",臺南市永康區大灣路602號,23.001542,120.264431
UN201602150117,"2016-02-15 09:28:00",中西區,道路維修,路面坑洞,"中西區府前路一段417號 坑洞",臺南市中西區府前路一段417號,22.990105,120.19833
UN201602150129,"2016-02-15 09:25:00",北區,民生管線,漏水、停水、消防栓漏水或損壞,"北區文賢三街301號跟307號 漏水",臺南市北區文賢三街301號,23.01531,120.198032
UN201602150145,"2016-02-15 09:44:00",安南區,民生管線,漏水、停水、消防栓漏水或損壞,"安南區安富街236號 漏水",臺南市安南區安富街236號,23.02677,120.196168
UN201602150192,"2016-02-15 10:20:00",安平區,違規停車,違規停車,"安平區府前路二段612號 違規停車",臺南市安平區府前路二段612號,22.993355,120.184329
UN201602150248,"2016-02-15 11:00:00",安南區,動物救援,遊蕩犬隻捕捉管制,"安南區安吉路一段236號 流浪狗捕抓",臺南市安南區安吉路一段236號,23.046738,120.188873
UN201602150267,"2016-02-15 11:14:00",永康區,違規停車,違規停車,"永康區中華路2號 違規停車",710台灣台南市永康區中華路2號,22.9987517,120.2347319
UN201602150317,"2016-02-15 11:51:00",南區,噪音舉發,妨礙安寧,"南區金華路二段156、158、160號 妨礙安寧",臺南市南區金華路二段156、158、160號,22.984751,120.191936
UN201602150322,"2016-02-15 11:58:00",東區,違規停車,違規停車,"東區崇德路628號  違規停車",臺南市東區崇德路628號,22.970355,120.227316
UN201602150324,"2016-02-15 11:59:00",中西區,違規停車,違規停車,"中西區中山路兩側(車站圓環到民族路) 違規停車",中西區中山路兩側(車站圓環到民族路),22.996775451562065,120.21136466413735
UN201602150340,"2016-02-15 12:07:00",安平區,違規停車,違規停車,"安平區建平七街309號 違規停車",臺南市安平區建平七街309號,22.988815,120.178589
UN201602150352,"2016-02-15 12:21:00",安南區,違規停車,違規停車,"安南區北安路四段280號 違規停車",709台灣台南市安南區北安路四段280號,23.0606988,120.2140819
UN201602150375,"2016-02-15 12:50:00","北 區",違規停車,違規停車,"北區北門路二段.三段兩側(和緯路到實踐街) 違規停車",北區北門路二段.三段兩側(和緯路到實踐街),23.012744909628836,120.21693360060453
