UN201602290002,"2016-02-29 00:35:00",東區,噪音舉發,妨礙安寧,"東區中華東路一段209號 妨礙安寧",東區中華東路一段209號,22.9902371,120.2337975
UN201602290007,"2016-02-29 04:50:00",北區,噪音舉發,妨礙安寧,"北區大興街325巷 聚眾喧嘩",北區大興街325巷,23.0097562,120.1865021
UN201602290008,"2016-02-29 06:13:00",東區,噪音舉發,妨害安寧,"東區長榮路一段234巷23號 噪音舉發",701台灣台南市東區長榮路一段234巷23號,22.9853062,120.2188065
UN201602290010,"2016-02-29 07:35:00",東區,噪音舉發,妨礙安寧,"東區東平路252巷18號  妨礙安寧",東區東平路252巷18號,22.9962653,120.2268675
UN201602290015,"2016-02-29 08:36:00",南區,違規停車,違規停車,"南區大同路二段750巷26號 違規停車",702台灣台南市南區大同路二段750巷26號,22.96596459,120.21544472
UN201602290019,"2016-02-29 08:45:00",永康區,違規停車,違規停車,"永康區復興路35號前 違停",臺南市永康區復興路35號,22.998486,120.249581
UN201602290022,"2016-02-29 08:50:00",仁德區,噪音舉發,妨礙安寧,"仁德區德南路32號對面工地大樓 妨礙安寧",臺南市仁德區德南路32號,22.948532,120.252313
UN201602290030,"2016-02-29 09:27:00",新市區,違規停車,違規停車,"新市區和平街與民生路二巷巷口 違規停車",744台灣台南市新市區和平街與民生路二巷巷口,23.0789658,120.2911158
UN201602290033,"2016-02-29 09:31:00",東區,違規停車,違規停車,"東區長榮路三段24巷巷底 違停",東區長榮路三段24巷巷底,22.9925363,120.2222446
UN201602290050,"2016-02-29 10:02:00",北區,民生管線,漏水、停水、消防栓漏水或損壞,"北區文賢路486號/安南區北安路二段32巷27號 漏水",臺南市北區文賢路486號,23.006293,120.193715
UN201602290071,"2016-02-29 10:44:00",南區,違規停車,違規停車,"南區國民路217巷3號 違規停車",臺南市南區國民路217巷3號,22.967559,120.210843
UN201602290073,"2016-02-29 10:48:00",中西區,違規停車,違規停車,"中西區西華南街2到68號 違規停車",臺南市中西區西華南街2到68號,22.994221,120.209598
UN201602290074,"2016-02-29 10:45:00",安平區,交通運輸,佔用道路,"安平區安北路93號 安平區安北路103巷 佔用道路",臺南市安平區安北路93號,23.001754,120.165148
UN201602290089,"2016-02-29 11:07:00",善化區,路燈故障,9盞以下路燈故障,"善化區東昌里13號 路燈",臺南市善化區東昌里13號,23.156768,120.326044
UN201602290096,"2016-02-29 11:20:00",南區,路燈故障,9盞以下路燈故障,"南區灣裡路333巷4弄2號 路燈",臺南市南區灣裡路333巷4弄2號,22.925056,120.182942
UN201602290099,"2016-02-29 10:00:00",永康區,動物救援,遊蕩犬隻捕捉管制,"永康區大民街129巷18號 流浪狗",永康區大民街129巷18號,23.01053,120.26721
UN201602290102,"2016-02-29 11:30:00",中西區,違規停車,違規停車,"中西區中山路125號南方公園周圍 違規停車",中西區中山路125號南方公園周圍,22.995497405890635,120.20946867763996
UN201602290110,"2016-02-29 11:58:00",中西區,違規停車,違規停車,"中西區衛民街(西華南街口到中山路口) 違規停車",衛民街,22.9929702,120.2099622
UN201602290111,"2016-02-29 11:41:00",安平區,違規停車,違規停車,"安平區國平路206號 違停",臺南市安平區國平路206號,22.990254,120.171219
UN201602290113,"2016-02-29 12:01:00",中西區,違規停車,違規停車,"中西區民權路一段3號  違停/妨礙安寧",臺南市中西區民權路一段3號,22.989141,120.210889
