UN201606130358,"2016-06-13 00:04:00",安南區,路燈故障,9盞以下路燈故障,路燈不亮,安南區安和路一段96巷32弄,23.0281726,120.2157971
UN201606130360,"2016-06-13 00:18:00",北區,違規停車,違規停車,北區西門路四段334號違規停車,台南市北區西門路四段334號,23.0135901,120.2094846
UN201606130364,"2016-06-13 01:35:00",永康區,道路維修,路面坑洞,"永康區永大一路65巷40號 路面坑洞",臺南市永康區永大一路65巷40號,23.017751,120.260561
UN201606130365,"2016-06-13 01:38:00",麻豆區,噪音舉發,妨害安寧,麻豆區中正路53-10號噪音舉發,台南市麻豆區中正路53-10號,23.185464,120.248854
UN201606130366,"2016-06-13 02:27:00",安平區,違規停車,違規停車,"安平區郡平路274巷20弄40號 違停",安平區郡平路274巷20弄40號,22.990558,120.1653419
UN201606130377,"2016-06-13 07:46:00",中西區,違規停車,違規停車,"中西區海安路二段296巷巷口 違規停車",701台灣台南市中西區海安路二段296巷巷口,22.99716648606001,120.21296594291925
UN201606130390,"2016-06-13 08:20:00",安南區,路燈故障,9盞以下路燈故障,"安南區海佃路一段188巷2號 路燈",臺南市安南區海佃路一段188巷2號,23.0246,120.192031
UN201606130393,"2016-06-13 08:29:00",南區,噪音舉發,妨礙安寧,"南區南功街８５巷１４號２樓 妨礙安寧",臺南市南區南功街85巷14號,22.984916,120.185309
UN201606130412,"2016-06-13 08:58:00",永康區,違規停車,違規停車,"永康區復興路35號前面 違規停車",臺南市永康區復興路35號,22.998486,120.249581
UN201606130445,"2016-06-13 10:06:00",南區,髒亂及汙染,空氣汙染,"南區金華路二段76號 空氣污染",臺南市南區金華路二段76號,22.977567,120.191301
UN201606130450,"2016-06-13 10:12:00",中西區,違規停車,違規停車,"中西區忠義路二段177號 違規停車",臺南市中西區忠義路二段177號,22.996692,120.204066
UN201606130454,"2016-06-13 09:47:00",東區,道路維修,人孔蓋聲響、凹陷、漏水,"東區裕文路136號前面 人孔蓋鬆動",臺南市東區裕文路136號,22.982284,120.243016
UN201606130462,"2016-06-13 10:37:00",永康區,違規停車,違規停車,"永康區二王路30巷2號  違規停車",臺南市永康區二王路30巷2號,23.02103,120.248568
UN201606130474,"2016-06-13 11:02:00",中西區,違規停車,違規停車,"開山路76 100號 違規停車",臺南市開山路76^100號,22.98627,120.209675
UN201606130476,"2016-06-13 11:03:00",中西區,違規停車,違規停車,"中西區西門路二段251號前面 違規停車",臺南市中西區西門路二段251號,22.99563,120.199335
UN201606130492,"2016-06-13 11:33:00",中西區,違規停車,違規停車,"中西區衛民街106號到120號 143號  違規停車",臺南市衛民街106號,22.993151,120.209223
UN201606130495,"2016-06-13 11:36:00",安平區,道路維修,路面坑洞,"安平區安平路328號前面 路面坑洞",臺南市安平區安平路328號,22.998427,120.177498
UN201606130499,"2016-06-13 11:42:00",安南區,交通運輸,號誌故障,"安南區海佃路二段上往一段方向 號誌",709台灣台南市安南區海佃路上與安吉路交接路口,23.0400092,120.1877729
UN201606130505,"2016-06-13 11:54:00",仁德區,民生管線,漏水、停水、消防栓漏水或損壞,"仁德區民安路一段273號 漏水",臺南市仁德區民安路一段273號,22.957321,120.245523
UN201606130506,"2016-06-13 11:57:00",北區,路燈故障,9盞以下路燈故障,"北區文賢路292巷119弄7號前面 路燈故障",臺南市北區文賢路292巷119弄7號,23.006918,120.196824
UN201606130511,"2016-06-13 12:05:00",東區,交通運輸,佔用道路,"東區裕農路726巷72號 佔用",臺南市東區裕農路726巷72號,22.986712,120.237705
UN201606130512,"2016-06-13 12:05:00",東區,道路維修,路面下陷、凹陷,"東區明東街36號-22號 路面下陷",臺南市東區明東街36號,22.961345,120.23535
UN201606130514,"2016-06-13 12:21:00",中西區,違規停車,違規停車,"中西區民族路二段76號  違規停車",中西區民族路二段76號,22.994746,120.2087298
UN201606130518,"2016-06-13 12:21:00",中西區,騎樓舉發,騎樓舉發,"中西區永福路二段107號 佔用騎樓",臺南市中西區永福路二段107號,22.993516,120.200974
UN201606130519,"2016-06-13 12:32:00",南區,違規停車,違規停車,"南區金華路一段2號-8號 違停",南區金華路一段2號-8號,22.9613635,120.1894329
UN201606130523,"2016-06-13 12:39:00",中西區,違規停車,違規停車,"中西區民族路二段從北門路口到公園路口  違規停車",民族路二段,22.9956728,120.2057033
UN201606130526,"2016-06-13 12:42:00",中西區,道路維修,路面掏空、塌陷,"中西區忠義路二段84巷3號前方  掏空",臺南市中西區忠義路二段84巷3號,22.994111,120.203557
UN201606130529,"2016-06-13 13:00:00",東區,違規停車,違規停車,"東區前鋒路上的民族路口到大學路口 違規停車",前鋒路上的民族路口到大學路口,22.997143,120.21363
UN201606130542,"2016-06-13 13:33:00",仁德區,道路維修,路面坑洞,"仁德區長興一街99號 坑洞",臺南市仁德區長興一街99號,22.994421,120.260933
UN201606130544,"2016-06-13 13:38:00",中西區,騎樓舉發,騎樓舉發,"中西區民權路三段17O號 騎樓舉發",700台灣台南市中西區民權路三段17O號,22.9972521,120.1957489
UN201606130554,"2016-06-13 13:55:00",中西區,騎樓舉發,騎樓舉發,"中西區民權路三段157號 騎樓舉發",700台灣台南市中西區民權路三段157號,22.9973118,120.1957417
UN201606130555,"2016-06-13 13:36:00",南區,道路維修,寬頻管線、孔蓋損壞,南區新興路217巷5號-7號前面,臺南市南區新興路217巷5號,22.976887,120.193913
UN201606130560,"2016-06-13 14:00:00",中西區,民生管線,漏水、停水、消防栓漏水或損壞,"中西區中山路166號前面 路面漏水",臺南市中西區中山路166號,22.99563,120.210167
UN201606130570,"2016-06-13 14:06:00",中西區,騎樓舉發,騎樓舉發,騎樓舉發,700台灣台南市中西區民權路三段157號,22.9973092,120.1957677
UN201606130581,"2016-06-13 14:15:00",南區,交通運輸,佔用道路,"南區西門路一段623號前面 佔用道路",南區西門路一段623號前面,22.9856359,120.1970744
UN201606130601,"2016-06-13 14:54:00",中西區,違規停車,違規停車,"中西區民族路二段76號 違規停車",中西區民族路二段76號,22.994746,120.2087298
UN201606130605,"2016-06-13 15:01:00",永康區,違規停車,違規停車,"永康區中正北路79號 違停",臺南市永康區中正北路79號,23.041658,120.239907
UN201606130607,"2016-06-13 15:02:00",東區,噪音舉發,妨礙安寧,"東區崇德十六街2之3號一樓   妨礙安寧",臺南市東區崇德十六街2之3號,22.969567,120.227973
UN201606130608,"2016-06-13 15:08:00",中西區,違規停車,違規停車,"中西區國華街三段217號 違規停車",台南市中西區國華街三段217號,22.9985641,120.199059
UN201606130611,"2016-06-13 15:05:00",仁德區,交通運輸,交通疏導,"仁德區交流道通往裕農路高速道路便道 交通疏導",仁德區交流道通往裕農路高速道路便道,22.9401228,120.2397336
UN201606130617,"2016-06-13 15:19:00",南區,道路維修,路面坑洞,"南區金華路一段61號-221號 路面坑洞",臺南市南區金華路一段61號,22.962652,120.189278
UN201606130626,"2016-06-13 15:30:00",北區,道路維修,路面坑洞,北區開元路281號橫向斑馬線上,臺南市北區開元路281號,23.007952,120.221034
UN201606130630,"2016-06-13 15:49:00",安平區,髒亂及汙染,空氣汙染,"安平區平通路393巷16號 空氣汙染",臺南市安平區平通路393巷16號,22.992563,120.175725
