UN201606270003,"2016-06-27 01:13:00",中西區,違規停車,違規停車,"北門路一段10號 北門圓環上違規停車",臺南市台南市北門路一段10號,22.989768,120.211613
UN201606270009,"2016-06-27 06:22:00",東區,違規停車,違規停車,東區光華街229巷32號違規停車,701台灣台南市東區光華街229巷32號,22.9860945,120.2144275
UN201606270010,"2016-06-27 06:28:00",東區,違規停車,違規停車,東區光華街229巷28弄26號違規停車,701台灣台南市東區光華街229巷28弄26號,22.9860476,120.2137981
UN201606270013,"2016-06-27 06:46:00",麻豆區,髒亂及汙染,空氣汙染,"官田鋼鐵工廠 空氣污染",臺南市麻豆區麻口里麻豆口32-6號,23.185811,120.2203
UN201606270023,"2016-06-27 07:49:00",中西區,道路維修,人孔蓋聲響、凹陷、漏水,"中西區南華街70號 人孔蓋",臺南市中西區南華街70號,22.990505,120.191579
UN201606270026,"2016-06-27 07:54:00",東區,違規停車,違規停車,"東區育樂街168巷轉角處 違停",東區育樂街168巷轉角處,22.9948733,120.2147093
UN201606270027,"2016-06-27 07:55:00",新市區,違規停車,違規停車,"新市區和平街215號附近 違規停車",臺南市新市區和平街215號,23.078917,120.291031
UN201606270051,"2016-06-27 08:53:00",東區,違規停車,違規停車,"東區大同路二段543號巷口 違停",臺南市東區大同路二段543號,22.968947,120.215797
UN201606270052,"2016-06-27 08:55:00",中西區,違規停車,違規停車,"中西區廣慈街17號  違規停車",700台灣台南市中西區廣慈街17號,22.9963036,120.206568
UN201606270080,"2016-06-27 09:42:00",東區,違規停車,違規停車,"東區林森路二段86號邊 違停",臺南市東區林森路二段86號,22.987058,120.223295
UN201606270084,"2016-06-27 09:47:00",東區,違規停車,違規停車,違規停車,臺南市東區東門路三段85號,22.988484,120.213281
UN201606270100,"2016-06-27 10:06:00",北區,動物救援,犬貓急難救援,"北區北成路138號  犬貓救援",臺南市北區北成路138號,23.019846,120.20869
UN201606270113,"2016-06-27 10:35:00",永康區,違規停車,違規停車,"永康區中華路427號  違規停車",台南市永康區中華路427號,23.0101055,120.2326524
UN201606270122,"2016-06-27 10:43:00",中西區,道路維修,路面坑洞,"中西區健康路一段74號 坑洞",臺南市中西區健康路一段74號,22.981453,120.209848
UN201606270143,"2016-06-27 11:09:00",北區,道路維修,人孔蓋聲響、凹陷、漏水,"北區文成三路233號對面棒球場前面  孔蓋鬆動",臺南市北區文成三路233號,23.016471,120.203879
UN201606270148,"2016-06-27 11:15:00",北區,違規停車,違規停車,"北區和緯路四段８９號旁 違停",臺南市北區和緯路四段89號,23.008911,120.191605
UN201606270153,"2016-06-27 11:24:00",中西區,違規停車,違規停車,"中西區萬昌街 興華街 違規停車","萬昌街 興華街",22.9920383,120.2104726
UN201606270158,"2016-06-27 10:50:00",中西區,道路維修,路面下陷、凹陷,"中西區民權路三段188號 下陷",中西區民權路三段188號,22.997811,120.195347
UN201606270168,"2016-06-27 11:37:00",東區,違規停車,違規停車,"東區東平路上和中華東路口 違規停車",東區東平路上和中華東路口,22.9946483,120.2342987
UN201606270169,"2016-06-27 11:43:00",中西區,違規停車,違規停車,違規停車,西華南街,22.9954612,120.2097537
UN201606270170,"2016-06-27 11:45:00",中西區,交通運輸,佔用道路,"中西區民權路四段162號  佔用道路",臺南市中西區民權路四段162號,22.99931,120.181901
UN201606270171,"2016-06-27 11:47:00",中西區,交通運輸,佔用道路,"中西區民權路四段162號 佔用道路",臺南市中西區民權路四段162號,22.99931,120.181901
UN201606270177,"2016-06-27 12:00:00",東區,違規停車,違規停車,"東區東門路二段219-221號   違規停車",台南市東區東門路二段219-221號,22.984625,120.2249688
UN201606270183,"2016-06-27 12:12:00",北區,違規停車,違規停車,"北區小東路299巷2號旁   違規停車",臺南市小東路299巷2號,22.999479,120.230451
UN201606270187,"2016-06-27 12:25:00",中西區,違規停車,違規停車,"中西區忠義路二段24號  違規停車",臺南市中西區忠義路二段24號,22.991413,120.202838
UN201606270189,"2016-06-27 12:26:00",新化區,違規停車,違規停車,"新化區正新國小(正新路93-95號)校門口   違規停車",712台灣台南市新化區正新路93-95號,23.03271996412862,120.3031112998724
UN201606270191,"2016-06-27 12:35:00",中西區,違規停車,違規停車,"中西區民族路二段(北門至中山路口)兩側  違規停車",民族路二段,22.9956728,120.2057033
UN201606270204,"2016-06-27 13:11:00",中西區,道路維修,路面坑洞,"中西區和平街79號前 路面坑洞",臺南市中西區和平街79號,22.996365,120.197231
UN201606270209,"2016-06-27 13:27:00",新市區,違規停車,違規停車,"新市區民生路2巷21號 違規停車",744台灣台南市新市區民生路2巷21號,23.078957219785082,120.29120246171556
UN201606270210,"2016-06-27 13:28:00",永康區,違規停車,違規停車,"永康區中華路12號 違規停車",臺南市永康區中華路12號,23.000058,120.235058
UN201606270213,"2016-06-27 13:34:00",東區,違規停車,違規停車,"東區青年路214號 違規停車",臺南市青年路214號,22.991494,120.210999
UN201606270218,"2016-06-27 13:39:00",南區,違規停車,違規停車,"南區西門路一段639號 違停",臺南市南區西門路一段639號,22.985917,120.19731
UN201606270223,"2016-06-27 13:52:00",北區,違規停車,違規停車,"北區公園北路153號 違停",臺南市北區公園北路153號,23.004537,120.209335
UN201606270226,"2016-06-27 13:53:00",安南區,違規停車,違規停車,"安南區公學路五段697巷171號 違停",臺南市安南區公學路五段697巷171號,23.071521,120.159324
UN201606270237,"2016-06-27 14:14:00",六甲區,路燈故障,9盞以下路燈故障,"六甲區林鳳營240之89號門口旁邊 路燈故障",734台灣台南市六甲區林鳳營240之89號門口旁邊,23.240524,120.3184122
UN201606270246,"2016-06-27 14:29:00",中西區,違規停車,違規停車,"中西區中正路23號 違規停車",臺南市中西區中正路23號,22.99188,120.203073
UN201606270248,"2016-06-27 14:34:00",中西區,違規停車,違規停車,"中西區武聖路245號前方 違停",臺南市中西區武聖路245號,23.006967,120.188747
UN201606270292,"2016-06-27 15:49:00",中西區,違規停車,違規停車,"中西區武聖路249號 違停",中西區武聖路249號,23.007178,120.188438
UN201606270303,"2016-06-27 16:09:00",新營區,路燈故障,9盞以下路燈故障,"新營區中山路597號 路燈故障",臺南市新營區中山路597號,23.302278,120.313871
UN201606270322,"2016-06-27 16:40:00",中西區,違規停車,違規停車,"中西區忠孝街78巷口 違規停車",701台灣台南市中西區忠孝街78巷口,22.99716648606001,120.21296594291925
UN201606270323,"2016-06-27 16:43:00",中西區,違規停車,違規停車,"中西區西華南街42號 違規停車",西華南街42號,22.9939617,120.2095661
UN201606270325,"2016-06-27 16:47:00",中西區,違規停車,違規停車,"中西區海安路二段296巷口  違規停車",701台灣台南市中西區海安路二段296巷口,22.99716648606001,120.21296594291925
UN201606270333,"2016-06-27 17:00:00",永康區,違規停車,違規停車,"東橋十街68號 違規停車",台南市東橋十街68號,23.021925,120.2324455
UN201606270337,"2016-06-27 17:20:00","北 區",違規停車,違規停車,北區長榮路五段沿線(276巷到大武街)違規停車,北區長榮路五段沿線(276巷到大武街),23.01284211675233,120.21712370216846
UN201606270339,"2016-06-27 17:21:00",南區,髒亂及汙染,空氣汙染,"南區金華路二段76號  空氣汙染",臺南市南區金華路二段76號,22.977567,120.191301
UN201606270341,"2016-06-27 17:29:00",永康區,違規停車,違規停車,永康區小東路451號違規停車,710台灣台南市永康區小東路451號,22.998604676707647,120.23438799206188
UN201606270350,"2016-06-27 17:53:00",永康區,違規停車,違規停車,"永康區大灣路942巷114號 違規停車",永康區大灣路942巷114號,23.0029194,120.2559537
UN201606270356,"2016-06-27 18:14:00",東區,民生管線,漏水、停水、消防栓漏水或損壞,"東區崇德路370號前 漏水",臺南市東區崇德路370號,22.976045,120.224355
UN201606270357,"2016-06-27 18:20:00",永康區,違規停車,違規停車,"永康區中華路463號  違規停車",臺南市永康區中華路463號,23.011028,120.232106
UN201606270358,"2016-06-27 18:08:00",永康區,違規停車,違規停車,"永康區大灣路942巷114號  違停",臺南市永康區大灣路942巷114號,23.002819,120.256041
UN201606270361,"2016-06-27 18:26:00",南區,違規停車,違規停車,"南區德興路265巷27號前方  違規停車",702台灣台南市南區德興路265巷27號,22.9594001,120.1937219
UN201606270363,"2016-06-27 18:35:00",中西區,違規停車,違規停車,"中西區開山路109巷9號1樓之一前  違規停車",中西區開山路109巷9號,22.989706,120.207684
UN201606270366,"2016-06-27 18:22:00",中西區,髒亂及汙染,空氣汙染,"中西區武英街17號  路霸 / 空汙",中西區武英街17號,22.9890991,120.1919899
UN201606270368,"2016-06-27 18:46:00",南區,違規停車,違規停車,"南區文南路沿線兩側(建南路口至永華路一段路口)  違規停車",文南路沿線兩側,22.9849818,120.1899424
