UN201607110005,"2016-07-11 01:05:00",安平區,動物救援,遊蕩犬隻捕捉管制,"安平區慶平路129號 動物救援",臺南市安平區慶平路129號,22.996852,120.181925
UN201607110008,"2016-07-11 05:56:00",中西區,噪音舉發,場所連續噪音,中西區永福路一段27號3樓噪音舉發,臺南市臺南市永福路一段27號,22.982341,120.199649
UN201607110009,"2016-07-11 06:07:00",北區,違規停車,違規停車,北區公園路508號旁巷子內違規停車,704台灣台南市北區公園路508號旁巷子內,22.997660469693262,120.20933906719343
UN201607110010,"2016-07-11 06:18:00",七股區,動物救援,犬貓急難救援,"七股區後港里港東58號 動物救援",臺南市七股區後港里港東58號,23.185692,120.147485
UN201607110022,"2016-07-11 08:17:00",北區,建築物傾倒,路樹傾倒,"北區大和路330巷46號 路樹傾倒",臺南市北區大和路330巷46號,23.014757,120.190408
UN201607110037,"2016-07-11 08:55:00","北 區",違規停車,違規停車,"北區開元路 違規停車",北區開元路511號成大城周圍/北區開元路485巷沿線兩側(開元路到桂花鄉大樓前),23.0106572540232,120.22524274885656
UN201607110075,"2016-07-11 09:58:00",東區,民生管線,10盞以上路燈故障,"東區府東街49號 路燈亮著",臺南市東區府東街49號,22.985487,120.219537
UN201607110114,"2016-07-11 11:03:00",北區,交通運輸,號誌故障,"北區中華北路一段364號前面  號誌",臺南市北區中華北路一段364號,23.014012,120.186871
UN201607110131,"2016-07-11 11:42:00",永康區,違規停車,違規停車,"永康區中華路800號(華南銀行)巷口轉角  違規停車",臺南市永康區中華路800號,23.018279,120.226969
UN201607110133,"2016-07-11 11:46:00",中西區,交通運輸,佔用道路,"中西區成功路93號 違停",700台灣台南市中西區成功路93號,22.998158,120.2066327
UN201607110150,"2016-07-11 12:27:00",永康區,道路維修,路面坑洞,"永康區正強街198號  路面坑洞",710台灣台南市永康區正強街198號,23.028525744875566,120.25182661904910
UN201607110158,"2016-07-11 12:55:00",北區,違規停車,違規停車,"北區北忠街100-110號  違規停車",台南市北區北忠街100-110號,22.9994227,120.2095171
UN201607110160,"2016-07-11 13:04:00",北區,道路維修,停電、漏電、電線掉落、孔蓋鬆動,"北區海安路三段338巷與民德路90巷路口  孔蓋鬆動","海安路三段338巷 民德路90巷路口",23.107326019802965,120.28010841771606
UN201607110162,"2016-07-11 13:10:00",中西區,違規停車,違規停車,"中西區西賢一街230巷19號 違規停車",臺南市中西區西賢一街230巷19號,23.003946,120.178318
UN201607110173,"2016-07-11 13:37:00",中西區,違規停車,違規停車,"中西區民族路二段 違規停車",民族路二段,22.9956728,120.2057033
UN201607110179,"2016-07-11 13:43:00",永康區,動物救援,遊蕩犬隻捕捉管制,"永康區永二街202號 流浪狗捕抓",臺南市永康區永二街202號,23.01589,120.252151
UN201607110200,"2016-07-11 14:22:00",關廟區,髒亂及汙染,其他汙染舉發,"關廟區關新一街239號後方 汙染舉發",臺南市關廟區關新一街239號,23.000247,120.328434
UN201607110208,"2016-07-11 14:46:00",仁德區,違規停車,違規停車,"仁德區中正路二段1079號 違停",仁德區中正路二段1079號,22.9672681,120.2528357
UN201607110209,"2016-07-11 14:50:00",中西區,違規停車,違規停車,"中西區府前路一段199號 違規停車",臺南市中西區府前路一段199號,22.989039,120.204109
UN201607110221,"2016-07-11 15:05:00",中西區,違規停車,違規停車,"中西區西門路二段159號  違停",臺南市中西區西門路二段159號,22.99342,120.19863
UN201607110262,"2016-07-11 16:34:00",安南區,髒亂及汙染,空氣汙染,"安南區本田街和安明路交叉口  空氣汙染",安南區本田街和安明路交叉口,23.039446210603497,120.15824668789674
UN201607110264,"2016-07-11 16:36:00",北區,路燈故障,9盞以下路燈故障,"北區長勝北街50號及70號 水銀燈不亮",臺南市北區長勝北街50號,23.010644,120.219451
UN201607110266,"2016-07-11 16:39:00",中西區,違規停車,違規停車,"中西區民生路二段481號 車輛違停",中西區民生路二段481號,22.9975348,120.1875975
UN201607110267,"2016-07-11 16:40:00",中西區,路燈故障,9盞以下路燈故障,"中西區樹林街二段71號2樓 路燈不亮",臺南市中西區樹林街二段71號,22.985626,120.205399
UN201607110275,"2016-07-11 16:58:00",安平區,道路維修,路面坑洞,"安平區慶平路473號 路面坑洞",臺南市安平區慶平路473號,22.996911,120.173852
UN201607110279,"2016-07-11 17:06:00",安平區,違規停車,違規停車,"安平區建平十七街33號對面 違停",臺南市安平區建平十七街33號,22.997269,120.183149
UN201607110286,"2016-07-11 17:16:00",麻豆區,違規停車,違規停車,"麻豆區民權路51-1號 違規停車",721台灣台南市麻豆區民權路51-1號,23.1811605,120.251668
UN201607110296,"2016-07-11 17:36:00",安平區,違規停車,違規停車,"安平區華平路696號  違停",臺南市安平區華平路696號,22.997115,120.176033
UN201607110299,"2016-07-11 17:39:00",永康區,路燈故障,9盞以下路燈故障,"永康區大橋二街239巷22弄2號旁   路燈不亮",臺南市永康區大橋二街239巷22弄2號,23.021367,120.230185
UN201607110301,"2016-07-11 17:45:00",麻豆區,違規停車,違規停車,"麻豆區中山路11號   違規停車",麻豆區中山路11號,23.1835359,120.2477965
UN201607110309,"2016-07-11 17:58:00",麻豆區,違規停車,違規停車,"麻豆區興國路31巷口 違規停車",麻豆興國路31巷路口,23.1801939,120.2479759
UN201607110318,"2016-07-11 18:09:00",新營區,路燈故障,9盞以下路燈故障,"新營區太南里298號  路燈故障",臺南市新營區太南里298號,23.29019,120.278264
UN201607110321,"2016-07-11 18:04:00",東區,路燈故障,9盞以下路燈故障,"東區富農街一段244號對面  路燈不亮",臺南市東區富農街一段244號,22.983037,120.235151
UN201607110329,"2016-07-11 18:23:00",安平區,違規停車,違規停車,"安平區華平路694號 違停",臺南市安平區華平路694號,22.997035,120.17602
UN201607110339,"2016-07-11 18:35:00",南區,違規停車,違規停車,"安南區安中路一段703巷  違規停車",台南市安南區安中路一段703巷,23.0417345,120.1944773
UN201607110347,"2016-07-11 18:44:00",仁德區,道路維修,路面坑洞,"仁德區義林路232號*林頂街  坑洞",臺南市仁德區義林路232號,22.971668,120.264392
UN201607110349,"2016-07-11 18:49:00",中西區,違規停車,違規停車,"中西區民權路三段157號 佔用騎樓",臺南市中西區民權路三段157號,22.997273,120.195709
UN201607110357,"2016-07-11 18:54:00",永康區,動物救援,犬貓急難救援,"永康區復華十街47號前  犬貓救援",臺南市永康區復華十街47號,23.017356,120.245226
UN201607110369,"2016-07-11 19:09:00",南區,違規停車,違規停車,"南區夏林路99號  違規停車",臺南市南區夏林路99號,22.970004,120.195482
UN201607110376,"2016-07-11 19:12:00",北區,路燈故障,9盞以下路燈故障,"北區海安路三段985巷19號對面  路燈不亮",臺南市北區海安路三段985巷19號,23.019276,120.199133
UN201607110379,"2016-07-11 19:15:00",東區,違規停車,違規停車,"東區怡東路35號 違停",臺南市東區怡東路35號,22.991351,120.227541
UN201607110381,"2016-07-11 19:20:00",中西區,路燈故障,9盞以下路燈故障,"中西區大同路一段56巷10號  路燈故障",臺南市中西區大同路一段56巷10號,22.987279,120.210623
UN201607110382,"2016-07-11 19:21:00",安南區,路燈故障,漏水、停水、消防栓漏水或損壞,"安南區鎮安路201號至209號前 路燈不亮",臺南市安南區鎮安路201號,23.066492,120.200517
UN201607110391,"2016-07-11 19:30:00",東區,路燈故障,9盞以下路燈故障,"東區莊敬路58巷11號  路燈故障",臺南市東區莊敬路58巷11號,22.994008,120.233227
UN201607110397,"2016-07-11 19:43:00",北區,違規停車,違規停車,北區文賢路1122巷10號違規停車,704台灣台南市北區文賢路1122巷10號,23.01633873025236,120.19381262373197
UN201607110402,"2016-07-11 19:48:00",新市區,違規停車,違規停車,"新市區和平街與民生路二巷巷口 違規停車",台南市新市區和平街與民生路二巷巷口,23.1845709,120.253163
UN201607110412,"2016-07-11 20:09:00",南區,路燈故障,9盞以下路燈故障,"南區金華路一段95巷33號附近  路燈不亮",臺南市南區金華路一段95巷33號,22.963086,120.188237
UN201607110416,"2016-07-11 20:24:00",安南區,路燈故障,9盞以下路燈故障,"安南區安通路(自安通路五段230巷口到安明路口)  路燈故障",704台灣台南市安南區安通路,23.006276312493238,120.17165288329126
UN201607110418,"2016-07-11 20:29:00",東區,路燈故障,9盞以下路燈故障,"東區裕豐街133巷38號附近  路燈故障",臺南市東區裕豐街133巷38號,22.987082,120.22618
UN201607110419,"2016-07-11 20:32:00",中西區,違規停車,違規停車,"中西區民族路二段76號  違規停車",臺南市民族路二段76號,22.994726,120.20925
UN201607110423,"2016-07-11 20:53:00",北區,路燈故障,9盞以下路燈故障,"北區育德一街286號  路燈故障",臺南市北區育德一街286號,23.017734,120.205556
UN201607110429,"2016-07-11 21:04:00",東區,路燈故障,9盞以下路燈故障,"東區裕農路668巷26號附近  路燈故障",臺南市東區裕農路668巷26號,22.98782,120.236537
UN201607110432,"2016-07-11 21:15:00",北區,違規停車,違規停車,北區長榮路五段435巷2號違規停車,台南市北區長榮路五段435巷2號,23.013066,120.2121439
UN201607110435,"2016-07-11 21:21:00",歸仁區,違規停車,違規停車,歸仁區高鐵橋下台南段道路4號違規停車,臺南市歸仁區高鐵橋下台南段道路4號,22.965917,120.297039
UN201607110438,"2016-07-11 21:30:00",中西區,違規停車,違規停車,中西區大勇街115號違規停車,台南市中西區大勇街115號,22.9898674,120.1926028
UN201607110441,"2016-07-11 21:29:00",仁德區,道路維修,路面坑洞,"仁德區文山路196號  坑洞",臺南市仁德區文山路196號,22.975749,120.246079
UN201607110445,"2016-07-11 22:33:00",安平區,違規停車,違規停車,安平區平生路15-27號違規停車,台南市安平區平生路15-27號,22.9997079,120.1639251
UN201607110448,"2016-07-11 22:35:00",安平區,違規停車,違規停車,"安平區平生路15-27號  違規停車",台南市安平區平生路15-27號,22.9997079,120.1639251
UN201607110450,"2016-07-11 21:54:00",永康區,噪音舉發,妨礙安寧,"永康區大橋一街47之1號 2F之8  妨礙安寧",臺南市永康區大橋一街47之1號,23.016321,120.226273
UN201607110454,"2016-07-11 23:24:00",安平區,路燈故障,9盞以下路燈故障,"安平區建平十二街192巷7號前方  路燈不亮",臺南市安平區建平十二街192巷7號,22.995795,120.177678
UN201607120006,"2016-07-12 01:11:00",北區,違規停車,違規停車,"北區西門路四段289號 違停",臺南市北區西門路四段289號,23.013762,120.209248
UN201607120012,"2016-07-12 03:55:00",安平區,動物救援,犬貓急難救援,"安平區民權路四段313號之1 動物救援",臺南市安平區民權路四段313號,22.999046,120.177818
UN201607120020,"2016-07-12 07:29:00",新市區,道路維修,路樹傾倒,"台南市新市區大業一路-科學園區 道路維修",744台灣台南市新市區大業一路,23.0886048,120.2881217
UN201607120021,"2016-07-12 07:37:00",北區,交通運輸,佔用道路,"北區台南二中前  攤販",北區台南二中前,23.008515,120.2079953
UN201607120025,"2016-07-12 08:10:00",東區,違規停車,違規停車,"東區崇善路371號 違規停車",701台灣台南市東區崇善路371號,22.9768959,120.2283735
UN201607120033,"2016-07-12 08:21:00",新化區,違規停車,違規停車,"新化區正新路97號 違規停車",712台灣台南市新化區正新路97號,23.032757298484665,120.30308984220027
UN201607120035,"2016-07-12 08:23:00",永康區,道路維修,路面坑洞,"永康區復國一路147號前 坑洞",臺南市永康區復國一路147號,23.005968,120.246
UN201607120039,"2016-07-12 08:34:00",安南區,道路維修,路面坑洞,"安南區安和路五段104號前面 路面坑洞",臺南市安南區安和路五段104號,23.065187,120.218575
UN201607120056,"2016-07-12 08:59:00",中西區,違規停車,違規停車,"中西區民族路二段12號 違規停車",臺南市民族路二段12號,22.9946,120.211312
UN201607120060,"2016-07-12 09:03:00",永康區,交通運輸,佔用道路,"永康區中華路217巷23號前方 佔用道路",臺南市永康區中華路217巷23號,23.005032,120.23464
UN201607120062,"2016-07-12 09:06:00",安平區,道路維修,路樹傾倒,"安平區安平路75巷22弄2號-12號 路樹倒塌",臺南市安平區安平路75巷22弄2號,22.998507,120.164913
UN201607120066,"2016-07-12 09:13:00",永康區,噪音舉發,妨礙安寧,"永康區復國一路173巷34弄5號 妨礙安寧",臺南市永康區復國一路173巷34弄5號,23.006832,120.245419
UN201607120074,"2016-07-12 09:29:00",中西區,違規停車,違規停車,違規停車,700台灣台南市中西區青年路112號,22.9920399,120.2086656
UN201607120078,"2016-07-12 09:39:00",永康區,違規停車,違規停車,違規停車,臺南市永康區永大路二段1516號,23.024926,120.261063
UN201607120083,"2016-07-12 09:35:00",歸仁區,路燈故障,9盞以下路燈故障,"歸仁區沙崙50號前面 路燈故障",臺南市歸仁區沙崙50號,22.941087,120.293447
