UN201607250002,"2016-07-25 00:38:00",南區,噪音舉發,妨害安寧,"南區夏林路242號對面 妨害安寧",702台灣台南市南區夏林路242號對面,22.9787669,120.1944327
UN201607250006,"2016-07-25 01:02:00",永康區,路燈故障,9盞以下路燈故障,"永康區、東區 路燈故障","臺南市永康區中華路58巷   東區裕農路574號",23.002135,120.237675
UN201607250007,"2016-07-25 01:09:00",仁德區,噪音舉發,妨害安寧,"仁德區土庫三街52巷  妨害安寧",仁德區土庫三街52巷,22.9735087,120.2589035
UN201607250009,"2016-07-25 04:11:00",學甲區,動物救援,犬貓急難救援,"學甲區新達里頂山寮1號 狗受傷",臺南市學甲區新達里頂山寮1號,23.237595,120.194746
UN201607250017,"2016-07-25 07:29:00",新營區,違規停車,違規停車,"新營區中正路57號)和新營世家大樓中間的巷內  紅線違停",臺南市新營區中正路57號,23.31676,120.316181
UN201607250023,"2016-07-25 06:59:00",北區,違規停車,違規停車,"北區小東路325號341號 紅磚道和紅黃線違停",臺南市北區小東路325號,22.999222,120.230976
UN201607250032,"2016-07-25 08:28:00",東區,路燈故障,9盞以下路燈故障,"東區崇學路239巷29號門口  路燈",臺南市東區崇學路239巷29號,22.98177,120.223754
UN201607250034,"2016-07-25 08:32:00",中西區,違規停車,違規停車,"中西區長榮路二段180號停車格  違規停車",臺南市長榮路二段180號,22.990222,120.220767
UN201607250050,"2016-07-25 08:51:00",中西區,違規停車,違規停車,"中西區開山路76號 違規停車",臺南市開山路76號,22.990099,120.206607
UN201607250065,"2016-07-25 09:19:00",歸仁區,道路維修,人孔蓋聲響、凹陷、漏水,"歸仁區民權南路339號 人孔蓋鬆動",臺南市歸仁區民權南路339號,22.961384,120.287705
UN201607250067,"2016-07-25 09:22:00",北區,違規停車,違規停車,"台南市北區長勝路19號 停車格違規停車",台南市北區長勝路19號,23.009676,120.2198885
UN201607250073,"2016-07-25 09:42:00",安南區,路燈故障,9盞以下路燈故障,"安南區安和路四段533巷162號 路燈故障",臺南市安南區安和路四段533巷162號,23.060812,120.215209
UN201607250090,"2016-07-25 10:06:00",北區,噪音舉發,場所連續噪音,"北區林森路三段79號  妨害安寧",北區林森路三段79號,23.00316298276737,120.22457445816664
UN201607250121,"2016-07-25 10:50:00",中西區,違規停車,違規停車,"中西區民權路一段230號  違規停車",臺南市中西區民權路一段230號,22.992643,120.207498
UN201607250123,"2016-07-25 10:52:00",中西區,違規停車,違規停車,"中西區民族路二段76號  違規停車",臺南市中西區民族路二段76號,22.994726,120.20925
UN201607250125,"2016-07-25 10:54:00",中西區,騎樓舉發,騎樓舉發,"中西區衛民街60號到70號中間  騎樓舉發",臺南市中西區衛民街60號,22.993005,120.210427
UN201607250132,"2016-07-25 11:06:00",永康區,違規停車,違規停車,"永康區中正六街3號對面到89號對面  紅黃線違規停車","永康區中正六街3號對面到89號對面 台南應用科大周圍",23.03667487999403,120.23752726614477
UN201607250133,"2016-07-25 11:08:00","北 區",違規停車,違規停車,"北區北門路二段和緯路長榮路 紅黃線違規停車",北區北門路二段沿線兩側(和緯路到長榮路),23.012350525723473,120.21680552512407
UN201607250134,"2016-07-25 11:09:00",中西區,違規停車,違規停車,"中西區西華南街32號 紅線違規停車",臺南市西華南街32號,22.993828,120.209542
UN201607250139,"2016-07-25 11:11:00",南區,違規停車,違規停車,"南區金華路一段352巷153號門口  紅線違停",臺南市南區金華路一段352巷153號,22.968047,120.194029
UN201607250141,"2016-07-25 11:12:00",永康區,騎樓舉發,騎樓舉發,"永康區中正南路55號 店家佔用騎樓",臺南市永康區中正南路55號,23.02084,120.216016
UN201607250147,"2016-07-25 11:31:00",中西區,違規停車,違規停車,"中西區海安路一段203號 違規停車",台南市中西區海安路一段203號,22.9927839,120.1956821
UN201607250157,"2016-07-25 11:53:00",東區,路燈故障,9盞以下路燈故障,"東區崇明十三街10巷24號 路燈故障",臺南市東區崇明十三街10巷24號,22.973273,120.224854
UN201607250161,"2016-07-25 12:11:00",中西區,違規停車,違規停車,"中西區民族路二段76號  違規停車",臺南市中西區民族路二段76號,22.994726,120.20925
UN201607250174,"2016-07-25 12:39:00",永康區,騎樓舉發,騎樓舉發,"永康區國華街71號  騎樓舉發",臺南市國華街71號,23.01161,120.247258
UN201607250179,"2016-07-25 12:50:00",中西區,違規停車,違規停車,"中西區正興街40號   違規停車",臺南市中西區正興街40號,22.994258,120.19809
UN201607250189,"2016-07-25 13:22:00",東區,噪音舉發,妨害安寧,"東區崇道路92號 妨害安寧",東區崇道路92號,22.9719833,120.2283343
UN201607250192,"2016-07-25 13:26:00",永康區,髒亂及汙染,空氣汙染,"王行路1號至9號 粉塵問題",臺南市王行路1號,23.030214,120.27382
UN201607250197,"2016-07-25 13:37:00",安南區,噪音舉發,場所連續噪音,"安南區大安街59巷10號 工廠噪音",臺南市安南區大安街59巷10號,23.031901,120.191615
UN201607250199,"2016-07-25 13:30:00",東區,騎樓舉發,騎樓舉發,"東區小東路513號 攤販佔用騎樓",臺南市東區小東路513號,22.999858,120.225812
UN201607250216,"2016-07-25 14:15:00",北區,違規停車,違規停車,"北區長勝路5號 機車佔用汽車停車格",704台湾台南市北區長勝路5號,23.0095108,120.2201445
UN201607250231,"2016-07-25 14:36:00",安平區,違規停車,違規停車,"安平區安北路149之1號郵局周邊 紅黃線違規停車",安平區安北路149之1號郵局周邊,23.002846389036378,120.16122914850713
UN201607250239,"2016-07-25 14:42:00",東區,民生管線,電信孔蓋鬆動、電信線路掉落、電信桿傾倒,"東區崇善一街98號 中華電信孔蓋有聲響",東區崇善一街98號,22.9804293,120.2276139
UN201607250241,"2016-07-25 14:59:00",中西區,交通運輸,佔用道路,"中西區忠義路二段54號  佔用道路",中西區忠義路二段54號,22.9930358,120.2030421
UN201607250242,"2016-07-25 15:06:00",東區,違規停車,違規停車,"東區青年路281號  違規停車",東區青年路281號,22.9913885,120.2134325
UN201607250243,"2016-07-25 15:08:00",東區,違規停車,違規停車,"東區青年路278號  違規停車",東區青年路278號,22.9913994,120.213483
UN201607250249,"2016-07-25 15:23:00",中西區,違規停車,違規停車,"中西區中山路125號南方公園周圍  違規停車",中西區中山路125號南方公園周圍,22.995699869377752,120.20972248166798
UN201607250251,"2016-07-25 15:22:00",安平區,髒亂及汙染,道路散落物,"安平區健康路與建平路口 道路散落砂石",安平區健康路建平路,22.9825933,120.1812512
UN201607250284,"2016-07-25 16:24:00",中西區,違規停車,違規停車,"中西區中山路166號 紅線違規停車",中西區中山路166號Focus百貨周圍,22.995655426199264,120.21010771393776
UN201607250286,"2016-07-25 16:31:00",北區,路燈故障,9盞以下路燈故障,"北區海安路三段162號路燈 路燈",臺南市北區海安路三段162號,23.005003,120.200279
UN201607250294,"2016-07-25 16:44:00",中西區,道路維修,路面坑洞,"中西區五妃街2-3號前面 路面坑洞",中西區五妃街2-3號前面,22.9824834,120.2107342
UN201607250296,"2016-07-25 16:54:00",中西區,違規停車,違規停車,"中西區忠孝街78巷與康樂街口 違規停車",701台灣台南市中西區忠孝街78巷口,22.99716648606001,120.21296594291925
UN201607250301,"2016-07-25 17:15:00","東 區",違規停車,違規停車,"東區台南火車站前站機車臨時停放區 違規停車",東區台南火車站前站機車臨時停放區,22.996667739413795,120.21210227161646
UN201607250308,"2016-07-25 17:32:00",北區,騎樓舉發,騎樓舉發,"北區北忠街/西華路口   騎樓舉發",北區北忠街西華路,22.9990543,120.210508
UN201607250312,"2016-07-25 17:42:00",中西區,違規停車,違規停車,"中西區中山路2號到100號及中山路11號到117號   紅黃線違規停車",中西區中山路2號,22.9928053,120.2057059
UN201607250313,"2016-07-25 17:35:00",北區,違規停車,違規停車,"北區成功路238巷24號  違停",北區成功路238巷24號,22.999737,120.2031352
UN201607250315,"2016-07-25 17:58:00",東區,違規停車,違規停車,"東區崇德路277號   違規停車",701台灣台南市東區崇德路277號,22.9780532,120.2217692
UN201607250319,"2016-07-25 18:05:00",東區,路燈故障,10盞以上路燈故障,"東區東門路三段334號  大範圍路燈故障",臺南市東區東門路三段334號,22.97548,120.237899
UN201607250321,"2016-07-25 18:08:00",安南區,噪音舉發,場所連續噪音,"安南區郡安路五段164巷5弄26號  機械噪音",臺南市安南區郡安路五段164巷5弄26號,23.028427,120.197371
UN201607250323,"2016-07-25 18:13:00",永康區,違規停車,違規停車,"永康區大橋三街213號前及對面   違規停車",臺南市永康區大橋三街213號,23.020905,120.228275
UN201607250328,"2016-07-25 18:19:00",中西區,違規停車,違規停車,"中西區西華南街38號   紅線違規停車",臺南市中西區西華南街38號,22.993886,120.209524
UN201607250329,"2016-07-25 18:22:00",歸仁區,違規停車,違規停車,"歸仁區文化五街31號  違規停車",臺南市歸仁區文化五街31號,22.969794,120.289165
UN201607250338,"2016-07-25 18:48:00",北區,違規停車,違規停車,"北區育德二路786號   黃線違規停車",台南市北區育德二路786號,23.0199401,120.2014003
UN201607250339,"2016-07-25 18:49:00",東區,交通運輸,號誌故障,"中華東路三段399巷口(停車場側)  號誌故障",701台灣台南市東區中華東路三段399巷3號,22.973266881328851,120.22045176884762
UN201607250340,"2016-07-25 18:44:00",南區,違規停車,違規停車,"南區新城街52號對面  違停",臺南市南區新城街52號,22.979771,120.192124
UN201607250342,"2016-07-25 18:54:00",新營區,動物救援,犬貓急難救援,"新營區新東里東光街86巷1號   貓咪受困",臺南市新營區新東里東光街86巷1號,23.31806,120.321569
UN201607250348,"2016-07-25 19:11:00",東區,違規停車,違規停車,"東區中華東路三段336巷1號 違規停車",台南市東區中華東路三段336巷1號,22.9744738,120.2208836
UN201607250358,"2016-07-25 19:46:00",永康區,違規停車,違規停車,永康區中山南路758號違規停車,臺南市永康區中山南路758號,23.020601,120.24593
UN201607250361,"2016-07-25 20:00:00",中西區,違規停車,違規停車,"中西區府前路一段87號及91號     違規停車",臺南市中西區府前路一段87號,22.988816,120.209324
UN201607250363,"2016-07-25 20:05:00",中西區,騎樓舉發,騎樓舉發,"中西區衛民街63號與65號之間   騎樓舉發",臺南市中西區衛民街63號,22.992791,120.210553
UN201607250364,"2016-07-25 20:07:00",南區,違規停車,違規停車,"南區夏林路跟府緯街交叉口自助洗衣店前面  違規停車",南區夏林路府緯街,22.983851,120.1949241
UN201607250365,"2016-07-25 20:08:00",南區,違規停車,違規停車,"南區府緯街105號側面及後面消防通道紅線  違規停車",臺南市南區府緯街105號,22.983778,120.196074
UN201607250366,"2016-07-25 20:09:00",中西區,違規停車,違規停車,"中西區民族路二段(北門路口到西門路口)雙側紅黃線及121號～133號汽車停車格    違規停車",中西區民族路二段,22.9956728,120.2057033
UN201607250367,"2016-07-25 20:10:00",中西區,違規停車,違規停車,"中山路2號到100號及11號到117號   紅黃線違規停車",中西區中山路2號,22.9928053,120.2057059
UN201607250371,"2016-07-25 20:21:00",南區,違規停車,違規停車,"南區夏林路63號前  紅線違規停車",臺南市南區夏林路63號,22.983363,120.195236
UN201607250372,"2016-07-25 20:22:00",南區,違規停車,違規停車,"南區夏林路與樹林街二段口，水萍塭公園門口的殘障停車位   違規停車",南區夏林路樹林街二段,22.9863608,120.1949501
UN201607250374,"2016-07-25 20:33:00",東區,違規停車,違規停車,"東區中華東路(文化中心廣場旁)人行道上  違規停車",東區中華東路,22.9752626,120.2241397
UN201607250375,"2016-07-25 20:18:00",北區,違規停車,違規停車,"北區開元路212巷接近林森路口    違停",北區開元路212巷接近林森路口,23.0058759,120.2229729
UN201607250387,"2016-07-25 21:19:00",鹽水區,髒亂及汙染,空氣汙染,"鹽水區歡雅里倒茄苳22號附近養雞場 空氣汙染",鹽水區歡雅里倒茄苳22號,23.2838225,120.2438189
UN201607250389,"2016-07-25 21:27:00",北區,違規停車,違規停車,"北區成功路292號   違規停車",704台灣台南市北區成功路292號,22.999659,120.2014401
UN201607250401,"2016-07-25 23:16:00",中西區,違規停車,違規停車,"民族路二段59號附近外  違規停車",臺南市民族路二段59號,22.994308,120.209991
UN201607250402,"2016-07-25 23:19:00",東區,噪音舉發,妨害安寧,"東門路三段179巷58弄 噪音舉發",東門路三段179巷58弄,22.9770844,120.2362301
UN201607260001,"2016-07-26 00:04:00",中西區,違規停車,違規停車,"中西區國華街二段56-64號 紅線違規停車",700台灣台南市中西區國華街二段56號,22.988846770172575,120.19639953050773
UN201607260002,"2016-07-26 03:05:00",安南區,路燈故障,10盞以上路燈故障,"安南區台江大道 路燈故障",709台灣台南市安南區台南支線聯絡道,23.0612009,120.1912214
UN201607260008,"2016-07-26 07:32:00",北區,違規停車,違規停車,"北區南園街105巷與101巷34弄口 違規停車",南園街,23.008313,120.2248924
UN201607260009,"2016-07-26 07:35:00",中西區,違規停車,違規停車,"中西區永華路一段247號 214號 違規停車","永華路一段247號 214號",22.997143956084173,120.21296594291925
UN201607260013,"2016-07-26 07:49:00",永康區,髒亂及汙染,空氣汙染,"永康區中正北路88巷口 髒亂及汙染",710台灣台南市永康區中正北路88巷口,23.041162574685217,120.24069503892235
UN201607260018,"2016-07-26 06:58:00",安平區,違規停車,違規停車,"安平區育平路204號前面 違規停車",臺南市安平區育平路204號,22.989734,120.167077
UN201607260023,"2016-07-26 08:11:00",北區,路燈故障,9盞以下路燈故障,"北區大興街114巷3號 路燈故障",北區大興街114巷3號,23.0114231,120.190982
UN201607260027,"2016-07-26 08:24:00",永康區,騎樓舉發,騎樓舉發,"永康區中正南路55號 騎樓舉發",臺南市中正南路55號,23.233985,120.263255
UN201607260043,"2016-07-26 08:16:00",安平區,民生管線,漏水、停水、消防栓漏水或損壞,"安平區永華路二段184號 路旁漏水",臺南市安平區永華路二段184號,22.989657,120.184747
UN201607260053,"2016-07-26 09:09:00",北區,違規停車,違規停車,"北區長勝路19號 違規停車",704台湾台南市北區長勝路19號,23.0095287,120.2201304
UN201607260057,"2016-07-26 09:15:00",北區,道路維修,人孔蓋或溝蓋聲響鬆動,"北區大興街233巷36號跟38號中間 人孔聲響鬆動",臺南市北區大興街233巷36號,23.00971,120.188846
UN201607260067,"2016-07-26 09:27:00",北區,道路維修,人孔蓋凹陷坑洞,"北區北安路一段56巷1號前 人孔蓋凹陷坑洞",臺南市北區北安路一段56巷1號,23.016108,120.211594
UN201607260072,"2016-07-26 09:37:00",中西區,違規停車,違規停車,"萬昌街興華街 違規停車",萬昌街興華街,22.9920383,120.2104726
UN201607260087,"2016-07-26 09:48:00",北區,交通運輸,佔用道路,"北區育成路149巷2弄2號對面花園 佔用道路",臺南市北區育成路149巷2弄2號,23.017593,120.207163
UN201607260091,"2016-07-26 09:55:00",安南區,髒亂及汙染,空氣汙染,"安南區海佃路四段388巷134弄18號 空氣污染",臺南市安南區海佃路四段388巷134弄18號,23.066217,120.176669
UN201607260109,"2016-07-26 10:35:00",安平區,民生管線,漏水、停水、消防栓漏水或損壞,"安平區華平路180號182號  漏水",臺南市安平區華平路180號,22.989069,120.174893
UN201607260110,"2016-07-26 10:46:00",中西區,違規停車,違規停車,"中西區金華路三段91號   違規停車",中西區金華路三段91號,22.9904266,120.1923354
UN201607260117,"2016-07-26 10:51:00",中西區,道路維修,路面坑洞,"中西區國華街三段125號(面對大馬路左手邊)   路面坑洞",臺南市中西區國華街三段125號,22.996683,120.198533
UN201607260128,"2016-07-26 11:11:00",永康區,噪音舉發,妨害安寧,"永康區中正六街180之1號  妨害安寧",臺南市永康區中正六街180之1號,23.03896,120.237472
UN201607260152,"2016-07-26 11:50:00",安平區,違規停車,違規停車,"安平區華平路650號  違規停車",臺南市安平區華平路650號,22.995718,120.175901
UN201607260156,"2016-07-26 11:58:00",安南區,髒亂及汙染,其他汙染舉發,"安南區安中路三段59巷45弄16號旁邊 水污染",臺南市安南區安中路三段59巷45弄16號,23.046127,120.182659
UN201607260157,"2016-07-26 12:03:00",中西區,違規停車,違規停車,"中西區西華南街58號   違規停車",臺南市中西區西華南街58號,22.994066,120.20957
UN201607260160,"2016-07-26 12:06:00",佳里區,髒亂及汙染,空氣汙染,"佳里區忠孝路25號 空污",臺南市佳里區忠孝路25號,23.165352,120.175766
UN201607260162,"2016-07-26 12:12:00",安平區,違規停車,違規停車,"安平區華平路658號   紅線違規停車",臺南市安平區華平路658號,22.995893,120.17588
UN201607260163,"2016-07-26 12:11:00",中西區,違規停車,違規停車,"中西區開山路118號前  違停",臺南市中西區開山路118號,22.989421,120.207195
UN201607260170,"2016-07-26 12:27:00",永康區,騎樓舉發,騎樓舉發,"永康區小東路513號(台灣銀行)前面的騎樓  騎樓舉發",臺南市永康區小東路513號,22.998719,120.236233
UN201607260173,"2016-07-26 12:32:00",中西區,違規停車,違規停車,"中西區中山路166號Focus百貨周圍    紅黃線及斑馬線違規停車",中西區中山路166號,22.995708202472084,120.2101006731391
UN201607260178,"2016-07-26 12:49:00",安平區,違規停車,違規停車,"安平區永華路二段與文平路交叉口人行道上   違規停車",安平區永華路二段文平路,22.997143956084173,120.21296594291925
UN201607260180,"2016-07-26 12:50:00",中西區,違規停車,違規停車,"中西區廣慈街上(靠近養樂多)從成功路端算來第二個停車格   違規停車",中西區廣慈街,22.997519945316387,120.20746004127807
UN201607260189,"2016-07-26 13:12:00","北 區",違規停車,違規停車,"北區北門路二段從和緯路到長榮路  違規停車",北區北門路二段和緯路長榮路,23.01264122195323,120.21708380430937
UN201607260196,"2016-07-26 13:23:00",北區,違規停車,違規停車,"北區民德路58巷與西門路四段7巷口 違規停車",北區民德路58巷西門路四段7巷,23.007978955305187,120.20318199891615
UN201607260206,"2016-07-26 12:59:00",中西區,違規停車,違規停車,"中西區武英街20號 紅線違停",中西區武英街20號,22.9893107,120.1920715
UN201607260208,"2016-07-26 13:49:00",歸仁區,民生管線,漏水、停水、消防栓漏水或損壞,"歸仁區中山路一段384號 水管破裂",臺南市歸仁區中山路一段384號,22.966238,120.299911
UN201607260212,"2016-07-26 14:08:00",東區,違規停車,違規停車,"東區大學路西段27號  違規停車",東區大學路西段27號,22.99635002857353,120.21738999534418
UN201607260214,"2016-07-26 14:16:00",永康區,違規停車,違規停車,"永康區小東路685巷21號  違規停車",永康區小東路685巷21號,22.9996685,120.2393297
UN201607260238,"2016-07-26 15:12:00",中西區,違規停車,違規停車,"中西區公園路36號 黃線違規停車",700台灣台南市中西區公園路36號,22.994500824331254,120.20558886229992
UN201607260255,"2016-07-26 15:41:00",東區,違規停車,違規停車,"東區光華街119巷17號 紅線違規停車",701台灣台南市東區光華街119巷17號,22.984837945572085,120.21732578996588
UN201607260280,"2016-07-26 16:26:00",安平區,違規停車,違規停車,"安平區永華路二段與文平路交叉口人行道上 違規停車",安平區永華路二段文平路,22.990087,120.1782411
UN201607260282,"2016-07-26 16:34:00",歸仁區,路燈故障,9盞以下路燈故障,"歸仁區中正南路一段218巷8弄65號 路燈故障",臺南市歸仁區中正南路一段218巷8弄65號,22.964447,120.291156
UN201607260287,"2016-07-26 16:47:00",新營區,交通運輸,佔用道路,"新營區南新街14號  招牌佔用道路",新營區南新街14號,22.997163708391966,120.21296594291925
UN201607260288,"2016-07-26 16:48:00","東 區",違規停車,違規停車,"東區台南火車站前站  違規停車",東區台南火車站前站機車臨時停放區,22.996650456081138,120.21214183419944
UN201607260297,"2016-07-26 17:18:00",東區,民生管線,電信孔蓋鬆動、電信線路掉落、電信桿傾倒,"東區東興路289號 中華電信孔蓋聲響",臺南市東區東興路289號,22.996389,120.229906
UN201607260305,"2016-07-26 17:36:00",新營區,動物救援,犬貓急難救援,"新營區東光街86巷3號  貓困水溝救援",臺南市新營區東光街86巷3號,23.318057,120.321628
UN201607260311,"2016-07-26 17:50:00",南區,違規停車,違規停車,"南區竹溪街66號前 紅線違停",臺南市南區竹溪街66號,22.979837,120.209988
UN201607260312,"2016-07-26 17:53:00",東區,違規停車,違規停車,"東區中華東路三段399巷29弄1號 黃線違停",701台灣台南市東區中華東路三段399巷29弄1號,22.972020033598813,120.22078880000004
