UN201608020389,"2016-08-02 19:28:00",安平區,違規停車,違規停車,"安平區華平路658號 違規停車",安平區華平路658號,22.9957898,120.1757635
UN201608020395,"2016-08-02 19:43:00",中西區,違規停車,違規停車,"中西區中和街48號 違規停車",700台灣台南市中西區中和街48號,23.000310519731602,120.19088298093546
UN201608020397,"2016-08-02 19:45:00",歸仁區,髒亂及汙染,其他汙染舉發,"歸仁區沙崙里528號 空氣汙染",臺南市歸仁區沙崙里528號,22.938947,120.321437
UN201608020399,"2016-08-02 19:49:00",南區,違規停車,違規停車,"南區新興路441號 違規停車",台南市南區新興路441號,22.9749927,120.189649
UN201608020401,"2016-08-02 19:56:00",東區,違規停車,違規停車,"東區林森路二段192巷24弄25號  違規停車",臺南市東區林森路二段192巷24弄25號,22.988829,120.225453
UN201608020404,"2016-08-02 20:11:00",中西區,違規停車,違規停車,"中西區民族路二段76號 違規停車",臺南市民族路二段76號,22.994726,120.20925
UN201608020405,"2016-08-02 20:15:00",東區,違規停車,違規停車,"東區裕農路706號  違規停車",臺南市東區裕農路706號,22.988645,120.237366
UN201608020407,"2016-08-02 20:26:00",南區,違規停車,違規停車,"南區新興路217巷7號 佔用道路",南區新興路217巷7號,22.9768547,120.193926
UN201608020411,"2016-08-02 20:43:00",北區,道路維修,路面坑洞,"北區文賢路1068號 道路坑洞",臺南市北區文賢路1068號,23.014893,120.193831
UN201608020421,"2016-08-02 21:33:00",東區,違規停車,違規停車,"東區東區長榮路二段180號 違規停車",臺南市長榮路二段180號,22.990222,120.220767
UN201608020425,"2016-08-02 21:45:00",安平區,違規停車,違規停車,"安平區文平路106號 違規停車",台南市安平區文平路106號,22.9862875,120.1777285
UN201608020426,"2016-08-02 21:49:00",安平區,違規停車,違規停車,"安平區安平路68號 違規停車",708台灣台南市安平區安平路68號,22.9902593,120.1690449
UN201608020427,"2016-08-02 21:54:00",安平區,違規停車,違規停車,"安平區安平路70號前  違停",臺南市安平區安平路70號,22.998242,120.18484
UN201608020428,"2016-08-02 22:02:00",中西區,違規停車,違規停車,中西區北門路一段101號違規停車,臺南市北門路一段101號,22.992288,120.211372
UN201608020429,"2016-08-02 22:07:00",中西區,噪音舉發,妨害安寧,中西區衛民街129號噪音舉發,臺南市衛民街129號,22.99328,120.207732
UN201608020431,"2016-08-02 22:12:00",中西區,違規停車,違規停車,中西區民族路二段121至143號違規停車,臺南市民族路二段121至143號,22.994977,120.207443
UN201608020435,"2016-08-02 22:37:00",東區,噪音舉發,妨害安寧,"東區林森路一段160號4樓之3或之4 妨害安寧",臺南市東區林森路一段160號,22.981688,120.215359
UN201608020438,"2016-08-02 22:59:00",永康區,違規停車,違規停車,"永康區洲尾街200號 違規停車",臺南市永康區洲尾街200號,23.041798,120.230562
UN201608020441,"2016-08-02 23:56:00",仁德區,違規停車,違規停車,"仁德區德崙路369巷9-13號 違規停車",臺南市仁德區德崙路369巷9-13號,22.94274,120.259795
UN201608030001,"2016-08-03 00:17:00",新化區,髒亂及汙染,空氣汙染,"新化區護安街42號(天壇護安宮)  空氣汙染",臺南市新化區護安街42號,23.035114,120.309462
UN201608030008,"2016-08-03 03:01:00",新市區,違規停車,違規停車,新市區和平街215號附近違規停車,臺南市新市區和平街215號,23.078917,120.291031
UN201608030019,"2016-08-03 07:40:00",安平區,違規停車,違規停車,"安平區華平路690號  違停",臺南市安平區華平路690號,22.996671,120.17601
UN201608030029,"2016-08-03 08:27:00",善化區,民生管線,電信孔蓋鬆動、電信線路掉落、電信桿傾倒,"善化區興華路380號  中華電信孔蓋鬆動",臺南市善化區興華路380號,23.126987,120.294746
UN201608030031,"2016-08-03 08:27:00",安南區,違規停車,違規停車,"安南區府安路五段119巷33弄2號旁  違規停車",臺南市安南區府安路五段119巷33弄2號,23.024385,120.199288
UN201608030032,"2016-08-03 08:29:00",善化區,路燈故障,10盞以上路燈故障,"善化區小新里成功新村70號   路燈故障",臺南市善化區小新里成功新村70號,23.12832,120.320061
UN201608030051,"2016-08-03 09:06:00",中西區,違規停車,違規停車,"中西區友愛街 文資中心車道入口處  違停","中西區友愛街 文資中心車道入口處",22.9915083,120.1994656
UN201608030058,"2016-08-03 09:21:00",麻豆區,動物救援,犬貓急難救援,"麻豆區新生北路551號   狗受傷",臺南市麻豆區新生北路551號,23.190309,120.248868
UN201608030059,"2016-08-03 09:03:00",北區,民生管線,停電、漏電、電線掉落、孔蓋鬆動,"北區公園路1074巷20弄20號  汙水孔蓋鬆動",臺南市北區公園路1074巷20弄20號,23.018048,120.216404
UN201608030067,"2016-08-03 09:35:00",安平區,民生管線,漏水、停水、消防栓漏水或損壞,"安平區建平五街21號  漏水",臺南市安平區建平五街21號,22.98729,120.181659
UN201608030087,"2016-08-03 10:30:00",永康區,違規停車,違規停車,"永康區中正六街台南應用科大周圍(5號對面到79號對面)   違規停車",永康區中正六街,23.036714373029426,120.23755241185427
UN201608030094,"2016-08-03 10:36:00",東區,違規停車,違規停車,"東區崇明路482號前  違規停車",臺南市東區崇明路482號,22.973924,120.223291
UN201608030112,"2016-08-03 11:09:00",安南區,違規停車,違規停車,"安南區府安路五段156號  違規停車",臺南市安南區府安路五段156號,23.022959,120.198103
UN201608030119,"2016-08-03 10:47:00",東區,違規停車,違規停車,"東區崇德路621號  違規停車",臺南市東區崇德路621號,22.971727,120.227679
UN201608030126,"2016-08-03 11:49:00",仁德區,路燈故障,9盞以下路燈故障,"仁德區中洲里333號玄天宮  路燈不亮",臺南市仁德區中洲里333號,22.906953,120.252259
UN201608030129,"2016-08-03 11:59:00",永康區,違規停車,違規停車,"永康區中華路796號   違規停車",臺南市永康區中華路796號,23.017997,120.227374
UN201608030133,"2016-08-03 12:02:00",東區,違規停車,違規停車,"東區崇明路614號前 違規停車",臺南市東區崇明路614號,22.972267,120.225065
UN201608030137,"2016-08-03 12:12:00",東區,違規停車,違規停車,"東區林森路一段153巷27弄號 違規停車",臺南市東區林森路一段153巷27弄號,22.984263,120.215152
UN201608030138,"2016-08-03 12:13:00",東區,違規停車,違規停車,"東區崇德路761號 違規停車",臺南市東區崇德路761號,22.967328,120.227702
UN201608030140,"2016-08-03 12:15:00",東區,違規停車,違規停車,"東區崇德路680號 違規停車",臺南市東區崇德路680號,22.967185,120.227308
UN201608030150,"2016-08-03 12:39:00","北 區",違規停車,違規停車,"北區北門路二段沿線兩側(長榮路到和緯路) 違規停車",北區北門路二段,23.012759104959184,120.21692287176847
UN201608030156,"2016-08-03 12:49:00",中西區,交通運輸,佔用道路,"中西區國華街二段99號   佔用道路",臺南市中西區國華街二段99號,22.99047,120.196633
UN201608030164,"2016-08-03 13:16:00",安南區,路燈故障,9盞以下路燈故障,"安南區安和路三段73巷5號前  路燈故障",臺南市安南區安和路三段73巷5號,23.045302,120.216889
UN201608030166,"2016-08-03 13:16:00",中西區,違規停車,違規停車,"中西區武英街17號 / 金華路三段37號   違停",臺南市中西區武英街17號,22.989105,120.191982
UN201608030175,"2016-08-03 13:52:00",北區,違規停車,違規停車,"北區開元路485巷15號   違規停車",704台灣台南市北區開元路485巷15號,23.01073526034412,120.22458158444634
UN201608030176,"2016-08-03 13:53:00",中西區,違規停車,違規停車,"中西區西華南街沿線   違規停車",中西區西華南街沿線,22.995818075815972,120.20976874977352
UN201608030178,"2016-08-03 13:54:00",東區,違規停車,違規停車,"東區中華東路三段102號 違規停車",臺南市中華東路三段102號,22.979199,120.227452
UN201608030182,"2016-08-03 14:01:00",中西區,民生管線,漏水、停水、消防栓漏水或損壞,"中西區西門路四段5號 漏水",臺南市中西區西門路四段5號,22.990342,120.197459
UN201608030185,"2016-08-03 14:08:00",中西區,交通運輸,佔用道路,"中西區大智街96號  佔用道路",臺南市中西區大智街96號,22.989722,120.192981
UN201608030191,"2016-08-03 14:25:00",永康區,違規停車,違規停車,"永康區中華路21號 違規停車",永康區中華路21號,22.99969105405604,120.2347069233656
UN201608030207,"2016-08-03 15:05:00",南區,路燈故障,9盞以下路燈故障,"南區南門路261號週邊  路燈故障",臺南市南區南門路261號,22.979898,120.204139
UN201608030210,"2016-08-03 15:11:00",中西區,違規停車,違規停車,"中西區府緯街2號/永福路一段 違規停車",700台灣台南市中西區府緯街2號永福路一段,22.9838489,120.1999886
UN201608030214,"2016-08-03 15:15:00",東區,騎樓舉發,騎樓舉發,"東區崇明路125號 佔用騎樓",701台灣台南市東區崇明路125號,22.9794242,120.2180063
UN201608030226,"2016-08-03 15:27:00",中西區,違規停車,違規停車,"中西區府連路108號 違規停車",700台灣台南市中西區府連路108號,22.983366943473214,120.21026864647865
UN201608030233,"2016-08-03 15:39:00",中西區,違規停車,違規停車,"府前路二段314號 違停",臺南市府前路二段314號,22.992451,120.188896
UN201608030234,"2016-08-03 15:39:00",安定區,道路維修,路面坑洞,"安定區中榮里許中營25之9號 路面坑洞",臺南市安定區中榮里許中營25之9號,23.094516,120.244661
UN201608030239,"2016-08-03 15:49:00",東區,違規停車,違規停車,"東區青年路278號 違規停車",臺南市東區青年路278號,22.991297,120.213154
UN201608030241,"2016-08-03 15:49:00",楠西區,路燈故障,9盞以下路燈故障,"楠西區鹿田里1號之10 路燈不亮",臺南市楠西區鹿田里1號,23.14256,120.482912
UN201608030244,"2016-08-03 15:52:00",中西區,違規停車,違規停車,"中西區中山路2號到100號 /11號到117號 紅黃線違停",臺南市中山路2號,23.234637,120.26121
UN201608030256,"2016-08-03 16:04:00",中西區,髒亂及汙染,空氣汙染,"中西區民族路三段68號 空氣污染",臺南市中西區民族路三段68號,22.998204,120.198154
UN201608030257,"2016-08-03 16:06:00",東區,民生管線,停電、漏電、電線掉落、孔蓋鬆動,"東區崇信街21號前 孔蓋鬆動",臺南市東區崇信街21號,22.982453,120.226568
UN201608030268,"2016-08-03 16:35:00",中西區,違規停車,違規停車,"南區西門路一段681號(西門路郵局) 違規停車",臺南市南區西門路一段681號,22.986684,120.197318
UN201608030276,"2016-08-03 16:51:00",東區,路燈故障,9盞以下路燈故障,"東區自由路一段106號 路燈故障",臺南市東區自由路一段106號,22.972692,120.237641
UN201608030278,"2016-08-03 16:54:00",中西區,違規停車,違規停車,"中西區台南火車站前站圓環公車南站後方 違規停車",中西區台南火車站前站圓環公車南站後方,22.996880077320096,120.21132845431566
UN201608030281,"2016-08-03 16:59:00",東區,違規停車,違規停車,"東區裕農路632號 違規停車",701台灣台南市東區裕農路632號,22.988566677107464,120.23582297388485
UN201608030287,"2016-08-03 17:08:00",中西區,違規停車,違規停車,"中西區府前路一段299號前 違規停車",臺南市中西區府前路一段299號,22.989615,120.201516
UN201608030293,"2016-08-03 17:21:00",中西區,騎樓舉發,騎樓舉發,"中西區民族路二段71號 騎樓舉發",中西區民族路二段71號,23.003855757537902,120.20190441010561
UN201608030298,"2016-08-03 17:31:00",中西區,違規停車,違規停車,"中西區西華南街38/42號 違規停車",臺南市中西區西華南街38號,22.993886,120.209524
UN201608030301,"2016-08-03 17:42:00","北 區",違規停車,違規停車,"北區北門路二段沿線兩側(和緯路到長榮路)  紅黃線違規停車",北區北門路二段,23.0094700687176,120.2158885449171
UN201608030302,"2016-08-03 17:43:00",東區,違規停車,違規停車,"東區府連路437號 紅線違規停車",臺南市東區府連路437號,22.986438,120.217129
UN201608030308,"2016-08-03 18:09:00",東區,違規停車,違規停車,"東區東門路二段296號  紅線違停",臺南市東區東門路二段296號,22.983788,120.22548
UN201608030310,"2016-08-03 18:12:00",中西區,違規停車,違規停車,"中西區衛民街135號  違規停車",臺南市中西區衛民街135號,22.993308,120.207612
UN201608030315,"2016-08-03 18:46:00",中西區,違規停車,違規停車,"中西區中山路125號南方公園周圍  違規停車",中西區中山路125號南方公園周圍,22.99569770894581,120.20969901233912
UN201608030323,"2016-08-03 19:03:00",中西區,違規停車,違規停車,"中西區民族路二段從北門路口到西門路口與民族路二段 汽機車違停",民族路二段北門路,22.9945122,120.2117605
UN201608030326,"2016-08-03 19:17:00",安平區,違規停車,違規停車,"國平路552巷37號 違規停車",臺南市安平區國平路552巷37號,22.996667,120.172438
UN201608030331,"2016-08-03 19:23:00",東區,違規停車,違規停車,"東區大學路12巷9號  違停",臺南市東區大學路12巷9號,22.994983,120.22049
UN201608030336,"2016-08-03 19:43:00",中西區,違規停車,違規停車,"中西區民族路二段76號/95號 違規停車",臺南市民族路二段76號,22.994726,120.20925
UN201608030337,"2016-08-03 19:40:00",北區,違規停車,違規停車,"北區開元路212巷接近林森路口  違停",北區開元路212巷接近林森路口,23.0058759,120.2229729
UN201608030338,"2016-08-03 19:45:00",北區,交通運輸,號誌故障,"北區育德路與立賢一路口 號誌故障",704台灣台南市北區育德路167號,23.0093152,120.2055496
UN201608030340,"2016-08-03 19:48:00",新營區,噪音舉發,妨害安寧,"新營區南新街13巷20號 妨害安寧",台南市新營區南新街13巷20號,22.997163708391966,120.21296594291925
UN201608030343,"2016-08-03 19:54:00",永康區,噪音舉發,妨害安寧,"永康區西勢路19巷60號 妨害安寧",永康區西勢路19巷60號,23.0188647,120.2801505
UN201608030349,"2016-08-03 20:46:00",中西區,違規停車,違規停車,"中西區衛民萬昌街  違規停車",中西區衛民萬昌街,22.9928755,120.2106492
UN201608030355,"2016-08-03 20:52:00",南區,違規停車,違規停車,南區新興路217巷7號違停,南區新興路217巷7號,22.9768547,120.193926
UN201608030360,"2016-08-03 21:26:00",中西區,噪音舉發,妨害安寧,"中西區府前二街70號 妨害安寧",臺南市中西區府前二街70號,22.994604,120.187297
UN201608030365,"2016-08-03 22:03:00",新營區,噪音舉發,妨害安寧,"新營區育德街54號 妨害安寧",臺南市新營區育德街54號,23.31292,120.311661
UN201608030373,"2016-08-03 22:28:00",安平區,騎樓舉發,騎樓舉發,安平區安平路68號騎樓舉發,708台灣台南市安平區安平路68號,22.9978983,120.1848947
UN201608030374,"2016-08-03 22:27:00",歸仁區,動物救援,遊蕩犬隻捕捉管制,"歸仁區長榮路一段70巷51號前  捕犬",臺南市歸仁區長榮路一段70巷51號,22.908829,120.267182
UN201608030376,"2016-08-03 22:29:00",安平區,違規停車,違規停車,安平區安平路70號違規停車,708台灣台南市安平區安平路70號,22.9979191,120.1843615
UN201608030377,"2016-08-03 22:30:00",中西區,違規停車,違規停車,中西區北門路1段171號違規停車,中西區北門路1段171號,22.996000169082286,120.21187763661145
UN201608030378,"2016-08-03 22:37:00",安平區,違規停車,違規停車,安平區國平路552巷37號前違規停車,臺南市安平區國平路552巷37號,22.996667,120.172438
UN201608030381,"2016-08-03 22:55:00",新化區,髒亂及汙染,空氣汙染,"新化區護安街42號 空氣汙染",新化區護安街42號,23.035225,120.309398
