UN201608150003,"2016-08-15 01:02:00",麻豆區,噪音舉發,妨害安寧,麻豆區中正路53-10號噪音舉發,臺南市麻豆區中正路53-10號,23.185464,120.248821
UN201608150006,"2016-08-15 03:20:00",東區,違規停車,違規停車,"東區裕農路657號 紅線違規停車",臺南市東區裕農路657號,22.988789,120.236367
UN201608150013,"2016-08-15 07:04:00",東區,違規停車,違規停車,"裕農路446巷52弄17號對面 違規停車",臺南市裕農路446巷52弄17號,22.986367,120.231159
UN201608150021,"2016-08-15 07:56:00",永康區,髒亂及汙染,空氣汙染,"永康區大灣路283號大灣國小附近 空氣汙染",永康區大灣路283號大灣國小,23.0054983,120.2673111
UN201608150024,"2016-08-15 08:11:00",東區,違規停車,違規停車,"東區東門路三段308巷71弄30號 違規停車",臺南市東區東門路三段308巷71弄30號,22.981174,120.231669
UN201608150026,"2016-08-15 08:13:00",中西區,民生管線,漏水、停水、消防栓漏水或損壞,"中西區公園路7號前面 路面漏水",臺南市中西區公園路7號,22.993014,120.20462
UN201608150041,"2016-08-15 08:45:00",永康區,違規停車,違規停車,"710台灣台南市永康區洲尾街154巷9號 違規停車",710台灣台南市永康區洲尾街154巷9號,23.043006496959670,120.23133631991664
