UN201608220005,"2016-08-22 05:01:00",六甲區,噪音舉發,妨害安寧,"六甲區中正路422巷7號 妨害安寧",臺南市六甲區中正路422巷7號,23.227712,120.351213
UN201608220006,"2016-08-22 05:23:00",六甲區,噪音舉發,妨害安寧,"六甲區中正路422巷7號  妨害安寧",臺南市六甲區中正路422巷7號,23.227712,120.351213
UN201608220009,"2016-08-22 06:26:00",後壁區,動物救援,遊蕩犬隻捕捉管制,"後壁區新東里新港東147之42號 流浪犬",臺南市後壁區新東里新港東147之42號,23.33987,120.326546
UN201608220013,"2016-08-22 07:52:00",中西區,髒亂及汙染,空氣汙染,"中西區大勇街101號 空氣汙染",臺南市中西區大勇街101號,23.003237,120.1889
UN201608220017,"2016-08-22 08:01:00",安平區,噪音舉發,妨害安寧,"安平區安平路183號旁 妨害安寧",臺南市安平區安平路183號,23.000094,120.160815
UN201608220021,"2016-08-22 08:04:00",柳營區,髒亂及汙染,道路散落物,"柳營路二段77號  道路散落物",臺南市柳營路二段77號,23.279138,120.311554
UN201608220024,"2016-08-22 08:13:00",北區,道路維修,人孔蓋或溝蓋聲響鬆動,"北區育德二路810巷5號前面 孔蓋噪音",臺南市北區育德二路810巷5號,23.020468,120.201514
UN201608220025,"2016-08-22 08:11:00",南區,民生管線,漏水、停水、消防栓漏水或損壞,"南區明興路681巷52弄27號  漏水",臺南市南區明興路681巷52弄27號,22.937638,120.181114
