UN201609050002,"2016-09-05 00:42:00",中西區,噪音舉發,場所連續噪音,中西區府前一街101號噪音舉發,700台灣台南市中西區府前一街101號,22.9948531,120.1883694
UN201609050015,"2016-09-05 07:33:00",永康區,違規停車,違規停車,"永康區復國一路364巷75號 違規停車",710台灣台南市永康區復國一路364巷75號,23.0118933,120.2473025
UN201609050025,"2016-09-05 08:08:00",中西區,違規停車,違規停車,"中西區青年路163號附近外面 違規停車",臺南市青年路163號,22.991948,120.209811
UN201609050026,"2016-09-05 08:08:00",永康區,違規停車,違規停車,"永康區大灣路942巷114號 違停",臺南市永康區大灣路942巷114號,23.002819,120.256041
UN201609050027,"2016-09-05 08:09:00",中西區,違規停車,違規停車,"中西區城隍街 違規停車","臺南市城隍街靠近青年路口的紅線 違規停車 單號",22.989403,120.208018
UN201609050034,"2016-09-05 08:20:00",安定區,髒亂及汙染,空氣汙染,"台南市安定區蘇林里124號 空氣汙染",臺南市安定區蘇林里124號,23.130855,120.254613
UN201609050041,"2016-09-05 08:34:00",永康區,噪音舉發,場所連續噪音,"永康區中山北路164巷110弄12號 工廠機器噪音",臺南市永康區中山北路164巷110弄12號,23.026072,120.263464
UN201609050048,"2016-09-05 08:45:00",中西區,違規停車,違規停車,"中西區民權路一段184號 違規停車",臺南市民權路一段184號,22.991658,120.208127
UN201609050055,"2016-09-05 09:05:00",北區,噪音舉發,妨害安寧,"北區大興街574號  妨害安寧",臺南市北區大興街574號,23.008074,120.179807
UN201609050060,"2016-09-05 09:09:00",永康區,違規停車,違規停車,"永康區復國一路364巷口轉彎處 違規停車",710台灣台南市永康區復國一路364巷口轉彎處,23.0118864,120.2473017
UN201609050071,"2016-09-05 09:28:00",東區,路燈故障,9盞以下路燈故障,"東區東興路40巷1號  路燈故障",臺南市東區東興路40巷1號,22.991171,120.229091
UN201609050078,"2016-09-05 09:38:00",北區,路燈故障,9盞以下路燈故障,"北區成功路600巷31號 路燈故障",臺南市北區成功路600巷31號,23.003111,120.195682
UN201609050085,"2016-09-05 07:59:00",安南區,路燈故障,9盞以下路燈故障,"安南區城西街二段181巷50弄156號附近 路燈故障",臺南市安南區城西街二段181巷50弄156號,23.058094,120.120549
UN201609050093,"2016-09-05 10:13:00",永康區,違規停車,違規停車,"永康區中正七街1號到77號對面，台南應用科大周圍 違規停車",永康區中正七街1號,23.039820402298027,120.23982994258402
UN201609050097,"2016-09-05 10:15:00",北區,違規停車,違規停車,"北區成功路380號 違規停車",北區成功路380號,22.991052816475914,120.22031301643722
UN201609050099,"2016-09-05 10:16:00",永康區,道路維修,路面坑洞,"永康區大灣路904號 路面坑洞",臺南市永康區大灣路904號,22.999725,120.255851
