UN201609230204,"2016-09-23 13:20:00",將軍區,交通運輸,佔用道路,"將軍區苓和里7號後方  佔用道路",臺南市將軍區苓和里7號,23.222555,120.162769
UN201609230206,"2016-09-23 13:22:00",東區,違規停車,違規停車,"東區崇學路228號（加油站旁） 違規停車",臺南市東區崇學路228號,22.9825969,120.2260329
UN201609230207,"2016-09-23 13:24:00",永康區,違規停車,違規停車,"台南市永康區中正南路30號 違規停車",臺南市永康區中正南路30號,23.019486,120.216239
UN201609230210,"2016-09-23 13:29:00",北區,違規停車,違規停車,"台南市北區北安路一段37號 違規停車",台南市北區北安路一段37號,23.0152481,120.211969
UN201609230219,"2016-09-23 13:53:00",永康區,騎樓舉發,騎樓舉發,"永康區小東路513號  刮刮樂",臺南市永康區小東路513號,22.998719,120.236233
UN201609230225,"2016-09-23 14:08:00",北區,噪音舉發,妨害安寧,"704台灣台南市北區文賢路218巷62號  妨害安寧",704台灣台南市北區文賢路218巷62號,23.004431,120.1952856
UN201609230229,"2016-09-23 14:10:00",中西區,違規停車,違規停車,"台南市中西區永福路二段99到125號  違規停車",臺南市中西區永福路二段99號,22.99329,120.200962
UN201609230241,"2016-09-23 14:39:00",永康區,髒亂及汙染,道路散落物,"永康區埔園街315至327號  道路散落物",臺南市永康區埔園街315至327號,23.032904,120.251711
UN201609230273,"2016-09-23 15:28:00",中西區,違規停車,違規停車,"中西區金華路三段45號 違規停車",臺南市中西區金華路三段45號,22.989418,120.192139
UN201609230287,"2016-09-23 15:39:00",北區,交通運輸,佔用道路,"北區文賢路263號 妨礙出入",臺南市北區文賢路263號,23.00554,120.193471
UN201609230289,"2016-09-23 15:45:00",南區,道路維修,路面掏空、塌陷,"南區大成路一段192號 塌陷",臺南市南區大成路一段192號,22.975252,120.198398
UN201609230294,"2016-09-23 15:52:00",東區,違規停車,違規停車,"東區林森路一段145號  紅線違停",臺南市東區林森路一段145號,22.982249,120.214912
UN201609230298,"2016-09-23 15:59:00",南區,動物救援,遊蕩犬隻捕捉管制,"南區體育路87號  犬貓捕捉",臺南市南區體育路87號,22.977435,120.208613
UN201609230303,"2016-09-23 16:07:00",安南區,道路維修,路樹傾倒,"安南區安和路一段250號 路樹傾倒",臺南市安南區安和路一段250號,23.03139,120.212846
UN201609230308,"2016-09-23 16:16:00",安南區,道路維修,路面掏空、塌陷,"安南區安中路二段117號 塌陷",安南區安中路二段117號,23.0463885,120.1870845
UN201609230315,"2016-09-23 16:39:00",北區,違規停車,違規停車,"台南市北區成功路2號  紅線違停",臺南市北區成功路2號,22.997791,120.211428
UN201609230319,"2016-09-23 16:43:00",安平區,違規停車,違規停車,"安平區建平八街450巷10號 違規停車",安平區建平八街450巷10號,22.9921552,120.1719166
UN201609230320,"2016-09-23 16:45:00",楠西區,路燈故障,9盞以下路燈故障,"楠西區灣丘里香蕉山10號-1  路燈",臺南市楠西區灣丘里香蕉山10號,23.183205,120.537963
UN201609230326,"2016-09-23 16:54:00",中西區,違規停車,違規停車,"700台灣台南市中西區府連路117號   違規停車",700台灣台南市中西區府連路117號旁巷口,22.9839332,120.2105266
UN201609230329,"2016-09-23 17:07:00",安平區,噪音舉發,場所連續噪音,"安平區安平路796號斜對面 噪音",臺南市安平區安平路796號,23.000395,120.160365
UN201609230338,"2016-09-23 17:27:00",中西區,違規停車,違規停車,"中西區民族路二段76/95號 違規停車",臺南市中西區民族路二段76/95號,22.995083,120.207033
UN201609230350,"2016-09-23 17:55:00",中西區,違規停車,違規停車,"中西區永福路一段86號  違規停車",700台灣台南市中西區永福路一段86號,22.987899893896138,120.20036940370483
UN201609230357,"2016-09-23 18:20:00",仁德區,髒亂及汙染,空氣汙染,"仁德區中正路一段336號斜對面 空氣汙染",臺南市仁德區中正路一段336號,22.923946,120.239216
UN201609230361,"2016-09-23 18:23:00",中西區,交通運輸,佔用道路,"中西區民生路二段19號 佔用道路",臺南市中西區民生路二段19號,22.994513,120.198564
UN201609230364,"2016-09-23 18:33:00",中西區,違規停車,違規停車,"中西區民權路   違規停車",中西區民權路,22.9982223,120.1933076
UN201609230366,"2016-09-23 18:38:00",東區,違規停車,違規停車,"東區中華東路三段399巷25號  違規停車",東區中華東路三段399巷25號,22.9808533,120.2279451
UN201609230368,"2016-09-23 18:39:00",中西區,違規停車,違規停車,違規停車,700台灣台南市中西區國華街二段46號,22.9884274,120.1964734
UN201609230376,"2016-09-23 18:51:00",安南區,違規停車,違規停車,"安南區安中路一段755號雙側  違停",臺南市安南區安中路一段755號,23.065847,120.127563
UN201609230380,"2016-09-23 19:00:00",東區,違規停車,違規停車,"東區長榮路二段180號到276號  違停",臺南市東區長榮路二段180號,22.990222,120.220767
UN201609230381,"2016-09-23 19:02:00",中西區,違規停車,違規停車,"中西區府前路二段157號 違規停車",700台灣台南市中西區府前路二段157號,22.991433259944507,120.19348108366103
UN201609230388,"2016-09-23 19:23:00",佳里區,髒亂及汙染,空氣汙染,"佳里區營頂里2號 燒東西空氣汙染",臺南市佳里區營頂里2號,23.197206,120.188068
UN201609230389,"2016-09-23 19:11:00",永康區,路燈故障,9盞以下路燈故障,"永康區富強路二段121巷111號  路燈不亮",臺南市永康區富強路二段121巷111號,23.022224,120.273505
UN201609230393,"2016-09-23 19:38:00",東區,違規停車,違規停車,"東區長榮路二段257號旁邊  違規停車",東區長榮路二段257號旁邊,22.9919097,120.2214619
UN201609230397,"2016-09-23 19:57:00",安平區,違規停車,違規停車,"安平區育平五街31-75號 違規停車",育平五街,22.9906705,120.1689224
UN201609230398,"2016-09-23 19:59:00",南區,路燈故障,9盞以下路燈故障,"南區明興路1285巷29號前面及對面  路燈故障",臺南市南區明興路1285巷29號,22.923121,120.18592
UN201609230406,"2016-09-23 20:18:00",東區,違規停車,違規停車,"東區林森路一段320號 東門消防隊","東區林森路一段320號 東門消防隊",22.9850449,120.2217466
UN201609230409,"2016-09-23 20:34:00",中西區,交通運輸,佔用道路,"中西區西門路二段387號  佔用道路",中西區西門路二段387號,22.9985471,120.200283
UN201609230410,"2016-09-23 20:23:00",北區,違規停車,違規停車,"北區成功路和中西區康樂街 轉角  違停","北區成功路和中西區康樂街 轉角",23.0025475,120.1981527
UN201609230419,"2016-09-23 21:13:00","南 區",違規停車,違規停車,"南區永興二街23號 違規停車",702台灣台南市南區永興二街23號,22.965363690108557,120.19276354461908
UN201609230424,"2016-09-23 21:33:00",中西區,交通運輸,交通疏導,"中西區民族路二段雙向   交通疏導",中西區民族路二段雙向,22.9957239,120.2057375
UN201609230426,"2016-09-23 21:50:00",北區,違規停車,違規停車,"北區北門路二段101號 違規停車",台南市北區北門路二段101號,22.9994497,120.2124742
UN201609230427,"2016-09-23 21:43:00",永康區,違規停車,違規停車,"永康區自強路872巷9弄巷口  違停",永康區自強路872巷9弄巷口,23.0381482,120.2659641
UN201609230428,"2016-09-23 21:53:00",北區,交通運輸,佔用道路,"北區開元路182號 郵局處 佔用道路","北區開元路182號 郵局處",23.0071955,120.2201708
UN201609230434,"2016-09-23 22:19:00",中西區,違規停車,違規停車,中西區府連路117號旁-紅線違停違規停車,台南市中西區府連路117號旁-紅線違停,22.9836944,120.2105204
UN201609230435,"2016-09-23 22:20:00",南區,髒亂及汙染,空氣汙染,"南區金華路二段76號 空氣汙染",臺南市南區金華路二段76號,22.977567,120.191301
UN201609230437,"2016-09-23 22:39:00",安平區,違規停車,違規停車,"安平區建平七街85號 違規停車",臺南市安平區建平七街85號,22.988395,120.182801
UN201609230438,"2016-09-23 22:43:00",善化區,路燈故障,10盞以上路燈故障,"善化月眉園路路燈 路燈故障",善化月眉園路路燈,23.1104157,120.3044313
UN201609230441,"2016-09-23 23:19:00",歸仁區,噪音舉發,妨害安寧,"歸仁區中正一街51號 妨害安寧/連續噪音",臺南市歸仁區中正一街51號,22.966127,120.295252
UN201609230442,"2016-09-23 23:37:00",安平區,違規停車,違規停車,"安平區中華西路二段559號   紅線違停",臺南市安平區中華西路二段559號,22.998789,120.186527
UN201609230443,"2016-09-23 23:57:00",安南區,髒亂及汙染,空氣汙染,"安南區海佃路四段89號 空氣汙染",臺南市安南區海佃路四段89號,23.05536,120.17679
UN201609240007,"2016-09-24 04:38:00",中西區,噪音舉發,場所連續噪音,"中西區金華新路43號  連續噪音",臺南市中西區金華新路43號,22.993256,120.19278
UN201609240008,"2016-09-24 04:47:00",六甲區,噪音舉發,妨害安寧,"六甲區中正路422巷7號   妨害安寧",臺南市六甲區中正路422巷7號,23.227712,120.351213
UN201609240009,"2016-09-24 05:12:00",南區,交通運輸,佔用道路,"南區體育路47號  佔用道路",臺南市南區體育路47號,22.980806,120.2072
UN201609240012,"2016-09-24 06:43:00",東區,違規停車,違規停車,東區仁和路139巷51弄20號紅線違規停車,臺南市東區仁和路139巷51弄20號,22.970452,120.236855
UN201609240015,"2016-09-24 06:58:00",下營區,噪音舉發,妨害安寧,"下營區中營里1154號 妨害安寧噪音汙染",臺南市下營區中營里1154號,23.215277,120.277553
UN201609240016,"2016-09-24 07:28:00",東區,違規停車,違規停車,"東區崇德路36號旁邊巷口 違規停車",臺南市東區崇德路36號,22.981646,120.21747
UN201609240017,"2016-09-24 07:29:00",北區,違規停車,違規停車,"台南市北區勝利路214號 違規停車",臺南市北區勝利路214號,23.004501,120.21897
UN201609240019,"2016-09-24 07:30:00",北區,違規停車,違規停車,"台南市北區勝利路216號 違規停車",臺南市北區勝利路216號,23.004542,120.218955
UN201609240047,"2016-09-24 09:22:00",北區,違規停車,違規停車,"北區開元路307號對面  違規停車",臺南市北區開元路307號,23.00817,120.221424
UN201609240048,"2016-09-24 09:27:00",安南區,路燈故障,9盞以下路燈故障,"安南區鎮安路29號前 路燈",臺南市安南區鎮安路29號,23.064317,120.199147
UN201609240061,"2016-09-24 09:51:00",善化區,路燈故障,9盞以下路燈故障,"善化區月眉園路與蓮潭南街交界  路燈故障",善化區月眉園路與蓮潭南街交界,23.110867137315477,120.30427692306121
UN201609240065,"2016-09-24 10:01:00","北 區",違規停車,違規停車,"北區長榮路五段 違規停車",北區長榮路五段沿線(北門路到公園路),23.013227550022346,120.21307792514563
UN201609240073,"2016-09-24 10:26:00",中西區,違規停車,違規停車,"台南市中西區西門路二段2號 違規停車",臺南市中西區西門路二段2號,22.990558,120.19823
UN201609240081,"2016-09-24 10:42:00",北區,違規停車,違規停車,"北區東興路二段51號 違規停車",臺南市北區東興路二段51號,23.000601,120.228449
UN201609240085,"2016-09-24 10:47:00",安平區,違規停車,違規停車,"安平區華平路656號 違規停車",臺南市華平路656號,22.995837,120.175938
UN201609240086,"2016-09-24 10:45:00",關廟區,動物救援,犬貓急難救援,"關廟區南雄路二段450號對面工地 犬救援",臺南市關廟區南雄路二段450號,22.966203,120.328261
UN201609240096,"2016-09-24 10:55:00",中西區,違規停車,違規停車,"中西區青年路民權路城隍街 違規停車",青年路民權路,22.9921134,120.2077023
UN201609240097,"2016-09-24 11:00:00",南區,騎樓舉發,騎樓舉發,"南區金華路二段與新孝路口，水果行 騎樓舉發",南區金華路二段新孝路口,22.9816175,120.1914653
UN201609240109,"2016-09-24 11:25:00",北區,違規停車,違規停車,"北區成功路6號  違停",北區成功路6號,22.9975773,120.2102911
UN201609240111,"2016-09-24 11:33:00",安平區,違規停車,違規停車,"安平區華平路652號 違規停車",臺南市華平路652號,22.995755,120.175904
UN201609240117,"2016-09-24 11:39:00",永康區,違規停車,違規停車,"永康區南台街55號 違規停車",臺南市永康區南台街55號,23.022459,120.222442
UN201609240118,"2016-09-24 11:38:00",北區,交通運輸,交通疏導,"北區公園南路和海安路交叉口 交通疏導",北區公園南路和海安路交叉口,23.0031959,120.199975
UN201609240122,"2016-09-24 11:44:00",永康區,髒亂及汙染,空氣汙染,"永康區環工路25號  空污",臺南市永康區環工路25號,23.047223,120.274324
UN201609240128,"2016-09-24 11:52:00",安平區,違規停車,違規停車,"安平區華平路658號 違規停車",臺南市華平路658號,22.995893,120.17588
UN201609240130,"2016-09-24 11:56:00",中西區,違規停車,違規停車,"中西區民族路二段76/95號 違規停車",臺南市民族路二段76號,22.994726,120.20925
UN201609240132,"2016-09-24 11:59:00",安平區,違規停車,違規停車,"安平區華平路650號 違規停車",臺南市華平路650號,22.995718,120.175901
UN201609240136,"2016-09-24 12:04:00",北區,道路維修,路樹傾倒,"北區東豐路241號  路樹傾倒",臺南市北區東豐路241號,23.003236,120.221316
UN201609240137,"2016-09-24 12:07:00",中西區,違規停車,違規停車,"中西區海安路一段保安路口 違規停車",700台灣台南市中西區海安路一段保安路,22.9907149,120.1953563
UN201609240138,"2016-09-24 12:07:00",安平區,違規停車,違規停車,"安平區華平路652號 違規停車",臺南市華平路652號,22.995755,120.175904
UN201609240140,"2016-09-24 12:10:00",安平區,騎樓舉發,騎樓舉發,"安平區華平路652號 騎樓舉發",臺南市華平路652號,22.995755,120.175904
UN201609240142,"2016-09-24 12:14:00",安平區,違規停車,違規停車,"安平區華平路648號 違規停車",臺南市華平路648號,22.995683,120.175899
UN201609240143,"2016-09-24 12:11:00",南區,違規停車,違規停車,"南區金華路一段484巷99弄84號 紅線違停",臺南市南區金華路一段484巷99弄84號,22.973073,120.193635
UN201609240151,"2016-09-24 12:24:00",中西區,違規停車,違規停車,"中西區友愛街92號前面 違規停車",臺南市中西區友愛街92號,22.991599,120.199293
UN201609240156,"2016-09-24 12:30:00",中西區,違規停車,違規停車,"台南市中西區南門路46號  違規停車",臺南市中西區南門路46號,22.985518,120.204013
UN201609240157,"2016-09-24 12:33:00",中西區,違規停車,違規停車,"台南市中西區南門路185-4號 違規停車",臺南市中西區南門路185-4號,22.98575,120.204326
UN201609240161,"2016-09-24 12:37:00",安平區,違規停車,違規停車,"安平區華平路652號 違規停車",臺南市華平路652號,22.995755,120.175904
UN201609240162,"2016-09-24 12:39:00",安平區,違規停車,違規停車,"安平區華平路652號 違規停車",臺南市華平路652號,22.995755,120.175904
UN201609240170,"2016-09-24 12:53:00",佳里區,違規停車,違規停車,"佳里區六合街26號 違規停車",臺南市佳里區六合街26號,23.165808,120.179504
UN201609240171,"2016-09-24 12:55:00",佳里區,違規停車,違規停車,"佳里區忠孝東路53號 違規停車",722台灣台南市佳里區忠孝東路53號,23.164904912805252,120.17945976415308
UN201609240172,"2016-09-24 12:57:00",佳里區,違規停車,違規停車,"佳里區林園街74-84號 違規停車",臺南市佳里區林園街74-84號,23.165397,120.179157
UN201609240190,"2016-09-24 13:45:00",永康區,違規停車,違規停車,"永康區南台街56號 違規停車",臺南市永康區南台街56號,23.022532,120.222722
UN201609240202,"2016-09-24 14:16:00",中西區,髒亂及汙染,空氣汙染,"中西區民權路一段110號，東嶽殿 空氣污染",臺南市中西區民權路一段110號,22.990453,120.209432
UN201609240208,"2016-09-24 14:25:00",安平區,違規停車,違規停車,"安平區華平路656號 違規停車",臺南市華平路656號,22.995837,120.175938
UN201609240211,"2016-09-24 14:44:00",安平區,違規停車,違規停車,"安平區華平路595號 違規停車",臺南市華平路595號,22.995766,120.175603
UN201609240214,"2016-09-24 14:48:00",中西區,違規停車,違規停車,"中西區民族路二段76號 違規停車",臺南市民族路二段76號,22.994726,120.20925
UN201609240217,"2016-09-24 14:52:00",北區,違規停車,違規停車,"北區成功路2號 違規停車",臺南市北區成功路2號,22.997791,120.211428
UN201609240222,"2016-09-24 15:00:00",中西區,違規停車,違規停車,"中西區中山路2號到100號  中西區中山路11號到117號  違規停車",臺南市中山路2號,23.234637,120.26121
UN201609240231,"2016-09-24 15:04:00",中西區,違規停車,違規停車,"中西區南門路(民生綠園圓環到健康路口) 違規停車",南門路,22.9839852,120.2040603
UN201609240232,"2016-09-24 15:04:00",中西區,違規停車,違規停車,"中西區開山路(民生綠園圓環到大同路口) 違規停車",開山路,22.9884387,120.2080123
UN201609240240,"2016-09-24 15:31:00",東區,違規停車,違規停車,"東區崇德路283號 違規停車",臺南市崇德路283號,22.977909,120.222222
UN201609240248,"2016-09-24 15:56:00",北區,違規停車,違規停車,"北區海安路三段580號～600號 佔用人行道",臺南市北區海安路三段580號,23.012236,120.200782
UN201609240258,"2016-09-24 16:36:00",中西區,違規停車,違規停車,"中西區國華街二段沿線兩側(中正路到友愛街) 違規停車",中西區國華街二段沿線兩側,22.992695292395865,120.1972994953394
UN201609240261,"2016-09-24 16:44:00",安平區,違規停車,違規停車,"安平區建平路686號 違規停車",臺南市安平區建平路686號,22.99631,120.184246
UN201609240265,"2016-09-24 16:51:00",安平區,違規停車,違規停車,"安平區華平路656號 違規停車",臺南市華平路656號,22.995837,120.175938
UN201609240274,"2016-09-24 16:59:00",安平區,違規停車,違規停車,"安平區安平路422號  違規停車",台南市安平區安平路422號,22.9980996,120.1741423
UN201609240275,"2016-09-24 17:00:00",麻豆區,違規停車,違規停車,"麻豆區興國路42-15號 違規停車",麻豆區興國路42-15號,23.1798735,120.2477297
UN201609240279,"2016-09-24 17:03:00",安平區,違規停車,違規停車,"安平區安平路378號～408-1號 違規停車",臺南市安平區安平路378號,22.998306,120.175534
UN201609240283,"2016-09-24 17:07:00",中西區,違規停車,違規停車,"中西區府前路二段34號 違規停車",臺南市中西區府前路二段34號,22.990844,120.196744
UN201609240293,"2016-09-24 17:23:00",安平區,騎樓舉發,騎樓舉發,"安平區華平路656號 騎樓舉發",臺南市華平路656號,22.995837,120.175938
UN201609240296,"2016-09-24 17:30:00",中西區,違規停車,違規停車,"中西區民族路二段76/95號 違規停車",臺南市民族路二段76號,22.994726,120.20925
UN201609240297,"2016-09-24 17:32:00",北區,違規停車,違規停車,"北區公園南路19號～83號前 違規停車",台南市公園南路19號,23.0000193,120.2120644
UN201609240298,"2016-09-24 17:33:00",安平區,違規停車,違規停車,"安平區華平路650 違規停車",臺南市華平路650號,22.995718,120.175901
UN201609240303,"2016-09-24 17:40:00",新營區,噪音舉發,妨害安寧,"新營區南紙街162巷52號 工程噪音",臺南市新營區南紙街162巷52號,23.29669,120.294751
UN201609240304,"2016-09-24 17:45:00",安平區,違規停車,違規停車,"安平區華平路652 違規停車",臺南市華平路652號,22.995755,120.175904
UN201609240308,"2016-09-24 17:52:00",安平區,違規停車,違規停車,"安平區華平路650號 違規停車",臺南市華平路650號,22.995718,120.175901
UN201609240311,"2016-09-24 17:56:00",東區,違規停車,違規停車,"東區裕忠一街96號 違規停車",臺南市東區裕忠一街96號,22.981167,120.24381
UN201609240313,"2016-09-24 17:58:00",安平區,違規停車,違規停車,"安平區華平路648號 違規停車",臺南市華平路648號,22.995683,120.175899
UN201609240315,"2016-09-24 18:02:00",南區,違規停車,違規停車,"南區健康路一段179號前方  違停",臺南市南區健康路一段179號,22.98117,120.207882
UN201609240317,"2016-09-24 18:06:00",永康區,違規停車,違規停車,"永康區南台街2號  違規停車",臺南市永康區南台街2號,23.022382,120.224461
UN201609240318,"2016-09-24 18:06:00",中西區,違規停車,違規停車,"中西區台南火車站圓環公車南站後方  違規停車",中西區台南火車站圓環公車南站後方,22.996924520095426,120.21132845431566
UN201609240319,"2016-09-24 18:07:00",永康區,違規停車,違規停車,"永康區南台街2號   違規停車",臺南市永康區南台街2號,23.022382,120.224461
UN201609240326,"2016-09-24 18:18:00",永康區,民生管線,停電、漏電、電線掉落、孔蓋鬆動,"永康區忠孝路6巷15弄1號 電線垂落",臺南市永康區忠孝路6巷15弄1號,23.000916,120.240814
UN201609240327,"2016-09-24 18:21:00",北區,騎樓舉發,騎樓舉發,騎樓舉發,臺南市台南市公園南路69號,23.00033,120.211075
UN201609240328,"2016-09-24 18:23:00",南區,路燈故障,9盞以下路燈故障,"南區中華南路二段315巷6弄10號前 路燈故障",臺南市南區中華南路二段315巷6弄10號,22.961031,120.184737
UN201609240330,"2016-09-24 18:25:00",中西區,違規停車,違規停車,"中西區西門路２段387號  違規停車",臺南市中西區西門路2段387號,22.998515,120.200417
UN201609240331,"2016-09-24 18:25:00",北區,騎樓舉發,騎樓舉發,"北區公園南路65號前   騎樓舉發",臺南市北區公園南路65號,23.000275,120.211254
UN201609240333,"2016-09-24 18:27:00",北區,路燈故障,9盞以下路燈故障,"北區文成里立賢路二段66巷23號前 路燈故障",臺南市北區文成里立賢路二段66巷23號,23.01013,120.198781
UN201609240336,"2016-09-24 18:34:00",安平區,違規停車,違規停車,安平區華平路652號違規停車,臺南市安平區華平路652號,22.995755,120.175904
UN201609240348,"2016-09-24 18:51:00",東區,違規停車,違規停車,"東區裕農路878號  違規停車",臺南市東區裕農路878號,22.989479,120.242722
UN201609240353,"2016-09-24 18:59:00",安平區,違規停車,違規停車,"安平區華平路656號 違規停車",臺南市安平區華平路656號,22.995837,120.175938
UN201609240355,"2016-09-24 18:51:00",安平區,噪音舉發,妨害安寧,"安平區安平路183號  妨礙安寧",臺南市安平區安平路183號,23.000094,120.160815
UN201609240359,"2016-09-24 19:08:00",中西區,髒亂及汙染,道路散落物,"中西區金華路三段74號 道路散落物",臺南市中西區金華路三段74號,22.990221,120.192648
UN201609240365,"2016-09-24 19:22:00",東區,路燈故障,9盞以下路燈故障,"東區仁和路39-10號 路燈故障",臺南市東區仁和路39-10號,22.977459,120.230324
UN201609240366,"2016-09-24 19:23:00",安南區,道路維修,路面下陷、凹陷,"安南區安富街251巷61號前方  路面凹陷",臺南市安南區安富街251巷61號,23.025546,120.195706
UN201609240369,"2016-09-24 19:31:00",中西區,違規停車,違規停車,"中西區民權路跟中山路  違規停車",中西區民權路中山路,22.9936552,120.2066738
UN201609240371,"2016-09-24 19:32:00",中西區,交通運輸,佔用道路,"中西區民族路二段202號 佔用道路",臺南市中西區民族路二段202號,22.996748,120.203113
UN201609240372,"2016-09-24 19:33:00",安平區,違規停車,違規停車,"安平區華平路658號/656號  違規停車",臺南市安平區華平路658號,22.995893,120.17588
UN201609240374,"2016-09-24 19:35:00",北區,交通運輸,交通疏導,"北區公園北路兵工廠  交通疏導",北區公園北路兵工廠,23.0048026,120.2095267
UN201609240383,"2016-09-24 20:05:00",安平區,違規停車,違規停車,"安平區華平路658號  違規停車",安平區華平路658號,22.9959066,120.1757814
UN201609240384,"2016-09-24 20:00:00",南區,違規停車,違規停車,"南區健康路二段357號跟惠南街口 違停",臺南市南區健康路二段357號,22.981692,120.187603
UN201609240386,"2016-09-24 20:10:00",中西區,違規停車,違規停車,"中西區民族路二段  民族路二段121至133號  違規停車","臺南市中西區民族路二段  民族路二段121至133號",22.994878,120.207797
UN201609240390,"2016-09-24 20:17:00",南區,髒亂及汙染,空氣汙染,"南區金華路二段76號 油煙空氣汙染",南區金華路二段76號,22.9775693,120.1912587
UN201609240398,"2016-09-24 20:45:00",北區,騎樓舉發,騎樓舉發,"北區公園南路69號前   騎樓舉發",臺南市北區公園南路69號,23.00033,120.211075
UN201609240400,"2016-09-24 20:50:00",東區,違規停車,違規停車,"東區長榮路二段180號  違規停車",臺南市東區長榮路二段180號,22.990222,120.220767
UN201609240404,"2016-09-24 20:58:00",東區,違規停車,違規停車,"東區勝利路85-1號對面 交通疏導",東區勝利路85-1號對面,22.9918065,120.217496
UN201609240406,"2016-09-24 21:02:00",中西區,違規停車,違規停車,"中西區金華路四段17號周圍 違停",中西區金華路四段17號,22.9971948,120.1941781
UN201609240409,"2016-09-24 21:25:00",北區,違規停車,違規停車,"北區立賢路一段563號對面 紅線違停",北區立賢路一段563號對面,23.0095995,120.2012714
