UN201609220037,"2016-09-22 08:22:00","北 區",違規停車,違規停車,"北區開元路成大城周圍/北區開元路485巷沿線兩側(桂花鄉大樓到開元路)  違規停車",北區開元路成大城周圍/北區開元路485巷沿線兩側(桂花鄉大樓到開元路),23.010774521565487,120.225460678339
UN201609220041,"2016-09-22 08:25:00",歸仁區,道路維修,人孔蓋或溝蓋聲響鬆動,"歸仁區民權南路339號 人孔蓋或溝蓋聲響鬆動",臺南市歸仁區民權南路339號,22.961384,120.287705
UN201609220051,"2016-09-22 08:59:00",東區,髒亂及汙染,道路散落物,"東區東寧路269號 道路散落物",臺南市東區東寧路269號,22.990469,120.227399
UN201609220053,"2016-09-22 09:02:00",仁德區,路燈故障,9盞以下路燈故障,"仁德區保華路129巷27號  路燈",臺南市仁德區保華路129巷27號,22.959102,120.230695
UN201609220056,"2016-09-22 09:05:00",永康區,違規停車,違規停車,"永康區中華二路206巷66號 違規停車",臺南市永康區中華二路206巷66號,23.010429,120.235184
UN201609220057,"2016-09-22 09:02:00",楠西區,路燈故障,9盞以下路燈故障,"楠西區灣丘里2鄰19號 路燈不亮",臺南市楠西區灣丘里2鄰19號,23.178707,120.507772
UN201609220060,"2016-09-22 09:08:00",中西區,違規停車,違規停車,"中西區城隍街60號 違規停車",臺南市城隍街60號,22.990104,120.208467
UN201609220061,"2016-09-22 09:08:00",安南區,路燈故障,9盞以下路燈故障,"安南區安中路六段1巷256號-10  路燈",臺南市安南區安中路六段1巷256號,23.054963,120.134467
UN201609220066,"2016-09-22 09:19:00",東區,騎樓舉發,騎樓舉發,"東區自由路一段165號 騎樓舉發",東區自由路一段165號,22.9683415,120.2364344
UN201609220076,"2016-09-22 09:30:00",永康區,噪音舉發,妨害安寧,"永康區大灣路942巷374弄17號 妨害安寧",臺南市台南市大灣路942巷374弄17號,23.008661,120.258603
UN201609220086,"2016-09-22 09:54:00",永康區,路燈故障,9盞以下路燈故障,"永康區忠孝路152巷57弄52號  路燈",臺南市永康區忠孝路152巷57弄52號,23.007343,120.243595
UN201609220100,"2016-09-22 10:20:00",中西區,噪音舉發,妨害安寧,"中西區文和街8-2號附近 噪音舉發",台南市中西區文和街8-2號,23.0045031,120.193291
UN201609220102,"2016-09-22 10:20:00",歸仁區,交通運輸,號誌故障,"歸仁區中正北路二段106號門口 紅綠燈故障",臺南市歸仁區中正北路二段106號,22.98093,120.293831
UN201609220116,"2016-09-22 10:39:00",永康區,違規停車,違規停車,"永康區中正六街，台南應用科大周圍 違規停車",永康區中正六街,23.04000336175707,120.24003110826014
UN201609220117,"2016-09-22 10:37:00",中西區,噪音舉發,場所連續噪音,"中西區湖美三街 場所連續噪音",中西區湖美三街,23.0017881,120.1826255
UN201609220122,"2016-09-22 10:32:00",中西區,路燈故障,9盞以下路燈故障,"中西區忠明街49號對面門口  路燈不亮",臺南市中西區忠明街49號,22.996354,120.195909
UN201609220123,"2016-09-22 10:49:00",東區,違規停車,違規停車,"東區中華東路二段355號 違停",臺南市東區中華東路二段355號,22.981198,120.229695
UN201609220145,"2016-09-22 11:16:00",北區,違規停車,違規停車,"北區公園南路161號  違規停車",臺南市北區公園南路161號,23.001482,120.206566
UN201609220154,"2016-09-22 11:17:00",安南區,髒亂及汙染,空氣汙染,安南區安和路3段190巷75-48號空氣汙染,臺南市安南區安和路3段190巷75-48號,23.046961,120.220772
UN201609220163,"2016-09-22 11:32:00",北區,路燈故障,9盞以下路燈故障,"北區南園街127巷106弄82號門口右側  路燈不亮",北區南園街127巷106弄82號門口右側,23.0081761,120.2249846
UN201609220165,"2016-09-22 11:29:00",安南區,髒亂及汙染,道路散落物,"安南區土城聖母廟附近，城北路和台江大道五段交叉口 魚",安南區城北路台江大道五段,23.0656628,120.1399054
UN201609220167,"2016-09-22 11:37:00",安南區,噪音舉發,場所連續噪音,"安南區府安路七段75巷26號  場所連續噪音",臺南市安南區府安路七段75巷26號,23.01308,120.178848
UN201609220169,"2016-09-22 11:39:00",安南區,道路維修,路面坑洞,"安南區本田路三段387-10號  坑洞",臺南市安南區本田路三段387-10號,23.046348,120.166968
UN201609220177,"2016-09-22 11:54:00",七股區,交通運輸,佔用道路,"七股區永吉里51之46號 雜物佔用車道",臺南市七股區永吉里51之46號,23.09369,120.127235
UN201609220181,"2016-09-22 11:56:00",安平區,違規停車,違規停車,"安平區華平路656號 違規停車",臺南市華平路656號,22.995837,120.175938
UN201609220182,"2016-09-22 11:55:00",中西區,違規停車,違規停車,"中西區西門路二段307巷  違停",中西區西門路二段307巷,22.9971498,120.1990825
UN201609220183,"2016-09-22 11:59:00",中西區,違規停車,違規停車,"東區北門路一段123巷民族路口 違規停車",701台灣台南市東區北門路一段123巷民族路口,22.99722296529799,120.21296594291925
UN201609220184,"2016-09-22 12:00:00",中西區,違規停車,違規停車,"中西區中山路164巷 違規停車",700台灣台南市中西區中山路164巷,22.99526562186111,120.21026495844126
UN201609220188,"2016-09-22 12:02:00",永康區,路燈故障,9盞以下路燈故障,"永康區忠孝路146號 路燈故障",臺南市永康區忠孝路146號,23.005362,120.240082
UN201609220196,"2016-09-22 12:05:00",永康區,騎樓舉發,騎樓舉發,"永康區小東路513號台灣銀行前 騎樓舉發",永康區小東路513號,22.9987661,120.236238
UN201609220199,"2016-09-22 12:22:00",北區,違規停車,違規停車,北區開元橋河堤邊的單向道，由崑山中學旁到南園街，違停,北區開元橋,23.0111749,120.2260566
UN201609220201,"2016-09-22 12:27:00",中西區,違規停車,違規停車,"中西區海安路和保安路轉角處 紅線違停",中西區海安路保安路,22.9904972,120.1954962
UN201609220202,"2016-09-22 12:30:00",安平區,騎樓舉發,騎樓舉發,"安平區華平路656號 佔用騎樓",臺南市華平路656號,22.995837,120.175938
UN201609220208,"2016-09-22 12:41:00",中西區,違規停車,違規停車,"中西區民族路二段76之6號  違規停車",臺南市中西區民族路二段76之6號,22.994726,120.20925
UN201609220209,"2016-09-22 12:32:00",中西區,髒亂及汙染,空氣汙染,"中西區民權路一段110號 東獄殿  空污",臺南市中西區民權路一段110號,22.990453,120.209432
UN201609220211,"2016-09-22 12:43:00",中西區,違規停車,違規停車,"中西區民族路二段  違規停車",中西區民族路二段,22.9957239,120.2057375
UN201609220213,"2016-09-22 12:45:00",中西區,違規停車,違規停車,"中西區民族路三段274號  違規停車",中西區民族路三段274號,23.0003506,120.1926735
UN201609220214,"2016-09-22 12:45:00",永康區,違規停車,違規停車,"永康區中正路沿線兩側(中正六街到新行街)   違規停車",永康區中正路,23.039309472037576,120.23939710110426
UN201609220215,"2016-09-22 12:46:00",安平區,違規停車,違規停車,"安平區華平路648號 違規停車",臺南市華平路648號,22.995683,120.175899
UN201609220216,"2016-09-22 12:47:00",中西區,違規停車,違規停車,"中西區海安路一段135號 違停",臺南市中西區海安路一段135號,22.990866,120.195266
UN201609220217,"2016-09-22 12:47:00",永康區,髒亂及汙染,空氣汙染,"永康區忠孝路239巷28弄2號，阿吉小吃店 油煙味",臺南市永康區忠孝路239巷28弄2號,23.005057,120.23919
UN201609220220,"2016-09-22 12:52:00",中西區,違規停車,違規停車,"中西區保安路102號 違規停車",臺南市中西區保安路102號,22.990671,120.195097
UN201609220228,"2016-09-22 12:59:00",中西區,違規停車,違規停車,"台南市中西區西門路二段120號  違規停車",臺南市中西區西門路二段120號,22.993599,120.19905
UN201609220231,"2016-09-22 13:07:00",仁德區,交通運輸,號誌秒差調整,"仁德區中山路文忠路  號誌",仁德區中山路文忠路,22.9749411,120.2391494
UN201609220236,"2016-09-22 13:22:00",安南區,民生管線,停電、漏電、電線掉落、孔蓋鬆動,"安南區公學路六段469巷52弄13號前  電線垂落",臺南市安南區公學路六段469巷52弄13號,23.077154,120.1468
UN201609220237,"2016-09-22 13:23:00",中西區,違規停車,違規停車,"700台南市中西區民族路二段205-235號 違規停車",臺南市中西區民族路二段205號,22.995651,120.205542
UN201609220244,"2016-09-22 13:28:00",中西區,違規停車,違規停車,"台南市中西區公園路59-79號  違規停車",臺南市中西區公園路79號,22.99535,120.205509
UN201609220246,"2016-09-22 13:30:00",歸仁區,道路維修,路面坑洞,"歸仁區南丁路359巷211號前 道路坑洞",臺南市歸仁區南丁路359巷211號,22.982736,120.274086
UN201609220251,"2016-09-22 13:36:00",安平區,違規停車,違規停車,"安平區華平路652號  違規停車",臺南市華平路652號,22.995755,120.175904
UN201609220257,"2016-09-22 13:40:00",北區,違規停車,違規停車,"台南市北區公園路856號  違規停車",臺南市北區公園路856號,23.013763,120.212463
UN201609220280,"2016-09-22 14:27:00",東區,違規停車,違規停車,"東區崇學路230巷129號對面 佔用道路",臺南市東區崇學路230巷129號,22.979815,120.225615
UN201609220284,"2016-09-22 14:38:00",歸仁區,民生管線,電信孔蓋鬆動、電信線路掉落、電信桿傾倒,"歸仁區六甲路384號 孔蓋不平",臺南市歸仁區六甲路384號,22.953173,120.273027
UN201609220298,"2016-09-22 14:48:00",楠西區,違規停車,違規停車,"楠西區照興里興南29-8號  路燈不亮",臺南市楠西區照興里興南29-8號,23.176005,120.471134
UN201609220318,"2016-09-22 15:44:00",北區,違規停車,違規停車,"北區西門路三段159號 違規停車",741台灣台南市北區西門路三段159號,23.133284829999994,120.29215973999996
UN201609220331,"2016-09-22 16:10:00",中西區,違規停車,違規停車,"中西區中山路86號  違規停車",臺南市中山路86號,23.235186,120.26297
UN201609220335,"2016-09-22 16:15:00",永康區,違規停車,違規停車,"永康區柴頭港溪防汛道路沿線(勝華街到中山南路)  違規停車",永康區柴頭港溪防汛道路沿線(勝華街到中山南路),23.009970619657498,120.22942028939725
UN201609220337,"2016-09-22 16:16:00",永康區,違規停車,違規停車,"永康區忠勇街65巷1號對面(精忠新城周圍)  違規停車",永康區忠勇街65巷1號對面(精忠新城周圍),23.00154185954538,120.23797821253538
UN201609220340,"2016-09-22 16:20:00",中西區,違規停車,違規停車,"中西區民族路二段76號 違規停車",臺南市民族路二段76號,22.994726,120.20925
UN201609220341,"2016-09-22 16:19:00",安南區,路燈故障,9盞以下路燈故障,"安南區長和路二段12巷28-21號 9盞以下路燈故障",臺南市安南區長和路二段12巷28-21號,23.064831,120.224566
UN201609220344,"2016-09-22 16:37:00",安平區,違規停車,違規停車,"安平區華平路656號  違規停車",安平區華平路656號,22.9958683,120.1757755
UN201609220350,"2016-09-22 16:58:00","北 區",違規停車,違規停車,"北區開元路485巷32號周邊  違規停車",北區開元路485巷32號周邊,23.011089600430825,120.22447161376476
UN201609220355,"2016-09-22 17:13:00",永康區,髒亂及汙染,空氣汙染,"永康區中正七街31號 油煙空氣汙染/食安",臺南市永康區中正七街31號,23.040156,120.240088
UN201609220362,"2016-09-22 17:30:00",中西區,違規停車,違規停車,"中西區中山路125號  中西區西華南街   違規停車","中西區中山路125號  中西區西華南街",22.995698326212068,120.20971778780222
UN201609220364,"2016-09-22 17:33:00",安南區,道路維修,路樹傾倒,"安南區安中路四段 加油站斜對面    路樹倒塌","安南區安中路四段 加油站斜對面",23.0513301,120.1657818
UN201609220373,"2016-09-22 17:55:00",中西區,違規停車,違規停車,"中西區台南火車站圓環公車北站.公車南站   違規停車",中西區台南火車站圓環公車北站.公車南站,22.996924520095426,120.2112503349781
UN201609220374,"2016-09-22 17:57:00",安平區,騎樓舉發,騎樓舉發,"安平區華平路656號  騎樓舉發",安平區華平路656號,22.9958683,120.1757755
UN201609220375,"2016-09-22 18:03:00",安平區,違規停車,違規停車,"安平區華平路658號 違規停車",臺南市華平路658號,22.995893,120.17588
UN201609220378,"2016-09-22 18:06:00",安平區,違規停車,違規停車,"安平區華平路658號 違規停車",臺南市華平路658號,22.995893,120.17588
UN201609220379,"2016-09-22 18:06:00",中西區,違規停車,違規停車,"中西區成功路149、151號 騎樓違停",臺南市中西區成功路149號,22.998019,120.206581
UN201609220385,"2016-09-22 18:14:00",安平區,路燈故障,9盞以下路燈故障,"安平區慶平路769號 路燈故障",臺南市安平區慶平路769號,22.997474,120.165525
UN201609220386,"2016-09-22 18:16:00",東區,路燈故障,9盞以下路燈故障,"東區崇德十九街24號對面 路燈故障",臺南市東區崇德十九街24號,22.968165,120.228402
UN201609220387,"2016-09-22 18:17:00",中西區,違規停車,違規停車,"中西區萬昌街107號 紅線違停",臺南市中西區萬昌街107號,22.992338,120.210298
UN201609220388,"2016-09-22 18:23:00",安平區,交通運輸,佔用道路,"安平區安北路16巷19號 交通運輸",安平區安北路16巷19號,22.999969741247934,120.168298445642
UN201609220390,"2016-09-22 18:29:00",中西區,違規停車,違規停車,"中西區民族路二段121、133號 違規停車",臺南市民族路二段121號,22.994805,120.20804
UN201609220391,"2016-09-22 18:29:00",東區,違規停車,違規停車,"東區大同路一段175巷132弄7號 違規停車",臺南市東區大同路一段175巷132弄7號,22.983016,120.213587
UN201609220394,"2016-09-22 18:33:00",中西區,違規停車,違規停車,"中西區民族路二段95號 違規停車",臺南市民族路二段95號,22.994481,120.209028
UN201609220396,"2016-09-22 18:37:00",安平區,違規停車,違規停車,"安平區華平路658號 違規停車",臺南市華平路658號,22.995893,120.17588
UN201609220402,"2016-09-22 18:50:00",安平區,違規停車,違規停車,"安平區華平路658號 違規停車",臺南市華平路658號,22.995893,120.17588
UN201609220405,"2016-09-22 19:02:00",東區,違規停車,違規停車,"東區裕農路和裕農路389巷交叉T字路口 違規停車",東區裕農路裕農路389巷,22.9876129,120.2308417
UN201609220407,"2016-09-22 19:08:00",安平區,違規停車,違規停車,"安平區華平路652號  違規停車",安平區華平路652號,22.9843573,120.1734174
UN201609220409,"2016-09-22 19:16:00",仁德區,路燈故障,9盞以下路燈故障,"仁德區義林路205號、及187或189號 路燈故障",臺南市仁德區義林路205號,22.968925,120.263457
UN201609220413,"2016-09-22 19:24:00",永康區,違規停車,違規停車,"永康區大灣三街102號 違規停車",台南市永康區大灣三街102號,23.0049488,120.2660028
UN201609220414,"2016-09-22 19:24:00",南區,路燈故障,9盞以下路燈故障,"南區中華南路二段315巷6弄10號 路燈故障",臺南市南區中華南路二段315巷6弄10號,22.961031,120.184737
UN201609220416,"2016-09-22 19:29:00",安平區,違規停車,違規停車,"安平區華平路656號 違規停車",安平區華平路656號,22.9958683,120.1757755
UN201609220417,"2016-09-22 19:29:00",中西區,違規停車,違規停車,"中西區民族路二段121至133號  違規停車",臺南市民族路二段121至133號,22.994878,120.207797
UN201609220419,"2016-09-22 19:31:00",中西區,違規停車,違規停車,"中西區民族路二段95號 違規停車",中西區民族路二段95號,22.9945453,120.2088953
UN201609220423,"2016-09-22 19:42:00",善化區,違規停車,違規停車,"善化區建國路190號 違停",善化區建國路190號,23.1323923,120.2967412
UN201609220424,"2016-09-22 19:45:00",東區,路燈故障,9盞以下路燈故障,"東區崇仁街1號^崇仁街77號、崇仁街53巷內   路燈不亮",臺南市東區崇仁街1號,22.984711,120.222591
UN201609220425,"2016-09-22 20:03:00",永康區,路燈故障,9盞以下路燈故障,"永康區正南三路76號 路燈故障",臺南市永康區正南三路76號,23.027798,120.235245
UN201609220426,"2016-09-22 20:11:00",北區,路燈故障,9盞以下路燈故障,"北區公園路1092巷27弄27號之1 路燈不亮",臺南市北區公園路1092巷27弄27號,23.019566,120.217223
UN201609220428,"2016-09-22 20:21:00",安平區,髒亂及汙染,空氣汙染,安平區民權路四段829號對面,臺南市安平區民權路四段829號,23.002032,120.166416
UN201609220431,"2016-09-22 20:38:00",中西區,違規停車,違規停車,"中西區西華南街68號旁邊 違規停車",臺南市西華南街68號,22.994221,120.209598
UN201609220433,"2016-09-22 20:43:00",東區,路燈故障,9盞以下路燈故障,"東區中華東路二段133巷31號 路燈故障",臺南市東區中華東路二段133巷31號,22.985227,120.234152
UN201609220434,"2016-09-22 20:50:00",麻豆區,動物救援,遊蕩犬隻捕捉管制,"麻豆區油車里自由路45號之25 捕狗",臺南市麻豆區油車里自由路45號,23.186092,120.243522
UN201609220435,"2016-09-22 20:55:00",東區,路燈故障,9盞以下路燈故障,"東區崇仁街1號到73號跟53巷 路燈故障",臺南市東區崇仁街1號,22.984711,120.222591
UN201609220436,"2016-09-22 21:04:00",東區,違規停車,違規停車,"東區勝利路242號  違規停車",臺南市東區勝利路242號,22.995949,120.218359
UN201609220438,"2016-09-22 21:08:00",東區,違規停車,違規停車,"東區長榮路二段180號 違規停車",臺南市東區長榮路二段180號,22.990222,120.220767
UN201609220441,"2016-09-22 21:15:00",東區,違規停車,違規停車,"東區長榮路二段180號  違規停車",東區長榮路二段180號,22.9901221,120.22073
UN201609220444,"2016-09-22 21:24:00",北區,騎樓舉發,騎樓舉發,"北區西門路四段169號對面 違停騎樓",臺南市北區西門路四段169號,23.010191,120.207936
UN201609220447,"2016-09-22 21:39:00",東區,違規停車,違規停車,"東區小東路從光明街口到東和路口 違規停車",東區小東路,23.0000536,120.2270729
UN201609220451,"2016-09-22 21:51:00",中西區,違規停車,違規停車,"中西區民族路二段 違規停車",中西區民族路二段,22.9957239,120.2057375
UN201609220453,"2016-09-22 21:54:00",中西區,違規停車,違規停車,"中西區中山路88號 違規停車",台南市中西區中山路88號,22.9941783,120.207816
UN201609220461,"2016-09-22 22:19:00",新營區,違規停車,違規停車,新營區民治路38號違規停車,730台灣台南市新營區民治路38號,23.310759377601645,120.31494137619632
UN201609220462,"2016-09-22 22:19:00",中西區,路燈故障,9盞以下路燈故障,"中西區南門路187巷24-1號/29-1號 路燈故障",臺南市中西區南門路187巷24-1號,22.985242,120.205546
UN201609220475,"2016-09-22 23:29:00",中西區,噪音舉發,妨害安寧,"中西區中成路18號、慈音街和觀亭街附近 廟會活動",臺南市中西區中成路18號,22.996721,120.20544
UN201609220478,"2016-09-22 23:51:00",安平區,噪音舉發,妨害安寧,"安平區同平路127巷16弄1號 妨害安寧",臺南市安平區同平路127巷16弄1號,22.995894,120.153713
UN201609230001,"2016-09-23 00:02:00",東區,違規停車,違規停車,東區中華東路三段336巷1號紅線違規停車,臺南市東區中華東路三段336巷1號,22.974417,120.220646
UN201609230002,"2016-09-23 00:03:00",安南區,噪音舉發,妨害安寧,"安南區府安路四段31號 連續噪音",臺南市安南區府安路四段31號,23.025477,120.213632
UN201609230007,"2016-09-23 03:45:00",永康區,噪音舉發,場所連續噪音,"永康區大武街18巷48號  施工噪音",臺南市永康區大武街18巷48號,23.018878,120.22348
UN201609230015,"2016-09-23 07:19:00",北區,違規停車,違規停車,"北區勝利路138號 違規停車",台南市北區勝利路138號,23.0021803,120.2189867
UN201609230016,"2016-09-23 07:24:00",北區,交通運輸,佔用道路,"北區公園路331號對面 攤販佔用道路",北區公園路331號對面,23.0136374,120.2613501
UN201609230017,"2016-09-23 07:29:00",南區,民生管線,漏水、停水、消防栓漏水或損壞,"南區中華南路二段300巷30弄9號前面 路面漏水",臺南市南區中華南路二段300巷30弄9號,22.962923,120.188297
UN201609230020,"2016-09-23 07:49:00",永康區,道路維修,路樹傾倒,"永康區中正路215號 路樹傾倒",臺南市永康區中正路215號,23.031134,120.249979
UN201609230021,"2016-09-23 07:54:00",永康區,違規停車,違規停車,"永康區中華西街85巷12弄39號 違規停車",臺南市永康區中華西街85巷12弄39號,23.014896,120.225602
UN201609230026,"2016-09-23 08:06:00",安平區,道路維修,路面坑洞,"安平區安北路149之1號   坑洞",安平區安北路149之1號,23.0027661,120.1613067
UN201609230029,"2016-09-23 08:11:00",中西區,違規停車,違規停車,"中西區衛民街106之53號 違規停車",臺南市衛民街106之53號,22.993346,120.208667
UN201609230030,"2016-09-23 08:13:00",中西區,違規停車,違規停車,"中西區中山路45號 違規停車",臺南市中山路45號,23.235138,120.262134
UN201609230032,"2016-09-23 08:15:00",安平區,民生管線,停電、漏電、電線掉落、孔蓋鬆動,"安平區建平十一街160號  電線桿傾斜",臺南市安平區建平十一街160號,22.994886,120.180658
UN201609230041,"2016-09-23 08:38:00",安平區,動物救援,犬貓急難救援,"安平區府平路420號  犬貓急難救援",臺南市安平區府平路420號,22.987283,120.166157
UN201609230043,"2016-09-23 08:42:00",永康區,動物救援,犬貓急難救援,"永康區大灣路37巷30弄21號  犬貓急難救援",臺南市永康區大灣路37巷30弄21號,23.011953,120.272636
UN201609230064,"2016-09-23 09:19:00",中西區,違規停車,違規停車,"台南市中西區西門路二段351號  違規停車",台南市中西區西門路二段351號,22.9979663,120.1995923
UN201609230090,"2016-09-23 09:51:00",南區,路燈故障,9盞以下路燈故障,"南區利南街143號  路燈故障",臺南市利南街143號,22.971535,120.188436
UN201609230093,"2016-09-23 09:54:00",中西區,噪音舉發,場所連續噪音,"中西區文和街10巷2號旁  妨害寧",臺南市文和街10巷2號,23.004533,120.193175
UN201609230122,"2016-09-23 10:47:00",中西區,違規停車,違規停車,"中西區中正路10號附近外面 違規停車",臺南市中正路10號,22.992342,120.203848
UN201609230125,"2016-09-23 10:53:00",中西區,違規停車,違規停車,"中西區青年路177號 違規停車",臺南市青年路177號,22.991856,120.210455
UN201609230127,"2016-09-23 10:59:00",中西區,違規停車,違規停車,"中西區開山路76号到80號  違規停車",臺南市中西區開山路76号到80號,22.990031,120.206704
UN201609230136,"2016-09-23 11:09:00",中西區,違規停車,違規停車,"中西區城隍街的60號與80號中間   違規停車",臺南市城隍街的60號,22.990104,120.208467
UN201609230140,"2016-09-23 11:14:00",中西區,違規停車,違規停車,"中西區永福路一段86號   違規停車",700台灣台南市中西區永福路一段86號,22.987964568296405,120.20039676508179
UN201609230150,"2016-09-23 11:25:00",北區,違規停車,違規停車,"北區臨安路二段17-37號  違規停車",臺南市北區臨安路二段17-37號,23.002563,120.1956
UN201609230160,"2016-09-23 11:34:00",中西區,違規停車,違規停車,"中西區府前路一段199號 違規停車",臺南市中西區府前路一段199號,22.989039,120.204109
UN201609230162,"2016-09-23 11:41:00",安平區,違規停車,違規停車,"安平區華平路652號  違規停車",臺南市安平區華平路652號,22.995755,120.175904
UN201609230166,"2016-09-23 11:45:00",東山區,路燈故障,9盞以下路燈故障,"東山區青山里81號 路燈故障",臺南市東山區青山里81號,23.271582,120.481107
UN201609230178,"2016-09-23 12:19:00",永康區,違規停車,違規停車,"永康區中正路545號周邊 違規停車",永康區中正路545號周邊,23.039783995495753,120.23893374949692
UN201609230182,"2016-09-23 12:26:00",北區,違規停車,違規停車,"北區西門路四段426號 違規停車",臺南市北區西門路四段426號,23.015481,120.210398
UN201609230184,"2016-09-23 12:27:00",永康區,違規停車,違規停車,"永康區中正路529號 違停",臺南市永康區中正路529號,23.039316,120.238472
UN201609230186,"2016-09-23 12:38:00",安平區,違規停車,違規停車,"安平區華平路658號 違規停車",臺南市安平區華平路658號,22.995893,120.17588
UN201609230187,"2016-09-23 12:47:00",中西區,違規停車,違規停車,"中西區府前路二段167-1號/西門路二段356號 紅線違規停車",台南市中西區府前路二段167-1號,22.9913342,120.1930978
UN201609230190,"2016-09-23 12:51:00",中西區,違規停車,違規停車,"中西區廣慈街 逆向違規停車",中西區廣慈街,22.996499409637281,120.20687829947508
UN201609230194,"2016-09-23 13:00:00",北區,違規停車,違規停車,"台南市北區西門路四段482號 違規停車",台南市北區西門路四段482號,23.016506,120.2111729
UN201609230199,"2016-09-23 13:05:00",永康區,違規停車,違規停車,"台南市永康區大橋二街24號 違規停車",台南市永康區大橋二街24號,23.0182494,120.2267518
UN201609230200,"2016-09-23 13:09:00",永康區,違規停車,違規停車,"台南市永康區大橋二街35號 違規停車",臺南市永康區大橋二街35號,23.01859,120.226968
