UN201609200192,"2016-09-20 14:12:00",永康區,道路維修,路面坑洞,"永康區永華路196號前面 路面坑洞",臺南市永康區永華路196號,23.008749,120.259719
UN201609200216,"2016-09-20 14:52:00",中西區,違規停車,違規停車,"中西區中正路357號 違規停車",臺南市中西區中正路357號,22.993405,120.193629
UN201609200220,"2016-09-20 14:53:00",北區,騎樓舉發,騎樓舉發,"北區成功路54號 騎樓舉發",北區成功路54號,22.9980911,120.2074545
UN201609200231,"2016-09-20 15:11:00",東區,交通運輸,號誌故障,"東區大同路二段379號隔壁 號誌電線垂落",臺南市東區大同路二段379號,22.972741,120.214999
UN201609200234,"2016-09-20 14:37:00",南區,路燈故障,9盞以下路燈故障,"南區新孝路126巷56弄3號前面 路燈故障不亮",臺南市南區新孝路126巷56弄3號,22.979165,120.187206
UN201609200246,"2016-09-20 15:33:00",安南區,道路維修,人孔蓋凹陷坑洞,"安南區府安路五段162巷66號跟18號    污水孔蓋下陷",臺南市安南區府安路五段162巷66號,23.024007,120.197611
UN201609200251,"2016-09-20 15:42:00",北區,路燈故障,9盞以下路燈故障,"北區文賢路875號 路燈故障",臺南市北區文賢路875號,23.017756,120.193031
UN201609200256,"2016-09-20 15:56:00",新營區,違規停車,違規停車,"新營區三民路72號 違規停車",730台灣台南市新營區三民路72號,23.307130840006046,120.31652989154054
UN201609200277,"2016-09-20 16:29:00",安南區,道路維修,路樹傾倒,"安南區安和路一段250號 路樹傾倒",臺南市安南區安和路一段250號,23.03139,120.212846
UN201609200287,"2016-09-20 16:49:00",永康區,民生管線,漏水、停水、消防栓漏水或損壞,"永康區復華三街90巷6號前 冒水",臺南市永康區復華三街90巷6號,23.00993,120.245092
UN201609200288,"2016-09-20 16:45:00",北區,道路維修,人孔蓋或溝蓋聲響鬆動,"北區邱碧瑩中醫診所（公園路778號）前 污水孔蓋聲響",臺南市北區公園路778號,23.01131,120.211164
UN201609200296,"2016-09-20 17:16:00",永康區,違規停車,違規停車,"永康區大灣路942巷114號 違停",臺南市永康區大灣路942巷114號,23.002819,120.256041
UN201609200297,"2016-09-20 17:22:00",永康區,道路維修,寬頻管線、孔蓋損壞,"永康區龍潭街26巷15號 水溝蓋鬆脫",臺南市永康區龍潭街26巷15號,23.029839,120.266199
UN201609200302,"2016-09-20 17:37:00",中西區,違規停車,違規停車,"700台南市中西區忠義路二段36號  違規停車",臺南市中西區忠義路二段36號,22.9926,120.203019
UN201609200309,"2016-09-20 17:58:00",永康區,違規停車,違規停車,"永康區中華二路379巷  紅線違停",永康區中華二路379巷,23.0084381,120.2315527
UN201609200312,"2016-09-20 17:29:00",東區,路燈故障,9盞以下路燈故障,"東區東寧路428巷2弄2號旁邊 路燈故障",臺南市東區東寧路428巷2弄2號,22.989393,120.228846
UN201609200317,"2016-09-20 18:13:00",南區,路燈故障,9盞以下路燈故障,"南區永成路二段833號  路燈",臺南市南區永成路二段833號,22.960393,120.195274
UN201609200318,"2016-09-20 18:18:00",東區,違規停車,違規停車,"701台灣台南市東區裕信路272號 違規停車",701台灣台南市東區裕信路272號,22.986990171689655,120.24848438903045
UN201609200322,"2016-09-20 18:30:00",南區,違規停車,違規停車,"南區永成路三段121巷41號至57號 違規停車",臺南市南區永成路三段121巷41號,22.965423,120.194297
UN201609200328,"2016-09-20 18:34:00",安南區,違規停車,違規停車,"安南區海佃路一段126號之10 汽車違停機車格",臺南市安南區海佃路一段126號,23.023313,120.19201
UN201609200331,"2016-09-20 18:45:00",中西區,違規停車,違規停車,"中西區民權路中山路 違規停車",中西區民權路中山路,22.9936552,120.2066738
UN201609200332,"2016-09-20 18:45:00",中西區,違規停車,違規停車,"中西區青年路北門路 違規停車",中西區青年路北門路,22.9915569,120.2115713
UN201609200336,"2016-09-20 18:47:00",永康區,髒亂及汙染,空氣汙染,"永康區王行路246巷17號 強力膠味",臺南市永康區王行路246巷17號,23.03442,120.274615
UN201609200337,"2016-09-20 18:47:00",中西區,違規停車,違規停車,"中西區中山路2號到100號 違規停車",臺南市中西區中山路2號,22.992715,120.205643
UN201609200338,"2016-09-20 18:58:00",北區,路燈故障,9盞以下路燈故障,"北區開元路333巷16弄23號 路燈故障",北區開元路333巷16弄23號,23.00953,120.221299
UN201609200348,"2016-09-20 19:19:00",中西區,噪音舉發,妨害安寧,"中西區府前路一段283號  妨害安寧",臺南市中西區府前路一段283號,22.989495,120.202016
UN201609200350,"2016-09-20 19:26:00",安平區,違規停車,違規停車,"安平區華平路652號  違規停車",臺南市華平路652號,22.995755,120.175904
UN201609200352,"2016-09-20 19:39:00",安南區,路燈故障,9盞以下路燈故障,"709台灣台南市安南區公學路三段132號  路燈故障",709台灣台南市安南區公學路三段132號,23.0688401,120.1864335
UN201609200356,"2016-09-20 19:45:00",山上區,路燈故障,9盞以下路燈故障,"743台灣台南市山上區南140鄉道42號  路燈故障",743台灣台南市山上區南140鄉道42號,23.1053748,120.3487189
UN201609200357,"2016-09-20 19:36:00",中西區,違規停車,違規停車,"中西區武英街17號 違規停車",臺南市中西區武英街17號,22.989105,120.191982
UN201609200359,"2016-09-20 19:59:00",中西區,違規停車,違規停車,"中西區友愛街92號  違停",臺南市中西區友愛街92號,22.991599,120.199293
UN201609200360,"2016-09-20 20:01:00",東區,噪音舉發,妨害安寧,"701台灣台南市東區東寧路西段群英堂 噪音舉發",701台灣台南市東區東寧路西段群英堂,22.992841712349005,120.21733348413090
UN201609200362,"2016-09-20 20:02:00",仁德區,路燈故障,9盞以下路燈故障,"仁德區義林路256巷22弄21號前 路燈故障",臺南市仁德區義林路256巷22弄21號,22.972118,120.266121
UN201609200367,"2016-09-20 20:47:00",安平區,違規停車,違規停車,"安平區華平路652之1號 違規停車",臺南市安平區華平路652之1號,22.995794,120.175906
UN201609200369,"2016-09-20 20:51:00",東區,違規停車,違規停車,"東區長榮路二段180號  違規停車",臺南市東區長榮路二段180號,22.990222,120.220767
UN201609200370,"2016-09-20 20:52:00",仁德區,動物救援,犬貓急難救援,"仁德區忠義路180號  犬貓救援",臺南市仁德區忠義路180號,22.976417,120.257537
UN201609200375,"2016-09-20 21:06:00",安平區,民生管線,漏水、停水、消防栓漏水或損壞,"安平區建平十七街 119號  漏水","臺南市安平區建平十七街 119號",22.997467,120.179914
UN201609200377,"2016-09-20 21:09:00",安平區,騎樓舉發,騎樓舉發,"安平區華平路656號  騎樓",臺南市安平區華平路656號,22.995837,120.175938
UN201609200385,"2016-09-20 21:37:00",永康區,路燈故障,9盞以下路燈故障,"永康區王行路866巷29弄120號   路燈故障",臺南市王行路866巷29弄120號,23.05137,120.277651
UN201609200388,"2016-09-20 21:47:00",東區,噪音舉發,妨害安寧,"東區崇學路135巷  妨害安寧",東區崇學路135巷,22.9796323,120.222001
UN201609200394,"2016-09-20 22:41:00",安平區,路燈故障,9盞以下路燈故障,"安平區世平路1號  路燈",臺南市安平區世平路1號,22.994424,120.151027
UN201609200395,"2016-09-20 22:49:00",南區,髒亂及汙染,空氣汙染,"南區金華路二段76號  空污",臺南市南區金華路二段76號,22.977567,120.191301
UN201609200396,"2016-09-20 22:58:00",下營區,動物救援,犬貓急難救援,"下營區裕農街29號  犬貓救援",臺南市下營區裕農街29號,23.233331,120.268074
UN201609210003,"2016-09-21 00:21:00",南區,違規停車,違規停車,"南區中華西路一段137巷53號與55號間巷口 違規停車",臺南市南區中華西路一段137巷53號,22.981615,120.183896
UN201609210004,"2016-09-21 00:31:00",北區,髒亂及汙染,道路散落物,"北區西門路四段339號  道路散落物",臺南市北區西門路四段339號,23.015064,120.209783
UN201609210005,"2016-09-21 01:09:00",歸仁區,路燈故障,9盞以下路燈故障,"歸仁區大廟一街216號 路燈故障",711台灣台南市歸仁區大廟一街216號,22.9920203,120.2750124
UN201609210010,"2016-09-21 02:26:00",安南區,路燈故障,9盞以下路燈故障,"安南區同安路跟安中路口 路燈故障",安南區同安路跟安中路口,23.0417216,120.1914992
UN201609210035,"2016-09-21 06:41:00",永康區,髒亂及汙染,空氣汙染,"永康區中山南路868號 黑烟空氣汙染",710台灣台南市永康區中山南路868號,23.0215584,120.2484335
UN201609210038,"2016-09-21 07:20:00",中西區,道路維修,路面坑洞,"中西區金華路四段126號 路面坑洞",臺南市中西區金華路四段126號,22.998913,120.195146
UN201609210073,"2016-09-21 07:59:00",北區,違規停車,違規停車,"北區西門路四段367號北安路 違規停車",臺南市北區西門路四段367號,23.016195,120.210289
UN201609210081,"2016-09-21 09:05:00",東區,違規停車,違規停車,"台南市東區東門路三段338巷51號 違規停車",臺南市東區東門路三段338巷51號,22.972309,120.23789
UN201609210082,"2016-09-21 09:09:00",安南區,道路維修,路面坑洞,"安南區安和路五段318號前面 路面坑洞",臺南市安南區安和路五段318號,23.068721,120.216552
UN201609210084,"2016-09-21 09:11:00","北 區",違規停車,違規停車,"北區開元路 違規停車",北區開元路,23.011023869053442,120.22589419037104
UN201609210086,"2016-09-21 09:12:00",永康區,違規停車,違規停車,"永康區忠勇街65巷1號 違規停車",永康區忠勇街65巷1號,23.001540625066262,120.23799799382687
UN201609210093,"2016-09-21 09:20:00",中西區,髒亂及汙染,空氣汙染,"中西區民權路一段110號  空氣汙染",中西區民權路一段110號,22.9905169,120.2092959
UN201609210094,"2016-09-21 09:23:00",歸仁區,道路維修,路樹傾倒,"歸仁區中山路二段51號前 路樹倒塌",臺南市歸仁區中山路二段51號,22.966778,120.292748
UN201609210096,"2016-09-21 09:20:00",中西區,違規停車,違規停車,"中西區健康路一段六號 違規停車",臺南市中西區健康路一段六號,22.981349,120.211738
UN201609210099,"2016-09-21 09:24:00",永康區,違規停車,違規停車,"永康區忠勇街 違規停車",永康區忠勇街,23.00055921059981,120.23801174014808
UN201609210106,"2016-09-21 09:26:00",永康區,交通運輸,佔用道路,"永康區永華路201巷32弄37號 佔用道路",臺南市永康區永華路201巷32弄37號,23.011028,120.25828
UN201609210107,"2016-09-21 09:28:00",永康區,噪音舉發,妨害安寧,"台南市永康區中山南路428號 妨害安寧",臺南市永康區中山南路428號,23.017212,120.238702
UN201609210108,"2016-09-21 09:31:00",永康區,違規停車,違規停車,"永康區忠勇街65巷23號 違規停車",永康區忠勇街65巷23號,23.001544945743102,120.23711957037447
UN201609210124,"2016-09-21 10:06:00",南區,民生管線,停電、漏電、電線掉落、孔蓋鬆動,"南區國民路629巷1號  電線垂落",臺南市南區國民路629巷1號,22.974529,120.20413
UN201609210143,"2016-09-21 10:36:00",東區,違規停車,違規停車,"東區民族路一段228號 違規停車",701台灣台南市東區民族路一段228號,22.9944211,120.21189
UN201609210162,"2016-09-21 11:01:00",安平區,騎樓舉發,騎樓舉發,"安平區華平路656號  違規停車",臺南市華平路656號,22.995837,120.175938
UN201609210164,"2016-09-21 11:03:00",永康區,違規停車,違規停車,"永康區忠勇街65巷1號對面    違規停車",永康區忠勇街65巷1號,23.001547414701232,120.23802313953638
UN201609210166,"2016-09-21 11:09:00",佳里區,路燈故障,9盞以下路燈故障,"佳里區民安里同安寮路2之6號 路燈故障",臺南市佳里區民安里同安寮路2之6號,23.16273,120.187284
UN201609210167,"2016-09-21 11:11:00",歸仁區,違規停車,違規停車,"歸仁區歸仁大道100號  違規停車",臺南市歸仁區歸仁大道100號,22.924522,120.285509
UN201609210181,"2016-09-21 11:29:00",北區,違規停車,違規停車,"台南市北區東豐路173號  違規停車",臺南市北區東豐路173號,23.003549,120.219194
UN201609210189,"2016-09-21 11:47:00",中西區,違規停車,違規停車,"中西區慶中街60號 違規停車",臺南市中西區慶中街60號,22.982736,120.20557
UN201609210193,"2016-09-21 11:57:00",永康區,路燈故障,9盞以下路燈故障,"永康區中華二路60號至82號 路燈故障",臺南市永康區中華二路60號,23.008664,120.240404
UN201609210200,"2016-09-21 12:06:00",安平區,違規停車,違規停車,"安平區華平路648號 違規停車",臺南市華平路648號,22.995683,120.175899
UN201609210201,"2016-09-21 12:07:00",東區,路燈故障,9盞以下路燈故障,"東區德祥街5號  路燈",臺南市東區德祥街5號,22.964386,120.236094
UN201609210207,"2016-09-21 12:21:00",東區,違規停車,違規停車,"東區東興路36號 違規停車",臺南市東區東興路36號,22.990973,120.228904
UN201609210208,"2016-09-21 12:22:00",安平區,違規停車,違規停車,"安平區華平路648號 違規停車",臺南市華平路648號,22.995683,120.175899
UN201609210212,"2016-09-21 12:08:00",永康區,騎樓舉發,騎樓舉發,"永康區小東路513號  騎樓舉發",臺南市永康區小東路513號,22.998719,120.236233
UN201609210224,"2016-09-21 12:59:00",中西區,違規停車,違規停車,"中西區武英街17號19號 違規停車",臺南市中西區武英街17號,22.989105,120.191982
UN201609210230,"2016-09-21 13:25:00",安南區,髒亂及汙染,空氣汙染,"安南區開安路20號  空氣汙染",臺南市安南區開安路20號,23.04556,120.222437
UN201609210248,"2016-09-21 13:41:00",北區,違規停車,違規停車,"台南市北區西門路四段428號  違規停車",臺南市北區西門路四段428號,23.01553,120.210416
UN201609210250,"2016-09-21 13:43:00",安平區,違規停車,違規停車,"安平區華平路656號 違規停車",臺南市華平路656號,22.995837,120.175938
UN201609210252,"2016-09-21 13:46:00",北區,違規停車,違規停車,"台南市北區北安路一段95號 違規停車",臺南市北區北安路一段95號,23.016064,120.211017
UN201609210253,"2016-09-21 13:48:00",北區,違規停車,違規停車,"台南市北區西門路四段480號 違規停車",臺南市北區西門路四段480號,23.016325,120.210972
UN201609210257,"2016-09-21 13:49:00",北區,違規停車,違規停車,"台南市北區西門路四段482號 違規停車",臺南市北區西門路四段482號,23.016431,120.211049
UN201609210259,"2016-09-21 13:50:00",北區,違規停車,違規停車,"台南市北區西門路四段482號 違規停車",臺南市北區西門路四段482號,23.016431,120.211049
UN201609210263,"2016-09-21 13:52:00",北區,違規停車,違規停車,"台南市北區西門路四段480號 違規停車",臺南市北區西門路四段480號,23.016325,120.210972
UN201609210267,"2016-09-21 13:56:00",安平區,違規停車,違規停車,"安平區華平路656號 違規停車",安平區華平路656號,22.9958683,120.1757755
UN201609210268,"2016-09-21 13:56:00",北區,違規停車,違規停車,"704台南市北區公園路595之4號 違規停車",臺南市北區公園路595之4號,23.013465,120.211876
UN201609210269,"2016-09-21 13:57:00",北區,違規停車,違規停車,"北區公園路595-4號 違規停車",704台南市北區公園路595-4號,23.0134347,120.2116897
UN201609210270,"2016-09-21 13:58:00",安平區,違規停車,違規停車,"安平區華平路648號  違規停車",安平區華平路648號,22.9957579,120.1757586
UN201609210272,"2016-09-21 14:02:00",安平區,違規停車,違規停車,"安平區華平路656號 騎樓舉發",安平區華平路656號,22.9958683,120.1757755
UN201609210273,"2016-09-21 14:01:00",玉井區,噪音舉發,妨害安寧,"玉井區民族路136號  妨害安寧",玉井區民族路136號,23.1237916,120.4663041
UN201609210274,"2016-09-21 14:03:00",北區,違規停車,違規停車,"北區成功路14號 違規停車",北區成功路14號,22.9977363,120.2095456
UN201609210276,"2016-09-21 14:05:00",中西區,違規停車,違規停車,"中西區友愛街92號前 違停",中西區友愛街92號,22.9916852,120.1992381
UN201609210278,"2016-09-21 14:06:00",安南區,噪音舉發,場所連續噪音,"安南區環福街170巷11號 施工噪音",臺南市安南區環福街170巷11號,23.073765,120.22306
UN201609210293,"2016-09-21 14:30:00","北 區",違規停車,違規停車,"北區開元路 違規停車",北區開元路,23.01105349446693,120.22586669772863
UN201609210314,"2016-09-21 15:03:00",安平區,民生管線,漏水、停水、消防栓漏水或損壞,"安平區國勝路35巷8號 漏水",臺南市安平區國勝路35巷8號,23.001055,120.159623
UN201609210324,"2016-09-21 15:31:00",中西區,違規停車,違規停車,"中西區中山路125號，南方公園周圍 違規停車",中西區中山路125號,22.99558629233699,120.20946767181157
UN201609210325,"2016-09-21 15:32:00",中西區,違規停車,違規停車,"中西區青年路北門路 違規停車",中西區青年路北門路,22.99189745563567,120.2089500054717
UN201609210327,"2016-09-21 15:36:00",中西區,違規停車,違規停車,"中西區中山路166號，Focus百貨周圍 違規停車",中西區中山路166號,22.9956730182925,120.21009899675846
UN201609210337,"2016-09-21 15:56:00",中西區,違規停車,違規停車,中西區西華南街沿線(成功路到中山路)，違規停車,中西區西華南街,22.995911591541045,120.20981937646867
UN201609210339,"2016-09-21 15:58:00",中西區,髒亂及汙染,空氣汙染,"中西區武英街17號   空汙",中西區武英街17號,22.9890991,120.1919899
UN201609210344,"2016-09-21 16:10:00",歸仁區,違規停車,違規停車,"台南市歸仁區歸仁大道100號 違規停車",臺南市歸仁區歸仁大道100號,22.924522,120.285509
UN201609210345,"2016-09-21 16:11:00",中西區,違規停車,違規停車,"中西區台南火車站前站圓環 違規停車",中西區台南火車站前站圓環,22.996909088577876,120.21135192364453
UN201609210357,"2016-09-21 16:32:00",永康區,民生管線,停電、漏電、電線掉落、孔蓋鬆動,"永康區復興路356巷11號  電線",臺南市永康區復興路356巷11號,22.999074,120.24136
UN201609210369,"2016-09-21 16:48:00",中西區,違規停車,違規停車,"中西區西門路二段309號  違規停車",臺南市中西區西門路二段309號,22.997015,120.199758
UN201609210372,"2016-09-21 16:39:00",中西區,髒亂及汙染,空氣汙染,"中西區中山路177巷2-1號  空氣汙染",臺南市中西區中山路177巷2-1號,22.99645,120.210487
UN201609210375,"2016-09-21 16:56:00",安南區,動物救援,犬貓急難救援,"安南區海佃路四段55巷18弄19號 動物救援",安南區海佃路四段55巷18弄19號,23.0550971,120.1764387
UN201609210380,"2016-09-21 17:10:00",安平區,違規停車,違規停車,"安平區華平路652號 違規停車",臺南市華平路652號,22.995755,120.175904
UN201609210398,"2016-09-21 17:45:00",永康區,違規停車,違規停車,"永康區大灣路942巷114號前方  違停",臺南市永康區大灣路942巷114號,23.002819,120.256041
UN201609210401,"2016-09-21 17:49:00",佳里區,髒亂及汙染,空氣汙染,"佳里區營頂里89號附近  空污",臺南市佳里區營頂里89號,23.199423,120.190122
UN201609210402,"2016-09-21 17:52:00",安平區,違規停車,違規停車,"安平區華平路658號 違規停車",臺南市華平路658號,22.995893,120.17588
UN201609210403,"2016-09-21 17:52:00",中西區,路燈故障,9盞以下路燈故障,"中西區西門路一段482巷6號 路燈不亮",臺南市中西區西門路一段482巷6號,22.983388,120.198146
UN201609210429,"2016-09-21 18:52:00",中西區,違規停車,違規停車,"中西區府前路一段3號  違規停車",臺南市府前路一段3號,22.988391,120.211188
UN201609210431,"2016-09-21 18:56:00",南區,髒亂及汙染,空氣汙染,"南區明興路1181巷156號 燒廢電纜",臺南市南區明興路1181巷156號,22.925712,120.189762
UN201609210432,"2016-09-21 18:57:00",東區,民生管線,電信孔蓋鬆動、電信線路掉落、電信桿傾倒,"東區裕信路328號  電信孔蓋鬆動",臺南市東區裕信路328號,22.981427,120.244949
UN201609210433,"2016-09-21 19:01:00",中西區,路燈故障,9盞以下路燈故障,"中西區樹林街二段71號2樓 路燈不亮",臺南市中西區樹林街二段71號,22.985626,120.205399
UN201609210434,"2016-09-21 19:07:00",東區,違規停車,違規停車,"東區東安路凱旋路口   違規停車",東區東安路凱旋路口,22.9935114,120.2266632
UN201609210437,"2016-09-21 19:20:00",安平區,違規停車,違規停車,"安平區華平路652號  違規停車",安平區華平路652號,22.9957715,120.1759172
UN201609210439,"2016-09-21 19:21:00",安平區,違規停車,違規停車,"安平區華平路658號  違規停車",安平區華平路658號,22.9959066,120.1757814
UN201609210444,"2016-09-21 19:40:00",中西區,違規停車,違規停車,"中西區西門路二段387號  違停",臺南市中西區西門路二段387號,22.998515,120.200417
UN201609210446,"2016-09-21 19:42:00",中西區,違規停車,違規停車,"中西區中山路125號南方公園周圍/中西區西華南街沿線 成功路到中山路    違規停車","中西區中山路125號南方公園周圍/中西區西華南街沿線 成功路到中山路",22.9956566607322,120.20959977060558
UN201609210449,"2016-09-21 19:50:00",東區,路燈故障,10盞以上路燈故障,"東區東門路二段301巷90幾號後及115弄附近 路燈不亮",臺南市東區東門路二段301巷90號,22.983956,120.229017
UN201609210453,"2016-09-21 20:09:00",中西區,違規停車,違規停車,"中西區友愛街92號  違停",中西區友愛街92號,22.9916852,120.1992381
UN201609210454,"2016-09-21 20:12:00",南區,路燈故障,9盞以下路燈故障,"南區大成路一段193巷67號 路燈不亮",臺南市南區大成路一段193巷67號,22.974404,120.200653
UN201609210456,"2016-09-21 20:19:00",東區,路燈故障,9盞以下路燈故障,"東區東光路二段102號  路燈",東區東光路二段102號,22.9974681,120.2319987
UN201609210457,"2016-09-21 20:20:00",中西區,騎樓舉發,騎樓舉發,"中西區中山路 富邦銀行","中西區中山路 富邦銀行",22.9948012,120.2084142
UN201609210461,"2016-09-21 20:25:00",安平區,騎樓舉發,騎樓舉發,"安平區華平路656號 騎樓舉發",臺南市華平路656號,22.995837,120.175938
UN201609210465,"2016-09-21 20:34:00",東區,路燈故障,9盞以下路燈故障,"東區長東街46巷8號  路燈閃爍",臺南市東區長東街46巷8號,22.963716,120.229166
UN201609210467,"2016-09-21 20:43:00",安平區,違規停車,違規停車,"安平區華平路648號   違規停車",臺南市華平路648號,22.995683,120.175899
UN201609210469,"2016-09-21 20:45:00",東區,違規停車,違規停車,"東區長榮路二段180號   違規停車",臺南市長榮路二段180號,22.990222,120.220767
UN201609210470,"2016-09-21 20:47:00",安平區,違規停車,違規停車,"安平區世平五街45號  違停",臺南市安平區世平五街45號,22.996869,120.150367
UN201609210473,"2016-09-21 20:53:00",南區,路燈故障,9盞以下路燈故障,"南區中華南路二段315巷6弄10號  路燈不亮",臺南市南區中華南路二段315巷6弄10號,22.961031,120.184737
UN201609210485,"2016-09-21 21:36:00",永康區,違規停車,違規停車,"永康區南工街66巷  違規停車",710台灣台南市永康區南工街66巷,23.010567,120.2401838
UN201609210487,"2016-09-21 21:39:00",安平區,交通運輸,佔用道路,"安平區慶平路  佔用道路",安平區慶平路,22.9971279,120.1730348
UN201609210490,"2016-09-21 22:15:00",安南區,噪音舉發,妨害安寧,"安南區長和路四段231巷78號  妨礙安寧",安南區長和路四段231巷78號,23.0635252,120.2079111
UN201609210491,"2016-09-21 22:15:00",安南區,噪音舉發,妨害安寧,"安南區長和路四段231巷78號  妨礙安寧",安南區長和路四段231巷78號,23.0635252,120.2079111
UN201609210492,"2016-09-21 22:23:00",安南區,道路維修,路面下陷、凹陷,安南區長和路一段222巷道路維修,台南市安南區長和路一段222巷,23.0585265,120.2391176
UN201609210493,"2016-09-21 22:20:00",中西區,噪音舉發,妨害安寧,"中西區和善街*和善街98巷 妨礙安寧",中西區和善街*和善街98巷,23.0024716,120.1897601
UN201609210500,"2016-09-21 22:50:00",中西區,噪音舉發,妨害安寧,"中西區和善街95號附近    妨礙安寧",中西區和善街95號附近,23.0021663,120.1899098
UN201609210501,"2016-09-21 23:20:00",北區,違規停車,違規停車,"北區開元路66巷底  違規停車",704台灣台南市北區開元路66巷底,23.004783513342222,120.21712360687047
UN201609210503,"2016-09-21 23:29:00",南區,噪音舉發,妨害安寧,"南區中華西路一段155號4樓  音響噪音",南區中華西路一段155號4樓,22.9819732,120.1857345
UN201609210505,"2016-09-21 23:44:00",安平區,噪音舉發,妨害安寧,"安平區觀汐平台 煙火妨害安寧",安平區觀汐平台,22.99053,120.147033
UN201609220006,"2016-09-22 02:16:00",中西區,噪音舉發,場所連續噪音,中西區金城街70號噪音舉發,700台灣台南市中西區金城街70號,22.9948209,120.1884622
UN201609220012,"2016-09-22 05:28:00",六甲區,噪音舉發,妨害安寧,"六甲區中正路422巷7號 妨害安寧",臺南市六甲區中正路422巷7號,23.227712,120.351213
UN201609220015,"2016-09-22 07:09:00",安南區,路燈故障,9盞以下路燈故障,"安南區安和路兩段285巷18弄40號 路燈不亮",臺南市安南區安和路兩段285巷18弄40號,23.042809,120.214919
