UN201610170007,"2016-10-17 05:55:00",南區,違規停車,違規停車,"南區中華南路二段300巷30弄14號 紅線違規停車",702台灣台南市南區中華南路二段300巷30弄14號,22.9628011,120.1885599
UN201610170011,"2016-10-17 07:00:00",北區,交通運輸,佔用道路,"北區文賢路1180巷35號 占用道路",北區文賢路1180巷35號,23.0177476,120.1942586
UN201610170012,"2016-10-17 06:59:00",安南區,違規停車,違規停車,"安南區同安路80巷58弄2號前面 紅線違停",臺南市安南區同安路80巷58弄2號,23.03903,120.190359
UN201610170020,"2016-10-17 07:34:00",永康區,騎樓舉發,騎樓舉發,"永康區中正路226號 騎樓舉發",臺南市永康區中正路226號,23.030914,120.251748
UN201610170026,"2016-10-17 08:00:00",中西區,騎樓舉發,騎樓舉發,"中西區金華路四段104號/104號-120號  騎樓舉發",臺南市中西區金華路四段104號,22.998594,120.195013
UN201610170027,"2016-10-17 08:02:00",安南區,路燈故障,9盞以下路燈故障,"安南區頂安街220號 路燈不亮",臺南市安南區頂安街220號,23.044216,120.211875
UN201610170040,"2016-10-17 08:24:00","北 區",違規停車,違規停車,"北區開元路485巷  違規停車",北區開元路485巷沿線兩側,23.01096461820696,120.22440556436776
UN201610170046,"2016-10-17 08:35:00",北區,違規停車,違規停車,"北區西門路四段271號 違停",臺南市北區西門路四段271號,23.013093,120.208899
UN201610170058,"2016-10-17 08:49:00",永康區,民生管線,漏水、停水、消防栓漏水或損壞,"永康區中正二街133號附近  消防栓漏水",臺南市永康區中正二街133號,23.028041,120.2307
UN201610170088,"2016-10-17 09:49:00",七股區,路燈故障,9盞以下路燈故障,"七股區竹子港53之28號 路燈故障",臺南市七股區竹子港53之28號,23.107918,120.171706
UN201610170102,"2016-10-17 10:20:00",北區,違規停車,違規停車,"台南市北區開元路422號 違規停車",臺南市北區開元路422號,23.010723,120.225751
UN201610170128,"2016-10-17 10:53:00",北區,交通運輸,佔用道路,"北區文賢路1180巷35號 佔用道路",臺南市北區文賢路1180巷35號,23.017858,120.194206
UN201610170143,"2016-10-17 11:19:00",中西區,違規停車,違規停車,"中西區中山路45號   違規停車",臺南市中山路45號,23.235138,120.262134
UN201610170165,"2016-10-17 12:03:00",南區,違規停車,違規停車,"南區福吉路79號 違規停車",702台灣台南市南區福吉路79號,22.9818037,120.1932958
UN201610170168,"2016-10-17 12:08:00",安定區,髒亂及汙染,空氣汙染,"安定區港南里102-1號  燒垃圾",臺南市安定區港南里102-1號,23.089947,120.229909
UN201610170174,"2016-10-17 12:20:00",中西區,違規停車,違規停車,"中西區衛民街139號 違規停車",臺南市衛民街139號,22.993335,120.207487
UN201610170188,"2016-10-17 12:43:00",中西區,違規停車,違規停車,"中西區西華南街62號 違規停車",臺南市西華南街62號,22.994161,120.20959
UN201610170190,"2016-10-17 12:45:00",中西區,違規停車,違規停車,"中西區民族路三段西門路口到臨安路口雙側 違規停車",民族路三段西門路口到臨安路口雙側紅線黃線違規停車,22.998857,120.195917
UN201610170196,"2016-10-17 12:58:00",中西區,違規停車,違規停車,"中西區中山路45號  違規停車",臺南市中山路45號,23.235138,120.262134
UN201610170201,"2016-10-17 13:14:00",中西區,路燈故障,9盞以下路燈故障,"中西區五妃街202號後面 路燈故障不亮",中西區五妃街202號後面,22.9826557,120.2053574
UN201610170205,"2016-10-17 13:15:00",玉井區,交通運輸,佔用道路,"玉井區中華路198號  佔用道路",玉井區中華路198號,23.1212336,120.4649601
UN201610170211,"2016-10-17 13:44:00",中西區,違規停車,違規停車,"中西區中西區中山路125號 違規停車",中西區中西區中山路125號,22.995709437004535,120.20971141755582
UN201610170220,"2016-10-17 14:05:00",七股區,髒亂及汙染,空氣汙染,"七股區後港里港西67號 空氣汙染",臺南市七股區後港里港西67號,23.183622,120.141865
UN201610170243,"2016-10-17 14:49:00",中西區,交通運輸,佔用道路,"中西區西門路二段287號 佔用道路",中西區西門路二段287號,22.9964916,120.1995206
UN201610170245,"2016-10-17 14:52:00",中西區,違規停車,違規停車,"中西區樹林街二段290號旁  違停",臺南市中西區樹林街二段290號,22.986452,120.201416
UN201610170254,"2016-10-17 15:13:00",中西區,違規停車,違規停車,"中西區中正興街/海安路口  違規停車",中西區中正興街海安路,22.9945658,120.1963461
UN201610170263,"2016-10-17 15:24:00",東區,違規停車,違規停車,"東區崇善路25巷96號  違規停車",東區崇善路25巷96號,22.9836864,120.2220877
UN201610170269,"2016-10-17 15:31:00","北 區",違規停車,違規停車,"北區開元路485巷沿線兩側(桂花鄉大樓到開元路)+北園街8巷沿線兩側(桂花鄉大樓到北園街)  違規停車",北區開元路485巷,23.011335861362685,120.22431436926126
UN201610170270,"2016-10-17 15:32:00",新營區,違規停車,違規停車,"新營區府西路/府西路33巷口，府西路上  違規停車",新營區府西路府西路33巷,23.31174,120.3138478
UN201610170285,"2016-10-17 15:53:00",中西區,路燈故障,9盞以下路燈故障,"中西區武聖路235號前  路燈故障",臺南市中西區武聖路235號,23.006882,120.18888
UN201610170290,"2016-10-17 16:02:00","北 區",違規停車,違規停車,"北區實踐街85巷2號 違規停車",北區實踐街85巷2號,23.015021080904823,120.21974690258502
UN201610170291,"2016-10-17 16:02:00",東區,髒亂及汙染,空氣汙染,東區富農街二段空氣汙染,東區富農街二段,22.9867148,120.2355846
UN201610170294,"2016-10-17 16:04:00",永康區,違規停車,違規停車,"永康區大橋一街*大橋一街247巷跟大橋二街*大橋一街247巷 違停",永康區大橋一街,23.0174773,120.2286974
UN201610170303,"2016-10-17 16:10:00",東區,路燈故障,9盞以下路燈故障,"東區崇學路142巷15號對面 路燈",臺南市東區崇學路142巷15號,22.98071,120.22514
UN201610170308,"2016-10-17 16:12:00",官田區,路燈故障,9盞以下路燈故障,"官田區隆田里新生街 編號：049號   路燈不亮","臺南市官田區隆田里新生街 編號",23.192427,120.31883
UN201610170313,"2016-10-17 16:24:00",善化區,交通運輸,佔用道路,"善化區中山路138號對面 佔用道路",臺南市善化區中山路138號,23.132976,120.301803
UN201610170330,"2016-10-17 17:00:00",北區,道路維修,人孔蓋或溝蓋聲響鬆動,"北區北成路478號  孔蓋鬆動",臺南市北區北成路478號,23.018908,120.200794
UN201610170336,"2016-10-17 17:19:00",中西區,違規停車,違規停車,"中西區民權路一段230號 違規停車",臺南市民權路一段230號,22.992643,120.207498
UN201610170343,"2016-10-17 17:34:00",永康區,違規停車,違規停車,"永康區中興街91巷56號 違規停車",永康區中興街91巷56號,23.007875,120.237715
UN201610170345,"2016-10-17 17:36:00",學甲區,路燈故障,9盞以下路燈故障,"學甲區三慶里頂洲179號   路燈不亮",臺南市學甲區三慶里頂洲179號,23.289295,120.19995
UN201610170349,"2016-10-17 17:42:00",安平區,噪音舉發,場所連續噪音,"安平區安平路183號旁邊 噪音",臺南市安平區安平路183號,23.000094,120.160815
UN201610170351,"2016-10-17 17:53:00",南區,路燈故障,9盞以下路燈故障,"南區德興路247巷31號前  路燈故障",臺南市南區德興路247巷31號,22.959947,120.193671
UN201610170353,"2016-10-17 17:57:00",東區,違規停車,違規停車,"東區長榮路二段180號 違規停車",臺南市東區長榮路二段180號,22.990222,120.220767
UN201610170354,"2016-10-17 17:58:00",永康區,騎樓舉發,騎樓舉發,"永康區中山南路130號  騎樓舉發",臺南市永康區中山南路130號,23.013198,120.230259
UN201610170358,"2016-10-17 18:03:00",北區,路燈故障,9盞以下路燈故障,"北區西門路四段16巷31弄82號   路燈不亮",臺南市北區西門路四段16巷31弄82號,23.005953,120.208791
UN201610170365,"2016-10-17 18:06:00",安南區,路燈故障,10盞以上路燈故障,"安南區安富街166號  路燈",臺南市安南區安富街166號,23.028672,120.201292
UN201610170380,"2016-10-17 18:32:00",中西區,路燈故障,9盞以下路燈故障,"中西區府前一街69號  路燈",臺南市中西區府前一街69號,22.994127,120.188042
UN201610170381,"2016-10-17 18:33:00",北區,騎樓舉發,騎樓舉發,"北區開元路370號  騎樓舉發",北區開元路370號,23.0099649,120.2246269
UN201610170383,"2016-10-17 18:37:00",新營區,違規停車,違規停車,"新營區復興路17號前  違規停車",臺南市新營區復興路17號,23.302681,120.313061
UN201610170388,"2016-10-17 18:47:00",永康區,違規停車,違規停車,"710台灣台南市永康區復華十街45巷38號  違規停車",710台灣台南市永康區復華十街45巷38號,23.01710940433947,120.24534489970677
UN201610170396,"2016-10-17 19:07:00",永康區,道路維修,路面坑洞,"永康區復興路26巷37號前 路面坑洞",臺南市永康區復興路26巷37號,23.001375,120.249938
UN201610170400,"2016-10-17 19:13:00",七股區,路燈故障,10盞以上路燈故障,"七股區中寮里106號週邊  路燈故障",臺南市七股區中寮里106號,23.156063,120.10701
UN201610170404,"2016-10-17 19:19:00",東區,違規停車,違規停車,"東區裕農路572號  違停",東區裕農路572號,22.9882601,120.234309
UN201610170406,"2016-10-17 19:23:00",七股區,路燈故障,9盞以下路燈故障,"七股區三股里1號前  路燈故障",臺南市七股區三股里1號,23.105308,120.072082
UN201610170407,"2016-10-17 19:32:00",永康區,路燈故障,9盞以下路燈故障,"永康區永明街175號和183號 路燈",臺南市永康區永明街175號,23.024721,120.262573
UN201610170414,"2016-10-17 19:46:00",北區,道路維修,路面坑洞,"北區海安路三段781巷202號前方 路面坑洞",臺南市北區海安路三段781巷202號,23.013356,120.195975
UN201610170418,"2016-10-17 20:00:00",東區,噪音舉發,妨害安寧,"東區東興路二段59號 妨礙安寧",臺南市東區東興路二段59號,22.99098,120.228634
UN201610170419,"2016-10-17 20:02:00",永康區,違規停車,違規停車,"永康區中華路346號至406號  違規停車",臺南市中華路346號,23.008658,120.234025
UN201610170421,"2016-10-17 20:06:00",安南區,違規停車,違規停車,"安南區育安一街/安豐六街25巷口  違規停車",安南區育安一街安豐六街25巷,23.0478459,120.2123154
UN201610170429,"2016-10-17 20:53:00",安南區,路燈故障,9盞以下路燈故障,"安南區安和路一段101巷56號  路燈",安南區安和路一段101巷56號,23.027668,120.212994
UN201610170433,"2016-10-17 21:07:00",北區,違規停車,違規停車,"北區育德路文成三路口  違停",北區育德路文成三路口,23.0168874,120.207279
UN201610170435,"2016-10-17 21:22:00",北區,違規停車,違規停車,"北區公園路878-880號  違規停車",臺南市北區公園路878號,23.014142,120.212774
UN201610170436,"2016-10-17 21:24:00",北區,違規停車,違規停車,"北區公園路595-4號+公園路591-45號  違規停車",臺南市北區公園路595-4號,23.013465,120.211876
UN201610170444,"2016-10-17 22:09:00",安南區,路燈故障,9盞以下路燈故障,安南區安和路四段533巷與北安路四段巷口路燈故障,709台灣台南市安南區安和路四段533巷與北安路四段巷口,23.060721,120.2143075
UN201610170446,"2016-10-17 22:15:00",山上區,路燈故障,9盞以下路燈故障,山上區明和里193之2號路燈故障,743台灣台南市山上區南140鄉道42號,23.1053826,120.3484601
UN201610170449,"2016-10-17 22:21:00",山上區,路燈故障,9盞以下路燈故障,山上區明和里萬善堂(土地公)廟旁路燈故障,743台灣台南市山上區南140鄉道42號,23.1053826,120.3484601
UN201610170450,"2016-10-17 22:21:00",歸仁區,噪音舉發,場所連續噪音,"歸仁區中正一街51號  噪音/妨害安寧",臺南市歸仁區中正一街51號,22.966127,120.295252
UN201610170453,"2016-10-17 22:29:00",山上區,路燈故障,9盞以下路燈故障,"山上區明和里8號 路燈故障",743台灣台南市山上區南140鄉道42號,23.1053826,120.3484601
UN201610170454,"2016-10-17 22:33:00",中西區,噪音舉發,妨害安寧,"中西區南門路31巷33號附近  妨害安寧",臺南市中西區南門路31巷33號,22.991853,120.205302
UN201610170455,"2016-10-17 22:35:00",新市區,違規停車,違規停車,"新市區和平街與民生路二巷巷口  違規停車",新市區和平街民生路二巷,23.0788634,120.2911681
UN201610170459,"2016-10-17 23:09:00",新化區,路燈故障,9盞以下路燈故障,新化區路燈故障,712台灣台南市新化區80,23.0189262,120.3361706
UN201610170460,"2016-10-17 23:19:00",中西區,髒亂及汙染,空氣汙染,"中西區民權路一段110號  空氣汙染",中西區民權路一段110號,22.9905169,120.2092959
UN201610170462,"2016-10-17 23:24:00",南區,交通運輸,交通疏導,"南區機場路9xx號附近  交通疏導",南區機場路,22.9485857,120.2166338
UN201610180001,"2016-10-18 00:12:00",南區,違規停車,違規停車,"南區中華西路一段137巷53號與55號間巷口 紅線違規停車",臺南市南區中華西路一段137巷53號,22.981615,120.183896
UN201610180003,"2016-10-18 00:22:00",北區,違規停車,違規停車,北區公園路703號違規停車,臺南市北區公園路703號,23.016742,120.214587
UN201610180009,"2016-10-18 02:50:00",東區,違規停車,違規停車,東區林森路二段91巷30號違規停車,701台灣台南市東區林森路二段91巷30號,22.9902073,120.223099
UN201610180011,"2016-10-18 05:42:00",南區,噪音舉發,場所連續噪音,"南區健康路二段116巷7弄11號 連續噪音",臺南市南區健康路二段116巷7弄11號,22.981904,120.193981
UN201610180012,"2016-10-18 05:59:00",下營區,髒亂及汙染,空氣汙染,"下營區甲中里中庄子6之2號  空氣汙染",臺南市下營區甲中里中庄子6之2號,23.250418,120.270606
UN201610180015,"2016-10-18 06:51:00",北區,噪音舉發,妨害安寧,北區北門路二段258號4樓噪音舉發,臺南市北區北門路二段258號,23.006819,120.214868
UN201610180019,"2016-10-18 07:42:00",新化區,違規停車,違規停車,"新化區信義路392號 違停",臺南市新化區信義路392號,23.034624,120.304968
UN201610180034,"2016-10-18 08:32:00",中西區,違規停車,違規停車,"中西區金華路四段104號-120號 機車違停",臺南市中西區金華路四段104號,22.998594,120.195013
UN201610180036,"2016-10-18 08:33:00",永康區,交通運輸,佔用道路,"永康區文賢街22號 佔用道路",臺南市永康區文賢街22號,23.004419,120.27115
UN201610180053,"2016-10-18 09:16:00",永康區,髒亂及汙染,環境髒亂,"永康區新行街291巷內  環境髒亂",永康區新行街291巷,23.0426804,120.2421719
UN201610180067,"2016-10-18 09:36:00",中西區,違規停車,違規停車,"中西區中山路45號 違規停車",臺南市中西區中山路45號,22.993513,120.206355
UN201610180072,"2016-10-18 09:45:00",永康區,髒亂及汙染,空氣汙染,"永康區永大路二段96號 水溝臭味 空氣汙染",臺南市永康區永大路二段96號,23.001822,120.26013
UN201610180079,"2016-10-18 09:53:00",善化區,路燈故障,9盞以下路燈故障,"善化區和平路跟興華路258號   路燈不亮",臺南市善化區和平路興華路258號,23.132889,120.297874
UN201610180092,"2016-10-18 10:15:00",永康區,違規停車,違規停車,"永康區中正六街沿線(正南五街到正南五街410巷)  違規停車",永康區中正六街,23.036625513683504,120.23744780570269
UN201610180095,"2016-10-18 10:23:00",新市區,民生管線,電信孔蓋鬆動、電信線路掉落、電信桿傾倒,"新市區復興路6巷19弄4號6號中間  電信孔蓋鬆動",臺南市新市區復興路6巷19弄4號,23.080631,120.296173
UN201610180096,"2016-10-18 10:22:00",東區,交通運輸,佔用道路,"東區崇善路953號 佔用騎樓",臺南市東區崇善路953號,22.964756,120.234383
UN201610180131,"2016-10-18 11:26:00",安南區,路燈故障,9盞以下路燈故障,"安南區城西街二段181巷50弄146號旁  路燈故障",臺南市安南區城西街二段181巷50弄146號,23.058094,120.120549
UN201610180135,"2016-10-18 11:35:00",安平區,違規停車,違規停車,"安平區華平路650號 違規停車",安平區華平路650號,22.9957693,120.1757969
UN201610180148,"2016-10-18 12:02:00",安平區,違規停車,違規停車,"安平區華平路648號  違規停車",臺南市華平路648號,22.995683,120.175899
UN201610180152,"2016-10-18 12:06:00",永康區,違規停車,違規停車,"永康區中正六街沿線(正南五街到正南五街410巷)  違規停車",永康區中正六街,23.036756642906038,120.23756850510834
UN201610180159,"2016-10-18 12:26:00",東區,違規停車,違規停車,"東區仁和路77-1號  違停",臺南市東區仁和路77-1號,22.973705,120.231926
UN201610180165,"2016-10-18 12:45:00",中西區,違規停車,違規停車,"700台灣台南市中西區廣慈街  違規停車",700台灣台南市中西區廣慈街,22.996533547602908,120.20716821852420
UN201610180185,"2016-10-18 14:01:00",中西區,違規停車,違規停車,"中西區民族路二段121號至133號  違規停車",臺南市中西區民族路二段121號,22.994805,120.20804
UN201610180190,"2016-10-18 14:12:00",安平區,違規停車,違規停車,"安平區華平路656號  併排違停",臺南市華平路656號,22.995837,120.175938
UN201610180204,"2016-10-18 14:23:00",學甲區,交通運輸,佔用道路,"學甲區中洲里頭前寮181號-6 佔用道路",臺南市學甲區中洲里頭前寮181號,23.237826,120.155328
UN201610180211,"2016-10-18 14:43:00",永康區,騎樓舉發,騎樓舉發,"永康區小東路513號台灣銀行   佔用騎樓",永康區小東路513號,22.9987661,120.236238
