UN201611120023,"2016-11-12 07:10:00",佳里區,交通運輸,佔用道路,"佳里區安西路335巷2號 佔用道路",佳里區安西路335巷2號,23.1613988,120.1708458
UN201611120029,"2016-11-12 07:59:00",東區,違規停車,違規停車,"東區北門路二段14號 違規停車",台南市東區北門路二段14號,22.9977597,120.2122125
UN201611120032,"2016-11-12 07:51:00",永康區,噪音舉發,場所連續噪音,"永康區永大路二段556巷47號對面  施工噪音",永康區永大路二段556巷47號對面,23.0113195,120.2632932
UN201611120035,"2016-11-12 08:23:00",中西區,道路維修,人孔蓋或溝蓋聲響鬆動,"中西區府前一街12號前方 汙水人孔蓋",臺南市中西區府前一街12號,22.9927,120.188759
UN201611120038,"2016-11-12 08:29:00",東區,違規停車,違規停車,"東區北門路二段14號 違規停車",臺南市東區北門路二段14號,22.998012,120.212476
UN201611120043,"2016-11-12 08:39:00",北區,違規停車,違規停車,"北區開元路220-270號 違規停車",臺南市北區開元路220-270號,23.007469,120.220763
UN201611120058,"2016-11-12 09:10:00",歸仁區,髒亂及汙染,空氣汙染,"歸仁區保大路一段222號   空汙",臺南市歸仁區保大路一段222號,22.996557,120.292739
UN201611120063,"2016-11-12 09:22:00",新市區,噪音舉發,場所連續噪音,"新市區社內里119號隔壁   施工噪音",臺南市新市區社內里119號,23.074955,120.283002
UN201611120072,"2016-11-12 09:39:00",永康區,違規停車,違規停車,台南市永康區正南一街74號違規停車,臺南市永康區正南一街74號,23.025417,120.23017
UN201611120079,"2016-11-12 10:02:00",南區,違規停車,違規停車,"南區健康路一段367號左側的人行道上   違規停車",臺南市南區健康路一段367號,22.98128,120.199879
UN201611120080,"2016-11-12 09:59:00",東區,天然災害,路樹問題,"東區裕農路801號   路樹倒塌",臺南市東區裕農路801號,22.989472,120.240054
UN201611120082,"2016-11-12 10:05:00",安平區,違規停車,違規停車,"安平區國勝路26號  違規停車",臺南市安平區國勝路26號,22.999776,120.161287
UN201611120083,"2016-11-12 10:10:00",中西區,違規停車,違規停車,"中西區府前路一段275號  違規停車",臺南市中西區府前路一段275號,22.989409,120.202344
UN201611120106,"2016-11-12 11:04:00",南區,違規停車,違規停車,"台南市南區金華路二段39巷95號  違規停車",台南市南區金華路二段39巷95號,22.9774038,120.1882291
UN201611120107,"2016-11-12 11:05:00",北區,路燈故障,9盞以下路燈故障,"北區和緯路一段176巷7號  路燈",臺南市北區和緯路一段176巷7號,23.010271,120.212761
UN201611120108,"2016-11-12 11:08:00",永康區,違規停車,違規停車,"台南市永康區中正北路35號   違規停車",臺南市永康區中正北路35號,23.041612,120.23832
UN201611120112,"2016-11-12 11:24:00",北區,違規停車,違規停車,"台南市北區開元路291號對面  違規停車",台南市北區開元路,23.0076695,120.2208365
UN201611120114,"2016-11-12 11:28:00",安平區,違規停車,違規停車,"安平區華平路656號    違規停車",臺南市華平路656號,22.995837,120.175938
UN201611120117,"2016-11-12 11:31:00",中西區,違規停車,違規停車,"中西區民生路二段120號  違規停車",中西區民生路二段120號,22.9956563,120.1961209
UN201611120127,"2016-11-12 11:47:00",仁德區,違規停車,違規停車,"台南市仁德區中正路二段145號  違規停車",臺南市仁德區中正路二段145號,22.946946,120.25106
UN201611120129,"2016-11-12 11:49:00",永康區,違規停車,違規停車,"台南市永康區中正北路56號   違規停車",臺南市永康區中正北路56號,23.041032,120.239357
UN201611120130,"2016-11-12 11:48:00",永康區,違規停車,違規停車,"永康區新中街281巷36號前方 違停",臺南市永康區新中街281巷36號,23.039918,120.243145
UN201611120132,"2016-11-12 11:47:00",永康區,違規停車,違規停車,"永康區小東路513號台灣銀行   違規攤販",臺南市永康區小東路513號,22.998719,120.236233
UN201611120139,"2016-11-12 11:57:00",新營區,違規停車,違規停車,"新營區民權路跟武昌街交叉口  違規攤販",新營區民權路武昌街,23.3059254,120.3127039
UN201611120140,"2016-11-12 12:00:00",中西區,違規停車,違規停車,"中西區西門路一段466-476號    違規停車",臺南市中西區西門路一段476號,22.983396,120.197777
UN201611120150,"2016-11-12 12:22:00",北區,違規停車,違規停車,"北區富北街64號  違規停車",704台灣台南市北區富北街64號,22.99930314069893,120.21155241888036
UN201611120151,"2016-11-12 12:24:00",北區,違規停車,違規停車,"北區富北街68號  違規停車",704台灣台南市北區富北街68號,22.999421283624134,120.2115898021685
UN201611120152,"2016-11-12 12:26:00",永康區,路燈故障,9盞以下路燈故障,"永康區中正二街182巷2號   路燈故障",臺南市永康區中正二街182巷2號,23.028888,120.233414
UN201611120153,"2016-11-12 12:31:00",安平區,違規停車,違規停車,"安平區華平路650號  違規停車",安平區華平路650號,22.9957693,120.1757969
UN201611120154,"2016-11-12 12:32:00",北區,違規停車,違規停車,"北區北忠街58巷18號   違規停車",704台灣台南市北區北忠街58巷18號,22.999248281142673,120.21142032008638
UN201611120155,"2016-11-12 12:33:00",永康區,違規停車,違規停車,"永康區正義街和永正路口  違規停車",710台灣台南市永康區正義街和永正路口,23.0278571,120.2535716
UN201611120156,"2016-11-12 12:19:00",安平區,違規停車,違規停車,"安平區華平路652-1號  黃線違停",臺南市安平區華平路652-1號,22.995794,120.175906
UN201611120158,"2016-11-12 12:39:00",永康區,違規停車,違規停車,"永康區中山南路永康國小  違規停車",台南市永康區中山南路永康國小,23.0245282,120.2559325
UN201611120161,"2016-11-12 12:38:00",南區,違規停車,違規停車,"南區中華南路二段247之2號 違停",南區中華南路二段247之2號,22.961445,120.187074
UN201611120166,"2016-11-12 12:53:00",北區,交通運輸,佔用道路,"北區文賢路365巷18弄   佔用道路",北區文賢路365巷18弄,23.0080825,120.193157
UN201611120167,"2016-11-12 12:58:00",安平區,違規停車,違規停車,"安平區華平路595號 違規停車",臺南市華平路595號,22.995766,120.175603
UN201611120169,"2016-11-12 13:04:00",仁德區,違規停車,違規停車,"仁德區土庫六街83號  逆向違停",臺南市仁德區土庫六街83號,22.988968,120.259763
UN201611120170,"2016-11-12 13:09:00",永康區,違規停車,違規停車,"台南市永康區中華路996號  違規停車",臺南市永康區中華路996號,23.021688,120.221559
UN201611120171,"2016-11-12 13:11:00",安南區,髒亂及汙染,空氣汙染,"安南區本原街一段402號   空污",臺南市安南區本原街一段402號,23.054106,120.195312
UN201611120176,"2016-11-12 13:17:00",東區,違規停車,違規停車,"東區北門路一段2號  違規停車",臺南市北門路一段2號,22.98954,120.211598
UN201611120177,"2016-11-12 13:18:00",中西區,違規停車,違規停車,"中西區西門路２段(郡緯街轉角)387號   違規停車",臺南市西門路2段387號,22.998515,120.200417
UN201611120179,"2016-11-12 13:19:00",中西區,違規停車,違規停車,"中西區衛民街56號  違規停車",臺南市衛民街56號,22.992987,120.210528
UN201611120183,"2016-11-12 13:29:00",中西區,違規停車,違規停車,"中西區開山路163號  違停",中西區開山路163號,22.9877082,120.2087056
UN201611120184,"2016-11-12 13:30:00",東區,違規停車,違規停車,"701台灣台南市東區東安路131號   違規停車",701台灣台南市東區東安路131號,22.9938793,120.2267957
UN201611120186,"2016-11-12 13:31:00",中西區,違規停車,違規停車,"中西區成功路191號   違規停車",臺南市中西區成功路191號,22.998173,120.205551
UN201611120199,"2016-11-12 13:51:00",東區,噪音舉發,場所連續噪音,"東區崇學路135巷12號 噪音",東區崇學路135巷12號,22.9795813,120.2223023
UN201611120207,"2016-11-12 14:10:00",新營區,噪音舉發,場所連續噪音,"新營區復興路803巷28號 噪音舉發",臺南市復興路803巷28號,23.30721,120.287442
UN201611120208,"2016-11-12 14:20:00",中西區,違規停車,違規停車,"中西區友愛街92號 違停",臺南市中西區友愛街92號,22.991599,120.199293
UN201611120217,"2016-11-12 14:39:00",歸仁區,交通運輸,佔用道路,"歸仁區文化街三段776巷23號 佔用道路",臺南市歸仁區文化街三段776巷23號,22.971116,120.271838
UN201611120220,"2016-11-12 14:49:00",永康區,違規停車,違規停車,"永康區大武街51-53號 違規停車",臺南市永康區大武街51-53號,23.020435,120.222765
UN201611120223,"2016-11-12 14:53:00",中西區,噪音舉發,妨害安寧,"中西區法華街115號 妨礙安寧",臺南市中西區法華街115號,22.983045,120.209271
UN201611120228,"2016-11-12 15:06:00",新營區,噪音舉發,妨害安寧,"新營區民族路96號 鑽地噪音",臺南市新營區民族路96號,23.31334,120.318711
UN201611120237,"2016-11-12 15:35:00",中西區,違規停車,違規停車,"中西區萬昌街73號 違規停車",臺南市中西區萬昌街73號,22.9911,120.21031
UN201611120243,"2016-11-12 15:38:00",下營區,動物救援,犬貓急難救援,"下營區開化里469-9號   犬貓救援",臺南市下營區開化里469-9號,23.211366,120.277553
UN201611120249,"2016-11-12 15:45:00",安平區,違規停車,違規停車,"安平區華平路656號 違規停車",臺南市華平路656號,22.995837,120.175938
UN201611120258,"2016-11-12 15:59:00",中西區,違規停車,違規停車,"中西區忠義路111號 違規停車",臺南市中西區忠義路二段111號,22.994094,120.203184
UN201611120262,"2016-11-12 16:03:00",北區,違規停車,違規停車,台南市北區公園路792號違規停車,臺南市北區公園路792號,23.011679,120.21129
UN201611120264,"2016-11-12 16:05:00",南區,違規停車,違規停車,"南區文南路沿線兩側   違規停車",南區文南路,22.9849416,120.1899994
UN201611120276,"2016-11-12 16:25:00",新營區,噪音舉發,妨害安寧,"新營區民治路96號 妨害安寧",臺南市新營區民治路96號,23.31021,120.310131
UN201611120290,"2016-11-12 16:33:00",中西區,違規停車,違規停車,"中西區民族路二段 違規停車",中西區民族路二段,22.9957239,120.2057375
UN201611120316,"2016-11-12 16:46:00",東區,違規停車,違規停車,"東區北門路一段 中西區北門路一段違規停車",北門路一段,22.9932589,120.2116579
UN201611120318,"2016-11-12 16:47:00",永康區,違規停車,違規停車,"永康區中正北路沿線(中正路到新中街) 違規停車",永康區中正北路,23.04136706524239,120.23958150297403
UN201611120327,"2016-11-12 17:19:00",新營區,違規停車,違規停車,730台灣台南市新營區復興路32-42號違規停車,730台灣台南市新營區復興路32-42號,23.303109885484620,120.31227409140160
UN201611120328,"2016-11-12 17:20:00",安平區,違規停車,違規停車,"安平區慶平路529號  違規停車",臺南市安平區慶平路529號,22.9971,120.172223
UN201611120331,"2016-11-12 17:29:00",東區,違規停車,違規停車,"台南市東區裕農路389巷3弄12-19號   違規停車",臺南市東區裕農路389巷3弄12-19號,22.988388,120.230394
UN201611120334,"2016-11-12 17:39:00",永康區,違規停車,違規停車,"台南市永康區國華街138巷5號   違規停車",台南市永康區國華街138巷5號,22.9935158,120.1973639
UN201611120342,"2016-11-12 18:09:00",永康區,違規停車,違規停車,"台南市永康區中正路55巷3號    違規停車",臺南市永康區中正路55巷3號,23.029672,120.25448
UN201611120348,"2016-11-12 18:15:00",安平區,違規停車,違規停車,"安平區安平路252號 跟292號  違規停車",臺南市安平區安平路252號,22.998586,120.179128
UN201611120349,"2016-11-12 18:19:00",永康區,違規停車,違規停車,永康區勝華街37巷37弄9號違規停車,臺南市永康區勝華街37巷37弄9號,23.005897,120.234059
UN201611120350,"2016-11-12 18:19:00",東區,違規停車,違規停車,台南市東區東寧路201巷102號違規停車,臺南市東區東寧路201巷102號,22.993859,120.22634
UN201611120351,"2016-11-12 18:19:00",北區,違規停車,違規停車,台南市北區成功路32號違規停車,臺南市北區成功路32號,22.997963,120.208301
UN201611120354,"2016-11-12 18:29:00",永康區,違規停車,違規停車,"台南市永康區永正路57號     違規停車",臺南市永康區永正路57號,23.02639,120.253758
UN201611120357,"2016-11-12 18:44:00",安平區,違規停車,違規停車,安平區華平路652號違規停車,臺南市安平區華平路652號,22.995755,120.175904
UN201611120358,"2016-11-12 18:49:00",永康區,違規停車,違規停車,台南市永康區復華十街45巷38號違規停車,台南市永康區復華十街45巷38號,23.0172365,120.2455837
UN201611120359,"2016-11-12 18:53:00",安平區,違規停車,違規停車,安平區華平路658號違規停車,臺南市安平區華平路658號,22.995893,120.17588
UN201611120364,"2016-11-12 18:59:00",永康區,違規停車,違規停車,"台南市永康區復華十街45巷38號    違規停車",台南市永康區復華十街45巷38號,23.0172365,120.2455837
UN201611120366,"2016-11-12 19:01:00",中西區,違規停車,違規停車,"中西區中山路2號到100號、11號到117號 違規停車",臺南市中山路2號,23.234637,120.26121
UN201611120367,"2016-11-12 19:01:00",中西區,違規停車,違規停車,中西區民族路二段（北門路到西門路口）違規停車,民族路二段,22.9957239,120.2057375
UN201611120369,"2016-11-12 19:02:00",中西區,違規停車,違規停車,中西區民族路三段（西門路到臨安路口）違規停車,民族路三段,22.998857,120.195917
UN201611120370,"2016-11-12 19:07:00",仁德區,違規停車,違規停車,"仁德區義林三街仁義路口   違停",仁德區義林三街仁義路口,22.9683934,120.2616921
UN201611120373,"2016-11-12 19:21:00",中西區,違規停車,違規停車,"中西區忠義路一段40-42號 違規停車",台南市中西區忠義路一段40號,22.9857631,120.201957
UN201611120375,"2016-11-12 19:37:00",中西區,違規停車,違規停車,"中西區西華南街（民族路到衛民街口） 違規停車",西華南街,22.9955627,120.2097732
UN201611120378,"2016-11-12 19:44:00",北區,違規停車,違規停車,"北區和緯路二段330號 違規停車",臺南市和緯路二段330號,23.012567,120.205016
UN201611120379,"2016-11-12 19:45:00",中西區,違規停車,違規停車,"中西區西門路一段576號 違規停車",中西區西門路一段576號,22.986041922143645,120.19782034691441
UN201611120381,"2016-11-12 19:50:00",永康區,路燈故障,9盞以下路燈故障,"永康區中正南路110號   路燈不亮",臺南市永康區中正南路110號,23.021637,120.216468
UN201611120384,"2016-11-12 20:07:00",北區,違規停車,違規停車,"北區育德二路196巷巷口  違規停車",北區育德二路196巷,23.0117478,120.2036168
UN201611120385,"2016-11-12 20:17:00",南區,髒亂及汙染,空氣汙染,"南區新孝路68號旁豬肉攤 空氣污染",臺南市南區新孝路68號,22.977923,120.189126
UN201611120387,"2016-11-12 20:25:00",新市區,違規停車,違規停車,"新市區 中正路 和 民權路 路口 四個轉角   違規停車",新市區中正路民權路,23.0779369,120.2919699
UN201611120388,"2016-11-12 20:23:00",東區,路燈故障,9盞以下路燈故障,"東區大同路一段329巷20幾號公寓大樓前 路燈故障",臺南市東區大同路一段329巷20號,22.981892,120.212636
UN201611120389,"2016-11-12 20:26:00",安平區,違規停車,違規停車,安平區華平路658號違規停車,臺南市安平區華平路658號,22.995893,120.17588
UN201611120391,"2016-11-12 20:38:00",北區,違規停車,違規停車,"北區海安路三段576～600號 違停",臺南市北區海安路三段576號,23.012137,120.200785
UN201611120393,"2016-11-12 20:46:00",南區,違規停車,違規停車,台南市南區健康路2段150巷2號違規停車,臺南市南區健康路2段150巷2號,22.981796,120.193768
UN201611120394,"2016-11-12 20:51:00",東區,違規停車,違規停車,"東區長榮路二段180號  違規停車",臺南市東區長榮路二段180號,22.990222,120.220767
UN201611120396,"2016-11-12 20:57:00",中西區,違規停車,違規停車,違規停車,中西區衛民街119號,22.9932033,120.2079001
UN201611120398,"2016-11-12 21:05:00",北區,噪音舉發,妨害安寧,"北區富北街11號2F、3F 噪音舉發",臺南市富北街11號,22.998951,120.211372
UN201611120403,"2016-11-12 21:33:00",中西區,違規停車,違規停車,"中西區民族路二段76/99號 違規停車",臺南市民族路二段99號,22.994503,120.208958
UN201611120404,"2016-11-12 21:39:00",北區,違規停車,違規停車,"北區公園南路346號 違規停車",臺南市北區公園南路346號,23.002997,120.202882
UN201611120405,"2016-11-12 21:50:00",中西區,違規停車,違規停車,"中西區府前路二段180號 違規停車",臺南市中西區府前路二段180號,22.991538,120.193384
UN201611120409,"2016-11-12 22:05:00",新市區,違規停車,違規停車,新市區中正路民生路違規停車,新市區中正路民生路,23.0780253,120.2919884
UN201611120412,"2016-11-12 22:13:00",東區,噪音舉發,妨害安寧,"台南市東區崇德七街20巷30號 妨害安寧",臺南市東區崇德七街20巷30號,22.974642,120.2283
UN201611120413,"2016-11-12 22:12:00",新市區,噪音舉發,場所連續噪音,"新市區可口街83號 連續噪音",臺南市新市區可口街83號,23.07347,120.293597
UN201611120415,"2016-11-12 22:16:00",北區,違規停車,違規停車,"台南市北區公園路595之4號 違規停車",台南市北區公園路595之4號,23.0134347,120.2116897
UN201611120416,"2016-11-12 22:20:00",中西區,違規停車,違規停車,"台南市中西區赤崁東街86號 違規停車",臺南市中西區赤崁東街86號,22.997671,120.203592
UN201611120417,"2016-11-12 22:20:00",南區,違規停車,違規停車,台南市南區金華路二段89號違規停車,臺南市南區金華路二段89號,22.979454,120.191137
UN201611120423,"2016-11-12 23:20:00",中西區,違規停車,違規停車,"中西區赤崁東街86號 違規停車",臺南市中西區赤崁東街86號,22.997671,120.203592
UN201611130007,"2016-11-12 23:45:00",永康區,違規停車,違規停車,"永康區新民街66巷新行街  違規停車",永康區新民街66巷新行街,23.0411258,120.2425476
UN201611130004,"2016-11-13 00:10:00",仁德區,噪音舉發,妨害安寧,"仁德區中正路二段 妨害安寧",仁德區中正路二段,22.9542672,120.2526183
UN201611130005,"2016-11-13 01:19:00",東區,噪音舉發,妨害安寧,"東區林森路三段236號  妨害安寧",臺南市東區林森路三段236號,22.990555,120.22453
UN201611130009,"2016-11-13 02:00:00",東區,違規停車,違規停車,台南市東區崇明路137號違規停車,台南市東區崇明路137號,22.9794845,120.2182663
UN201611130010,"2016-11-13 01:57:00",永康區,動物救援,犬貓急難救援,"永康區中正南路160號   捕捉流浪狗",臺南市永康區中正南路160號,23.022495,120.217023
UN201611130018,"2016-11-13 05:27:00",中西區,道路維修,人孔蓋或溝蓋聲響鬆動,"中西區民生路一段95號 孔蓋聲響",臺南市中西區民生路一段95號,22.993398,120.202171
UN201611130029,"2016-11-13 07:42:00",北區,髒亂及汙染,其他汙染舉發,"北區南園街101巷21弄7號 噪音污染",臺南市北區南園街101巷21弄7號,23.00853,120.225766
UN201611130031,"2016-11-13 07:54:00",中西區,交通運輸,佔用道路,"中西區和善街120號 妨害安寧 佔用道路",臺南市中西區和善街120號,23.002845,120.18941
UN201611130038,"2016-11-13 07:54:00",永康區,噪音舉發,妨害安寧,"永康區復國一路344號 妨害安寧",臺南市永康區復國一路344號,23.010895,120.246616
UN201611130043,"2016-11-13 08:41:00",安平區,違規停車,違規停車,"安平區安平路88號、100號、228號 違規停車",臺南市安平路88號,22.998278,120.184433
UN201611130047,"2016-11-13 08:56:00",永康區,交通運輸,佔用道路,"永康區中山東路336號 佔用道路",臺南市永康區中山東路336號,23.008258,120.23776
UN201611130048,"2016-11-13 09:01:00",永康區,違規停車,違規停車,"台南市永康區復華八街51巷16號旁 違規停車",臺南市永康區復華八街51巷16號,23.017742,120.246427
UN201611130049,"2016-11-13 09:02:00",中西區,違規停車,違規停車,"中西區府前路二段121號 違規停車",臺南市府前路二段121號,22.991079,120.194428
UN201611130056,"2016-11-13 09:28:00",永康區,噪音舉發,妨害安寧,"永康區四維街149巷34-1號 妨害安寧",臺南市永康區四維街149巷34-1號,23.035003,120.250806
UN201611130058,"2016-11-13 09:38:00",安平區,違規停車,違規停車,"安平區安平路228號 違規停車",臺南市安平路228號,22.998617,120.179986
UN201611130060,"2016-11-13 09:39:00",永康區,髒亂及汙染,空氣汙染,"永康區正南一街200號  空氣汙染",臺南市正南一街200號,23.027979,120.225189
UN201611130062,"2016-11-13 09:44:00",新市區,噪音舉發,妨害安寧,"新市區中正路322號隔壁 妨害安寧",臺南市新市區中正路322號,23.078874,120.292648
UN201611130066,"2016-11-13 09:54:00",東區,違規停車,違規停車,"東區崇學路217號 違規停車",臺南市崇學路217號,22.981007,120.224078
UN201611130074,"2016-11-13 10:10:00",中西區,違規停車,違規停車,"台南市中西區南門路231巷2號  違規停車",臺南市中西區南門路231巷2號,22.983535,120.204451
UN201611130080,"2016-11-13 10:21:00",中西區,違規停車,違規停車,"中西區民生路   違規停車",中西區民生路,22.9964656,120.1928657
UN201611130081,"2016-11-13 10:22:00",永康區,違規停車,違規停車,"中西區中山南路119巷53號對面 違規停車",臺南市中山南路119巷53號,23.013825,120.230052
UN201611130094,"2016-11-13 10:55:00",南區,道路維修,路面下陷、凹陷,"南區金華路一段102巷46號  下陷",臺南市南區金華路一段102巷46號,22.964038,120.192085
UN201611130100,"2016-11-13 11:23:00",東區,違規停車,違規停車,東區府連路204巷29弄13號,臺南市東區府連路204巷29弄13號,22.984463,120.213551
UN201611130106,"2016-11-13 11:35:00",中西區,噪音舉發,場所連續噪音,"中西區青年路133號  妨害安寧",中西區青年路133號,22.9919878,120.2090649
UN201611130107,"2016-11-13 11:38:00",新市區,違規停車,違規停車,"新市區中正路152號    違規停車",新市區中正路152號,23.0740776,120.2913647
UN201611130112,"2016-11-13 11:56:00",安平區,違規停車,違規停車,"安平區華平路650號   違規停車",安平區華平路650號,22.9957693,120.1757969
UN201611130114,"2016-11-13 12:03:00",安平區,違規停車,違規停車,"安平區華平路658號 違規停車",臺南市華平路658號,22.995893,120.17588
UN201611130115,"2016-11-13 12:03:00",北區,違規停車,違規停車,"台南市北區東豐路195號 違規停車",臺南市北區東豐路195號,23.003497,120.219848
UN201611130117,"2016-11-13 12:04:00",永康區,違規停車,違規停車,"永康區大灣路942巷75號和大仁街31巷交叉口 違停",臺南市永康區大灣路942巷75號,23.001188,120.255287
UN201611130118,"2016-11-13 12:10:00",北區,違規停車,違規停車,"台南市北區北門路二段6號 違規停車",臺南市北區北門路二段6號,23.001903,120.213684
UN201611130122,"2016-11-13 12:15:00",中西區,違規停車,違規停車,"中西區赤崁樓 民族路 違規停車","赤崁樓 民族路",22.9975421,120.2026071
UN201611130128,"2016-11-13 12:40:00",安平區,違規停車,違規停車,"安平區華平路650號 違規停車",臺南市華平路650號,22.995718,120.175901
UN201611130130,"2016-11-13 12:41:00",安平區,違規停車,違規停車,"安平區華平路658號  違規停車",臺南市華平路658號,22.995893,120.17588
UN201611130133,"2016-11-13 12:47:00",中西區,違規停車,違規停車,"中西區民族路二段 違規停車",臺南市民族路二段76/99號,22.995083,120.207033
UN201611130137,"2016-11-13 12:58:00",仁德區,民生管線,漏水、停水、消防栓漏水或損壞,"仁德區仁義三街233號  漏水",臺南市仁德區仁義三街233號,22.96974,120.258281
UN201611130145,"2016-11-13 13:04:00",中西區,違規停車,違規停車,"中西區中山路2號到100號紅黃線違停 中山路11號到117號 紅黃線違停 違規停車",臺南市中西區中山路2號,22.992715,120.205643
UN201611130148,"2016-11-13 13:15:00",安平區,違規停車,違規停車,"安平區華平路650號 違規停車",臺南市華平路650號,22.995718,120.175901
UN201611130152,"2016-11-13 13:27:00",新化區,噪音舉發,妨害安寧,"新化區中正路869號   妨害安寧",臺南市中正路869號,22.964777,120.253257
UN201611130154,"2016-11-13 13:35:00",東區,違規停車,違規停車,"台南市東區北門路一段134號  違規停車",臺南市東區北門路一段134號,22.992867,120.211826
UN201611130157,"2016-11-13 13:38:00",北區,違規停車,違規停車,"北區長榮路四段169號    違規停車",臺南市長榮路四段169號,23.006452,120.22138
UN201611130161,"2016-11-13 13:50:00",北區,違規停車,違規停車,"台南市北區北門路二段6號  違規停車",臺南市北區北門路二段6號,23.001903,120.213684
UN201611130162,"2016-11-13 13:50:00",東區,違規停車,違規停車,"台南市東區東光路一段39號  違規停車",台南市東區東光路一段39號,22.9915576,120.2307921
UN201611130163,"2016-11-13 13:57:00",東區,違規停車,違規停車,"台南市東區大同路二段63號  違規停車",台南市東區大同路二段63號,22.9795269,120.2129989
