UN201611080364,"2016-11-08 19:09:00",新營區,路燈故障,9盞以下路燈故障,"新營區進修街19號 路燈故障",臺南市新營區進修街19號,23.306873,120.306332
UN201611080374,"2016-11-08 19:21:00",安平區,違規停車,違規停車,"安平區華平路650號/658號 違規停車",安平區華平路650號/658號,22.9957693,120.1757969
UN201611080381,"2016-11-08 19:31:00",永康區,違規停車,違規停車,"永康區永大路二段1446號 違規停車",710台灣台南市永康區永大路二段1446號,23.0232015,120.2609633
UN201611080383,"2016-11-08 19:32:00",東區,違規停車,違規停車,"東區崇德十九街62號 違停",臺南市東區崇德十九街62號,22.968164,120.22935
UN201611080385,"2016-11-08 19:44:00",仁德區,違規停車,違規停車,"仁德區仁義路119號  違規停車",臺南市仁德區仁義路119號,22.96844,120.255716
UN201611080389,"2016-11-08 19:48:00",中西區,違規停車,違規停車,"中西區衛民街127號  違規停車",臺南市中西區衛民街127號,22.993252,120.207773
UN201611080392,"2016-11-08 20:00:00",安平區,違規停車,違規停車,"安平區華平路650號 違規停車",臺南市華平路650號,22.995718,120.175901
UN201611080393,"2016-11-08 20:05:00",北區,違規停車,違規停車,"北區公園路860號 違規停車",臺南市北區公園路860號,23.013832,120.212519
UN201611080395,"2016-11-08 20:07:00",北區,違規停車,違規停車,"北區公園路856號 違規停車",臺南市北區公園路856號,23.013763,120.212463
UN201611080408,"2016-11-08 21:23:00",麻豆區,噪音舉發,妨害安寧,"麻豆區大山腳1號附近 鞭炮妨害安寧",臺南市麻豆區大山腳1號,23.191176,120.2219
UN201611080409,"2016-11-08 21:26:00",永康區,違規停車,違規停車,"永康區自強路330巷23號 違規停車",臺南市永康區自強路330巷23號,23.028451,120.253011
UN201611080411,"2016-11-08 21:29:00",安平區,違規停車,違規停車,"安平區建平七街24號旁巷內 違規停車",臺南市安平區建平七街24號,22.988332,120.18511
UN201611080436,"2016-11-08 22:04:00",新市區,違規停車,違規停車,"新市區中山路18-20號 違規停車",台南市新市區縱貫公路,23.0813895,120.3035116
UN201611090001,"2016-11-09 00:13:00",永康區,噪音舉發,妨害安寧,"永康區復國一路315巷36號附近  妨害安寧",710台灣台南市永康區復國一路315巷36號附近,23.0102269,120.2450526
UN201611090006,"2016-11-09 03:29:00",中西區,噪音舉發,妨害安寧,"中西區新美街68、72號  妨害安寧","臺南市中西區新美街68 72號",22.999189,120.2021
UN201611090009,"2016-11-09 06:40:00",東區,違規停車,違規停車,"東區德東街55號 紅線違規停車",臺南市東區德東街55號,22.961718,120.229066
UN201611090010,"2016-11-09 07:04:00",安平區,違規停車,違規停車,"安平區安平路174號 違規停車",臺南市安平路174號,22.998533,120.181769
UN201611090020,"2016-11-09 07:58:00",中西區,違規停車,違規停車,"中西區開山路76號至100號 違停",臺南市開山路76號,22.990099,120.206607
UN201611090023,"2016-11-09 08:10:00",永康區,民生管線,漏水、停水、消防栓漏水或損壞,"永康區尚頂路167號  路面冒水",臺南市永康區尚頂路167號,23.030016,120.22749
UN201611090027,"2016-11-09 08:19:00",南區,民生管線,電信孔蓋鬆動、電信線路掉落、電信桿傾倒,"南區健康路一段133巷97,99號  中華電信孔蓋","臺南市南區健康路一段133巷97,99號",22.976895,120.208288
UN201611090031,"2016-11-09 08:39:00",北區,違規停車,違規停車,"北區開元路515號  違停",臺南市北區開元路515號,23.011026,120.225619
UN201611090039,"2016-11-09 08:53:00",永康區,違規停車,違規停車,"永康區中正路545號 違規停車",永康區中正路545號,23.039757153186084,120.23891866207123
UN201611090044,"2016-11-09 09:01:00",中西區,交通運輸,佔用道路,"中西區尊王路23號  佔用道路",臺南市中西區尊王路23號,22.991241,120.197397
UN201611090047,"2016-11-09 09:11:00","北 區",違規停車,違規停車,"北區北園街8巷沿線兩側 違停",北區北園街8巷沿線兩側(北園街到桂花鄉大樓)/北區開元路485巷沿線兩側(桂花鄉大樓到開元路),23.011076022120744,120.22437907755373
UN201611090054,"2016-11-09 09:21:00",將軍區,噪音舉發,妨害安寧,"將軍區保源里79-2號對面 妨害安寧",臺南市將軍區保源里79之2號,23.218414,120.164815
UN201611090070,"2016-11-09 09:41:00",永康區,髒亂及汙染,其他汙染舉發,"永康區國聖街246號  其他汙染舉發",臺南市永康區國聖街246號,23.034441,120.22664
UN201611090075,"2016-11-09 09:57:00",北區,道路維修,人孔蓋或溝蓋聲響鬆動,"北區大興街568號 雨水孔蓋",臺南市大興街568號,23.00812,120.179916
UN201611090090,"2016-11-09 10:22:00",永康區,民生管線,漏水、停水、消防栓漏水或損壞,"永康區環工路12號  漏水",臺南市永康區環工路12號,23.047772,120.273813
UN201611090095,"2016-11-09 10:34:00",安平區,違規停車,違規停車,"安平區華平路650號  違規停車",安平區華平路650號,22.9957693,120.1757969
UN201611090099,"2016-11-09 10:39:00",東區,噪音舉發,妨害安寧,"東區崇德十六街2號之3的2樓  妨害安寧",臺南市東區崇德十六街2號,22.969554,120.227841
UN201611090103,"2016-11-09 10:44:00",東區,交通運輸,佔用道路,"東區勝利路131號～151號  佔用道路",臺南市東區勝利路131號,22.994912,120.217948
UN201611090110,"2016-11-09 11:03:00",歸仁區,髒亂及汙染,空氣汙染,"歸仁區西埔二街110巷31-1號   空污",臺南市歸仁區西埔二街110巷31-1號,23.003178,120.284901
UN201611090114,"2016-11-09 11:13:00",永康區,違規停車,違規停車,"永康區中正路 中正七街 違規停車",永康區中正路890號萊爾富超商周圍/永康區中正七街沿線兩側(中正路到新民街),23.039747280151303,120.23892134428024
UN201611090117,"2016-11-09 11:09:00",安南,道路維修,路面坑洞,"安南區同安路346號 坑洞",臺南市安南區同安路346號,23.043087,120.19284
UN201611090122,"2016-11-09 11:26:00",新營區,違規停車,違規停車,"新營區民治路368號 違規停車",臺南市新營區民治路368號,23.305465,120.302999
UN201611090129,"2016-11-09 11:30:00",北區,道路維修,人孔蓋或溝蓋聲響鬆動,"北區公園路533號和535號中間  汙水孔蓋鬆動",臺南市北區公園路533號,23.009829,120.210427
UN201611090132,"2016-11-09 11:34:00",南區,騎樓舉發,騎樓舉發,"南區金華路二段20號  騎樓舉發",臺南市南區金華路二段20號,22.975973,120.191204
UN201611090136,"2016-11-09 11:41:00",中西區,違規停車,違規停車,"中西區開山路82之一號 違規停車",臺南市開山路82之一號,22.989971,120.206739
UN201611090138,"2016-11-09 11:46:00",安平區,違規停車,違規停車,"安平區華平路658號 違規停車",臺南市華平路658號,22.995893,120.17588
UN201611090140,"2016-11-09 11:57:00",安平區,違規停車,違規停車,"安平區華平路652號 違規停車",臺南市華平路652號,22.995755,120.175904
UN201611090141,"2016-11-09 12:02:00",安南區,違規停車,違規停車,"安南區安中路三段458號 違規停車",709台灣台南市安南區安中路三段458號,23.0505078938073,120.17359002504513
UN201611090144,"2016-11-09 12:10:00",中西區,違規停車,違規停車,"中西區開山路99號至101號 違規停車",臺南市開山路99至101號,22.989593,120.207331
UN201611090151,"2016-11-09 12:33:00",安平區,違規停車,違規停車,"安平區華平路650號 違規停車",臺南市華平路650號,22.995718,120.175901
UN201611090152,"2016-11-09 12:35:00",東區,違規停車,違規停車,"東區中華東路三段399巷17號 違規停車",台南市中華東路三段399巷17號,22.97289,120.2206642
UN201611090157,"2016-11-09 12:51:00",安南區,動物救援,遊蕩犬隻捕捉管制,"安南區城西街三段510巷23號  捕犬",臺南市安南區城西街三段510巷23號,23.057326,120.0939
UN201611090162,"2016-11-09 12:57:00",東區,動物救援,犬貓急難救援,"東區東門路三段179巷103號4F-2  貓咪受困",臺南市東區東門路三段179巷103號,22.977956,120.23538
UN201611090164,"2016-11-09 13:24:00",新化區,違規停車,違規停車,"新化區中山路538號前 佔用道路",臺南市新化區中山路538號,23.036128,120.302007
UN201611090166,"2016-11-09 12:59:00",新營區,噪音舉發,妨害安寧,"新營區同濟街11號 妨害安寧",臺南市新營區同濟街11號,23.305143,120.320444
UN201611090171,"2016-11-09 13:30:00",北區,民生管線,電信孔蓋鬆動、電信線路掉落、電信桿傾倒,"北區南園街127巷65號前面 孔蓋鬆動聲響",臺南市北區南園街127巷65號,23.007463,120.227307
UN201611090175,"2016-11-09 13:47:00",中西區,違規停車,違規停車,"中西區西華南街68號   違規停車",臺南市中西區西華南街68號,22.994221,120.209598
UN201611090177,"2016-11-09 13:48:00",中西區,違規停車,違規停車,"中西區民族路二段54號  違規停車",中西區民族路二段54號,22.9946227,120.210492
UN201611090179,"2016-11-09 13:51:00",中西區,違規停車,違規停車,"中西區永福路   忠義路   違規停車","中西區永福路   忠義路",22.9941725,120.2033594
UN201611090181,"2016-11-09 13:54:00",中西區,違規停車,違規停車,"中西區民族路三段  違規停車",中西區民族路三段,22.998857,120.195917
UN201611090182,"2016-11-09 13:54:00",中西區,違規停車,違規停車,"中西區民權路  青年路  城隍街  違規停車","中西區民權路  青年路  城隍街",22.9919116,120.2090264
UN201611090185,"2016-11-09 14:00:00",東區,違規停車,違規停車,"台南市東區北門路二段14號  違規停車",台南市東區北門路二段14號,22.9977597,120.2122125
UN201611090187,"2016-11-09 14:01:00",南區,違規停車,違規停車,"南區健康路二段114號  違規停車",702台灣台南市南區健康路二段114號,22.981591,120.1945133
UN201611090191,"2016-11-09 14:23:00",佳里區,民生管線,漏水、停水、消防栓漏水或損壞,"佳里區民安里新宅38號  漏水",臺南市佳里區民安里新宅38號,23.183122,120.194618
UN201611090202,"2016-11-09 14:37:00",永康區,違規停車,違規停車,"永康區中正六街沿線(正南五街到正南五街410巷) 違規停車",永康區中正六街沿線(正南五街到正南五街410巷),23.036687530108182,120.23748736828566
UN201611090204,"2016-11-09 14:41:00",中西區,道路維修,人孔蓋或溝蓋聲響鬆動,"中西區民生路一段97號 污水孔蓋",中西區民生路一段97號,22.9932691,120.201988
UN201611090208,"2016-11-09 14:57:00",永康區,違規停車,違規停車,"永康區中正路 違規停車",永康區中正路沿線兩側(中正路127巷到中正路209巷),23.030847679190842,120.25162294507028
UN201611090213,"2016-11-09 15:16:00",安南區,民生管線,漏水、停水、消防栓漏水或損壞,"安南區海佃路一段213巷42號 路面漏水",臺南市安南區海佃路一段213巷42號,23.024707,120.190188
UN201611090223,"2016-11-09 15:45:00",安南區,髒亂及汙染,空氣汙染,"安南區郡安路四段接近海佃路口  空氣污染",安南區郡安路四段,23.0281181,120.20975
UN201611090237,"2016-11-09 16:26:00",東區,違規停車,違規停車,"東區崇明十三街10巷6號  違停",東區崇明十三街10巷6號,22.9734951,120.2246294
UN201611090242,"2016-11-09 16:45:00","北 區",違規停車,違規停車,"北區北門路三段沿線兩側   違規停車",北區北門路三段沿線兩側,23.014233559613714,120.21729469299315
UN201611090244,"2016-11-09 16:48:00",中西區,違規停車,違規停車,"中西區府前路一段174-1號  違規停車",臺南市中西區府前路一段174-1號,22.989141,120.206489
UN201611090247,"2016-11-09 17:00:00",永康區,違規停車,違規停車,"永康區小東路679號  違規停車",臺南市永康區小東路679號,22.99871,120.239358
UN201611090256,"2016-11-09 17:26:00",中西區,違規停車,違規停車,"中西區正興街100號  違規停車",臺南市中西區正興街100號,22.994316,120.197009
UN201611090258,"2016-11-09 17:34:00",新營區,違規停車,違規停車,"新營區裕民路12號  違規停車",730台灣台南市新營區裕民路12號,23.302367077595214,120.30720663372949
UN201611090261,"2016-11-09 17:41:00",中西區,違規停車,違規停車,"中西區建業街80號書局前面及對向  違規停車",臺南市中西區建業街80號,22.987931,120.204936
UN201611090262,"2016-11-09 17:41:00",安南區,路燈故障,9盞以下路燈故障,"安南區開安一街17號前 路燈不亮",臺南市安南區開安一街17號,23.046778,120.224498
UN201611090264,"2016-11-09 17:53:00",麻豆區,違規停車,違規停車,"麻豆區民權路41號  違規停車",臺南市麻豆區民權路41號,23.18226,120.251594
UN201611090267,"2016-11-09 17:58:00",新市區,路燈故障,10盞以上路燈故障,"新市區民族路76號(新市國中)前的民族路整排 路燈故障",臺南市新市區民族路76號,23.083774,120.300444
UN201611090268,"2016-11-09 17:57:00",官田區,路燈故障,9盞以下路燈故障,"官田區二鎮里56之3號 路燈不亮",臺南市官田區二鎮里56之3號,23.220584,120.326663
UN201611090269,"2016-11-09 17:55:00",永康區,路燈故障,9盞以下路燈故障,"永康區中山南路119巷52號  路燈不亮",臺南市永康區中山南路119巷52號,23.01371,120.230158
UN201611090272,"2016-11-09 17:59:00",永康區,路燈故障,9盞以下路燈故障,"永康區大安路1014號  路燈不亮",臺南市永康區大安路1014號,23.01396,120.264298
UN201611090274,"2016-11-09 18:11:00",中西區,違規停車,違規停車,"中西區海安路一段12號 違規停車",臺南市中西區海安路一段12號,22.988038,120.195066
UN201611090275,"2016-11-09 18:07:00",安南區,路燈故障,9盞以下路燈故障,安南區義吉街112巷1號右側,安南區義吉街112巷1號右側,23.0318871,120.1961519
UN201611090276,"2016-11-09 18:12:00",安平區,違規停車,違規停車,"安平區安平路174號 違規停車",臺南市安平路174號,22.998533,120.181769
UN201611090279,"2016-11-09 18:13:00",北區,噪音舉發,妨害安寧,"北區公園路746巷27之2號 妨害安寧",臺南市北區公園路746巷27之2號,23.008806,120.211282
UN201611090281,"2016-11-09 18:20:00",歸仁區,違規停車,違規停車,"歸仁區中山路三段81巷19號 違規停車",臺南市歸仁區中山路三段81巷19號,22.967112,120.286085
UN201611090283,"2016-11-09 18:23:00",北區,髒亂及汙染,空氣汙染,"北區育賢街桂田擎天樹工地 髒亂及汙染",北區育賢街,23.0146818,120.2080746
UN201611090286,"2016-11-09 18:32:00",永康區,違規停車,違規停車,"永康區南工街228號 違規停車",臺南市永康區南工街228號,23.013354,120.238792
UN201611090295,"2016-11-09 18:49:00",中西區,違規停車,違規停車,"中西區北門路一段171號 違規停車",中西區北門路一段171號,22.99602177335182,120.21185919642448
UN201611090298,"2016-11-09 19:00:00",中西區,違規停車,違規停車,"中西區西門路２段387號  違規停車",臺南市中西區西門路2段387號,22.998515,120.200417
UN201611090299,"2016-11-09 19:00:00",中西區,違規停車,違規停車,"中西區西門路一段466號～476號  違規停車",臺南市中西區西門路一段466號,22.983052,120.198015
UN201611090300,"2016-11-09 18:47:00",安平區,噪音舉發,場所連續噪音,"安平區州平三街12號   噪音",臺南市安平區州平三街12號,22.99872,120.149013
UN201611090303,"2016-11-09 19:14:00",東區,違規停車,違規停車,"東區裕農路448之9號 違規停車",臺南市東區裕農路448之9號,22.987909,120.231866
UN201611090305,"2016-11-09 19:23:00",東區,交通運輸,佔用道路,"東區懷恩街長榮路口   旗幟佔用馬路",東區懷恩街長榮路口,22.9892484,120.2198123
UN201611090312,"2016-11-09 20:00:00",北區,違規停車,違規停車,"北區勝利路457號 違規停車",臺南市北區勝利路457號,23.005482,120.218762
UN201611090313,"2016-11-09 20:00:00",永康區,違規停車,違規停車,"永康區大橋二街218號 違規停車",台南市永康區大橋二街218號,23.020979,120.2306513
UN201611090314,"2016-11-09 20:00:00",安平區,違規停車,違規停車,"安平區慶平路541號 違規停車",台南市安平區慶平路541號,22.9973365,120.1710088
UN201611090318,"2016-11-09 20:14:00",安平區,違規停車,違規停車,"安平區華平路658號 違規停車",臺南市華平路658號,22.995893,120.17588
UN201611090319,"2016-11-09 20:13:00",佳里區,髒亂及汙染,空氣汙染,"佳里區蕭壠文化園區（佳里區六安里六安130號）附近 空氣污染",臺南市佳里區六安里六安130號,23.172406,120.177822
UN201611090321,"2016-11-09 20:28:00",安平區,違規停車,違規停車,"安平區華平路658號 違規停車",臺南市華平路658號,22.995893,120.17588
UN201611090326,"2016-11-09 20:43:00",關廟區,路燈故障,9盞以下路燈故障,"關廟區龜洞里 編號：南雄高幹276右3、旗官高分16    路燈不亮","臺南市關廟區龜洞里 編號",22.902443,120.350845
UN201611090327,"2016-11-09 20:51:00",東區,違規停車,違規停車,"東區大同路一段323號前 違停",臺南市東區大同路一段323號,22.981547,120.21206
UN201611090330,"2016-11-09 20:55:00",新市區,噪音舉發,妨害安寧,"新市區永福街16巷70弄12號  妨礙安寧",臺南市新市區永福街16巷70弄12號,23.075561,120.295654
UN201611090333,"2016-11-09 21:08:00",佳里區,違規停車,違規停車,"佳里區忠孝東路77號  違規停車",722台灣台南市佳里區忠孝東路77號,23.165162785825089,120.17899105612344
UN201611090338,"2016-11-09 21:41:00",永康區,違規停車,違規停車,"永康區中華路893巷靠近台鐵圍牆邊 違規停車",永康區中華路893巷,22.9863903,120.201433
UN201611090339,"2016-11-09 21:45:00",安南區,路燈故障,9盞以下路燈故障,"安南區長和路一段222巷115弄100號  路燈故障",臺南市安南區長和路一段222巷115弄100號,23.05703,120.240962
UN201611090340,"2016-11-09 21:49:00",北區,路燈故障,9盞以下路燈故障,"北區育賢街252號、及256或258號前 路燈不亮",臺南市北區育賢街252號,23.01435,120.208142
UN201611090344,"2016-11-09 22:14:00",永康區,違規停車,違規停車,"永康區中華路409號 違規停車",710台灣台南市永康區中華路409號,23.0097543,120.233107
UN201611090350,"2016-11-09 22:37:00",中西區,噪音舉發,妨害安寧,"中西區衛民街129號 噪音舉發",臺南市衛民街129號,22.99328,120.207732
UN201611100001,"2016-11-10 00:00:00",東區,違規停車,違規停車,"東區中華東路3段381號 違規停車",臺南市東區中華東路3段381號,22.973558,120.221215
UN201611100003,"2016-11-10 00:06:00",永康區,噪音舉發,妨害安寧,"永康區正南五街289巷75號3樓  妨害安寧",710台灣台南市永康區正南五街289巷75號3樓,23.0349842,120.2368035
UN201611100006,"2016-11-10 01:06:00",北區,噪音舉發,妨害安寧,"北區和緯路一段 妨害安寧",北區和緯路一段,23.009843,120.2136111
UN201611100007,"2016-11-10 01:10:00",北區,違規停車,違規停車,"北區開元路507號 違規停車",北區開元路507號,23.0109034,120.2256645
UN201611100008,"2016-11-10 02:59:00",北區,違規停車,違規停車,"北區開元路515號  違規停車",臺南市北區開元路515號,23.011026,120.225619
UN201611100017,"2016-11-10 07:29:00",大內區,髒亂及汙染,道路散落物,大內區石城里石子瀨73之5號路面散落物,臺南市大內區石城里石子瀨73之5號,23.121482,120.357828
UN201611100026,"2016-11-10 08:31:00",東區,違規停車,違規停車,台南市東區凱旋路33號違規停車,臺南市東區凱旋路33號,22.992933,120.230513
UN201611100027,"2016-11-10 08:34:00",新市區,違規停車,違規停車,"744台灣台南市新市區民生路富林路 違規停車",744台灣台南市新市區民生路富林路,23.0790072,120.289895
UN201611100030,"2016-11-10 08:45:00",安平區,路燈故障,9盞以下路燈故障,"安平區世平路136號    路燈故障",臺南市安平區世平路136號,22.995875,120.150237
UN201611100037,"2016-11-10 09:02:00",安南區,違規停車,違規停車,"安南區北安路三段775號 違規停車",臺南市安南區北安路三段775號,23.04872,120.21131
UN201611100042,"2016-11-10 08:57:00",永康區,違規停車,違規停車,"永康區勝華街140巷7號 違規停車",臺南市永康區勝華街140巷7號,23.00691,120.231488
UN201611100044,"2016-11-10 09:21:00",安南區,路燈故障,9盞以下路燈故障,"安南區公學路四段122巷272弄18之50號前面 路燈故障不亮",臺南市安南區公學路四段122巷272弄18之50號,23.072098,120.176862
UN201611100045,"2016-11-10 09:26:00",東山區,髒亂及汙染,空氣汙染,"東山區聖賢里北勢寮73號  空氣汙染",臺南市東山區聖賢里北勢寮73號,23.316235,120.364503
UN201611100061,"2016-11-10 09:49:00",北區,噪音舉發,場所連續噪音,"北區育成路118號 連續噪音",臺南市北區育成路118號,23.017376,120.208306
UN201611100080,"2016-11-10 10:24:00",仁德區,髒亂及汙染,空氣汙染,"仁德區太子四街31巷1號  空氣汙染",臺南市仁德區太子四街31巷1號,22.987224,120.24962
UN201611100106,"2016-11-10 11:24:00",安平區,違規停車,違規停車,"安平區華平路650號  違規停車",臺南市安平區華平路650號,22.995718,120.175901
UN201611100113,"2016-11-10 11:38:00",安平區,違規停車,違規停車,"安平區華平路658號  違規停車",臺南市安平區華平路658號,22.995893,120.17588
UN201611100117,"2016-11-10 11:54:00",中西區,違規停車,違規停車,"中西區西門路一段466號   違停",臺南市中西區西門路一段466號,22.983052,120.198015
UN201611100120,"2016-11-10 12:06:00",永康區,違規停車,違規停車,"永康區中正路926巷7號路口轉角  違規停車",臺南市永康區中正路926巷7號,23.0399,120.239454
UN201611100121,"2016-11-10 11:59:00",南區,路燈故障,9盞以下路燈故障,"南區中華南路一段30號前面 路燈故障",臺南市南區中華南路一段30號,22.972392,120.213871
UN201611100122,"2016-11-10 12:13:00",歸仁區,違規停車,違規停車,"歸仁區復興路42號  違規停車",臺南市歸仁區復興路42號,22.965348,120.296952
UN201611100125,"2016-11-10 12:17:00",安平區,違規停車,違規停車,"安平區華平路650號  違規停車",安平區華平路650號,22.9957693,120.1757969
UN201611100127,"2016-11-10 12:24:00",永康區,違規停車,違規停車,"永康區中正路545號統一超商周邊  違規停車",永康區中正路545號,23.039746354554257,120.23889485746622
UN201611100132,"2016-11-10 12:37:00",永康區,違規停車,違規停車,"永康區永二街447巷68弄112號 違規停車",臺南市永康區永二街447巷68弄112號,23.018019,120.246649
UN201611100148,"2016-11-10 12:59:00",南區,髒亂及汙染,空氣汙染,"南區金華路二段76號 空污",臺南市南區金華路二段76號,22.977567,120.191301
UN201611100158,"2016-11-10 13:10:00",中西區,髒亂及汙染,空氣汙染,"中西區西賢一街88巷17號 空氣汙染",臺南市中西區西賢一街88巷17號,23.001136,120.178075
UN201611100159,"2016-11-10 13:33:00",安平區,違規停車,違規停車,"台南市安平區永華路二段816號  違規停車",臺南市安平區永華路二段816號,22.991603,120.168832
UN201611100163,"2016-11-10 13:36:00",官田區,髒亂及汙染,空氣汙染,官田區湖山里６５之3號空氣汙染,臺南市官田區湖山里65之3號,23.210667,120.349641
UN201611100170,"2016-11-10 13:54:00",中西區,違規停車,違規停車,"中西區西華南街68號    違規停車",臺南市西華南街68號,22.994221,120.209598
UN201611100177,"2016-11-10 14:06:00",中西區,道路維修,路面坑洞,中西區府前一街109巷路面坑洞,中西區府前一街109巷,22.9953233,120.1876883
UN201611100184,"2016-11-10 14:18:00",中西區,違規停車,違規停車,"中西區忠義路二段177號 違規停車",臺南市中西區忠義路二段177號,22.996692,120.204066
UN201611100197,"2016-11-10 14:54:00",東區,違規停車,違規停車,"東區東寧路246號 違規停車",臺南市東區東寧路246號,22.990667,120.225395
UN201611100205,"2016-11-10 15:25:00",東區,交通運輸,佔用道路,"東區崇明路493號 佔用道路",臺南市東區崇明路493號,22.972466,120.225334
UN201611100208,"2016-11-10 15:25:00",北區,髒亂及汙染,空氣汙染,北區北安路一段102號空氣汙染,臺南市北區北安路一段102號,23.016814,120.210255
UN201611100210,"2016-11-10 15:30:00",中西區,違規停車,違規停車,"中西區忠義路二段177號 違規停車",臺南市中西區忠義路二段177號,22.996692,120.204066
UN201611100211,"2016-11-10 15:32:00",北區,違規停車,違規停車,"北區康樂街396號隔壁 違規停車",北區康樂街396號隔壁,23.0018609,120.1978923
UN201611100212,"2016-11-10 15:37:00",北區,違規停車,違規停車,"北區和緯路二段197號前 違停",北區和緯路二段197號前,23.0121417,120.205898
UN201611100218,"2016-11-10 15:58:00",北區,違規停車,違規停車,704台灣台南市北區和緯路二段238-248號違規停車,704台灣台南市北區和緯路二段238-248號,23.012161777989984,120.20660424616210
UN201611100221,"2016-11-10 15:48:00",北區,違規停車,違規停車,"北區文成路1號 違規停車",北區文成路1號,23.0123737,120.2080523
UN201611100224,"2016-11-10 16:11:00",中西區,違規停車,違規停車,"中西區永福路一段(新光三越旁)  違規停車",700台灣台南市中西區永福路一段,22.9896914,120.2004547
