UN201611100228,"2016-11-10 16:21:00",永康區,違規停車,違規停車,"永康區勝華街140巷7號  違規停車",臺南市永康區勝華街140巷7號,23.00691,120.231488
UN201611100234,"2016-11-10 16:35:00",東區,違規停車,違規停車,"東區東寧路201巷30-6號旁巷口紅線  違規停車",臺南市東區東寧路201巷30-6號,22.992005,120.225865
UN201611100238,"2016-11-10 16:45:00",永康區,違規停車,違規停車,"永康區中正七街沿線兩側(中正路到新民街)  違規停車",永康區中正七街,23.03959085415987,120.23959357291461
UN201611100243,"2016-11-10 16:50:00",中西區,違規停車,違規停車,"中西區府前路一段174-1號  違規停車",臺南市中西區府前路一段174-1號,22.989141,120.206489
UN201611100249,"2016-11-10 16:59:00",永康區,髒亂及汙染,空氣汙染,"永康區大灣路3號 空污",臺南市永康區大灣路3號,23.012851,120.271144
UN201611100251,"2016-11-10 17:04:00","北 區",違規停車,違規停車,"北區北園街8巷沿線兩側     違規停車",北區北園街8巷沿線兩側(桂花鄉大樓到北園街)/北區開元路485巷沿線兩側(開元路到桂花鄉大樓)/北區開元路成大城周圍(中山南路到開元路485巷),23.011276302055716,120.22432342171668
UN201611100255,"2016-11-10 17:08:00",北區,違規停車,違規停車,"北區文成路1號 違停",臺南市北區文成路1號,23.012197,120.208394
UN201611100256,"2016-11-10 17:10:00",東區,違規停車,違規停車,"台南市東區府連路161號  違規停車",臺南市東區府連路161號,22.985056,120.211894
UN201611100259,"2016-11-10 17:28:00",安平區,違規停車,違規停車,"台南市安平區永華路二段816號  違規停車",臺南市安平區永華路二段816號,22.991603,120.168832
UN201611100261,"2016-11-10 17:34:00",永康區,違規停車,違規停車,"永康區勝華街140巷7號對面消防栓  違規停車",臺南市永康區勝華街140巷7號,23.00691,120.231488
UN201611100263,"2016-11-10 17:36:00",新市區,違規停車,違規停車,"744台灣台南市新市區民生路和富林路交叉口  違規停車",744台灣台南市新市區民生路和富林路交叉口,23.079016,120.2895191
UN201611100266,"2016-11-10 17:40:00",安平區,違規停車,違規停車,"安平區華平路658號   違規停車",臺南市華平路658號,22.995893,120.17588
UN201611100271,"2016-11-10 17:52:00",永康區,路燈故障,9盞以下路燈故障,"永康區中山南路1066號 路燈不亮",臺南市永康區中山南路1066號,23.02556,120.255983
UN201611100275,"2016-11-10 18:01:00",南區,違規停車,違規停車,"南區健康路一段179號 違停",臺南市南區健康路一段179號,22.98117,120.207882
UN201611100277,"2016-11-10 18:04:00",安平區,違規停車,違規停車,安平區華平路650號違規停車,安平區華平路650號,22.9957693,120.1757969
UN201611100278,"2016-11-10 18:08:00",北區,違規停車,違規停車,台南市北區開元路517號違規停車,臺南市北區開元路517號,23.011101,120.225714
UN201611100280,"2016-11-10 18:20:00",永康區,違規停車,違規停車,台南市永康區大橋一街322-324號違規停車,臺南市永康區大橋一街324號,23.019569,120.232267
UN201611100283,"2016-11-10 18:24:00",北區,路燈故障,9盞以下路燈故障,"北區臨安路二段299號 路燈不亮",臺南市北區臨安路二段299號,23.004784,120.201946
UN201611100286,"2016-11-10 18:31:00",安平區,違規停車,違規停車,安平區郡平路310號違規停車,安平區郡平路310號,22.9897261,120.1631769
UN201611100290,"2016-11-10 18:49:00",永康區,違規停車,違規停車,台南市永康區復華十街45巷38號違規停車,臺南市永康區復華十街45巷38號,23.017253,120.244662
UN201611100292,"2016-11-10 18:52:00",中西區,違規停車,違規停車,"西區中山路2號到100號紅黃線違停+中西區中山路11號到117號紅黃線違停     違規停車",臺南市中西區中山路2號,22.992715,120.205643
UN201611100298,"2016-11-10 18:57:00",中西區,違規停車,違規停車,中西區衛民街119號違規停車,臺南市中西區衛民街119號,22.993165,120.208322
UN201611100299,"2016-11-10 18:58:00",中西區,違規停車,違規停車,中西區西華南街38號違規停車,臺南市中西區西華南街38號,22.993886,120.209524
UN201611100305,"2016-11-10 19:26:00",永康區,髒亂及汙染,空氣汙染,"永康區正南一街200號  空氣汙染",臺南市正南一街200號,23.027979,120.225189
UN201611100309,"2016-11-10 19:50:00",東區,違規停車,違規停車,"東區裕農路389巷3弄12號 違規停車",台南市東區裕農路389巷3弄12號,22.988488,120.2303677
UN201611100311,"2016-11-10 19:53:00",永康區,違規停車,違規停車,"永康區中華路893巷8號 違規停車",710台灣台南市永康區中華路893巷8號,23.0191951,120.2240908
UN201611100316,"2016-11-10 20:13:00",安南區,路燈故障,9盞以下路燈故障,"安南區長和路四段160巷5弄131號   水銀路燈不亮",臺南市安南區長和路四段160巷5弄131號,23.067377,120.207049
UN201611100319,"2016-11-10 20:16:00",永康區,路燈故障,9盞以下路燈故障,"永康區永科五路   路燈故障",710台灣台南市永康區永科五路,23.039249,120.2768691
UN201611100320,"2016-11-10 20:18:00",永康區,路燈故障,9盞以下路燈故障,"永康區永科王田大道168號    路燈故障",710台灣台南市永康區永科王田大道168號,23.0406717,120.2774932
UN201611100323,"2016-11-10 20:32:00",永康區,路燈故障,9盞以下路燈故障,"永康區永科三路     路燈故障",710台灣台南市永康區永科三路,23.0409862,120.2775029
UN201611100328,"2016-11-10 20:42:00",中西區,違規停車,違規停車,台南市中西區金華路三段95號違規停車,台南市中西區金華路三段95號,22.9905276,120.1923551
UN201611100329,"2016-11-10 20:45:00",南區,違規停車,違規停車,南區健康路一段367號、369號違規停車,南區健康路一段367號,22.981167,120.199922
UN201611100330,"2016-11-10 20:46:00",永康區,違規停車,違規停車,台南市永康區成功路202-1號違規停車,臺南市永康區成功路202-1號,23.010866,120.233255
UN201611100332,"2016-11-10 20:50:00",東區,違規停車,違規停車,東區仁和路157號前麻辣燙店家前違規停車,臺南市東區仁和路157號,22.968106,120.235246
UN201611100333,"2016-11-10 20:50:00",東區,違規停車,違規停車,東區懷恩街2號違規停車,臺南市東區懷恩街2號,22.989413,120.219361
UN201611100340,"2016-11-10 21:10:00",安南區,違規停車,違規停車,"安南區海佃路一段143號 違規停車",臺南市安南區海佃路一段143號,23.023157,120.191585
UN201611100341,"2016-11-10 21:11:00",北區,違規停車,違規停車,"北區林森路三段90號 違停",臺南市北區林森路三段90號,23.003258,120.224991
UN201611100343,"2016-11-10 21:15:00",北區,違規停車,違規停車,"北區文賢路693號 違規停車",台南市北區文賢路693號,23.0142907,120.1935694
UN201611100344,"2016-11-10 21:21:00",北區,違規停車,違規停車,"北區公園路591號 違規停車",台南市北區公園路591號,23.013087,120.210748
UN201611100345,"2016-11-10 21:36:00",北區,違規停車,違規停車,"北區公園路595-4號 違規停車",臺南市北區公園路595-4號,23.013465,120.211876
UN201611100349,"2016-11-10 21:46:00",南區,違規停車,違規停車,"安南區同安路262巷41號 違規停車",台南市安南區同安路262巷41號,23.0410854,120.1925577
UN201611100350,"2016-11-10 21:50:00",南區,違規停車,違規停車,"南區大同路二段194號 違規停車",台南市南區大同路二段194號,22.9769689,120.2135956
UN201611100353,"2016-11-10 21:47:00",安南區,民生管線,停電、漏電、電線掉落、孔蓋鬆動,"安南區本原街一段167巷160弄38號   停電",安南區本原街一段167巷160弄38號,23.0495231,120.195751
UN201611100355,"2016-11-10 21:59:00",南區,路燈故障,9盞以下路燈故障,"南區中華南路一段30號前 路燈不亮",臺南市南區中華南路一段30號,22.972392,120.213871
UN201611100356,"2016-11-10 22:03:00",安南區,違規停車,違規停車,"安南區安中路一段705巷55號 違規停車",台南市安南區安中路一段705巷55號,23.0412828,120.193785
UN201611100357,"2016-11-10 22:13:00",中西區,噪音舉發,妨害安寧,"中西區衛民街129號  妨害安寧",中西區衛民街129號,22.9932957,120.2076893
UN201611100358,"2016-11-10 22:19:00",安南區,噪音舉發,妨害安寧,"安南區安中路三段400巷29號 妨害安寧",臺南市安南區安中路三段400巷29號,23.050723,120.1748
UN201611100359,"2016-11-10 22:31:00",安南區,違規停車,違規停車,"安南區安中路一段703巷58號 違規停車",台南市安南區安中路一段703巷58號,23.0342031,120.210782
UN201611100361,"2016-11-10 22:42:00",永康區,違規停車,違規停車,"永康區復華五街55巷15號 違規停車",台南市永康區復華五街55巷15號,23.0131599,120.2477771
UN201611100365,"2016-11-10 23:24:00",安南區,噪音舉發,妨害安寧,"安南區海佃路四段55巷48弄133號 妨礙安寧",安南區海佃路四段55巷48弄133號,23.0561049,120.1755648
UN201611100366,"2016-11-10 23:27:00",東區,噪音舉發,妨害安寧,"東區林森路一段160號6樓 妨害安寧",東區林森路一段160號6樓,22.9815804,120.2152417
UN201611100367,"2016-11-10 23:30:00",永康區,違規停車,違規停車,"永康區新行街70號 違規停車",臺南市永康區新行街70號,23.039801,120.24193
UN201611110003,"2016-11-11 01:04:00",永康區,違規停車,違規停車,"永康區新行街70號 違規停車",台南市永康區新行街70號,23.0396604,120.2417694
UN201611110008,"2016-11-11 04:57:00",中西區,噪音舉發,妨害安寧,"中西區西華南街120巷18號 妨害安寧",臺南市中西區西華南街120巷18號,22.996711,120.21051
UN201611110009,"2016-11-11 05:14:00",永康區,違規停車,違規停車,"永康區中山南路119巷53號對面 違規停車",臺南市永康區中山南路119巷53號,23.013825,120.230052
UN201611110014,"2016-11-11 07:09:00",安平區,違規停車,違規停車,"安平區安平路110號 違規停車",臺南市安平區安平路110號,22.998391,120.183802
UN201611110016,"2016-11-11 07:21:00",南區,違規停車,違規停車,南區健康路一段367號違規停車,臺南市南區健康路一段367號,22.98128,120.199879
UN201611110023,"2016-11-11 07:48:00",中西區,違規停車,違規停車,台南市中西區民族路二段391巷9號違規停車,臺南市中西區民族路二段391巷9號,22.996804,120.201349
UN201611110025,"2016-11-11 07:58:00",中西區,違規停車,違規停車,中西區民族路二段55號違規停車,臺南市中西區民族路二段55號,22.994309,120.210166
UN201611110026,"2016-11-11 08:04:00",永康區,髒亂及汙染,空氣汙染,"永康區龍國街240巷3弄1號 空氣汙染",臺南市永康區龍國街240巷3弄1號,23.031748,120.263249
UN201611110033,"2016-11-11 08:28:00",永康區,髒亂及汙染,空氣汙染,"永康區龍國街240巷3弄1號 空氣汙染",臺南市永康區龍國街240巷3弄1號,23.031748,120.263249
UN201611110035,"2016-11-11 08:34:00",中西區,髒亂及汙染,空氣汙染,"中西區大勇街101號 空氣汙染",臺南市中西區大勇街101號,23.003237,120.1889
UN201611110038,"2016-11-11 08:41:00",中西區,違規停車,違規停車,"中西區中山路41跟43號前 違停",臺南市中西區中山路41號,22.993561,120.206177
UN201611110041,"2016-11-11 08:47:00",北區,違規停車,違規停車,"北區開元路515號前面 違停",臺南市北區開元路515號,23.011026,120.225619
UN201611110043,"2016-11-11 08:50:00",中西區,騎樓舉發,騎樓舉發,"中西區金華路四段104號跟118號前 騎樓舉發",臺南市中西區金華路四段104號,22.998594,120.195013
UN201611110065,"2016-11-11 09:24:00",東區,違規停車,違規停車,台南市東區東安路22號違規停車,臺南市東區東安路22號,22.991487,120.226308
UN201611110068,"2016-11-11 09:30:00",麻豆區,違規停車,違規停車,"台南市麻豆區中山路110號 違規停車",臺南市麻豆區中山路110號,23.183813,120.245056
UN201611110080,"2016-11-11 09:43:00",白河區,髒亂及汙染,空氣汙染,"白河區內角里內角127號之2  空氣汙染",臺南市白河區內角里內角127號,23.409168,120.446624
UN201611110081,"2016-11-11 09:44:00",永康區,違規停車,違規停車,"永康區中正路127巷 違規停車",永康區中正路127巷,23.030948267342072,120.25114852935077
UN201611110087,"2016-11-11 09:51:00",永康區,違規停車,違規停車,"永康區中正路545號 違規停車",永康區中正路545號,23.03978121870535,120.23892033845185
UN201611110095,"2016-11-11 10:04:00",中西區,違規停車,違規停車,"中西區成功路63號 違停",臺南市中西區成功路63號,22.99756,120.20886
UN201611110105,"2016-11-11 10:26:00",東區,違規停車,違規停車,"東區東興路358巷350號  違規停車",臺南市東區東興路358巷350號,22.997427,120.230012
UN201611110118,"2016-11-11 10:40:00",安平區,違規停車,違規停車,"安平區慶平路416號、慶平路418號  違規停車",安平區慶平路416號,22.997038,120.1755331
UN201611110149,"2016-11-11 11:30:00",北區,違規停車,違規停車,"北區富北街91號 違規停車",臺南市北區富北街91號,22.999975,120.211593
UN201611110158,"2016-11-11 11:47:00",安平區,違規停車,違規停車,"安平區華平路656號 違規停車",臺南市華平路656號,22.995837,120.175938
UN201611110159,"2016-11-11 11:47:00",永康區,違規停車,違規停車,"永康區中正路545號 違規停車",永康區中正路545號,23.039746354554257,120.23892704397441
UN201611110165,"2016-11-11 11:55:00",安平區,違規停車,違規停車,"安平區華平路650號 違規停車",臺南市華平路650號,22.995718,120.175901
UN201611110168,"2016-11-11 12:03:00",永康區,違規停車,違規停車,"永康區正義街正強街 違規停車",永康區正義街正強街,23.0265852,120.2520391
UN201611110170,"2016-11-11 12:07:00",永康區,違規停車,違規停車,"永康區中正七街22號 違規停車",永康區中正七街22號,23.039960167303473,120.2400904521346
UN201611110177,"2016-11-11 12:20:00",中西區,違規停車,違規停車,"中西區民族路二段76號 違規停車",臺南市中西區民族路二段76號,22.994726,120.20925
UN201611110188,"2016-11-11 12:41:00",佳里區,違規停車,違規停車,722台灣台南市佳里區中山路480號違規停車,722台灣台南市佳里區中山路480號,23.165985276182013,120.17817615132594
UN201611110196,"2016-11-11 12:45:00",北區,騎樓舉發,騎樓舉發,"北區北門路二段580號  騎樓舉發",臺南市北區北門路二段580號,23.010757,120.216424
UN201611110200,"2016-11-11 12:51:00",中西區,違規停車,違規停車,"中西區民族路二段76號 違規停車",臺南市中西區民族路二段76號,22.994726,120.20925
UN201611110204,"2016-11-11 12:55:00",永康區,違規停車,違規停車,"永康區永大路二段891號  違停",臺南市永康區永大路二段891號,23.0228,120.260975
UN201611110221,"2016-11-11 13:25:00",中西區,違規停車,違規停車,"台南市中西區南門路51號 違規停車",臺南市中西區南門路51號,22.990129,120.204853
UN201611110232,"2016-11-11 13:46:00",中西區,騎樓舉發,騎樓舉發,"中西區永華路一段27號    佔用騎樓",中西區永華路一段27號,22.9873198,120.1965966
UN201611110238,"2016-11-11 13:58:00",永康區,違規停車,違規停車,"台南市永康區忠孝路380巷 違規停車",台南市永康區忠孝路380巷,23.0176739,120.245412
UN201611110242,"2016-11-11 14:03:00",永康區,噪音舉發,場所連續噪音,"永康區王行里王行路351巷70弄5號對面  噪音",臺南市永康區王行里王行路351巷70弄5號,23.037928,120.27178
UN201611110251,"2016-11-11 14:21:00",東區,噪音舉發,場所連續噪音,"東區崇德十四街45號  場所連續噪音",臺南市東區崇德十四街45號,22.970792,120.228976
UN201611110253,"2016-11-11 14:24:00",中西區,違規停車,違規停車,"中西區大智街124號 違停",臺南市中西區大智街124號,22.989302,120.192808
UN201611110261,"2016-11-11 14:51:00",永康區,騎樓舉發,騎樓舉發,"永康區小東路513號  騎樓舉發",臺南市永康區小東路513號,22.998719,120.236233
UN201611110266,"2016-11-11 15:01:00",北區,違規停車,違規停車,"北區成功路176號 違規停車",704台灣台南市北區成功路176號,22.9987359,120.2042078
UN201611110289,"2016-11-11 15:50:00",東區,違規停車,違規停車,"東區青年路309號  違規停車",臺南市東區青年路309號,22.9918136,120.2132254
UN201611110293,"2016-11-11 15:59:00",安南區,路燈故障,9盞以下路燈故障,"安南區海佃路二段42號+義吉街112巷1號右邊  路燈故障",臺南市安南區海佃路二段42號,23.030546,120.190493
UN201611110295,"2016-11-11 16:01:00",永康區,違規停車,違規停車,"永康區小東路679號  違規停車",臺南市永康區小東路679號,22.99871,120.239358
UN201611110303,"2016-11-11 16:19:00",北區,違規停車,違規停車,"北區文賢路365巷18弄19號  違規停車",臺南市北區文賢路365巷18弄19號,23.008477,120.193052
UN201611110316,"2016-11-11 16:37:00",中西區,騎樓舉發,騎樓舉發,"中西區成功路3號的西側騎樓  騎樓舉發",臺南市中西區成功路3號,22.997231,120.210389
UN201611110317,"2016-11-11 16:40:00",東區,違規停車,違規停車,"東區北門路一段294號 違規停車",700台灣台南市東區北門路一段294號,22.9960728,120.2119179
UN201611110318,"2016-11-11 16:43:00",安平區,違規停車,違規停車,"安平區華平路658號  違規停車",臺南市安平區華平路658號,22.995893,120.17588
UN201611110319,"2016-11-11 16:43:00",新營區,違規停車,違規停車,"新營區大同路8之2號(張如輝眼科)旁的路口   違規停車",臺南市新營區大同路8之2號,23.307924,120.322684
UN201611110326,"2016-11-11 16:56:00",中西區,違規停車,違規停車,"中西區民族路二段1號  違規停車",臺南市中西區民族路二段1號,22.994331,120.211105
UN201611110328,"2016-11-11 16:57:00",永康區,騎樓舉發,騎樓舉發,"永康區小東路513號 佔用騎樓",臺南市永康區小東路513號,22.998719,120.236233
UN201611110331,"2016-11-11 17:02:00",安南區,噪音舉發,妨害安寧,"安南區郡安路5段164巷5弄26號 連續噪音",臺南市郡安路5段164巷5弄26號,23.028427,120.197371
UN201611110333,"2016-11-11 17:04:00",東區,違規停車,違規停車,"中西區北門路一段294號 違規停車",700台灣台南市中西區北門路一段294號,22.9960077,120.2118277
UN201611110346,"2016-11-11 17:20:00",中西區,違規停車,違規停車,"中西區新美街與郡緯街口 違規停車",臺南市中西區新美街266號,22.998282,120.201865
UN201611110347,"2016-11-11 17:23:00","北 區",違規停車,違規停車,"北區北園街8巷 違規停車",北區北園街8巷,23.010561588321103,120.22384498268364
UN201611110348,"2016-11-11 17:26:00",中西區,違規停車,違規停車,"中西區民族路三段從西門路至臨安路口 違規停車",民族路三段,22.998857,120.195917
UN201611110350,"2016-11-11 17:30:00",中西區,違規停車,違規停車,"中西區慶中街198號 違規停車",臺南市中西區慶中街198號,22.984514,120.205694
UN201611110357,"2016-11-11 17:34:00",中西區,違規停車,違規停車,"中西區民權路從中山路至青年路口 違停",中西區民權路,22.9982223,120.1933076
UN201611110359,"2016-11-11 17:43:00","北 區",違規停車,違規停車,"北區開元路 違規停車",北區開元路,23.011082502677986,120.22590391337873
UN201611110363,"2016-11-11 17:53:00",永康區,路燈故障,9盞以下路燈故障,"永康區大灣路1014號前 路燈不亮",臺南市永康區大灣路1014號,22.999921,120.253194
UN201611110368,"2016-11-11 18:19:00",善化區,路燈故障,9盞以下路燈故障,"善化區成功路92巷11號 路燈不亮",臺南市善化區成功路92巷11號,23.130073,120.314201
UN201611110371,"2016-11-11 18:29:00",永康區,違規停車,違規停車,"永康區大橋一街322-324號  違規停車",臺南市永康區大橋一街322-324號,23.019569,120.232267
UN201611110374,"2016-11-11 18:35:00",中西區,違規停車,違規停車,"中西區中山路2號到100號  中山路11號到117號    違規停車",臺南市中西區中山路2號,22.992715,120.205643
UN201611110378,"2016-11-11 18:44:00",中西區,違規停車,違規停車,"中西區民族路二段55-3號  違規停車",700台灣台南市中西區民族路二段55-3號,22.9945342,120.2102497
UN201611110379,"2016-11-11 18:53:00",中西區,違規停車,違規停車,"中西區西華南街近民族路口   違規停車",中西區西華南街近民族路口,22.9955627,120.2097732
UN201611110382,"2016-11-11 18:57:00",善化區,路燈故障,9盞以下路燈故障,"善化區興華路274號 路燈故障",臺南市善化區興華路274號,23.127086,120.295559
UN201611110393,"2016-11-11 19:37:00",永康區,路燈故障,9盞以下路燈故障,"永康區永大路三段511巷20弄20號前 違停",臺南市永康區永大路三段511巷20弄20號,23.04059,120.257425
UN201611110401,"2016-11-11 19:46:00",佳里區,違規停車,違規停車,"722台灣台南市佳里區林園街100號-112號   違規停車",722台灣台南市佳里區林園街112號,23.165622758933761,120.17799796464692
UN201611110406,"2016-11-11 19:47:00",中西區,違規停車,違規停車,"中西區中山路2號到100號紅黃線違停+中西區中山路11號到117號 紅黃線違停    違規停車",臺南市**中山路2號,23.234637,120.26121
UN201611110412,"2016-11-11 19:55:00",中西區,違規停車,違規停車,"中西區民族路二段76/99號的公車站   違規停車",中西區民族路二段,22.9957239,120.2057375
UN201611110413,"2016-11-11 19:59:00",善化區,違規停車,違規停車,"善化區民族路1號  違規停車",臺南市善化區民族路1號,23.133073,120.305597
UN201611110414,"2016-11-11 19:59:00",善化區,違規停車,違規停車,"善化區民族路1號  違規停車",臺南市善化區民族路1號,23.133073,120.305597
UN201611110417,"2016-11-11 20:09:00",東區,違規停車,違規停車,"東區中華東路二段18號前   違規停車",臺南市東區中華東路二段18號,22.987592,120.233255
UN201611110420,"2016-11-11 20:20:00",東區,違規停車,違規停車,"東區中華東路二段18號  違規停車",台南市東區中華東路二段18號,22.987615,120.2332004
UN201611110424,"2016-11-11 20:29:00",善化區,違規停車,違規停車,"善化區民族路1號  違規停車",臺南市善化區民族路1號,23.133073,120.305597
UN201611110429,"2016-11-11 20:55:00",東區,違規停車,違規停車,"東區中華東路二段20號  違規停車",臺南市東區中華東路二段20號,22.987419,120.233296
UN201611110435,"2016-11-11 21:28:00",北區,違規停車,違規停車,"北區西門路四段171巷口左右兩側   違停",北區西門路四段171巷口左右兩側,23.0106363,120.2072001
UN201611110436,"2016-11-11 21:31:00",安平區,違規停車,違規停車,"安平區安平路324號  違停/占用車道",臺南市安平區安平路324號,22.998464,120.177589
UN201611110445,"2016-11-11 22:06:00",南區,違規停車,違規停車,"南區大同路二段482巷191號    違規停車",臺南市南區大同路二段482巷191號,22.972925,120.209116
UN201611110448,"2016-11-11 22:15:00",東區,噪音舉發,妨害安寧,東區裕農路448之12號噪音舉發,臺南市裕農路448之12號,22.987909,120.231866
UN201611110452,"2016-11-11 22:24:00",六甲區,噪音舉發,妨害安寧,"六甲區七甲街93巷15弄8號  妨礙安寧",六甲區七甲街93巷15弄8號,23.2220844,120.3447621
UN201611110454,"2016-11-11 22:32:00",麻豆區,路燈故障,9盞以下路燈故障,"麻豆區信義路8-3號   路燈電線掉落",臺南市麻豆區信義路8-3號,23.181755,120.24871
UN201611110456,"2016-11-11 22:55:00",永康區,噪音舉發,妨害安寧,"永康區大武街2巷48號  妨害安寧",永康區大武街2巷48號,23.0185253,120.2233332
UN201611110458,"2016-11-11 23:08:00",北區,違規停車,違規停車,北區和緯路二段157號違規停車,臺南市北區和緯路二段157號,23.011772,120.206968
UN201611110459,"2016-11-11 23:09:00",新市區,噪音舉發,妨害安寧,新市區永福街111號噪音舉發,臺南市新市區永福街111號,23.074667,120.292272
UN201611110461,"2016-11-11 23:13:00",南區,噪音舉發,妨害安寧,"南區西門路一段364號   妨害安寧",南區西門路一段364號,22.9805149,120.1977883
UN201611110463,"2016-11-11 23:24:00",關廟區,噪音舉發,妨害安寧,"關廟區四維街52號   妨害安寧",臺南市關廟區四維街52號,22.955842,120.336158
UN201611120001,"2016-11-12 00:00:00",永康區,噪音舉發,場所連續噪音,永康區新行街262-284號噪音舉發,710台灣台南市永康區新行街262-284號,23.0446508,120.2423029
UN201611120003,"2016-11-12 00:24:00",安平區,噪音舉發,場所連續噪音,"深呼吸健身房  連續噪音",安平區建平十五街56號,22.9964358,120.1825644
UN201611120009,"2016-11-12 00:59:00",中西區,噪音舉發,妨害安寧,"金凱撒音樂會館 妨害安寧、菸害",中西區府前路二段227號2樓,22.9915943,120.1915563
UN201611120011,"2016-11-12 01:14:00",中西區,噪音舉發,妨害安寧,"中西區成功路40巷1弄10號  妨害安寧",臺南市中西區成功路40巷1弄10號,22.999258,120.200478
UN201611120013,"2016-11-12 02:35:00",東區,噪音舉發,場所連續噪音,東區崇德二十二街80號噪音舉發,701台灣台南市東區崇德二十二街80號,22.9662561,120.2299063
UN201611120022,"2016-11-12 07:04:00",北區,噪音舉發,妨害安寧,"北區大港里大興街246巷9號  噪音舉發",台南市北區大港里大興街246巷9號,23.0110631,120.187248
