UN201611140004,"2016-11-14 00:40:00",麻豆區,噪音舉發,妨害安寧,麻豆區中正路53-10號噪音舉發,臺南市麻豆區中正路53-10號,23.185464,120.248821
UN201611140006,"2016-11-14 01:18:00",永康區,違規停車,違規停車,"永康區新行街122巷跟新民街66巷 紅線違停",永康區新行街122巷新民街66巷,23.0411258,120.2425476
UN201611140007,"2016-11-14 01:51:00",永康區,違規停車,違規停車,"永康區復興路33巷內 紅、黃、白線違停",永康區復興路33巷內,23.0499779,120.2516641
UN201611140011,"2016-11-14 03:03:00",中西區,噪音舉發,妨害安寧,"中西區海安路一段169號 妨害安寧",中西區海安路一段169號,22.9919936,120.1956616
UN201611140012,"2016-11-14 03:20:00",永康區,違規停車,違規停車,永康區中正七街30號紅線違規停車,臺南市永康區中正七街30號,23.04001,120.240238
UN201611140019,"2016-11-14 07:05:00",東區,髒亂及汙染,其他汙染舉發,"東區東安路105號    噪音",臺南市東區東安路105號,22.993178,120.226384
UN201611140021,"2016-11-14 07:19:00",永康區,違規停車,違規停車,"永康區大橋二街83號   違停",臺南市永康區大橋二街83號,23.01876,120.227088
UN201611140040,"2016-11-14 08:32:00",南區,騎樓舉發,騎樓舉發,"南區新興路533巷33弄217號  騎樓舉發",臺南市南區新興路533巷33弄217號,22.97365,120.187957
UN201611140041,"2016-11-14 08:41:00",東區,噪音舉發,場所連續噪音,"東區裕農路288巷70弄39之2號    施工噪音跟施工安全",臺南市東區裕農路288巷70弄39之2號,22.984952,120.229124
UN201611140050,"2016-11-14 08:53:00",後壁區,髒亂及汙染,道路散落物,"後壁區嘉田里上茄苳12-39號   狗屍體",臺南市後壁區嘉田里上茄苳12-39號,23.393275,120.376838
UN201611140052,"2016-11-14 08:55:00",永康區,違規停車,違規停車,"台南市永康區永科一路98號   違規停車",臺南市永康區永科一路98號,23.043761,120.277615
UN201611140055,"2016-11-14 09:00:00",東區,違規停車,違規停車,"東區裕學路 違停",東區裕學路,22.9850335,120.2382693
UN201611140061,"2016-11-14 09:20:00",永康區,違規停車,違規停車,"台南市永康區中正南路634-636號   違規停車",臺南市永康區中正南路634-636號,23.038367,120.233955
UN201611140069,"2016-11-14 09:26:00",東區,違規停車,違規停車,東區長榮路三段52號違規停車,臺南市東區長榮路三段52號,22.993369,120.2218
UN201611140078,"2016-11-14 09:37:00",中西區,違規停車,違規停車,"中西區忠義路2段177號   違規停車",中西區忠義路2段177號,22.9966406,120.2041012
UN201611140107,"2016-11-14 10:09:00",仁德區,髒亂及汙染,空氣汙染,"仁德區開發五路16號 空氣汙染",臺南市仁德區開發五路16號,22.922008,120.249378
UN201611140112,"2016-11-14 10:17:00",東區,噪音舉發,妨害安寧,"東區崇德十六街2之3號2樓 妨礙安寧",東區崇德十六街2之3號2樓,22.9695327,120.2278381
UN201611140114,"2016-11-14 10:20:00",南區,髒亂及汙染,空氣汙染,"南區明興路619巷110號-1   空污",臺南市南區明興路619巷110號,22.940625,120.184738
UN201611140118,"2016-11-14 10:24:00",南區,噪音舉發,妨害安寧,"南區新建路29巷   妨害安寧",南區新建路29巷,22.9705043,120.1858822
UN201611140124,"2016-11-14 10:33:00",安南區,路燈故障,9盞以下路燈故障,"安南區開安一街17號前 路燈",臺南市安南區開安一街17號,23.046778,120.224498
UN201611140128,"2016-11-14 10:42:00",歸仁區,髒亂及汙染,空氣汙染,"歸仁區媽廟村保大路一段152巷160號  空污",臺南市媽廟村保大路一段152巷160號,23.010985,120.293054
UN201611140133,"2016-11-14 10:42:00",北區,道路維修,人孔蓋或溝蓋聲響鬆動,"北區育德路666號   孔蓋鬆動",臺南市北區育德路666號,23.017193,120.207624
UN201611140138,"2016-11-14 11:10:00",中西區,違規停車,違規停車,"中西區府前路一段229號 違規停車",臺南市中西區府前路一段229號,22.989028,120.203522
UN201611140153,"2016-11-14 11:28:00",永康區,違規停車,違規停車,永康區大仁街29號違規停車,臺南市永康區大仁街29號,23.000863,120.256533
UN201611140173,"2016-11-14 11:48:00",中西區,違規停車,違規停車,"中西區西門路一段466號～476號  違規停車",臺南市中西區西門路一段466號,22.983052,120.198015
UN201611140178,"2016-11-14 11:57:00",東區,違規停車,違規停車,"東區榮譽街120號 違規停車",臺南市東區榮譽街120號,22.975122,120.218407
UN201611140209,"2016-11-14 13:08:00",中西區,髒亂及汙染,空氣汙染,"中西區大智街96號 空汙",臺南市中西區大智街96號,22.989722,120.192981
UN201611140213,"2016-11-14 13:15:00",東區,路燈故障,9盞以下路燈故障,"東區崇德二十七街47號前 路燈故障不亮",臺南市東區崇德二十七街47號,22.96213,120.229282
UN201611140225,"2016-11-14 13:47:00",中西區,違規停車,違規停車,"中西區西華南街60號 違規停車",臺南市西華南街60號,22.994113,120.209579
UN201611140230,"2016-11-14 13:49:00",東區,違規停車,違規停車,"東區仁和路139巷51弄  佔用道路","仁和路139巷51弄 整排路霸",22.9710266,120.237154
UN201611140231,"2016-11-14 13:48:00",南區,噪音舉發,妨害安寧,"南區聖南街18號 妨礙安寧",臺南市南區聖南街18號,22.981059,120.190781
UN201611140249,"2016-11-14 14:05:00",中西區,違規停車,違規停車,"中西區西門路一段468號～472號   違規停車",臺南市中西區西門路一段468號,22.983195,120.197804
UN201611140260,"2016-11-14 14:13:00",北區,髒亂及汙染,空氣汙染,"北區公園路579-2號的沙茶爐火   空氣汙染",臺南市北區公園路579-2號,23.010615,120.210668
UN201611140274,"2016-11-14 14:49:00",永康區,髒亂及汙染,其他汙染舉發,"永康區王行里王行路351巷70弄5號對面 噪音汙染",臺南市永康區王行里王行路351巷70弄5號,23.037928,120.27178
UN201611140277,"2016-11-14 15:01:00",中西區,違規停車,違規停車,中西區民生路二段263-271號違規停車,臺南市中西區民生路二段263-271號,22.996313,120.192645
UN201611140281,"2016-11-14 14:41:00",中西區,道路維修,路面坑洞,"中西區海安路一段51號前面 路面坑洞",臺南市中西區海安路一段51號,22.988888,120.194733
UN201611140288,"2016-11-14 15:24:00",北區,違規停車,違規停車,"北區西門路四段343-345號    違規停車",臺南市北區西門路四段343-345號,23.015252,120.209818
UN201611140294,"2016-11-14 15:34:00",東區,違規停車,違規停車,"台南市東區府連路437號  違規停車",臺南市東區府連路437號,22.986438,120.217129
UN201611140300,"2016-11-14 15:49:00",麻豆區,道路維修,寬頻管線、孔蓋損壞,"麻豆區光復路38號前 孔蓋聲響",臺南市麻豆區光復路38號,23.184579,120.24766
UN201611140303,"2016-11-14 15:54:00",中西區,交通運輸,佔用道路,"中西區國華街二段146號   佔用道路",臺南市中西區國華街二段146號,22.991143,120.196994
UN201611140308,"2016-11-14 16:00:00",永康區,違規停車,違規停車,"永康區忠勇街(中華立體停車場周圍)  違規停車",永康區忠勇街,23.000587295201022,120.23800838738678
UN201611140309,"2016-11-14 16:01:00",永康區,違規停車,違規停車,"永康區華興街沿線(忠孝路到忠勇街) 違規停車",永康區華興街,23.000782961381322,120.23895554244517
UN201611140318,"2016-11-14 16:24:00",中西區,騎樓舉發,騎樓舉發,"中西區忠義路二段56號  騎樓舉發",臺南市中西區忠義路二段56號,22.993154,120.203116
UN201611140327,"2016-11-14 16:32:00",佳里區,動物救援,犬貓急難救援,"佳里區佳化里202號隔壁 狗救援",臺南市佳里區佳化里202號,23.18723,120.191517
UN201611140333,"2016-11-14 16:50:00",北區,違規停車,違規停車,"北區北門路三段沿線兩側(長榮路到實踐街)  違規停車",北區北門路三段,23.01409160779474,120.21724909543991
UN201611140334,"2016-11-14 16:47:00",北區,違規停車,違規停車,"北區小東路289號   違規停車",臺南市北區小東路289號,22.999663,120.229461
UN201611140336,"2016-11-14 16:53:00","北 區",違規停車,違規停車,"北區北園街8巷沿線兩側(桂花鄉大樓到北園街)  違規停車",北區北園街8巷,23.0105097436542,120.2234161645174
UN201611140338,"2016-11-14 16:56:00",中西區,違規停車,違規停車,"中西區民族路二段65號  違規停車",臺南市中西區民族路二段65號,22.994306,120.2098
UN201611140342,"2016-11-14 17:01:00",中西區,違規停車,違規停車,"中西區中成路靠近成功路  違規停車",中西區中成路,22.9970008,120.2050903
UN201611140347,"2016-11-14 17:20:00",永康區,違規停車,違規停車,"永康區復國一路475巷19號 違規停車",臺南市永康區復國一路475巷19號,23.014374,120.244568
UN201611140356,"2016-11-14 17:33:00",永康區,違規停車,違規停車,"永康區中華路394號～398號  違規停車",臺南市永康區中華路394號,23.009634,120.233431
UN201611140360,"2016-11-14 17:41:00",歸仁區,路燈故障,9盞以下路燈故障,"歸仁區高鐵三路160巷126號附近 路燈不亮",臺南市歸仁區高鐵三路160巷126號,22.91997,120.279463
UN201611140365,"2016-11-14 18:00:00",東區,違規停車,違規停車,"東區崇德四街3巷8號 違規停車",臺南市東區崇德四街3巷8號,22.976855,120.224524
UN201611140368,"2016-11-14 18:07:00",永康區,道路維修,路面下陷、凹陷,"永康區大灣路406巷5號再往前 路面下陷",臺南市永康區大灣路406巷5號,23.005063,120.2661
UN201611140370,"2016-11-14 18:26:00",中西區,違規停車,違規停車,"中西區西門路二段194號  違規停車",臺南市中西區西門路二段194號,22.994599,120.199367
UN201611140373,"2016-11-14 18:30:00",東區,違規停車,違規停車,"東區東寧路37號 違規停車",台南市東區東寧路37號,22.9921942,120.2210376
UN201611140386,"2016-11-14 18:50:00",山上區,民生管線,漏水、停水、消防栓漏水或損壞,"山上區明和里北勢洲98號 消防栓漏水",臺南市山上區明和里北勢洲98號,23.110887,120.339056
UN201611140391,"2016-11-14 19:00:00",永康區,髒亂及汙染,空氣汙染,"永康區正南八街85號、87號 空氣污染",臺南市永康區正南八街85號,23.040037,120.231429
UN201611140401,"2016-11-14 19:07:00",安平區,噪音舉發,妨害安寧,"安平區安平路183號 妨害安寧",臺南市安平區安平路183號,23.000094,120.160815
UN201611140402,"2016-11-14 19:17:00",中西區,違規停車,違規停車,"中西區金華路三段91號 違規停車",台南市中西區金華路三段91號,22.9904266,120.1923354
UN201611140404,"2016-11-14 19:30:00",中西區,違規停車,違規停車,"中西區大同路一段142-144號 違規停車",中西區大同路一段142號,22.9843854,120.2109582
UN201611140408,"2016-11-14 19:30:00",中西區,違規停車,違規停車,"中西區府緯街73號 違停",中西區府緯街73號,22.9837816,120.1969566
UN201611140410,"2016-11-14 19:50:00",永康區,違規停車,違規停車,"永康區崑山科技大學 違規停車",永康區崑大路195號,22.998238,120.2547842
UN201611140413,"2016-11-14 19:34:00",南區,髒亂及汙染,空氣汙染,"南區國民路567巷口汽車保養廠 空氣污染",南區國民路567巷,22.973134,120.205122
UN201611140416,"2016-11-14 20:12:00",北區,違規停車,違規停車,"北區開元路291號對面 違停",臺南市北區開元路291號,23.008027,120.221153
UN201611140417,"2016-11-14 20:16:00",永康區,違規停車,違規停車,"永康區大同街和大同街639巷口 違規停車",710台灣台南市永康區大同街和大同街639巷口,23.0169088,120.2645688
UN201611140418,"2016-11-14 20:18:00",新市區,違規停車,違規停車,"新市區中正路152號 違規停車",臺南市新市區中正路152號,23.074094,120.291442
UN201611140423,"2016-11-14 20:30:00",中西區,違規停車,違規停車,違規停車,台南市中西區民族路二段239號,22.9959196,120.2046931
UN201611140436,"2016-11-14 21:09:00",歸仁區,髒亂及汙染,空氣汙染,"歸仁區民生十二街300號 空氣汙染",臺南市歸仁區民生十二街300號,22.954825,120.274478
UN201611140437,"2016-11-14 21:08:00",中西區,髒亂及汙染,空氣汙染,"中西區新美街14號 空氣汙染",臺南市中西區新美街14號,22.99457,120.200175
UN201611140444,"2016-11-14 21:28:00",北區,違規停車,違規停車,"北區公園路591-45號591-42號 違規停車",臺南市北區公園路591-45號,23.013198,120.211722
UN201611140446,"2016-11-14 21:30:00",安平區,違規停車,違規停車,"安平區安平路88號及安平路446巷與446巷25弄口 違停",臺南市安平區安平路88號,22.998278,120.184433
UN201611140448,"2016-11-14 21:38:00",安平區,違規停車,違規停車,"安平區安平路202號 違規停車",安平區安平路202號,22.998626,120.180851
UN201611140456,"2016-11-14 21:50:00",北區,違規停車,違規停車,"北區勝利路282號 違規停車",臺南市北區勝利路282號,23.006087,120.218902
UN201611140460,"2016-11-14 22:00:00",北區,違規停車,違規停車,北區公園路595-4號違規停車,台南市北區公園路595-4號,23.0134347,120.2116897
UN201611150002,"2016-11-15 01:05:00",永康區,噪音舉發,妨害安寧,"永康區中華路7巷20弄15號  妨害安寧",臺南市永康區中華路7巷20弄15號,22.999561,120.234181
UN201611150007,"2016-11-15 03:10:00",北區,違規停車,違規停車,北區大興街233巷46弄62號紅線違停,臺南市北區大興街233巷46弄62號,23.00907,120.187529
UN201611150010,"2016-11-15 06:54:00",永康區,噪音舉發,妨害安寧,"永康區新中街281巷38號 妨害安寧",臺南市永康區新中街281巷38號,23.039918,120.243145
UN201611150011,"2016-11-15 07:03:00",北區,違規停車,違規停車,台南市北區公園北路152號違規停車,臺南市北區公園北路152號,23.005205,120.20837
UN201611150012,"2016-11-15 07:11:00",新化區,髒亂及汙染,空氣汙染,"712台灣台南市新化區忠孝路2號    髒亂及汙染",712台灣台南市新化區忠孝路2號,23.0397537,120.3102606
UN201611150017,"2016-11-15 07:30:00",東區,違規停車,違規停車,"東區崇學路135巷12號前面 違規停車",臺南市東區崇學路135巷12號,22.97953,120.222288
UN201611150024,"2016-11-15 08:18:00",安平區,髒亂及汙染,空氣汙染,"安平區安北路130號-140號  空氣汙染",臺南市安平區安北路130號,23.003019,120.162235
UN201611150025,"2016-11-15 08:29:00",安平區,違規停車,違規停車,"安平區安平路 違規停車",安平區安平路,22.9986112,120.16961
UN201611150027,"2016-11-15 08:32:00",永康區,髒亂及汙染,空氣汙染,"永康區龍埔街137號   空氣汙染",臺南市永康區龍埔街137號,23.03383,120.263948
UN201611150034,"2016-11-15 08:52:00",中西區,違規停車,違規停車,"中西區城隍街靠近青年路口  違規停車",中西區城隍街青年路,22.9919116,120.2090264
UN201611150037,"2016-11-15 09:03:00",南區,動物救援,遊蕩犬隻捕捉管制,"南區水交社一街北邊空地  動物救援",南區水交社一街北邊空地,22.9782446,120.2019227
UN201611150046,"2016-11-15 09:27:00",北區,騎樓舉發,騎樓舉發,"北區西門路四段271號    騎樓舉發",臺南市西門路四段271號,23.013093,120.208899
UN201611150049,"2016-11-15 09:33:00",新營區,違規停車,違規停車,"台南市新營區中山路210-220號  違規停車",臺南市新營區中山路210-220號,23.303581,120.315261
