UN201612020017,"2016-12-02 07:36:00",新營區,動物救援,犬貓急難救援,"新營區中興路13巷3-2號   貓受傷",臺南市新營區中興路13巷3-2號,23.302831,120.317164
UN201612020019,"2016-12-02 07:49:00",北區,噪音舉發,妨害安寧,"北區北園街8巷23-75號   噪音舉發",北區北園街8巷23-75號,23.0107286,120.2239087
UN201612020023,"2016-12-02 08:07:00",東區,違規停車,違規停車,違規停車,臺南市東區林森路二段192巷70弄1號,22.98948,120.226595
UN201612020028,"2016-12-02 08:20:00",新營區,違規停車,違規停車,台南市新營區博愛街169號違規停車,臺南市新營區博愛街169號,23.30398,120.311273
UN201612020031,"2016-12-02 08:23:00",東區,噪音舉發,場所連續噪音,"東區崇德九街44號 連續施工噪音",臺南市東區崇德九街44號,22.973455,120.228593
UN201612020035,"2016-12-02 08:30:00","東 區",交通運輸,佔用道路,"701台灣台南市東區裕農三街78號 佔用道路",701台灣台南市東區裕農三街78號,22.9861923996411,120.2396783977747
UN201612020044,"2016-12-02 09:02:00",新營區,路燈故障,9盞以下路燈故障,"新營區新東里東泰五街32號 路燈故障",臺南市新營區新東里東泰五街32號,23.318036,120.325845
UN201612020051,"2016-12-02 09:19:00",北區,違規停車,違規停車,北區北園街87巷187弄1號違規停車,臺南市北區北園街87巷187弄1號,23.013858,120.220976
UN201612020052,"2016-12-02 09:19:00",安南區,騎樓舉發,騎樓舉發,安南區安中路一段678號,臺南市安南區安中路一段678號,23.042543,120.196834
UN201612020064,"2016-12-02 09:48:00",永康區,違規停車,違規停車,永康區永康街168號違規停車,永康區永康街168號,23.025504676646577,120.25628294806951
UN201612020065,"2016-12-02 09:53:00",北區,違規停車,違規停車,北區開元路485巷37號OK超商周邊違規停車,臺南市北區開元路485巷37號,23.011214,120.224202
UN201612020072,"2016-12-02 10:08:00",永康區,違規停車,違規停車,"永康區南台街40號 違規停車",臺南市南台街40號,23.022282,120.223299
UN201612020075,"2016-12-02 10:05:00",永康區,噪音舉發,妨害安寧,"永康區東橋一路128號威爾森幼兒園   妨害安寧",臺南市永康區東橋一路128號,23.017839,120.234657
UN201612020091,"2016-12-02 10:38:00",東區,髒亂及汙染,環境髒亂,"東區崇善十二街78號 空氣污染",臺南市東區崇善十二街78號,22.969971,120.233373
UN201612020092,"2016-12-02 10:44:00",永康區,交通運輸,佔用道路,"永康區中華東路燦坤 佔用道路",永康區中華東路燦坤,22.9937783,120.2340388
UN201612020095,"2016-12-02 10:47:00",東區,路燈故障,9盞以下路燈故障,"東區裕敬五街108號 路燈不亮",臺南市東區裕敬五街108號,22.977815,120.247296
UN201612020109,"2016-12-02 11:14:00",東區,違規停車,違規停車,"東區小東路25號 違停",臺南市東區小東路25號,22.999858,120.225812
UN201612020112,"2016-12-02 11:19:00",安平區,交通運輸,佔用道路,"安平區安平路133號及135號 佔用道路",臺南市安平區安平路133號,22.999874,120.162795
UN201612020124,"2016-12-02 11:48:00",東區,違規停車,違規停車,"東區中華東路二段（中華電信）325號 違規停車",臺南市台南市中華東路二段325號,22.981737,120.230179
UN201612020132,"2016-12-02 12:02:00",中西區,違規停車,違規停車,"中西區民生路二段95號 違規停車",中西區民生路二段95號,22.9950893,120.1967133
UN201612020133,"2016-12-02 12:01:00",東區,違規停車,違規停車,"東區勝利路跟育樂街交叉口還有東區怡東路74號 違規停車",臺南市東區怡東路74號,22.992432,120.228098
UN201612020137,"2016-12-02 12:19:00",東區,違規停車,違規停車,"東區崇善路454號 違規停車",臺南市東區崇善路454號,22.973196,120.229373
UN201612020138,"2016-12-02 12:22:00",永康區,違規停車,違規停車,"永康區中正七街22號及27號 違規停車",臺南市永康區中正七街22號,23.039754,120.239961
UN201612020141,"2016-12-02 12:30:00",中西區,違規停車,違規停車,"中西區西門路二段387號(郡緯街轉角消防栓)  轉角紅線違停",臺南市中西區西門路二段387號,22.998515,120.200417
UN201612020149,"2016-12-02 12:38:00",中西區,違規停車,違規停車,"民族路二段230號 石精臼點心城周邊＋對面 違規停車",臺南市民族路二段230號,22.997259,120.201768
UN201612020151,"2016-12-02 12:38:00",中西區,違規停車,違規停車,"中西區大同路一段142號上富小吃周邊以及對面 違規停車",臺南市大同路一段142號,22.984273,120.211001
UN201612020155,"2016-12-02 12:40:00",中西區,違規停車,違規停車,"中西區民生路二段69號 違規停車",台南市中西區民生路二段69號,22.9949813,120.1971928
UN201612020158,"2016-12-02 12:43:00",中西區,違規停車,違規停車,"中西區興華街15號波哥對面及12-1號週邊 違規停車",臺南市中西區興華街15號,22.992099,120.210452
UN201612020159,"2016-12-02 12:48:00",中西區,違規停車,違規停車,"中西區國華街與成功路交叉丹丹漢堡 違規停車",中西區國華街成功路,23.0000831,120.1999849
UN201612020160,"2016-12-02 12:53:00",永康區,違規停車,違規停車,"永康區中正路545號 違規停車",永康區中正路545號,23.0396461,120.2387988
UN201612020161,"2016-12-02 12:53:00",中西區,違規停車,違規停車,"中西區中山路31號以及周邊 違規停車",臺南市中西區中山路31號,22.9933,120.205975
UN201612020169,"2016-12-02 13:24:00",東區,動物救援,犬貓急難救援,"東區東興路31巷1號 犬受困",臺南市東區東興路31巷1號,22.990745,120.228401
UN201612020170,"2016-12-02 13:25:00",永康區,騎樓舉發,騎樓舉發,"永康區小東路513號 佔用騎樓",臺南市永康區小東路513號,22.998719,120.236233
UN201612020187,"2016-12-02 14:05:00",永康區,交通運輸,佔用道路,永康區小東路513號佔用道路,永康區小東路513號,22.9987661,120.236238
UN201612020196,"2016-12-02 14:28:00",中西區,違規停車,違規停車,中西區永華路一段1號違規停車,臺南市中西區永華路一段1號,22.988572,120.188368
UN201612020198,"2016-12-02 14:29:00",中西區,違規停車,違規停車,中西區永華路一段1號違規停車,臺南市中西區永華路一段1號,22.988572,120.188368
UN201612020199,"2016-12-02 14:32:00",中西區,違規停車,違規停車,中西區永華路一段3號違規停車,臺南市中西區永華路一段3號,22.988572,120.188368
UN201612020201,"2016-12-02 14:33:00",中西區,違規停車,違規停車,中西區永華路一段3號違規停車,臺南市中西區永華路一段3號,22.988572,120.188368
UN201612020202,"2016-12-02 14:34:00",中西區,違規停車,違規停車,中西區永華路一段7號違規停車,臺南市中西區永華路一段7號,22.988572,120.188368
UN201612020205,"2016-12-02 14:37:00",南區,違規停車,違規停車,南區永華路一段11號違規停車,臺南市南區永華路一段11號,22.987257,120.197032
UN201612020209,"2016-12-02 14:42:00",南區,違規停車,違規停車,南區永華路一段11號違規停車,臺南市南區永華路一段11號,22.987257,120.197032
UN201612020210,"2016-12-02 14:49:00",南區,違規停車,違規停車,南區永華路一段11號違規停車,臺南市南區永華路一段11號,22.987257,120.197032
UN201612020211,"2016-12-02 14:49:00",永康區,違規停車,違規停車,台南市永康區大灣路231號違規停車,臺南市永康區大灣路231號,23.007079,120.267795
UN201612020212,"2016-12-02 14:50:00",南區,違規停車,違規停車,"中西區永華路一段11號 違規停車",臺南市永華路一段11號,22.987257,120.197032
UN201612020219,"2016-12-02 14:57:00",中西區,噪音舉發,妨害安寧,"台南市中西區法華街115號    妨害安寧",台南市中西區法華街115號,22.983218,120.2092809
UN201612020220,"2016-12-02 14:57:00",南區,違規停車,違規停車,南區永華路一段11號違規停車,臺南市南區永華路一段11號,22.987257,120.197032
UN201612020222,"2016-12-02 14:59:00",南區,違規停車,違規停車,南區永華路一段11號違規停車,臺南市南區永華路一段11號,22.987257,120.197032
UN201612020223,"2016-12-02 15:01:00",南區,違規停車,違規停車,南區永華路一段11號違規停車,臺南市南區永華路一段11號,22.987257,120.197032
UN201612020227,"2016-12-02 15:04:00",南區,違規停車,違規停車,"南區永華路一段27號 違規停車",臺南市南區永華路一段27號,22.987273,120.196672
UN201612020233,"2016-12-02 15:17:00",南區,違規停車,違規停車,南區西門路一段695號違規停車,臺南市南區西門路一段695號,22.987198,120.197324
UN201612020256,"2016-12-02 15:45:00",東區,違規停車,違規停車,台南市東區東寧路201巷30之6號違規停車,臺南市東區東寧路201巷30之6號,22.991788,120.225813
UN201612020257,"2016-12-02 15:47:00",永康區,噪音舉發,場所連續噪音,"永康區中正路155巷10弄9號 連續噪音",臺南市永康區中正路155巷10弄9號,23.029433,120.250791
UN201612020262,"2016-12-02 15:58:00",東區,違規停車,違規停車,違規停車,臺南市東區東平路267號,22.995514,120.227401
UN201612020277,"2016-12-02 14:55:00",南區,路燈故障,9盞以下路燈故障,"南區永興一街56號  路燈故障",臺南市南區永興一街56號,22.965922,120.19165
UN201612020292,"2016-12-02 16:57:00",中西區,違規停車,違規停車,"中西區民族路二段76/99號 違規停車","臺南市中西區民族 路二段76號",22.994726,120.20925
UN201612020307,"2016-12-02 17:29:00",中西區,違規停車,違規停車,"中西區西門路二段180號 違規停車",臺南市中西區西門路二段180號,22.994229,120.199249
UN201612020311,"2016-12-02 17:43:00",永康區,騎樓舉發,騎樓舉發,"永康區小東路513號 違停",臺南市永康區小東路513號,22.998719,120.236233
