UN201611300264,"2016-11-30 16:25:00",安平區,違規停車,違規停車,"安平區安平路50號   違停",安平區安平路50號,22.99811,120.185788
UN201611300268,"2016-11-30 16:31:00",安南區,民生管線,漏水、停水、消防栓漏水或損壞,"安南區怡安路跟培安路口   漏水",安南區怡安路跟培安路口,23.041461,120.2095762
UN201611300269,"2016-11-30 16:35:00",中西區,違規停車,違規停車,"中西區民族路二段63號65號  違規停車",中西區民族路二段63號,22.9943593,120.209799
UN201611300274,"2016-11-30 16:40:00",安南區,騎樓舉發,騎樓舉發,"安南區安中路一段812號  騎樓舉發",709台灣台南市安南區安中路一段812號,23.04352034397918,120.1948127216788
UN201611300277,"2016-11-30 16:41:00",北區,路燈故障,9盞以下路燈故障,"北區立賢路一段與育德一街 路燈故障",北區立賢路一段與育德一街,23.0096785,120.204842
UN201611300291,"2016-11-30 17:11:00",佳里區,髒亂及汙染,空氣汙染,"佳里區北門農工(六安里117號)附近  空氣汙染",臺南市佳里區六安里117號,23.179413,120.183159
UN201611300293,"2016-11-30 17:18:00",北區,違規停車,違規停車,"北區開元路81號   違規停車",北區開元路81號,23.006287738702266,120.21722177054752
UN201611300294,"2016-11-30 17:25:00",中西區,違規停車,違規停車,中西區西門路二段387號(郡緯街轉角)違規停車,中西區西門路二段387號,22.9985471,120.200283
UN201611300295,"2016-11-30 17:26:00",中西區,違規停車,違規停車,"中西區民族路二段63 65號違規停車",中西區民族路二段65號,22.9943597,120.2097544
UN201611300296,"2016-11-30 17:18:00",新化區,髒亂及汙染,其他汙染舉發,"新化區大德路184-38號  廢水排廢",新化區大德路184-38號,23.0447362,120.3025855
UN201611300299,"2016-11-30 17:39:00",安南區,交通運輸,號誌故障,"安南區長和路三段84號 號誌燈故障",安南區長和路三段84號,23.0634415,120.2169444
UN201611300301,"2016-11-30 17:45:00",永康區,髒亂及汙染,空氣汙染,"永康區正南八街85號 空氣汙染",永康區正南八街85號,23.0395014,120.2320712
UN201611300302,"2016-11-30 17:50:00",南區,違規停車,違規停車,南區德興路237巷與興隆路違規停車,南區德興路237巷與興隆路,22.9591229,120.1938453
UN201611300305,"2016-11-30 18:01:00",安平區,違規停車,違規停車,"安平區安平路50號 違規停車",安平區安平路50號,22.99811,120.185788
UN201611300309,"2016-11-30 18:17:00",北區,路燈故障,9盞以下路燈故障,"北區北成路128巷45弄  路燈故障",北區北成路128巷45弄,23.0213076,120.208355
UN201611300310,"2016-11-30 18:16:00",新營區,髒亂及汙染,空氣汙染,"新營區卯舍 空氣汙染",新營區卯舍,23.322096,120.330145
UN201611300311,"2016-11-30 18:23:00",北區,違規停車,違規停車,"北區實踐街2號 違停",北區實踐街2號,23.01475,120.216238
UN201611300312,"2016-11-30 18:25:00",中西區,髒亂及汙染,空氣汙染,"中西區南寧街25號 空氣汙染",中西區南寧街25號,22.9845287,120.2049978
UN201611300315,"2016-11-30 18:35:00",新市區,違規停車,違規停車,新市區和平街215號違規停車,臺南市新市區和平街215號,23.078917,120.291031
UN201611300316,"2016-11-30 18:38:00",中西區,違規停車,違規停車,"中西區城堭街40號 違規停車",中西區城堭街40號,22.9898198,120.2082097
UN201611300317,"2016-11-30 18:41:00",中西區,違規停車,違規停車,中西區衛民街60號違規停車,中西區衛民街60號,22.9931518,120.2102647
UN201611300318,"2016-11-30 18:42:00",東區,路燈故障,9盞以下路燈故障,"東區中華東路三段77巷口24號  路燈故障",東區中華東路三段77巷口24號,22.9731629,120.2235567
UN201611300319,"2016-11-30 18:47:00",安南區,髒亂及汙染,空氣汙染,"安南區安中路一段812號 空氣汙染",臺南市安南區安中路1段812號,23.043604,120.194815
UN201611300320,"2016-11-30 18:47:00",善化區,路燈故障,9盞以下路燈故障,路燈不亮,善化區,23.1402613,120.3089541
UN201611300321,"2016-11-30 18:49:00",中西區,違規停車,違規停車,中西區開山路78號違規停車,中西區開山路78號,22.9901395,120.2066364
UN201611300322,"2016-11-30 18:49:00",中西區,違規停車,違規停車,中西區永福路二段69號違規停車,中西區永福路二段69號,22.9920611,120.2006182
UN201611300323,"2016-11-30 18:50:00",中西區,違規停車,違規停車,中西區民生路一段152號違規停車,中西區民生路一段152號,22.9942671,120.2002935
UN201611300324,"2016-11-30 18:50:00",中西區,違規停車,違規停車,中西區民生路二段95號違規停車,中西區民生路二段95號,22.9950893,120.1967133
UN201611300325,"2016-11-30 18:51:00",中西區,違規停車,違規停車,中西區興華街15號違規停車,中西區興華街15號,22.9922128,120.2105654
UN201611300326,"2016-11-30 18:51:00",東區,違規停車,違規停車,"台南市東區崇明十街4號 違規停車",台南市東區崇明十街4號,22.9749297,120.2200099
UN201611300327,"2016-11-30 18:51:00",中西區,違規停車,違規停車,中西區民權路一段220巷違規停車,中西區民權路一段220巷,22.9926601,120.2078895
UN201611300328,"2016-11-30 18:52:00",中西區,違規停車,違規停車,中西區民族路二段230號違規停車,中西區民族路二段230號,22.9972751,120.201768
UN201611300329,"2016-11-30 18:53:00",中西區,違規停車,違規停車,中西區大同路一段142號違規停車,中西區大同路一段142號,22.9843854,120.2109582
UN201611300330,"2016-11-30 18:52:00",南區,路燈故障,9盞以下路燈故障,"南區西門路一段545巷46號 路燈故障",南區西門路一段545巷46號,22.9836978,120.1961066
UN201611300332,"2016-11-30 19:03:00",東區,路燈故障,9盞以下路燈故障,"東區崇德十八街37號  路燈不亮",東區崇德十八街37號,22.9688547,120.2285663
UN201611300333,"2016-11-30 19:08:00",安南區,路燈故障,9盞以下路燈故障,安南區海東一街二街路燈故障,安南區海東一街二街,23.0305261,120.1878567
UN201611300338,"2016-11-30 19:19:00",六甲區,違規停車,違規停車,"六甲區中山路43巷 違停",六甲區中山路43巷,23.2302707,120.350373
UN201611300340,"2016-11-30 19:27:00",南區,違規停車,違規停車,"安南區海佃路一段122號 違規停車",台南市安南區海佃路一段122號,23.0230086,120.1919951
UN201611300342,"2016-11-30 19:32:00",中西區,違規停車,違規停車,"中西區西門路一段466號 違規停車",中西區西門路一段466號,22.9831599,120.197701
UN201611300343,"2016-11-30 19:36:00",南區,騎樓舉發,騎樓舉發,"南區西門路一段579號對面 騎樓舉發",臺南市南區西門路一段579號,22.984392,120.197369
UN201611300347,"2016-11-30 19:54:00",南區,交通運輸,佔用道路,"南區西門路一段567號  佔用道路",臺南市南區西門路一段567號,22.984179,120.197395
UN201611300348,"2016-11-30 19:53:00",東區,違規停車,違規停車,"東區勝利路116號 違停",臺南市東區勝利路116號,22.995798,120.218353
UN201611300352,"2016-11-30 20:08:00",安平區,違規停車,違規停車,安平區華平路650號違規停車,安平區華平路650號,22.9957693,120.1757969
UN201611300353,"2016-11-30 20:10:00",南區,髒亂及汙染,環境髒亂,髒亂及汙染,臺南市南區西門路一段567號,22.984179,120.197395
UN201611300355,"2016-11-30 20:19:00",安平區,違規停車,違規停車,安平路100號違規停車,臺南市安平路100號,22.998296,120.184173
UN201611300356,"2016-11-30 20:19:00",安平區,違規停車,違規停車,安平區華平路650號違規停車,安平區華平路650號,22.9957693,120.1757969
UN201611300357,"2016-11-30 20:24:00",安平區,違規停車,違規停車,安平區安平路70號違規停車,安平區安平路70號,22.9981931,120.184817
UN201611300359,"2016-11-30 20:30:00",安平區,違規停車,違規停車,"安平區安平路346之1號 違規停車",安平區安平路346之1號,22.9984415,120.1770256
UN201611300360,"2016-11-30 20:31:00",中西區,違規停車,違規停車,"中西區民族路二段230號 違規停車",中西區民族路二段230號,22.9972751,120.201768
UN201611300366,"2016-11-30 20:50:00",中西區,道路維修,路面下陷、凹陷,"中西區民族路三段16號 路面凹陷",中西區民族路三段16號,22.9978224,120.1992413
UN201611300367,"2016-11-30 20:58:00",中西區,違規停車,違規停車,"中西區民族路二段76/99號 違規停車","臺南市民族路二段76 99號",22.995083,120.207033
UN201611300368,"2016-11-30 21:11:00",東區,違規停車,違規停車,台南市東區大同路一段46巷違規停車,台南市東區大同路一段46巷,22.9836705,120.2112053
UN201611300371,"2016-11-30 21:15:00",安平區,噪音舉發,場所連續噪音,安平區建平七街230號連續噪音,安平區建平七街230號,22.9887686,120.1804539
UN201611300376,"2016-11-30 21:54:00",永康區,路燈故障,9盞以下路燈故障,永康區洲尾街321巷路口路燈故障,台南市永康區洲尾街321巷路口,23.039119,120.2287386
UN201611300384,"2016-11-30 22:55:00",白河區,噪音舉發,妨害安寧,"白河區九龍街70號  妨害安寧",白河區九龍街70號,23.3486218,120.4136149
UN201611300385,"2016-11-30 22:59:00",中西區,違規停車,違規停車,"中西區樹林街二段45號 違規停車",台南市中西區樹林街二段45號,22.9855343,120.206343
UN201611300386,"2016-11-30 23:08:00",東區,違規停車,違規停車,"東區裕豐街218號 違規停車",台南市東區裕豐街218號,22.9881608,120.2274008
UN201611300390,"2016-11-30 23:54:00",永康區,噪音舉發,妨害安寧,永康區中華路7巷20弄口噪音舉發,710台灣台南市永康區中華路7巷20弄口,22.9994094,120.234234
UN201612010004,"2016-12-01 03:27:00",鹽水區,髒亂及汙染,市區道路路面油漬,"鹽水區忠孝路跟南太路口 市區道路路面油漬","鹽水區忠孝路 南太路",23.3112279,120.2705381
UN201612010013,"2016-12-01 07:22:00",安平區,違規停車,違規停車,"安平區安平路392號 違規停車",安平區安平路392號,22.998205,120.1751806
UN201612010014,"2016-12-01 07:24:00",中西區,道路維修,路面坑洞,"中西區中華西路西湖街 路面坑洞",中西區中華西路西湖街,23.0034037,120.1868682
UN201612010015,"2016-12-01 07:32:00",安平區,違規停車,違規停車,"安平路366號 違規停車",安平區安平路366號,22.9983333,120.1762296
UN201612010016,"2016-12-01 07:37:00",安平區,違規停車,違規停車,"安平區民權路四段安平路500巷 違規停車",安平區民權路四段安平路500巷,22.9991203,120.1777605
UN201612010019,"2016-12-01 07:44:00",永康區,違規停車,違規停車,"永康區中華二路266巷1之7號 違規停車",永康區中華二路266巷1之7號,23.0087784,120.2328557
UN201612010022,"2016-12-01 07:39:00",官田區,髒亂及汙染,道路散落物,"官田區拔子林路橋   貓屍體",官田區拔子林路橋,23.1730054,120.3208349
UN201612010025,"2016-12-01 08:03:00",安南區,違規停車,違規停車,"安南區文安街110巷7號  違規停車",安南區文安街110巷7號,23.0267049,120.2113192
UN201612010026,"2016-12-01 08:10:00",北區,違規停車,違規停車,台南市北區北門路二段14號違規停車,台南市北區北門路二段14號,22.9977597,120.2122125
UN201612010027,"2016-12-01 08:08:00",安南區,噪音舉發,場所連續噪音,"安南區海佃國小 連續噪音",安南區海佃國小,23.022854,120.1917946
UN201612010030,"2016-12-01 08:21:00",安南區,交通運輸,號誌故障,安南區台江大道跟玉英街口,安南區台江大道玉英街,23.0623266,120.1578331
UN201612010041,"2016-12-01 08:59:00",南區,違規停車,違規停車,違規停車,台南市南區永成路三段101號,22.965176,120.195307
UN201612010048,"2016-12-01 09:09:00",永康區,違規停車,違規停車,違規停車,臺南市永康區中華路58巷70號,23.002222,120.238327
UN201612010049,"2016-12-01 09:10:00",東區,路燈故障,9盞以下路燈故障,路燈故障,東區崇德路356號,22.9762546,120.2240348
UN201612010061,"2016-12-01 09:30:00",中西區,交通運輸,佔用道路,交通運輸,中西區赤崁樓,22.9975421,120.2026071
UN201612010077,"2016-12-01 09:51:00",中西區,違規停車,違規停車,違規停車,"臺南市開山路76、78、80、82-1,86號",22.98627,120.209675
UN201612010095,"2016-12-01 10:37:00",安平區,噪音舉發,妨害安寧,"安平區安平路183號隔壁 妨礙安寧",安平區安平路183號隔壁,23.0001906,120.160762
UN201612010103,"2016-12-01 10:54:00",中西區,違規停車,違規停車,中西區西華南街35號違規停車,中西區西華南街35號,22.9938716,120.2093781
UN201612010105,"2016-12-01 10:57:00",中西區,違規停車,違規停車,"中西區民族路二段63號65號   違規停車",中西區民族路二段63號,22.9943593,120.209799
UN201612010118,"2016-12-01 11:09:00",安南區,道路維修,路面坑洞,"安南區永安路75號 路面坑洞",安南區永安路75號,23.044191,120.2225278
UN201612010131,"2016-12-01 11:48:00",南區,路燈故障,9盞以下路燈故障,"南區明興路619巷101號前 路燈不亮",南區明興路619巷101號,22.9409861,120.184159
UN201612010133,"2016-12-01 11:52:00",安南區,道路維修,路面坑洞,"安南區開安三街24號前 路面坑洞",安南區開安三街24號,23.0481127,120.2247604
UN201612010138,"2016-12-01 12:00:00",北區,違規停車,違規停車,"北區北門路二段14號 違規停車",台南市北區北門路二段14號,22.9977597,120.2122125
UN201612010140,"2016-12-01 12:08:00",學甲區,交通運輸,佔用道路,"學甲區育德路夏威夷喜宴公司 佔用道路",學甲區育德路,23.2392796,120.1746106
UN201612010147,"2016-12-01 12:26:00",南區,違規停車,違規停車,"南區西門路一段209號 違規停車",台南市南區西門路一段209號,22.9752726,120.197449
UN201612010150,"2016-12-01 12:28:00",關廟區,交通運輸,號誌故障,"關廟區關新路一段一號 號誌故障",關廟區關新路一段一號,22.9847282,120.3109762
UN201612010157,"2016-12-01 12:55:00",中西區,違規停車,違規停車,"中西區國華街慈善街口 違規停車",國華街慈善街,22.9965617,120.198531
UN201612010193,"2016-12-01 14:16:00",中西區,違規停車,違規停車,台南市中西區府前路一段174號違規停車,臺南市中西區府前路一段174號,22.989141,120.206489
UN201612010195,"2016-12-01 14:19:00",東區,違規停車,違規停車,"台南市東區長榮路四段成杏校區旁 違規停車",台南市東區長榮路四段成杏校區旁,23.0042874,120.2224815
UN201612010215,"2016-12-01 14:53:00",安南區,髒亂及汙染,空氣汙染,台南市安南區安中路一段812號髒亂及汙染,台南市安南區安中路一段812號,23.043593,120.1947679
UN201612010217,"2016-12-01 14:53:00",安平區,噪音舉發,妨害安寧,"安平區永華路二段821號旁 妨礙安寧",臺南市安平區永華路二段821號,22.991214,120.168488
UN201612010221,"2016-12-01 15:10:00",永康區,違規停車,違規停車,永康區南台街36號(全家超商)周邊違規停車,永康區南台街36號,23.022328,120.223467
UN201612010224,"2016-12-01 15:04:00",關廟區,髒亂及汙染,其他汙染舉發,"關廟區大順路158號  廢水排放",關廟區大順路158號,22.9494157,120.3285428
UN201612010228,"2016-12-01 15:15:00",永康區,違規停車,違規停車,"永康區成功路172巷 違規停車",永康區成功路172巷,23.0108019,120.2345366
UN201612010236,"2016-12-01 15:40:00",東區,違規停車,違規停車,台南市東區中華東路三段381號違規停車,台南市東區中華東路三段381號,22.973606,120.221327
UN201612010237,"2016-12-01 15:40:00",佳里區,違規停車,違規停車,"佳里區成功路213巷30號  違規停車",臺南市佳里區成功路213巷30號,23.149725,120.174306
UN201612010239,"2016-12-01 15:45:00",佳里區,路燈故障,9盞以下路燈故障,"佳里區鎮山街85巷86號 路燈故障",佳里區鎮山街85巷86號,23.149562,120.1830538
UN201612010242,"2016-12-01 16:13:00",安南區,路燈故障,9盞以下路燈故障,"安南區城西街一段61巷176號 路燈故障",臺南市安南區城西街一段61巷176號,23.059524,120.12702
UN201612010243,"2016-12-01 16:10:00",新營區,違規停車,違規停車,"新營區府西路*府西路63巷 交叉處  違停","新營區府西路*府西路63巷 交叉處",23.312815,120.3137826
UN201612010252,"2016-12-01 16:31:00",新營區,違規停車,違規停車,"新營區中正路4號  違規停車",730台灣台南市新營區中正路4號,23.307663090548765,120.31629310000717
UN201612010261,"2016-12-01 16:38:00",北區,違規停車,違規停車,"北區開元橋西側人行道  違規停車",北區開元橋西側人行道,23.0111749,120.2260566
UN201612010262,"2016-12-01 16:43:00",中西區,違規停車,違規停車,"中西區民族路二段20、63、65號   違規停車",中西區民族路二段20、63、65號,22.9948341,120.2110719
UN201612010263,"2016-12-01 16:44:00",中西區,違規停車,違規停車,"中西區健康路一段水交社郵局前 違規停車",中西區健康路一段水交社郵局前,22.9813813,120.2046539
UN201612010265,"2016-12-01 16:50:00",北區,違規停車,違規停車,"北區開元路485巷37號  違規停車",北區開元路485巷37號,23.011264,120.2241961
UN201612010271,"2016-12-01 17:09:00",安平區,違規停車,違規停車,"安平區安平路482-3號  違規停車",台南市安平區安平路482-3號,22.998518,120.172616
UN201612010272,"2016-12-01 17:20:00",中西區,違規停車,違規停車,"中西區永福路二段113號 違規停車",中西區永福路二段113號附近以及周邊,22.9935557,120.2010592
UN201612010275,"2016-12-01 17:33:00",中西區,民生管線,漏水、停水、消防栓漏水或損壞,"中西區民權路四段112巷25號前面 消防栓漏水",中西區民權路四段112巷25號,23.0000423,120.1832399
UN201612010280,"2016-12-01 17:45:00",中西區,違規停車,違規停車,違規停車,中西區開山路78、80號,22.9901395,120.2066364
UN201612010285,"2016-12-01 17:50:00",中西區,違規停車,違規停車,"中西區中山路178號   違規停車",台南市中西區中山路178號,22.9962421,120.211275
UN201612010286,"2016-12-01 17:50:00",中西區,違規停車,違規停車,"中西區中山路178號   違規停車",台南市中西區中山路178號,22.9962421,120.211275
UN201612010287,"2016-12-01 17:50:00",中西區,違規停車,違規停車,"中西區民生路二段95號   112號   違規停車","中西區民生路二段95號  112號",22.9950893,120.1967133
UN201612010289,"2016-12-01 17:51:00",安定區,路燈故障,9盞以下路燈故障,"安定區六嘉里六塊寮159-1號   路燈故障",709台灣台南市安定區六嘉里六塊寮159-1號,23.0759424,120.2193624
UN201612010292,"2016-12-01 17:38:00",南區,路燈故障,9盞以下路燈故障,南區健康路二斷491號門前,臺南市南區健康路二斷491號,22.982244,120.183828
UN201612010294,"2016-12-01 18:00:00",中西區,髒亂及汙染,市區道路路面油漬,"中西區民生路二段200號 路面油漬",中西區民生路二段200號,22.996566,120.193584
UN201612010295,"2016-12-01 18:03:00",安南區,路燈故障,9盞以下路燈故障,"安南區府安路七段10巷口 路燈不亮",安南區府安路七段10巷,23.0140846,120.1813533
UN201612010298,"2016-12-01 18:32:00",南區,違規停車,違規停車,"南區大同路二段412-432號 違規停車",702台灣台南市南區大同路二段412號,22.9744463,120.2141942
UN201612010300,"2016-12-01 18:12:00",東區,違規停車,違規停車,"東區長榮路三段66巷25號  違停",東區長榮路三段66巷25號,22.9937244,120.2226573
UN201612010301,"2016-12-01 18:43:00",中西區,違規停車,違規停車,"中西區衛民街129號附近 違規停車",臺南市衛民街129號,22.99328,120.207732
UN201612010302,"2016-12-01 18:44:00",中西區,違規停車,違規停車,"中西區西華南街38號 違規停車",臺南市西華南街38號,22.993886,120.209524
UN201612010304,"2016-12-01 18:45:00",中西區,違規停車,違規停車,"中西區中山路31號及周邊 違規停車",臺南市中山路31號,23.234003,120.261294
UN201612010305,"2016-12-01 18:46:00",中西區,違規停車,違規停車,"中西區民族路二段230號，石精臼點心城周邊＋對面 違規停車",臺南市民族路二段230號,22.997259,120.201768
UN201612010307,"2016-12-01 18:48:00",中西區,違規停車,違規停車,"中西區大同路一段142號，上富小吃周邊以及對面紅黃線 違規停車",臺南市大同路一段142號,22.984273,120.211001
UN201612010308,"2016-12-01 18:49:00",永康區,違規停車,違規停車,"永康區復華十街47號 違規停車",台南市永康區復華十街47號,23.0174335,120.2452364
UN201612010312,"2016-12-01 18:58:00",新市區,違規停車,違規停車,"新市區中正路228號 違規停車",744台灣台南市新市區中正路228號,23.0778177,120.2919019
UN201612010314,"2016-12-01 19:00:00",新市區,違規停車,違規停車,"新市區中正路224號 違規停車",744台灣台南市新市區中正路224號,23.0758095,120.2916422
UN201612010316,"2016-12-01 19:02:00",中西區,違規停車,違規停車,"中西區中山路10號12號46號58號 違規停車",臺南市中山路46號,23.234951,120.262179
UN201612010319,"2016-12-01 19:03:00",東區,違規停車,違規停車,"東區勝利路99號 違停",東區勝利路99號,22.9920686,120.2176229
UN201612010321,"2016-12-01 19:06:00",安平區,路燈故障,9盞以下路燈故障,"安平區安億路232號對面 路燈故障",臺南市安平區安億路232號,22.993601,120.158495
UN201612010322,"2016-12-01 19:09:00",東區,違規停車,違規停車,"東區裕孝路260-4號/裕信路272號  違規停車",東區裕孝路260-4號裕信路,22.9842005,120.2431593
UN201612010324,"2016-12-01 19:10:00",永康區,違規停車,違規停車,"永康區永大二路33號 違規停車",710台灣台南市永康區永大二路33號,23.0185911,120.260152
UN201612010328,"2016-12-01 19:17:00",新營區,違規停車,違規停車,"新營區大同路6號對面  違停",新營區大同路6號對面,23.0168267,120.2642905
UN201612010331,"2016-12-01 19:25:00",新市區,髒亂及汙染,道路散落物,"新市區南科聯絡道  道路散落物",新市區南科聯絡道,23.0617517,120.2736448
UN201612010332,"2016-12-01 19:21:00",關廟區,路燈故障,9盞以下路燈故障,"關廟區大仁街 路燈編號：0021  路燈不亮",關廟區大仁街,22.9575078,120.325951
UN201612010347,"2016-12-01 19:33:00",中西區,違規停車,違規停車,"中西區民權路四段*頂美三街  違停",中西區民權路四段*頂美三街,22.9989698,120.1859212
UN201612010348,"2016-12-01 20:00:00",中西區,違規停車,違規停車,"中西區永福路二段197巷1號 違規停車",台南市中西區永福路二段197巷1號,22.9959001,120.2015536
UN201612010349,"2016-12-01 20:04:00",新市區,違規停車,違規停車,"新市區和平街209號附近 違規停車",臺南市新市區和平街209號,23.079155,120.291251
UN201612010350,"2016-12-01 20:06:00",中西區,違規停車,違規停車,"中西區民生路二段85號 違規停車",台南市中西區民生路二段85號,22.994925,120.1969228
UN201612010360,"2016-12-01 21:14:00",東區,交通運輸,號誌故障,"東區東寧路往裕農路，後甲圓環 號誌故障",後甲圓環,22.9884878,120.2339835
UN201612010361,"2016-12-01 21:16:00",東區,違規停車,違規停車,"東區東寧路 違規停車",東區東寧路,22.9908416,120.2252715
UN201612010362,"2016-12-01 21:29:00",永康區,違規停車,違規停車,"永康區中山南路104巷8號 違規停車",台南市永康區中山南路104巷8號,23.0115104,120.2268013
UN201612010365,"2016-12-01 21:39:00",仁德區,違規停車,違規停車,"仁德區中清二街28號 違規停車",台南市仁德區中清二街28號,22.9728841,120.2546396
UN201612010371,"2016-12-01 22:09:00",永康區,髒亂及汙染,空氣汙染,"永康區仁愛街15號  空汙",永康區仁愛街15號,23.0428762,120.2382283
UN201612010385,"2016-12-01 22:53:00",新營區,噪音舉發,妨害安寧,"新營區東明街96巷2號 妨害安寧",新營區東明街96巷2號,23.3196021,120.3235536
UN201612010391,"2016-12-01 23:22:00",東區,噪音舉發,妨害安寧,"東區裕信六街22號  妨害安寧",東區裕信六街22號,22.9765274,120.2461254
UN201612010393,"2016-12-01 23:37:00",北區,違規停車,違規停車,北區中華北路二段違規停車,704台灣台南市北區中華北路二段,23.0192018,120.1962472
UN201612010394,"2016-12-01 23:40:00",北區,噪音舉發,場所連續噪音,北區北園街99巷21弄7號噪音舉發,台南市北區北園街99巷21弄7號,23.0122075,120.2219846
UN201612020004,"2016-12-02 01:40:00",北區,違規停車,違規停車,北區公園路918巷1-3號紅線違規停車,臺南市北區公園路918巷1-3號,23.015126,120.21366
UN201612020007,"2016-12-02 04:46:00",南區,髒亂及汙染,道路散落物,"南區尊南街251號  道路散落物",臺南市南區尊南街251號,22.980613,120.188785
UN201612020011,"2016-12-02 06:25:00",中西區,民生管線,漏水、停水、消防栓漏水或損壞,"中西區南寧街136巷138號 路面漏水",臺南市中西區南寧街136巷138號,22.985484,120.200941
UN201612020013,"2016-12-02 06:46:00",中西區,交通運輸,佔用道路,"中西區五妃街187號 佔用道路",臺南市中西區五妃街187號,22.982515,120.205852
UN201612020014,"2016-12-02 06:59:00",中西區,違規停車,違規停車,"中西區開山路80號  違規停車",臺南市中西區開山路80號,22.990031,120.206704
UN201612020015,"2016-12-02 07:23:00",中西區,違規停車,違規停車,"中西區協和街30號附近    違規停車",中西區協和街30號,22.9993037,120.1900344
