UN201612050003,"2016-12-05 01:07:00",仁德區,噪音舉發,妨害安寧,"仁德區全福路80巷26號 妨害安寧",臺南市仁德區全福路80巷26號,22.952029,120.229902
UN201612050005,"2016-12-05 02:35:00",仁德區,違規停車,違規停車,"仁德區德安路24號  違停",臺南市仁德區德安路24號,22.952611,120.252709
UN201612050010,"2016-12-05 04:15:00",中西區,動物救援,犬貓急難救援,"中西區民族路二段246號 動物救援",臺南市中西區民族路二段246號,22.997373,120.201373
UN201612050013,"2016-12-05 04:59:00",六甲區,噪音舉發,妨害安寧,"六甲區中正路422巷1弄8號  妨害安寧",臺南市六甲區中正路422巷1弄8號,23.227459,120.35113
UN201612050014,"2016-12-05 05:49:00",南區,噪音舉發,妨害安寧,"南區尊南街163號對面 噪音舉發",臺南市尊南街163號,22.978072,120.188695
UN201612050015,"2016-12-05 05:51:00",永康區,噪音舉發,妨害安寧,"永康區復華一街143號  妨害安寧",臺南市永康區復華一街143號,23.005318,120.242034
UN201612050019,"2016-12-05 07:23:00",永康區,違規停車,違規停車,"永康區大仁街87號 違停",臺南市永康區大仁街87號,23.002403,120.25678
UN201612050026,"2016-12-05 08:05:00",中西區,違規停車,違規停車,"中西區廣慈街 違規停車",700台灣台南市中西區廣慈街027停車格,22.996451352412016,120.20687654973756
UN201612050036,"2016-12-05 08:30:00",中西區,違規停車,違規停車,"中西區民族路二段63號 65號 違規停車","中西區民族路二段63號 65號",22.9943593,120.209799
UN201612050037,"2016-12-05 08:31:00",中西區,違規停車,違規停車,"中西區濟生街11號對面 違停",臺南市中西區濟生街11號,22.997533,120.191591
UN201612050070,"2016-12-05 09:56:00",安平區,違規停車,違規停車,"安平區安平路74號  違停",臺南市安平路74號,22.998254,120.184727
UN201612050073,"2016-12-05 10:04:00",中西區,噪音舉發,場所連續噪音,"中西區西湖街233號 噪音",臺南市中西區西湖街233號,23.003878,120.182289
UN201612050084,"2016-12-05 10:35:00",中西區,違規停車,違規停車,"中西區民生路二段60號 違規停車",台南市中西區民生路二段60號,22.9950969,120.1976236
UN201612050086,"2016-12-05 10:35:00",東區,髒亂及汙染,空氣汙染,"東區崇德路56號 餐廳油煙空污",東區崇德路56號,22.9809888,120.2176722
UN201612050088,"2016-12-05 10:43:00",東區,違規停車,違規停車,"東區中華東路一段201號 機車黃線及騎樓違停",臺南市東區中華東路一段201號,22.990222,120.233952
UN201612050089,"2016-12-05 10:46:00",安南區,交通運輸,號誌故障,"安南區長和路二段74號 號誌燈故障",臺南市安南區長和路二段74號,23.064129,120.222343
UN201612050091,"2016-12-05 10:47:00",東區,違規停車,違規停車,"東區怡東路22號 紅線違停",臺南市東區怡東路22號,22.990797,120.227682
UN201612050092,"2016-12-05 10:53:00",東區,違規停車,違規停車,"東區大同路一段275巷9-17號 違規停車",台南市東區大同路一段275巷9-17號,22.988448,120.211799
UN201612050095,"2016-12-05 10:59:00",南區,違規停車,違規停車,"南區大成路二段132號 違規停車",臺南市南區大成路二段132號,22.975132,120.194266
UN201612050100,"2016-12-05 11:07:00",永康區,交通運輸,佔用道路,"永康區龍埔街85號 妨礙出入",臺南市永康區龍埔街85號,23.033894,120.264456
UN201612050110,"2016-12-05 11:29:00",永康區,違規停車,違規停車,"永康區大武街597巷62號～66號對面圍牆+永康區正新街51～65號   違規停車",臺南市永康區大武街597巷62號,23.02121,120.223317
UN201612050112,"2016-12-05 11:33:00",安平區,違規停車,違規停車,安平區慶平路416號、慶平路418號騎樓違規停車,臺南市安平區慶平路416號,22.996963,120.175551
UN201612050115,"2016-12-05 11:40:00",北區,違規停車,違規停車,違規停車,台南市北區海安路三段994號,23.019748,120.1996991
UN201612050121,"2016-12-05 11:59:00",中西區,違規停車,違規停車,中西區民族路二段18號黑色車輛違停違規停車,中西區民族路二段18號黑色車輛違停,22.9946294,120.2111349
UN201612050142,"2016-12-05 12:40:00",南區,違規停車,違規停車,"南區西門路一段623號 違規停車",臺南市南區西門路一段623號,22.985578,120.197353
UN201612050143,"2016-12-05 12:42:00",中西區,違規停車,違規停車,"中西區民族路二段18號 違規停車",中西區民族路二段18號,22.9946294,120.2111349
UN201612050146,"2016-12-05 12:48:00",中西區,違規停車,違規停車,"中西區民族路三段19-1號 違規停車",700台灣台南市中西區民族路三段19-1號,22.994646783939558,120.20161986362207
UN201612050149,"2016-12-05 13:01:00",安南區,路燈故障,9盞以下路燈故障,"安南區郡安路四段72號   路燈不亮",臺南市安南區郡安路四段72號,23.027925,120.210969
UN201612050154,"2016-12-05 13:21:00",東區,違規停車,違規停車,"東區崇德路46號前 違停",臺南市東區崇德路46號,22.981389,120.217567
UN201612050157,"2016-12-05 13:30:00",東區,違規停車,違規停車,"東區大同路一段275巷8號  違規停車",臺南市東區大同路一段275巷8號,22.982311,120.211914
UN201612050169,"2016-12-05 13:53:00",東區,違規停車,違規停車,"東區崇善路195號對面 違規停車",臺南市崇善路195號,22.980177,120.223991
UN201612050170,"2016-12-05 13:53:00",中西區,違規停車,違規停車,"中西區樹林街二段65號 違規停車",臺南市樹林街二段65號,22.985591,120.205669
UN201612050171,"2016-12-05 13:55:00",中西區,違規停車,違規停車,"中西區民生路二段95號 違規停車",臺南市民生路二段的95號,22.995084,120.196784
UN201612050174,"2016-12-05 13:57:00",中西區,違規停車,違規停車,"中西區永福路二段193號 違規停車",臺南市永福路二段193號,22.995706,120.201647
UN201612050185,"2016-12-05 14:11:00",永康區,動物救援,遊蕩犬隻捕捉管制,"永康區永康街91號 捕犬",臺南市永康區永康街91號,23.024207,120.256969
UN201612050187,"2016-12-05 14:19:00",永康區,違規停車,違規停車,"永康區中華路425號 違停",臺南市永康區中華路425號,23.01005,120.232677
UN201612050191,"2016-12-05 14:21:00",永康區,噪音舉發,場所連續噪音,"永康區南工街323巷14弄2號 噪音",臺南市永康區南工街323巷14弄2號,23.013685,120.236769
UN201612050193,"2016-12-05 14:27:00",善化區,髒亂及汙染,道路散落物,"善化區進學路91號 機車道中間 垃圾包",臺南市善化區進學路91號,23.136892,120.288543
UN201612050199,"2016-12-05 14:40:00",永康區,交通運輸,佔用道路,"大橋國中(永康區東橋十街1號)對面人行道轉角處 攤車妨礙通行",臺南市永康區東橋十街1號,23.022391,120.23216
UN201612050202,"2016-12-05 14:51:00",東區,噪音舉發,妨害安寧,"東區崇德十六街2-3號 妨害安寧",臺南市東區崇德十六街2號,22.969554,120.227841
UN201612050205,"2016-12-05 14:55:00",永康區,髒亂及汙染,道路散落物,"永康區大灣路436巷40號旁巷口及電線桿 垃圾包",臺南市永康區大灣路436巷40號,23.00434,120.265297
UN201612050212,"2016-12-05 15:17:00",安南區,違規停車,違規停車,"安南區海佃路一段 公車站違停",安南區海佃路一段,23.0246827,120.1913975
UN201612050224,"2016-12-05 15:33:00",中西區,路燈故障,9盞以下路燈故障,中西區府中街146號/137號,臺南市中西區府中街146號,22.990108,120.205013
UN201612050228,"2016-12-05 15:44:00",中西區,違規停車,違規停車,台南市中西區府前路一段85巷6號違規停車,臺南市中西區府前路一段85巷6號,22.988658,120.209309
UN201612050247,"2016-12-05 16:31:00",中西區,違規停車,違規停車,"中西區民族路二段76之2號 違規停車",臺南市民族路二段76之2號,22.994726,120.20925
UN201612050265,"2016-12-05 16:53:00",安平區,違規停車,違規停車,"安平區中華西路二段49巷24弄1號 違停",臺南市安平區中華西路二段49巷24弄1號,22.986671,120.185859
UN201612050268,"2016-12-05 17:06:00",中西區,違規停車,違規停車,中西區衛民街56號/73號違規停車,臺南市中西區衛民街56號,22.992987,120.210528
UN201612050278,"2016-12-05 17:48:00",東區,違規停車,違規停車,台南市東區崇德路471-3號違規停車,臺南市東區崇德路471-3號,22.974989,120.226394
UN201612050279,"2016-12-05 17:48:00",安南區,路燈故障,9盞以下路燈故障,"安南區安和路四段438號   路燈故障",臺南市安南區安和路四段438號,23.059821,120.218931
UN201612050283,"2016-12-05 18:04:00",中西區,違規停車,違規停車,"中西區衛民街154號 違規停車",臺南市中西區衛民街154號,22.993561,120.207195
UN201612050284,"2016-12-05 18:04:00",中西區,違規停車,違規停車,中西區民權路二段100號違規停車,臺南市中西區民權路二段100號,22.994796,120.204014
UN201612050288,"2016-12-05 18:19:00",東區,違規停車,違規停車,"東區長榮路二段180號 違規停車",臺南市東區長榮路二段180號,22.990222,120.220767
UN201612050292,"2016-12-05 18:24:00",麻豆區,髒亂及汙染,道路散落物,"麻豆區中正路105號 路面散落物",臺南市麻豆區中正路105號,23.186902,120.250169
UN201612050295,"2016-12-05 18:44:00",南區,路燈故障,9盞以下路燈故障,"南區新和東路96巷26號    路燈故障",臺南市南區新和東路96巷26號,22.967893,120.187162
UN201612050296,"2016-12-05 18:47:00",北區,違規停車,違規停車,北區開元路212巷94號違規停車,臺南市北區開元路212巷94號,23.005396,120.223478
UN201612050302,"2016-12-05 19:12:00",永康區,違規停車,違規停車,"台南市永康區大灣路40巷158弄15號 違規停車",臺南市永康區大灣路40巷158弄15號,23.017107,120.26712
UN201612050306,"2016-12-05 19:35:00",南區,路燈故障,9盞以下路燈故障,南區健康路一段113巷24號路燈故障,臺南市台南市健康路一段113巷24號,22.980423,120.209333
UN201612050307,"2016-12-05 19:37:00",南區,交通運輸,佔用道路,"台南市南區健康路一段135號 佔用道路",臺南市南區健康路一段135號,22.981091,120.20887
UN201612050308,"2016-12-05 19:45:00",北區,違規停車,違規停車,704台灣台南市北區開元路76號違規停車,704台灣台南市北區開元路76號,23.006095938539051,120.21730064425651
UN201612050310,"2016-12-05 19:44:00",永康區,違規停車,違規停車,"永康區中正七街25巷    違規停車",永康區中正七街25巷,23.0399779,120.2400076
UN201612050322,"2016-12-05 20:32:00",永康區,違規停車,違規停車,"永康區龍國街97號旁 違規停車",臺南市永康區龍國街97號,23.032621,120.260485
UN201612050325,"2016-12-05 20:43:00",佳里區,髒亂及汙染,空氣汙染,"佳里區六合街14號 空氣汙染",722台灣台南市佳里區六合街14號,23.165722961276504,120.17935279337030
UN201612050328,"2016-12-05 20:48:00",新化區,路燈故障,9盞以下路燈故障,"新化區民治路18巷8號 路燈故障",臺南市新化區民治路18巷8號,23.031961,120.30501
UN201612050330,"2016-12-05 20:53:00",永康區,違規停車,違規停車,"永康區成功路202-1號 違規停車",臺南市永康區成功路202-1號,23.010866,120.233255
UN201612050332,"2016-12-05 20:54:00",安平區,違規停車,違規停車,違規停車,臺南市安平路100號,22.998296,120.184173
UN201612050334,"2016-12-05 21:00:00",中西區,違規停車,違規停車,中西區民族路二段76號違規停車,中西區民族路二段76號,22.994746,120.2087298
UN201612050335,"2016-12-05 21:01:00",中西區,違規停車,違規停車,中西區興華街15號違規停車,臺南市中西區興華街15號,22.992099,120.210452
UN201612050339,"2016-12-05 21:14:00",永康區,違規停車,違規停車,台南市永康區南工街144號違規停車,台南市永康區南工街144號,23.0120808,120.240012
UN201612050341,"2016-12-05 21:22:00",永康區,違規停車,違規停車,台南市永康區復華五街55巷17號違規停車,臺南市永康區復華五街55巷17號,23.010784,120.245781
UN201612050344,"2016-12-05 21:24:00",永康區,違規停車,違規停車,710台灣台南市永康區正義街103號違規停車,710台灣台南市永康區正義街103號,23.0276919,120.2527603
UN201612050346,"2016-12-05 21:30:00",安平區,違規停車,違規停車,安平區安平路202號違規停車,臺南市安平區安平路202號,22.998642,120.180833
UN201612050347,"2016-12-05 21:33:00",安平區,違規停車,違規停車,安平區安平路446巷27弄違規停車,安平區安平路446巷27弄,22.99802,120.1735638
UN201612050348,"2016-12-05 21:34:00",新市區,違規停車,違規停車,744台灣台南市新市區中正路224號違規停車,744台灣台南市新市區中正路224號,23.0758095,120.2916422
UN201612050349,"2016-12-05 21:35:00",南區,路燈故障,9盞以下路燈故障,"南區明興路657號 路燈故障",臺南市南區明興路657號,22.938707,120.181115
UN201612050353,"2016-12-05 22:16:00",安平區,噪音舉發,場所連續噪音,"安平區建平十五街56號3樓之3   場所連續噪音",臺南市安平區建平十五街56號,22.996496,120.182629
UN201612050356,"2016-12-05 22:47:00",中西區,髒亂及汙染,空氣汙染,"中西區府前路一段121號 空氣汙染",臺南市中西區府前路一段121號,22.988832,120.208431
UN201612050357,"2016-12-05 23:11:00",北區,違規停車,違規停車,704台灣台南市北區開元路76號違規停車,704台灣台南市北區開元路76號,23.006179505839579,120.21725010132423
UN201612050358,"2016-12-05 23:23:00",北區,噪音舉發,場所連續噪音,"北區和緯路一段94號 連續噪音",北區和緯路一段94號,23.0095672,120.2144842
UN201612060001,"2016-12-06 00:05:00",永康區,違規停車,違規停車,永康區復華三街90巷22號違規停車,710台灣台南市永康區復華三街90巷22號,23.0102269,120.2450526
UN201612060006,"2016-12-06 04:20:00",中西區,髒亂及汙染,道路散落物,"中西區忠義路二段84巷7號 道路散落物",臺南市中西區忠義路二段84巷7號,22.994125,120.203697
UN201612060014,"2016-12-06 08:12:00",永康區,違規停車,違規停車,"永康區中山南路119巷53號斜對面 違停",臺南市永康區中山南路119巷53號,23.013825,120.230052
UN201612060030,"2016-12-06 08:57:00",東區,違規停車,違規停車,"東區富農街一段131巷1號 違規停車",臺南市東區富農街一段131巷1號,22.9818,120.234416
UN201612060039,"2016-12-06 09:15:00",北區,違規停車,違規停車,"北區東興路二段51號前 違停",臺南市北區東興路二段51號,23.000601,120.228449
UN201612060078,"2016-12-06 10:30:00",麻豆區,違規停車,違規停車,"麻豆區中山路110號 違規停車",臺南市麻豆區中山路110號,23.183813,120.245056
UN201612060087,"2016-12-06 10:44:00",永康區,違規停車,違規停車,"永康區永科環路168號 違規停車",臺南市永康區永科環路168號,23.036321,120.279012
