UN201504260042,"2015-04-26 10:11:00",北區,噪音舉發,妨礙安寧,"賢北國小(北區賢北里大興街599號 )體育場裡面 妨礙安寧",臺南市北區賢北里大興街599號,23.007598,120.179143
UN201504260043,"2015-04-26 10:09:00",中西區,違規停車,違規停車,"中西區金華路四段72號前 違停",臺南市中西區金華路四段72號,22.997897,120.194752
UN201504260048,"2015-04-26 10:24:00",安平區,路燈故障,10盞以上路燈故障,"安平區永華路二段930號前 路燈不亮",臺南市安平區永華路二段930號,22.992045,120.16563
UN201504260049,"2015-04-26 10:24:00",中西區,違規停車,違規停車,"中西區海安路二段290到322號 違停",臺南市中西區海安路二段290到322號,22.999151,120.198365
UN201504260050,"2015-04-26 10:33:00",中西區,違規停車,違規停車,"中西區青年路171號西華南街40到50號 中山路90號 違停",臺南市中西區青年路171號,22.99192,120.210032
UN201504260053,"2015-04-26 10:41:00",歸仁區,交通運輸,佔用道路,"歸仁區民權南路331號 佔用道路/環境髒亂",臺南市歸仁區民權南路331號,22.961559,120.28777
UN201504260055,"2015-04-26 10:46:00",中西區,違規停車,違規停車,"中西區興華街4號到12之3號及中西區興華街9號-15號 違停",臺南市中西區興華街4號,22.991841,120.210366
UN201504260056,"2015-04-26 10:50:00",安南區,動物救援,犬貓急難救援,"安南區安中路一段560巷12弄29號 犬貓救援",臺南市安南區安中路一段560巷12弄29號,23.040663,120.200858
UN201504260062,"2015-04-26 10:43:00",西港區,噪音舉發,妨礙安寧,"西港區慶安路32號 噪音",臺南市西港區慶安路32號,23.121363,120.20186
UN201504260065,"2015-04-26 10:43:00",西港區,噪音舉發,妨礙安寧,"西港區慶安路32號 噪音",臺南市西港區慶安路32號,23.121363,120.20186
UN201504260072,"2015-04-26 11:18:00",中西區,違規停車,違規停車,"中西區西門路二段398號 違停",臺南市中西區西門路二段398號,22.998818,120.200914
UN201504260074,"2015-04-26 11:23:00",中西區,違規停車,違規停車,"中西區民生路二段9號跟11號前 違停",臺南市中西區民生路二段9號,22.994421,120.198789
UN201504260075,"2015-04-26 11:25:00",中西區,違規停車,違規停車,"中西區中正路352-26號 違停",臺南市中西區中正路352-26號,22.994117,120.192788
UN201504260080,"2015-04-26 11:41:00",中西區,違規停車,違規停車,"中西區保安路36號 34號 違停",臺南市中西區保安路36號,22.990324,120.196872
UN201504260081,"2015-04-26 11:40:00",中西區,違規停車,違規停車,"中西區青年路209號跟214號 萬昌街90巷口 民權路一段220號 民族路二段103號 違停",臺南市中西區青年路209號,22.991728,120.211222
UN201504260090,"2015-04-26 12:14:00",中西區,違規停車,違規停車,"中西區興華街7號到15號 12-3號 違停",臺南市中西區興華街7號,22.991965,120.210201
UN201504260091,"2015-04-26 12:27:00",中西區,違規停車,違規停車,"中西區民生路二段5號 7號 9號前 違停",臺南市中西區民生路二段5號,22.994401,120.198891
UN201504260096,"2015-04-26 12:53:00",北區,違規停車,違規停車,"北區東豐路239號跟241號前 違停",臺南市北區東豐路239號,23.003248,120.221141
UN201504260098,"2015-04-26 12:49:00",北區,違規停車,違規停車,"北區東豐路229號 239號 241號 違停",臺南市北區東豐路229號,23.003348,120.220826
UN201504260099,"2015-04-26 13:00:00",中西區,違規停車,違規停車,"中西區西華南街2-10號 違停",臺南市中西區西華南街2-10號,22.993195,120.20943
UN201504260100,"2015-04-26 12:57:00",中西區,違規停車,違規停車,"中西區北門路一段101號前方和旁邊 違停",臺南市中西區北門路一段101號,22.992288,120.211372
UN201504260102,"2015-04-26 13:05:00",中西區,違規停車,違規停車,"中西區青年路175號 違停",臺南市中西區青年路175號,22.991831,120.210413
UN201504260104,"2015-04-26 13:38:00",中西區,違規停車,違規停車,"中西區慶中街202號前 違停",臺南市中西區慶中街202號,22.984661,120.20571
UN201504260105,"2015-04-26 13:15:00",東區,噪音舉發,妨礙安寧,"東區林森路二段192巷35弄1號 妨礙安寧",臺南市東區林森路二段192巷35弄1號,22.98977,120.225207
UN201504260114,"2015-04-26 15:27:00",安南區,噪音舉發,場所連續噪音,"安南區頂安街475號對面 噪音",臺南市安南區頂安街475號,23.043431,120.207683
UN201504260118,"2015-04-26 15:34:00",中西區,違規停車,違規停車,"中西區民生路二段95號 違停",臺南市中西區民生路二段95號,22.995084,120.196784
UN201504260120,"2015-04-26 15:46:00",東區,髒亂及汙染,其他汙染舉發,"東區東門路三段37巷12弄30號的巷口處 汙染舉發",臺南市東區東門路三段37巷12弄30號,22.980753,120.23306
UN201504260122,"2015-04-26 15:50:00",中西區,違規停車,違規停車,"中西區府前路一段369號前 違停",臺南市中西區府前路一段369號,22.990009,120.198981
UN201504260125,"2015-04-26 15:59:00",中西區,違規停車,違規停車,"中西區興華街15號前 違停",臺南市中西區興華街15號,22.992099,120.210452
UN201504260128,"2015-04-26 16:09:00",北區,違規停車,違規停車,"北區西門路四段169號人行道跟轉彎處紅線 違停",臺南市北區西門路四段169號,23.010191,120.207936
UN201504260136,"2015-04-26 16:39:00",中西區,違規停車,違規停車,"中西區興華街 12之3號前 違停","臺南市中西區興華街 12之3號",22.992091,120.210708
UN201504260148,"2015-04-26 17:43:00",麻豆區,民生管線,寬頻管線、孔蓋損壞,"麻豆區民族路6-4號前 孔蓋",臺南市麻豆區民族路6-4號,23.182752,120.249534
UN201504260154,"2015-04-26 18:01:00",安平區,動物救援,犬貓急難救援,"安平區世平路150號 鮮活工坊對面  犬貓救援",臺南市安平區世平路150號,22.996074,120.150032
UN201504260164,"2015-04-26 18:36:00",善化區,交通運輸,佔用道路,"善化區民生路432號 佔用道路",臺南市善化區民生路432號,23.130146,120.294906
UN201504260175,"2015-04-26 18:55:00",北區,違規停車,違規停車,"北區東豐路239號 241號前方 違停",臺南市北區東豐路239號,23.003248,120.221141
UN201504260186,"2015-04-26 19:28:00",佳里區,噪音舉發,場所連續噪音,"佳里區長安街78-1號 噪音",臺南市佳里區長安街78-1號,23.161902,120.174102
UN201504260189,"2015-04-26 19:26:00",安南區,路燈故障,9盞以下路燈故障,"安南區安中路二段138巷60號 路燈",臺南市安南區安中路二段138巷60號,23.047317,120.188119
UN201504260190,"2015-04-26 19:59:00",永康區,違規停車,違規停車,"永康區中山路492號 494號 違停",臺南市永康區中山路492號,23.037153,120.25445
UN201504260207,"2015-04-26 21:04:00",東區,違規停車,違規停車,"東區北門路一段218號一直到火車站 違停",臺南市東區北門路一段218號,22.994232,120.211916
UN201504260211,"2015-04-26 21:13:00",永康區,噪音舉發,妨礙安寧,"永康區大灣路40巷76號上恩幼稚園旁邊巷子進去 妨礙安寧",臺南市永康區大灣路40巷76號,23.015195,120.268695
UN201504260216,"2015-04-26 21:41:00",永康區,噪音舉發,場所連續噪音,"永康區中山北路194號 廟會噪音",臺南市永康區中山北路194號,23.027712,120.262029
UN201504260217,"2015-04-26 22:09:00",中西區,噪音舉發,妨礙安寧,"中西區衛民街106-50號對面 妨礙安寧",臺南市中西區衛民街106-50號,22.993346,120.208667
UN201504260221,"2015-04-26 22:25:00",中西區,噪音舉發,場所連續噪音,"中西區神農街54號 海安路二段243號 238號右手邊 海安路二段330巷1號 噪音/佔用道路",臺南市中西區神農街54號,22.997411,120.197084
UN201504260226,"2015-04-26 23:08:00",北區,違規停車,違規停車,"北區文賢一路103號與文賢路292巷口 違停",臺南市北區文賢一路103號,23.006517,120.195983
UN201504260230,"2015-04-26 23:41:00",永康區,噪音舉發,妨礙安寧,"永康區中華路282-1號旁攤販 妨礙安寧",臺南市永康區中華路282-1號,23.007154,120.235024
