UN201505100097,"2015-05-10 13:43:00",東區,噪音舉發,妨礙安寧,"東區崇德十五街15號 妨礙安寧",臺南市崇德十五街15號,22.970294,120.227968
UN201505100104,"2015-05-10 14:19:00",安平區,違規停車,違規停車,"安平區平通路142號  違停",臺南市安平區平通路142號,22.992715,120.179315
UN201505100114,"2015-05-10 14:57:00",安平區,髒亂及汙染,其他汙染舉發,"安平區怡平路392號 前方  路面油漬",臺南市安平區怡平路392號,22.994529,120.176317
UN201505100119,"2015-05-10 15:11:00",中西區,違規停車,違規停車,"中西區忠義路二段54號 違停",臺南市中西區忠義路二段54號,22.993062,120.203209
UN201505100128,"2015-05-10 15:52:00",麻豆區,違規停車,違規停車,"麻豆區民權路10號 違停",臺南市麻豆區民權路10號,23.182807,120.251337
UN201505100132,"2015-05-10 16:23:00",南區,違規停車,違規停車,"南區大林路69號對面 違停",臺南市南區大林路69號,22.975602,120.212315
UN201505100145,"2015-05-10 16:51:00",中西區,違規停車,違規停車,"中西區青年路194號 西華南街40^60號  武德街與衛民街交叉處  違停",臺南市中西區青年路194號,22.991579,120.21043
UN201505100152,"2015-05-10 17:16:00",中西區,違規停車,違規停車,"中西區青年路194號轉角衛民街  興華街15號 青年路206號 違停",臺南市中西區青年路194號,22.991579,120.21043
UN201505100163,"2015-05-10 18:15:00",善化區,動物救援,遊蕩犬隻捕捉管制,"善化區中山路432號 捕犬",臺南市善化區中山路432號,23.132435,120.290804
UN201505100177,"2015-05-10 19:31:00",南區,違規停車,違規停車,"南區健康路二段188號 違停",臺南市南區健康路二段188號,22.981681,120.192645
UN201505100180,"2015-05-10 19:55:00",北區,噪音舉發,妨礙安寧,"北區東豐路441號後方(趙子龍廟) 妨礙安寧/廟會",臺南市東豐路441號,23.002434,120.226903
UN201505100185,"2015-05-10 20:46:00",南區,違規停車,違規停車,"南區國民路567巷5弄2號  違停",臺南市國民路567巷5弄2號,22.972791,120.204829
UN201505100188,"2015-05-10 19:00:00",仁德區,噪音舉發,妨礙安寧,"仁德區和愛街6號2樓(B棟) 妨礙安寧",臺南市和愛街6號,22.960179,120.223622
UN201505100196,"2015-05-10 21:34:00",中西區,交通運輸,佔用道路,"中西區中成路52號 佔用道路",臺南市中成路52號,22.997928,120.205427
UN201505100198,"2015-05-10 21:46:00",安平區,髒亂及汙染,空氣汙染,"安平區建平四街18巷30號 空氣汙染",臺南市安平區建平四街18巷30號,22.987168,120.181388
UN201505100204,"2015-05-10 22:25:00",南區,噪音舉發,場所連續噪音,"南區南樂街43號前家樂福 噪音",臺南市南區南樂街43號,22.987289,120.1883
UN201505100206,"2015-05-10 22:58:00",安南區,髒亂及汙染,空氣汙染,"安南區城北路735巷330號附近 空氣汙染",臺南市安南區城北路735巷330號,23.074905,120.123117
UN201505100211,"2015-05-10 23:06:00",中西區,交通運輸,佔用道路,"中西區神農街54號 海安路二段243號 268號及266號隔壁 中西區海安路二段330巷1號 佔用道路/北區成功路396之4號 違停",臺南市中西區神農街54號,22.997411,120.197084
