UN201510190009,"2015-10-19 08:08:00",永康區,違規停車,違規停車,"永康區自強路750巷68弄53號 違停",臺南市永康區自強路750巷68弄53號,23.035167,120.264001
UN201510190013,"2015-10-19 08:20:00",永康區,交通運輸,佔用道路,"永康區小東路649號 佔用道路",臺南市永康區小東路649號,22.9987,120.238627
UN201510190016,"2015-10-19 08:34:00",中西區,動物救援,遊蕩犬隻捕捉管制,"中西區湖美一街49巷1號 捕犬",臺南市中西區湖美一街49巷1號,23.000962,120.181141
UN201510190025,"2015-10-19 08:46:00",北區,,9盞以下路燈故障,"北區育德二路490號前 路燈故障",臺南市北區育德二路490號,23.018579,120.201947
UN201510190044,"2015-10-19 09:19:00",新營區,噪音舉發,妨礙安寧,"新營區三興街301巷61號 妨礙安寧",新營區三興街301巷61號,23.3183894,120.3073443
UN201510190063,"2015-10-19 09:46:00",東區,違規停車,違規停車,"東區勝利路135號的對面 違停",臺南市東區勝利路135號,22.994976,120.217955
UN201510190071,"2015-10-19 09:54:00",北區,動物救援,遊蕩犬隻捕捉管制,北區育德三街121巷1號後方防火巷,臺南市北區育德三街121巷1號,23.014264,120.201587
UN201510190074,"2015-10-19 09:57:00",東區,交通運輸,佔用道路,":東區裕農路104號轉彎處""申請水溝清淤/ ""東區裕豐街214巷52號1樓""佔用道路",臺南市東區裕豐街214巷52號,22.987534,120.227902
UN201510190078,"2015-10-19 10:00:00",新化區,交通運輸,佔用道路,"新化區新和庄21號之5門口前 佔用道路",臺南市新化區新和庄21號,23.022379,120.329948
UN201510190099,"2015-10-19 10:16:00",中西區,違規停車,違規停車,"中西區西門路二段10號前     違停",臺南市中西區西門路二段10號,22.990663,120.198189
UN201510190127,"2015-10-19 11:01:00",安定區,動物救援,遊蕩犬隻捕捉管制,"安定區中榮里76之111號邊空地上 捕犬",臺南市安定區中榮里76之111號,23.096113,120.243433
UN201510190138,"2015-10-19 11:09:00",北區,道路維修,路面掏空、塌陷,"北區海安路338巷17號 路面塌陷",臺南市北區海安路338巷17號,23.009089,120.200688
UN201510190140,"2015-10-19 11:19:00",永康區,違規停車,違規停車,"永康區中正七街27號.28號.30號 違規停車",臺南市永康區中正七街27號,23.04011,120.240019
UN201510190142,"2015-10-19 11:21:00",永康區,違規停車,違規停車,"永康區中正路545號.529號.890號 違規停車",臺南市永康區中正路545號,23.039721,120.238829
UN201510190168,"2015-10-19 12:09:00",中西區,違規停車,違規停車,"中西區中山路143號.125號周邊 違規停車",臺南市中西區中山路143號,22.99592,120.209992
UN201510190170,"2015-10-19 12:10:00",北區,違規停車,違規停車,"北區開元路兩側(前鋒路到北園街) 違規停車",北區開元路兩側(前鋒路到北園街),23.0076695,120.2208365
UN201510190173,"2015-10-19 12:13:00",安平區,違規停車,違規停車,"安平區郡平路(育平路－建康三街) 違規停車",708台灣台南市安平區郡平路,22.98909032906246,120.16794607043268
UN201510190176,"2015-10-19 12:18:00",東區,違規停車,違規停車,"東區長榮路二段194號 違停",臺南市東區長榮路二段194號,22.990222,120.220767
UN201510190184,"2015-10-19 12:40:00",東區,違規停車,違規停車,"東區小東路260號-300號/東區東和路1號-60號 違停",臺南市東區小東路260號,22.998671,120.2307
UN201510190185,"2015-10-19 12:45:00",東區,違規停車,違規停車,"東區北門路ㄧ段132號+134號 違規停車",臺南市北門路ㄧ段132號,23.015964,120.217868
UN201510190188,"2015-10-19 12:48:00",東區,違規停車,違規停車,"東區林森路一段140號 違停",東區林森路一段140號,22.9812513,120.2137465
UN201510190194,"2015-10-19 13:00:00",台南,道路維修,路樹傾倒,道路維修,556台灣南投縣信義鄉郡大林道,23.5438451365,121.096801758
UN201510190196,"2015-10-19 13:01:00",台南,道路維修,路樹傾倒,道路維修,556台灣南投縣信義鄉郡大林道,23.5438451365,121.096801758
UN201510190200,"2015-10-19 13:04:00",中西區,違規停車,違規停車,"中西區中正路76號 違停",臺南市中西區中正路76號,22.992331,120.201196
UN201510190201,"2015-10-19 13:15:00",仁德區,交通運輸,佔用道路,"仁德區成功一街21號 佔用道路",臺南市仁德區成功一街21號,22.960924,120.225139
UN201510190215,"2015-10-19 13:51:00",中西區,違規停車,違規停車,"中西區興華街5號 違規停車",臺南市興華街5號,22.991948,120.210182
UN201510190224,"2015-10-19 14:09:00",北區,噪音舉發,妨礙安寧,"北區北門路二段光武里活動中心後方 廟會/妨礙安寧",北區北門路二段光武里活動中心後方,23.0118688,120.2166124
UN201510190238,"2015-10-19 14:49:00",永康區,違規停車,違規停車,"永康區中華路725號永豐銀行..473號郵局.423號國泰銀行.357號合作金庫.196號超商周邊.21號大眾銀行周邊.1號國泰銀行周圍 違規停車",臺南市永康區中華路725號,23.017167,120.227709
UN201510190242,"2015-10-19 14:55:00",永康區,違規停車,違規停車,"永康區中正路545號.529號.890號 違規停車",臺南市永康區中正路545號,23.039721,120.238829
UN201510190275,"2015-10-19 15:44:00",中西區,髒亂及汙染,空氣汙染,"中西區青年路37號 空氣汙染",臺南市中西區青年路37號,22.992457,120.206397
UN201510190282,"2015-10-19 15:52:00",中西區,違規停車,違規停車,"中西區中山路143號.125號   違規停車",臺南市中西區中山路143號,22.99592,120.209992
UN201510190283,"2015-10-19 15:52:00",東區,違規停車,違規停車,"東區長榮路三段2號 違停",臺南市東區長榮路三段2號,22.992134,120.221702
UN201510190299,"2015-10-19 16:14:00",七股區,路燈故障,9盞以下路燈故障,"七股區頂山里145-3號 路燈故障",臺南市七股區頂山里145-3號,23.182006,120.112294
UN201510190331,"2015-10-19 17:04:00",永康區,違規停車,違規停車,"永康區南台街3巷1-40號 違停",臺南市永康區南台街3巷1-40號,23.022004,120.224132
UN201510190344,"2015-10-19 17:46:00",佳里區,髒亂及汙染,大型廢棄物清運,髒亂及汙染,臺南市民安里同安寮1-29號,23.165436,120.188278
UN201510190353,"2015-10-19 18:13:00",中西區,違規停車,違規停車,"中西區衛民街92號  違規停車",臺南市衛民街92號,22.993062,120.209633
UN201510190357,"2015-10-19 18:17:00",中西區,違規停車,違規停車,"中西區萬昌街54號  違規停車",臺南市萬昌街54號,22.99023,120.210314
UN201510190369,"2015-10-19 18:35:00",南區,路燈故障,9盞以下路燈故障,"南區鯤鯓路162巷25弄16號前 路燈故障",臺南市南區鯤鯓路162巷25弄16號,22.961503,120.171354
UN201510190385,"2015-10-19 19:00:00",永康區,路燈故障,9盞以下路燈故障,"永康區復興路356巷80弄67號後方   路燈不亮",臺南市永康區復興路356巷80弄67號,23.000929,120.243448
UN201510190397,"2015-10-19 19:45:00",北區,路燈故障,9盞以下路燈故障,"北區西門路四段65巷45號、35號、108弄整條、文成二路302號左右      路燈不亮",臺南市北區西門路四段65巷45號,23.00795,120.205336
UN201510190398,"2015-10-19 20:13:00",永康區,交通運輸,佔用道路,"大灣東路南巡宮   佔用道路",大灣東路南巡宮,23.000306140303373,120.26603646576405
UN201510190408,"2015-10-19 20:26:00",新營區,路燈故障,9盞以下路燈故障,新營區東明街96巷1號^20號內,臺南市新營區東明街96巷1號,23.31979,120.325702
UN201510190414,"2015-10-19 21:17:00",中西區,違規停車,違規停車,"中西區中山路125號.143號/西華南街兩側(成功路到民族路)   違規停車",臺南市中西區中山路125號,22.995819,120.209228
UN201510190419,"2015-10-19 21:44:00",東區,路燈故障,9盞以下路燈故障,"東區大同路一段141巷39號 路燈故障",臺南市東區大同路一段141巷39號,22.986064,120.21251
UN201510190428,"2015-10-19 22:47:00",東區,噪音舉發,妨害安寧,"東區裕永一街72號對面  妨礙安寧",東區裕永一街72號對面,22.9903779,120.2433571
UN201510200009,"2015-10-20 02:51:00",永康區,噪音舉發,妨害安寧,"永康區中華路7巷20弄 妨礙安寧",永康區中華路7巷20弄,23.0146459,120.2299338
UN201510200063,"2015-10-20 09:29:00",安南區,噪音舉發,場所連續噪音,"安南區安吉路一段560號 噪音",臺南市安南區安吉路一段560號,23.05115,120.189638
UN201510200077,"2015-10-20 09:40:00",永康區,違規停車,違規停車,"永康區中正路529號門口周邊 違規停車",臺南市永康區中正路529號,23.039316,120.238472
UN201510200081,"2015-10-20 09:40:00",七股區,路燈故障,9盞以下路燈故障,"七股區篤加里29號 路燈",臺南市七股區篤加里29號,23.159372,120.13014
UN201510200092,"2015-10-20 10:00:00",東區,路燈故障,9盞以下路燈故障,"東區中華東路二段96巷42號 路燈故障",臺南市東區中華東路二段96巷42號,22.985264,120.231672
UN201510200116,"2015-10-20 10:43:00",東區,違規停車,違規停車,"東區東和路1號 違停",臺南市東區東和路1號,22.998711,120.2305
UN201510200117,"2015-10-20 10:44:00",歸仁區,噪音舉發,場所連續噪音,"歸仁區中正南路一段510號 噪音干擾",臺南市歸仁區中正南路一段510號,22.959962,120.286709
UN201510200123,"2015-10-20 10:53:00",東區,違規停車,違規停車,"東區東興路257號至271號 黃線違停",臺南市東區東興路257號,22.995139,120.229582
UN201510200132,"2015-10-20 11:13:00",東區,違規停車,違規停車,"東區中華東路二段333號-337號 違停",臺南市東區中華東路二段333號,22.98154,120.229985
UN201510200139,"2015-10-20 11:23:00",下營區,噪音舉發,場所連續噪音,"下營區蚵寮街97號 噪音干擾",臺南市下營區蚵寮街97號,23.233571,120.256258
UN201510200154,"2015-10-20 11:51:00",永康區,違規停車,違規停車,"永康區中正七街(中正路到中正北路) 違規停車",永康區中正七街(中正路到中正北路),23.03993332502892,120.24001937359571
UN201510200159,"2015-10-20 11:56:00",永康區,違規停車,違規停車,"永康區中正路兩側(中正路到新行街) 違規停車",永康區中正路兩側(中正路到新行街),23.039306695237393,120.23937966674568
UN201510200162,"2015-10-20 12:06:00",安平區,違規停車,違規停車,"安平區郡平路 違規停車",708台灣台南市安平區郡平路,22.989135700346218,120.16794707626106
UN201510200166,"2015-10-20 12:13:00",新營區,路燈故障,9盞以下路燈故障,新營區土庫里卯舍15之1號前,臺南市新營區土庫里卯舍15之1號,23.322121,120.331676
UN201510200178,"2015-10-20 12:53:00",東區,違規停車,違規停車,"東區東門路二段267號 違規停車",臺南市東區東門路二段267號,22.983845,120.225974
UN201510200180,"2015-10-20 13:00:00",南區,違規停車,違規停車,"南區永成路三段115號 違停",臺南市南區永成路三段115號,22.965476,120.195272
UN201510200192,"2015-10-20 13:22:00",永康區,違規停車,違規停車,"永康區中正路529號周邊 違規停車",永康區中正路529號周邊,23.039270288296308,120.2393776550889
UN201510200198,"2015-10-20 13:34:00",新營區,違規停車,違規停車,"新營區新進路二71號 違停",臺南市新營區新進路二71號,23.300561,120.312467
UN201510200207,"2015-10-20 13:43:00",安平區,噪音舉發,場所連續噪音,"安平區怡平路366號 違建/ 施工噪音",臺南市安平區怡平路366號,22.993476,120.17765
UN201510200214,"2015-10-20 14:06:00",歸仁區,噪音舉發,場所連續噪音,"歸仁區中正南路一段510號隔壁 噪音",臺南市歸仁區中正南路一段510號,22.959962,120.286709
UN201510200228,"2015-10-20 14:36:00",永康區,違規停車,違規停車,"永康區中正北路126號周邊 違規停車",永康區中正北路126號周邊,23.041403780145387,120.24251114577055
UN201510200237,"2015-10-20 14:47:00",安平區,髒亂及汙染,其他汙染舉發,"安平區慶平路539號維悅飯店旁邊 水汙",臺南市安平區慶平路539號,22.997179,120.171562
UN201510200244,"2015-10-20 15:16:00",永康區,違規停車,違規停車,"永康區新興街88號對面 違停",臺南市永康區新興街88號,23.012194,120.230966
UN201510200247,"2015-10-20 15:26:00",中西區,路燈故障,9盞以下路燈故障,"中西區郡西路112號 路燈",臺南市中西區郡西路112號,22.990272,120.194639
UN201510200307,"2015-10-20 17:18:00",東區,道路維修,人孔蓋聲響、凹陷、漏水,"東區裕農路801號   水溝蓋塌陷",臺南市東區裕農路801號,22.989472,120.240054
UN201510200312,"2015-10-20 17:37:00",安平區,違規停車,違規停車,"安平區安平路372到380號 違停",臺南市安平區安平路372到380號,22.998299,120.175491
UN201510200316,"2015-10-20 17:41:00",北區,路燈故障,9盞以下路燈故障,"北區文賢路1122巷94弄38號對面   路燈不亮",臺南市北區文賢路1122巷94弄38號,23.016185,120.196008
UN201510200322,"2015-10-20 17:51:00",東區,路燈故障,9盞以下路燈故障,"東區中華東路二段243巷57弄59號對面  路燈不亮",臺南市東區中華東路二段243巷57弄59號,22.983981,120.233962
UN201510200325,"2015-10-20 18:13:00",中西區,路燈故障,9盞以下路燈故障,"中西區頂美一街82巷18號 路燈故障",臺南市中西區頂美一街82巷18號,23.001697,120.184118
UN201510200329,"2015-10-20 18:18:00",關廟區,路燈故障,9盞以下路燈故障,"關廟區旺萊路313號 路燈故障",臺南市關廟區旺萊路313號,22.956748,120.337833
UN201510200354,"2015-10-20 19:17:00",南區,違規停車,違規停車,"南區永成路三段117號 違停",臺南市南區永成路三段117號,22.965501,120.19527
UN201510200356,"2015-10-20 19:26:00",中西區,民生管線,停電、漏電、電線掉落、孔蓋鬆動,"中西區協和里永和街132號 電線走火",臺南市中西區協和里永和街132號,23.001774,120.191838
UN201510200375,"2015-10-20 21:14:00",中西區,違規停車,違規停車,"中西區衛民街65-1號到149號   違規停車",臺南市中西區衛民街65-1號,22.99284,120.210384
UN201510200378,"2015-10-20 21:04:00",安南區,路燈故障,9盞以下路燈故障,"安南區安通路二段6號對面、開安路63巷65號斜對面 路燈不亮",臺南市安南區安通路二段6號,23.044567,120.225098
UN201510200391,"2015-10-20 22:40:00",永康區,違規停車,違規停車,"永康區中正北路126號周邊  違規停車",臺南市永康區中正北路126號,23.04141,120.242456
UN201510200392,"2015-10-20 22:33:00",東區,噪音舉發,場所連續噪音,"東區崇善路25巷96號 對面   噪音",臺南市東區崇善路25巷96號,22.983713,120.222131
UN201510200393,"2015-10-20 22:50:00",北區,違規停車,違規停車,"北區公園路856號   違規停車",臺南市北區公園路856號,23.013763,120.212463
UN201510200395,"2015-10-20 23:09:00",永康區,違規停車,違規停車,"永康區中正北路122號  違規停車",臺南市永康區中正北路122號,23.041412,120.242361
UN201510200397,"2015-10-20 22:48:00",永康區,髒亂及汙染,路面油漬,"永康區中華路*中正南路  油漬",永康區中華路*中正南路,23.023611,120.2182712
UN201510210018,"2015-10-21 07:22:00",安平區,違規停車,違規停車,"安平區永華路二段495號 華平路720號右邊 違停",臺南市安平區永華路二段495號,22.99026,120.175736
UN201510210038,"2015-10-21 08:51:00",北區,違規停車,違規停車,"北區開元路259號前 違停",臺南市北區開元路259號,23.007641,120.220469
UN201510210060,"2015-10-21 09:41:00",白河區,民生管線,停電、漏電、電線掉落、孔蓋鬆動,"白河區草店里65之10號前 電線掉落",臺南市白河區草店里65之10號,23.38979,120.434538
UN201510210080,"2015-10-21 10:19:00",永康區,違規停車,違規停車,"永康區新中街(中正路到正南五街) 違規停車",永康區新中街(中正路到正南五街),23.03625896826217,120.24040024727582
UN201510210103,"2015-10-21 11:05:00",南區,噪音舉發,妨礙安寧,"南區金華路二段168號/170號 妨礙安寧",臺南市南區金華路二段168號,22.979618,120.191473
UN201510210104,"2015-10-21 11:08:00",東區,違規停車,違規停車,"東區大學路22巷18號 違停",臺南市東區大學路22巷18號,22.99502,120.221239
UN201510210105,"2015-10-21 11:05:00",下營區,路燈故障,9盞以下路燈故障,"下營區大埤里79-8號 路燈故障",臺南市下營區大埤里79-8號,23.224854,120.248553
UN201510210120,"2015-10-21 11:30:00",北區,違規停車,違規停車,"北區東豐路239號與241前 違停",臺南市北區東豐路239號,23.003248,120.221141
UN201510210134,"2015-10-21 11:53:00",東區,違規停車,違規停車,"東區崇學路138號前 違停",臺南市東區崇學路138號,22.98093,120.224507
UN201510210137,"2015-10-21 11:59:00",南區,交通運輸,佔用道路,"南區大成路二段165號前方 佔用道路",臺南市南區大成路二段165號,22.974828,120.193043
UN201510210138,"2015-10-21 12:03:00",中西區,違規停車,違規停車,"中西區公園路90號,健保局旁邊 違規停車","700台灣台南市中西區公園路90號 健保局旁邊",22.996392131720473,120.2062798663974
UN201510210157,"2015-10-21 13:17:00",永康區,違規停車,違規停車,"永康區中華路58巷68號周圍 違規停車",永康區中華路58巷68號周圍,23.00153537852992,120.23812640458344
UN201510210161,"2015-10-21 13:28:00",東區,違規停車,違規停車,"東區前鋒路的小東路口到大學路口 違規停車",前鋒路,22.997143,120.21363
UN201510210162,"2015-10-21 13:28:00",永康區,違規停車,違規停車,"永康區忠勇街與忠勇街65巷交叉路口 違規停車",永康區忠勇街與忠勇街65巷交叉路口周邊,23.00148538211445,120.23802816867828
UN201510210187,"2015-10-21 14:23:00",東區,路燈故障,9盞以下路燈故障,"東區崇德路305號 路燈故障",臺南市東區崇德路305號,22.977609,120.222649
UN201510210199,"2015-10-21 14:46:00",北區,違規停車,違規停車,"北區臨安路二段209號 違規停車",704台灣台南市北區臨安路二段209號,23.0038707,120.1995292
UN201510210201,"2015-10-21 14:51:00",南區,違規停車,違規停車,"安南區安中路四段141號 違規停車",709台南市安南區安中路四段141號,23.0494884,120.1699185
UN201510210215,"2015-10-21 14:59:00",北區,民生管線,人孔蓋聲響、凹陷、漏水,"北區大興街300巷23號 孔蓋",臺南市北區大興街300巷23號,23.010925,120.185465
UN201510210217,"2015-10-21 15:20:00",北區,違規停車,違規停車,"北區長榮路五段(開元路到長榮地下道) 違規停車",北區長榮路五段(開元路到長榮地下道),23.0128541,120.216601
UN201510210223,"2015-10-21 15:40:00",新營區,髒亂及汙染,其他汙染舉發,"新營區復興路1號 空氣汙染",臺南市新營區復興路1號,23.30251,120.313238
UN201510210225,"2015-10-21 15:42:00",永康區,違規停車,違規停車,"永康區中正七街28號.30號 違規停車",永康區中正七街28號.30號,23.0404714,120.240496
UN201510210228,"2015-10-21 15:22:00",中西區,道路維修,路面坑洞,"中西區民權路三段162號 坑洞",臺南市中西區民權路三段162號,22.997396,120.195866
UN201510210232,"2015-10-21 15:58:00",東區,噪音舉發,妨礙安寧,"東區崇德路514號 妨礙安寧",臺南市東區崇德路514號,22.973413,120.227327
UN201510210270,"2015-10-21 17:40:00",中西區,路燈故障,9盞以下路燈故障,"湖美一街108巷11號前 路燈故障",臺南市湖美一街108巷11號,23.003152,120.181458
UN201510210276,"2015-10-21 17:50:00",中西區,違規停車,違規停車,"中西區府中街106巷120號 違停",臺南市中西區府中街106巷120號,22.990208,120.205499
UN201510210277,"2015-10-21 17:00:00",中西區,道路維修,路面坑洞,"中西區青年路164巷7號和9號中間 坑洞",臺南市中西區青年路164巷7號,22.991567,120.209873
UN201510210278,"2015-10-21 17:57:00",歸仁區,路燈故障,9盞以下路燈故障,"歸仁區中正南路一段1207號消防隊 路燈/水溝蓋",臺南市歸仁區中正南路一段1207號,22.947457,120.278038
UN201510210279,"2015-10-21 18:01:00",中西區,違規停車,違規停車,"中西區府前路二段206號 違停",臺南市府前路二段206號,22.991702,120.1925
UN201510210282,"2015-10-21 18:06:00",中西區,路燈故障,9盞以下路燈故障,"中西區臨安路一段9號 路燈",臺南市中西區臨安路一段9號,22.99784,120.189211
UN201510210283,"2015-10-21 18:11:00",中西區,違規停車,違規停車,"台南市中西區西門路二段387號 違停",臺南市中西區西門路二段387號,22.998515,120.200417
UN201510210288,"2015-10-21 18:18:00",永康區,違規停車,違規停車,"永康區文化路172號口處 違停",臺南市永康區文化路172號,23.015639,120.256585
UN201510210295,"2015-10-21 18:40:00",永康區,髒亂及汙染,空氣汙染,"永康區南台街45巷47號前方 空氣汙染",臺南市永康區南台街45巷47號,23.02213,120.222811
UN201510210299,"2015-10-21 18:46:00",仁德區,髒亂及汙染,空氣汙染,"仁德區文華路三段483號 空氣汙染",臺南市仁德區文華路三段483號,22.971723,120.243385
UN201510210300,"2015-10-21 18:53:00",中西區,違規停車,違規停車,"中西區中山路143號.125號 違停",臺南市中西區中山路143號,22.99592,120.209992
UN201510210309,"2015-10-21 19:20:00",中西區,違規停車,違規停車,"中西區衛民街106號 違停",臺南市衛民街106號,22.993151,120.209223
UN201510210315,"2015-10-21 19:01:00",東區,違規停車,違規停車,"東區中華東路二段335號至349號前 違停",臺南市東區中華東路二段335號,22.981512,120.22996
UN201510210317,"2015-10-21 19:31:00",仁德區,路燈故障,9盞以下路燈故障,"仁德區北保一街1巷14號-20號中間 路燈",臺南市仁德區北保一街1巷14號,22.95427,120.251671
UN201510210321,"2015-10-21 19:46:00",北區,違規停車,違規停車,"台南市北區北忠街58巷56號前 違停",臺南市北區北忠街58巷56號,22.999947,120.211245
UN201510210328,"2015-10-21 20:12:00",中西區,髒亂及汙染,空氣汙染,"中西區民族路二段124號 空氣汙染",臺南市中西區民族路二段124號,22.995998,120.205428
UN201510210334,"2015-10-21 20:40:00",永康區,違規停車,違規停車,"永康區中正北路126號周邊 違停",臺南市永康區中正北路126號,23.04141,120.242456
UN201510210347,"2015-10-21 21:23:00",東區,路燈故障,10盞以上路燈故障,"東區中華東路二段243巷57弄口至57弄98號 路燈",臺南市東區中華東路二段243巷57弄口至57弄98號,22.984025,120.233965
UN201510210356,"2015-10-21 22:00:00",東區,噪音舉發,妨礙安寧,"東區中華東路二段185巷10號 妨礙安寧/噪音",臺南市東區中華東路二段185巷10號,22.984499,120.232945
UN201510210359,"2015-10-21 22:08:00",中西區,違規停車,違規停車,"中西區中山路65號前面 違停",臺南市中西區中山路65號,22.993935,120.206994
UN201510210363,"2015-10-21 22:21:00",東區,路燈故障,10盞以上路燈故障,"東區裕和五街69號前 路燈",臺南市東區裕和五街69號,22.988224,120.247261
UN201510210369,"2015-10-21 23:14:00",仁德區,髒亂及汙染,道路散落物,"仁德區中山路799號特力屋往歸仁方向 狗屍",臺南市仁德區中山路799號,22.973486,120.244408
UN201510220002,"2015-10-22 00:21:00",新營區,髒亂及汙染,道路散落物,"新營區鐵線里鐵線橋40號(通濟宮) 動物屍體",臺南市新營區鐵線里鐵線橋40號,23.264683,120.277382
UN201510220007,"2015-10-22 02:46:00",麻豆區,噪音舉發,妨礙安寧,"麻豆區油車里130-5號對面的獨立戶 妨礙安寧",麻豆區油車里130-5號對面的獨立戶,23.1907984,120.241176
UN201510220014,"2015-10-22 07:14:00",中西區,交通運輸,號誌故障,"中西區永華路/國華街口 南區國華街/健康路口 號誌故障","中西區永華路/國華街口 南區國華街/健康路口",22.9909879,120.1721476
UN201510220015,"2015-10-22 07:20:00",麻豆區,違規停車,違規停車,"麻豆區信義路(郵局-國中街) 麻豆分局旁邊市場 違停","麻豆區信義路(郵局-國中街) 麻豆分局旁邊市場",23.1818657,120.253197
UN201510220016,"2015-10-22 07:25:00",北區,髒亂及汙染,道路散落物,"北區長榮地下道 道路散落物",北區長榮地下道,23.0127136,120.219185
UN201510220019,"2015-10-22 07:35:00",新營區,違規停車,違規停車,"新營區東仁街21巷24號 違停",臺南市新營區東仁街21巷24號,23.31732,120.327452
UN201510220040,"2015-10-22 08:59:00",中西區,違規停車,違規停車,"中西區開山路82-1號 違規停車",臺南市開山路82-1號,22.989971,120.206739
UN201510220068,"2015-10-22 09:56:00",中西區,違規停車,違規停車,"中西區公園路86號 健保局旁騎樓 違規停車","700台灣台南市中西區公園路86號 健保局旁騎樓",22.996422068977562,120.20624801516531
UN201510220074,"2015-10-22 10:05:00",安南區,動物救援,犬貓急難救援,"安南區安和路一段226號 犬貓救援",臺南市安南區安和路一段226號,23.030899,120.213031
UN201510220077,"2015-10-22 10:08:00",永康區,違規停車,違規停車,"永康區中正路529號周邊 違規停車",永康區中正路529號周邊,23.039349581367254,120.23935753852129
UN201510220100,"2015-10-22 10:38:00",中西區,違規停車,違規停車,"中西區忠義路二段42號前 違停",臺南市中西區忠義路二段42號,22.992858,120.203051
UN201510220101,"2015-10-22 10:39:00",東區,違規停車,違規停車,"東區崇學路127號～129號 違停",臺南市東區崇學路127號,22.97908,120.222385
