UN201510250198,"2015-10-25 17:54:00",中西區,違規停車,違規停車,"中西區忠義路二段38巷口 違規停車",中西區忠義路二段38巷口,22.992077085058238,120.20323824137449
UN201510250201,"2015-10-25 18:13:00",麻豆區,民生管線,停電、漏電、電線掉落、孔蓋鬆動,"麻豆區新生北路551號(麻豆監理站)週邊、176市道 路燈不亮",臺南市麻豆區新生北路551號,23.190309,120.248868
UN201510250202,"2015-10-25 18:14:00",中西區,違規停車,違規停車,"中西區西華南街68號旁 違規停車",臺南市中西區西華南街68號,22.994221,120.209598
UN201510250203,"2015-10-25 18:16:00","東 區",違規停車,違規停車,"東區崇德路827號 違規停車",東區崇德路827號,22.9654779099628,120.22755548357964
UN201510250206,"2015-10-25 18:25:00",東區,路燈故障,9盞以下路燈故障,"東區崇學路18號前 路燈故障",臺南市東區崇學路18號,22.977719,120.220961
UN201510250207,"2015-10-25 18:26:00",中西區,違規停車,違規停車,"中西區海安路二段339號週邊 違停",臺南市中西區海安路二段339號,22.998575,120.197679
UN201510250208,"2015-10-25 18:27:00",永康區,違規停車,違規停車,"永康區中正北路126號周邊 違規停車",臺南市永康區中正北路126號,23.04141,120.242456
UN201510250212,"2015-10-25 18:40:00",麻豆區,路燈故障,10盞以上路燈故障,"麻豆區文昌路29-38號週邊 路燈不亮",臺南市麻豆區文昌路29-38號,23.185987,120.251764
UN201510250217,"2015-10-25 19:00:00",六甲區,路燈故障,9盞以下路燈故障,"六甲區菁埔里563號前  路燈故障",臺南市六甲區菁埔里563號,23.239899,120.297438
UN201510250218,"2015-10-25 19:10:00",安南區,路燈故障,9盞以下路燈故障,"安南區海東六街36號週邊 路燈",臺南市安南區海東六街36號,23.033012,120.188451
UN201510250223,"2015-10-25 19:20:00",南區,路燈故障,10盞以上路燈故障,"南區中華南路二段249巷32弄60號附近 路燈",臺南市南區中華南路二段249巷32弄60號,22.960075,120.186106
UN201510250232,"2015-10-25 19:45:00",官田區,噪音舉發,妨礙安寧,"官田區二鎮里69號(護安宮)附近 妨礙安寧",臺南市官田區二鎮里69號,23.218272,120.328518
UN201510250233,"2015-10-25 19:46:00",北區,動物救援,犬貓急難救援,"北區和緯路三段303巷25號旁 犬貓救援",臺南市北區和緯路三段303巷25號,23.009371,120.196816
UN201510250234,"2015-10-25 19:49:00",安平區,路燈故障,9盞以下路燈故障,"安平區育平六街46號(永華十街～平豐路) 路燈故障",臺南市安平區育平六街46號,22.992626,120.166025
UN201510250243,"2015-10-25 20:27:00",南區,噪音舉發,妨礙安寧,"南區灣裡路158號附近 妨礙安寧",臺南市南區灣裡路158號,22.929165,120.181273
UN201510250249,"2015-10-25 20:54:00",中西區,違規停車,違規停車,"中西區中山路143號、125號周邊 違規停車",臺南市中西區中山路143號,22.99592,120.209992
UN201510250264,"2015-10-25 22:32:00",北區,違規停車,違規停車,"北區西門路四段280巷37號前面 違規停車",臺南市西門路四段280巷37號,23.012763,120.210144
