UN201512070008,"2015-12-07 01:22:00",麻豆區,噪音舉發,妨礙安寧,"麻豆區中正路53號 妨礙安寧",臺南市麻豆區中正路53號,23.185109,120.248724
UN201512080006,"2015-12-08 04:21:00",中西區,噪音舉發,妨礙安寧,"中西區康樂街156號3樓 妨礙安寧",臺南市中西區康樂街156號,22.995194,120.195253
UN201512080008,"2015-12-08 05:07:00",安南區,噪音舉發,妨礙安寧,安南區安和路一段159巷121弄24號,臺南市安南區安和路一段159巷121弄24號,23.031386,120.210754
UN201512080025,"2015-12-08 08:26:00",東區,交通運輸,佔用道路,"東區崇明十一街54號(水果攤) 佔用道路",臺南市東區崇明十一街54號,22.976431,120.223333
UN201512080028,"2015-12-08 08:37:00",北區,違規停車,違規停車,"北區長榮路五段393號 違規停車",臺南市北區長榮路五段393號,23.012982,120.213758
UN201512080032,"2015-12-08 08:38:00",永康區,違規停車,違規停車,"永康區新中街(中正路到正南五街) 違規停車",永康區新中街(中正路到正南五街),23.036160235318285,120.24031911045313
UN201512080058,"2015-12-08 09:21:00",北區,違規停車,違規停車,"北區小東路321至330號 違停",臺南市北區小東路321至330號,22.999204,120.231064
UN201512080068,"2015-12-08 09:43:00",永康區,違規停車,違規停車,"永康區中正路888號對面 違規停車",永康區中正路888號對面,23.039337240036314,120.23941084742548
UN201512080090,"2015-12-08 10:21:00",安平區,違規停車,違規停車,"安平區國平路308號 違停",臺南市安平區國平路308號,22.991898,120.171354
UN201512080096,"2015-12-08 10:28:00",中西區,交通運輸,佔用道路,"萬昌街113及115號 交通運輸",臺南市萬昌街113及115號,22.992552,120.210478
UN201512080097,"2015-12-08 10:28:00",永康區,違規停車,違規停車,"永康區中華路1-128號 違規停車",710台灣台南市永康區中華路1-128號,22.9987439,120.2340998
UN201512080106,"2015-12-08 10:45:00",永康區,違規停車,違規停車,"永康區中正七街22.23.27號 違規停車",永康區中正七街22.23.27號,23.039944740709558,120.24002976715566
UN201512080118,"2015-12-08 11:06:00",永康區,違規停車,違規停車,"永康區中正北路126號周邊 違規停車",永康區中正北路126號周邊,23.041543852036337,120.24251684546472
UN201512080120,"2015-12-08 11:12:00",東區,交通運輸,號誌故障,"東區東門路/長榮路口 號誌故障",東區東門路/長榮路口,22.9866175,120.218849
UN201512080133,"2015-12-08 11:47:00",南區,違規停車,違規停車,"文南路與文南3街的交叉路口及文南路271號 違規停車",臺南市文南路與文南3街的交叉路口及文南路271號,22.986158,120.189932
UN201512080139,"2015-12-08 11:55:00",永康區,違規停車,違規停車,"永康區中正七街22.23.27.70號/中正路545號.888號對面 違規停車",永康區中正七街22.23.27.70號/中正路545號.888號對面,23.039920983751447,120.24002473801374
UN201512080141,"2015-12-08 11:58:00",中西區,違規停車,違規停車,"中西區西華南街60號 違規停車",臺南市中西區西華南街60號,22.994113,120.209579
UN201512080147,"2015-12-08 12:24:00",中西區,違規停車,違規停車,"中西區中山路49號 違規停車",臺南市中西區中山路49號,22.993548,120.20641
UN201512080148,"2015-12-08 12:26:00",北區,違規停車,違規停車,"北區富北街7-9號 違規停車",臺南市北區富北街7-9號,22.998202,120.211254
UN201512080150,"2015-12-08 12:29:00",善化區,民生管線,漏水、停水、消防栓漏水或損壞,"善化區光復路860號對面  消防栓遭撞毀",臺南市善化區光復路860號,23.136398,120.285887
UN201512080157,"2015-12-08 12:54:00",中西區,違規停車,違規停車,"中西區中山路2到48號 違規停車",臺南市中西區中山路2到48號,22.993315,120.206552
UN201512080158,"2015-12-08 12:57:00",北區,違規停車,違規停車,"北區富北街7-9號 違規停車",704台灣台南市北區富北街7-9號,22.9983149,120.2112291
UN201512080163,"2015-12-08 13:17:00",南區,違規停車,違規停車,南區南寧街166號對面,臺南市南區南寧街166號,22.985199,120.197226
UN201512080164,"2015-12-08 13:18:00",中西區,交通運輸,佔用道路,"衛民街113號 交通運輸",衛民街113號,22.9931693,120.2082771
UN201512080166,"2015-12-08 13:23:00",安平區,噪音舉發,場所連續噪音,安平區光州四街52號對面,臺南市安平區光州四街52號,22.987932,120.161726
UN201512080212,"2015-12-08 15:58:00",東區,違規停車,違規停車,"東區裕信路352號 違規停車",臺南市東區裕信路352號,22.979744,120.24494
UN201512080225,"2015-12-08 16:23:00",北區,交通運輸,佔用道路,"北區西門路四段343號 佔用道路",臺南市北區西門路四段343號,23.015252,120.209818
UN201512080244,"2015-12-08 17:04:00",中西區,噪音舉發,妨礙安寧,"中西區府前路一段283號3樓 妨礙安寧",臺南市中西區府前路一段283號,22.989495,120.202016
UN201512080247,"2015-12-08 17:12:00",永康區,違規停車,違規停車,"永康區復興路1巷26號 違停",臺南市永康區復興路1巷26號,22.997112,120.250268
UN201512080248,"2015-12-08 17:15:00","北 區",違規停車,違規停車,"北區北門路二段、三段(和緯路到實踐街) 違規停車",北區北門路二段.三段(和緯路到實踐街),23.01402711224502,120.21725345402956
UN201512080250,"2015-12-08 17:18:00",永康區,違規停車,違規停車,"永康區新中街(中正路到正南五街)沿線 違規停車",永康區新中街(中正路到正南五街),23.036225645901702,120.2403724193573
UN201512080255,"2015-12-08 17:47:00",中西區,違規停車,違規停車,"中西區國華街三段250巷28號 違規停車",臺南市中西區國華街三段250巷28號,22.999115,120.200082
UN201512080260,"2015-12-08 18:02:00",安平區,違規停車,違規停車,"安平區郡平路(育平路～健康三街) 違規停車",安平區郡平路(育平路～健康三街),22.989064711256052,120.16817808151245
UN201512080263,"2015-12-08 18:07:00",中西區,違規停車,違規停車,"中西區衛民街106-18號  衛民街142號波力旁邊外面  違規停車",臺南市中西區衛民街106-18號,22.993176,120.209001
UN201512080265,"2015-12-08 17:59:00",南區,交通運輸,交通疏導,交通疏導,臺南市南區健康路一段179號,22.98117,120.207882
UN201512080274,"2015-12-08 18:42:00",北區,違規停車,違規停車,"北區公園北路148號、150號 違停",臺南市北區公園北路148號,23.005131,120.2085
UN201512080275,"2015-12-08 18:29:00",中西區,噪音舉發,妨礙安寧,"中西區府前路一段283號三樓  妨礙安寧",臺南市中西區府前路一段283號,22.989495,120.202016
UN201512080276,"2015-12-08 18:39:00",東區,髒亂及汙染,空氣汙染,"東區崇德路582號旁 空汙",臺南市東區崇德路582號,22.971566,120.227333
UN201512080279,"2015-12-08 18:45:00",北區,民生管線,漏水、停水、消防栓漏水或損壞,停水,臺南市北區北園街109巷111號,23.012799,120.221219
UN201512080288,"2015-12-08 19:11:00",仁德區,噪音舉發,妨礙安寧,"仁德區中生里中洲76號之83(允利榮機械)後方 妨礙安寧",臺南市仁德區中生里中洲76號,22.909494,120.250162
UN201512080299,"2015-12-08 19:48:00",東區,違規停車,違規停車,"東區府東街34號週邊 違規停車",臺南市東區府東街34號,22.985444,120.220162
UN201512080310,"2015-12-08 20:30:00",善化區,髒亂及汙染,空氣汙染,"善化啤酒廠(善化區成功路2號)附近的磚窯廠 空氣汙染",臺南市善化區成功路2號,23.127879,120.317313
UN201512080311,"2015-12-08 20:32:00","東 區",違規停車,違規停車,"東區裕農路572-574號 違規停車",701台灣台南市東區裕農路572-574號,22.988436919156392,120.2340229600668
UN201512080326,"2015-12-08 21:52:00",東區,違規停車,違規停車,"東區大同路二段97巷1號 違停",臺南市東區大同路二段97巷1號,22.97896,120.213688
UN201512080334,"2015-12-08 22:29:00",北區,違規停車,違規停車,"北區和緯路二段130號 違停",臺南市北區和緯路二段130號,23.011433,120.209153
UN201512080339,"2015-12-08 23:23:00",南區,噪音舉發,妨礙安寧,"南區西門路一段351號 妨礙安寧",臺南市南區西門路一段351號,22.978208,120.197462
UN201512090006,"2015-12-09 01:02:00",安平區,噪音舉發,場所連續噪音,"安平區安平路606巷25弄20號左右  噪音汙染",臺南市安平區安平路606巷25弄20號,22.999866,120.16865
UN201512090007,"2015-12-09 01:20:00",永康區,噪音舉發,妨礙安寧,"永康區中華路7巷20弄17號3樓住戶 妨礙安寧",臺南市永康區中華路7巷20弄17號,22.999592,120.234186
UN201512090008,"2015-12-09 02:33:00",北區,噪音舉發,妨礙安寧,"北區公園路128號 妨礙安寧",臺南市北區公園路128號,22.998894,120.207641
UN201512090009,"2015-12-09 03:13:00",東區,噪音舉發,妨礙安寧,"東區崇德二十街83號 妨礙安寧",臺南市東區崇德二十街83號,22.967927,120.229932
UN201512090016,"2015-12-09 07:44:00",仁德區,交通運輸,交通疏導,仁德區太子路679號前往永大路方向,臺南市仁德區太子路679號,22.991405,120.253153
UN201512090019,"2015-12-09 08:02:00",東區,道路維修,佔用道路,東區小東路338號前,臺南市東區小東路338號,22.99834,120.232541
UN201512090031,"2015-12-09 08:32:00",中西區,交通運輸,佔用道路,"中西區萬昌街113號盆栽 佔據道路",臺南市萬昌街113號,22.992534,120.210524
UN201512090032,"2015-12-09 08:34:00",中西區,髒亂及汙染,空氣汙染,"中西區環河街86號 空氣汙染",臺南市中西區環河街86號,22.994639,120.192541
UN201512090038,"2015-12-09 08:44:00",善化區,髒亂及汙染,空氣汙染,"善化區六德里290之1號 空氣汙染",臺南市善化區六德里290之1號,23.155369,120.302299
UN201512090050,"2015-12-09 09:08:00",東區,髒亂及汙染,空氣汙染,"東區立德四路22號外面 空汙",臺南市東區立德四路22號,22.975613,120.2155
UN201512090052,"2015-12-09 09:15:00",永康區,違規停車,違規停車,"永康區中正路888號對面 違規停車",永康區中正路888號對面,23.03924745681975,120.23949399590494
UN201512090059,"2015-12-09 09:29:00",東區,動物救援,犬貓急難救援,"東區府東街30號8樓 動物救援",臺南市東區府東街30號,22.985522,120.220287
UN201512090062,"2015-12-09 09:34:00",安平區,違規停車,違規停車,"安平區安平路117號 違停",臺南市安平區安平路117號,22.99972,120.163532
UN201512090080,"2015-12-09 10:08:00",永康區,動物救援,犬貓急難救援,"永康區永和街238巷22弄13號 貓受困",臺南市永康區永和街238巷22弄13號,23.019402,120.254036
UN201512090094,"2015-12-09 10:37:00",東區,違規停車,違規停車,"東區崇德四街9號及崇德四街7巷路口 違規停車",臺南市崇德四街9號,22.977712,120.225227
UN201512090100,"2015-12-09 10:54:00",東區,違規停車,違規停車,"東區東成街201巷9號  違規停車",臺南市東區東成街201巷9號,22.980637,120.237781
UN201512090113,"2015-12-09 11:31:00",中西區,違規停車,違規停車,"中西區府前路二段283號 違規停車",臺南市中西區府前路二段283號,22.992032,120.189341
UN201512090116,"2015-12-09 11:39:00",中西區,違規停車,違規停車,"中西區府前路二段227號 違規停車",臺南市中西區府前路二段227號,22.991602,120.191581
UN201512090117,"2015-12-09 11:43:00",北區,違規停車,違規停車,"北區北成路112號 違規停車",臺南市北區北成路112號,23.019708,120.208962
UN201512090124,"2015-12-09 12:04:00",安平區,違規停車,違規停車,"安平區郡平路(育平路-健康三街)  違規停車",708台灣台南市安平區郡平路,22.98910699606642,120.16817037016152
UN201512090127,"2015-12-09 12:22:00",南區,交通運輸,佔用道路,"南區金華路一段460巷17號對面轉角處 佔用道路",臺南市南區金華路一段460巷17號,22.972322,120.191324
UN201512090132,"2015-12-09 12:40:00",中西區,交通運輸,佔用道路,"中西區永福路二段37號對面公11停車場人行道 佔用道路",臺南市中西區永福路二段37號,22.991058,120.200434
UN201512090146,"2015-12-09 13:25:00",中西區,違規停車,違規停車,"中西區萬昌街133號深呼吸外 違規停車",臺南市萬昌街133號,22.993493,120.210563
UN201512090147,"2015-12-09 13:25:00",北區,違規停車,違規停車,"北區東豐路229,239及241號 違停","臺南市北區東豐路229,239及241號",23.003236,120.221316
UN201512090159,"2015-12-09 13:58:00",中西區,交通運輸,佔用道路,"中西區府緯街4巷2號 佔用道路",臺南市中西區府緯街4巷2號,22.984104,120.199753
UN201512090193,"2015-12-09 15:16:00",中西區,道路維修,路面坑洞,"中西區民權路三段162號(三山食堂)  路面坑洞",臺南市中西區民權路三段162號,22.997396,120.195866
UN201512090201,"2015-12-09 15:42:00",中西區,騎樓舉發,騎樓舉發,"中西區民族路二段63號 騎樓舉發",臺南市民族路二段63號,22.994306,120.209873
UN201512090207,"2015-12-09 15:51:00",永康區,違規停車,違規停車,"永康區新中街(中正路到正南五街) 違規停車",永康區新中街(中正路到正南五街),23.03622873130579,120.24036638438703
UN201512090234,"2015-12-09 17:28:00",中西區,違規停車,違規停車,"中西區金華路3段52號 違規停車",臺南市中西區金華路3段52號,22.989536,120.192472
UN201512090244,"2015-12-09 18:05:00",中西區,違規停車,違規停車,"中西區府前路2段204號 違規停車",臺南市府前路2段204號,22.991702,120.1925
UN201512090245,"2015-12-09 18:09:00",新營區,噪音舉發,妨礙安寧,"新營區民治路1-14號1樓 妨礙安寧",臺南市新營區民治路1-14號,23.310581,120.321582
UN201512090247,"2015-12-09 18:13:00",仁德區,髒亂及汙染,空氣汙染,"仁德區正義路165號附近的公園旁的農地 空氣汙染",臺南市仁德區正義路165號,22.972481,120.255933
UN201512090248,"2015-12-09 18:24:00",仁德區,路燈故障,10盞以上路燈故障,"仁德區中清路200號週邊 路燈故障",臺南市仁德區中清路200號,22.973818,120.256323
UN201512090249,"2015-12-09 18:26:00","東 區",違規停車,違規停車,"東區裕農路357巷 違規停車",701台灣台南市東區裕農路357巷,22.987266514294088,120.22977266460656
UN201512090260,"2015-12-09 19:13:00",麻豆區,髒亂及汙染,道路散落物,"麻豆區謝厝寮222號附近 動物屍體",臺南市麻豆區謝厝寮222號,23.150417,120.236948
UN201512090267,"2015-12-09 19:42:00",新市區,違規停車,違規停車,"新市區中正路191號 違規停車",744台灣台南市新市區中正路191號,23.076723,120.2917388
UN201512090277,"2015-12-09 20:21:00",東區,噪音舉發,妨礙安寧,"東區文化中心 靠近崇明路的廣場 妨礙安寧","東區文化中心 靠近崇明路的廣場",24.7920604,120.9933678
UN201512090278,"2015-12-09 20:23:00",南區,違規停車,違規停車,"南區文南路286號與文南路284號中間汽車停車格 違規停車",臺南市南區文南路286號,22.986534,120.190192
UN201512090279,"2015-12-09 20:29:00",中西區,路燈故障,9盞以下路燈故障,"中正路*忠義路交叉口 路燈不亮",中正路*忠義路交叉口,22.9800921,120.2563131
UN201512090281,"2015-12-09 20:40:00",東區,交通運輸,佔用道路,"東區裕農三街217號 佔用道路",臺南市東區裕農三街217號,22.983195,120.239727
UN201512090290,"2015-12-09 21:20:00",北區,違規停車,違規停車,"北區北成路128巷41號 違停",臺南市北區北成路128巷41號,23.020706,120.209299
UN201512090300,"2015-12-09 22:11:00",北區,噪音舉發,妨礙安寧,"北區公園路128號(首相飯店) 妨礙安寧",臺南市北區公園路128號,22.998894,120.207641
UN201512090302,"2015-12-09 22:10:00",北區,路燈故障,9盞以下路燈故障,"北區小北路20號 路燈故障",北區小北路20號,23.006286,120.2067734
UN201512100001,"2015-12-10 00:02:00",安南區,動物救援,犬貓急難救援,"安南區安豐五街182號 貓受傷",臺南市安南區安豐五街182號,23.047586,120.217495
UN201512100006,"2015-12-10 00:26:00",麻豆區,噪音舉發,妨礙安寧,"麻豆區中正路53號 妨礙安寧",臺南市麻豆區中正路53號,23.185109,120.248724
UN201512100013,"2015-12-10 05:20:00",安定區,噪音舉發,妨礙安寧,"安定區港口里393-29號 妨礙安寧",臺南市安定區港口里393-29號,23.094681,120.233953
UN201512100014,"2015-12-10 05:57:00",中西區,違規停車,違規停車,"中西區府緯街4巷2號 違停",臺南市中西區府緯街4巷2號,22.984104,120.199753
UN201512100015,"2015-12-10 06:00:00",中西區,違規停車,違規停車,"中西區府緯街四巷六號轉角 違規停車",700台灣台南市中西區府緯街四巷六號轉角,22.983986733980643,120.19968967884779
UN201512100016,"2015-12-10 06:02:00",中西區,違規停車,違規停車,"中西區府緯街四巷8號轉角 違規停車",700台灣台南市中西區府緯街四巷8號轉角,22.9839759308836,120.19970409572124
UN201512100018,"2015-12-10 06:42:00",安平區,路燈故障,9盞以下路燈故障,"安平路51巷16弄15號 路燈故障",臺南市安平路51巷16弄15號,22.998716,120.165489
UN201512100019,"2015-12-10 06:45:00",東區,噪音舉發,妨礙安寧,"東興路二段59號 妨礙安寧",臺南市東興路二段59號,23.001156,120.228279
UN201512100029,"2015-12-10 08:14:00",北區,違規停車,違規停車,北區小東路319號至339號,臺南市北區小東路319號,22.999234,120.230812
UN201512100061,"2015-12-10 09:32:00","北 區",違規停車,違規停車,"北區開南街與開元路交叉口附近 違規停車",704台灣台南市北區開南街與開元路交叉口附近,23.008210968130363,120.2219010517001
UN201512100069,"2015-12-10 09:48:00",中西區,違規停車,違規停車,違停,臺南市中西區忠義路二段132號,22.995337,120.203796
UN201512100076,"2015-12-10 10:04:00",東區,髒亂及汙染,空氣汙染,"東區崇善路478號隔壁(品旺自助餐) 空氣汙染",臺南市東區崇善路478號,22.972606,120.22959
UN201512100079,"2015-12-10 10:06:00",中西區,交通運輸,佔用道路,中西區海安路二段268號270號272號,臺南市中西區海安路二段268號,22.997838,120.19787
UN201512100088,"2015-12-10 10:26:00",中西區,交通運輸,佔用道路,"中西區府緯街8號 交通運輸",700台灣台南市中西區府緯街8號,22.983983338721664,120.19970443099737
UN201512100092,"2015-12-10 10:29:00",中西區,違規停車,違規停車,"府緯街4巷 違規停車",700台灣台南市中西區府緯街4巷1號前,22.984322864197022,120.1995351165533
UN201512100093,"2015-12-10 10:12:00",永康區,噪音舉發,妨礙安寧,妨礙安寧,臺南市永康區四維街51巷5號,23.032225,120.252393
UN201512100097,"2015-12-10 10:36:00",中西區,違規停車,違規停車,"中西區永福路ㄧ段77號 違規停車",700台灣台南市中西區永福路ㄧ段77號,22.984075010684123,120.19964475184679
UN201512100099,"2015-12-10 10:37:00",中西區,違規停車,違規停車,"中西區府緯街 違規停車",700台南市中西區府緯街13號,22.991999924682634,120.22369846701623
UN201512100106,"2015-12-10 10:45:00",東區,違規停車,違規停車,東區東門路三段226巷10號對面,臺南市東區東門路三段226巷10號,22.976942,120.234433
UN201512100112,"2015-12-10 10:53:00",將軍區,道路維修,路面坑洞,"將軍區鯤溟里100號  路面坑洞",臺南市將軍區鯤溟里100號,23.189157,120.086672
UN201512100119,"2015-12-10 11:02:00",東區,交通運輸,佔用道路,"東區東和路74號 交通運輸",臺南市東區東和路74號,22.998556,120.227595
UN201512100123,"2015-12-10 10:59:00",安平區,道路維修,路面下陷、凹陷,路面凹陷,臺南市安平區文平路187巷12號,22.986943,120.17734
UN201512100127,"2015-12-10 11:21:00",南區,髒亂及汙染,道路散落物,貓屍,臺南市南區西門路404號,22.981239,120.197867
UN201512100130,"2015-12-10 11:29:00",北區,違規停車,違規停車,"北區成功路286號前 違停",臺南市北區成功路286號,22.999643,120.201778
UN201512100139,"2015-12-10 11:47:00",永康區,違規停車,違規停車,"永康區中正路888號對面.545號周邊/中正七街22.23.27.68.70號周邊 違規停車",永康區中正路888號對面.545號周邊/中正七街22.23.27.68.70號周邊,23.039293428302383,120.23946482688187
UN201512100146,"2015-12-10 11:57:00",安平區,違規停車,違規停車,"安平區安平路與健康三街口 違規停車",708台灣台南市安平區安平路與健康三街口,22.99836550743159,120.16998387873173
UN201512100147,"2015-12-10 11:57:00",中西區,違規停車,違規停車,"中西區府前路2段290號 違規停車",臺南市中西區府前路2段290號,22.992321,120.189576
UN201512100151,"2015-12-10 12:27:00",安平區,違規停車,違規停車,"安平區郡平路 違規停車",708台灣台南市安平區郡平路,22.989115329567632,120.16796786338091
UN201512100165,"2015-12-10 13:23:00",永康區,髒亂及汙染,空氣汙染,"永康區中正北路831號 空污",臺南市永康區中正北路831號,23.048834,120.264662
UN201512100166,"2015-12-10 13:25:00",仁德區,髒亂及汙染,空氣汙染,仁德區二仁路一段247號綠塑資源再生有限公司,臺南市仁德區二仁路一段247號,22.922474,120.223857
UN201512100168,"2015-12-10 13:32:00",東區,違規停車,違規停車,"東區東門路二段30號 違停",臺南市東區東門路二段30號,22.986286,120.219514
UN201512100180,"2015-12-10 14:13:00",北區,違規停車,違規停車,"北區成功路176號 違規停車",臺南市北區成功路176號,22.99887,120.204069
UN201512100184,"2015-12-10 14:20:00",安南區,噪音舉發,妨礙安寧,"安南區城北路234巷48弄9號 妨礙安寧",臺南市安南區城北路234巷48弄9號,23.065969,120.132461
UN201512100185,"2015-12-10 14:26:00",永康區,交通運輸,佔用道路,永康區富強路一段52號前,臺南市永康區富強路一段52號,23.014582,120.272646
UN201512100194,"2015-12-10 14:54:00",永康區,違規停車,違規停車,"永康區中正七街1號周邊 違規停車",永康區中正七街1號周邊,23.03948163353745,120.23941956460476
UN201512100203,"2015-12-10 15:08:00",永康區,路燈故障,9盞以下路燈故障,永康區龍潭街286巷75號前,臺南市永康區龍潭街286巷75號,23.0381,120.268267
UN201512100206,"2015-12-10 15:11:00",中西區,違規停車,違規停車,"中西區民生路二段94號外面 違停",臺南市中西區民生路二段94號,22.995404,120.196818
UN201512100209,"2015-12-10 15:15:00",永康區,噪音舉發,場所連續噪音,"永康區復國二路63巷2號 噪音",臺南市永康區復國二路63巷2號,23.005982,120.247092
UN201512100216,"2015-12-10 15:42:00",官田區,髒亂及汙染,空氣汙染,"官田區南部里南部120號之8""宏展瀝青有限公司",臺南市官田區南部里南部120號,23.195692,120.318116
UN201512100221,"2015-12-10 15:57:00",永康區,髒亂及汙染,空氣汙染,"永康區大灣路166號 空氣汙染",臺南市永康區大灣路166號,23.009203,120.268911
UN201512100222,"2015-12-10 16:00:00",安平區,民生管線,漏水、停水、消防栓漏水或損壞,"安平區建平八街372巷56號 漏水",臺南市安平區建平八街372巷56號,22.992654,120.174735
UN201512100232,"2015-12-10 16:32:00",南區,道路維修,路面坑洞,"南區明興路651之2號 路面坑洞",臺南市南區明興路651之2號,22.938872,120.181148
UN201512100234,"2015-12-10 16:30:00",南區,違規停車,違規停車,違停,臺南市南區夏林路252號,22.978578,120.194887
UN201512100235,"2015-12-10 16:38:00",東區,違規停車,違規停車,東區東寧296號與怡東路口,臺南市東區東寧路296號,22.990262,120.226739
UN201512100237,"2015-12-10 16:39:00",東區,噪音舉發,妨礙安寧,妨礙安寧,臺南市東區中華東路二段48巷6號,22.986784,120.232972
UN201512100239,"2015-12-10 16:44:00",永康區,違規停車,違規停車,"永康區中正路 違規停車",永康區中正路890號周圍.888號對面,23.03928602350087,120.2393789961934
UN201512100249,"2015-12-10 16:57:00",中西區,違規停車,違規停車,"中西區西華南街18號 違規停車",臺南市西華南街18號,22.993517,120.209444
UN201512100251,"2015-12-10 17:00:00",中西區,交通運輸,佔用道路,"中西區萬昌街一百一13號 佔用道路",臺南市萬昌街一百一13號,22.993489,120.210623
UN201512100267,"2015-12-10 17:38:00",中西區,路燈故障,9盞以下路燈故障,"中西區民生路一段181巷1號 路燈不亮",臺南市中西區民生路一段181巷1號,22.99396,120.200035
UN201512100270,"2015-12-10 17:49:00",東區,交通運輸,佔用道路,"東區仁和路80號前 佔用道路",臺南市東區仁和路80號,22.975577,120.230583
UN201512100273,"2015-12-10 18:00:00",南區,交通運輸,交通疏導,"南區健康路一段149號  交通疏導",臺南市南區健康路一段179號,22.98117,120.207882
UN201512100275,"2015-12-10 18:02:00",東區,違規停車,違規停車,"東區仁和路67號旁邊 違停",臺南市東區仁和路67號,22.971997,120.236371
UN201512100276,"2015-12-10 18:00:00",安平區,路燈故障,9盞以下路燈故障,"安平區安北路121巷15弄1號 路燈",臺南市安平區安北路121巷15弄1號,23.001986,120.163261
UN201512100277,"2015-12-10 18:03:00",南區,路燈故障,9盞以下路燈故障,"南區惠南街63號對面 路燈故障",臺南市南區惠南街63號,22.979108,120.188036
UN201512100278,"2015-12-10 18:04:00",安平區,路燈故障,9盞以下路燈故障,"安平區古堡街113號前方 路燈不亮",臺南市安平區古堡街113號,23.00291,120.158132
UN201512100281,"2015-12-10 18:07:00",中西區,路燈故障,9盞以下路燈故障,"中西區國華街三段221號對面 路燈",臺南市中西區國華街三段221號,22.998559,120.199301
