UN201512130070,"2015-12-13 11:09:00",南區,違規停車,違規停車,"南區永成路二段665號 福懋休息站旁邊斜對面   併排違停",臺南市南區永成路二段665號,22.952358,120.195333
UN201512130084,"2015-12-13 11:53:00",北區,違規停車,違規停車,"北區實踐街39巷122弄19號 違停",臺南市北區實踐街39巷122弄19號,23.016932,120.219426
UN201512130086,"2015-12-13 12:25:00",佳里區,違規停車,違規停車,"722台灣台南市佳里區延平路250-252號 違規停車",臺南市佳里區延平路250-252號,23.159622,120.178625
UN201512130088,"2015-12-13 12:37:00","東 區",違規停車,違規停車,"701台灣台南市東區中華東路三段360號 違規停車",701台灣台南市東區中華東路三段360號,22.97381631604366,120.2208476141095
UN201512130090,"2015-12-13 12:40:00",中西區,違規停車,違規停車,"700台灣台南市中西區府前一街9巷16號 違規停車",臺南市中西區府前一街9巷16號,22.993164,120.187611
UN201512130095,"2015-12-13 13:09:00",中西區,違規停車,違規停車,"中西區西華南街58/60號 違規停車",臺南市西華南街58/60號,22.996888,120.210151
UN201512130096,"2015-12-13 12:59:00",東區,違規停車,違規停車,"東區東門路一段148號  違停",臺南市東區東門路一段148號,22.987756,120.21489
UN201512130097,"2015-12-13 12:46:00",下營區,噪音舉發,妨礙安寧,"下營區中營里1154號 廟會/妨礙安寧",臺南市下營區中營里1154號,23.215277,120.277553
UN201512130101,"2015-12-13 13:20:00",中西區,違規停車,違規停車,"700台灣台南市中西區國華街三段250巷28號 違規停車",臺南市中西區國華街三段250巷28號,22.999115,120.200082
UN201512130102,"2015-12-13 13:24:00",南區,違規停車,違規停車,"台南市南區新興路359號 違規停車",臺南市南區新興路359號,22.975563,120.191557
UN201512130103,"2015-12-13 12:23:00",下營區,噪音舉發,妨礙安寧,"下營區茅港里280號 廟會/妨礙安寧",臺南市下營區茅港里280號,23.216593,120.282524
UN201512130106,"2015-12-13 13:22:00",中西區,違規停車,違規停車,"中西區開山路83號周邊  違停",臺南市中西區開山路83號,22.990004,120.20704
UN201512130111,"2015-12-13 13:58:00",永康區,違規停車,違規停車,"永康區中華路381號 違停",臺南市永康區中華路381號,23.009197,120.233242
UN201512130115,"2015-12-13 14:17:00",歸仁區,噪音舉發,場所連續噪音,"歸仁區大仁七街50號附近   噪音",臺南市歸仁區大仁七街50號,22.974871,120.299062
UN201512130117,"2015-12-13 13:39:00",中西區,違規停車,違規停車,"中西區開山路63號   違停",臺南市中西區開山路63號,22.990512,120.206663
UN201512130122,"2015-12-13 14:42:00",中西區,違規停車,違規停車,"中西區興華街37號 違規停車",臺南市興華街37號,22.99257,120.211201
UN201512130125,"2015-12-13 14:55:00",永康區,違規停車,違規停車,違規停車,701台灣台南市永康區中華二路,22.997163708391966,120.21296594291925
UN201512130130,"2015-12-13 14:53:00",東區,噪音舉發,妨礙安寧,"東區仁和路56號  妨礙安寧",臺南市東區仁和路56號,22.977239,120.230032
UN201512130132,"2015-12-13 14:55:00",安平區,噪音舉發,妨礙安寧,"安平區永華路二段819號對面   擴音器",臺南市安平區永華路二段819號,22.990885,120.168528
UN201512130138,"2015-12-13 15:24:00",安平區,違規停車,違規停車,"安平區國平路308號  違停",臺南市安平區國平路308號,22.991898,120.171354
UN201512130144,"2015-12-13 16:02:00",安平區,噪音舉發,妨礙安寧,"安平區永華路二段819號附近 妨礙安寧",臺南市安平區永華路二段819號,22.990885,120.168528
UN201512130153,"2015-12-13 16:33:00",中西區,違規停車,違規停車,"中西區府緯街41號對面   違規停車",700台灣台南市中西區府緯街41號對面,22.98401173543049,120.19961390644312
UN201512130154,"2015-12-13 16:33:00",中西區,違規停車,違規停車,"中西區府緯街四巷27號   違規停車",700台灣台南市中西區府緯街四巷27號,22.984087974390953,120.198559127748
UN201512130155,"2015-12-13 16:35:00",中西區,違規停車,違規停車,"中西區府緯街四巷六號   違規停車",700台灣台南市中西區府緯街四巷六號,22.98403550223655,120.19876699894667
UN201512130157,"2015-12-13 16:43:00","南 區",違規停車,違規停車,"南區體育路21巷17號   違規停車",702台灣台南市南區體育路21巷17號,22.98081861158592,120.20821508020163
UN201512130158,"2015-12-13 16:47:00","南 區",違規停車,違規停車,"南區體育路21巷36號旁  違規停車",702台灣台南市南區體育路21巷36號旁,22.980849478296566,120.2079488709569
UN201512130159,"2015-12-13 16:47:00","南 區",違規停車,違規停車,"南區體育路21巷   違規停車",702台灣台南市南區體育路21巷,22.980763668823535,120.2079478651285
UN201512130161,"2015-12-13 16:51:00","南 區",違規停車,違規停車,"南區健康路一段133巷40號   違規停車",702台灣台南市南區健康路一段133巷40號,22.979728703512706,120.20896710455419
UN201512130166,"2015-12-13 17:12:00","南 區",違規停車,違規停車,"南區竹溪街70號 違規停車",702台灣台南市南區竹溪街70號,22.979053950013164,120.21021667867899
UN201512130167,"2015-12-13 17:15:00","南 區",違規停車,違規停車,"南區健康路一段133巷85號 違規停車",702台灣台南市南區健康路一段133巷85號,22.97960461826382,120.20957797765733
UN201512130168,"2015-12-13 17:20:00","南 區",違規停車,違規停車,"南區體育路41巷及體育路交叉口 違規停車",702台灣台南市南區體育路41巷及體育路交叉口,22.97952775943311,120.20713783800602
UN201512130170,"2015-12-13 17:24:00","南 區",違規停車,違規停車,"南區田徑場正門口公有停車場 違規停車",702台灣台南市南區田徑場正門口公有停車場,22.97850451420798,120.2046514302492
UN201512130173,"2015-12-13 17:33:00",中西區,違規停車,違規停車,"中西區五妃街與永福路一段交叉口 違規停車",700台灣台南市中西區五妃街與永福路一段交叉口,22.98268572622385,120.19998908042906
UN201512130183,"2015-12-13 18:24:00",中西區,違規停車,違規停車,"中西區府前二街10號 違規停車",臺南市中西區府前二街10號,22.99325,120.187589
UN201512130185,"2015-12-13 18:31:00",中西區,違規停車,違規停車,"中西區府前二街10號 違規停車",臺南市中西區府前二街10號,22.99325,120.187589
UN201512130191,"2015-12-13 19:09:00",北區,違規停車,違規停車,"北區開元路142號 違停",臺南市北區開元路142號,23.006787,120.219392
UN201512130196,"2015-12-13 19:30:00",東區,噪音舉發,妨礙安寧,"東區裕農路450號附近 廟會",臺南市東區裕農路450號,22.988107,120.232326
UN201512130207,"2015-12-13 20:09:00",仁德區,髒亂及汙染,空氣汙染,"仁德區中正路三段136巷62.66.45.43號 空氣汙染",臺南市仁德區中正路三段136巷62.66.45.43號,22.974903,120.254541
UN201512130208,"2015-12-13 20:14:00",東區,噪音舉發,妨礙安寧,"東區富農街二段130號後面巷子裡 廟會妨礙安寧",臺南市東區富農街二段130號,22.987879,120.235747
UN201512130216,"2015-12-13 20:26:00",永康區,違規停車,違規停車,"永康區中華路754號前面巷口處 違停",臺南市永康區中華路754號,23.017004,120.228473
UN201512130217,"2015-12-13 20:28:00",安南區,違規停車,違規停車,"安南區北安路二段319-2號 違規停車",709台灣台南市安南區北安路二段319-2號,23.033578651700836,120.204008705914
UN201512130220,"2015-12-13 20:36:00",官田區,民生管線,漏水、停水、消防栓漏水或損壞,"官田區隆本里復興街212號 消防栓漏水",臺南市官田區隆本里復興街212號,23.198213,120.311946
UN201512130230,"2015-12-13 21:17:00",東區,違規停車,違規停車,東區長榮路二段32巷70.80號-88號違停/申請紅線,臺南市東區長榮路二段32巷70.80號,22.987231,120.222056
UN201512130232,"2015-12-13 21:42:00",東區,違規停車,違規停車,"東區裕農一街84、86號前 違規停車",臺南市裕農一街84、86號,22.983101,120.238347
UN201512130261,"2015-12-13 22:59:00",仁德區,違規停車,違規停車,"仁德區中正路二段1207號 違停",臺南市仁德區中正路二段1207號,22.970326,120.251754
