UN201701230001,"2017-01-23 00:19:00",新營區,噪音舉發,妨害安寧,"新營區新進路二段254號 妨害安寧",臺南市新營區新進路二段254號,23.30074,120.305584
UN201701230007,"2017-01-23 03:59:00",中西區,髒亂及汙染,道路散落物,"中西區金華路三段175號 道路散落物",中西區金華路三段175號,22.9935591,120.193052
UN201701230008,"2017-01-23 05:01:00",東區,噪音舉發,場所連續噪音,"阿寶早餐店  場所連續噪音",臺南市東區裕農路752號,22.988732,120.238186
UN201701230009,"2017-01-23 05:26:00",南區,噪音舉發,場所連續噪音,"南區大同路二段164巷10號12樓之2   場所連續噪音",南區大同路二段164巷10號12樓之2,22.9780781,120.211999
UN201701230023,"2017-01-23 08:16:00",中西區,交通運輸,佔用道路,"中西區民生路二段276號 佔用道路",臺南市中西區民生路二段276號,22.997019,120.191529
UN201701230025,"2017-01-23 08:18:00",中西區,違規停車,違規停車,"中西區開山路76、78、80、82-1、86號周邊及對面的77、85號 違規停車",臺南市中西區開山路76號,22.990099,120.206607
UN201701230041,"2017-01-23 08:39:00",東區,噪音舉發,場所連續噪音,"東區長東街103巷2之8號   場所連續噪音",臺南市東區長東街103巷2之8號,22.962252,120.230098
