UN201702070292,"2017-02-07 17:38:00",安南區,動物救援,遊蕩犬隻捕捉管制,"安南區府安路三段289巷25弄3號 捕犬",臺南市安南區府安路三段289巷25弄3號,23.029637,120.217944
UN201702070296,"2017-02-07 17:46:00",南區,違規停車,違規停車,"南區大同路二段285號 違規停車",臺南市南區大同路二段285號,22.976467,120.213623
UN201702070298,"2017-02-07 17:53:00",東區,違規停車,違規停車,"東區大同路二段5號至27號 違規停車",臺南市東區大同路二段5號,22.988529,120.211889
UN201702070300,"2017-02-07 17:58:00",中西區,違規停車,違規停車,"中西區尊王路186號、府前路二段204到214號  違規停車",中西區尊王路186號,22.992496415372468,120.19225639205229
UN201702070301,"2017-02-07 18:01:00",中西區,違規停車,違規停車,"中西區府前路二段202號 違規停車",臺南市中西區府前路二段202號,22.991695,120.192535
UN201702070310,"2017-02-07 18:15:00",新市區,路燈故障,9盞以下路燈故障,"新市區中興街137號、143號前面 路燈故障",臺南市新市區中興街137號,23.077999,120.29226
UN201702070315,"2017-02-07 18:26:00",中西區,違規停車,違規停車,中西區民族路二段76號違規停車,臺南市中西區民族路二段76號,22.994726,120.20925
UN201702070316,"2017-02-07 18:28:00",中西區,違規停車,違規停車,中西區中山路16-48號違規停車,臺南市中西區中山路16-48號,22.992958,120.206019
UN201702070320,"2017-02-07 18:38:00",中西區,違規停車,違規停車,中西區民權路一段18號違規停車,臺南市中西區民權路一段18號,22.989454,120.210847
UN201702070321,"2017-02-07 18:40:00",中西區,違規停車,違規停車,中西區永福路二段193號違規停車,臺南市中西區永福路二段193號,22.995706,120.201647
UN201702070323,"2017-02-07 18:40:00",南區,違規停車,違規停車,"永華路一段251號 違規停車",臺南市永華路一段251號,22.988297,120.190753
UN201702070324,"2017-02-07 18:47:00",中西區,違規停車,違規停車,中西區永福路二段34號違規停車,臺南市中西區永福路二段34號,22.991446,120.20073
UN201702070327,"2017-02-07 18:52:00",南區,違規停車,違規停車,"南區金華路一段2號到8號 違規停車",臺南市南區金華路一段2號,22.96143,120.189391
UN201702070329,"2017-02-07 18:54:00",南區,髒亂及汙染,空氣汙染,"南區金華路二段76號，四海遊龍 空污",臺南市南區金華路二段76號,22.977567,120.191301
UN201702070334,"2017-02-07 19:09:00",中西區,違規停車,違規停車,"中西區友愛街132號 違規停車",臺南市中西區友愛街132號,22.991757,120.198544
UN201702070338,"2017-02-07 19:25:00",新市區,違規停車,違規停車,"新市區中正路 違規停車",新市區中正路,23.0747826,120.291444
UN201702070344,"2017-02-07 19:35:00",東區,違規停車,違規停車,"東區長榮路二段32巷163號 違規停車",臺南市東區長榮路二段32巷163號,22.988683,120.220973
UN201702070347,"2017-02-07 19:38:00",東區,違規停車,違規停車,"東區大同路二段5號 違規停車",臺南市東區大同路二段5號,22.988529,120.211889
UN201702070350,"2017-02-07 19:35:00",北區,噪音舉發,妨害安寧,北區小東路299巷9弄9號妨礙安寧,臺南市北區小東路299巷9弄9號,22.999715,120.229855
UN201702070353,"2017-02-07 19:57:00",中西區,違規停車,違規停車,"中西區西門路一段464號至476號 違停",臺南市中西區西門路一段464號,22.983118,120.197789
UN201702070355,"2017-02-07 20:02:00",東區,違規停車,違規停車,台南市東區崇道路19巷26號違規停車,臺南市東區崇道路19巷26號,22.972894,120.225604
UN201702070356,"2017-02-07 20:03:00",安平區,騎樓舉發,騎樓舉發,安平區華平路656號騎樓舉發,安平區華平路656號,22.9958648,120.1757903
UN201702070358,"2017-02-07 20:15:00",東區,違規停車,違規停車,台南市東區東門路一段76號違規停車,臺南市東區東門路一段76號,22.988235,120.213372
UN201702070359,"2017-02-07 20:19:00",新營區,違規停車,違規停車,新營區隋唐街31巷48弄違規停車,新營區隋唐街31巷48弄,23.3057924,120.30253
UN201702070363,"2017-02-07 20:32:00",北區,違規停車,違規停車,70448台南市北區成功路1號2號違規停車,臺南市北區成功路1號,22.997791,120.211428
UN201702070364,"2017-02-07 20:36:00",東區,違規停車,違規停車,701台灣台南市東區崇明路239號違規停車,臺南市東區崇明路239號,22.977218,120.220682
UN201702070374,"2017-02-07 21:46:00",鹽水區,違規停車,違規停車,"鹽水區西門路2號 違規停車",鹽水區西門路2號,23.3173193,120.2666789
UN201702070378,"2017-02-07 20:29:00",六甲區,違規停車,違規停車,"六甲區中正路485巷  違規停車",六甲區中正路485巷,23.2298791,120.350797
UN201702070380,"2017-02-07 22:21:00",永康區,違規停車,違規停車,"永康區新行街70號 違規停車",永康區新行街70號,23.0396657,120.2417515
UN201702070387,"2017-02-07 22:41:00",東區,違規停車,違規停車,"東區府連路204巷29弄13號旁 違停",臺南市東區府連路204巷29弄13號,22.984463,120.213551
UN201702070392,"2017-02-07 22:46:00",安平區,噪音舉發,場所連續噪音,"安平區永華路二段819號旁 噪音",臺南市安平區永華路二段819號,22.990885,120.168528
UN201702070395,"2017-02-07 23:12:00",北區,噪音舉發,妨害安寧,"北區大興街325巷33號，北海釣蝦場停車場 妨害安寧",臺南市北區大興街325巷33號,23.009635,120.18664
UN201702070406,"2017-02-07 23:58:00",東區,噪音舉發,妨害安寧,"東區崇善路1091號 妨害安寧",臺南市東區崇善路1091號,22.964029,120.234922
UN201702080008,"2017-02-08 01:37:00",東區,噪音舉發,妨害安寧,"東區勝利路50號附近 妨害安寧",東區勝利路50號附近,22.991275,120.2178564
UN201702080012,"2017-02-08 02:48:00",中西區,動物救援,犬貓急難救援,"中西區民生路一段46號 貓受傷",臺南市中西區民生路一段46號,22.993272,120.203772
UN201702080019,"2017-02-08 06:01:00",永康區,噪音舉發,妨害安寧,"永康區蔦松二街124巷 妨害安寧",永康區蔦松二街124巷,23.0435648,120.2568143
UN201702080021,"2017-02-08 06:50:00",北區,交通運輸,佔用道路,"北區台南公園附近的二中入口前 佔用道路",北區台南公園附近的二中入口前,23.0043521,120.2125535
UN201702080024,"2017-02-08 07:42:00",中西區,違規停車,違規停車,"中西區民生路一段80號90號  違規停車",中西區民生路一段80號,22.993955,120.202251
UN201702080025,"2017-02-08 07:47:00",南區,交通運輸,佔用道路,"南區體育路極限運動場旁  佔用道路/違規停車",南區體育路,22.9778308,120.2072655
UN201702080030,"2017-02-08 08:08:00",中西區,交通運輸,佔用道路,"中西區西賢五街65巷60號 佔用道路",臺南市中西區西賢五街65巷60號,23.001932,120.17192
UN201702080040,"2017-02-08 08:45:00",中西區,民生管線,漏水、停水、消防栓漏水或損壞,"中西區中正路305號前  消防栓漏水",700台灣台南市中西區中正路305號,22.9932807,120.1959026
UN201702080045,"2017-02-08 09:03:00",北區,違規停車,違規停車,"北區大武街542巷2號  違規停車",臺南市北區大武街542巷2號,23.017179,120.221572
UN201702080050,"2017-02-08 09:09:00",永康區,噪音舉發,場所連續噪音,"永康區龍橋街36號 連續噪音",臺南市永康區龍橋街36號,23.035111,120.266722
UN201702080052,"2017-02-08 09:13:00",中西區,民生管線,漏水、停水、消防栓漏水或損壞,"中西區中正路與康樂街口   消防栓漏水",中西區中正路與康樂街口,22.9932342,120.1959411
UN201702080070,"2017-02-08 09:43:00",白河區,民生管線,漏水、停水、消防栓漏水或損壞,"白河區中山路3-2號、5號  路面冒水",臺南市白河區中山路3-2號,23.34817,120.414316
UN201702080074,"2017-02-08 09:54:00",中西區,髒亂及汙染,其他汙染舉發,"中西區和善街91巷52號  其他汙染舉發",臺南市中西區和善街91巷52號,23.001515,120.188833
UN201702080080,"2017-02-08 10:07:00",東區,民生管線,漏水、停水、消防栓漏水或損壞,"東區崇善路539號與崇善五街口  消防栓漏水",臺南市東區崇善路539號,22.973553,120.229577
UN201702080090,"2017-02-08 10:27:00",永康區,違規停車,違規停車,"永康區鹽忠街與鹽行路口 違規停車",臺南市永康區洲尾街327號,23.042062,120.230569
UN201702080096,"2017-02-08 10:41:00",東區,交通運輸,佔用道路,"東區府連路220號後方 佔用道路",臺南市東區府連路220號,22.985144,120.213284
UN201702080097,"2017-02-08 10:42:00",中西區,違規停車,違規停車,"中西區民族路二段103號 違規停車",臺南市中西區民族路二段103號,22.994509,120.208887
UN201702080101,"2017-02-08 10:41:00",永康區,髒亂及汙染,其他汙染舉發,永康區中正南路376號狗屍,臺南市永康區中正南路376號,23.033527,120.228939
UN201702080102,"2017-02-08 10:49:00",中西區,違規停車,違規停車,"中西區廣慈街 違規停車",700台灣台南市中西區廣慈街,22.996535252399731,120.20698383809815
UN201702080105,"2017-02-08 10:59:00",安南區,違規停車,違規停車,"安南區海佃路二段306號 違規停車",709台灣台南市安南區海佃路二段306號,23.0375296,120.1872531
UN201702080119,"2017-02-08 11:19:00",中西區,違規停車,違規停車,"中西區民權路一段222號至232號 違規停車",臺南市民權路一段222號,22.992513,120.207623
UN201702080121,"2017-02-08 11:22:00",東區,違規停車,違規停車,"東區崇德路46號 違規停車",臺南市東區崇德路46號,22.981389,120.217567
UN201702080124,"2017-02-08 11:28:00",新營區,違規停車,違規停車,"新營區中正路8號 違規停車",臺南市新營區中正路8號,23.30841,120.31626
UN201702080141,"2017-02-08 10:57:00",安南區,交通運輸,佔用道路,"安南區安中路二段93號 佔用道路",安南區安中路二段93號,23.0464054,120.1870886
UN201702080148,"2017-02-08 12:10:00",安南區,違規停車,違規停車,"安南區海佃路一段187號 違規停車",海佃路一段187號,23.0240852,120.191428
UN201702080150,"2017-02-08 12:10:00",安平區,騎樓舉發,騎樓舉發,"安平區華平路656號 騎樓舉發",臺南市華平路656號,22.995837,120.175938
UN201702080155,"2017-02-08 12:32:00",中西區,違規停車,違規停車,"中西區府前路一段95號97號  違規停車",臺南市中西區府前路一段95號,22.988816,120.209143
UN201702080162,"2017-02-08 12:45:00",中西區,違規停車,違規停車,"中西區廣慈街003停車格 違規停車",700台灣台南市中西區廣慈街003停車格,22.997410935974568,120.20740614868771
UN201702080165,"2017-02-08 12:15:00",中西區,違規停車,違規停車,"中西區府緯街九巷29號 違規停車",臺南市中西區府緯街九巷29號,22.98344,120.198728
UN201702080170,"2017-02-08 12:50:00",北門區,動物救援,犬貓急難救援,"北門區永華里1-1號 動物救援",臺南市北門區永華里1-1號,23.253084,120.128623
UN201702080173,"2017-02-08 13:04:00",中西區,違規停車,違規停車,"中西區民權路二段33號  違規停車",臺南市中西區民權路二段33號,22.993993,120.205971
UN201702080174,"2017-02-08 13:06:00",中西區,違規停車,違規停車,"中西區民權路二段48號60號  違規停車",臺南市中西區民權路二段60號,22.994536,120.204935
UN201702080178,"2017-02-08 13:06:00",永康區,髒亂及汙染,空氣汙染,"永康區小東路641號對面 空氣汙染",永康區小東路641號,22.998786,120.238395
UN201702080182,"2017-02-08 13:17:00",中西區,違規停車,違規停車,"中西區永福路二段193號  違規停車",臺南市中西區永福路二段193號,22.995706,120.201647
UN201702080189,"2017-02-08 13:25:00",永康區,違規停車,違規停車,"永康區小東路679號  違規停車",臺南市永康區小東路679號,22.99871,120.239358
UN201702080192,"2017-02-08 13:28:00",永康區,違規停車,違規停車,"永康區小東路675-677號  違規停車",臺南市永康區小東路677號,22.998696,120.239267
UN201702080196,"2017-02-08 13:03:00",麻豆區,髒亂及汙染,其他汙染舉發,"麻豆區興國路63之2號 其他汙染舉發",臺南市麻豆區興國路63之2號,23.175378,120.246985
UN201702080213,"2017-02-08 14:23:00",佳里區,噪音舉發,妨害安寧,"佳里區文化路119號 妨礙安寧",臺南市佳里區文化路119號,23.163065,120.17982
UN201702080233,"2017-02-08 15:20:00",中西區,違規停車,違規停車,"中西區青年路81號 101號 違規停車",臺南市中西區青年路81號,22.992182,120.208082
UN201702080235,"2017-02-08 15:23:00",中西區,違規停車,違規停車,"中西區衛民街119號 137號 違規停車",臺南市中西區衛民街119號,22.993165,120.208322
UN201702080238,"2017-02-08 15:25:00",中西區,違規停車,違規停車,中西區民權路一段232號違規停車,臺南市中西區民權路一段232號,22.992722,120.207498
UN201702080240,"2017-02-08 15:30:00",永康區,騎樓舉發,騎樓舉發,"永康區小東路513號 佔用騎樓",永康區小東路513號,22.9987661,120.236238
UN201702080244,"2017-02-08 15:42:00",中西區,違規停車,違規停車,"中西區民權路一段232號 違規停車",臺南市中西區民權路一段232號,22.992722,120.207498
UN201702080252,"2017-02-08 15:54:00",麻豆區,交通運輸,佔用道路,"麻豆區民族路16之16號對面 佔用道路",臺南市麻豆區民族路16之16號,23.180732,120.249247
UN201702080253,"2017-02-08 16:01:00",中西區,違規停車,違規停車,"中西區府前路一段361^381號前 違規停車",臺南市中西區府前路一段381號,22.990072,120.198755
UN201702080263,"2017-02-08 16:44:00",中西區,交通運輸,佔用道路,"中西區民生路二段110號 佔用道路",臺南市中西區民生路二段110號,22.995624,120.195992
UN201702080264,"2017-02-08 16:53:00",中西區,違規停車,違規停車,"中西區衛民街117號 違規停車",中西區衛民街117號,22.9931301,120.2080188
UN201702080265,"2017-02-08 16:53:00",東區,違規停車,違規停車,"東區裕農路930號  違規停車",臺南市東區裕農路930號,22.989829,120.244261
UN201702080266,"2017-02-08 16:58:00",永康區,違規停車,違規停車,"永康區成功路188巷7號前 違規停車",710台灣台南市永康區成功路188巷7號,23.0092427,120.2364578
UN201702080276,"2017-02-08 17:17:00",永康區,髒亂及汙染,環境髒亂,"永康區復興路 環境髒亂",永康區復興路,22.9986627,120.2454263
UN201702080280,"2017-02-08 17:28:00",東區,違規停車,違規停車,"東區裕信二街與裕文一街 違規停車",裕信二街,22.9833497,120.2471277
UN201702080284,"2017-02-08 17:32:00",東區,路燈故障,9盞以下路燈故障,"東區大同路一段141巷35號 路燈故障",東區大同路一段141巷35號,22.985948,120.2125494
UN201702080291,"2017-02-08 17:59:00",北區,違規停車,違規停車,"北區北成路80巷40弄20號 違停",臺南市北區北成路80巷40弄20號,23.019932,120.210884
UN201702080294,"2017-02-08 18:06:00",東區,違規停車,違規停車,"東區崇德十八街與崇德17街126巷口 違規停車",東區崇德17街126巷口,22.9686363,120.2299773
UN201702080296,"2017-02-08 18:07:00",東區,違規停車,違規停車,"東區育樂街220-250號 違規停車",臺南市東區育樂街220-250號,22.992485,120.214484
UN201702080300,"2017-02-08 18:20:00",學甲區,違規停車,違規停車,"學甲區中正路198號 違規停車",臺南市學甲區中正路198號,23.231952,120.179944
UN201702080301,"2017-02-08 18:14:00",北區,道路維修,路面掏空、塌陷,"北區開元路148巷136號、勝利路190巷59號 路面掏空",臺南市北區開元路148巷136號,23.005348,120.220121
UN201702080305,"2017-02-08 18:27:00",東區,違規停車,違規停車,"東區長榮路二段180號 違規停車",臺南市東區長榮路二段180號,22.990222,120.220767
UN201702080307,"2017-02-08 18:29:00",永康區,違規停車,違規停車,"永康區大灣路273號 違規停車",臺南市永康區大灣路273號,23.006329,120.267355
UN201702080314,"2017-02-08 18:41:00",北區,違規停車,違規停車,"北區和緯路五段76號 違規停車",臺南市北區和緯路五段76號,23.009688,120.214657
UN201702080316,"2017-02-08 18:44:00",安南區,交通運輸,號誌故障,"安南區宜居路與府安路六段交叉口 號誌故障",安南區宜居路,23.0216636,120.1850587
UN201702080317,"2017-02-08 18:45:00",北區,路燈故障,9盞以下路燈故障,"北區公園南路17號前 路燈不亮",臺南市北區公園南路17號,23.000028,120.212147
UN201702080319,"2017-02-08 18:51:00",東區,違規停車,違規停車,"東區東門路二段28號-30號 違規停車",東區東門路二段28號,22.9862834,120.2194145
UN201702080320,"2017-02-08 18:54:00",北區,髒亂及汙染,空氣汙染,"北區長榮路五段211巷10號旁 空氣汙染",北區長榮路五段211巷10號,23.0124438,120.2197227
UN201702080323,"2017-02-08 19:06:00",永康區,違規停車,違規停車,"永康區復興路31號 違規停車",台南市永康區復興路31號,22.998477,120.2496668
UN201702080327,"2017-02-08 19:11:00",永康區,噪音舉發,場所連續噪音,"永康區富強路一段93巷21號 噪音舉發",臺南市永康區富強路一段93巷21號,23.015515,120.272828
UN201702080329,"2017-02-08 19:16:00",中西區,違規停車,違規停車,"中西區民權路一段229號到265號 違規停車",臺南市民權路一段229號,22.992518,120.207295
UN201702080330,"2017-02-08 19:18:00",中西區,違規停車,違規停車,"中西區衛民街137號 違規停車",臺南市衛民街137號,22.993296,120.207525
UN201702080332,"2017-02-08 19:20:00",中西區,違規停車,違規停車,"中西區衛民街106之20號 違規停車",臺南市衛民街106之20號,22.993346,120.208667
UN201702080333,"2017-02-08 19:23:00",東區,違規停車,違規停車,"東區崇明十二街8號 違規停車",崇明12街8號,22.9750575,120.223332
UN201702080338,"2017-02-08 19:34:00",中西區,噪音舉發,妨害安寧,"中西區康樂街74號  妨害安寧",中西區康樂街74號,22.9921295,120.1944197
UN201702080339,"2017-02-08 19:38:00",新營區,違規停車,違規停車,"新營區復興路130號前 違停",臺南市新營區復興路130號,23.303511,120.309628
UN201702080340,"2017-02-08 19:45:00",安南區,路燈故障,9盞以下路燈故障,"安南區海環街317號 路燈故障",臺南市安南區海環街317號,23.038742,120.181187
UN201702080342,"2017-02-08 19:58:00",永康區,違規停車,違規停車,"永康區復興路29號 違規停車",台南市永康區復興路29號,22.998545,120.2500816
UN201702080345,"2017-02-08 20:19:00",中西區,違規停車,違規停車,"中西區府連路40號 違規停車",中西區府連路40號,22.9828623,120.2099887
UN201702080348,"2017-02-08 20:37:00",中西區,交通運輸,佔用道路,"中西區國華街二段182號附近 違規攤販",臺南市中西區國華街二段182號,22.992137,120.197242
UN201702080350,"2017-02-08 20:41:00",東區,違規停車,違規停車,"東區崇明24街 違規停車",東區崇明24街,22.9667385,120.2256975
UN201702080354,"2017-02-08 21:05:00",東區,違規停車,違規停車,"東區崇明路19號 違規停車",崇明路19號,22.9817824,120.2163005
UN201702080367,"2017-02-08 23:20:00",東區,噪音舉發,妨害安寧,"東區大同路一段241巷6弄10號 噪音舉發",臺南市東區大同路一段241巷6弄10號,22.982874,120.211793
UN201702080369,"2017-02-08 23:36:00",南區,噪音舉發,妨害安寧,"南區鹽埕路103巷38弄14號 妨害安寧",702台灣台南市南區鹽埕路103巷38弄14號,22.9661487,120.1876854
UN201702090001,"2017-02-09 00:14:00",永康區,違規停車,違規停車,"永康區新中街301號 違規停車",710台灣台南市永康區新中街301號,23.040172640823094,120.24392332645880
UN201702090008,"2017-02-09 05:04:00",北區,噪音舉發,場所連續噪音,北區北園街80巷5號噪音舉發,704台灣台南市北區北園街80巷5號,23.0125047,120.2231891
UN201702090013,"2017-02-09 07:35:00",關廟區,髒亂及汙染,空氣汙染,"關廟區花園一街88號旁 空氣汙染",臺南市關廟區花園一街88號,22.961794,120.336396
UN201702090024,"2017-02-09 08:30:00",中西區,違規停車,違規停車,"中西區開山路76、78、80、82-1、86號周邊及對面75、77、85號 違規停車",臺南市中西區開山路76號,22.990099,120.206607
UN201702090026,"2017-02-09 08:43:00",安平區,髒亂及汙染,道路散落物,"安平區健康路三段320號 道路散落物",臺南市安平區健康路三段320號,22.984652,120.169792
UN201702090038,"2017-02-09 09:22:00",北區,違規停車,違規停車,"北區成功路114號，近忠義路三段 違停",臺南市北區成功路114號,22.998814,120.205387
UN201702090042,"2017-02-09 09:23:00",安南區,道路維修,人孔蓋凹陷坑洞,"安南區本田路三段266號 人孔蓋或溝蓋聲響鬆動",臺南市安南區本田路三段266號,23.043992,120.164738
UN201702090044,"2017-02-09 09:29:00",北區,髒亂及汙染,道路散落物,"北區西門路三段41號立人國小前方  道路散落物",臺南市北區西門路三段41號,23.001336,120.202082
UN201702090048,"2017-02-09 09:42:00",南區,路燈故障,9盞以下路燈故障,"南區興南街252巷90號前 路燈故障",臺南市南區興南街252巷90號,22.923262,120.180005
UN201702090056,"2017-02-09 09:57:00",北區,噪音舉發,場所連續噪音,"北區文賢路799巷57弄67號 場所連續噪音",臺南市北區文賢路799巷57弄67號,23.014824,120.191885
UN201702090060,"2017-02-09 10:00:00",安南區,民生管線,漏水、停水、消防栓漏水或損壞,"安南區培安二街9號 漏水",臺南市安南區培安二街9號,23.046497,120.213309
UN201702090070,"2017-02-09 10:35:00",永康區,違規停車,違規停車,"永康區小東路477巷29號 違規停車",臺南市永康區小東路477巷29號,22.999637,120.235335
UN201702090072,"2017-02-09 10:39:00",中西區,違規停車,違規停車,"中西區頂美三街246號  違規停車",臺南市中西區頂美三街246號,23.004878,120.185991
UN201702090073,"2017-02-09 10:09:00",永康區,噪音舉發,場所連續噪音,"永康區復華三街79號 連續噪音",臺南市永康區復華三街79號,23.00955,120.246013
UN201702090081,"2017-02-09 10:47:00",東區,交通運輸,號誌故障,"東區中華東路二段77號和中華東路二段73巷交叉口 號誌",臺南市東區中華東路二段77號,22.986671,120.233675
UN201702090084,"2017-02-09 10:53:00",東區,交通運輸,號誌故障,"東區中華東路二段40號 號誌故障",臺南市東區中華東路二段40號,22.987024,120.233206
UN201702090085,"2017-02-09 10:55:00",仁德區,道路維修,人孔蓋或溝蓋聲響鬆動,"仁德區土庫路206號及208號對面 人孔蓋或溝蓋聲響鬆動",仁德區土庫路206號,22.9857495,120.2613989
UN201702090096,"2017-02-09 11:10:00",安南區,路燈故障,9盞以下路燈故障,"安南區安中路四段20號 路燈",臺南市安南區安中路四段20號,23.050475,120.173112
UN201702090100,"2017-02-09 11:29:00",永康區,違規停車,違規停車,永康區永二街文化路違規停車,永康區永二街文化路,23.0157026,120.2521997
UN201702090101,"2017-02-09 11:32:00",中西區,違規停車,違規停車,中西區中山路45號違規停車,臺南市中西區中山路45號,22.993513,120.206355
UN201702090103,"2017-02-09 11:33:00",中西區,違規停車,違規停車,中西區中山路2號違規停車,中西區中山路2號,22.9928053,120.2057059
UN201702090106,"2017-02-09 11:34:00",中西區,違規停車,違規停車,中西區民生路一段6-40號違規停車,臺南市中西區民生路一段6-40號,22.992937,120.204494
UN201702090108,"2017-02-09 11:35:00",中西區,違規停車,違規停車,中西區民生路一段160號違規停車,中西區民生路一段160號,22.9942969,120.2001762
UN201702090111,"2017-02-09 11:58:00",中西區,違規停車,違規停車,中西區金華路三段205號違規停車,中西區金華路三段205號,22.9944527,120.1932237
UN201702090112,"2017-02-09 12:00:00",中西區,違規停車,違規停車,中西區中正路101號違規停車,中西區中正路101號,22.9923299,120.2003152
UN201702090117,"2017-02-09 12:13:00",安平區,違規停車,違規停車,"安平區華平路656號 違規停車",臺南市安平區華平路656號,22.995837,120.175938
UN201702090121,"2017-02-09 12:22:00",安平區,騎樓舉發,騎樓舉發,"安平區華平路656號 騎樓舉發",臺南市安平區華平路656號,22.995837,120.175938
UN201702090128,"2017-02-09 12:43:00",中西區,違規停車,違規停車,"中西區開山路76、78、80、82-1、86號周邊及對面75、77、85號 違規停車",臺南市中西區開山路76號,22.990099,120.206607
UN201702090154,"2017-02-09 13:57:00",東區,違規停車,違規停車,"東區中華東路一段336號 違規停車",臺南市東區中華東路一段336號,22.992999,120.233749
UN201702090155,"2017-02-09 13:57:00",安南區,噪音舉發,妨害安寧,"安南區怡安路一段316巷21弄20號 妨礙安寧",臺南市安南區怡安路一段316巷21弄20號,23.042692,120.208763
UN201702090165,"2017-02-09 14:15:00",安南區,噪音舉發,妨害安寧,"安南區怡安路一段316巷21弄20號 妨害安寧",臺南市安南區怡安路一段316巷21弄20號,23.042692,120.208763
UN201702090166,"2017-02-09 14:15:00",北區,交通運輸,佔用道路,"北區文成二路372號 佔用道路",臺南市北區文成二路372號,23.015024,120.201293
UN201702090170,"2017-02-09 14:31:00",新市區,違規停車,違規停車,"新市區中心路 違規停車",744台灣台南市新市區中心路,23.10319386,120.26142232
