UN201702110145,"2017-02-11 10:54:00",中西區,違規停車,違規停車,"中西區衛民街41號到58號 違規停車",臺南市中西區衛民街41號,22.99273,120.211154
UN201702110148,"2017-02-11 10:58:00",永康區,髒亂及汙染,空氣汙染,"永康區立興街132號 空氣汙染",臺南市永康區立興街132號,23.001939,120.262828
UN201702110149,"2017-02-11 10:58:00",中西區,違規停車,違規停車,中西區興華街37號違規停車,臺南市中西區興華街37號,22.99257,120.211201
UN201702110151,"2017-02-11 10:59:00",中西區,違規停車,違規停車,"中西區民權路三段118號和109號 違規停車",臺南市中西區民權路三段118號,22.99716,120.196743
UN201702110153,"2017-02-11 11:02:00",中西區,違規停車,違規停車,中西區衛民街69號違規停車,臺南市中西區衛民街69號,22.992892,120.209701
UN201702110157,"2017-02-11 11:08:00",安平區,交通運輸,號誌故障,"708台灣台南市安平區國平路335-363號 號誌故障",708台灣台南市安平區國平路335-363號,22.9930676,120.1713336
UN201702110158,"2017-02-11 11:08:00",中西區,違規停車,違規停車,中西區民權路一段238號違規停車,臺南市中西區民權路一段238號,22.992864,120.207342
UN201702110160,"2017-02-11 11:09:00",中西區,違規停車,違規停車,中西區青年路76號違規停車,臺南市中西區青年路76號,22.992044,120.207439
UN201702110162,"2017-02-11 11:11:00",中西區,違規停車,違規停車,中西區城隍街青年路違規停車,中西區城隍街青年路,22.9919116,120.2090264
UN201702110164,"2017-02-11 11:16:00",南區,噪音舉發,妨害安寧,"南區金華路一段484巷240弄26號 妨害安寧",臺南市南區金華路一段484巷240弄26號,22.968566,120.194412
UN201702110165,"2017-02-11 11:16:00",南區,髒亂及汙染,空氣汙染,"南區五妃街與國華街一段口 空污",南區五妃街國華街一段,22.9826627,120.1964883
UN201702110171,"2017-02-11 11:31:00",永康區,髒亂及汙染,空氣汙染,"永康區正南一街200號 空氣污染",永康區正南一街200號,23.0275191,120.225292
UN201702110172,"2017-02-11 11:32:00",中西區,違規停車,違規停車,中西區武德街衛民街違規停車,中西區武德街衛民街,22.9930015,120.2097953
UN201702110173,"2017-02-11 11:31:00",東區,噪音舉發,場所連續噪音,"東區林森路一段160號8樓之4 噪音",臺南市東區林森路一段160號,22.981688,120.215359
UN201702110174,"2017-02-11 11:36:00",安平區,騎樓舉發,騎樓舉發,安平區華平路656號騎樓舉發,臺南市安平區華平路656號,22.995837,120.175938
UN201702110184,"2017-02-11 12:00:00",永康區,民生管線,漏水、停水、消防栓漏水或損壞,"永康區小東路565號 漏水",臺南市永康區小東路565號,22.99867,120.236738
UN201702110188,"2017-02-11 12:06:00",東區,民生管線,漏水、停水、消防栓漏水或損壞,"東區東安路172-1號   停水",臺南市東區東安路172-1號,22.99491,120.227081
UN201702110194,"2017-02-11 12:29:00",中西區,交通運輸,佔用道路,"中西區神農街95號 佔用道路",臺南市中西區神農街95號,22.997697,120.196143
UN201702110197,"2017-02-11 12:34:00",安平區,違規停車,違規停車,"安平區健康三街近慶平路口 違規停車",健康三街慶平路,22.9976403,120.1696149
UN201702110199,"2017-02-11 12:37:00",安平區,違規停車,違規停車,"安平區健康三街近慶平路口 違規停車",健康三街慶平路,22.9976403,120.1696149
UN201702110204,"2017-02-11 12:49:00",中西區,違規停車,違規停車,"中西區金華路三段54號 違停",臺南市中西區金華路三段54號,22.989609,120.192504
UN201702110207,"2017-02-11 12:57:00",永康區,違規停車,違規停車,"永康區中華路463號旁巷口 違規停車",臺南市永康區中華路463號,23.011028,120.232106
UN201702110209,"2017-02-11 12:59:00",北區,違規停車,違規停車,"北區和緯路二段330號 違規停車",北區和緯路二段330號,23.0125869,120.2050044
UN201702110210,"2017-02-11 13:04:00",佳里區,動物救援,犬貓急難救援,"佳里區公園路283巷6號 貓受傷",臺南市佳里區公園路283巷6號,23.158738,120.172207
UN201702110215,"2017-02-11 13:11:00",南區,違規停車,違規停車,"南區大同路二段702號  黃紅線違停",臺南市南區大同路二段702號,22.967138,120.215743
UN201702110216,"2017-02-11 13:16:00",東區,違規停車,違規停車,"東區東門路二段30號  違停",臺南市東區東門路二段30號,22.986286,120.219514
UN201702110217,"2017-02-11 13:21:00",新營區,噪音舉發,妨害安寧,"新營區民治路366號 妨害安寧",臺南市新營區民治路366號,23.305536,120.303034
UN201702110224,"2017-02-11 13:44:00",安南區,民生管線,漏水、停水、消防栓漏水或損壞,"安南區安中路二段71巷12號 地震 漏水",臺南市安南區安中路二段71巷12號,23.045967,120.187328
UN201702110225,"2017-02-11 13:47:00",安南區,民生管線,漏水、停水、消防栓漏水或損壞,"安南區安和路二段196號 漏水",臺南市安南區安和路二段196號,23.040857,120.215903
UN201702110226,"2017-02-11 13:58:00",北區,違規停車,違規停車,704台灣台南市北區海安路三段781巷違規停車,704台灣台南市北區海安路三段781巷,23.0143489,120.200511
UN201702110230,"2017-02-11 14:02:00",北區,違規停車,違規停車,704台灣台南市北區海安路三段781巷公園違規停車,704台灣台南市北區海安路三段781巷公園,23.0157346,120.2004205
UN201702110233,"2017-02-11 14:05:00",東區,髒亂及汙染,空氣汙染,髒亂及汙染,臺南市東區小東路198巷6弄11號,22.99951,120.227356
UN201702110234,"2017-02-11 13:25:00",南區,交通運輸,佔用道路,"南區金華路一段352巷193弄6號  占用道路",臺南市南區金華路一段352巷193弄6號,22.967493,120.194967
UN201702110236,"2017-02-11 14:08:00",中西區,違規停車,違規停車,中西區西華南街32號違規停車,中西區西華南街32號,22.9937341,120.2093835
UN201702110239,"2017-02-11 14:16:00",中西區,違規停車,違規停車,中西區西寧街37號、25號違停,臺南市中西區西寧街37號,22.997194,120.191612
UN201702110249,"2017-02-11 14:45:00",東區,違規停車,違規停車,"東區中華東路三段399巷29弄9號  違規停車",701台灣台南市東區中華東路三段399巷29弄9號,22.972308467836502,120.22132987672126
UN201702110255,"2017-02-11 14:58:00",中西區,騎樓舉發,騎樓舉發,"中西區民族路二段76之12號1樓 佔用騎樓",臺南市中西區民族路二段76之12號,22.994726,120.20925
UN201702110259,"2017-02-11 15:08:00",南區,違規停車,違規停車,"南區國華街一段*永華路  違停",南區國華街一段*永華路,22.987386,120.1963873
UN201702110266,"2017-02-11 15:32:00",東區,違規停車,違規停車,"東區慶東街127巷7號 違規停車",臺南市東區慶東街127巷7號,22.989952,120.215995
UN201702110274,"2017-02-11 15:56:00",安平區,騎樓舉發,騎樓舉發,"安平區華平路656號 騎樓舉發",安平區華平路656號,22.9958648,120.1757903
UN201702110275,"2017-02-11 15:59:00",北區,民生管線,漏水、停水、消防栓漏水或損壞,"北區臨安路二段269號 漏水",北區臨安路二段269號,23.0045243,120.2013622
UN201702110276,"2017-02-11 16:01:00",中西區,騎樓舉發,騎樓舉發,台南市中西區府前路一段174號違規停車,台南市中西區府前路一段174號,22.9891651,120.2065068
UN201702110283,"2017-02-11 16:14:00",北區,交通運輸,佔用道路,"北區民德路58巷23弄及58巷口 佔用道路",北區民德路58巷30弄,23.0072949,120.2032845
UN201702110289,"2017-02-11 16:16:00",東區,違規停車,違規停車,"東區中華東路二段185巷口 違停",東區中華東路二段185巷,22.9846025,120.2330707
UN201702110296,"2017-02-11 16:41:00",安平區,違規停車,違規停車,"台南市安平區永華六街154巷66號 違規停車",台南市安平區永華六街154巷66號,22.9923892,120.1768374
UN201702110303,"2017-02-11 17:14:00",中西區,違規停車,違規停車,"中西區衛民街69號、71號，106之20號, 152號 違規停車",臺南市中西區衛民街69號,22.992892,120.209701
UN201702110304,"2017-02-11 17:16:00",中西區,違規停車,違規停車,"中西區中正路6號到土地銀行 違規停車",臺南市中西區中正路6號,22.992373,120.20396
UN201702110306,"2017-02-11 17:19:00",中西區,違規停車,違規停車,"中西區忠義路一段59號 違規停車",臺南市中西區忠義路一段59號,22.9864,120.20173
UN201702110308,"2017-02-11 17:21:00",中西區,違規停車,違規停車,"中西區南寧街146/130號對面 違規停車",臺南市中西區南寧街146號,22.985167,120.200401
UN201702110310,"2017-02-11 17:27:00",中西區,違規停車,違規停車,"中西區忠義路一段89號 違規停車",臺南市中西區忠義路一段89號,22.987291,120.201748
UN201702110311,"2017-02-11 17:29:00",中西區,違規停車,違規停車,"中西區忠義路二段41號 違規停車",臺南市中西區忠義路二段41號,22.99105,120.202458
UN201702110314,"2017-02-11 17:41:00",中西區,違規停車,違規停車,"中西區金華路四段110號 違規停車",臺南市中西區金華路四段110號,22.998693,120.195055
UN201702110318,"2017-02-11 17:56:00",北區,噪音舉發,妨害安寧,"北區民德路101號5樓，劍道社 妨害安寧",北區民德路101號,23.0058535,120.2019412
UN201702110320,"2017-02-11 18:00:00",中西區,違規停車,違規停車,"忠義路一帶87號附近 違規停車",臺南市中西區忠義路一路87號,22.992741,120.202828
UN201702110322,"2017-02-11 18:04:00",中西區,違規停車,違規停車,"中西區中山路2號到48號 違規停車",臺南市中西區中山路2號,22.992715,120.205643
UN201702110323,"2017-02-11 18:06:00",中西區,違規停車,違規停車,"中西區西華南街38號42號 違規停車",臺南市西華南街38號,22.993886,120.209524
UN201702110324,"2017-02-11 18:08:00",中西區,違規停車,違規停車,"中西區衛民街152號/69號 違規停車",臺南市中西區衛民街152號,22.993549,120.207286
UN201702110325,"2017-02-11 18:09:00",東區,民生管線,漏水、停水、消防栓漏水或損壞,"東區利東街30號 漏水",臺南市東區利東街30號,22.969467,120.235732
UN201702110334,"2017-02-11 18:29:00",中西區,違規停車,違規停車,"中西區府前路325到329號 違規停車",臺南市中西區府前路一段325號,22.989847,120.199893
UN201702110336,"2017-02-11 18:33:00",中西區,違規停車,違規停車,"中西區民權路一段229號 違規停車",臺南市民權路一段229號,22.992518,120.207295
UN201702110340,"2017-02-11 18:41:00",南區,路燈故障,10盞以上路燈故障,"南區國華街一段98號 路燈故障",臺南市南區國華街一段98號,22.985406,120.196471
UN201702110343,"2017-02-11 18:54:00",中西區,違規停車,違規停車,"中西區忠義路二段41號 違規停車",臺南市中西區忠義路二段41號,22.99105,120.202458
UN201702110344,"2017-02-11 18:55:00",中西區,違規停車,違規停車,"中西區衛民街62號門口 違規停車",臺南市中西區衛民街62號,22.993127,120.210295
UN201702110349,"2017-02-11 19:16:00",中西區,違規停車,違規停車,"中西區康樂街，介於成功路與民族三段間 違停",中西區康樂街,22.995694,120.195283
UN201702110357,"2017-02-11 19:33:00",永康區,違規停車,違規停車,"永康區中華路456號 違規停車",台南市永康區中華路456號,23.0106782,120.2328077
UN201702110361,"2017-02-11 19:47:00",東區,違規停車,違規停車,"東區長榮路三段30巷18號 違規停車",東區長榮路三段30巷18號,22.99260592803406,120.22187635677068
UN201702110369,"2017-02-11 20:32:00",東區,違規停車,違規停車,"東區裕農路448之9號 違規停車",臺南市裕農路448之9號,22.987909,120.231866
UN201702110370,"2017-02-11 20:34:00",安南區,民生管線,漏水、停水、消防栓漏水或損壞,"安南區安和路二段196號 路面冒水",臺南市安南區安和路二段196號,23.040857,120.215903
UN201702110374,"2017-02-11 20:53:00",北區,違規停車,違規停車,"北區武聖路8號/武聖路8巷口 違規停車",704台灣台南市北區武聖路8號,23.0053374,120.1931154
UN201702110379,"2017-02-11 21:07:00",東區,違規停車,違規停車,"東區裕豐街211號 違規停車",臺南市東區裕豐街211號,22.988971,120.227374
UN201702110380,"2017-02-11 21:06:00",中西區,違規停車,違規停車,"中西區民族路二段143號 違停",臺南市中西區民族路二段143號,22.994977,120.207443
UN201702110386,"2017-02-11 21:35:00",中西區,違規停車,違規停車,"中西區民族路二段71號與西華南街口 違規停車",臺南市民族路二段71號,22.994351,120.209457
UN201702110390,"2017-02-11 21:50:00",安平區,民生管線,漏水、停水、消防栓漏水或損壞,"安平區平通路578號 消防栓漏水",臺南市安平區平通路578號,22.993845,120.170434
UN201702110391,"2017-02-11 21:54:00",安南區,違規停車,違規停車,"安南區台江大道五段 違規停車",安南區台江大道五段,23.0656628,120.1399054
UN201702110393,"2017-02-11 22:18:00",東區,違規停車,違規停車,"東區崇德四街7巷12號 違規停車",台南市東區崇德四街7巷12號,22.9776831,120.225107
UN201702110394,"2017-02-11 22:37:00",中西區,違規停車,違規停車,"中西區海安路二段268號 違規停車",臺南市中西區海安路二段268號,22.997838,120.19787
