UN201702090172,"2017-02-09 14:33:00",中西區,違規停車,違規停車,"中西區民族路277號公車站牌違停中山路仁德公車站牌  違規停車",臺南市中西區民族路277號,22.996151,120.203482
UN201702090183,"2017-02-09 14:48:00",新營區,道路維修,路面坑洞,"新營區中正路330號-1 路面坑洞",臺南市新營區中正路330號,23.322561,120.316309
UN201702090185,"2017-02-09 14:50:00",北區,道路維修,路面坑洞,"北區西門路四段202號對面 路面坑洞",臺南市北區西門路四段202號,23.010468,120.208504
UN201702090206,"2017-02-09 15:34:00",北區,髒亂及汙染,空氣汙染,"北區北成路212號對面，東琳建設 空污",北區北成路212號,23.0204757,120.2066229
UN201702090208,"2017-02-09 15:31:00",北區,路燈故障,9盞以下路燈故障,"北區武聖路158號前  路燈故障",臺南市北區武聖路158號,23.006763,120.189859
UN201702090213,"2017-02-09 15:49:00",安平區,違規停車,違規停車,"安平區永華四街17巷53號 違規停車",安平區永華四街17巷53號,22.9883977,120.1786273
UN201702090218,"2017-02-09 16:01:00",安平區,動物救援,遊蕩犬隻捕捉管制,"安平區安平路126號 遊蕩犬隻捕捉管制",臺南市安平區安平路126號,22.99858,120.183258
UN201702090223,"2017-02-09 16:16:00",北區,交通運輸,佔用道路,"北區文成二路372號 佔用道路",臺南市北區文成二路372號,23.015024,120.201293
UN201702090224,"2017-02-09 16:18:00",中西區,違規停車,違規停車,"中西區西華南街57號 違規停車",臺南市西華南街57號,22.994192,120.209412
UN201702090228,"2017-02-09 16:27:00",中西區,違規停車,違規停車,"中西區民族路二段76號及95號 違規停車","民族 路二段76號",22.994746,120.2087298
UN201702090229,"2017-02-09 16:28:00",中西區,違規停車,違規停車,"中西區民族路二段76之2號 違規停車",民族路二段76之2號,22.9947981,120.209125
UN201702090233,"2017-02-09 16:34:00",中西區,違規停車,違規停車,"中西區中山路83號 違規停車",臺南市中山路83號,23.235452,120.263134
UN201702090235,"2017-02-09 16:37:00",中西區,違規停車,違規停車,"中西區民權路一段231號到251號 違規停車",臺南市民權路一段231號,22.992523,120.207194
UN201702090242,"2017-02-09 16:52:00",安平區,違規停車,違規停車,安平區安平路246號違規停車,安平區安平路246號,22.9985108,120.1792847
UN201702090252,"2017-02-09 17:09:00",東區,動物救援,犬貓急難救援,"東區建東街35巷12號  貓受傷",臺南市東區建東街35巷12號,22.989886,120.236567
UN201702090253,"2017-02-09 17:32:00",中西區,違規停車,違規停車,中西區青年路101號違規停車,臺南市中西區青年路101號,22.992378,120.208498
UN201702090257,"2017-02-09 17:37:00",中西區,違規停車,違規停車,"中西區民生路一段10-40號  違規停車",臺南市中西區民生路一段10-40號,22.992973,120.204434
UN201702090259,"2017-02-09 17:45:00",中西區,違規停車,違規停車,"中西區衛民街32號 違規停車",臺南市中西區衛民街32號,22.992918,120.211
UN201702090260,"2017-02-09 17:46:00",東區,違規停車,違規停車,"東區崇明二十街13號  違規停車",臺南市東區崇明二十街13號,22.969321,120.226464
UN201702090262,"2017-02-09 17:48:00",安平區,騎樓舉發,騎樓舉發,安平區華平路656號騎樓舉發,安平區華平路656號,22.9958648,120.1757903
UN201702090263,"2017-02-09 17:52:00",南區,違規停車,違規停車,"南區健康路一段179號  違規停車",臺南市南區健康路一段179號,22.98117,120.207882
UN201702090264,"2017-02-09 17:53:00",東區,違規停車,違規停車,"東區裕農二街   違規停車",東區裕農二街,22.9850795,120.23901
UN201702090266,"2017-02-09 17:58:00",中西區,違規停車,違規停車,中西區府前路二段204到214號違規停車,中西區府前路二段204到214號,22.989024982940037,120.19401441793858
UN201702090273,"2017-02-09 18:20:00",新市區,違規停車,違規停車,"新市區中華路16號 違規停車",744台灣台南市新市區中華路16號,23.067834486550847,120.29042897757176
UN201702090276,"2017-02-09 18:29:00",安平區,違規停車,違規停車,"安平區健康三街府平路 違規停車",安平區健康三街府平路,22.987021,120.1682993
UN201702090280,"2017-02-09 18:37:00",東區,違規停車,違規停車,"東區長榮路二段180號   違規停車",臺南市長榮路二段180號,22.990222,120.220767
UN201702090282,"2017-02-09 18:38:00",善化區,動物救援,犬貓急難救援,"善化區胡厝里胡厝寮190號  犬貓救援",臺南市善化區胡厝里胡厝寮190號,23.143916,120.269393
UN201702090284,"2017-02-09 18:47:00",中西區,違規停車,違規停車,"中西區民權路二段138號及142號 違規停車",臺南市民權路二段138號,22.995054,120.203163
UN201702090285,"2017-02-09 18:49:00",中西區,違規停車,違規停車,"中西區忠義路二段41號 違規停車",臺南市中西區忠義路二段41號,22.99105,120.202458
UN201702090286,"2017-02-09 18:50:00",中西區,違規停車,違規停車,"中西區民權路二段9號至51號 違規停車",臺南市民權路二段9號,22.993747,120.206416
UN201702090287,"2017-02-09 18:52:00",南區,違規停車,違規停車,"南區大同路二段118號 違規停車",臺南市南區大同路二段118號,22.979673,120.212625
UN201702090288,"2017-02-09 18:52:00",中西區,違規停車,違規停車,"中西區衞民街106號至20號及119 違規停車",衞民街106-20號/119號,22.9933218,120.2089647
UN201702090289,"2017-02-09 18:53:00",中西區,違規停車,違規停車,"中西區府緯街22號 違規停車",府緯街22號,22.9839464,120.1993916
UN201702090290,"2017-02-09 18:53:00",中西區,違規停車,違規停車,"中西區衛民街32號 違規停車",臺南市衛民街32號,22.992918,120.211
UN201702090294,"2017-02-09 19:00:00",中西區,違規停車,違規停車,"中西區民權路一段229號至269號 違規停車",臺南市民權路一段229號,22.992518,120.207295
UN201702090300,"2017-02-09 19:18:00",中西區,違規停車,違規停車,"中西區西華南街32號 違規停車",臺南市中西區西華南街32號,22.993828,120.209542
UN201702090301,"2017-02-09 19:20:00",新市區,違規停車,違規停車,"新市區中正路 丹丹漢堡和全聯    違規停車","新市區中正路 丹丹漢堡和全聯",23.0742238,120.2914209
UN201702090304,"2017-02-09 19:56:00",東區,違規停車,違規停車,"東區育樂街220號 違規停車",臺南市東區育樂街220號,22.992485,120.214484
UN201702090305,"2017-02-09 20:06:00",永康區,違規停車,違規停車,"永康區復國二路10巷2號 違規停車",臺南市永康區復國二路10巷2號,23.0024061,120.247355
UN201702090306,"2017-02-09 18:48:00",新市區,路燈故障,10盞以上路燈故障,"新市區大洲里大洲路32號周邊 路燈不亮",臺南市新市區大洲里大洲路32號,23.070957,120.261024
UN201702090307,"2017-02-09 20:19:00",北區,違規停車,違規停車,"北區忠義路三段22號 違規停車",忠義路三段22號,22.9993063,120.2053477
UN201702090308,"2017-02-09 20:30:00",永康區,違規停車,違規停車,"永康區中華路911號 違規停車",永康區中華路911號,23.021433,120.2212465
UN201702090311,"2017-02-09 20:47:00",鹽水區,交通運輸,佔用道路,"台南市鹽水區武廟路87號 佔用道路",737台灣台南市鹽水區武廟路87號,23.3239532,120.2658758
UN201702090314,"2017-02-09 20:50:00",東區,違規停車,違規停車,"東區凱旋路33號 違規停車",台南市東區凱旋路33號,22.9928221,120.230502
UN201702090315,"2017-02-09 20:39:00",中西區,路燈故障,9盞以下路燈故障,"中西區武英街8號 路燈不亮",臺南市中西區武英街8號,22.989229,120.192596
UN201702090317,"2017-02-09 20:54:00",永康區,噪音舉發,妨害安寧,"永康區中山南路479號 妨害安寧",臺南市永康區中山南路479號,23.021868,120.248933
UN201702090318,"2017-02-09 20:55:00",中西區,噪音舉發,妨害安寧,"中西區民權路一段110號   妨礙安寧",臺南市中西區民權路一段110號,22.990453,120.209432
UN201702090320,"2017-02-09 21:24:00",北區,噪音舉發,妨害安寧,"北區公園路798號 妨害安寧",臺南市北區公園路798號,23.011869,120.211382
UN201702090322,"2017-02-09 21:25:00",新營區,噪音舉發,妨害安寧,"新營區南新街13巷20號    妨礙安寧",臺南市新營區南新街13巷20號,23.31039,120.308842
UN201702090328,"2017-02-09 21:49:00",北區,交通運輸,佔用道路,"北區西門路四段285號 佔用道路",北區西門路四段285號,23.0136475,120.2092508
UN201702090332,"2017-02-09 22:06:00",中西區,騎樓舉發,騎樓舉發,"中西區海安路二段330巷1號 占用騎樓",臺南市中西區海安路二段330巷1號,22.999492,120.198528
UN201702090333,"2017-02-09 22:30:00",南區,違規停車,違規停車,"安南區智安一街33號 違規停車",台南市安南區智安一街33號,23.0500743,120.1766138
UN201702090334,"2017-02-09 22:25:00",東區,噪音舉發,場所連續噪音,"東區崇信街95號  噪音",臺南市東區崇信街95號,22.980514,120.227183
UN201702090336,"2017-02-09 22:40:00",中西區,噪音舉發,妨害安寧,"中西區康樂街74號旁  噪音",中西區康樂街74號旁,22.9947908,120.1950675
UN201702090339,"2017-02-09 22:59:00",南區,民生管線,停電、漏電、電線掉落、孔蓋鬆動,"南區大林路12號門口   台電孔蓋噪音",臺南市南區大林路12號,22.976235,120.212712
UN201702090340,"2017-02-09 23:23:00",東區,噪音舉發,妨害安寧,"東區自由路二段175巷15號  妨害安寧",701台灣台南市東區自由路二段175巷15號,22.9742446,120.2366104
UN201702090343,"2017-02-09 23:35:00",永康區,噪音舉發,妨害安寧,"永康區復國一路254號  妨害安寧",臺南市永康區復國一路254號,23.007312,120.246609
UN201702100001,"2017-02-10 00:17:00",東區,噪音舉發,場所連續噪音,"東區育樂街200號 噪音舉發",臺南市東區育樂街200號,22.993742,120.214576
UN201702100013,"2017-02-10 05:00:00",新營區,噪音舉發,場所連續噪音,"新營區新進路69號  場所連續噪音",臺南市新營區新進路69號,23.30476,120.321051
UN201702100014,"2017-02-10 05:08:00",東區,噪音舉發,場所連續噪音,"東區東光路二段58巷16號 場所連續噪音",臺南市東區東光路二段58巷16號,22.996511,120.232136
UN201702100017,"2017-02-10 07:30:00",關廟區,髒亂及汙染,空氣汙染,"關廟區花園一街88號 空氣汙染",臺南市關廟區花園一街88號,22.961794,120.336396
UN201702100018,"2017-02-10 07:44:00",中西區,違規停車,違規停車,"中西區中山路37號 違規停車",臺南市中山路37號,23.233897,120.261315
UN201702100019,"2017-02-10 07:46:00",中西區,違規停車,違規停車,"中西區民生路一段78號 違規停車",臺南市民生路一段78號,22.993573,120.20266
UN201702100020,"2017-02-10 07:53:00",中西區,違規停車,違規停車,"中西區民生路一段63號 違規停車",臺南市民生路一段63號,22.993176,120.203189
UN201702100021,"2017-02-10 07:59:00",中西區,違規停車,違規停車,"中西區開山路56號 違規停車",臺南市開山路56號,22.991184,120.205957
UN201702100022,"2017-02-10 08:01:00",中西區,違規停車,違規停車,"中西區中山路46號 違規停車",臺南市中山路46號,23.234951,120.262179
UN201702100027,"2017-02-10 08:25:00",永康區,違規停車,違規停車,"永康區復國二路10巷2號  違規停車",臺南市永康區復國二路10巷2號,23.002448,120.247352
UN201702100031,"2017-02-10 08:35:00",仁德區,違規停車,違規停車,"仁德區中正路二段256號  違規停車",臺南市仁德區中正路二段256號,22.949525,120.251542
UN201702100046,"2017-02-10 09:22:00",東區,違規停車,違規停車,"東區林森路2段192巷24弄18號 違規停車",台南市東區林森路2段192巷24弄18號,22.9886564,120.2251373
UN201702100054,"2017-02-10 09:34:00",中西區,違規停車,違規停車,"中西區廣慈街 違規停車",中西區廣慈街,22.996439943888493,120.20691670265501
UN201702100070,"2017-02-10 10:10:00",中西區,違規停車,違規停車,"中西區健康路一段166號 違規停車",700台灣台南市中西區健康路一段166號,22.9813265,120.2074092
UN201702100084,"2017-02-10 10:49:00",中西區,交通運輸,號誌故障,"中西區健康路一段112號前方 號誌",臺南市中西區健康路一段112號,22.981458,120.208889
UN201702100091,"2017-02-10 11:00:00",中西區,騎樓舉發,騎樓舉發,"中西區民生路一段10號 騎樓舉發",臺南市中西區民生路一段10號,22.992973,120.204434
UN201702100097,"2017-02-10 11:20:00",永康區,違規停車,違規停車,台南市永康區永大路二段5號違規停車,台南市永康區永大路二段5號,23.00106,120.259288
UN201702100111,"2017-02-10 12:06:00",東區,違規停車,違規停車,"東區東門路二段291號 違規停車",701台南市東區東門路二段291號,22.9835218,120.2264344
UN201702100112,"2017-02-10 12:09:00",中西區,違規停車,違規停車,"中西區民權路一段232號到246 號/239到247號  違規停車",臺南市中西區民權路一段232號,22.992722,120.207498
UN201702100117,"2017-02-10 12:12:00",中西區,違規停車,違規停車,"民族路二段42號/56號/76號 違規停車",臺南市民族路二段42號,22.994585,120.210894
UN201702100128,"2017-02-10 12:59:00",仁德區,違規停車,違規停車,"仁德區中正路一段38號 違規停車",717台灣台南市仁德區中正路一段38號,22.919019518323243,120.22760644555093
UN201702100130,"2017-02-10 13:03:00",中西區,違規停車,違規停車,"中西區西華南街32號 違規停車",臺南市西華南街32號,22.993828,120.209542
UN201702100131,"2017-02-10 13:03:00",中西區,違規停車,違規停車,"中西區中正路252號 違規停車",台南市中西區中正路252號,22.9933508,120.1965813
UN201702100145,"2017-02-10 13:56:00",東區,交通運輸,佔用道路,"東區崇德十一街53號 佔用道路",東區崇德十一街53號,22.9728641,120.228969
UN201702100150,"2017-02-10 14:08:00",中西區,違規停車,違規停車,"中西區民族路二段76號/95號的公車站  違規停車",臺南市中西區民族路二段76號,22.994726,120.20925
UN201702100152,"2017-02-10 14:10:00",中西區,違規停車,違規停車,"中西區廣慈街  違規停車",中西區廣慈街,22.996578210703376,120.20685232963865
UN201702100155,"2017-02-10 14:13:00",中西區,髒亂及汙染,空氣汙染,"中西區民權路一段110號 空汙",臺南市中西區民權路一段110號,22.990453,120.209432
UN201702100157,"2017-02-10 14:15:00",安南區,噪音舉發,場所連續噪音,"安南區海佃路一段188巷58號  場所連續噪音",臺南市安南區海佃路一段188巷58號,23.024962,120.193357
UN201702100161,"2017-02-10 14:23:00",中西區,交通運輸,佔用道路,"中西區國華街二段51號 佔用道路",臺南市中西區國華街二段51號,22.989016,120.196305
UN201702100163,"2017-02-10 14:25:00",安平區,道路維修,人孔蓋或溝蓋聲響鬆動,"安平區平通路408號斜對面 孔蓋鬆動",臺南市安平區平通路408號,22.993344,120.174522
UN201702100168,"2017-02-10 14:34:00",中西區,違規停車,違規停車,"中西區中正路347號斜對面   違規停車",臺南市中西區中正路347號,23.003839,120.180559
UN201702100188,"2017-02-10 15:23:00",仁德區,噪音舉發,妨害安寧,"仁德區中正路二段134號 妨害安寧",臺南市仁德區中正路二段134號,22.946439,120.251308
UN201702100192,"2017-02-10 15:31:00",北區,違規停車,違規停車,"北區和緯路二段207號 違規停車",臺南市北區和緯路二段207號,23.012116,120.205758
UN201702100194,"2017-02-10 15:41:00",中西區,交通運輸,佔用道路,"中西區國華街二段182號 佔用道路",臺南市中西區國華街二段182號,22.992137,120.197242
UN201702100207,"2017-02-10 16:11:00",北區,路燈故障,9盞以下路燈故障,"北區和緯路四段139巷25號  路燈故障",臺南市北區和緯路四段139巷25號,23.007941,120.190684
UN201702100214,"2017-02-10 16:21:00",西港區,髒亂及汙染,空氣汙染,"西港區文化路11號 空氣汙染",臺南市西港區文化路11號,23.123219,120.203959
UN201702100218,"2017-02-10 16:26:00",中西區,違規停車,違規停車,"中西區西和路181號 違停",中西區西和路181號,23.0019049,120.1907137
UN201702100230,"2017-02-10 16:57:00",中西區,違規停車,違規停車,中西區西華南街42號違規停車,中西區西華南街42號,22.9939617,120.2095661
UN201702100233,"2017-02-10 17:12:00",中西區,違規停車,違規停車,中西區民生路一段6-40號違規停車,臺南市中西區民生路一段6-40號,22.992937,120.204494
UN201702100234,"2017-02-10 17:13:00",中西區,違規停車,違規停車,中西區忠義路二段41號違規停車,臺南市中西區忠義路二段41號,22.99105,120.202458
UN201702100235,"2017-02-10 17:13:00",中西區,違規停車,違規停車,700台灣台南市中西區廣慈街違規停車,700台灣台南市中西區廣慈街,22.996827909790028,120.20695582645874
UN201702100236,"2017-02-10 17:14:00",中西區,違規停車,違規停車,中西區忠義路一段89號違規停車,中西區忠義路一段89號,22.987286,120.201643
UN201702100238,"2017-02-10 17:18:00",永康區,動物救援,遊蕩犬隻捕捉管制,"710台灣台南市永康區復華七街32巷31號 捕狗",710台灣台南市永康區復華七街32巷31號,23.0131673,120.2460891
UN201702100244,"2017-02-10 15:20:00",北區,髒亂及汙染,空氣汙染,"北區和緯路二段 空氣汙染",北區和緯路二段,23.012179,120.2057702
UN201702100245,"2017-02-10 17:50:00",中西區,違規停車,違規停車,"中西區中山路6號到42號 違規停車",臺南市中山路6號,23.234659,120.261272
UN201702100246,"2017-02-10 17:51:00",中西區,違規停車,違規停車,"中西區衛民街119號外面 違規停車",臺南市衛民街119號,22.993165,120.208322
UN201702100251,"2017-02-10 17:56:00",仁德區,髒亂及汙染,市區道路路面油漬,"仁德區中正西路683號  路面油漬",臺南市仁德區中正西路683號,22.918592,120.213153
UN201702100252,"2017-02-10 18:11:00",安平區,違規停車,違規停車,"安平區永華路二段768號 違停",臺南市安平區永華路二段768號,22.9914,120.170649
UN201702100255,"2017-02-10 18:07:00",南區,噪音舉發,場所連續噪音,"南區大同路二段482巷115弄 連續噪音",南區大同路二段482巷115弄,22.9785963,120.2134656
UN201702100260,"2017-02-10 18:34:00",永康區,違規停車,違規停車,"永康區中華路463號 違規停車",臺南市永康區中華路461號463號,23.011022,120.2320511
UN201702100267,"2017-02-10 18:52:00",北區,違規停車,違規停車,"北區林森路三段152號 違規停車",北區林森路三段152附近,23.0031315,120.2246831
UN201702100272,"2017-02-10 19:11:00",中西區,違規停車,違規停車,"中西區民族路二段76號與76之2號 違規停車",臺南市民族路二段76號,22.994726,120.20925
UN201702100273,"2017-02-10 19:12:00",西港區,髒亂及汙染,空氣汙染,"西港區西港里45之23號，西港國中附近 空氣污染",臺南市西港區西港里45之23號,23.121347,120.20578
UN201702100275,"2017-02-10 19:16:00",中西區,違規停車,違規停車,"中西區民族路二段196號 違規停車",臺南市民族路二段230號,22.997259,120.201768
UN201702100276,"2017-02-10 19:25:00",東區,噪音舉發,妨害安寧,"東區衛國街112巷11之5號6樓 噪音舉發",臺南市衛國街112巷11之5號,22.987587,120.224121
UN201702100278,"2017-02-10 19:33:00",永康區,交通運輸,佔用道路,"永康區中華路481號 佔用道路",永康區中華路481號,23.0114282,120.2318647
UN201702100279,"2017-02-10 19:34:00",南區,路燈故障,9盞以下路燈故障,"南區金華里新孝路172巷11號前 路燈故障",臺南市南區金華里新孝路172巷11號,22.978329,120.185196
UN201702100287,"2017-02-10 19:58:00",中西區,髒亂及汙染,市區道路路面油漬,"中西區青年路跟城隍路口 路面油漬",中西區青年路跟城隍路口,22.991988,120.209065
UN201702100289,"2017-02-10 20:16:00",中西區,違規停車,違規停車,"中西區民族路二段133號到141號 違規停車",臺南市民族路二段133號,22.994878,120.207797
UN201702100293,"2017-02-10 20:35:00",新市區,違規停車,違規停車,"新市區華興街120號 違規停車",台南市新市區華興街120號,23.0768989,120.2921766
UN201702100297,"2017-02-10 20:31:00",東區,違規停車,違規停車,"東區東門路二段158巷23號對面巷子 違停",臺南市東區東門路二段158巷23號,22.984719,120.22083
UN201702100298,"2017-02-10 20:54:00",關廟區,路燈故障,9盞以下路燈故障,"關廟區布袋里南雄南路36號左斜前方 路燈故障",臺南市關廟區布袋里南雄南路36號,22.925608,120.344642
UN201702100304,"2017-02-10 21:17:00",安平區,噪音舉發,妨害安寧,"安平區永華路二段819號旁大樓工地 妨害安寧",臺南市安平區永華路二段819號,22.990885,120.168528
UN201702100307,"2017-02-10 21:31:00",安平區,噪音舉發,場所連續噪音,"安平區永華路二段819號 噪音舉發",臺南市永華路2段819號,22.990885,120.168528
UN201702100308,"2017-02-10 21:35:00",安平區,違規停車,違規停車,"安平區安平路68號/174號/324號/348號  違停",安平區安平路68號174號624號348號,22.9984747,120.1817772
UN201702100309,"2017-02-10 21:45:00",永康區,違規停車,違規停車,"永康區中華路6-2號 違停",永康區中華路6-2號,22.999163,120.235008
UN201702100310,"2017-02-10 21:48:00",中西區,噪音舉發,妨害安寧,"中西區北門路一段123巷42之1號，D.D.HOUSE  妨害安寧",臺南市中西區北門路一段123巷42之1號,22.994998,120.210944
UN201702100312,"2017-02-10 22:21:00",永康區,違規停車,違規停車,"永康區中華西街21巷8之1號 妨礙出入",永康區中華西街21巷8之1號,23.0143336,120.2259573
UN201702100314,"2017-02-10 22:27:00",中西區,噪音舉發,場所連續噪音,"中西區康樂街74號旁，臨水夫人廟 廟會噪音",臺南市中西區康樂街74號,22.992114,120.194472
UN201702100316,"2017-02-10 23:06:00",安平區,違規停車,違規停車,"安平區同平路178號 妨礙出入",安平區同平路178號,22.9946377,120.1526276
UN201702100318,"2017-02-10 23:28:00",東區,交通運輸,佔用道路,"東區崇德十六街16號對面 佔用道路",台南市東區崇德十六街16號,22.9696448,120.2283198
UN201702100319,"2017-02-10 23:27:00",永康區,民生管線,漏水、停水、消防栓漏水或損壞,"永康區復華七街21號前，電線桿旁 水管漏水",臺南市永康區復華七街21號,23.013545,120.244944
UN201702100320,"2017-02-10 23:43:00",安南區,髒亂及汙染,空氣汙染,"安南區北安路三段286號   空氣污染",安南區北安路三段286號,23.0438629,120.2051071
UN201702100321,"2017-02-10 23:42:00",中西區,髒亂及汙染,道路散落物,"中西區健康路一段342號 貓屍",臺南市中西區健康路一段342號,22.981926,120.200832
UN201702110003,"2017-02-11 00:55:00",中西區,噪音舉發,妨害安寧,"中西區衛民街62號5樓之6 妨害安寧",中西區衛民街62號5樓之6,22.9929862,120.2103885
UN201702110004,"2017-02-11 01:02:00",東區,噪音舉發,場所連續噪音,東區崇善東路7號6樓噪音舉發,臺南市東區崇善東路7號,22.967472,120.232436
UN201702110060,"2017-02-11 04:14:00",北區,噪音舉發,場所連續噪音,北區北園街80巷1號噪音舉發,704台灣台南市北區北園街80巷1號,23.0125886,120.2231891
UN201702110066,"2017-02-11 04:43:00",東區,路燈故障,9盞以下路燈故障,"東區東門路2段301巷120弄21號 路燈故障",臺南市東區東門路2段301巷120弄21號,22.983675,120.229962
UN201702110067,"2017-02-11 05:03:00",六甲區,噪音舉發,妨害安寧,"六甲區中正路422巷7號 妨害安寧",臺南市六甲區中正路422巷7號,23.227712,120.351213
UN201702110085,"2017-02-11 08:09:00",南區,民生管線,漏水、停水、消防栓漏水或損壞,"南區美南街49號   水管破裂  地震",臺南市南區美南街49號,22.987204,120.190402
UN201702110088,"2017-02-11 07:59:00",永康區,民生管線,漏水、停水、消防栓漏水或損壞,"永康區復興路136號 地震 漏水",臺南市永康區復興路136號,22.998776,120.246216
UN201702110097,"2017-02-11 08:48:00",永康區,民生管線,停電、漏電、電線掉落、孔蓋鬆動,"永康區永二街229巷2號   停電    地震",臺南市永康區永二街229巷2號,23.015961,120.252811
UN201702110106,"2017-02-11 09:19:00",中西區,違規停車,違規停車,"中西區開山路76至86號周邊 違規停車",臺南市開山路76號,22.990099,120.206607
UN201702110117,"2017-02-11 09:43:00",南區,民生管線,漏水、停水、消防栓漏水或損壞,"南區夏林路182號 地震 漏水",臺南市南區夏林路182號,22.980267,120.194798
UN201702110125,"2017-02-11 10:02:00",永康區,違規停車,違規停車,"永康區洲尾街327號  違規停車",臺南市永康區洲尾街327號,23.042062,120.230569
UN201702110127,"2017-02-11 10:03:00",北區,民生管線,漏水、停水、消防栓漏水或損壞,"北區公園路591之31號 路面冒水",臺南市北區公園路591之31號,23.013198,120.211722
UN201702110128,"2017-02-11 10:06:00",安平區,交通運輸,號誌故障,"安平區怡平路與永華三街口 號誌不亮",安平區怡平路永華三街,22.9928627,120.1816995
UN201702110139,"2017-02-11 10:34:00",仁德區,民生管線,漏水、停水、消防栓漏水或損壞,"仁德區中山路910巷8號 漏水",臺南市仁德區中山路910巷8號,22.975172,120.239345
UN201702110141,"2017-02-11 10:39:00",北區,噪音舉發,妨害安寧,"北區實踐街36號 妨礙安寧",臺南市北區實踐街36號,23.0141,120.217846
