UN201702130269,"2017-02-13 00:02:00",安平區,道路維修,路面掏空、塌陷,"安平區國平路599號  路面掏空下",臺南市安平區國平路599號,22.996529,120.171431
UN201702130270,"2017-02-13 00:05:00",東區,噪音舉發,場所連續噪音,"東區建東街43巷15號 場所連續噪音",台南市東區建東街43巷15號,22.9902181,120.2365604
UN201702130277,"2017-02-13 01:19:00",後壁區,髒亂及汙染,空氣汙染,"後壁區新嘉里130號左右  空汙",臺南市後壁區新嘉里130號,23.369969,120.313226
UN201702130289,"2017-02-13 07:09:00",安平區,違規停車,違規停車,"安平區安平路242號右側 違規停車",臺南市安平區安平路242號,22.99855,120.179388
UN201702130290,"2017-02-13 07:15:00",中西區,違規停車,違規停車,"中西區健康路一段300號～324號間 違規停車",臺南市中西區健康路一段300號,22.98149,120.202989
UN201702130291,"2017-02-13 07:25:00",中西區,違規停車,違規停車,"中西區健康路二段370號 違規停車",臺南市中西區健康路二段370號,22.981577,120.199385
UN201702130300,"2017-02-13 08:11:00",永康區,交通運輸,佔用道路,"永康區復國一路284號 佔用道路",永康區復國一路284號,23.0091552,120.2464374
UN201702130302,"2017-02-13 08:13:00",永康區,違規停車,違規停車,"永康區中正北路523號對面 違規停車",臺南市永康區中正北路523號,23.042413,120.256825
UN201702130304,"2017-02-13 08:16:00",安南區,交通運輸,佔用道路,"安南區北安路四段與州南路口 佔用道路",安南區北安路四段,23.057463366427733,120.21372814285280
UN201702130309,"2017-02-13 08:29:00",安平區,路燈故障,9盞以下路燈故障,"安平區古堡街120-9號 路燈",臺南市安平區古堡街120-9號,23.003641,120.159087
UN201702130330,"2017-02-13 08:57:00",東區,違規停車,違規停車,"東區立德三路23號與24號 違停",臺南市東區立德三路23號,22.975497,120.215585
UN201702130335,"2017-02-13 08:59:00",北區,噪音舉發,場所連續噪音,"北區實踐街39巷103弄4號隔壁 施工噪音",臺南市北區實踐街39巷103弄4號,23.017111,120.218625
UN201702130336,"2017-02-13 08:58:00",永康區,髒亂及汙染,環境髒亂,"永康區中正六街109號後方 髒亂及汙染",臺南市永康區中正六街109號,23.037925,120.237271
UN201702130339,"2017-02-13 08:58:00",鹽水區,天然災害,路樹問題,"鹽水區南港里202號 路樹問題",臺南市鹽水區南港里202號,23.255144,120.249325
UN201702130347,"2017-02-13 09:35:00",中西區,違規停車,違規停車,"中西區永福路二段117號  違規停車",台南市中西區永福路二段117號,22.9936136,120.2010758
UN201702130369,"2017-02-13 10:17:00",東區,違規停車,違規停車,"東區東安路62號  違規停車",東安路62號,22.9923742,120.2264815
UN201702130384,"2017-02-13 10:35:00",安南區,違規停車,違規停車,"安南區長和路二段75號 違規停車",臺南市安南區長和路二段75號,23.063867,120.222304
UN201702130388,"2017-02-13 10:45:00",仁德區,違規停車,違規停車,"仁德區中正路二段1050號 違規停車",臺南市仁德區中正路二段1050號,22.967952,120.252889
UN201702130399,"2017-02-13 11:08:00",安平區,交通運輸,佔用道路,"安平區建平七街726號 佔用人行道",臺南市安平區建平七街726號,22.990205,120.168896
UN201702130406,"2017-02-13 11:18:00",安南區,違規停車,違規停車,"安南區長和路二段75號 違停",臺南市安南區長和路二段75號,23.063867,120.222304
UN201702130409,"2017-02-13 11:15:00",中西區,違規停車,違規停車,"中西區城隍街33號 違停",中西區城隍街33號,22.9898559,120.2082159
UN201702130418,"2017-02-13 11:28:00",麻豆區,髒亂及汙染,空氣汙染,"麻豆區安正里3-1號 空氣汙染",臺南市麻豆區安正里3-1號,23.16749,120.225066
UN201702130420,"2017-02-13 11:35:00",中西區,違規停車,違規停車,"中西區大同路一段142/144號    違停",中西區大同路一段142/144號,22.9843854,120.2109582
UN201702130441,"2017-02-13 12:20:00",永康區,違規停車,違規停車,"永康區正義街和正強街口  違規停車",710台灣台南市永康區正義街和正強街口,23.0265392,120.2518588
UN201702130447,"2017-02-13 12:26:00",中西區,騎樓舉發,騎樓舉發,"中西區中山路93號 騎樓舉發",中西區中山路93號,22.99438,120.207449
UN201702130453,"2017-02-13 13:07:00",中西區,違規停車,違規停車,中西區民族路二段2號、68號、65號違規停車,中西區民族路二段2號,22.9946526,120.2115926
UN201702130461,"2017-02-13 13:16:00",安南區,噪音舉發,妨害安寧,"北安路二段加油站（安南區北安路二段363號）  警報器聲響妨礙安寧",安南區北安路二段363號,23.0352649,120.2032008
UN201702130505,"2017-02-13 15:09:00",永康區,騎樓舉發,騎樓舉發,"永康區小東路513號 騎樓舉發",永康區小東路513號,22.9987661,120.236238
UN201702130506,"2017-02-13 15:12:00",東區,道路維修,路面坑洞,"東區仁和路162號旁，快車道中間 路面坑洞",臺南市東區仁和路162號,22.969638,120.233978
UN201702130513,"2017-02-13 15:26:00",安平區,交通運輸,佔用道路,"安平區運河路13巷11號 佔用道路",安平區運河路13巷11號,22.9989167,120.1630087
UN201702130515,"2017-02-13 15:33:00",東區,路燈故障,9盞以下路燈故障,"東區大同路一段69號 路燈故障",臺南市東區大同路一段69號,22.987191,120.211523
UN201702130527,"2017-02-13 16:19:00",南區,違規停車,違規停車,"南區文南路沿線兩側 違規停車",文南路,22.9849416,120.1899994
UN201702130529,"2017-02-13 16:19:00",東區,違規停車,違規停車,"東區裕農路 違規停車",裕農路,22.9886368,120.2364571
UN201702130559,"2017-02-13 17:20:00",中西區,違規停車,違規停車,"中西區民族路二段76/95號 違規停車",臺南市民族路二段76號,22.994726,120.20925
UN201702130575,"2017-02-13 18:02:00",東區,違規停車,違規停車,東區東門路二段360號違規停車,701台南市東區東門路二段360號,22.9825438,120.2271517
UN201702130580,"2017-02-13 18:18:00",中西區,違規停車,違規停車,"中西區青年路194號旁 違規停車",臺南市中西區青年路194號,22.991579,120.21043
UN201702130583,"2017-02-13 18:10:00",永康區,髒亂及汙染,空氣汙染,永康區王行路866巷7弄7號空汙,臺南市永康區王行路866巷7弄7號,23.049933,120.276772
UN201702130590,"2017-02-13 18:48:00",永康區,違規停車,違規停車,違規停車,臺南市永康區中華路619巷27號,23.014085,120.229007
UN201702130591,"2017-02-13 18:51:00",永康區,違規停車,違規停車,"永康區中華路619巷27號 違規停車",臺南市永康區中華路619巷27號,23.014085,120.229007
UN201702130592,"2017-02-13 18:51:00",中西區,違規停車,違規停車,"中西區和緯路5段122號 違規停車",台南市中西區和緯路5段122號,23.0055777,120.1833155
UN201702130593,"2017-02-13 19:10:00",東區,違規停車,違規停車,東區中華東路三段147號前違停,臺南市東區中華東路三段147號,22.977722,120.226687
UN201702130594,"2017-02-13 18:44:00",安平區,路燈故障,9盞以下路燈故障,安平區安平路606巷53弄50號和52號之間,臺南市安平區安平路606巷53弄50號,23.000714,120.168874
UN201702130598,"2017-02-13 19:32:00",南區,髒亂及汙染,空氣汙染,"南區明興路619巷360號斜對面墳墓旁巷內 空氣汙染",臺南市南區明興路619巷360號,22.940341,120.189715
UN201702130599,"2017-02-13 19:42:00","東 區",違規停車,違規停車,"東區大同路二段191號 違規停車",701台灣台南市東區大同路二段191號,22.97634749406327,120.21399959921838
UN201702130603,"2017-02-13 20:04:00",東區,違規停車,違規停車,"東區育樂街青年公園  違停",東區育樂街青年公園,22.9944054,120.2147769
UN201702130607,"2017-02-13 20:14:00",北區,違規停車,違規停車,"北區開元路370號前 違停",北區開元路370號前,23.0099649,120.2246269
UN201702130610,"2017-02-13 20:43:00",新市區,違規停車,違規停車,新市區中正路違規停車,新市區中正路,23.0747826,120.291444
UN201702130612,"2017-02-13 20:49:00",歸仁區,髒亂及汙染,道路散落物,"歸仁區中山路三段109號  道路散落物",臺南市歸仁區中山路三段109號,22.967622,120.285089
UN201702130613,"2017-02-13 20:54:00",安平區,違規停車,違規停車,安平區育平五街33-77號違規停車,安平區育平五街33-77號,22.9904243,120.1690777
UN201702130622,"2017-02-13 21:36:00",安平區,交通運輸,佔用道路,"安平區運河路13巷口 佔用道路",安平區運河路13巷口,22.998875,120.1627486
UN201702130627,"2017-02-13 23:32:00",永康區,噪音舉發,場所連續噪音,"永康區仁愛街62號   場所連續噪音",臺南市永康區仁愛街62號,23.044004,120.239109
UN201702140635,"2017-02-14 00:29:00",北區,噪音舉發,妨害安寧,"北區大興街325巷  妨害安寧",北區大興街325巷,23.0097562,120.1865021
UN201702140637,"2017-02-14 01:15:00",仁德區,噪音舉發,場所連續噪音,"仁德區保仁路295巷17號 場所連續噪音",臺南市仁德區保仁路295巷17號,22.959835,120.217869
UN201702140638,"2017-02-14 01:19:00",北區,噪音舉發,妨害安寧,"北區實踐街36號 妨害安寧",臺南市北區實踐街36號,23.0141,120.217846
UN201702140639,"2017-02-14 01:26:00",仁德區,噪音舉發,場所連續噪音,噪音舉發,臺南市仁德區仁愛里保仁路295巷17號,22.9598999,120.2230524
UN201702140640,"2017-02-14 02:18:00",安南區,交通運輸,號誌故障,"安南區府安路六段跟宜居路 號誌燈傾斜","安南區府安路六段  宜居路",23.0169396,120.1866057
UN201702140641,"2017-02-14 03:46:00",北區,噪音舉發,場所連續噪音,北區北園街80巷7號噪音舉發,704台灣台南市北區北園街80巷7號,23.0122613,120.2235498
UN201702140644,"2017-02-14 06:06:00",北區,噪音舉發,妨害安寧,"北區東興路二段59號 狗吠噪音",臺南市北區東興路二段59號,23.001156,120.228279
UN201702140647,"2017-02-14 07:18:00",中西區,違規停車,違規停車,"中西區健康路一段300號至320號 違規停車",臺南市健康路一段300號,22.98149,120.202989
UN201702140649,"2017-02-14 07:24:00",中西區,違規停車,違規停車,"中西區民生路二段330號 違規停車",台南市中西區民生路二段330號,22.9974628,120.1901902
UN201702140650,"2017-02-14 07:24:00",新市區,違規停車,違規停車,"新市區中華路16號  違規停車",744台灣台南市新市區中華路16號,23.067881810318269,120.29045068670098
UN201702140651,"2017-02-14 07:30:00",永康區,噪音舉發,妨害安寧,"永康區永大一路241號對面 妨害安寧",永康區永大一路241號,23.0165426,120.2554544
UN201702140653,"2017-02-14 07:35:00",南區,違規停車,違規停車,"南區健康路一段395號 違規停車",健康路一段395號,22.981165,120.199279
UN201702140654,"2017-02-14 07:43:00",北區,違規停車,違規停車,"北區公園路589號 違停",臺南市北區公園路589號,23.011407,120.210957
UN201702140656,"2017-02-14 07:52:00",安南區,噪音舉發,妨害安寧,"安南區安豐四街20號 妨害安寧",台南市安南區安豐四街20號,23.0475077,120.2138468
UN201702140664,"2017-02-14 08:19:00",中西區,噪音舉發,妨害安寧,"中西區法華街115號 妨害安寧",中西區法華街115號,22.983218,120.2092809
UN201702140669,"2017-02-14 08:39:00",中西區,違規停車,違規停車,"中西區健康路一段312號 違規停車",臺南市中西區健康路一段312號,22.98151,120.202721
UN201702140683,"2017-02-14 09:12:00",新營區,髒亂及汙染,空氣汙染,新營區八德路3號,臺南市新營區八德路3號,23.30333,120.28538
UN201702140699,"2017-02-14 09:37:00",中西區,違規停車,違規停車,"中西區開山路76號至86號/開山路75號及77號及85號 違規停車",臺南市開山路76號,22.990099,120.206607
UN201702140701,"2017-02-14 09:42:00",中西區,違規停車,違規停車,"中西區北門路一段123巷36號 違規停車",臺南市北門路一段123巷36號,22.995418,120.210696
UN201702140707,"2017-02-14 10:02:00",中西區,違規停車,違規停車,"中西區民權路一段239號到253號藥局外面  違規停車",臺南市中西區民權路一段239號,22.992667,120.207121
UN201702140709,"2017-02-14 10:07:00",中西區,違規停車,違規停車,"中西區開山路2號到12號  違規停車",臺南市中西區開山路2號,22.992011,120.205449
UN201702140711,"2017-02-14 10:10:00",安南區,違規停車,違規停車,"安南區海佃路四段388巷59號 違規停車",臺南市安南區海佃路四段388巷59號,23.064829,120.176105
UN201702140737,"2017-02-14 10:50:00",東區,民生管線,電信孔蓋鬆動、電信線路掉落、電信桿傾倒,"東區裕農一街171號旁 中華電信孔蓋聲響",臺南市東區裕農一街171號,22.984113,120.238556
UN201702140740,"2017-02-14 10:53:00",中西區,民生管線,漏水、停水、消防栓漏水或損壞,"中西區西門路二段151號 漏水",臺南市中西區西門路二段151號,22.993247,120.198596
UN201702140744,"2017-02-14 11:03:00",佳里區,髒亂及汙染,空氣汙染,"佳里區六安里126之6號 空氣汙染",臺南市佳里區六安里126之6號,23.168691,120.179689
UN201702140751,"2017-02-14 11:27:00",中西區,違規停車,違規停車,中西區民權路一段150號違規停車,臺南市中西區民權路一段150號,22.991116,120.208576
UN201702140752,"2017-02-14 11:28:00",中西區,違規停車,違規停車,中西區衛民街149號違規停車,臺南市中西區衛民街149號,22.993452,120.207148
UN201702140754,"2017-02-14 11:30:00",中西區,違規停車,違規停車,中西區民生路一段2號違規停車,臺南市中西區民生路一段2號,22.992912,120.204543
UN201702140755,"2017-02-14 11:31:00",仁德區,違規停車,違規停車,"仁德區中正路二段仁義路 違規停車",仁德區中正路二段仁義路,22.9680957,120.2526666
UN201702140769,"2017-02-14 11:49:00",北區,違規停車,違規停車,北區成功路18號違規停車,臺南市北區成功路18號,22.997853,120.209053
UN201702140770,"2017-02-14 11:51:00",仁德區,髒亂及汙染,市區道路路面油漬,"仁德區二行一路18號  路面油漬",仁德區二行一路18號,22.9167458,120.2240969
UN201702140779,"2017-02-14 12:15:00",中西區,違規停車,違規停車,"中西區民生路二段95號（名東）周邊 違規停車",臺南市民生路二段95號,22.995084,120.196784
UN201702140781,"2017-02-14 12:15:00",新化區,違規停車,違規停車,"新化區中興路和護安街口 違規停車",台南巿新化區中興路護安街,23.0345339,120.3095657
UN201702140782,"2017-02-14 12:17:00",中西區,違規停車,違規停車,"中西區民生路8號附近，莎士比亞外面 佔用停車格",臺南市民生路8號,22.992954,120.204464
UN201702140783,"2017-02-14 12:18:00",中西區,違規停車,違規停車,中西區民生路1號（靠近民生綠園圓環），違規停車,臺南市民生路1號,22.99438,120.198978
UN201702140784,"2017-02-14 12:21:00",安平區,違規停車,違規停車,"安平區安平路370號側邊人行道上 違規停車",安平區安平路370號,22.9983243,120.176134
UN201702140789,"2017-02-14 12:54:00",中西區,違規停車,違規停車,"中西區衛民街56號 違規停車",臺南市衛民街56號,22.992987,120.210528
UN201702140793,"2017-02-14 13:12:00",新市區,違規停車,違規停車,"新市區中正路丹丹漢堡和全聯  違規停車",新市區中正路,23.0747826,120.291444
UN201702140800,"2017-02-14 13:39:00",東區,騎樓舉發,騎樓舉發,"東區生產路289號  騎樓舉發",東區生產路289號,22.965208,120.229251
UN201702140816,"2017-02-14 14:20:00",仁德區,違規停車,違規停車,"仁德區中正路二段1052號 違規停車",台南市仁德區中正路二段1052號,22.9681135,120.2527434
UN201702140831,"2017-02-14 14:59:00",新營區,髒亂及汙染,空氣汙染,"新營區長榮路二段961號  空氣汙染",新營區長榮路二段961號,23.3125962,120.2990114
UN201702140836,"2017-02-14 15:12:00",北區,違規停車,違規停車,"北區和緯路二段221號  違停",北區和緯路二段221號,23.0122297,120.2054569
UN201702140842,"2017-02-14 15:22:00",中西區,違規停車,違規停車,"中西區北門路一段123巷36號 違規停車",臺南市中西區北門路一段123巷36號,22.995418,120.210696
UN201702140856,"2017-02-14 15:59:00",東區,違規停車,違規停車,"東區東安路289號  違規停車",臺南市東區東安路289號,22.997495,120.227132
UN201702140859,"2017-02-14 16:08:00",永康區,噪音舉發,妨害安寧,"永康區永華路201巷 妨害安寧",永康區永華路201巷,23.0103828,120.2590425
UN201702140862,"2017-02-14 16:00:00",善化區,動物救援,犬貓急難救援,"善化區溪美里591號 動物救援",臺南市善化區溪美里591號,23.150923,120.287581
UN201702140867,"2017-02-14 16:17:00",歸仁區,民生管線,停電、漏電、電線掉落、孔蓋鬆動,"歸仁區和順路一段1號 台電電覽掉落",臺南市歸仁區和順路一段1號,22.993201,120.293394
UN201702140869,"2017-02-14 16:26:00",新營區,違規停車,違規停車,"新營區中正路35巷  違規停車",新營區中正路35巷,23.3127664,120.3147106
UN201702140872,"2017-02-14 16:30:00",北區,交通運輸,佔用道路,"北區開元路366號  佔用道路",臺南市北區開元路366號,23.009901,120.224614
UN201702140874,"2017-02-14 16:36:00",仁德區,違規停車,違規停車,"仁德區二行一路183號對向車道 違規停車",臺南市二行一路183號,22.919875,120.225087
UN201702140879,"2017-02-14 16:45:00",新營區,違規停車,違規停車,"新營區同濟街/義和街口  義和街上  違規停車",新營區同濟街義和街,23.3125194,120.3198696
UN201702140883,"2017-02-14 16:54:00",永康區,騎樓舉發,騎樓舉發,"永康區小東路513號 騎樓舉發",臺南市永康區小東路513號,22.998719,120.236233
UN201702140886,"2017-02-14 17:01:00",南區,違規停車,違規停車,"南區大同路二段283號 違規停車",臺南市南區大同路二段283號,22.976467,120.213623
UN201702140888,"2017-02-14 17:02:00",中西區,違規停車,違規停車,"中西區單行道廣慈街027停車格 違規停車",700台灣台南市中西區廣慈街,22.996341181791170,120.20676649895017
UN201702140889,"2017-02-14 17:02:00",中西區,違規停車,違規停車,"中西區北門路一段123巷36號 違規停車",臺南市北門路一段123巷36號,22.995418,120.210696
UN201702140893,"2017-02-14 17:09:00",中西區,,人孔蓋聲響、凹陷、漏水,"中西區大同路一段22巷45號 汙水孔蓋鬆動",臺南市中西區大同路一段22巷45號,22.988266,120.210405
UN201702140896,"2017-02-14 17:19:00",北區,道路維修,路面坑洞,"北區臨安路二段50巷37號 路面坑洞",臺南市北區臨安路二段50巷37號,23.002091,120.197649
UN201702140897,"2017-02-14 17:22:00",永康區,違規停車,違規停車,"永康區新行街70號 違規停車",臺南市永康區新行街70號,23.039801,120.24193
UN201702140898,"2017-02-14 17:23:00",中西區,違規停車,違規停車,"中西區西華南街38號 違規停車",臺南市西華南街38號,22.993886,120.209524
UN201702140899,"2017-02-14 17:25:00",中西區,違規停車,違規停車,"中西區民族路二段42號 違規停車",臺南市民族路二段42號,22.994585,120.210894
UN201702140900,"2017-02-14 17:33:00",永康區,髒亂及汙染,空氣汙染,"永康區王行路866巷7弄7號 空氣汙染",永康區王行路866巷7弄7號,23.0493501,120.2777503
UN201702140904,"2017-02-14 17:51:00",中西區,違規停車,違規停車,700台灣台南市中西區南門路257號違規停車,700台灣台南市中西區南門路257號,22.981680783923956,120.20384207379084
UN201702140905,"2017-02-14 17:53:00",中西區,路燈故障,9盞以下路燈故障,"中西區慶中街126號旁 路燈不亮",臺南市中西區慶中街126號,22.983759,120.205966
UN201702140911,"2017-02-14 18:13:00",東區,違規停車,違規停車,"台南市東區崇德四街7巷12-14號 違規停車",臺南市東區崇德四街7巷12-14號,22.97763,120.225032
UN201702140918,"2017-02-14 18:33:00",永康區,路燈故障,10盞以上路燈故障,"永康區南工街120號附近，南工街和中華二路整條 路燈不亮",臺南市永康區南工街120號,23.011586,120.240094
UN201702140924,"2017-02-14 17:30:00",安南區,違規停車,違規停車,"安南區海佃路一段284巷52號 違規停車",臺南市安南區海佃路一段284巷52號,23.026643,120.193069
UN201702140930,"2017-02-14 19:07:00",永康區,路燈故障,9盞以下路燈故障,"永康區永大路三段302號 路燈故障",臺南市永康區永大路三段302號,23.031699,120.260131
UN201702140931,"2017-02-14 19:14:00",中西區,路燈故障,9盞以下路燈故障,"中西區湖美街113巷25號 路燈故障",臺南市中西區湖美街113巷25號,23.001943,120.179115
UN201702140940,"2017-02-14 20:01:00",南區,路燈故障,9盞以下路燈故障,"南區新孝路127巷11號前 路燈不亮",臺南市南區新孝路127巷11號,22.980633,120.185987
UN201702140949,"2017-02-14 20:48:00",北區,違規停車,違規停車,"北區長榮路五段20號 違停",臺南市北區長榮路五段20號,23.009059,120.220785
UN201702140950,"2017-02-14 20:54:00",新市區,違規停車,違規停車,新市區中正路違規停車,新市區中正路,23.0747826,120.291444
UN201702140952,"2017-02-14 21:03:00",東區,違規停車,違規停車,"區東門路二段158巷36號 違規停車",臺南市東區東門路二段158巷36號,22.984889,120.220374
UN201702140954,"2017-02-14 21:11:00",白河區,髒亂及汙染,空氣汙染,"白河區蓮潭里42號 空氣汙染",臺南市白河區蓮潭里42號,23.400251,120.399806
UN201702140959,"2017-02-14 21:54:00",永康區,違規停車,違規停車,"永康區新行街70號 違規停車",臺南市永康區新行街70號,23.039801,120.24193
UN201702140963,"2017-02-14 22:38:00",中西區,噪音舉發,場所連續噪音,"中西區五妃街309巷3號後方 馬達噪音",臺南市中西區五妃街309巷3號,22.98234,120.199413
UN201702140966,"2017-02-14 23:32:00",中西區,違規停車,違規停車,中西區民族路二段76號違規停車,臺南市民族路二段76號,22.994726,120.20925
UN201702140970,"2017-02-14 23:53:00",仁德區,違規停車,違規停車,"仁德區保華路279號 違停",仁德區保華路279號,22.9592479,120.2253997
UN201702150002,"2017-02-15 00:44:00",北區,噪音舉發,妨害安寧,"北區實踐街36號 妨害安寧",臺南市北區實踐街36號,23.0141,120.217846
UN201702150003,"2017-02-15 00:47:00",安南區,噪音舉發,場所連續噪音,"安南區郡安路五段 場所連續噪音",安南區郡安路五段,23.0290379,120.1974869
UN201702150004,"2017-02-15 00:54:00",中西區,路燈故障,9盞以下路燈故障,"中西區府前路一段290號 路燈故障不亮",臺南市中西區府前路一段290號,22.990223,120.19942
UN201702150008,"2017-02-15 01:27:00",中西區,噪音舉發,妨害安寧,"中西區金華新路43號3樓  妨害安寧",臺南市中西區金華新路43號,22.993256,120.19278
UN201702150010,"2017-02-15 03:44:00",中西區,噪音舉發,妨害安寧,"中西區開山路2號 妨害安寧",中西區開山路2號,22.9911491,120.206339
UN201702150012,"2017-02-15 04:35:00",中西區,噪音舉發,場所連續噪音,"中西區湯德章紀念公園 場所連續噪音",中西區湯德章紀念公園,22.9930877,120.204329
UN201702150017,"2017-02-15 07:04:00",善化區,噪音舉發,妨害安寧,"善化區小新營33號附近  妨害安寧",臺南市善化區小新營33號,23.126118,120.31441
UN201702150019,"2017-02-15 07:12:00",安平區,違規停車,違規停車,"安平區安平路446巷與安平路446巷25弄交叉口  違規停車",安平區安平路446巷安平路446巷25弄,22.99802,120.1735638
UN201702150022,"2017-02-15 07:19:00",東區,違規停車,違規停車,"東區中華東路三段377巷  違規停車",701台灣台南市東區中華東路三段377巷10號,22.972701350440868,120.22169674180304
UN201702150025,"2017-02-15 07:35:00",中西區,騎樓舉發,騎樓舉發,"中西區健康路一段316號326號   騎樓舉發",臺南市中西區健康路一段316號,22.981502,120.202613
UN201702150034,"2017-02-15 08:22:00",中西區,違規停車,違規停車,"中西區健康路一段316號及326號 違規停車",健康路一段316號,22.9816025,120.2026457
UN201702150040,"2017-02-15 08:34:00",北區,噪音舉發,妨害安寧,"北區北門路二段132號對面公園  妨害安寧",臺南市北區北門路二段132號,23.003255,120.213528
UN201702150042,"2017-02-15 08:34:00",西港區,動物救援,犬貓急難救援,"西港區檨仔林20之60號前 貓急難救援",臺南市西港區檨仔林20之60號,23.135521,120.234026
UN201702150044,"2017-02-15 08:38:00",永康區,違規停車,違規停車,"永康區中華西街127巷30弄12號 違規停車",台南市永康區中華西街127巷30弄12號,23.015028,120.224724
UN201702150045,"2017-02-15 08:39:00",六甲區,髒亂及汙染,道路散落物,"六甲區林鳳營陸橋往西的上坡路段  道路散落物",六甲區林鳳營陸橋,23.2384115,120.3207711
UN201702150047,"2017-02-15 08:43:00",新營區,髒亂及汙染,空氣汙染,"新營區民生路465號 空氣汙染",臺南市新營區民生路465號,23.314873,120.303258
UN201702150054,"2017-02-15 08:56:00",中西區,違規停車,違規停車,"中西區民族路二段63號 違規停車",民族路二段63號,22.9943593,120.209799
UN201702150092,"2017-02-15 09:59:00",北區,髒亂及汙染,空氣汙染,"北區開元路308號及310號 空氣汙染",臺南市北區開元路308號,23.009016,120.223367
UN201702150094,"2017-02-15 10:12:00",白河區,動物救援,犬貓急難救援,"白河區新起街31之8號 犬貓救援",臺南市白河區新起街31之8號,23.348845,120.416347
