UN201702150105,"2017-02-15 10:40:00",中西區,違規停車,違規停車,"中西區華平路780號 違規停車",臺南市華平路780號,22.999902,120.175971
UN201702150111,"2017-02-15 10:51:00",中西區,違規停車,違規停車,"中西區開山路 違規停車",臺南市開山路86號,22.989882,120.206811
UN201702150119,"2017-02-15 11:03:00",歸仁區,違規停車,違規停車,"歸仁區歸仁大道100號 違停",臺南市歸仁區歸仁大道100號,22.924522,120.285509
UN201702150123,"2017-02-15 11:16:00",中西區,違規停車,違規停車,"中西區友愛東街42號 違規停車",臺南市友愛東街42號,22.991203,120.206231
UN201702150126,"2017-02-15 11:18:00",中西區,違規停車,違規停車,"中西區開山路86號以及周邊 違規停車",臺南市中西區開山路86號,22.989882,120.206811
UN201702150129,"2017-02-15 11:21:00",中西區,違規停車,違規停車,"中西區府前路一段278號 違規停車",臺南市中西區府前路一段278號,22.990177,120.199756
UN201702150132,"2017-02-15 11:25:00",中西區,違規停車,違規停車,中西區府前路一段121號違規停車,臺南市中西區府前路一段121號,22.988832,120.208431
UN201702150133,"2017-02-15 11:27:00",中西區,違規停車,違規停車,"中西區南門路121號 違規停車",中西區南門路121號,22.9870964,120.2044573
UN201702150136,"2017-02-15 11:30:00",中西區,違規停車,違規停車,"中西區南寧街46號68號 違規停車",臺南市中西區南寧街46號,22.984956,120.203574
UN201702150139,"2017-02-15 11:35:00",中西區,違規停車,違規停車,"中西區忠義路一段39號 違規停車",中西區忠義路一段39號,22.98585,120.201707
UN201702150141,"2017-02-15 11:35:00",麻豆區,交通運輸,佔用道路,"麻豆區新生南路6號 佔用道路",麻豆區新生南路6號,23.1846445,120.2411472
UN201702150142,"2017-02-15 11:40:00",中西區,違規停車,違規停車,"中西區民生路一 段6號到62號 違規停車","臺南市中西區民生路一 段6號",22.992937,120.204494
UN201702150143,"2017-02-15 10:56:00",中西區,違規停車,違規停車,"中西區南門路225號 違規停車",中西區南門路225號,22.9842561,120.2041049
UN201702150148,"2017-02-15 11:36:00",仁德區,道路維修,路面下陷、凹陷,"仁德區虎山一街100號 道路維修",臺南市仁德區虎山一街100號,22.945296,120.230314
UN201702150153,"2017-02-15 12:12:00",新營區,交通運輸,佔用道路,"新營區和平路32巷7-3號 佔用道路",臺南市新營區和平路32巷7-3號,23.300975,120.309344
UN201702150154,"2017-02-15 12:18:00",中西區,違規停車,違規停車,"中西區忠義路一段39號 違規停車",忠義路一段39號,22.98585,120.201707
UN201702150157,"2017-02-15 12:33:00",關廟區,噪音舉發,妨害安寧,"關廟區東興二街32號 妨害安寧",臺南市關廟區東興二街32號,22.955564,120.33015
UN201702150161,"2017-02-15 12:47:00",東區,違規停車,違規停車,"東區東寧路542號 違規停車",臺南市東寧路542號,22.988769,120.231545
UN201702150163,"2017-02-15 12:49:00",中西區,違規停車,違規停車,"中西區民族路二段61號旁 違規停車",臺南市民族路二段61號,22.994306,120.209916
UN201702150164,"2017-02-15 12:49:00",中西區,違規停車,違規停車,"中西區民權路一段153號 違規停車",臺南市民權路一段153號,22.990848,120.20815
UN201702150170,"2017-02-15 11:58:00",安南區,髒亂及汙染,大型廢棄物清運,"安南區城南路366巷1號 大型廢棄物清運",臺南市安南區城南路366巷1號,23.057435,120.124296
UN201702150176,"2017-02-15 13:07:00",學甲區,路燈故障,9盞以下路燈故障,"學甲區中山路76巷18號  路燈故障",臺南市學甲區中山路76巷18號,23.234936,120.182296
UN201702150186,"2017-02-15 13:30:00",安南區,違規停車,違規停車,"安南區海佃路一段410號 違規停車",安南區海佃路一段410號,23.0285883,120.1908049
UN201702150191,"2017-02-15 13:42:00",中西區,違規停車,違規停車,"中西區衛民街32號無比髪廊於50號依美琦中間   違規停車",臺南市中西區衛民街32號,22.992918,120.211
UN201702150197,"2017-02-15 14:09:00",永康區,路燈故障,9盞以下路燈故障,"永康區新民街47巷1號前 路燈不亮",臺南市永康區新民街47巷1號,23.040171,120.242511
UN201702150202,"2017-02-15 14:20:00",永康區,髒亂及汙染,空氣汙染,"永康區勝華街140巷3號對面 空氣汙染/連續噪音",臺南市永康區勝華街140巷3號,23.006783,120.231497
UN201702150204,"2017-02-15 14:23:00",歸仁區,交通運輸,佔用道路,"歸仁區民生北街52號 佔用道路",臺南市歸仁區民生北街52號,22.969436,120.281009
UN201702150214,"2017-02-15 14:42:00",北區,噪音舉發,場所連續噪音,"北區正覺街120號前面的榕樹下  噪音/妨害安寧",北區正覺街120號,23.0182821,120.2131134
UN201702150215,"2017-02-15 14:42:00",中西區,違規停車,違規停車,"中西區衛民街50號 違規停車",中西區衛民街50號,22.9930424,120.2106709
UN201702150216,"2017-02-15 14:43:00",中西區,違規停車,違規停車,"中西區衛民街65號   違規停車",衛民街65號,22.9927506,120.210421
UN201702150217,"2017-02-15 14:44:00",中西區,違規停車,違規停車,"中西區民族路二段71號  違規停車",臺南市民族路二段71號,22.994351,120.209457
UN201702150218,"2017-02-15 14:45:00",中西區,違規停車,違規停車,"中西區民族路二段200號至327號 違規停車",民族路二段200號,22.9967402,120.2031821
UN201702150220,"2017-02-15 14:48:00",中西區,違規停車,違規停車,"中西區西門路二段330號 違規停車",臺南市西門路二段330號,22.997666,120.200659
UN201702150240,"2017-02-15 15:43:00",東區,道路維修,人孔蓋凹陷坑洞,"東區東安路48巷 道路維修",東安路48巷,22.991931,120.2268481
UN201702150252,"2017-02-15 16:05:00",中西區,違規停車,違規停車,"中西區中正路240號 違規停車",701台灣台南中西區中正路240號,22.997166486060006,120.21296594291925
UN201702150253,"2017-02-15 16:07:00",東區,違規停車,違規停車,"東區崇德路452號 違規停車",台南市東區崇德路452號,22.9747314,120.2263228
UN201702150257,"2017-02-15 16:18:00",東區,違規停車,違規停車,"東區中華東路三段377巷 違規停車",701台灣台南市東區中華東路三段377巷底巴克禮公園,22.972521762811084,120.22210672222900
UN201702150263,"2017-02-15 16:33:00",中西區,違規停車,違規停車,"中西區中正路240號 違規停車",臺南市中西區中正路240號,22.993305,120.196756
UN201702150265,"2017-02-15 16:43:00",中西區,違規停車,違規停車,"中西區中正路240號 違規停車",700台灣台南市中正路240號,22.993236645872802,120.19620012491941
UN201702150272,"2017-02-15 16:56:00",安南區,噪音舉發,妨害安寧,"安南區公學路四段126巷128弄8號  妨礙安寧",臺南市公學路四段126巷128弄8號,23.067164,120.172847
UN201702150273,"2017-02-15 16:58:00",中西區,違規停車,違規停車,"中西區中正路240號 違規停車",704台灣台南市中西區中正路240號,23.002067746620114,120.19951835274695
UN201702150276,"2017-02-15 17:06:00",中西區,違規停車,違規停車,"中西區健康路一段312號 違規停車",臺南市健康路一段312號,22.98151,120.202721
UN201702150277,"2017-02-15 17:08:00",中西區,違規停車,違規停車,"中西區健康路一段320號 違規停車",臺南市健康路一段320號,22.981569,120.202519
UN201702150278,"2017-02-15 17:14:00",中西區,違規停車,違規停車,"中西區民族路二段76/95號 違規停車","臺南市民族 路二段76號",22.994726,120.20925
UN201702150279,"2017-02-15 17:16:00",中西區,違規停車,違規停車,"中西區西華南街42-58號 違規停車",臺南市西華南街42-58號,22.993942,120.20955
UN201702150280,"2017-02-15 17:23:00",中西區,違規停車,違規停車,"中西區民族路二段26號 違規停車",民族路二段26號,22.9947788,120.2108977
UN201702150289,"2017-02-15 17:46:00",永康區,髒亂及汙染,空氣汙染,"永康區正南一街200號 空氣汙染",臺南市正南一街200號,23.027979,120.225189
UN201702150291,"2017-02-15 17:50:00",東區,民生管線,停電、漏電、電線掉落、孔蓋鬆動,"東區自由路三段187號 孔蓋鬆動",臺南市東區自由路三段187號,22.981893,120.237079
UN201702150292,"2017-02-15 17:50:00",永康區,違規停車,違規停車,"永康區正義街 違規停車",台南市永康區正義街,23.0282061,120.2537068
UN201702150299,"2017-02-15 18:06:00",新市區,違規停車,違規停車,"新市區中正路 違規停車",新市區中正路,23.0747826,120.291444
UN201702150303,"2017-02-15 18:17:00",中西區,違規停車,違規停車,"中西區南華街20號 違規停車",中西區南華街20號,22.9889592,120.1915821
UN201702150310,"2017-02-15 18:42:00",中西區,違規停車,違規停車,"中西區中山路2號到48號 違規停車",臺南市中西區中山路2號,22.992715,120.205643
UN201702150311,"2017-02-15 18:42:00",東區,違規停車,違規停車,"崇德路與崇明三街路口，於監理站側 違規停車",東區崇明三街,22.981187936261492,120.21785657539363
UN201702150314,"2017-02-15 18:45:00",東區,路燈故障,10盞以上路燈故障,"東區崇德路1號 路燈故障",東區崇德路1號,22.9813179,120.2181499
UN201702150315,"2017-02-15 18:46:00",佳里區,違規停車,違規停車,"佳里區中山路447號 違規停車",佳里區中山路447號,23.165767296797345,120.17802422239163
UN201702150322,"2017-02-15 19:15:00",東區,違規停車,違規停車,"東區裕學路185巷105號 違規停車",臺南市東區裕學路185巷105號,22.983183,120.236491
UN201702150324,"2017-02-15 19:22:00",佳里區,違規停車,違規停車,"佳里區忠孝東路59-77號  違規停車",722台灣台南市佳里區忠孝東路59-77號,23.164981166263313,120.17917285026238
UN201702150326,"2017-02-15 19:28:00",南區,違規停車,違規停車,"南區夏林路224號 違規停車",臺南市南區夏林路224號,22.979266,120.194859
UN201702150328,"2017-02-15 19:30:00",東區,路燈故障,9盞以下路燈故障,"東區立德十路16號 路燈故障",臺南市東區立德十路16號,22.977711,120.214333
UN201702150329,"2017-02-15 18:45:00",北區,動物救援,遊蕩犬隻捕捉管制,"北區大興街64號 動物救援",臺南市北區大興街64號,23.01171,120.192276
UN201702150331,"2017-02-15 19:39:00",永康區,違規停車,違規停車,"永康區中山南路246號 違規停車",永康區中山南路246號,23.0143151,120.2339342
UN201702150334,"2017-02-15 19:47:00",永康區,違規停車,違規停車,"永康區忠孝路410巷70弄36號 違規停車",臺南市永康區忠孝路410巷70弄36號,23.017753,120.245325
UN201702150341,"2017-02-15 20:27:00",安平區,髒亂及汙染,空氣汙染,"安平區永華路二段819號大世紀 髒亂及汙染",臺南市安平區永華路二段819號,22.990885,120.168528
