UN201703270002,"2017-03-27 00:10:00",東區,噪音舉發,妨害安寧,"東區中華東路一段207巷巷口 妨礙安寧",東區中華東路一段207巷,22.9902863,120.2344404
UN201703270006,"2017-03-27 02:10:00","東 區",噪音舉發,妨害安寧,701台灣台南市東區長榮路二段32巷142號妨礙安寧,701台灣台南市東區長榮路二段32巷142號,22.987711281682596,120.22146351635458
UN201703270019,"2017-03-27 08:05:00",南區,交通運輸,佔用道路,"南區大成路二段155號 佔用道路",臺南市南區大成路二段155號,22.974809,120.193295
UN201703270020,"2017-03-27 06:59:00",永康區,髒亂及汙染,其他汙染舉發,"永康區中正路155巷17弄1號 髒亂及汙染",臺南市永康區中正路155巷17弄1號,23.030298,120.251023
UN201703270022,"2017-03-27 08:11:00",永康區,噪音舉發,妨害安寧,"永康區永大路二段1080號 妨害安寧",永大路二段1080號,23.0183999,120.2627109
UN201703270024,"2017-03-27 08:17:00",東區,交通運輸,佔用道路,"東區裕義路288號 佔用道路",東區裕義路288號,22.9833053,120.2478655
UN201703270034,"2017-03-27 08:51:00",安南區,交通運輸,佔用道路,"安南區安中路一段703巷70號 佔用道路",安南區安中路一段703巷70號,23.040606,120.193136
UN201703270048,"2017-03-27 08:15:00",中西區,路燈故障,9盞以下路燈故障,"中西區金華路三段176號 路燈故障",臺南市中西區金華路三段176號,22.993406,120.193476
UN201703270055,"2017-03-27 09:30:00",安平區,民生管線,漏水、停水、消防栓漏水或損壞,"安平區中華西路二段49巷46號 消防栓漏水",臺南市安平區中華西路二段49巷46號,22.987713,120.18538
UN201703270074,"2017-03-27 09:59:00",北區,騎樓舉發,騎樓舉發,"北區小東路281號 騎樓舉發",臺南市北區小東路281號,22.999776,120.229067
UN201703270089,"2017-03-27 10:30:00",新營區,噪音舉發,妨害安寧,"新營區民族路110號 妨害安寧",臺南市新營區民族路110號,23.31378,120.318863
UN201703270105,"2017-03-27 11:12:00",新市區,違規停車,違規停車,"新市區永就里59-3號旁轉角 違規停車",臺南市永就里59之3號,23.064107,120.294022
UN201703270107,"2017-03-27 11:16:00",中西區,違規停車,違規停車,"中西區開山路76、78、80、82-1、86號周邊及對面75、77、85號 違規停車",臺南市開山路86號,22.989882,120.206811
UN201703270111,"2017-03-27 11:23:00",後壁區,路燈故障,9盞以下路燈故障,"後壁區頂安里225號對面 路燈不亮",臺南市後壁區頂安里225號,23.342369,120.355063
UN201703270116,"2017-03-27 11:32:00",東區,騎樓舉發,騎樓舉發,"東區東榮街98號 騎樓舉發",臺南市台南市東榮街98號,22.988522,120.215082
UN201703270118,"2017-03-27 11:33:00",永康區,違規停車,違規停車,"小東路郵局前 紅線違停",臺南市永康區小東路481號,22.998675,120.235379
UN201703270121,"2017-03-27 11:43:00",新化區,違規停車,違規停車,"新化區中正路321號 違規停車",臺南市新化區中正路321號,23.033565,120.308432
UN201703270122,"2017-03-27 11:43:00",中西區,違規停車,違規停車,"中西區民族路二段63-57號及斜對面66號 違規停車",臺南市民族路二段63號,22.994306,120.209873
UN201703270124,"2017-03-27 11:46:00",東區,髒亂及汙染,空氣汙染,"東區崇德路56號 空氣汙染",臺南市東區崇德路56號,22.980949,120.217751
UN201703270136,"2017-03-27 12:08:00",中西區,違規停車,違規停車,"中西區民族路二段76號 違規停車","臺南市民族 路二段76號",22.994726,120.20925
UN201703270147,"2017-03-27 13:14:00",南區,違規停車,違規停車,"南區大成路西門路口 違規停車",大成路西門路,22.9749659,120.1976616
UN201703270148,"2017-03-27 13:11:00",北區,違規停車,違規停車,"北區文成五街290號，對面轉角處 紅線違停",臺南市北區文成五街290號,23.017786,120.200667
UN201703270153,"2017-03-27 13:43:00",中西區,違規停車,違規停車,"中西區大同路一段142號周遭 違規停車",臺南市中西區大同路一段142號,22.984273,120.211001
UN201703270167,"2017-03-27 14:02:00",中西區,違規停車,違規停車,"中西區西門路二段138號 違規停車",臺南市中西區西門路二段138號,22.993779,120.19908
UN201703270169,"2017-03-27 12:14:00",永康區,騎樓舉發,騎樓舉發,"永康區小東路513號 騎樓舉發",永康區小東路513號,22.9987661,120.236238
UN201703270180,"2017-03-27 14:06:00",南區,違規停車,違規停車,"南區大成路二段155號^171號 違規停車",臺南市南區大成路二段155號,22.974809,120.193295
UN201703270182,"2017-03-27 14:47:00",北區,騎樓舉發,騎樓舉發,"北區成功路2號 騎樓舉發",北區成功路2號,22.9976771,120.211063
UN201703270183,"2017-03-27 14:51:00",南區,違規停車,違規停車,"南區金華路二段195號 違規停車",台南市南區金華路二段195號,22.9821398,120.191343
UN201703270194,"2017-03-27 15:17:00",安南區,違規停車,違規停車,"安南區安中路四段4巷69弄23號 違規停車",臺南市安南區安中路四段4巷69弄23號,23.050294,120.172319
UN201703270197,"2017-03-27 15:25:00",北區,違規停車,違規停車,"北區北門路二段59號 違規停車",704台灣台南市北區北門路二段59號,22.9985982,120.2122786
UN201703270198,"2017-03-27 15:08:00",北區,道路維修,路面下陷、凹陷,"北區林森路三段245-1號  路面凹陷",北區林森路三段245-1號,23.0084177,120.2229679
UN201703270210,"2017-03-27 16:06:00",將軍區,噪音舉發,場所連續噪音,"將軍區保源里79之2號斜對面 噪音",臺南市將軍區保源里79之2號,23.218414,120.164815
UN201703270226,"2017-03-27 16:45:00",中西區,違規停車,違規停車,"中西區健康路一段32號 違規停車",台南市中西區健康路一段32號,22.9813651,120.2108272
UN201703270228,"2017-03-27 16:48:00",東區,違規停車,違規停車,"東區崇善路499號 違規停車",東區崇善路499號,22.9747418,120.2292506
UN201703270232,"2017-03-27 16:52:00",永康區,噪音舉發,場所連續噪音,"永康區永大一路241號對面 機械噪音",臺南市永康區永大一路241號,23.016541,120.255448
UN201703270234,"2017-03-27 16:55:00",東區,路燈故障,9盞以下路燈故障,"東區裕信路292號 路燈故障",東區裕信路292號,22.9806519,120.2451239
UN201703270238,"2017-03-27 17:13:00",南區,違規停車,違規停車,"南區金華路一段154巷 違規停車",臺南市南區金華路一段154巷,22.965048,120.1905959
UN201703270240,"2017-03-27 17:03:00",新營區,髒亂及汙染,空氣汙染,"新營區長榮路*新北街 附近  空汙","新營區長榮路*新北街 附近",23.3146192,120.3012488
UN201703270245,"2017-03-27 17:28:00",安南區,違規停車,違規停車,"安南區海佃路一段190號(爭鮮壽司旁)， 違規停車",台南市海佃路1段190號,23.0248323,120.1916752
UN201703270260,"2017-03-27 18:15:00",中西區,騎樓舉發,騎樓舉發,"中西區民族路二段76之12號 騎樓舉發",臺南市中西區民族路二段76之12號,22.994726,120.20925
UN201703270268,"2017-03-27 18:32:00",永康區,違規停車,違規停車,"永康區仁愛街，三村國小 違停",永康區仁愛街,23.047342,120.2406175
UN201703270274,"2017-03-27 18:50:00",中西區,違規停車,違規停車,"中西區西華南街32號 違規停車",臺南市中西區西華南街32號,22.993828,120.209542
UN201703270276,"2017-03-27 18:53:00",中西區,違規停車,違規停車,"中西區民族路二段48號 違規停車",臺南市中西區民族路二段48號,22.994597,120.210777
UN201703270277,"2017-03-27 18:54:00",東區,路燈故障,9盞以下路燈故障,"東區小東路254巷18弄24號和34號中間，小公園外路口 路燈不亮",臺南市東區小東路254巷18弄24號,22.99797,120.230092
UN201703270281,"2017-03-27 18:59:00",新化區,交通運輸,佔用道路,"新化區民權街94號  占用道路",新化區民權街94號,23.0384171,120.3046909
UN201703270283,"2017-03-27 19:07:00",南區,違規停車,違規停車,"南區金華路一段154巷60號 違規停車",臺南市南區金華路一段154巷60號,22.965127,120.1910289
UN201703270286,"2017-03-27 19:17:00",中西區,違規停車,違規停車,"中西區金華路四段61號 違規停車",台南市中西區金華路四段61號,22.9987461,120.194827
UN201703270288,"2017-03-27 19:20:00",北區,違規停車,違規停車,"北區文賢路281號或285號巷口 違停",臺南市北區文賢路281號,23.005904,120.193447
UN201703270289,"2017-03-27 19:21:00",南區,髒亂及汙染,空氣汙染,"南區金華路二段76號，四海遊龍 空污",臺南市南區金華路二段76號,22.977567,120.191301
UN201703270291,"2017-03-27 19:44:00",安平區,噪音舉發,妨害安寧,"永華路二段盧崑福議員辦公室（安平區永華路二段850號），正對面工地 施工噪音",臺南市安平區永華路二段850號,22.991758,120.168169
UN201703270292,"2017-03-27 19:46:00",歸仁區,髒亂及汙染,空氣汙染,"歸仁區南興里文化街三段366巷30號 空污",臺南市歸仁區南興里文化街三段366巷30號,22.971377,120.279932
UN201703270296,"2017-03-27 20:03:00",永康區,道路維修,寬頻管線、孔蓋損壞,"永康區龍國街220號前 寬頻孔蓋聲響",臺南市永康區龍國街220號,23.03223,120.262257
UN201703270297,"2017-03-27 20:04:00",永康區,違規停車,違規停車,"永康區中正六街7號對面 違停",臺南市永康區中正六街7號,23.036717,120.237396
UN201703270299,"2017-03-27 20:18:00",南區,噪音舉發,妨害安寧,"南區中華西路一段155號4樓，卡拉OK 妨害安寧",臺南市南區中華西路一段155號,22.981833,120.185705
UN201703270301,"2017-03-27 20:20:00",安平區,違規停車,違規停車,"安平區安平路394號 違規停車",臺南市安平區安平路394號,22.998274,120.17516
UN201703270302,"2017-03-27 20:20:00",中西區,髒亂及汙染,空氣汙染,"中西區慈聖街65號  空汙",臺南市中西區慈聖街65號,22.998901,120.199967
UN201703270303,"2017-03-27 20:28:00",安南區,噪音舉發,妨害安寧,"安南區理安街141號 妨害安寧",臺南市安南區理安街141號,23.033143,120.1945
UN201703270310,"2017-03-27 21:07:00",安平區,違規停車,違規停車,"安平區安平路394號 違規停車",臺南市安平區安平路394號,22.998274,120.17516
UN201703270312,"2017-03-27 20:57:00",南區,路燈故障,9盞以下路燈故障,"南區興昌路76巷26號 路燈不亮",臺南市南區興昌路76巷26號,22.977564,120.198986
UN201703270313,"2017-03-27 21:10:00",新市區,違規停車,違規停車,"新市區丹丹漢堡前路口 違規停車",新市區丹丹漢堡前路口,23.0741017,120.2914464
UN201703270318,"2017-03-27 21:34:00",安南區,道路維修,路面坑洞,安南區長溪路二段570巷81弄14-9號,臺南市安南區長溪路二段570巷81弄14-9號,23.056051,120.204644
UN201703270319,"2017-03-27 21:37:00",關廟區,髒亂及汙染,空氣汙染,"關廟區中正路567巷18號或20號周邊  空汙",臺南市關廟區中正路567巷18號,22.96357,120.340389
UN201703270329,"2017-03-27 22:26:00",永康區,違規停車,違規停車,"騰揮會館 違規停車",騰揮會館中正路970巷27號,23.0412574,120.2395062
UN201703270334,"2017-03-27 22:33:00",永康區,違規停車,違規停車,永康區復國一路30號違規停車,臺南市永康區復國一路30號,23.0024777,120.2460084
UN201703270337,"2017-03-27 22:51:00",安南區,違規停車,違規停車,"安南區安中路ㄧ段639巷底 違規停車",台南市安南區安中路ㄧ段639巷底,23.0546223,120.1546863
UN201703270338,"2017-03-27 22:56:00",安南區,違規停車,違規停車,"安南區安中路一段639巷底  違規停車",安南區安中路一段639巷底,23.0546223,120.1546863
UN201703270340,"2017-03-27 23:02:00",麻豆區,髒亂及汙染,空氣汙染,"麻豆區興中路165號附近 開源社  空汙",臺南市麻豆區興中路165號,23.183794,120.252432
UN201703270343,"2017-03-27 23:10:00",歸仁區,髒亂及汙染,空氣汙染,"歸仁區長榮路一段713號 空氣汙染",歸仁區長榮路一段713號,22.9099047,120.2775275
UN201703270345,"2017-03-27 23:42:00",安南區,噪音舉發,妨害安寧,安南區安和路四段537巷62號噪音舉發,臺南市安南區安和路四段537巷62號,23.062559,120.21774
UN201703270347,"2017-03-27 23:40:00",東區,違規停車,違規停車,"東區林森路一段  大東夜市周圍  違停","東區林森路一段  大東夜市周圍",22.9826132,120.2193412
UN201703280001,"2017-03-28 00:32:00",安定區,動物救援,遊蕩犬隻捕捉管制,"安定區安定村安定11-13號  遊蕩犬隻捕捉管制",臺南市安定區安定村安定11-13號,23.118523,120.245755
