UN201704030001,"2017-04-03 00:00:00",歸仁區,噪音舉發,妨害安寧,"歸仁區中正一街51號 妨害安寧",歸仁區中正一街51號,22.9660543,120.2953363
UN201704030002,"2017-04-03 00:05:00",中西區,髒亂及汙染,空氣汙染,"中西區大福街12巷3號 空氣污染",中西區大福街12巷3號,22.998519,120.193612
UN201704030005,"2017-04-03 00:09:00",北區,噪音舉發,妨害安寧,"中華北路二段西海岸活蝦之家 妨害安寧",北區中華北路二段160號,23.0207749,120.201495
UN201704030021,"2017-04-03 07:18:00",安南區,違規停車,違規停車,"安南區國安街94號 違規停車",臺南市安南區國安街94號,23.022502,120.189283
UN201704030022,"2017-04-03 07:39:00",安定區,噪音舉發,妨害安寧,"安定區海寮里201-12號 噪音舉發",臺南市安定區海寮里201-12號,23.105517,120.215518
UN201704030023,"2017-04-03 07:42:00",西港區,道路維修,路面下陷、凹陷,"西港區南42鄉道413號 路面下陷、凹陷",西港區南42鄉道413號,23.1093587,120.1928195
UN201704030037,"2017-04-03 08:58:00",永康區,噪音舉發,場所連續噪音,"永康區永大一路241號對面 連續噪音",臺南市永康區永大一路241號,23.016541,120.255448
UN201704030052,"2017-04-03 09:36:00",北區,噪音舉發,場所連續噪音,"北區公園路485號 連續噪音",北區公園路485號,23.0090458,120.210147
UN201704030057,"2017-04-03 10:19:00",麻豆區,噪音舉發,場所連續噪音,"麻豆區寮廍里寮仔廍166-21號 噪音舉發",臺南市麻豆區寮廍里寮仔廍166-21號,23.149947,120.23513
UN201704030058,"2017-04-03 10:17:00",北區,噪音舉發,場所連續噪音,"北區公園路485號 噪音",北區公園路485號,23.0090458,120.210147
UN201704030062,"2017-04-03 10:54:00",永康區,道路維修,人孔蓋或溝蓋聲響鬆動,"永康區中華路58巷76號 溝蓋鬆動",臺南市永康區中華路58巷76號,23.002076,120.237319
UN201704030064,"2017-04-03 10:59:00",歸仁區,動物救援,犬貓急難救援,"歸仁區民權北路128號 犬貓急難救援",臺南市歸仁區民權北路128號,22.970007,120.28822
UN201704030066,"2017-04-03 11:07:00",東區,違規停車,違規停車,"東區北門路一段270號 違停",臺南市東區北門路一段270號,22.995134,120.211966
UN201704030073,"2017-04-03 11:14:00",歸仁區,道路維修,人孔蓋或溝蓋聲響鬆動,歸仁區保大路一段132號前面,臺南市歸仁區保大路一段132號,22.99618,120.295339
UN201704030074,"2017-04-03 11:36:00",玉井區,民生管線,漏水、停水、消防栓漏水或損壞,"玉井區中正路420號對面 漏水",臺南市玉井區中正路420號,23.128358,120.467777
UN201704030076,"2017-04-03 11:40:00",中西區,騎樓舉發,騎樓舉發,"中西區民族路二段76-12號  騎樓舉發",臺南市中西區民族路二段76-12號,22.994726,120.20925
UN201704030077,"2017-04-03 11:41:00",中西區,交通運輸,佔用道路,"中西區新美街7號 佔用道路",臺南市中西區新美街7號,22.994519,120.199992
UN201704030085,"2017-04-03 12:17:00",安平區,髒亂及汙染,空氣汙染,髒亂及汙染,安平區華平路656號,22.9958648,120.1757903
UN201704030093,"2017-04-03 12:51:00",新營區,違規停車,違規停車,"新營區復興路163號 違規停車",新營區復興路163號,23.3029635,120.3072871
UN201704030094,"2017-04-03 12:52:00",東區,違規停車,違規停車,"東區裕農路572號 違規停車",臺南市東區裕農路572號,22.988274,120.233107
UN201704030097,"2017-04-03 13:08:00",佳里區,違規停車,違規停車,722台灣台南市佳里區延平路425-427號違規停車,722台灣台南市佳里區延平路425-427號,23.1653491,120.1781887
UN201704030102,"2017-04-03 13:39:00",南區,動物救援,犬貓急難救援,"南區健康路二段135號 犬貓急難救援",臺南市南區健康路二段135號,22.981291,120.19399
UN201704030103,"2017-04-03 13:05:00",仁德區,交通運輸,佔用道路,"仁德區成功一街二巷9號 佔用道路",臺南市仁德區成功一街二巷9號,22.961562,120.224838
UN201704030107,"2017-04-03 14:17:00",中西區,違規停車,違規停車,"中西區府前路一段377號 違規停車",臺南市中西區府前路一段377號,22.99003,120.198818
UN201704030110,"2017-04-03 14:37:00",中西區,交通運輸,佔用道路,中西區忠義路二段54號,臺南市忠義路二段54號,22.993062,120.203209
UN201704030112,"2017-04-03 14:55:00",安平區,交通運輸,佔用道路,"安平區古堡街120-1號 佔用道路",臺南市安平區古堡街120-1號,23.003339,120.159172
UN201704030117,"2017-04-03 14:44:00",佳里區,噪音舉發,妨害安寧,"佳里區文化路119號 妨礙安寧",臺南市佳里區文化路119號,23.163065,120.17982
UN201704030118,"2017-04-03 15:18:00",中西區,違規停車,違規停車,"中西區中山路125-56號 違規停車",臺南市中西區中山路125-56號,22.99544,120.208861
UN201704030122,"2017-04-03 15:32:00",永康區,違規停車,違規停車,"永康區中山南路國道一號路橋下 違停",臺南市永康區中山南路國道一號,23.011296,120.226355
