UN201704100001,"2017-04-10 00:16:00",北區,路燈故障,9盞以下路燈故障,路燈故障,北區西門路四段298號,23.0127007,120.2092712
UN201704100002,"2017-04-10 00:20:00",東區,噪音舉發,妨害安寧,"東區長榮路三段24巷25號  妨害安寧、紅線違停",臺南市東區長榮路三段24巷25號,22.992557,120.222437
UN201704100008,"2017-04-10 01:05:00",新化區,噪音舉發,妨害安寧,"新化區民治路40號 妨害安寧",臺南市新化區民治路40號,23.03242,120.304679
UN201704100009,"2017-04-10 01:41:00",東區,噪音舉發,場所連續噪音,"東區中華東路二段68號(一品炭烤店) 場所連續噪音",臺南市東區中華東路二段68號,22.986212,120.23306
UN201704100010,"2017-04-10 03:53:00",安平區,違規停車,違規停車,"安平區平生路59號 違規停車","臺南市平生路 59號",23.00091,120.164218
UN201704100012,"2017-04-10 05:01:00",永康區,違規停車,違規停車,永康區新民街66巷違規停車,710台灣台南市永康區新民街66巷,23.0407543,120.2424832
UN201704100016,"2017-04-10 06:51:00",善化區,髒亂及汙染,道路散落物,"善化區三民路1-23號 道路散落物",臺南市善化區三民路1-23號,23.127049,120.286967
UN201704100020,"2017-04-10 07:23:00",安南區,違規停車,違規停車,"安南區同安路80巷58弄2號 違停",臺南市安南區同安路80巷58弄2號,23.03903,120.190359
UN201704100024,"2017-04-10 07:45:00",南區,違規停車,違規停車,"南區健康路一段367號 中西區健康路二段412號及安平區文平路289號 違停",臺南市南區健康路一段367號,22.98128,120.199879
UN201704100025,"2017-04-10 07:50:00",東區,違規停車,違規停車,"東區府東街62號 違規停車",臺南市府東街62號,22.985884,120.21904
UN201704100027,"2017-04-10 07:54:00",新營區,違規停車,違規停車,"新營區民治路8之68號 違停",臺南市新營區民治路8之68號,23.311226,120.320603
UN201704100049,"2017-04-10 08:55:00",永康區,噪音舉發,場所連續噪音,"永康區永春街13巷  噪音舉發",台南市永康區永春街13巷,23.0157036,120.2554508
UN201704100053,"2017-04-10 09:05:00",東區,違規停車,違規停車,"東區東寧路560號 違規停車",臺南市東區東寧路560號,22.988419,120.231815
UN201704100055,"2017-04-10 09:05:00",中西區,違規停車,違規停車,"中西區永福路二段59號 違停/佔用道路",臺南市中西區永福路二段59號,22.99174,120.200565
UN201704100063,"2017-04-10 09:28:00",東區,噪音舉發,場所連續噪音,"東區東平路12巷11號旁 連續噪音",臺南市東區東平路12巷11號,22.995559,120.233635
UN201704100070,"2017-04-10 09:46:00",東區,違規停車,違規停車,"東區府東街62號 違停",臺南市東區府東街62號,22.985884,120.21904
UN201704100071,"2017-04-10 09:53:00",安南區,違規停車,違規停車,"安南區安和路五段80號前 違規停車",臺南市安南區安和路五段80號,23.064765,120.218705
UN201704100084,"2017-04-10 10:23:00",永康區,違規停車,違規停車,"永康區成功路202-1號 違規停車",臺南市永康區成功路202-1號,23.010866,120.233255
UN201704100090,"2017-04-10 10:32:00",麻豆區,民生管線,漏水、停水、消防栓漏水或損壞,"麻豆區興中路211號 路面冒水",臺南市麻豆區興中路211號,23.183841,120.256107
UN201704100091,"2017-04-10 10:38:00",歸仁區,路燈故障,9盞以下路燈故障,"歸仁區高鐵三路160巷126號  路燈故障",臺南市歸仁區高鐵三路160巷126號,22.91997,120.279463
UN201704100108,"2017-04-10 11:03:00",安平區,違規停車,違規停車,"安平區安平路346號、490號  違規停車",安平區安平路346號、490號,22.9993857,120.1732278
UN201704100111,"2017-04-10 11:05:00",中西區,違規停車,違規停車,"中西區民權路一段18號 到223號  違規停車",臺南市中西區民權路一段18號,22.989454,120.210847
UN201704100125,"2017-04-10 11:36:00",北區,騎樓舉發,騎樓舉發,"北區金華路五段1號  騎樓舉發",臺南市北區金華路五段1號,23.001683,120.196061
UN201704100145,"2017-04-10 12:04:00",北區,違規停車,違規停車,"北區臨安路二段91巷內 違規停車",北區臨安路二段91巷內,23.0036213,120.1954923
UN201704100147,"2017-04-10 12:09:00",東區,違規停車,違規停車,"東區東門路二段382號 違停黃線",臺南市東區東門路二段382號,22.982319,120.227565
UN201704100157,"2017-04-10 12:49:00",北區,違規停車,違規停車,"北區成功路282號前 黃線違停",臺南市北區成功路282號,22.999621,120.201843
UN201704100161,"2017-04-10 13:05:00",中西區,違規停車,違規停車,"中西區青年路115號和117號中間 黃線違停",臺南市中西區青年路115號,22.992137,120.208508
UN201704100164,"2017-04-10 13:23:00",北區,騎樓舉發,騎樓舉發,"北區金華路五段3號（台安藥局） 騎樓舉發",北區金華路五段3號,23.0016452,120.1960382
UN201704100167,"2017-04-10 13:29:00",東區,違規停車,違規停車,"東區長榮路二段180號  違規停車",臺南市東區長榮路二段180號,22.990222,120.220767
UN201704100174,"2017-04-10 13:45:00",中西區,違規停車,違規停車,"中西區永福路二段99號  違規停車",台南市中西區永福路二段99號,22.9933303,120.200987
UN201704100187,"2017-04-10 14:04:00",安南區,噪音舉發,場所連續噪音,"安南區義安街131號 連續噪音",臺南市安南區義安街131號,23.033031,120.194964
UN201704100193,"2017-04-10 14:15:00",中西區,交通運輸,交通疏導,"中西區安平路與民生路 交通疏導",中西區安平路與民生路,22.9967941,120.1916344
UN201704100204,"2017-04-10 14:38:00",中西區,違規停車,違規停車,"中西區中正路281號周遭  違規停車",中西區中正路281號,22.9931025,120.1962011
UN201704100207,"2017-04-10 14:45:00",中西區,違規停車,違規停車,"南區西門路一段689巷西門路口藍晒圖園區門口  違規停車",南區西門路一段689巷,22.9870881,120.1968897
UN201704100224,"2017-04-10 15:23:00",仁德區,違規停車,違規停車,仁德區中山路511號違規停車,仁德區中山路511號,22.9714397,120.2538854
UN201704100225,"2017-04-10 15:23:00",中西區,違規停車,違規停車,"中西區西門路一段474號  違規停車",臺南市中西區西門路一段474號,22.983349,120.197782
UN201704100235,"2017-04-10 15:36:00",北區,路燈故障,9盞以下路燈故障,"北區文成一路87號對面公園邊  路燈",臺南市北區文成一路87號,23.013816,120.206794
UN201704100252,"2017-04-10 16:12:00",東區,民生管線,停電、漏電、電線掉落、孔蓋鬆動,"東區府連東路37號前 孔蓋鬆動",臺南市東區府連東路37號,22.984427,120.217801
UN201704100263,"2017-04-10 16:39:00",中西區,違規停車,違規停車,"中西區北門路一段123巷32號  違規停車",臺南市中西區北門路一段123巷32號,22.995418,120.210696
UN201704100273,"2017-04-10 15:48:00",南區,違規停車,違規停車,"南區三官路176巷18號 違規停車",臺南市南區三官路176巷18號,22.97823,120.19303
UN201704100277,"2017-04-10 17:23:00",新營區,違規停車,違規停車,"新營區復興路157-2號 違規停車",730台灣台南市新營區復興路157-2號,23.3029827,120.307197
UN201704100280,"2017-04-10 17:31:00",東區,違規停車,違規停車,"東區東安路99-101號 違規停車",臺南市東區東安路99號,22.993056,120.22635
UN201704100285,"2017-04-10 17:41:00",中西區,違規停車,違規停車,"中西區民族路二段84號 違規停車",臺南市民族路二段84號,22.995552,120.2066
UN201704100287,"2017-04-10 17:43:00",永康區,違規停車,違規停車,"永康區大同街和大同街821號，弘安養護中心前 違規停車",710台灣台南市永康區大同街大同街821號,23.0151176,120.2637125
UN201704100289,"2017-04-10 17:45:00",永康區,違規停車,違規停車,"永康區鹽行里三村一街138巷92弄41號前 違規停車",臺南市永康區鹽行里三村一街138巷92弄41號,23.044046,120.240852
UN201704100290,"2017-04-10 17:45:00",中西區,違規停車,違規停車,"中西區西華南街68號 違規停車",臺南市西華南街68號,22.994221,120.209598
UN201704100308,"2017-04-10 18:50:00",安南區,路燈故障,9盞以下路燈故障,"安南區怡安路一段407號 路燈故障",臺南市安南區怡安路一段407號,23.042024,120.206412
UN201704100315,"2017-04-10 19:12:00",東區,交通運輸,佔用道路,"東區仁和路51號 佔用道路",臺南市東區仁和路51號,22.971877,120.236291
UN201704100329,"2017-04-10 19:53:00",北區,路燈故障,9盞以下路燈故障,"北區文賢二街101巷47號前 路燈故障",臺南市北區文賢二街101巷47號,23.007927,120.196844
UN201704100330,"2017-04-10 20:05:00",東區,路燈故障,9盞以下路燈故障,"東區仁和路51號 路燈故障",臺南市東區仁和路51號,22.971877,120.236291
UN201704100336,"2017-04-10 20:24:00",安南區,髒亂及汙染,空氣汙染,"安南區海尾路500號 空氣污染",臺南市安南區海尾路500號,23.035306,120.182782
UN201704100339,"2017-04-10 20:27:00",永康區,違規停車,違規停車,"永康區小東路373號 違停",臺南市永康區小東路373號,22.99876,120.233757
UN201704100341,"2017-04-10 20:39:00",安定區,髒亂及汙染,空氣汙染,"安定區中榮里17之3號 空氣汙染",臺南市安定區中榮里17之3號,23.093298,120.24303
UN201704100342,"2017-04-10 20:43:00",安南區,違規停車,違規停車,"安南區海佃路四段與本原街三段交叉口 違規停車",安南區海佃路四段本原街三段,23.0535676,120.1783233
UN201704100345,"2017-04-10 21:02:00",東區,違規停車,違規停車,"東區育樂街青年公園218號-250號 違規停車",東區育樂街,22.9943326,120.2146941
UN201704100347,"2017-04-10 21:14:00",中西區,違規停車,違規停車,"中西區長榮路二段180號 違規停車",長榮路二段180號,22.9901221,120.22073
UN201704100349,"2017-04-10 21:19:00",北區,路燈故障,9盞以下路燈故障,"北區臨安路二段18號  路燈故障",臺南市北區臨安路二段18號,23.002224,120.195717
UN201704100355,"2017-04-10 21:37:00",新營區,動物救援,犬貓急難救援,"新營區金華路331號  犬貓急難救援",臺南市新營區金華路331號,23.31336,120.306843
UN201704100356,"2017-04-10 21:43:00",北區,噪音舉發,妨害安寧,"南園街101巷34弄83號二樓 妨害安寧",北區南園街101巷34弄83號,23.0089008,120.227931
UN201704100359,"2017-04-10 21:52:00",北區,路燈故障,9盞以下路燈故障,"北區文賢二街101巷47號 路燈故障",臺南市北區文賢二街101巷47號,23.007927,120.196844
UN201704100369,"2017-04-10 22:45:00",南區,違規停車,違規停車,"南區新興路439巷1弄 違規停車",南區新興路439巷1弄,22.9747681,120.1867596
UN201704100370,"2017-04-10 22:47:00",仁德區,違規停車,違規停車,"仁德區仁中六街255號 違規停車",仁德區仁中六街255號,22.964190307045953,120.25271024554968
UN201704100374,"2017-04-10 23:11:00",善化區,髒亂及汙染,空氣汙染,"善化區啤酒廠省道旁 髒亂及汙染",善化區啤酒廠省道旁,23.1296969,120.3184879
UN201704100378,"2017-04-10 23:31:00",北區,噪音舉發,妨害安寧,"北區成功路86號(興濟宮) 廟會噪音妨害安寧",北區成功路86號,22.9983895,120.2062615
UN201704110001,"2017-04-11 00:05:00",東區,噪音舉發,妨害安寧,"東區崇善路1091號 妨害安寧",臺南市東區崇善路1091號,22.964029,120.234922
UN201704110006,"2017-04-11 01:04:00",善化區,髒亂及汙染,空氣汙染,"善化區文化路26號  空氣汙染",臺南市善化區文化路26號,23.125673,120.296745
UN201704110008,"2017-04-11 01:51:00",新營區,髒亂及汙染,空氣汙染,"新營區舊廍里15號 空汙",新營區舊廍里15號,23.2867306,120.2887685
UN201704110009,"2017-04-11 02:11:00",安平區,違規停車,違規停車,"安平區平生路 59號 違規停車","臺南市平生路 59號",23.00091,120.164218
UN201704110012,"2017-04-11 03:14:00",中西區,路燈故障,9盞以下路燈故障,"中西區府前路跟永福路  路燈傾斜","中西區府前路 永福路",22.9899421,120.2003505
UN201704110013,"2017-04-11 03:25:00",永康區,髒亂及汙染,空氣汙染,"永康區中正路872巷 空汙",永康區中正路872巷,23.0337658,120.245643
UN201704110014,"2017-04-11 03:51:00",永康區,違規停車,違規停車,永康區中正南路654巷2弄2號違規停車,710台灣台南市永康區中正南路654巷2弄2號,23.0382851,120.2348651
UN201704110016,"2017-04-11 06:17:00",永康區,噪音舉發,妨害安寧,"永康區富強路2段398巷191號 噪音舉發",富強路2段398巷191號,23.02918,120.277825
UN201704110022,"2017-04-11 07:36:00",北區,違規停車,違規停車,"中西區成功路217號 第一銀行正對面違規停車",臺南市中西區成功路217號,22.998468,120.204263
UN201704110023,"2017-04-11 07:40:00",永康區,違規停車,違規停車,永康區中正路529號,永康區中正路529號,23.0394245,120.2390574
UN201704110031,"2017-04-11 08:14:00",仁德區,違規停車,違規停車,"仁德區忠義路199巷口 違規停車",仁德區忠義路199巷,22.9747679,120.2591239
UN201704110035,"2017-04-11 08:31:00",大內區,路燈故障,9盞以下路燈故障,"大內區大內里1號 路燈故障",臺南市大內區大內里1號,23.119141,120.356707
UN201704110048,"2017-04-11 08:55:00",中西區,路燈故障,9盞以下路燈故障,"中西區西賢一街238號 路燈故障",臺南市中西區西賢一街238號,23.004142,120.177662
UN201704110051,"2017-04-11 08:57:00",北區,噪音舉發,妨害安寧,"北區崇安街91號 妨害安寧",臺南市北區崇安街91號,23.000807,120.207355
UN201704110054,"2017-04-11 08:58:00",永康區,交通運輸,佔用道路,"永康區中華一路140號 佔用道路",永康區中華一路140號,23.0042926,120.2360295
UN201704110064,"2017-04-11 09:23:00",新市區,噪音舉發,妨害安寧,"新市區大營里265-2號 妨礙安寧",新市區大營里265-2號,23.100596,120.307701
UN201704110072,"2017-04-11 09:33:00",新營區,違規停車,違規停車,"新營區民治路8-68號 違停",新營區民治路8之68號,23.3110555,120.3211073
UN201704110076,"2017-04-11 09:39:00",南區,交通運輸,號誌故障,"南區機場路775號 號誌故障",南區機場路775號,22.9485857,120.2166338
UN201704110092,"2017-04-11 10:17:00",仁德區,髒亂及汙染,環境髒亂,"仁德區開發一路2號 髒亂及汙染",仁德區開發一路2號,22.9220382,120.2426457
UN201704110094,"2017-04-11 10:23:00",鹽水區,噪音舉發,場所連續噪音,"鹽水區桐寮里30號之1 連續噪音",鹽水區桐寮里30號之1,23.289874,120.257243
UN201704110095,"2017-04-11 10:23:00",中西區,違規停車,違規停車,"中西區廣慈街停車格  違規停車",中西區廣慈街停車格,22.996513795202912,120.20684635344242
UN201704110099,"2017-04-11 10:31:00",新市區,違規停車,違規停車,"新市區中正路  違規停車",新市區中正路,23.0747826,120.291444
UN201704110119,"2017-04-11 11:06:00",安平區,違規停車,違規停車,"安平區永華路二段495號右邊  違規停車",安平區永華路二段495號,22.9906183,120.1753356
UN201704110120,"2017-04-11 11:05:00",安平區,道路維修,路面坑洞,"安平區永華路二段701號旁轉建平八街 路面坑洞",臺南市安平區永華路二段701號,22.990769,120.17202
UN201704110124,"2017-04-11 11:18:00",安平區,民生管線,停電、漏電、電線掉落、孔蓋鬆動,"安平區平通路146號  孔蓋鬆動",臺南市安平區平通路146號,22.992719,120.179247
UN201704110128,"2017-04-11 11:34:00",永康區,違規停車,違規停車,"永康區中華路12號 違規停車",臺南市永康區中華路12號,23.000058,120.235058
UN201704110130,"2017-04-11 11:39:00",中西區,違規停車,違規停車,"中西區西華南街60號到38號  違規停車",臺南市中西區西華南街60號,22.994113,120.209579
UN201704110131,"2017-04-11 11:41:00",中西區,違規停車,違規停車,"中西區民族路二段95號  違規停車",中西區民族路二段95號,22.9945453,120.2088953
UN201704110132,"2017-04-11 11:45:00",中西區,違規停車,違規停車,"中西區民族路二段373號  違規停車",臺南市中西區民族路二段373號,22.99697,120.201664
UN201704110136,"2017-04-11 11:59:00",永康區,違規停車,違規停車,"永康區中正南路64號 違停",臺南市永康區中正南路64號,23.020541,120.216309
UN201704110158,"2017-04-11 13:09:00",北區,民生管線,漏水、停水、消防栓漏水或損壞,"北區成功路614巷33號 路面漏水",臺南市北區成功路614巷33號,23.003388,120.195393
UN201704110169,"2017-04-11 13:54:00",中西區,違規停車,違規停車,"中西區南門路179號到203號  違規停車",臺南市中西區南門路179號,22.986164,120.204378
UN201704110170,"2017-04-11 13:54:00",北區,違規停車,違規停車,"北區成功路188號  違規停車",臺南市北區成功路188號,22.998935,120.2039
UN201704110171,"2017-04-11 13:57:00",中西區,違規停車,違規停車,"中西區中正路313號周遭  違規停車",臺南市中西區中正路313號,22.993285,120.195309
UN201704110174,"2017-04-11 14:04:00",東區,髒亂及汙染,空氣汙染,"東區裕農路779號 髒亂及汙染","No. 779, Yunong Rd, East District, Tainan City, Taiwan 701",22.988938456422638,120.23837065335385
UN201704110175,"2017-04-11 14:06:00",中西區,違規停車,違規停車,"中西區西華南街20號到60號  違規停車",臺南市中西區西華南街20號,22.993569,120.209457
UN201704110176,"2017-04-11 13:59:00",安南區,髒亂及汙染,空氣汙染,"安南區工明五路109號 空氣汙染",臺南市安南區工明五路109號,23.061005,120.203815
UN201704110187,"2017-04-11 14:25:00",安南區,髒亂及汙染,空氣汙染,"安南區長和路一段1巷300號 空氣汙染",臺南市安南區長和路一段1巷300號,23.048576,120.231378
UN201704110188,"2017-04-11 14:32:00",中西區,違規停車,違規停車,"中西區廣慈街停車格  違規停車",中西區廣慈街停車格,22.997086613629275,120.20727550688480
UN201704110206,"2017-04-11 15:05:00",東區,違規停車,違規停車,"東區東門路二段158巷36號 違規停車",東區東門路二段158巷36號,22.9844449,120.2204265
UN201704110211,"2017-04-11 15:15:00",仁德區,髒亂及汙染,空氣汙染,"仁德區文宏路3號路 焚燒樹葉",臺南市仁德區文宏路3號,22.97471,120.242947
UN201704110212,"2017-04-11 15:17:00",中西區,違規停車,違規停車,"中西區民權路三段111號  違規停車",臺南市中西區民權路三段111號,22.996927,120.196682
UN201704110217,"2017-04-11 15:23:00",中西區,違規停車,違規停車,"中西區忠義路二段177號旁空地前 違規停車",中西區忠義路二段177號,22.9966406,120.2041012
UN201704110228,"2017-04-11 15:39:00",後壁區,髒亂及汙染,空氣汙染,"後壁區頂長里4號 空氣汙染",臺南市後壁區頂長里4號,23.367061,120.330525
UN201704110242,"2017-04-11 15:59:00",北區,噪音舉發,妨害安寧,"北區公園路1092巷30弄10號 妨礙安寧",臺南市北區公園路1092巷30弄10號,23.018877,120.217226
UN201704110246,"2017-04-11 16:14:00",中西區,違規停車,違規停車,"中西區民生路二段協進國小機車待轉區紅線 違規停車",中西區民生路二段協進國小,22.9984029,120.1884938
UN201704110256,"2017-04-11 16:30:00",東區,道路維修,人孔蓋或溝蓋聲響鬆動,"東區裕孝路420號前 人孔蓋聲響",臺南市東區裕孝路420號,22.980912,120.243356
UN201704110261,"2017-04-11 16:43:00",安平區,違規停車,違規停車,"安平區安平路392號  違規停車",臺南市安平區安平路392號,22.998279,120.175206
UN201704110268,"2017-04-11 16:50:00",中西區,違規停車,違規停車,"中西區西華南街42號  違規停車",臺南市中西區西華南街42號,22.993942,120.20955
UN201704110272,"2017-04-11 17:05:00",中西區,違規停車,違規停車,"中西區衛民街32號到50號中間 違規停車",臺南市中西區衛民街32號,22.992918,120.211
UN201704110273,"2017-04-11 17:08:00",中西區,違規停車,違規停車,"中西區健康路一段312-1號、322號 違規停車",臺南市中西區健康路一段312-1號,22.981503,120.202669
UN201704110280,"2017-04-11 17:36:00",永康區,髒亂及汙染,空氣汙染,"永康區西勢路1巷398號 空污",永康區西勢路1巷398號,23.015116126266935,120.28613425791264
UN201704110282,"2017-04-11 17:38:00",東區,違規停車,違規停車,"東區裕農路635號 違規停車",臺南市東區裕農路635號,22.988759,120.235914
UN201704110283,"2017-04-11 17:29:00",安南區,髒亂及汙染,空氣汙染,"安南區安生街14號 空氣汙染",臺南市安南區安生街14號,23.044894,120.216585
UN201704110290,"2017-04-11 18:08:00",東區,違規停車,違規停車,"東區東寧路與裕豐街口 違停",東區東寧路裕豐街,22.9900265,120.2279758
UN201704110298,"2017-04-11 18:26:00",永康區,違規停車,違規停車,"永康區中華路352號 違規停車",臺南市永康區中華路352號,23.008795,120.233912
UN201704110299,"2017-04-11 18:41:00",永康區,交通運輸,佔用道路,"永康區復華五街55巷1號 佔用道路",臺南市永康區復華五街55巷1號,23.011003,120.245785
UN201704110302,"2017-04-11 18:56:00",東區,違規停車,違規停車,東區裕學路185巷105號違規停車,東區裕學路185巷105號,22.9831854,120.2365285
UN201704110307,"2017-04-11 19:19:00",安南區,路燈故障,9盞以下路燈故障,"安南區同安路292號 路燈不亮",臺南市安南區同安路292號,23.042293,120.192242
UN201704110312,"2017-04-11 19:37:00",學甲區,民生管線,停電、漏電、電線掉落、孔蓋鬆動,"學甲區中正路446號 電線冒火花",臺南市學甲區中正路446號,23.237698,120.183185
UN201704110315,"2017-04-11 20:01:00",安平區,違規停車,違規停車,安平區華平路656號違規停車,臺南市安平區華平路656號,22.995837,120.175938
UN201704110320,"2017-04-11 20:25:00",永康區,違規停車,違規停車,永康區新民街16巷26號違規停車,臺南市永康區新民街16巷26號,23.040721,120.243573
UN201704110324,"2017-04-11 20:30:00",永康區,違規停車,違規停車,永康區中正路970巷27號違規停車,臺南市永康區中正路970巷27號,23.041057,120.239318
UN201704110325,"2017-04-11 20:29:00",仁德區,交通運輸,佔用道路,"仁德區文山路139號 佔用道路",臺南市仁德區文山路139號,22.9751,120.247139
UN201704110327,"2017-04-11 20:38:00",中西區,違規停車,違規停車,中西區民生轉運站違規停車,中西區民生轉運站,22.9978523,120.1879999
UN201704110328,"2017-04-11 20:42:00",中西區,違規停車,違規停車,中西區民生路停車場違規停車,中西區民生路停車場,22.996675,120.1917821
UN201704110329,"2017-04-11 20:48:00",東區,違規停車,違規停車,東區裕學路185巷105號違規停車,東區裕學路185巷105號,22.9831854,120.2365285
UN201704110331,"2017-04-11 21:10:00",東區,路燈故障,9盞以下路燈故障,"東區文化二街196號 路燈故障",臺南市東區文化二街196號,22.975641,120.233265
UN201704110332,"2017-04-11 21:12:00",北區,路燈故障,9盞以下路燈故障,"北區公園路180號，公園國小門口右側 路燈不亮",北區公園路180號,23.0003908,120.2085746
UN201704110334,"2017-04-11 21:23:00",永康區,噪音舉發,場所連續噪音,"永康區台南高工  噪音舉發",永康區台南高工,23.0145585,120.2335483
UN201704110335,"2017-04-11 21:26:00",中西區,違規停車,違規停車,"中西區西門路二段147號 違規停車",中西區西門路二段147號,22.9933748,120.1985684
UN201704110339,"2017-04-11 21:53:00",東區,違規停車,違規停車,"東區崇明十四街6號 違規停車",台南市東區崇明十四街6號,22.9740008,120.2263059
UN201704110340,"2017-04-11 21:54:00",永康區,髒亂及汙染,空氣汙染,"永康區龍安街358巷 空污",永康區龍安街358巷,23.0366652,120.2669168
UN201704110341,"2017-04-11 22:05:00",中西區,路燈故障,9盞以下路燈故障,"中西區開山路245號  路燈燈桿會漏電",臺南市中西區開山路245號,22.986116,120.210233
UN201704110354,"2017-04-11 23:39:00",北區,路燈故障,9盞以下路燈故障,"北區大興街372之1號對面 路燈不亮",臺南市北區大興街372之1號,23.009495,120.183395
UN201704120002,"2017-04-12 00:04:00",新市區,違規停車,違規停車,新市區富強路違規停車,富強路,23.0684581,120.2867872
UN201704120005,"2017-04-12 01:43:00",東區,路燈故障,9盞以下路燈故障,"東區崇德路與崇德十八街 路燈故障",701台灣台南市東區崇德十八街43號,22.9689019,120.2286891
UN201704120006,"2017-04-12 01:53:00",北區,動物救援,犬貓急難救援,"北區臨安路二段53號 犬貓急難救援",臺南市北區臨安路二段53號,23.002802,120.196409
UN201704120007,"2017-04-12 02:48:00",安南區,路燈故障,9盞以下路燈故障,"安南區府安路五段257號 路燈倒塌",臺南市安南區府安路五段257號,23.021084,120.193614
UN201704120009,"2017-04-12 02:53:00",新市區,路燈故障,10盞以上路燈故障,"新市區大洲里32號  10盞以上路燈故障",臺南市新市區大洲里32號,23.070957,120.261024
UN201704120011,"2017-04-12 03:44:00",永康區,違規停車,違規停車,"永康區中山南路11號 違停",臺南市永康區中山南路11號,23.011582,120.226358
UN201704120012,"2017-04-12 04:41:00",中西區,噪音舉發,妨害安寧,"中西區金華新路43號2樓 妨害安寧",臺南市中西區金華新路43號,22.993256,120.19278
UN201704120016,"2017-04-12 05:43:00",永康區,路燈故障,10盞以上路燈故障,"永康區大灣東路606號 10盞以上路燈故障",臺南市永康區大灣東路606號,23.003636,120.273505
UN201704120022,"2017-04-12 07:30:00",中西區,違規停車,違規停車,"中西區健康路一段322號 違規停車",臺南市健康路一段322號,22.981572,120.202477
