UN201704140057,"2017-04-14 09:14:00",永康區,違規停車,違規停車,"永康區自強路750巷68弄53號 違規停車",臺南市永康區自強路750巷68弄53號,23.035167,120.264001
UN201704140066,"2017-04-14 09:29:00",仁德區,動物救援,犬貓急難救援,"仁德區中正路三段252號 小貓受困",仁德區中正路三段252號,22.9785218,120.2551134
UN201704140078,"2017-04-14 09:44:00",東區,噪音舉發,妨害安寧,"東區自由路二段91巷22號門口 妨礙安寧",臺南市東區自由路二段91巷22號,22.972392,120.236888
UN201704140083,"2017-04-14 09:51:00",東區,違規停車,違規停車,"東區裕學路19號、17號 違規停車",臺南市東區裕學路19號,22.98491,120.237808
UN201704140086,"2017-04-14 09:56:00",永康區,交通運輸,佔用道路,"永康區鹽忠街118號 佔用道路",永康區鹽忠街118號,23.0416068,120.2329677
UN201704140090,"2017-04-14 10:05:00",中西區,髒亂及汙染,空氣汙染,"中西區民權路一段110號 空氣汙染",臺南市中西區民權路一段110號,22.990453,120.209432
UN201704140094,"2017-04-14 10:10:00",北區,違規停車,違規停車,"北區小東路289號至295號 違停",臺南市北區小東路289號,22.999663,120.229461
UN201704140099,"2017-04-14 09:59:00",南區,髒亂及汙染,空氣汙染,"南區國民路567巷巷口 空氣汙染",南區國民路567巷,22.973119,120.2050926
UN201704140101,"2017-04-14 10:25:00",中西區,違規停車,違規停車,"中西區西華南街35號 違規停車",中西區西華南街35號,22.9938716,120.2093781
UN201704140136,"2017-04-14 11:24:00",永康區,噪音舉發,妨害安寧,"永康區南工街247巷33弄 噪音舉發",台南市永康區南工街247巷33弄,23.0119533,120.2386341
UN201704140150,"2017-04-14 11:42:00",中西區,交通運輸,佔用道路,"中西區民族路三段 戶政事務所對面佔用道路",台南市中西區民族路三段,22.998857,120.195917
UN201704140153,"2017-04-14 11:52:00",仁德區,髒亂及汙染,道路散落物,"仁德區德南路70巷馬路  道路散落物(動物屍體)",臺南市仁德區德南路70巷19號,22.947458,120.253115
UN201704140158,"2017-04-14 12:10:00",東區,違規停車,違規停車,"東區裕農路624號 違規停車",東區裕農路624號,22.988476,120.235649
UN201704140162,"2017-04-14 12:32:00",東區,違規停車,違規停車,違規停車,台南市東區裕平路虎尾寮公有市場,22.985324,120.240358
UN201704140165,"2017-04-14 12:51:00",中西區,違規停車,違規停車,"中西區民族路二段57號 違規停車",臺南市民族路二段57號,22.994309,120.210166
UN201704140167,"2017-04-14 13:04:00",永康區,交通運輸,佔用道路,"永康區小東路513號前 佔用道路",臺南市永康區小東路513號,22.998719,120.236233
UN201704140169,"2017-04-14 13:08:00",永康區,民生管線,停電、漏電、電線掉落、孔蓋鬆動,"永康區復興路148號、146號 孔蓋鬆動",臺南市永康區復興路148號,22.998778,120.246053
UN201704140177,"2017-04-14 13:38:00",中西區,違規停車,違規停車,中西區民族路二段57號及63號違規停車,臺南市中西區民族路二段57號,22.994309,120.210166
UN201704140185,"2017-04-14 13:52:00",中西區,違規停車,違規停車,中西區海安路一段105號違規停車,中西區海安路一段105號,22.9902217,120.1952529
UN201704140191,"2017-04-14 13:59:00",中西區,騎樓舉發,騎樓舉發,"中西區衛民街86號及69號 違停",衛民街86號,22.9930717,120.2096846
UN201704140195,"2017-04-14 14:09:00",中西區,交通運輸,佔用道路,"中西區國華街二段146號 佔用道路",臺南市中西區國華街二段146號,22.991143,120.196994
UN201704140202,"2017-04-14 14:25:00",北區,騎樓舉發,騎樓舉發,北區臨安路二段205號騎樓違停,北區臨安路二段205號,23.0038355,120.1994424
UN201704140204,"2017-04-14 14:37:00",安平區,髒亂及汙染,空氣汙染,"安平區華平路656號 空氣汙染",臺南市華平路656號,22.995837,120.175938
UN201704140206,"2017-04-14 14:46:00",安平區,髒亂及汙染,空氣汙染,"安平區華平路656號 空氣汙染",臺南市華平路656號,22.995837,120.175938
UN201704140208,"2017-04-14 14:49:00",安南區,違規停車,違規停車,"安南區安中路一段765號 違規停車",安南區安中路一段765號,23.0438418,120.1941835
UN201704140219,"2017-04-14 15:23:00",中西區,違規停車,違規停車,"中西區忠明街12號 違規停車",忠明街12號,22.9960526,120.1970642
UN201704140225,"2017-04-14 15:38:00",永康區,違規停車,違規停車,"永康區中華路7巷38號的對面 違規停車",臺南市中華路7巷38號,22.999189,120.233812
UN201704140234,"2017-04-14 15:45:00",安南區,髒亂及汙染,空氣汙染,"安南區十二佃路81巷47號 空氣汙染",安南區十二佃路81巷47號,23.0679794,120.1742037
UN201704140243,"2017-04-14 15:59:00",安平區,違規停車,違規停車,"安平區華平路 違規停車",華平路,22.9940248,120.175501
UN201704140249,"2017-04-14 16:13:00",中西區,違規停車,違規停車,"中西區武德街靠近衛民街口 違規停車",中西區武德街衛民街,22.9930015,120.2097953
UN201704140251,"2017-04-14 16:19:00",東區,違規停車,違規停車,"東區大學路1號 違規停車",東區大學路1號,22.996117514579552,120.22115858282913
UN201704140253,"2017-04-14 16:20:00",北區,道路維修,路面下陷、凹陷,"北區成功路與臨安路 路面下陷、凹陷",北區成功路臨安路,23.0021847,120.1951515
UN201704140260,"2017-04-14 16:49:00",學甲區,髒亂及汙染,道路散落物,"學甲區豐和里50號 道路散落物",臺南市學甲區豐和里50號,23.222287,120.197667
UN201704140273,"2017-04-14 17:27:00",新營區,髒亂及汙染,空氣汙染,"新營區長榮路二段961號 空汙",臺南市新營區長榮路二段961號,23.311657,120.298092
UN201704140275,"2017-04-14 16:08:00",新化區,民生管線,漏水、停水、消防栓漏水或損壞,"新化區復興路209號 民生管線",臺南市新化區復興路209號,23.032583,120.311074
UN201704140281,"2017-04-14 17:57:00",北區,違規停車,違規停車,"北區小東路289號到295號 違規停車",北區小東路289號,22.9996142,120.2295121
UN201704140283,"2017-04-14 18:01:00",中西區,髒亂及汙染,空氣汙染,"中西區建業街16號 空氣汙染",中西區建業街16號,22.988293,120.2071806
UN201704140284,"2017-04-14 18:03:00",永康區,違規停車,違規停車,"永康區大灣路和大灣路1090巷口 違規停車",永康區大灣路1090巷,22.9988729,120.2611886
UN201704140287,"2017-04-14 18:06:00",永康區,違規停車,違規停車,"永康區六合路54巷2號 違規停車",臺南市永康區六合路54巷2號,23.010287,120.231084
UN201704140293,"2017-04-14 18:26:00",中西區,違規停車,違規停車,"中西區民族路二段393號 違規停車",臺南市中西區民族路二段393號,22.997114,120.201265
UN201704140294,"2017-04-14 18:28:00",永康區,違規停車,違規停車,"永康區大灣路1090巷 違規停車",永康區大灣路1090巷,22.9989243,120.2519489
UN201704140299,"2017-04-14 18:35:00",中西區,違規停車,違規停車,"中西區民族路二段133號以及對面 違規停車",臺南市中西區民族路二段133號,22.994878,120.207797
UN201704140301,"2017-04-14 18:40:00",永康區,交通運輸,佔用道路,"永康區永大路三段51號 佔用道路",臺南市永康區永大路三段51號,23.038588,120.259171
UN201704140304,"2017-04-14 18:53:00",安平區,違規停車,違規停車,"安平區怡平路495號 違規停車",臺南市安平區怡平路495號,22.99393,120.172458
UN201704140306,"2017-04-14 18:54:00",永康區,違規停車,違規停車,"永康區華興街145到147號 違規停車",永康區華興街145至147號,23.0006548,120.2354962
UN201704140307,"2017-04-14 18:36:00",歸仁區,髒亂及汙染,其他汙染舉發,"歸仁區凱旋路一段601巷100號前 其他汙染舉發",臺南市歸仁區凱旋路一段601巷100號,22.953697,120.295274
UN201704140309,"2017-04-14 18:59:00",永康區,違規停車,違規停車,"永康區忠義街和華興街口 違規停車",永康區忠義街和華興街口,23.000666,120.2364429
UN201704140310,"2017-04-14 19:00:00",安南區,髒亂及汙染,空氣汙染,"安南區府安路六段與樂活路口 空氣汙染",安南區府安路六段,23.0172612,120.1871239
UN201704140311,"2017-04-14 19:02:00",新化區,髒亂及汙染,市區道路路面油漬,新化區中興路377號前,臺南市新化區中興路377號,23.026666,120.324496
UN201704140318,"2017-04-14 19:14:00",安平區,違規停車,違規停車,"安平區永華路二段建平路口 違規停車",708台灣台南市安平區永華路二段建平路口(明台產物保險旁人行道),22.9897066,120.1824578
UN201704140321,"2017-04-14 18:42:00",北區,髒亂及汙染,空氣汙染,"北區和緯路三段303巷5弄11號 空氣汙染",臺南市北區和緯路三段303巷5弄11號,23.009936,120.196875
UN201704140326,"2017-04-14 19:45:00",永康區,違規停車,違規停車,"永康區永正路103號 違規停車",臺南市永康區永正路103號,23.027946,120.253552
UN201704140330,"2017-04-14 20:02:00",永康區,違規停車,違規停車,"永康區成功路202之1號 違規停車",臺南市永康區成功路202之1號,23.010866,120.233255
UN201704140332,"2017-04-14 20:04:00",中西區,路燈故障,9盞以下路燈故障,"中西區民權路三段234巷9號  路燈故障",臺南市中西區民權路三段234巷9號,22.998403,120.193758
UN201704140334,"2017-04-14 20:07:00",東區,違規停車,違規停車,"東區中華東路一段207巷1號 違規停車",臺南市東區中華東路一段207巷1號,22.990209,120.23411
UN201704140335,"2017-04-14 20:07:00",北區,民生管線,漏水、停水、消防栓漏水或損壞,"北區文成三路682巷56號 漏水",臺南市北區文成三路682巷56號,23.016871,120.199499
UN201704140345,"2017-04-14 20:43:00",安平區,違規停車,違規停車,"安平區安平路394號 違規停車",臺南市安平區安平路394號,22.998274,120.17516
UN201704140352,"2017-04-14 21:37:00",仁德區,髒亂及汙染,空氣汙染,"仁德區中正西路1446巷168號 空氣汙染",臺南市仁德區中正西路1446巷168號,22.92772,120.194258
UN201704140353,"2017-04-14 21:40:00",安平區,違規停車,違規停車,"安平區安平路446巷25弄路口 違停",安平區安平路446巷25弄路口,22.99802,120.1735638
UN201704140358,"2017-04-14 22:28:00",東區,違規停車,違規停車,"東區東門路二段158巷23號斜對面  紅線違停",臺南市東區東門路二段158巷23號,22.984719,120.22083
