UN201705010004,"2017-05-01 02:19:00",安南區,髒亂及汙染,道路散落物,"安南區海佃路四段205號 道路散落物",臺南市安南區海佃路四段205號,23.058241,120.176404
UN201705010007,"2017-05-01 04:04:00",中西區,違規停車,違規停車,"中西區忠義路二段177號旁空地 違規停車",臺南市忠義路二段177號,22.996692,120.204066
UN201705010010,"2017-05-01 06:43:00",仁德區,髒亂及汙染,環境髒亂,仁德區德南路70巷38號髒亂及汙染,717台灣台南市仁德區德南路70巷38號,22.9468519,120.2526701
UN201705010014,"2017-05-01 07:39:00",北區,民生管線,漏水、停水、消防栓漏水或損壞,"北區育德三街235號 民生管線",臺南市北區育德三街235號,23.018,120.201184
UN201705010015,"2017-05-01 07:42:00",中西區,違規停車,違規停車,701台灣台南市中西區民生路海安路違規停車,701台灣台南市中西區民生路海安路,22.997166486060006,120.21296594291925
UN201705010027,"2017-05-01 08:18:00",新化區,違規停車,違規停車,新化區中山路234號違規停車,臺南市新化區中山路234號,23.036102,120.308249
UN201705010034,"2017-05-01 08:26:00",中西區,違規停車,違規停車,中西區民族路二段63號違規停車,臺南市中西區民族路二段63號,22.994306,120.209873
UN201705010036,"2017-05-01 08:31:00",大內區,民生管線,漏水、停水、消防栓漏水或損壞,"大內區二溪里217號 民生管線",臺南市大內區二溪里217號,23.139318,120.401164
