UN201705010004,"2017-05-01 02:19:00",安南區,髒亂及汙染,道路散落物,"安南區海佃路四段205號 道路散落物",臺南市安南區海佃路四段205號,23.058241,120.176404
UN201705010007,"2017-05-01 04:04:00",中西區,違規停車,違規停車,"中西區忠義路二段177號旁空地 違規停車",臺南市忠義路二段177號,22.996692,120.204066
UN201705010010,"2017-05-01 06:43:00",仁德區,髒亂及汙染,環境髒亂,仁德區德南路70巷38號髒亂及汙染,717台灣台南市仁德區德南路70巷38號,22.9468519,120.2526701
UN201705010014,"2017-05-01 07:39:00",北區,民生管線,漏水、停水、消防栓漏水或損壞,"北區育德三街235號 民生管線",北區育德三街235號,23.014815,120.2015907
UN201705010015,"2017-05-01 07:42:00",中西區,違規停車,違規停車,701台灣台南市中西區民生路海安路違規停車,701台灣台南市中西區民生路海安路,22.997166486060006,120.21296594291925
UN201705010027,"2017-05-01 08:18:00",新化區,違規停車,違規停車,新化區中山路234號違規停車,臺南市新化區中山路234號,23.036102,120.308249
UN201705010031,"2017-05-01 08:22:00",仁德區,道路維修,路面下陷、凹陷,"仁德區中正路二段387號旁 道路凹陷",臺南市仁德區中正路二段387號,22.953137,120.251743
UN201705010034,"2017-05-01 08:26:00",中西區,違規停車,違規停車,中西區民族路二段63號違規停車,臺南市中西區民族路二段63號,22.994306,120.209873
UN201705010036,"2017-05-01 08:31:00",大內區,民生管線,漏水、停水、消防栓漏水或損壞,"大內區二溪里217號 民生管線",臺南市大內區二溪里217號,23.139318,120.401164
UN201705010038,"2017-05-01 08:36:00",安南區,道路維修,路面下陷、凹陷,"安南區海環街715巷112弄3號之1  路面凹陷",臺南市安南區海環街715巷112弄3號,23.045465,120.183939
UN201705010049,"2017-05-01 09:08:00",新營區,交通運輸,佔用道路,"新營區樂仁街47號斜對面 占用道路",臺南市新營區樂仁街47號,23.31377,120.320602
UN201705010050,"2017-05-01 09:10:00",南區,噪音舉發,妨害安寧,"南區水交社路20巷18號 妨礙安寧",臺南市南區水交社路20巷18號,22.975514,120.201388
UN201705010052,"2017-05-01 09:13:00",中西區,違規停車,違規停車,"中西區五妃街280巷口 違規停車",五妃街280巷,22.9830475,120.1992111
UN201705010057,"2017-05-01 09:21:00",安南區,違規停車,違規停車,"安南區海中街77巷45弄路口 違規停車",海中街77巷45弄,23.0386752,120.1833551
UN201705010063,"2017-05-01 09:28:00",北門區,髒亂及汙染,其他汙染舉發,"北門區保吉里53號 汙染舉發",臺南市北門區保吉里53號,23.281091,120.135182
UN201705010073,"2017-05-01 09:57:00",中西區,違規停車,違規停車,"中西區廣慈街 違規停車",700台灣台南市中西區廣慈街,22.996832390449562,120.20709539577024
UN201705010084,"2017-05-01 10:06:00",中西區,交通運輸,佔用道路,"中西區開山路109巷8號 佔用道路",中西區開山路109巷8號,22.9895359,120.2076913
UN201705010096,"2017-05-01 10:23:00",麻豆區,髒亂及汙染,空氣汙染,"麻豆區中正路35號 空氣汙染",臺南市麻豆區中正路35號,23.184785,120.248633
UN201705010097,"2017-05-01 10:27:00",新市區,違規停車,違規停車,"新市區永就里59-3號 違規停車",臺南市永就里59-3號,23.064107,120.294022
UN201705010098,"2017-05-01 10:31:00",中西區,違規停車,違規停車,"中西區開山路76號至86號雙邊 違規停車",中西區開山路76號,22.9900953,120.2065688
UN201705010101,"2017-05-01 10:34:00",中西區,交通運輸,佔用道路,"中西區和緯路五段209號 佔用道路",臺南市中西區和緯路五段209號,23.004964,120.182502
UN201705010118,"2017-05-01 10:23:00",歸仁區,路燈故障,9盞以下路燈故障,"歸仁區歸仁十六路257號 路燈故障",臺南市歸仁區歸仁十六路257號,22.921575,120.276168
UN201705010128,"2017-05-01 11:17:00",東區,違規停車,違規停車,"東區東平路23號 違規停車",臺南市東區東平路23號,22.994697,120.233355
UN201705010132,"2017-05-01 11:21:00",北區,髒亂及汙染,空氣汙染,"北區公園路1092巷27弄34號對面 施工揚塵",臺南市北區公園路1092巷27弄34號,23.019593,120.217549
UN201705010134,"2017-05-01 11:30:00",北區,髒亂及汙染,空氣汙染,"北區公園路759-2號 空氣汙染",臺南市北區公園路759-2號,23.018087,120.21554
UN201705010137,"2017-05-01 11:33:00",中西區,違規停車,違規停車,"中西區西華南街38號 違規停車",臺南市西華南街38號,22.993886,120.209524
UN201705010138,"2017-05-01 11:33:00",中西區,違規停車,違規停車,"中西區民族路二段57號 違規停車",臺南市民族路二段57號,22.994309,120.210166
UN201705010140,"2017-05-01 11:35:00",中西區,違規停車,違規停車,"中西區衛民街83號 違規停車",臺南市衛民街83號,22.992855,120.209435
UN201705010150,"2017-05-01 11:50:00",中西區,違規停車,違規停車,"中西區民權路一段18號至232號 違停",臺南市中西區民權路一段18號,22.989454,120.210847
UN201705010155,"2017-05-01 11:59:00",北區,騎樓舉發,騎樓舉發,"北區西門路四段310號  騎樓舉發",臺南市北區西門路四段310號,23.013032,120.209457
UN201705010161,"2017-05-01 12:27:00",中西區,違規停車,違規停車,"中西區民族路二段63號 違規停車",中西區民族路二段63號,22.9943593,120.209799
UN201705010162,"2017-05-01 12:28:00",中西區,違規停車,違規停車,"中西區民族路二段42號28號及對面15號停車格間 違規停車",中西區民族路二段42號,22.9946351,120.2107863
UN201705010163,"2017-05-01 12:31:00",中西區,違規停車,違規停車,"中西區中山路125-56號南方公園 違規停車",700臺南市中西區中山路125號,22.9960707,120.2088778
UN201705010164,"2017-05-01 12:34:00",中西區,違規停車,違規停車,"中西區民族路二段89號到95號 違規停車",中西區民族路二段89號,22.9944584,120.2089941
UN201705010165,"2017-05-01 12:33:00",歸仁區,道路維修,寬頻管線、孔蓋損壞,"歸仁區中山路二段63號  孔蓋噪音",臺南市歸仁區中山路二段63號,22.966809,120.292475
UN201705010166,"2017-05-01 12:39:00",中西區,違規停車,違規停車,"中西區民族路二段230號小吃城周邊以及對面 違規停車",中西區民族路二段230號,22.9972751,120.201768
UN201705010170,"2017-05-01 12:45:00",中西區,違規停車,違規停車,"中西區中山路162號（新光三越） 違規停車",台南市中西區中山路162號,22.9955009,120.2098201
UN201705010172,"2017-05-01 12:45:00",東區,違規停車,違規停車,"東區大同路一段221號 違停",臺南市東區大同路一段221號,22.983574,120.211326
UN201705010175,"2017-05-01 13:01:00",北區,違規停車,違規停車,"北區公園路768號 違規停車",臺南市北區公園路768號,23.011073,120.21111
UN201705010180,"2017-05-01 13:06:00",將軍區,路燈故障,9盞以下路燈故障,"將軍區西華里1號消防隊南邊 路燈漏電",臺南市將軍區西華里1號,23.199151,120.157285
UN201705010189,"2017-05-01 13:32:00",永康區,違規停車,違規停車,"永康區鹽行里三村一街138巷92弄42號 違規停車",臺南市永康區鹽行里三村一街138巷92弄42號,23.044343,120.240239
UN201705010193,"2017-05-01 13:34:00",永康區,違規停車,違規停車,"永康區鹽行里三村一街138巷92弄66號旁 違規停車",臺南市永康區鹽行里三村一街138巷92弄66號,23.04408,120.240718
UN201705010195,"2017-05-01 13:35:00",永康區,違規停車,違規停車,"永康區鹽行里三村一街138巷92弄41號前 違規停車",臺南市永康區鹽行里三村一街138巷92弄41號,23.044046,120.240852
UN201705010196,"2017-05-01 13:37:00",永康區,違規停車,違規停車,"永康區鹽行里仁愛街108巷69號 違規停車",臺南市永康區鹽行里仁愛街108巷69號,23.044244,120.241643
UN201705010202,"2017-05-01 13:54:00",中西區,違規停車,違規停車,"中西區西華南街58號 違規停車",臺南市中西區西華南街58號,22.994066,120.20957
UN201705010205,"2017-05-01 14:03:00",永康區,動物救援,遊蕩犬隻捕捉管制,"永康區中華路472號 流浪犬捕捉",臺南市永康區中華路472號,23.011086,120.232484
UN201705010216,"2017-05-01 14:28:00",中西區,交通運輸,佔用道路,"中西區國華街二段182號 佔用道路",中西區國華街二段182號,22.9921694,120.1972213
UN201705010218,"2017-05-01 14:35:00",中西區,噪音舉發,妨害安寧,"中西區友愛街國華街 妨礙安寧",中西區友愛街國華街,22.9919725,120.1971227
UN201705010221,"2017-05-01 14:47:00",安南區,髒亂及汙染,空氣汙染,"安南區長溪路一段342巷38弄50號 空氣汙染",安南區長溪路一段342巷38弄50號,23.0401485,120.2074802
UN201705010224,"2017-05-01 14:55:00",中西區,動物救援,犬貓急難救援,"中西區觀亭街81號 犬貓救援",臺南市中西區觀亭街81號,22.997859,120.205869
UN201705010235,"2017-05-01 15:17:00",永康區,噪音舉發,妨害安寧,"永康區二王路135巷29號 妨害安寧",臺南市永康區二王路135巷29號,23.020946,120.249021
UN201705010238,"2017-05-01 15:28:00",麻豆區,民生管線,停電、漏電、電線掉落、孔蓋鬆動,"麻豆區新生北路26號 電線垂落",臺南市麻豆區新生北路26號,23.185574,120.241335
UN201705010241,"2017-05-01 15:41:00",東區,道路維修,寬頻管線、孔蓋損壞,"東區東門路一段205號 孔蓋噪音",臺南市東區東門路一段205號,22.987537,120.21629
UN201705010247,"2017-05-01 15:55:00",永康區,違規停車,違規停車,"永康區永正路85巷 違規停車",永康區永正路85巷,23.0265138,120.254152
UN201705010248,"2017-05-01 15:55:00",安平區,違規停車,違規停車,"安平區永華路二段820號  違規停車",安平區永華路二段820號,22.9919579,120.1686849
UN201705010250,"2017-05-01 15:58:00",永康區,違規停車,違規停車,"康區自強路368巷和自強路330巷9弄口 違規停車",710台灣台南市永康區自強路368巷和自強路330巷9弄口,23.0291081,120.2527457
UN201705010252,"2017-05-01 16:02:00",東區,違規停車,違規停車,"東區自由路二段95號 違規停車",自由路二段95號,22.9724666,120.2373741
UN201705010255,"2017-05-01 15:00:00",柳營區,路燈故障,9盞以下路燈故障,"柳營區長榮路六段600號 路燈故障",臺南市柳營區長榮路六段600號,23.26879,120.312307
UN201705010261,"2017-05-01 16:21:00",中西區,違規停車,違規停車,"中西區府前路一段上近南門路 違規停車",中西區府前路一段南門路,22.9889856,120.2045913
UN201705010262,"2017-05-01 16:32:00",中西區,違規停車,違規停車,"中西區北門路一段123巷36号 違規停車",北門路一段123巷36号,22.9952519,120.2108989
UN201705010267,"2017-05-01 16:47:00",南區,違規停車,違規停車,"南區夏林路312號 違規停車",南區夏林路312號,22.9757749,120.1950893
UN201705010268,"2017-05-01 16:52:00",北區,違規停車,違規停車,"北區成功路382-1號 違規停車",台南市北區成功路382-1號,23.0004401,120.2002894
UN201705010270,"2017-05-01 16:58:00",北區,路燈故障,9盞以下路燈故障,"北區武聖路74號對面 路燈故障",北區武聖路74號,23.0058178,120.1916941
UN201705010279,"2017-05-01 17:05:00",新營區,髒亂及汙染,空氣汙染,"新營區長榮路二段961號 空氣污染",臺南市新營區長榮路二段961號,23.311657,120.298092
UN201705010281,"2017-05-01 17:16:00",東區,騎樓舉發,騎樓舉發,"東區東平路146號 騎樓舉發",東區東平路146號,22.9954978,120.2295087
UN201705010284,"2017-05-01 17:25:00",仁德區,違規停車,違規停車,"仁德區德南路242巷18號 違規停車",臺南市仁德區德南路242巷18號,22.945073,120.256802
UN201705010291,"2017-05-01 17:43:00",東區,騎樓舉發,騎樓舉發,"東區育樂街133號 騎樓舉發",東區育樂街133號,22.9949846,120.2148762
UN201705010292,"2017-05-01 17:46:00",東區,騎樓舉發,騎樓舉發,"東區東平路146號 騎樓舉發",臺南市東區東平路146號,22.995482,120.229568
UN201705010304,"2017-05-01 18:13:00",中西區,違規停車,違規停車,"中西區民族路二段42號附近 違規停車",臺南市中西區民族路二段42號,22.994585,120.210894
UN201705010308,"2017-05-01 18:19:00",中西區,違規停車,違規停車,"中西區衛民街106號 違規停車",臺南市中西區衛民街106號,22.993151,120.209223
UN201705010311,"2017-05-01 18:24:00",中西區,違規停車,違規停車,"中西區南寧街88到180號 違規停車",臺南市中西區南寧街88號,22.985143,120.202314
UN201705010312,"2017-05-01 18:25:00",中西區,違規停車,違規停車,"中西區衛民街83號 違規停車",臺南市中西區衛民街83號,22.992855,120.209435
UN201705010316,"2017-05-01 18:34:00",安平區,路燈故障,9盞以下路燈故障,"安平區安北路388號 路燈故障",臺南市安平區安北路388號,23.000158,120.153398
UN201705010321,"2017-05-01 18:51:00",中西區,違規停車,違規停車,"中西區南寧街126號對面及周邊 違規停車",臺南市中西區南寧街126號,22.985151,120.201081
UN201705010323,"2017-05-01 18:50:00",南區,髒亂及汙染,空氣汙染,"南區大同路二段194號，熱炒店 空污",臺南市南區大同路二段194號,22.976703,120.213563
UN201705010326,"2017-05-01 18:59:00",中西區,違規停車,違規停車,"中西區衛民街106到120號 違規停車",臺南市中西區衛民街106號,22.993151,120.209223
UN201705010327,"2017-05-01 19:00:00",中西區,違規停車,違規停車,"中西區城隍街靠近府前路口 違規停車",中西區城隍街靠近府前路口,22.9904317,120.1984939
UN201705010328,"2017-05-01 19:00:00",山上區,路燈故障,9盞以下路燈故障,"山上區南洲里48號前 路燈故障",臺南市山上區南洲里48號,23.101053,120.354773
UN201705010329,"2017-05-01 19:00:00",北區,路燈故障,9盞以下路燈故障,"北區成功路282號 路燈不亮",臺南市北區成功路282號,22.999621,120.201843
UN201705010331,"2017-05-01 19:08:00",安平區,噪音舉發,妨害安寧,"安平區安平路183號旁空地 妨害安寧",臺南市安平區安平路183號,23.000094,120.160815
UN201705010332,"2017-05-01 18:56:00",東區,路燈故障,9盞以下路燈故障,東區崇道路112號　路燈不亮,臺南市東區崇道路112號,22.971954,120.228884
UN201705010333,"2017-05-01 19:13:00",東區,違規停車,違規停車,"東區育樂街218號至250號，青年公園 違停",臺南市東區育樂街218號,22.992578,120.214466
UN201705010336,"2017-05-01 19:21:00",安南區,髒亂及汙染,空氣汙染,"安南區工明三路20號與30號中間 空氣污染",臺南市安南區工明三路20號,23.059206,120.204942
UN201705010337,"2017-05-01 19:23:00",安平區,違規停車,違規停車,"安平區國平路210號，全聯福利中心前 違停",臺南市安平區國平路210號,22.990472,120.171243
UN201705010339,"2017-05-01 19:27:00",北區,民生管線,漏水、停水、消防栓漏水或損壞,"北區武聖路100號 漏水",臺南市北區武聖路100號,23.006118,120.191186
UN201705010341,"2017-05-01 19:36:00",永康區,違規停車,違規停車,"永康區永正路103號對面 違規停車",710台灣台南市永康區永正路103號對面,23.0282768,120.2537519
UN201705010342,"2017-05-01 19:37:00",東區,違規停車,違規停車,"東區東門路二段158巷40號旁巷子 違停",臺南市東區東門路二段158巷40號,22.984808,120.220532
UN201705010343,"2017-05-01 19:40:00",永康區,違規停車,違規停車,永康區永正路103號對面違規停車,710台灣台南市永康區永正路103號對面,23.0278842,120.253842
UN201705010346,"2017-05-01 19:44:00",歸仁區,路燈故障,9盞以下路燈故障,"歸仁區中山路二段24號 路燈不亮",臺南市歸仁區中山路二段24號,22.966972,120.293264
UN201705010348,"2017-05-01 19:56:00",新市區,違規停車,違規停車,新市區中正路違規停車,新市區中正路,23.0747826,120.291444
UN201705010349,"2017-05-01 19:44:00",七股區,路燈故障,9盞以下路燈故障,"七股區176市道 路燈編號0066、0068  路燈不亮","臺南市七股區176市道 路燈編號",23.131649,120.144793
UN201705010354,"2017-05-01 20:17:00",善化區,髒亂及汙染,空氣汙染,"善化區興農路461號附近  空氣汙染",臺南市善化區興農路461號,23.129802,120.268435
UN201705010356,"2017-05-01 20:28:00",學甲區,噪音舉發,場所連續噪音,"學甲區濟生路3巷1號旁，木工廠 噪音",臺南市學甲區濟生路3巷1號,23.231392,120.187746
UN201705010358,"2017-05-01 20:46:00",北區,違規停車,違規停車,"北區開元路72號開元路橋下 違規停車",北區開元路72號,23.0061072,120.2172332
UN201705010363,"2017-05-01 20:57:00",東區,違規停車,違規停車,"東區東門路二段158巷40號前  違停",臺南市東區東門路二段158巷40號,22.984808,120.220532
UN201705010366,"2017-05-01 21:17:00",東區,違規停車,違規停車,"東區東門路二段158巷40號 違停",東區東門路二段158巷40號,22.9848566,120.2206883
UN201705010368,"2017-05-01 21:22:00",安平區,髒亂及汙染,空氣汙染,"安平區建平六街98號 空污",臺南市安平區建平六街98號,22.987416,120.18316
UN201705010369,"2017-05-01 21:37:00",安南區,路燈故障,9盞以下路燈故障,"安南區北安路三段278號至威妮斯汽車旅館 路燈不亮",安南區北安路三段278號,23.0437644,120.2049678
UN201705010370,"2017-05-01 21:25:00",北區,髒亂及汙染,空氣汙染,"北區育德路225巷17號  空汙",臺南市北區育德路225巷17號,23.011504,120.20579
UN201705010376,"2017-05-01 22:24:00",鹽水區,髒亂及汙染,空氣汙染,"鹽水區歡雅里倒茄苳22號附近  空汙",臺南市鹽水區歡雅里倒茄苳22號,23.283924,120.243181
