UN201705210024,"2017-05-21 08:33:00",新市區,違規停車,違規停車,"新市區華興街86號 違規停車",臺南市新市區華興街86號,23.076977,120.29302
UN201705210027,"2017-05-21 08:42:00",北區,噪音舉發,場所連續噪音,"北區佑民街111號  噪音舉發",臺南市北區佑民街111號,22.999931,120.206941
UN201705210030,"2017-05-21 08:53:00",安平區,噪音舉發,妨害安寧,"安平區世平路1號 台南海事   路跑噪音",臺南市安平區世平路1號,22.994424,120.151027
UN201705210031,"2017-05-21 08:54:00",中西區,道路維修,路面坑洞,"中西區南華街22號邊 路面坑洞",臺南市中西區南華街22號,22.989115,120.191287
UN201705210032,"2017-05-21 09:00:00",安平區,噪音舉發,場所連續噪音,"安平區世平路1號 台南海事   路跑噪音",臺南市安平區世平路1號,22.994424,120.151027
UN201705210035,"2017-05-21 09:05:00",安平區,噪音舉發,妨害安寧,"安平區世平路1號 台南海事   路跑噪音",臺南市安平區世平路1號,22.994424,120.151027
UN201705210037,"2017-05-21 09:10:00",新市區,路燈故障,9盞以下路燈故障,"新市區中正路195巷16號前方  路燈",臺南市新市區中正路195巷16號,23.07618,120.290366
UN201705210038,"2017-05-21 09:15:00",新市區,違規停車,違規停車,"新市區中正路 違規停車",新市區中正路,23.0425292,120.3053191
UN201705210039,"2017-05-21 09:16:00",安平區,噪音舉發,妨害安寧,"安平區世平路1號 台南海事   路跑噪音",臺南市安平區世平路1號,22.994424,120.151027
UN201705210040,"2017-05-21 09:17:00",安平區,違規停車,違規停車,"安平區世平五街與世平五街40巷交叉口 違規停車",安平區世平五街40巷,22.9969814,120.1473644
UN201705210042,"2017-05-21 09:17:00",安平區,噪音舉發,妨害安寧,"安平區世平路1號 台南海事   路跑噪音",臺南市安平區世平路1號,22.994424,120.151027
UN201705210044,"2017-05-21 09:25:00",安南區,違規停車,違規停車,"安南區安中路四段3號-87號 違規停車",臺南市安南區安中路四段3號,23.05044,120.173457
UN201705210045,"2017-05-21 09:32:00",中西區,違規停車,違規停車,"中西區公園路96號 違規停車",中西區公園路96號,22.997471,120.206348
UN201705210049,"2017-05-21 09:40:00",永康區,違規停車,違規停車,"永康區鹽行里仁愛街108巷與仁愛街108巷71弄交叉口 違規停車",永康區鹽行里仁愛街108巷71弄,23.041356,120.2368389
UN201705210054,"2017-05-21 09:57:00",歸仁區,噪音舉發,場所連續噪音,"歸仁區大廟里大廟五街26巷20弄12號對面 噪音",臺南市歸仁區大廟里大廟五街26巷20弄12號,22.997351,120.277792
UN201705210057,"2017-05-21 10:02:00",永康區,髒亂及汙染,空氣汙染,"永康區仁愛街103巷30號 髒亂及汙染",臺南市永康區仁愛街103巷30號,23.045442,120.238597
UN201705210060,"2017-05-21 09:50:00",中西區,動物救援,犬貓急難救援,"中西區民生路一段16號 貓咪",中西區民生路一段16號,22.9882829,120.192186
UN201705210066,"2017-05-21 10:30:00",中西區,違規停車,違規停車,"中西區慶中街與南寧街口 違規停車",中西區慶中街南寧街口周遭,22.984532,120.2054246
UN201705210067,"2017-05-21 10:30:00",中西區,動物救援,犬貓急難救援,"中西區民生路一段18號 犬貓急難救援",臺南市中西區民生路一段18號,22.993107,120.204249
UN201705210068,"2017-05-21 10:43:00",北區,噪音舉發,妨害安寧,"北區公園路1092巷30弄10號 噪音舉發",臺南市北區公園路1092巷30弄10號,23.018877,120.217226
UN201705210076,"2017-05-21 11:38:00",北區,騎樓舉發,騎樓舉發,"北區文賢路363號 騎樓舉發",臺南市北區文賢路363號,23.00773,120.193557
UN201705210077,"2017-05-21 11:35:00",下營區,道路維修,路面坑洞,"下營區中山路一段413巷與174縣道，松根資源回收場旁 坑洞",下營區中山路一段413巷174縣道,23.2424619,120.2723746
UN201705210081,"2017-05-21 12:01:00",安南區,噪音舉發,妨害安寧,安南區理安街139號噪音舉發,安南區理安街139號,23.0507859,120.21527
UN201705210090,"2017-05-21 12:33:00",中西區,違規停車,違規停車,中西區公園路96號違規停車,中西區公園路96號,22.997471,120.206348
UN201705210093,"2017-05-21 12:44:00",中西區,違規停車,違規停車,中西區民族路二段76號違規停車,中西區民族路二段76號,22.994673,120.209333
UN201705210095,"2017-05-21 12:49:00",永康區,違規停車,違規停車,"永康區鹽行里中正七街226號前方 違規停車",臺南市永康區鹽行里中正七街226號,23.043649,120.240468
UN201705210096,"2017-05-21 12:49:00",中西區,違規停車,違規停車,中西區民族路二段76號/95號違規停車,臺南市中西區民族路二段76號,22.994726,120.20925
UN201705210097,"2017-05-21 12:50:00",永康區,違規停車,違規停車,"永康區鹽行里中正北路56之1號 違規停車",永康區鹽行里中正北路56之1號（麥當勞）,23.0413658,120.2396939
UN201705210100,"2017-05-21 13:05:00",東區,違規停車,違規停車,"東區東寧路201巷30-6號 違規停車",臺南市東區東寧路201巷30-6號,22.992005,120.225865
UN201705210101,"2017-05-21 13:10:00",玉井區,違規停車,違規停車,"玉井區中正路農會 違規停車",玉井區中正路,23.155423,120.488585
UN201705210105,"2017-05-21 13:19:00",中西區,髒亂及汙染,空氣汙染,"中西區民權路一段110號 空汙",中西區民權路一段110號,22.9904767,120.2093465
UN201705210107,"2017-05-21 13:25:00",玉井區,噪音舉發,妨害安寧,"玉井區中正路100號附近 妨礙噪音",臺南市玉井區中正路100號,23.124039,120.461409
UN201705210109,"2017-05-21 14:03:00",安南區,髒亂及汙染,其他汙染舉發,"安南區北安路二段536號 排放廢水",安南區北安路二段536號,23.0317911,120.204554
UN201705210114,"2017-05-21 14:11:00",南區,噪音舉發,場所連續噪音,"南區金華路一段484巷244弄30號 場所連續噪音",臺南市南區金華路一段484巷244弄30號,22.968261,120.194631
UN201705210121,"2017-05-21 15:14:00",永康區,騎樓舉發,騎樓舉發,"永康區小東路513號 騎樓舉發",臺南市永康區小東路513號,22.998719,120.236233
UN201705210122,"2017-05-21 15:26:00",永康區,違規停車,違規停車,"永康區鹽行里三村一街與中正北路19巷交叉口 違規停車",永康區鹽行里三村一街,23.0433938,120.2375535
UN201705210127,"2017-05-21 15:27:00",:新市區,民生管線,電信孔蓋鬆動、電信線路掉落、電信桿傾倒,":新市區南科國小旁 民生管線",臺南市新市區三舍里大順六路12巷6號,23.106076,120.291115
UN201705210135,"2017-05-21 15:59:00",東區,違規停車,違規停車,"東區東寧路122號 違規停車",台南市東區東寧路122號,22.9918833,120.2218139
UN201705210138,"2017-05-21 16:14:00",中西區,違規停車,違規停車,"中西區樹林街二段31號南大附小門口人行道 違規停車",臺南市中西區樹林街二段31號,22.985972,120.208999
UN201705210142,"2017-05-21 16:40:00",歸仁區,噪音舉發,妨害安寧,"歸仁區文化街三段70號附近 妨害安寧",臺南市歸仁區文化街三段70號,22.970915,120.286361
UN201705210149,"2017-05-21 16:56:00",北區,路燈故障,9盞以下路燈故障,"北區成功路22巷18弄112號 路燈",臺南市北區成功路22巷18弄112號,22.998705,120.209587
UN201705210161,"2017-05-21 17:25:00",中西區,違規停車,違規停車,"中西區府緯街70號、68號 違規停車",臺南市中西區府緯街70號,22.983986,120.19822
UN201705210168,"2017-05-21 17:55:00",南區,髒亂及汙染,道路散落物,"南區德南街14號 道路散落物",臺南市南區德南街14號,22.987577,120.189118
UN201705210180,"2017-05-21 18:45:00",中西區,違規停車,違規停車,"中西區西華南街57號旁邊 違規停車",臺南市中西區西華南街57號,22.994192,120.209412
UN201705210181,"2017-05-21 18:45:00",中西區,違規停車,違規停車,"中西區民族路二段133號 違規停車",臺南市中西區民族路二段133號,22.994878,120.207797
UN201705210184,"2017-05-21 18:53:00",永康區,路燈故障,9盞以下路燈故障,"永康區大橋三街25號 路燈傾斜",臺南市永康區大橋三街25號,23.0169,120.224254
UN201705210187,"2017-05-21 19:02:00",將軍區,民生管線,漏水、停水、消防栓漏水或損壞,"將軍區苓和里苓和1-15號 民生管線",臺南市將軍區苓和里苓和1-15號,23.22441,120.17196
UN201705210191,"2017-05-21 19:14:00",北區,違規停車,違規停車,"北區北園街124巷19號 違規停車",臺南市北園街124巷19號,23.014256,120.223321
UN201705210193,"2017-05-21 19:15:00",安南區,噪音舉發,妨害安寧,"安南區公學路四段122巷96弄4號 妨害安寧",臺南市安南區公學路四段122巷96弄4號,23.070228,120.176499
UN201705210197,"2017-05-21 19:29:00",中西區,違規停車,違規停車,"中西區民族路二段133號 違規停車",臺南市民族路二段133號,22.994878,120.207797
UN201705210200,"2017-05-21 19:37:00",南區,違規停車,違規停車,"南區健康路二段346號 違規停車",臺南市南區健康路二段346號,22.982051,120.187903
