UN201705150011,"2017-05-15 05:44:00",左鎮區,民生管線,漏水、停水、消防栓漏水或損壞,水管破裂,臺南市左鎮區榮和里61-1號,23.064326,120.38815
UN201705150012,"2017-05-15 05:50:00",白河區,動物救援,犬貓急難救援,"白河區汴頭里房子林21-20號 狗受困",臺南市白河區汴頭里房子林21-20號,23.36513,120.453208
UN201705150023,"2017-05-15 07:30:00",中西區,違規停車,違規停車,"中西區開山路29巷 違規停車",中西區開山路29巷,22.9916584,120.2061556
UN201705150025,"2017-05-15 07:39:00",永康區,違規停車,違規停車,"永康區大灣路942巷171號 違規停車",臺南市永康區大灣路942巷171號,23.002845,120.255894
UN201705150026,"2017-05-15 07:40:00",安南區,動物救援,犬貓急難救援,"安南區安中路一段837號前方 狗受傷",臺南市安南區安中路一段837號,23.044625,120.192538
UN201705150041,"2017-05-15 08:12:00",北區,違規停車,違規停車,"北區小東路423巷1號 違停",臺南市北區小東路423巷1號,22.999236,120.232674
UN201705150044,"2017-05-15 08:24:00",中西區,違規停車,違規停車,"中西區民族路二段63號 違規停車",臺南市民族路二段63號,22.994306,120.209873
UN201705150047,"2017-05-15 08:29:00",安平區,違規停車,違規停車,"安平區同平路96巷18號 違規停車",臺南市安平區同平路96巷18號,22.997119,120.152513
UN201705150049,"2017-05-15 08:29:00",中西區,違規停車,違規停車,"中西區北門路一段109號前至衛民街口 違規停車",臺南市中西區北門路一段109號,22.993371,120.211519
UN201705150065,"2017-05-15 08:51:00",南區,民生管線,停電、漏電、電線掉落、孔蓋鬆動,"南區健康路一段133巷54號前面右邊 台電孔蓋鬆動",臺南市南區健康路一段133巷54號,22.979406,120.208801
UN201705150075,"2017-05-15 09:12:00",永康區,違規停車,違規停車,"永康區新中街63號斜對面公車停靠站    違規停車",臺南市永康區新中街63號,23.036241,120.240054
UN201705150076,"2017-05-15 09:13:00",永康區,違規停車,違規停車,"永康區新民街218巷接新中街轉角   違規停車",永康區新民街218巷接新中街轉角,23.040388,120.24038
UN201705150084,"2017-05-15 09:27:00",南區,民生管線,漏水、停水、消防栓漏水或損壞,南區大同路二段430巷7弄3號和5號之間路邊冒水,臺南市南區大同路二段430巷7弄3號,22.973502,120.213761
UN201705150100,"2017-05-15 10:00:00",南區,交通運輸,交通疏導,"南區台十七線上86號快速道路前 交通疏導",臺南市南區台十七線上86號,22.931627,120.177812
UN201705150102,"2017-05-15 10:05:00",北區,違規停車,違規停車,"北區北門路三段35號 違規停車",704台灣台南市北區北門路三段35號,23.0135387,120.2171479
