UN201705190104,"2017-05-19 10:45:00",中西區,噪音舉發,場所連續噪音,"中西區尊王路176巷9號 噪音",臺南市中西區尊王路176巷9號,22.992847,120.192471
UN201705190110,"2017-05-19 11:02:00",北區,違規停車,違規停車,"北區文賢一路130號 違停",臺南市北區文賢一路130號,23.009072,120.196092
UN201705190120,"2017-05-19 11:21:00",中西區,違規停車,違規停車,"中西區民生路二段279號 違停",臺南市中西區民生路二段279號,22.996558,120.191812
UN201705190122,"2017-05-19 11:27:00",安平區,違規停車,違規停車,"安平區華平路656號 違規停車",臺南市安平區華平路656號,22.995837,120.175938
UN201705190128,"2017-05-19 11:37:00",安平區,違規停車,違規停車,"安平區華平路658號 違規停車",臺南市安平區華平路658號,22.995893,120.17588
UN201705190138,"2017-05-19 11:55:00",中西區,交通運輸,佔用道路,"中西區國華街三段25號對面 佔用道路",臺南市中西區國華街三段25號,22.993979,120.197501
UN201705190144,"2017-05-19 12:04:00",東區,髒亂及汙染,市區道路路面油漬,"東區崇善路740號對面 市區道路路面油漬",臺南市東區崇善路740號,22.966531,120.232195
UN201705190145,"2017-05-19 12:09:00",永康區,違規停車,違規停車,"永康區鹽行里中正七街232號 違規停車",臺南市永康區鹽行里中正七街232號,23.0438,120.240422
UN201705190146,"2017-05-19 12:11:00",永康區,違規停車,違規停車,"永康區鹽行里中正七街218號 違規停車",臺南市永康區鹽行里中正七街218號,23.043507,120.240432
UN201705190148,"2017-05-19 12:15:00",永康區,違規停車,違規停車,"永康區鹽行里三村一街138巷92弄41號  違規停車",臺南市永康區鹽行里三村一街138巷92弄41號,23.044046,120.240852
UN201705190151,"2017-05-19 12:26:00",北區,違規停車,違規停車,"北區勝利路268之1號 違規停車",704台灣台南市北區勝利路268之1號,23.0057785,120.2188047
UN201705190158,"2017-05-19 13:06:00",中西區,違規停車,違規停車,"中西區廣慈街 違規停車",中西區廣慈街,22.996990409195639,120.20733143016355
UN201705190166,"2017-05-19 13:20:00",東區,違規停車,違規停車,"東區大學路西段51跟53號 違規停車",臺南市東區大學路西段51號,22.9963,120.217149
UN201705190168,"2017-05-19 13:24:00",北區,髒亂及汙染,空氣汙染,"北區正覺街11號 空氣污染",臺南市北區正覺街11號,23.015403,120.21276
UN201705190174,"2017-05-19 13:33:00",東區,違規停車,違規停車,"東區青年路443號 違規停車",臺南市東區青年路443號,22.991308,120.216671
UN201705190176,"2017-05-19 13:38:00",仁德區,髒亂及汙染,道路散落物,"仁德區太子路300號前 道路散落物",臺南市仁德區太子路300號,22.991401,120.258702
UN201705190179,"2017-05-19 13:47:00",永康區,違規停車,違規停車,"永康區中華路，台灣企銀周邊 紅線違停",臺南市永康區中華路12號,23.000058,120.235058
UN201705190182,"2017-05-19 13:49:00",北區,髒亂及汙染,空氣汙染,"北區正覺街9號 空氣污染",臺南市北區正覺街9號,23.015343,120.212712
UN201705190188,"2017-05-19 14:02:00",安南區,違規停車,違規停車,"安南區海佃路四段388巷59號旁邊 違停",臺南市安南區海佃路四段388巷59號,23.064829,120.176105
UN201705190193,"2017-05-19 14:11:00",新市區,違規停車,違規停車,"新市區仁愛街251號 違規停車",臺南市新市區仁愛街251號,23.076533,120.293581
UN201705190200,"2017-05-19 14:24:00",南區,髒亂及汙染,空氣汙染,"南區新都路256巷1號 南區新都路256巷293號 空汙",臺南市南區新都路256巷1號,22.969053,120.198465
UN201705190201,"2017-05-19 14:31:00",東區,違規停車,違規停車,"東區青年路293巷45號 違規停車",701台灣台南市東區青年路293巷45號,22.9917654,120.2139549
UN201705190206,"2017-05-19 14:35:00",永康區,騎樓舉發,騎樓舉發,"永康區小東路513號 騎樓舉發",永康區小東路513號,22.9986693,120.2362472
UN201705190216,"2017-05-19 15:19:00",永康區,違規停車,違規停車,"永康區中正七街三村一街及三村一街138巷 違規停車",永康區中正七街三村一街,23.0433938,120.2375535
UN201705190221,"2017-05-19 15:23:00",安南區,路燈故障,9盞以下路燈故障,"安南區府安路五段11巷108號  府安路五段11巷77弄35號  路燈不亮",臺南市安南區府安路五段11巷108號,23.027007,120.204488
UN201705190225,"2017-05-19 15:26:00",中西區,噪音舉發,妨害安寧,"中西區西賢一街103號  妨礙安寧",臺南市中西區西賢一街103號,23.001888,120.177473
UN201705190229,"2017-05-19 15:37:00",安南區,動物救援,犬貓急難救援,"安南區安通路5段81-100號  動物救援",臺南市安南區安通路5段81-100號,23.029901,120.199977
UN201705190236,"2017-05-19 16:12:00",北區,交通運輸,佔用道路,"北區自強街87號，新聯源中藥行 佔用巷道和人行道翻新",臺南市北區自強街87號,23.000863,120.202993
UN201705190242,"2017-05-19 16:30:00",柳營區,違規停車,違規停車,"柳營區中山東路二段1116號 違規停車",臺南市柳營區中山東路二段1116號,23.279881,120.329703
UN201705190243,"2017-05-19 16:33:00",東區,交通運輸,佔用道路,"東區崇德路361號 佔用道路",臺南市東區崇德路361號,22.976827,120.223793
UN201705190244,"2017-05-19 16:33:00",東區,路燈故障,9盞以下路燈故障,"東區崇德十七街103號前方 路燈",臺南市東區崇德十七街103號,22.969297,120.229921
UN201705190249,"2017-05-19 16:56:00",中西區,違規停車,違規停車,"中西區北門路一段123巷36号 違規停車",中西區北門路一段123巷36号,22.996027,120.211779
UN201705190250,"2017-05-19 16:57:00",東區,違規停車,違規停車,"東區北門路一段294號 違規停車",東區北門路一段294號,22.9955864,120.212087
UN201705190253,"2017-05-19 17:02:00",永康區,違規停車,違規停車,"永康區中山南路119巷53號對面 違規停車",臺南市中山南路119巷53號,23.013825,120.230052
UN201705190258,"2017-05-19 17:32:00",中西區,違規停車,違規停車,"中西區西華南街26號 違規停車",臺南市西華南街26號,22.99369,120.20951
UN201705190261,"2017-05-19 17:41:00",南區,違規停車,違規停車,"南區西門路一段539號前 違規停車",臺南市西門路一段539號,22.983469,120.197381
UN201705190265,"2017-05-19 17:51:00",中西區,違規停車,違規停車,"中西區衛民街68號 違規停車",臺南市衛民街68號,22.993015,120.210006
UN201705190269,"2017-05-19 17:59:00",鹽水區,民生管線,電信孔蓋鬆動、電信線路掉落、電信桿傾倒,電信孔蓋鬆動、電信線路掉落、電信桿傾倒,臺南市鹽水區北門路9巷47號,23.324843,120.270723
UN201705190271,"2017-05-19 18:02:00",安平區,民生管線,漏水、停水、消防栓漏水或損壞,"安平區育平一街62號門口. 漏水、停水、消防栓漏水或損壞",臺南市安平區育平一街62號,22.98583,120.165076
UN201705190275,"2017-05-19 18:11:00",中西區,違規停車,違規停車,"中西區北門路一段和北門路一段161巷口 違規停車",中西區北門路一段和北門路一段161巷口,22.9958628,120.2115685
UN201705190278,"2017-05-19 18:19:00",中西區,違規停車,違規停車,中西區民族路二段76/95號的公車站有違規停車,"臺南市中西區民族 路二段76號",22.994726,120.20925
UN201705190285,"2017-05-19 18:43:00",北區,違規停車,違規停車,"北區臨安路二段264號 違規停車",北區臨安路二段264號,23.0040169,120.2008261
UN201705190289,"2017-05-19 18:56:00",北區,違規停車,違規停車,北區長榮路四段135巷違規停車,台南市北區長榮路四段135巷,23.0053421,120.222557
UN201705190291,"2017-05-19 18:51:00",南區,違規停車,違規停車,"南區新都路376號、378號  違停",臺南市南區新都路376號,22.96731,120.195193
UN201705190294,"2017-05-19 19:05:00",安平區,噪音舉發,妨害安寧,"安平區安平路183號旁  妨礙安寧",臺南市安平區安平路183號,23.000094,120.160815
UN201705190295,"2017-05-19 19:08:00",善化區,違規停車,違規停車,"善化區中山路468號 違規停車",臺南市善化區中山路468號,23.132515,120.290097
UN201705190296,"2017-05-19 19:11:00",永康區,違規停車,違規停車,永康區二王路6號對面違規停車,710台灣台南市永康區二王路6號對面,23.0204222,120.2487825
UN201705190307,"2017-05-19 19:49:00",東區,違規停車,違規停車,東區中華東路三段34號違規停車,臺南市東區中華東路三段34號,22.980461,120.228579
UN201705190311,"2017-05-19 20:00:00",永康區,路燈故障,9盞以下路燈故障,"永康區鹽行里中正南路652號（鹽行星巴克外面附近）， 路燈故障",臺南市永康區鹽行里中正南路652號,23.03878,120.234449
UN201705190321,"2017-05-19 20:15:00",北區,違規停車,違規停車,"北區南園街127巷19號旁 違規停車",臺南市北區南園街127巷19號,23.007217,120.226253
UN201705190327,"2017-05-19 20:46:00",歸仁區,噪音舉發,妨害安寧,"歸仁區國光街91號 妨礙安寧",歸仁區國光街91號,22.9700552,120.2914026
UN201705190332,"2017-05-19 21:08:00",北區,違規停車,違規停車,"北區公園路291號 違規停車",704台灣台南市北區公園路291號,23.0025859,120.2096636
UN201705190333,"2017-05-19 21:12:00",南區,違規停車,違規停車,"南區新都路378號和376號前 違停機車道",臺南市南區新都路378號,22.967294,120.195154
UN201705190335,"2017-05-19 21:31:00",永康區,違規停車,違規停車,"永康區中華西街122巷45號對面,旁邊以及安康公園前 違規停車",臺南市永康區中華西街122巷45號,23.015734,120.228021
UN201705190339,"2017-05-19 21:58:00",永康區,違規停車,違規停車,違規停車,710台灣台南市永康區忠勇街9號,22.999071644250023,120.23805566132069
UN201705190340,"2017-05-19 21:58:00",中西區,路燈故障,9盞以下路燈故障,"中西區民族路二段208巷 路燈故障",中西區民族路二段208巷,22.9964658,120.2033662
UN201705190343,"2017-05-19 22:25:00",北區,違規停車,違規停車,北區文賢二街101巷51號,臺南市北區文賢二街101巷51號,23.007841,120.196837
UN201705190344,"2017-05-19 22:32:00",安南區,路燈故障,10盞以上路燈故障,"安南區十二佃路 路燈故障",安南區十二佃路,23.0689337,120.1725399
UN201705200006,"2017-05-20 04:47:00",安南區,髒亂及汙染,道路散落物,"安南區安吉路一段547號 路面散落物",臺南市安南區安吉路一段547號,23.050438,120.189106
UN201705200012,"2017-05-20 07:14:00",北區,民生管線,漏水、停水、消防栓漏水或損壞,"北區北安路一段291號 民生管線",臺南市北區北安路一段291號,23.019778,120.206187
UN201705200016,"2017-05-20 07:33:00",北區,違規停車,違規停車,"北區公園路589號 違規停車",臺南市北區公園路589號,23.011407,120.210957
UN201705200022,"2017-05-20 08:02:00",永康區,違規停車,違規停車,"永康區中華路155巷40號 違規停車",710台灣台南市永康區中華路155巷40號,23.00283770544734,120.23410904232433
UN201705200024,"2017-05-20 08:05:00",善化區,違規停車,違規停車,"善化區永福路37號  違規停車",臺南市善化區永福路37號,23.130272,120.292833
UN201705200025,"2017-05-20 08:04:00",中西區,違規停車,違規停車,"中西區府前路一段277號旁 違停",中西區府前路一段277號旁,22.989432,120.2023628
UN201705200029,"2017-05-20 09:14:00",東區,噪音舉發,妨害安寧,"東區前鋒路129號 妨害安寧",臺南市東區前鋒路129號,22.993782,120.213032
UN201705200050,"2017-05-20 10:01:00",北區,違規停車,違規停車,"北區南園街101巷34弄41-43號 違規停車",臺南市北區南園街101巷34弄41-43號,23.00903,120.227715
UN201705200051,"2017-05-20 10:03:00",中西區,違規停車,違規停車,"中西區南寧街2號周遭 違規停車",臺南市中西區南寧街2號,22.984546,120.205477
UN201705200057,"2017-05-20 09:48:00",東區,髒亂及汙染,其他汙染舉發,"東區富農街二段65巷10號 其他汙染舉發",臺南市東區富農街二段65巷10號,22.986819,120.235219
UN201705200063,"2017-05-20 10:40:00",安南區,髒亂及汙染,環境髒亂,"安南區安和路一段220巷25號後方 環境髒亂",臺南市安南區安和路一段220巷25號,23.03121,120.213557
UN201705200072,"2017-05-20 11:15:00",永康區,交通運輸,佔用道路,"永康區中華路212巷2號 佔用道路",臺南市永康區中華路212巷2號,23.004557,120.236202
UN201705200075,"2017-05-20 11:24:00",永康區,髒亂及汙染,空氣汙染,"永康區仁愛街103巷30號 空氣污染",臺南市仁愛街103巷30號,23.045442,120.238597
UN201705200079,"2017-05-20 11:33:00",中西區,髒亂及汙染,空氣汙染,"中西區民權路三段169號對面 空氣汙染",臺南市中西區民權路三段169號,22.997277,120.195709
UN201705200082,"2017-05-20 11:49:00",新營區,違規停車,違規停車,"新營區新進路二段90號 違規停車",730台灣台南市新營區新進路二段90號,23.300555938981780,120.31091776651760
UN201705200093,"2017-05-20 12:11:00",中西區,違規停車,違規停車,"中西區民族路二段8號到48號 違規停車",臺南市中西區民族路二段48號,22.994597,120.210777
UN201705200094,"2017-05-20 12:10:00",安平區,髒亂及汙染,其他汙染舉發,"安平區華平路615號旁 其他汙染舉發",臺南市安平區華平路615號,22.996358,120.175274
UN201705200095,"2017-05-20 12:13:00",中西區,違規停車,違規停車,"中西區民族路二段63號 違規停車",臺南市中西區民族路二段63號,22.994306,120.209873
UN201705200097,"2017-05-20 12:13:00",中西區,違規停車,違規停車,"中西區西華南街38號 違規停車",臺南市中西區西華南街38號,22.993886,120.209524
UN201705200100,"2017-05-20 12:25:00",中西區,違規停車,違規停車,"中西區衛民街106至50號 違規停車",臺南市中西區衛民街106號,22.993151,120.209223
UN201705200101,"2017-05-20 12:28:00",中西區,違規停車,違規停車,"中西區西門路二段387號 郡緯街轉角 違規停車",臺南市中西區西門路二段387號,22.998515,120.200417
UN201705200110,"2017-05-20 12:50:00",永康區,道路維修,路面坑洞,"永康區大灣東路139號 路面坑洞",臺南市永康區大灣東路139號,22.999776,120.264097
UN201705200112,"2017-05-20 12:50:00",中西區,違規停車,違規停車,"中西區大同路一段74號 違規停車",臺南市中西區大同路一段74號,22.986866,120.211193
UN201705200113,"2017-05-20 12:54:00",南區,違規停車,違規停車,"南區金華路二段30號 違規停車",臺南市南區金華路二段30號,22.976189,120.191213
UN201705200114,"2017-05-20 12:54:00",北區,噪音舉發,妨害安寧,"北區富北街11號 2F3F 噪音舉發",臺南市北區富北街11號,22.998951,120.211372
UN201705200117,"2017-05-20 13:00:00",永康區,違規停車,違規停車,"永康區中山東路292巷29號 違規停車",臺南市永康區中山東路292巷29號,23.010012,120.236536
UN201705200118,"2017-05-20 12:59:00",仁德區,髒亂及汙染,環境髒亂,"仁德區德崙路370巷21弄6號 建築廢棄物和垃圾包",臺南市仁德區德崙路370巷21弄6號,22.941548,120.259326
UN201705200120,"2017-05-20 13:07:00",南區,違規停車,違規停車,"南區大同路二段706號 違規停車",臺南市南區大同路二段706號,22.966914,120.215776
UN201705200126,"2017-05-20 13:30:00",中西區,違規停車,違規停車,"中西區西門路二段120號周遭 違規停車",臺南市中西區西門路二段120號,22.993599,120.19905
UN201705200135,"2017-05-20 13:56:00",南區,交通運輸,佔用道路,"南區金華路一段484巷220弄1號 佔用道路",臺南市南區金華路一段484巷220弄1號,22.969157,120.194714
UN201705200137,"2017-05-20 14:04:00",安南區,噪音舉發,場所連續噪音,"安南區府安路五段157巷22弄15號 噪音舉發",臺南市安南區府安路五段157巷22弄15號,23.024053,120.198173
UN201705200138,"2017-05-20 14:06:00",中西區,違規停車,違規停車,"中西區永福路一段82號 違規停車",臺南市永福路ㄧ段82號,23.129977,120.29145
UN201705200146,"2017-05-20 12:05:00",東區,道路維修,路樹傾倒,"東區府東街276號旁 路樹傾倒",臺南市東區府東街276號,22.987517,120.211952
UN201705200147,"2017-05-20 13:42:00",永康區,騎樓舉發,騎樓舉發,"永康區小東路513號 騎樓舉發",臺南市永康區小東路513號,22.998719,120.236233
UN201705200153,"2017-05-20 14:52:00",東區,違規停車,違規停車,"東區青年路316號 違規停車",701台灣台南市東區青年路316號,22.9913133,120.2138116
UN201705200154,"2017-05-20 14:37:00",中西區,髒亂及汙染,環境髒亂,"中西區五妃街107號 環境髒亂",臺南市中西區五妃街107號,22.982491,120.208341
UN201705200155,"2017-05-20 14:58:00",東區,違規停車,違規停車,"東區青年路305號 違規停車",701台灣台南市東區青年路305號,22.9914622,120.2139017
UN201705200157,"2017-05-20 14:59:00",玉井區,違規停車,違規停車,"玉井區中正路139號附近 違停",玉井區中正路139號附近,23.125038,120.462337
UN201705200163,"2017-05-20 15:28:00",玉井區,交通運輸,佔用道路,"玉井區農會中正路 佔用道路",玉井區中正路農會,23.125038,120.462337
UN201705200164,"2017-05-20 15:28:00",北區,噪音舉發,妨害安寧,"北區文成五街178號 妨害安寧",臺南市北區文成五街178號,23.01832,120.202763
UN201705200171,"2017-05-20 15:51:00",將軍區,噪音舉發,妨害安寧,"將軍區將貴里將榮45之2號 妨礙安寧",臺南市將貴里將榮45之2號,23.216967,120.140659
UN201705200178,"2017-05-20 16:01:00",永康區,髒亂及汙染,空氣汙染,"永康區正南一街200號，易昇鋼鐵 空氣污染",臺南市永康區正南一街200號,23.027979,120.225189
UN201705200183,"2017-05-20 16:26:00",東區,違規停車,違規停車,東區中華東路三段399巷29弄3號-13號違規停車,東區中華東路三段399巷29弄3號,22.972215457917336,120.22112118095095
UN201705200185,"2017-05-20 16:27:00",永康區,違規停車,違規停車,"永康區中華路826號 違規停車",永康區中華路826號,23.018444,120.226773
UN201705200187,"2017-05-20 16:31:00",東區,違規停車,違規停車,"東區崇明七街跟崇民路口  違停",東區崇明七街跟崇民路口,22.9795456,120.2188655
UN201705200190,"2017-05-20 16:43:00",新市區,違規停車,違規停車,"新市區中正路 違規停車",新市區中正路,23.0425292,120.3053191
UN201705200192,"2017-05-20 16:50:00",中西區,違規停車,違規停車,"中西區府前路二段與府前二街路 違規停車",中西區府前路二段府前二街路,22.991311,120.194467
UN201705200193,"2017-05-20 16:58:00",中西區,違規停車,違規停車,"中西區中正路8號到土地銀 違規停車",中西區中正路8號,22.991616,120.20194
UN201705200196,"2017-05-20 17:06:00",東區,違規停車,違規停車,"東區東寧路201巷30-6號旁紅線巷口 違規停車",臺南市東區東寧路201巷30之6號,22.991788,120.225813
UN201705200203,"2017-05-20 17:27:00",安平區,違規停車,違規停車,"安平區效忠街4之3號 違規停車",安平區效忠街4之3號,23.0015065,120.162866
UN201705200205,"2017-05-20 17:27:00",新市區,交通運輸,佔用道路,"新市區民生路2巷20號 佔用道路",臺南市新市區民生路2巷20號,23.078885,120.291506
UN201705200206,"2017-05-20 17:31:00",中西區,違規停車,違規停車,"中西區西華南街16號 違規停車",臺南市中西區西華南街16號,22.993449,120.20945
UN201705200208,"2017-05-20 17:35:00",安平區,交通運輸,佔用道路,"安平區健康三街592巷22號 佔用道路",臺南市安平區健康三街592巷22號,22.996991,120.170116
UN201705200210,"2017-05-20 17:36:00",中西區,交通運輸,佔用道路,"中西區永福路一段119號 佔用人行道",中西區永福路一段119號,22.9936666,120.202277
UN201705200216,"2017-05-20 17:46:00",新市區,動物救援,犬貓急難救援,"新市大社 7-11 社頂門市前 狗救援",臺南市新市區大社里大社710號,23.089281,120.317623
UN201705200217,"2017-05-20 17:54:00",永康區,違規停車,違規停車,"永康區勝利街一巷37號 違停與亂丟垃圾",臺南市永康區勝利街一巷37號,23.001483,120.229357
UN201705200224,"2017-05-20 18:08:00",北區,違規停車,違規停車,北區北門路三段10跟12號中間.機車停用汽車停車格,臺南市北區北門路三段10號,23.013157,120.217201
UN201705200233,"2017-05-20 18:31:00",永康區,違規停車,違規停車,"安南區安中路一段797號 妨礙出入",安南區安中路一段797號,23.042865,120.196191
UN201705200234,"2017-05-20 18:33:00",東區,違規停車,違規停車,"東區長榮路二段250號 違規停車",701台灣台南市東區長榮路二段250號,22.9904788,120.221352
UN201705200237,"2017-05-20 18:47:00",東區,違規停車,違規停車,"東區中華東路三段399巷29弄1號到11號前 違規停車",701台灣台南市東區中華東路三段399巷29弄1號到11號,22.972393261393240,120.22092806190187
UN201705200239,"2017-05-20 18:51:00",永康區,違規停車,違規停車,"永康區勝利街1巷37號  違規停車",臺南市永康區勝利街1巷37號,23.001483,120.229357
UN201705200257,"2017-05-20 19:17:00",安平區,噪音舉發,妨害安寧,"安平區安平路183號 妨害安寧",臺南市安平區安平路183號,23.000094,120.160815
UN201705200261,"2017-05-20 19:26:00",南區,違規停車,違規停車,"南區大同路二段182號 違規停車",臺南市南區大同路二段182號,22.977045,120.213456
UN201705200263,"2017-05-20 19:37:00",佳里區,違規停車,違規停車,佳里區中山路447號違規停車,佳里區中山路447號,23.165761761526653,120.17791444744751
UN201705200264,"2017-05-20 19:38:00",東區,違規停車,違規停車,違規停車,臺南市東區裕學路185巷105號,22.983183,120.236491
UN201705200268,"2017-05-20 19:50:00",善化區,噪音舉發,場所連續噪音,"善化區興安街153號 廟會噪音舉發",臺南市善化區興安街153號,23.12715,120.299807
UN201705200269,"2017-05-20 19:51:00",永康區,違規停車,違規停車,"永康區自強路368巷3弄對面 違規停車",永康區自強路368巷3弄,23.0291565,120.2534251
UN201705200275,"2017-05-20 20:18:00",南區,違規停車,違規停車,"南區體育路47號，歡喜樓對面 違停",臺南市南區體育路47號,22.980806,120.2072
UN201705200278,"2017-05-20 20:34:00",安南區,髒亂及汙染,空氣汙染,"安南區同安路344巷18號 空氣污染",臺南市安南區同安路344巷18號,23.042702,120.193143
UN201705200279,"2017-05-20 20:36:00",安平區,路燈故障,9盞以下路燈故障,"安平區健康三街546號前 路燈故障",臺南市安平區健康三街546號,22.995689,120.169588
UN201705200296,"2017-05-20 21:51:00",東區,違規停車,違規停車,東區裕學路185巷105號違規停車,臺南市東區裕學路185巷105號,22.983183,120.236491
UN201705200299,"2017-05-20 21:58:00",安平區,噪音舉發,妨害安寧,安平區育平五街57之77號社區內妨礙安寧,臺南市安平區育平五街57之77號,22.990697,120.16816
UN201705200306,"2017-05-20 22:17:00",東區,道路維修,路面坑洞,"東區長榮路三段大學路 路面坑洞",東區長榮路三段大學路,22.9959457,120.221795
UN201705200311,"2017-05-20 22:50:00",北區,違規停車,違規停車,"北區公園南路206號 違規停車",臺南市北區公園南路206號,23.001917,120.205963
UN201705200321,"2017-05-20 23:20:00",永康區,違規停車,違規停車,永康區新中街違規停車,永康區新中街,23.0376224,120.2423499
UN201705200322,"2017-05-20 23:19:00",柳營區,噪音舉發,妨害安寧,"柳營區柳營路二段480號 越美人 妨害安寧",臺南市柳營區柳營路二段480號,23.285241,120.312467
UN201705200323,"2017-05-20 23:44:00",中西區,髒亂及汙染,空氣汙染,"中西區普濟街39號  空氣汙染",臺南市中西區普濟街39號,22.998169,120.19851
UN201705210002,"2017-05-21 00:54:00",歸仁區,噪音舉發,妨害安寧,台南市歸仁區公園路196號妨礙安寧,臺南市歸仁區公園路196號,22.963642,120.295345
UN201705210003,"2017-05-21 01:01:00",東區,噪音舉發,妨害安寧,東區裕農一街裕興街妨礙安寧,東區裕農一街裕興街,22.983722,120.240015
UN201705210004,"2017-05-21 01:56:00",東區,路燈故障,9盞以下路燈故障,"東區中華東路二段77號 路燈故障",臺南市東區中華東路二段77號,22.986671,120.233675
UN201705210006,"2017-05-21 05:22:00",永康區,噪音舉發,妨害安寧,"永康區大同街320巷17號 妨礙安寧",臺南市永康區大同街320巷17號,23.013731,120.266369
UN201705210008,"2017-05-21 06:10:00",東區,違規停車,違規停車,東區裕農路360號斜對面人行道違規停車,臺南市東區裕農路360號,22.987063,120.229995
UN201705210009,"2017-05-21 06:21:00",永康區,違規停車,違規停車,710台灣台南市永康區中華路155巷40號違規停車,710台灣台南市永康區中華路155巷40號,23.00295300997433,120.23406068616826
UN201705210012,"2017-05-21 07:00:00",永康區,噪音舉發,妨害安寧,"永康區龍國街351號 廟會",臺南市永康區龍國街351號,23.032065,120.265963
UN201705210013,"2017-05-21 07:10:00",東區,違規停車,違規停車,東區裕學路185巷105號違規停車,臺南市東區裕學路185巷105號,22.983183,120.236491
UN201705210018,"2017-05-21 08:03:00",北區,噪音舉發,場所連續噪音,北區佑民街111號噪音舉發,臺南市北區佑民街111號,22.999931,120.206941
UN201705210019,"2017-05-21 08:07:00",北區,噪音舉發,妨害安寧,北區佑民街111號噪音舉發,佑民街111號,22.9999038,120.206988
