UN201706050010,"2017-06-05 05:23:00",永康區,髒亂及汙染,道路散落物,"永康區南興路63號前、仁德區長興路38號對面，汽車道上 老鼠屍和貓屍",臺南市永康區南興路63號,22.997816,120.260761
UN201706050011,"2017-06-05 05:41:00",東區,噪音舉發,妨害安寧,"東區崇德二十二街84號 妨害安寧",701台灣台南市東區崇德二十二街84號,22.9662947,120.2298725
UN201706050019,"2017-06-05 07:19:00",官田區,違規停車,違規停車,官田區工業西路違規停車,官田區工業西路,23.2113355,120.320328
UN201706050021,"2017-06-05 07:36:00",安南區,噪音舉發,場所連續噪音,"安南區功安二街73號對面 連續噪音",臺南市安南區功安二街73號,23.049512,120.180872
UN201706050031,"2017-06-05 08:07:00",安南區,髒亂及汙染,空氣汙染,"安南區本田路二段 空氣汙染",安南區本田路二段,23.036025,120.152491
UN201706050033,"2017-06-05 08:11:00",中西區,違規停車,違規停車,"中西區廣慈街停車格 違規停車",700台灣台南市中西區廣慈街,22.997453045253504,120.20749701429440
UN201706050037,"2017-06-05 08:26:00",中西區,違規停車,違規停車,"中西區青年路137巷巷口 違規停車",中西區青年路137巷,22.9927359,120.208931
UN201706050042,"2017-06-05 08:39:00",安平區,違規停車,違規停車,"安平區永華路二段495號 違規停車",永華路二段495號,22.9993643,120.1734307
UN201706050051,"2017-06-05 09:11:00",中西區,違規停車,違規停車,"中西區五妃街309巷口 違規停車",五妃街309巷,22.9821963,120.1992935
UN201706050054,"2017-06-05 09:21:00",永康區,道路維修,路面坑洞,"永康區中正南路490巷46號  坑洞",永康區中正南路490巷46號,23.3175821,120.3179027
UN201706050060,"2017-06-05 09:30:00",北區,民生管線,漏水、停水、消防栓漏水或損壞,"北區育成路317巷56弄48號 民生管線",臺南市北區育成路317巷56弄48號,23.020956,120.20333
UN201706050074,"2017-06-05 10:07:00",東區,違規停車,違規停車,"東區崇學路255號 違規停車",台南市東區崇學路255路255號,22.9796352,120.2233616
