UN201706140065,"2017-06-14 09:59:00",永康區,違規停車,違規停車,"永康區鹽行三村國小前計程車站 違規停車",永康區鹽行路2號,23.0444051,120.233646
UN201706140080,"2017-06-14 10:49:00",永康區,違規停車,違規停車,"永康區中華路12號與22號 違停",永康區中華路12號,23.0000091,120.235192
UN201706140093,"2017-06-14 11:12:00",安南區,違規停車,違規停車,"安南區總安街一段146巷85弄1號 違規停車",臺南市總安街一段146巷85弄1號,23.053696,120.215534
UN201706140100,"2017-06-14 11:47:00",東區,違規停車,違規停車,"東區崇德十九街19號 違停",東區崇德十九街19號,22.9683466,120.228332
UN201706140115,"2017-06-14 12:32:00",永康區,騎樓舉發,騎樓舉發,"永康區鹽行里中正七街78號 騎樓舉發",臺南市永康區鹽行里中正七街78號,23.040821,120.240555
UN201706140116,"2017-06-14 12:33:00",中西區,違規停車,違規停車,"中西區開山路52到90號及對面75到85號 違規停車",臺南市中西區開山路52號,22.991184,120.205957
UN201706140124,"2017-06-14 12:53:00",中西區,違規停車,違規停車,"中西區廣慈街停車格 違規停車",中西區廣慈街,22.996539224752855,120.20695811216433
UN201706140129,"2017-06-14 13:18:00",安南區,動物救援,犬貓急難救援,"安南區北汕尾三路532號 捕抓流浪狗",臺南市安南區北汕尾三路532號,23.056713,120.141395
UN201706140138,"2017-06-14 13:55:00",中西區,違規停車,違規停車,"中西區民族路二段41號到63號 違規停車",臺南市中西區民族路二段41號,22.994315,120.210621
UN201706140141,"2017-06-14 14:08:00",永康區,道路維修,路面坑洞,"永康區南灣街130號 坑洞",永康區南灣街130號,23.001588,120.252223
UN201706140146,"2017-06-14 14:32:00",東區,違規停車,違規停車,"東區東和路72號 違規停車",臺南市東區東和路72號,22.998556,120.227633
UN201706140169,"2017-06-14 15:11:00",中西區,交通運輸,佔用道路,"中西區西門路二段198號包包堂 佔用道路",臺南市中西區西門路二段198號,22.994664,120.199374
UN201706140170,"2017-06-14 15:14:00",安平區,道路維修,人孔蓋或溝蓋聲響鬆動,"安平區建平七街677號 污水蓋鬆動會有聲響",臺南市安平區建平七街677號,22.989959,120.169453
UN201706140176,"2017-06-14 15:29:00",中西區,違規停車,違規停車,"中西區青年路175號 違規停車",臺南市中西區青年路175號,22.991831,120.210413
UN201706140197,"2017-06-14 16:03:00",中西區,道路維修,路面坑洞,"中西區慶中街48號 路面坑洞",臺南市中西區慶中街48號,22.98249,120.205755
UN201706140198,"2017-06-14 16:19:00",安南區,交通運輸,佔用道路,"安南區大安街68巷27號 佔用道路",臺南市安南區大安街68巷27號,23.031208,120.192807
UN201706140207,"2017-06-14 16:57:00",後壁區,髒亂及汙染,空氣汙染,"青寮國中前面 空氣汙染",臺南市後壁區頂長里8-3號,23.368859,120.332227
UN201706140210,"2017-06-14 17:01:00",永康區,路燈故障,9盞以下路燈故障,"永康區永大路二段556巷21號 路燈故障",臺南市永康區永大路二段556巷21號,23.008594,120.263233
UN201706140216,"2017-06-14 17:23:00",中西區,違規停車,違規停車,"中西區民族路二段48號 違規停車",臺南市中西區民族路二段48號,22.994597,120.210777
UN201706140217,"2017-06-14 17:28:00",中西區,違規停車,違規停車,"中西區西華南街42號及8號 違規停車",臺南市中西區西華南街42號,22.993942,120.20955
UN201706140220,"2017-06-14 17:33:00",仁德區,違規停車,違規停車,"仁德區民安路一段435號 違規停車",臺南市仁德區民安路一段435號,22.953886,120.250662
UN201706140229,"2017-06-14 18:04:00",安平區,違規停車,違規停車,"安平區華平路656號 違規停車",臺南市安平區華平路656號,22.995837,120.175938
UN201706140230,"2017-06-14 18:11:00",南區,道路維修,路樹傾倒,"南區新孝路128號 路樹傾倒",臺南市南區新孝路128號,22.977973,120.186343
UN201706140235,"2017-06-14 18:39:00",新營區,違規停車,違規停車,"新營區忠義街2號 違規停車",730台灣台南市新營區忠義街2號,23.303048529621481,120.31224451349181
UN201706140236,"2017-06-14 18:40:00",東區,違規停車,違規停車,"東區青年路299號 違規停車",臺南市東區青年路299號,22.991516,120.213769
UN201706140243,"2017-06-14 18:50:00",安平區,違規停車,違規停車,"安平區華平路656號 違規停車",臺南市安平區華平路656號,22.995837,120.175938
UN201706140245,"2017-06-14 19:01:00",南區,交通運輸,佔用道路,"南區西門路一段513號 佔用道路",臺南市南區西門路一段513號,22.982938,120.197441
UN201706140246,"2017-06-14 19:06:00",安平區,違規停車,違規停車,"安平區慶平路386號 違規停車",臺南市安平區慶平路386號,22.997093,120.17719
UN201706140247,"2017-06-14 19:05:00",永康區,髒亂及汙染,空氣汙染,"永康區文賢街68巷1號大灣高中附近 空氣汙染",臺南市永康區文賢街68巷1號,23.00633,120.272652
UN201706140248,"2017-06-14 19:14:00",永康區,路燈故障,9盞以下路燈故障,"永康區永華路87號跟89號中間 路燈故障",臺南市永康區永華路87號,23.008123,120.259421
UN201706140251,"2017-06-14 19:33:00",新營區,路燈故障,10盞以上路燈故障,"新營區八德路17號 路燈故障",臺南市新營區八德路17號,23.30359,120.280621
UN201706140253,"2017-06-14 19:41:00",安平區,路燈故障,9盞以下路燈故障,"安平區安北路與王城路北側 路燈故障",安平區安北路與王城路,22.9999491,120.1533631
UN201706140256,"2017-06-14 20:05:00",東區,違規停車,違規停車,"東區立德十路43號 違規停車",臺南市東區立德十路43號,22.97802,120.215034
UN201706140271,"2017-06-14 21:02:00",東區,違規停車,違規停車,"東區仁和路109巷70多號 違停",臺南市東區仁和路109巷70多號,22.971621,120.235851
UN201706140281,"2017-06-14 22:22:00",東區,噪音舉發,妨害安寧,"東區崇德路508巷7號 妨害安寧",臺南市台南市崇德路508巷7號,22.973451,120.227097
UN201706140283,"2017-06-14 22:33:00",永康區,違規停車,違規停車,"永康區中華路826號 違規停車",臺南市永康區中華路826號,23.01854,120.226544
UN201706140284,"2017-06-14 22:47:00",南區,噪音舉發,妨害安寧,"南區中華西路一段155號4樓 妨害安寧",臺南市南區中華西路一段155號,22.981833,120.185705
UN201706140285,"2017-06-14 23:00:00",東區,違規停車,違規停車,"東區東寧路120巷75號 違規停車",臺南市東區東寧路120巷75號,22.990714,120.22217
UN201706150009,"2017-06-15 01:32:00",東區,噪音舉發,妨害安寧,"育樂街全家附近 妨害安寧",臺南市東區育樂街170號,22.994698,120.214658
UN201706150011,"2017-06-15 03:19:00",東區,路燈故障,9盞以下路燈故障,"東區大同路一段83號、107號前 路燈不亮",臺南市東區大同路一段83號,22.986785,120.211486
UN201706150014,"2017-06-15 05:26:00",歸仁區,噪音舉發,妨害安寧,"歸仁區民生南街二段163號對面 妨害安寧",臺南市歸仁區民生南街二段163號,22.963651,120.280673
UN201706150016,"2017-06-15 07:05:00",東區,違規停車,違規停車,東區府連路182巷22號違規停車,臺南市東區府連路182巷22號,22.984283,120.212531
UN201706150017,"2017-06-15 07:07:00",新市區,交通運輸,號誌故障,"744台灣台南市新市區大順八路 號誌故障",744台灣台南市新市區大順八路,23.1032048,120.2876804
UN201706150021,"2017-06-15 07:32:00",後壁區,髒亂及汙染,其他汙染舉發,"後壁區仕安里活動中心72號  其他汙染舉發",臺南市後壁區仕安里活動中心72號,23.352667,120.322254
UN201706150025,"2017-06-15 07:46:00",安平區,違規停車,違規停車,"安平區安平路110號跟212號 違規停車",臺南市安平區安平路110號,22.998391,120.183802
UN201706150027,"2017-06-15 07:53:00",北區,違規停車,違規停車,"北區開元路394巷11號 違規停車",臺南市北區開元路394巷11號,23.010091,120.225346
UN201706150029,"2017-06-15 07:59:00",北區,髒亂及汙染,環境髒亂,"北區北園街87巷靠近長榮路五段76巷 垃圾",北區北園街87巷長榮路五段76巷,22.9691379,120.1810714
UN201706150030,"2017-06-15 08:00:00",永康區,動物救援,遊蕩犬隻捕捉管制,"永康區復國二路114巷10號  流浪犬捕捉",永康區復國二路114巷10號,23.003156,120.260217
UN201706150034,"2017-06-15 08:15:00",安南區,違規停車,違規停車,"安南區國安街56巷17弄15號 佔用道路",臺南市安南區國安街56巷17弄15號,23.023032,120.189539
UN201706150038,"2017-06-15 08:32:00",永康區,違規停車,違規停車,"永康區廣興街38巷18號 違規停車",臺南市永康區廣興街38巷18號,23.018316,120.277728
UN201706150047,"2017-06-15 09:01:00",東區,道路維修,路面坑洞,"東區大同路一段188號對面 路面坑洞",臺南市東區大同路一段188號,22.98424,120.211329
UN201706150048,"2017-06-15 09:03:00",中西區,違規停車,違規停車,"中西區開山路52到90號及對面75到85號紅黃線 違規停車",臺南市中西區開山路52至90號,22.989829,120.20686
UN201706150054,"2017-06-15 09:18:00",安平區,髒亂及汙染,環境髒亂,"安平區建平十六街上(建平路708號側邊圍牆) 路面垃圾",臺南市安平區建平十六街上(建平路708號,22.996652,120.184529
UN201706150067,"2017-06-15 09:32:00",安南區,道路維修,路面坑洞,"安南區鹿耳門大道一段 路面坑洞",安南區鹿耳門大道一段北汕尾路三段,23.037424,120.124428
UN201706150084,"2017-06-15 10:27:00",安南區,道路維修,路面坑洞,"安南區安和路一段66號 路面坑洞",安南區安和路一段66號,23.0325221,120.21239
UN201706150101,"2017-06-15 11:03:00",北區,道路維修,路面下陷、凹陷,北區文賢路313巷34弄20號路面下陷,臺南市北區文賢路313巷34弄20號,23.007356,120.192603
UN201706150103,"2017-06-15 11:14:00",中西區,違規停車,違規停車,"中西區衛民街149/151號以及對面 違規停車",臺南市中西區衛生民主街149至151號,23.001798,120.176377
UN201706150104,"2017-06-15 11:14:00",安南區,違規停車,違規停車,安南區國安街56巷17弄13號違規停車,臺南市安南區國安街56巷17弄13號,23.023038,120.189585
UN201706150108,"2017-06-15 11:21:00",中西區,違規停車,違規停車,"中西區民權路一段232號 違規停車",臺南市中西區民權路一段232號,22.992722,120.207498
UN201706150119,"2017-06-15 11:48:00",中西區,違規停車,違規停車,"中西區金華路三段91號 違規停車",臺南市中西區金華路三段91號,22.990408,120.192366
UN201706150132,"2017-06-15 12:38:00",中西區,違規停車,違規停車,"中西區西門路一段464號到470號 違規停車",中西區西門路一段464號,22.9816531,120.197785
UN201706150137,"2017-06-15 12:30:00",北區,噪音舉發,妨害安寧,"北區北安路一段176巷57弄5號 妨礙安寧",臺南市北區北安路一段176巷57弄5號,23.018968,120.209131
UN201706150138,"2017-06-15 13:00:00",中西區,違規停車,違規停車,"中西區中山路45號以及周邊 違規停車",臺南市中西區中山路45號,22.993513,120.206355
UN201706150148,"2017-06-15 13:54:00",中西區,違規停車,違規停車,"中西區衛民街56號68號 違規停車",臺南市中西區衛民街56號,22.992987,120.210528
UN201706150169,"2017-06-15 14:46:00",永康區,違規停車,違規停車,"永康區中華路357號合作金庫永康分行 違規停車",永康區中華路357號合作金庫存,23.0085091,120.2337983
UN201706150173,"2017-06-15 15:04:00",仁德區,道路維修,寬頻管線、孔蓋損壞,"仁德區中山路883號 道路維修",臺南市仁德區中山路883號,22.973852,120.243212
UN201706150187,"2017-06-15 15:53:00",北區,違規停車,違規停車,"北區勝利路182-188號 違規停車",臺南市勝利路182-188號,22.955253,120.26358
UN201706150193,"2017-06-15 16:03:00",永康區,違規停車,違規停車,"永康區勝華街140巷5號對面 違規停車",臺南市永康區勝華街140巷5號,23.006849,120.231495
UN201706150201,"2017-06-15 16:45:00",南區,髒亂及汙染,道路散落物,"南區喜樹路151巷59弄9號 貓屍",南區喜樹路151巷59弄9號,22.9424741,120.1796513
UN201706150202,"2017-06-15 16:47:00",中西區,違規停車,違規停車,"中西區衛民街68號 違規停車",臺南市衛民街68號,22.993015,120.210006
UN201706150210,"2017-06-15 16:59:00",中西區,違規停車,違規停車,"中西區西華南街32號 違規停車",臺南市西華南街32號,22.993828,120.209542
UN201706150213,"2017-06-15 17:06:00",東區,違規停車,違規停車,"東區北門路一段132號 違規停車",臺南市東區北門路一段132號,22.992642,120.211805
UN201706150221,"2017-06-15 17:31:00",中西區,違規停車,違規停車,"中西區武聖路69巷63號 違規停車",臺南市中西區武聖路69巷63號,23.004296,120.191235
UN201706150222,"2017-06-15 17:28:00",北區,違規停車,違規停車,"北區勝利路206巷49號 違停",臺南市北區勝利路206巷49號,23.004848,120.219377
UN201706150224,"2017-06-15 17:31:00",南區,路燈故障,9盞以下路燈故障,"南區中華西路一段26巷3號 路燈故障",臺南市南區中華西路一段26巷3號,22.966645,120.184113
UN201706150225,"2017-06-15 17:36:00",佳里區,道路維修,路樹傾倒,"佳里區建南里南勢街250號 路樹倒塌",佳里區建南里南勢街250號,23.1467796,120.1764641
UN201706150227,"2017-06-15 17:36:00",東區,違規停車,違規停車,"東區府連路204巷29弄口 違停",東區府連路204巷29弄,22.9847461,120.215482
UN201706150231,"2017-06-15 17:50:00",東區,違規停車,違規停車,"東區北門路一段132號 違規停車",臺南市東區北門路一段132號,22.992642,120.211805
UN201706150233,"2017-06-15 17:52:00",中西區,違規停車,違規停車,"中西區衛民街60號到80號 違規停車",臺南市中西區衛民街60號,22.993005,120.210427
UN201706150234,"2017-06-15 18:03:00",安南區,違規停車,違規停車,"安南區安和路五段 58度c 違規停車",安南區安和路五段,23.0671765,120.2172323
UN201706150236,"2017-06-15 18:05:00",安平區,違規停車,違規停車,"安平區安平路86號^96號 違規停車",臺南市安平區安平路86號,22.99827,120.184471
UN201706150237,"2017-06-15 18:04:00",南區,道路維修,路面坑洞,"南區明興路201號 坑洞",臺南市南區明興路201號,22.95503,120.186119
UN201706150240,"2017-06-15 18:09:00",安南區,道路維修,路面坑洞,"安南區郡安路四段51號前 路面坑洞",臺南市安南區郡安路四段51號,23.028045,120.212003
UN201706150244,"2017-06-15 18:52:00",鹽水區,動物救援,犬貓急難救援,"鹽水區南門路49號 動物救援",臺南市鹽水區南門路49號,23.315357,120.267621
UN201706150246,"2017-06-15 17:16:00",安南區,髒亂及汙染,空氣汙染,"安南區興安路50號^100多號 空氣汙染",臺南市安南區興安路50號,23.041079,120.21284
UN201706150251,"2017-06-15 19:11:00",安平區,路燈故障,9盞以下路燈故障,"安平區府平路447號 路燈故障",臺南市安平區府平路447號,22.987214,120.165453
UN201706150259,"2017-06-15 19:32:00",中西區,違規停車,違規停車,"中西區西華南街32號 違規停車",臺南市西華南街32號,22.993828,120.209542
UN201706150261,"2017-06-15 19:42:00",北區,噪音舉發,妨害安寧,"北區公園路1092巷30弄10號 妨害安寧",臺南市北區公園路1092巷30弄10號,23.018877,120.217226
UN201706150274,"2017-06-15 20:38:00",龍崎區,民生管線,停電、漏電、電線掉落、孔蓋鬆動,"龍崎區土崎里尖峰17之5號 停電",臺南市龍崎區土崎里尖峰17之5號,22.991756,120.399561
UN201706150279,"2017-06-15 21:16:00",中西區,違規停車,違規停車,"中西區永福路二段99號 違規停車",臺南市台南市永福路二段99號,22.99329,120.200962
UN201706150285,"2017-06-15 22:02:00",北區,噪音舉發,妨害安寧,"北區公園路1092巷30弄10號 噪音舉發",臺南市北區公園路1092巷30弄10號,23.0185937,120.214661
UN201706150290,"2017-06-15 22:23:00",安平區,髒亂及汙染,空氣汙染,"安平區湖內二街42號 空汙",臺南市安平區湖內二街42號,22.998132,120.159111
UN201706150294,"2017-06-15 23:34:00",歸仁區,噪音舉發,妨害安寧,"歸仁區大廟一街218號 妨害安寧",711台灣台南市歸仁區大廟一街218號,22.9924438,120.2740893
UN201706160001,"2017-06-16 00:14:00",歸仁區,噪音舉發,場所連續噪音,"歸仁區保大路三段366巷60號  場所連續噪音",臺南市歸仁區保大路三段366巷60號,23.007544,120.275097
UN201706160002,"2017-06-16 00:20:00",東區,騎樓舉發,騎樓舉發,"東區中華東路二段161號前  騎樓舉發",臺南市中華東路二段161號,22.985139,120.233083
UN201706160004,"2017-06-16 00:43:00",麻豆區,髒亂及汙染,空氣汙染,"麻豆區寮廍里2號 空氣汙染",臺南市麻豆區寮廍里2號,23.1895686,120.282236
UN201706160011,"2017-06-16 03:31:00",安南區,路燈故障,10盞以上路燈故障,"安南區大眾六街148巷39弄2號 住家、路燈都停電",臺南市安南區大眾六街148巷39弄2號,23.019894,120.127314
UN201706160016,"2017-06-16 07:20:00",南區,違規停車,違規停車,"南區中華西路一段137巷53號與55號間巷口 違規停車",臺南市南區中華西路一段137巷53號,22.981615,120.183896
UN201706160021,"2017-06-16 07:46:00",永康區,違規停車,違規停車,"永康區大灣路942巷114號 違規停車",臺南市永康區大灣路942巷114號,23.002819,120.256041
UN201706160027,"2017-06-16 08:07:00",安平區,路燈故障,9盞以下路燈故障,安平區古堡街125巷2號路燈故障,臺南市安平區古堡街125巷2號,23.002665,120.157393
UN201706160030,"2017-06-16 08:10:00",南區,違規停車,違規停車,"南區三和街34號旁 違停",臺南市南區三和街34號,22.981073,120.192804
UN201706160031,"2017-06-16 07:30:00",東區,道路維修,路面坑洞,"東區崇善路843號 路面坑洞",臺南市東區崇善路843號,22.966812,120.232594
UN201706160045,"2017-06-16 09:00:00",中西區,違規停車,違規停車,"中西區開山路52到90號 違規停車",臺南市中西區開山路52到90號,22.989829,120.20686
UN201706160047,"2017-06-16 09:07:00",東區,騎樓舉發,騎樓舉發,臺南市東區東門路三段253號騎樓舉發,臺南市東區東門路三段253號,22.976472,120.235983
UN201706160051,"2017-06-16 09:20:00",中西區,違規停車,違規停車,"中西區民生路二段60號旁巷子 違規停車",臺南市中西區民生路二段60號,22.995134,120.197618
UN201706160053,"2017-06-16 09:21:00",柳營區,髒亂及汙染,空氣汙染,"柳營區大農里農場15號 空氣汙染",臺南市柳營區大農里農場15號,23.284259,120.347945
UN201706160055,"2017-06-16 09:25:00",安南區,髒亂及汙染,空氣汙染,"安南區安和路一段496巷1弄69號附近 空氣污染",臺南市安南區安和路一段496巷1弄69號,23.036205,120.215911
UN201706160059,"2017-06-16 09:46:00",安南區,動物救援,遊蕩犬隻捕捉管制,"709台灣台南市安南區府安路五段119巷1號 捕捉流浪狗",709台灣台南市安南區府安路五段119巷1號,23.023081056106882,120.19990045662234
