UN201706120002,"2017-06-12 01:25:00",永康區,違規停車,違規停車,"永康區小東路 違規停車",台南市永康區小東路307巷96弄1號,23.0002121,120.239768
UN201706120003,"2017-06-12 01:27:00",永康區,違規停車,違規停車,"永康區中華一路 違規停車",台南市永康區中華一路203巷6號,23.0026763,120.2380037
UN201706120006,"2017-06-12 03:33:00",歸仁區,髒亂及汙染,空氣汙染,"歸仁區長榮路一段713號 空汙",臺南市歸仁區長榮路一段713號,22.910134,120.280931
UN201706120007,"2017-06-12 05:16:00",南區,違規停車,違規停車,"南區大同路二段704巷 違規停車",702台灣台南市南區大同路二段704巷,22.9669285,120.2141159
UN201706120013,"2017-06-12 07:23:00",永康區,違規停車,違規停車,"永康區中山南路119巷8號前 違規停車",臺南市永康區中山南路119巷8號,23.013208,120.229154
UN201706120014,"2017-06-12 07:22:00",南區,髒亂及汙染,其他汙染舉發,"南區新興路303號 府城骨科附近 貓屍體",臺南市南區新興路303號,22.975875,120.192026
UN201706120021,"2017-06-12 08:17:00",北區,噪音舉發,場所連續噪音,"北區臨安路二段249巷22號4樓 噪音",臺南市北區臨安路二段249巷22號,23.005428,120.200755
UN201706120029,"2017-06-12 08:39:00",安南區,民生管線,漏水、停水、消防栓漏水或損壞,"安南區安中路一段622巷24號 漏水",臺南市安南區安中路一段622巷24號,23.04192,120.198827
UN201706120058,"2017-06-12 09:35:00",柳營區,髒亂及汙染,空氣汙染,"柳營區環園西路二段16號 空氣汙染",臺南市柳營區環園西路二段16號,23.267746,120.304717
UN201706120063,"2017-06-12 09:39:00",中西區,髒亂及汙染,空氣汙染,"中西區民權路一段110號 空氣汙染",臺南市中西區民權路一段110號,22.990453,120.209432
UN201706120064,"2017-06-12 09:35:00",東區,噪音舉發,場所連續噪音,"東區立德十路3號一樓  噪音/佔用道路",臺南市東區立德十路3號,22.977948,120.214105
UN201706120070,"2017-06-12 09:48:00",北區,違規停車,違規停車,"北區中華北路二段42號 違規停車",臺南市北區中華北路二段42號,23.018648,120.195386
UN201706120076,"2017-06-12 09:50:00",善化區,噪音舉發,場所連續噪音,"善化區東隆里東勢寮201之11號 噪音",臺南市善化區東隆里東勢寮201之11號,23.155948,120.314051
UN201706120093,"2017-06-12 10:36:00",東區,違規停車,違規停車,"東區中華東路二段355號 違停",臺南市東區中華東路二段355號,22.981198,120.229695
UN201706120111,"2017-06-12 11:11:00",安平區,違規停車,違規停車,"安平區安平路96號 違規停車",安平區安平路96號,22.9993865,120.1733743
UN201706120113,"2017-06-12 11:10:00",永康區,髒亂及汙染,空氣汙染,"永康區洲工街117號  空汙",臺南市永康區洲工街117號,23.035858,120.225236
UN201706120163,"2017-06-12 12:57:00",中西區,違規停車,違規停車,"中西區民族路二段8-48號 違規停車",臺南市民族路二段8號,22.994606,120.211439
UN201706120167,"2017-06-12 13:19:00",新營區,違規停車,違規停車,"新營區民治路27-12號 違規停車",730台灣台南市新營區民治路27-12號,23.310864175577006,120.31783419325416
UN201706120171,"2017-06-12 13:33:00",中西區,違規停車,違規停車,"中西區民生路一段157巷11號 違規停車",台南市民生路一段157巷11號,22.9935685,120.2003653
UN201706120174,"2017-06-12 13:33:00",北區,騎樓舉發,騎樓舉發,"北區和緯路一段82號前 騎樓舉發",臺南市北區和緯路一段82號,23.009728,120.214523
UN201706120194,"2017-06-12 14:20:00",中西區,髒亂及汙染,空氣汙染,"中西區民權路一段110號，東嶽殿 空污",臺南市中西區民權路一段110號,22.990453,120.209432
UN201706120212,"2017-06-12 14:51:00",南區,髒亂及汙染,空氣汙染,"南區新都路256巷1號/南區新都路193號 空污",臺南市南區新都路256巷1號,22.969053,120.198465
UN201706120219,"2017-06-12 15:02:00",永康區,動物救援,遊蕩犬隻捕捉管制,"永康區復興路一巷30弄9號 捕犬",臺南市永康區復興路一巷30弄9號,22.996444,120.249909
UN201706120224,"2017-06-12 15:14:00",新營區,道路維修,人孔蓋或溝蓋聲響鬆動,"新營區三民路36號，第三市場前 污水孔蓋噪音",臺南市新營區三民路36號,23.307541,120.319757
UN201706120236,"2017-06-12 15:41:00",南區,道路維修,路面坑洞,"永華路文華社區活動中心前，剛好在橋頭處，快車道和慢車道中間 路面坑洞",臺南市南區永華路一段275號,22.988456,120.189884
UN201706120240,"2017-06-12 15:41:00",南區,違規停車,違規停車,南區大同路二段136巷10號,南區大同路二段136巷10號,22.979133,120.211717
UN201706120243,"2017-06-12 15:57:00",東區,路燈故障,9盞以下路燈故障,"東區裕忠路628號 路燈故障",臺南市東區裕忠路628號,22.979613,120.241605
UN201706120258,"2017-06-12 16:28:00",柳營區,髒亂及汙染,空氣汙染,"柳營區環園西路二段13號/柳營區環園西路二段16號 空污",臺南市柳營區環園西路二段13號,23.267746,120.304717
UN201706120267,"2017-06-12 16:55:00",新市區,違規停車,違規停車,"新市區中正路177號 違停",臺南市新市區中正路177號,23.07614,120.291514
UN201706120270,"2017-06-12 16:57:00",永康區,動物救援,犬貓急難救援,"永康區王行東路166號  犬貓救援",臺南市永康區王行東路166號,23.039395,120.283617
UN201706120272,"2017-06-12 17:01:00",東區,違規停車,違規停車,"東區北門路一段294號 違規停車",701台灣台南市東區北門路一段294號,22.9956944,120.2117714
UN201706120274,"2017-06-12 17:03:00",永康區,交通運輸,佔用道路,"永康區東橋三路440號 佔用道路",臺南市永康區東橋三路440號,23.023442,120.232875
UN201706120275,"2017-06-12 17:04:00",中西區,違規停車,違規停車,"中西區西華南街28號 違規停車",臺南市西華南街28號,22.993754,120.20953
UN201706120278,"2017-06-12 17:11:00",東區,違規停車,違規停車,"東區北門路一段294號 違規停車",701台灣台南市東區北門路一段294號,22.995706,120.2119112
UN201706120279,"2017-06-12 17:15:00",東區,違規停車,違規停車,"東區大同路二段345號 違規停車",台南市東區大同路二段345號,22.9679251,120.216059
UN201706120288,"2017-06-12 17:33:00",中西區,違規停車,違規停車,"中西區民族路二段230號，石精臼點心城周邊＋對面 違規停車",臺南市民族路二段230號,22.997259,120.201768
UN201706120289,"2017-06-12 17:44:00",中西區,違規停車,違規停車,"中西區民權路三段（海安路到西門路口）雙側 違規停車",民權路三段,22.9982223,120.1933076
UN201706120301,"2017-06-12 18:26:00",中西區,違規停車,違規停車,"中西區民族路二段48到66號 違規停車",臺南市民族路二段48到66號,22.994656,120.210177
UN201706120306,"2017-06-12 18:51:00",永康區,違規停車,違規停車,"永康區中山南路119巷8號 違規停車",臺南市中山南路119巷8號,23.013208,120.229154
UN201706120310,"2017-06-12 18:59:00",安平區,噪音舉發,妨害安寧,"安平區安平路183號隔壁空地 妨礙安寧",臺南市安平區安平路183號,23.000094,120.160815
UN201706120313,"2017-06-12 19:02:00",永康區,路燈故障,9盞以下路燈故障,"永康區永大路三段560巷1弄7號 路燈故障",臺南市永康區永大路三段560巷1弄7號,23.037745,120.259341
UN201706120314,"2017-06-12 19:12:00",安南區,路燈故障,9盞以下路燈故障,"安南區公學路四段126巷82號 路燈不亮",臺南市安南區公學路四段126巷82號,23.067048,120.174147
UN201706120316,"2017-06-12 19:16:00",安平區,交通運輸,佔用道路,"安平區古堡街58號前方 及水景橋 佔用道路",臺南市安平區古堡街58號,23.002192,120.16136
UN201706120317,"2017-06-12 19:22:00",中西區,違規停車,違規停車,"中西區西寧街37號 紅線違停",臺南市中西區西寧街37號,22.997194,120.191612
UN201706120319,"2017-06-12 19:27:00",安平區,路燈故障,9盞以下路燈故障,"安平區漁光路114號附近 路燈不亮",臺南市安平區漁光路114號,22.981981,120.156157
UN201706120323,"2017-06-12 19:38:00",永康區,違規停車,違規停車,710台灣台南市永康區二王路6號對面違規停車,710台灣台南市永康區二王路6號對面,23.0215762,120.248929
UN201706120328,"2017-06-12 19:52:00",永康區,違規停車,違規停車,710台灣台南市永康區正義街49巷違規停車,710台灣台南市永康區正義街49巷,23.0289042,120.2539772
UN201706120329,"2017-06-12 19:55:00",永康區,違規停車,違規停車,710台灣台南市永康區永正路85巷對面違規停車,710台灣台南市永康區永正路85巷對面,23.0243808,120.2579435
UN201706120333,"2017-06-12 20:00:00",南區,髒亂及汙染,空氣汙染,"南區金華路二段76號 空氣污染",臺南市南區金華路二段76號,22.977567,120.191301
UN201706120341,"2017-06-12 20:17:00",永康區,違規停車,違規停車,"永康區中華路602號至608號 違規停車",臺南市中華路602號,23.013894,120.230886
UN201706120347,"2017-06-12 20:39:00",新營區,路燈故障,9盞以下路燈故障,"新營區八德路17號 路燈故障",臺南市新營區八德路17號,23.30359,120.280621
UN201706120350,"2017-06-12 20:45:00",安平區,違規停車,違規停車,"安平區古堡街62號 違停",安平區古堡街62號,23.00241,120.1613079
UN201706120352,"2017-06-12 20:49:00",中西區,髒亂及汙染,小廣告、旗幟,"中西區民族路二段71號 小廣告",臺南市民族路二段71號,22.994351,120.209457
UN201706120353,"2017-06-12 20:50:00",永康區,違規停車,違規停車,"永康區南台街54巷 違停",永康區南台街54巷,23.0239715,120.2224494
UN201706120356,"2017-06-12 20:51:00",仁德區,髒亂及汙染,空氣汙染,"仁德區保安路中正路 空氣污染",仁德區保安路中正路,22.9189339,120.2274961
UN201706120367,"2017-06-12 21:41:00",永康區,動物救援,遊蕩犬隻捕捉管制,"永康區中正二街105巷26號 捕犬",臺南市永康區中正二街105巷26號,23.027912,120.229125
UN201706120380,"2017-06-12 22:53:00",安平區,違規停車,違規停車,安平區育平五街33-77號違規停車,臺南市安平區育平五街33-77號,22.990495,120.169195
UN201706120382,"2017-06-12 23:11:00",南區,噪音舉發,妨害安寧,"南區中華西路一段155號4樓 妨礙安寧",臺南市南區中華西路一段155號,22.981833,120.185705
UN201706120385,"2017-06-12 23:36:00",南區,違規停車,違規停車,"南區大同路二段704巷 違規停車",702台灣台南市南區大同路二段704巷,22.9671057,120.2140708
UN201706120389,"2017-06-12 23:41:00",永康區,違規停車,違規停車,"麗瓷咖啡店 違規停車",新民街接新中街，麗瓷咖啡店旁,23.040171,120.243781
UN201706120392,"2017-06-12 23:46:00",永康區,違規停車,違規停車,"多福豆花店 違規停車",新中街多福豆花店旁,23.0356851,120.2393523
UN201706130002,"2017-06-13 00:31:00",安南區,路燈故障,10盞以上路燈故障,"安南區台江大道三段 路燈大範圍不亮",安南區台江大道三段,23.0639816,120.1626834
UN201706130003,"2017-06-13 00:51:00",永康區,違規停車,違規停車,"永康區中華一路203巷6號 違規停車",臺南市永康區中華一路203巷6號,23.003864,120.233574
UN201706130009,"2017-06-13 02:34:00",永康區,違規停車,違規停車,"永康區中華一路203巷16號 違規停車",臺南市永康區中華一路203巷16號,23.003592,120.233524
UN201706130020,"2017-06-13 07:34:00",安南區,違規停車,違規停車,"安南區怡安路二段79巷81號 違規停車",臺南市安南區怡安路二段79巷81號,23.042644,120.200957
UN201706130033,"2017-06-13 08:20:00",北區,髒亂及汙染,其他汙染舉發,"北區和緯路二段2號 其他汙染舉發",臺南市北區和緯路二段2號,23.010873,120.210586
UN201706130036,"2017-06-13 08:36:00",南區,違規停車,違規停車,"南區新孝路148巷109號轉角 違規停車",南區新孝路148巷109號,22.9784421,120.179729
UN201706130037,"2017-06-13 07:29:00",北區,髒亂及汙染,空氣汙染,"北區大興街280巷20弄1號隔壁 空氣汙染",臺南市北區大興街280巷20弄1號,23.01103,120.186429
UN201706130038,"2017-06-13 08:36:00",麻豆區,違規停車,違規停車,"麻豆新樓醫院前 違停",麻豆新樓醫院前,23.180079,120.232913
UN201706130044,"2017-06-13 08:54:00",中西區,違規停車,違規停車,"中西區民族路二段59號 違規停車",臺南市中西區民族路二段59號,22.994308,120.209991
UN201706130046,"2017-06-13 08:53:00",安南區,動物救援,遊蕩犬隻捕捉管制,"安南區安吉路一段53號走廊跟旁邊空地 捕犬",臺南市安南區安吉路一段53號,23.042987,120.187584
UN201706130054,"2017-06-13 09:14:00",安南區,違規停車,違規停車,"安南區長和路二段176號前 違停",臺南市安南區長和路二段176號,23.063598,120.219731
UN201706130064,"2017-06-13 09:05:00",安平區,髒亂及汙染,環境髒亂,"安平區平通路358號 環境髒亂",臺南市安平區平通路358號,22.992844,120.177822
UN201706130065,"2017-06-13 09:34:00",永康區,違規停車,違規停車,"永康區小東路553號 違規停車",臺南市永康區小東路553號,22.998683,120.236498
UN201706130070,"2017-06-13 09:38:00",佳里區,噪音舉發,場所連續噪音,"佳里區四維一街106巷38號 場所連續噪音",臺南市佳里區四維一街106巷38號,23.150611,120.177125
UN201706130072,"2017-06-13 09:41:00",永康區,違規停車,違規停車,"永康區新中街 違規停車",新中街,23.3780791,120.151369
UN201706130081,"2017-06-13 09:58:00",永康區,違規停車,違規停車,"永康區南台街13巷16號旁 違規停車",永康區南台街13巷16號,23.0226508,120.223792
UN201706130090,"2017-06-13 10:15:00",永康區,違規停車,違規停車,"永康區鹽行里中正七街232號前方 違規停車",臺南市永康區中正七街232號,23.0438,120.240422
UN201706130091,"2017-06-13 10:14:00",北區,噪音舉發,場所連續噪音,"北區臨安路二段249巷22號4樓 場所連續噪音",臺南市北區臨安路二段249巷22號,23.005428,120.200755
UN201706130093,"2017-06-13 10:25:00",柳營區,髒亂及汙染,空氣汙染,"柳營區環園西路二段13號與16號 空氣汙染",臺南市柳營區環園西路二段13號,23.267746,120.304717
UN201706130109,"2017-06-13 10:56:00",北區,違規停車,違規停車,"北區中華北路二段42號前紅線 違停",臺南市北區中華北路二段42號,23.018648,120.195386
UN201706130125,"2017-06-13 11:40:00",中西區,違規停車,違規停車,"中西區民族路二段12號 違規停車",臺南市民族路二段12號,22.9946,120.211312
UN201706130126,"2017-06-13 11:41:00",中西區,違規停車,違規停車,"中西區民族路二段57號到63號 違規停車",臺南市民族路二段57號,22.994309,120.210166
UN201706130127,"2017-06-13 11:43:00",中西區,違規停車,違規停車,"中西區西華南街68號 違規停車",臺南市西華南街68號,22.994221,120.209598
UN201706130141,"2017-06-13 12:14:00",南區,違規停車,違規停車,"南區中華西路一段448號 違規停車",南區中華西路一段448號,22.9736591,120.183342
UN201706130144,"2017-06-13 12:23:00",中西區,違規停車,違規停車,"中西區民生路二段69號 違規停車",臺南市民生路二段69號,22.99493,120.197375
UN201706130147,"2017-06-13 12:36:00",中西區,違規停車,違規停車,"中西區民生路一段27號 違規停車",臺南市民生路一段27號,22.992974,120.203909
UN201706130153,"2017-06-13 12:54:00",永康區,違規停車,違規停車,"永康區三村國小圍牆 違規停車",永康區鹽洲里仁愛街三村國小,23.041356,120.2368389
UN201706130157,"2017-06-13 13:00:00",中西區,違規停車,違規停車,中西區新美街1號違規停車,台南市中西區新美街1號,22.9868277,120.1977034
UN201706130158,"2017-06-13 13:05:00",中西區,違規停車,違規停車,中西區西華南街57號近民族路違規停車,臺南市中西區西華南街57號,22.994192,120.209412
UN201706130159,"2017-06-13 13:06:00",中西區,違規停車,違規停車,中西區民族路二段32號違規停車,臺南市中西區民族路二段32號,22.99471,120.21081
UN201706130162,"2017-06-13 13:15:00",東區,違規停車,違規停車,東區北門路一段294號違規停車,701台灣台南市東區北門路一段294號,22.9959011,120.2111853
UN201706130163,"2017-06-13 13:16:00",中西區,違規停車,違規停車,中西區健康路一段312號違規停車,臺南市中西區健康路一段312號,22.98151,120.202721
UN201706130169,"2017-06-13 13:42:00",中西區,違規停車,違規停車,"中西區西門路二段398號 違停",臺南市中西區西門路二段398號,22.998818,120.200914
UN201706130176,"2017-06-13 13:51:00",中西區,髒亂及汙染,環境髒亂,"中西區南寧街4號旁 環境髒亂",臺南市中西區南寧街4號,22.984546,120.205477
UN201706130177,"2017-06-13 13:49:00",永康區,騎樓舉發,騎樓舉發,"永康區小東路513號 騎樓舉發",臺南市永康區小東路513號,22.998719,120.236233
UN201706130178,"2017-06-13 13:53:00",永康區,噪音舉發,妨害安寧,噪音舉發,臺南市永康區勝利街77巷12號,23.002664,120.232008
UN201706130181,"2017-06-13 14:01:00",南區,違規停車,違規停車,"南區永華路一段179號 違規停車",臺南市永華路一段179號,22.98801,120.19185
UN201706130189,"2017-06-13 14:10:00",安平區,違規停車,違規停車,"安平區安平路96號與安平區安平路106號 違規停車",臺南市安平區安平路96號,22.99831,120.184273
UN201706130205,"2017-06-13 14:34:00",安平區,違規停車,違規停車,"安平區安平路250號 違規停車",安平路250號,22.9994636,120.1733067
UN201706130216,"2017-06-13 15:06:00",東區,違規停車,違規停車,"東區北門路一段294號 違規停車",701台灣台南市東區北門路一段294號,22.9937517,120.2135861
UN201706130232,"2017-06-13 14:48:00",歸仁區,動物救援,犬貓急難救援,"歸仁區中正北路三段243號 動物救援",臺南市歸仁區中正北路三段243號,22.995262,120.293862
UN201706130237,"2017-06-13 15:57:00",永康區,違規停車,違規停車,"永康區新行街70號 違規停車",臺南市永康區新行街70號,23.039801,120.24193
UN201706130239,"2017-06-13 16:03:00",東區,路燈故障,9盞以下路燈故障,"東區崇學路142巷13號 路燈故障",臺南市東區崇學路142巷13號,22.980736,120.225116
UN201706130247,"2017-06-13 16:26:00",北區,違規停車,違規停車,"北區東豐路447號 違規停車",臺南市北區東豐路447號,23.002409,120.227036
UN201706130260,"2017-06-13 17:15:00",東區,違規停車,違規停車,"東區長榮路二段180號 違規停車",臺南市長榮路二段180號,22.990222,120.220767
UN201706130261,"2017-06-13 17:16:00",中西區,違規停車,違規停車,"中西區民權路一段232號 違規停車",臺南市民權路一段232號,22.992722,120.207498
UN201706130262,"2017-06-13 17:18:00",中西區,違規停車,違規停車,"中西區成功路169號 違規停車",臺南市中西區成功路169號,22.998026,120.2063
UN201706130264,"2017-06-13 17:27:00",中西區,違規停車,違規停車,"中西區青年路109號 違規停車",臺南市青年路109號,22.992177,120.208391
UN201706130265,"2017-06-13 17:29:00",中西區,違規停車,違規停車,"中西區民族路二段8到66號 違規停車",臺南市民族路二段8號,22.994606,120.211439
UN201706130273,"2017-06-13 18:04:00",北區,違規停車,違規停車,704台灣台南市北區公園路483號違規停車,704台灣台南市北區公園路483號,23.0090887,120.210013
UN201706130276,"2017-06-13 18:10:00",永康區,違規停車,違規停車,台南市永康區大灣路273號違規停車,臺南市永康區大灣路273號,23.006329,120.267355
UN201706130279,"2017-06-13 18:18:00",安平區,違規停車,違規停車,安平區育平五街33-77號違規停車,臺南市安平區育平五街33-77號,22.990495,120.169195
UN201706130283,"2017-06-13 18:18:00",永康區,違規停車,違規停車,臺南市永康區中山南路1042號違規停車,臺南市永康區中山南路1042號,23.025379,120.255588
UN201706130298,"2017-06-13 18:50:00",安南區,交通運輸,佔用道路,"安南區安中路四段320巷129弄34之13號 佔用道路",臺南市安南區安中路四段320巷129弄34之13號,23.054128,120.168217
UN201706130300,"2017-06-13 18:55:00",佳里區,違規停車,違規停車,台南市佳里區光復路152號違規停車,臺南市佳里區光復路152號,23.159314,120.174961
UN201706130302,"2017-06-13 19:04:00",永康區,違規停車,違規停車,"永康區復國二路173號 違規停車",臺南市永康區復國二路173號,23.011776,120.248101
UN201706130303,"2017-06-13 19:06:00",永康區,路燈故障,9盞以下路燈故障,"永康區永大路二段556巷11號 路燈故障",臺南市永康區永大路二段556巷11號,23.008719,120.262927
UN201706130305,"2017-06-13 19:11:00",東區,違規停車,違規停車,"東區崇學路70號 違停",東區崇學路70號,22.9796352,120.2233616
UN201706130309,"2017-06-13 19:14:00",北區,騎樓舉發,騎樓舉發,北區長榮路五段126號騎樓舉發,臺南市北區長榮路五段126號,23.012554,120.220263
UN201706130310,"2017-06-13 19:23:00",中西區,違規停車,違規停車,"中西區西寧街37號 違停",臺南市中西區西寧街37號,22.997194,120.191612
UN201706130312,"2017-06-13 19:24:00",安南區,動物救援,遊蕩犬隻捕捉管制,"安南區北安路三段225號  遊蕩犬隻捕捉管制",臺南市安南區北安路三段225號,23.04273,120.203197
UN201706130318,"2017-06-13 19:59:00",中西區,違規停車,違規停車,"中西區西寧街37號、25號 違規停車",臺南市中西區西寧街37號,22.997194,120.191612
UN201706130321,"2017-06-13 20:07:00",南區,違規停車,違規停車,702台灣台南市南區金華路二段83巷違規停車,702台灣台南市南區金華路二段83巷,22.984109,120.1923036
UN201706130322,"2017-06-13 20:18:00",南區,道路維修,路面坑洞,南區夏林路105號道路維修,臺南市南區夏林路105號,22.981858,120.195322
UN201706130323,"2017-06-13 20:18:00",新營區,路燈故障,9盞以下路燈故障,"新營區工業街83號至新營火車站 路燈不亮",臺南市新營區工業街83號,23.29933,120.321812
UN201706130328,"2017-06-13 20:36:00",中西區,違規停車,違規停車,中西區民族路二段53號57號違規停車,中西區民族路二段53號57號,22.9964658,120.2033662
UN201706130329,"2017-06-13 20:41:00",官田區,民生管線,漏水、停水、消防栓漏水或損壞,"官田區社子里2鄰14號 路面冒水",臺南市官田區社子里2鄰14號,23.182123,120.359589
UN201706130330,"2017-06-13 20:45:00",安南區,髒亂及汙染,道路散落物,安南區海佃路二段570號　道路散落物,臺南市安南區海佃路二段570號,23.042113,120.188032
UN201706130331,"2017-06-13 20:49:00",中西區,違規停車,違規停車,中西區民族路二段71號違規停車,中西區民族路二段71號,22.9964658,120.2033662
UN201706130332,"2017-06-13 20:50:00",永康區,違規停車,違規停車,永康區鹽行里中正七街中正路違規停車,永康區鹽行里中正七街中正路,23.041356,120.2368389
UN201706130333,"2017-06-13 20:51:00",中西區,髒亂及汙染,空氣汙染,"中西區康樂街216號 空氣污染",臺南市中西區康樂街216號,22.997585,120.196108
UN201706130334,"2017-06-13 20:54:00",中西區,違規停車,違規停車,中西區西華南街62號違規停車,中西區西華南街62號,22.9946816,120.2096086
UN201706130335,"2017-06-13 20:55:00",東區,違規停車,違規停車,台南市東區裕農路51號違規停車,台南市東區裕農路51號,22.989693,120.2428369
UN201706130346,"2017-06-13 22:16:00",永康區,違規停車,違規停車,"永康區華興街138號 違規停車/賭場",臺南市永康區華興街138號,23.000861,120.236657
UN201706130351,"2017-06-13 23:04:00",安平區,道路維修,路面坑洞,"安平區安平路630號對面 路面坑洞",安平區安平路630號,22.9991056,120.1684238
UN201706140002,"2017-06-14 00:16:00",北區,違規停車,違規停車,違規停車,"臺南市台南市 公園路 750號",23.009437,120.210683
UN201706140005,"2017-06-14 01:18:00",歸仁區,噪音舉發,妨害安寧,"歸仁區中正一街51號 妨害安寧",歸仁區中正一街51號,22.9444799,120.2774144
UN201706140018,"2017-06-14 07:24:00",安南區,噪音舉發,場所連續噪音,"安南區長溪路一段190號旁工地 噪音舉發",臺南市安南區長溪路一段190號,23.036996,120.209465
UN201706140021,"2017-06-14 07:29:00",東區,違規停車,違規停車,"東區衛國街與東區長榮路二段32巷與東區長榮路二段24巷 違規停車",東區衛國街,22.9871261,120.223084
UN201706140029,"2017-06-14 08:30:00",山上區,髒亂及汙染,其他汙染舉發,"山上區明和里北勢洲21之4號至-21之9號 廢油汙染",臺南市山上區明和里北勢洲21之4號,23.113643,120.33514
UN201706140033,"2017-06-14 08:39:00",白河區,動物救援,犬貓急難救援,"白河區河東里36之2號 狗受困",臺南市白河區河東里36之2號,23.343842,120.430861
UN201706140036,"2017-06-14 08:47:00",安南區,路燈故障,9盞以下路燈故障,"安南區頂安街63號 路燈故障",臺南市安南區頂安街63號,23.043736,120.214643
UN201706140040,"2017-06-14 07:29:00",安南區,交通運輸,公車動態LED跑馬燈資訊顯示異常,"歷史博物館對面 交通運輸",臺南市安南區長和路一段250號,23.059176,120.234144
UN201706140060,"2017-06-14 09:35:00",安平區,路燈故障,9盞以下路燈故障,"安平區民權路四段771號 路燈不亮",安平區民權路四段771號,23.000056,120.171993
