UN201706260002,"2017-06-26 01:05:00",永康區,違規停車,違規停車,"永康區中華一路203巷15號 違規停車",臺南市永康區中華一路203巷15號,23.003826,120.233789
UN201706260004,"2017-06-26 01:58:00",麻豆區,髒亂及汙染,市區道路路面油漬,"麻豆區民權路70之33號 路面油漬",臺南市麻豆區民權路70之33號,23.178608,120.253007
UN201706260005,"2017-06-26 04:19:00",柳營區,髒亂及汙染,道路散落物,"柳營區果毅後5-2號   道路散落物",臺南市柳營區果毅後5-2號,23.259288,120.371939
UN201706260006,"2017-06-26 06:12:00",七股區,動物救援,犬貓急難救援,"七股區永吉里17之36號 犬貓急難救援",臺南市七股區永吉里17之36號,23.093562,120.131412
UN201706260007,"2017-06-26 06:38:00",中西區,髒亂及汙染,其他汙染舉發,"中西區金城街70號 垃圾包",臺南市中西區金城街70號,22.992745,120.189173
UN201706260018,"2017-06-26 07:57:00",中西區,道路維修,寬頻管線、孔蓋損壞,"中西區海安路二段332號  孔蓋",臺南市中西區海安路二段332號,22.999151,120.198365
UN201706260026,"2017-06-26 08:31:00",中西區,違規停車,違規停車,"中西區民族路二段63號 違規停車",臺南市中西區民族路二段63號,22.994306,120.209873
UN201706260049,"2017-06-26 09:07:00",北區,違規停車,違規停車,"北區大武街502巷2弄2號 違規停車",臺南市北區大武街502巷2弄2號,23.016998,120.220858
UN201706260052,"2017-06-26 09:06:00",東區,民生管線,電信孔蓋鬆動、電信線路掉落、電信桿傾倒,"東區東寧路201巷93號前 孔蓋鬆動聲響",臺南市東區東寧路201巷93號,22.992986,120.225892
UN201706260064,"2017-06-26 09:22:00",中西區,違規停車,違規停車,"中西區開山路52到90號及對面75到85號 違規停車",臺南市中西區開山路52至90號,22.989829,120.20686
UN201706260068,"2017-06-26 09:26:00",東區,髒亂及汙染,市區道路路面油漬,"東區北門路一段260號 油漬",臺南市東區北門路一段260號,22.994954,120.211957
UN201706260076,"2017-06-26 09:40:00",永康區,違規停車,違規停車,"永康區中華路800號 違規停車",臺南市永康區中華路800號,23.018279,120.226969
UN201706260078,"2017-06-26 09:40:00",仁德區,民生管線,電信孔蓋鬆動、電信線路掉落、電信桿傾倒,"仁德區中山路301號 孔蓋鬆動",臺南市仁德區中山路301號,22.970545,120.259948
UN201706260080,"2017-06-26 09:45:00",麻豆區,髒亂及汙染,空氣汙染,"麻豆區新生北路308巷 空氣汙染",麻豆區新生北路308巷,23.190973,120.2559159
UN201706260081,"2017-06-26 09:44:00",安南區,違規停車,違規停車,"安鰻區北安路三段156號 違停",臺南市安鰻區北安路三段156號,23.042457,120.203557
