UN201707170001,"2017-07-17 01:15:00",南區,路燈故障,9盞以下路燈故障,"南區金華路一段416號、中西區大勇街119號前 路燈不亮",臺南市南區金華路一段416號,22.971374,120.190757
UN201707170007,"2017-07-17 06:59:00",中西區,噪音舉發,妨害安寧,"中西區成功路273號，夜茶飲料店 妨害安寧",臺南市中西區成功路273號,22.999275,120.201824
UN201707170018,"2017-07-17 08:11:00",玉井區,動物救援,犬貓急難救援,玉井區玉田里大勇街62巷11號犬貓急難救援,臺南市玉井區玉田里大勇街62巷11號,23.125183,120.468473
UN201707170029,"2017-07-17 08:32:00",中西區,違規停車,違規停車,"中西區開山路52到90號及對面75到85號 違規停車",臺南市中西區開山路90號,22.989829,120.20686
UN201707170040,"2017-07-17 08:50:00",仁德區,民生管線,停電、漏電、電線掉落、孔蓋鬆動,"仁德區中正路三段16號 台電孔蓋鬆動",臺南市仁德區中正路三段16號,22.972097,120.251984
UN201707170063,"2017-07-17 09:26:00",永康區,騎樓舉發,騎樓舉發,"永康區復興路156號 騎樓舉發",臺南市復興路156號,22.998788,120.245913
UN201707170068,"2017-07-17 09:37:00",南區,路燈故障,9盞以下路燈故障,"南區興南街55巷59號 路燈故障",臺南市南區興南街55巷59號,22.92259,120.184234
UN201707170073,"2017-07-17 09:47:00",中西區,違規停車,違規停車,"中西區民族路二段7號到63號 違規停車",臺南市民族路二段7號,22.994343,120.21139
UN201707170086,"2017-07-17 10:02:00",中西區,違規停車,違規停車,"中西區衛民街62號附近的騎樓 違規停車",臺南市中西區衛民街62號,22.993127,120.210295
UN201707170094,"2017-07-17 10:08:00",中西區,違規停車,違規停車,"中西區民族路二段230號 石精臼點心城 周邊 ＋對面 紅線黃線 違規停車",臺南市中西區民族路二段230號,22.997259,120.201768
UN201707170098,"2017-07-17 10:09:00",安平區,騎樓舉發,騎樓舉發,"安平區健康三街199號 佔用騎樓",臺南市安平區健康三街199號,22.989306,120.168542
UN201707170107,"2017-07-17 10:23:00",中西區,違規停車,違規停車,"中西區青年路109號 違規停車",臺南市中西區青年路109號,22.992177,120.208391
UN201707170108,"2017-07-17 10:23:00",中西區,違規停車,違規停車,"中西區國華街三段2號 違規停車",700台灣台南市中西區國華街三段2號,22.9929787,120.1973879
UN201707170114,"2017-07-17 10:31:00",東區,違規停車,違規停車,"東區東寧路429號 違規停車",臺南市東區東寧路429號,22.989611,120.229971
UN201707170121,"2017-07-17 10:38:00",南區,噪音舉發,場所連續噪音,"南區夏林路180巷3號 噪音舉發",臺南市南區夏林路180巷3號,22.980235,120.194609
UN201707170122,"2017-07-17 10:40:00",東區,路燈故障,9盞以下路燈故障,"東區裕農路873號 路燈不亮",臺南市東區裕農路873號,22.989943,120.243327
UN201707170132,"2017-07-17 10:58:00",南區,道路維修,路面坑洞,"南區西門路一段605號 坑洞",臺南市南區西門路一段605號,22.985037,120.19735
UN201707170136,"2017-07-17 10:56:00",安平區,交通運輸,佔用道路,"安平區建平八街416巷6弄32號 佔用道路",臺南市安平區建平八街416巷6弄32號,22.992,120.172922
UN201707170138,"2017-07-17 11:03:00",新化區,交通運輸,號誌故障,"新化區知義里1號附近 號誌不亮",臺南市新化區知義里1號,23.025028,120.337177
UN201707170141,"2017-07-17 11:11:00",中西區,違規停車,違規停車,"中西區廣慈街停車格 違規停車",中西區廣慈街,22.997247812992459,120.20738564550788
UN201707170145,"2017-07-17 11:19:00",永康區,違規停車,違規停車,"永康區中華路7巷20弄6號 違規停車",臺南市永康區中華路7巷20弄6號,22.999414,120.234148
UN201707170164,"2017-07-17 11:48:00",北區,民生管線,漏水、停水、消防栓漏水或損壞,"北區立賢路一段608號與育德二路交叉口 路面冒水",臺南市北區立賢路一段608號,23.009792,120.203734
UN201707170169,"2017-07-17 11:56:00",北區,路燈故障,9盞以下路燈故障,"北區大興街528巷13弄64號 路燈開關箱傾倒",臺南市北區大興街528巷13弄64號,23.008632,120.179506
UN201707170171,"2017-07-17 11:58:00",中西區,交通運輸,佔用道路,"中西區國華街三段3號與5號 違規擺販",臺南市中西區國華街三段3號,22.993323,120.197371
UN201707170182,"2017-07-17 12:23:00",永康區,違規停車,違規停車,"永康區中華路423號 違規停車",臺南市永康區中華路423號,23.009827,120.232846
UN201707170194,"2017-07-17 12:50:00",永康區,噪音舉發,妨害安寧,"永康區中正路1巷30號 狗叫聲 妨害安寧",臺南市永康區中正路1巷30號,23.028295,120.255226
UN201707170202,"2017-07-17 13:23:00",安南區,違規停車,違規停車,"安南區北安路三段138號 違停",臺南市安南區北安路三段138號,23.042181,120.203494
UN201707170207,"2017-07-17 13:47:00",白河區,路燈故障,9盞以下路燈故障,"白河區竹門里竹子門5-12號  路燈故障",臺南市白河區竹門里竹子門5之12號,23.374233,120.447924
UN201707170218,"2017-07-17 14:01:00",中西區,髒亂及汙染,其他汙染舉發,"中西區大同路一段46巷23號25號27號 其他汙染舉發",臺南市中西區大同路一段46巷23號,22.987724,120.210393
UN201707170225,"2017-07-17 14:32:00",永康區,騎樓舉發,騎樓舉發,"永康區大武街42號  騎樓舉發",臺南市永康區大武街42號,23.020185,120.222801
UN201707170237,"2017-07-17 14:15:00",北區,違規停車,違規停車,"北區正覺街109號 違規停車",臺南市北區正覺街109號,23.017891,120.212816
UN201707170239,"2017-07-17 14:57:00",六甲區,路燈故障,9盞以下路燈故障,"六甲區龜港里161巷55號 路燈故障",臺南市六甲區龜港里161巷55號,23.251272,120.310664
UN201707170243,"2017-07-17 15:02:00",永康區,騎樓舉發,騎樓舉發,"永康區中華西街186號 騎樓舉發",臺南市永康區中華西街186號,23.016641,120.225748
UN201707170244,"2017-07-17 15:05:00",北區,違規停車,違規停車,"北區正覺街109號 違規停車",臺南市北區正覺街109號,23.017891,120.212816
UN201707170253,"2017-07-17 15:16:00",永康區,髒亂及汙染,空氣汙染,"永康區中正北路946號 空氣汙染",臺南市永康區中正北路946號,23.055232,120.2736
UN201707170261,"2017-07-17 15:28:00",永康區,騎樓舉發,騎樓舉發,"永康區大武街42號  騎樓舉發",臺南市永康區大武街42號,23.020185,120.222801
UN201707170265,"2017-07-17 15:40:00",新營區,道路維修,人孔蓋或溝蓋聲響、鬆動,"新營區三民路36號 人孔蓋聲響",臺南市新營區三民路36號,23.307541,120.319757
UN201707170266,"2017-07-17 15:41:00",永康區,交通運輸,佔用道路,"永康區復興路156號  佔用道路",臺南市永康區復興路156號,22.998788,120.245913
UN201707170268,"2017-07-17 15:47:00",南區,違規停車,違規停車,"南區夏林路310號 違規停車",臺南市南區夏林路310號,22.976802,120.195385
UN201707170269,"2017-07-17 15:52:00",南區,交通運輸,佔用道路,"南區夏林路312號 佔用道路",臺南市南區夏林路312號,22.975797,120.195163
UN201707170271,"2017-07-17 15:51:00",北區,交通運輸,佔用道路,"北區大興街68號 占用道路",臺南市北區大興街68號,23.011676,120.19218
UN201707170275,"2017-07-17 16:11:00",永康區,騎樓舉發,騎樓舉發,"永康區大武街42號  騎樓舉發",南市永康區大武街42號,23.0204126,120.2224056
UN201707170285,"2017-07-17 16:42:00",新營區,交通運輸,佔用道路,"新營區新進路二段83號 佔用道路",臺南市新營區新進路二段83號,23.30044,120.310942
UN201707170292,"2017-07-17 16:52:00",安南區,道路維修,路面坑洞,"安南區開安路77號 路面坑洞",臺南市安南區開安路77號,23.048131,120.223446
UN201707170295,"2017-07-17 17:01:00",東區,騎樓舉發,騎樓舉發,"東區中華東三段244號 騎樓舉發",東區中華東三段244號,22.978595,120.227407
UN201707170296,"2017-07-17 17:01:00",中西區,違規停車,違規停車,"中西區民族路二段305號 違規停車",臺南市中西區民族路二段305號,22.996548,120.203058
UN201707170304,"2017-07-17 17:06:00",永康區,騎樓舉發,騎樓舉發,"南市永康區大武街42號與40號跟正新街交叉口 騎樓舉發",臺南市永康區大武街42號,23.020185,120.222801
UN201707170322,"2017-07-17 17:59:00",永康區,違規停車,違規停車,"永康區復國一路254號 違規停車",永康區復國一路254號,23.0135471,120.246125
UN201707170325,"2017-07-17 18:06:00",安南區,髒亂及汙染,空氣汙染,"安南區育安街221號，安順里活動中心 空污",臺南市安南區育安街221號,23.050749,120.215186
UN201707170327,"2017-07-17 18:07:00",東區,違規停車,違規停車,"東區崇學路135巷10號 違規停車",臺南市東區崇學路135巷10號,22.979502,120.222328
UN201707170341,"2017-07-17 18:44:00",北區,違規停車,違規停車,"北區長榮路四段139號 違停",北區長榮路四段139號,23.005958,120.221821
UN201707170342,"2017-07-17 18:52:00",北區,噪音舉發,妨害安寧,"北區武聖路138號，神壇 妨害安寧",臺南市北區武聖路138號,23.006549,120.190285
UN201707170345,"2017-07-17 19:08:00",南區,路燈故障,9盞以下路燈故障,"南區永成路三段440號 路燈不亮",臺南市南區永成路三段440號,22.969388,120.195539
UN201707170346,"2017-07-17 19:06:00",下營區,路燈故障,9盞以下路燈故障,"下營區大埤里18-31號 路燈故障",臺南市下營區大埤里18之31號,23.22964,120.252133
UN201707170347,"2017-07-17 19:09:00",安南區,路燈故障,9盞以下路燈故障,"安南區公學路七段97巷44之2號 路燈故障",臺南市安南區公學路七段97巷44之2號,23.078994,120.138386
UN201707170350,"2017-07-17 19:18:00",學甲區,路燈故障,9盞以下路燈故障,"學甲區新達里17-1號 路燈不亮",臺南市學甲區新達里17之1號,23.240186,120.195366
UN201707170351,"2017-07-17 19:04:00",北區,路燈故障,9盞以下路燈故障,北區實踐街39巷99弄13之5號路燈故障,臺南市北區實踐街39巷99弄13之5號,23.016326,120.218429
UN201707170354,"2017-07-17 19:40:00",新營區,路燈故障,9盞以下路燈故障,"新營區太南里314-5號 路燈不亮",臺南市新營區太南里314之5號,23.288191,120.275499
UN201707170355,"2017-07-17 19:44:00",玉井區,髒亂及汙染,空氣汙染,"玉井區豐里里內豐里  空氣汙染",714台灣台南市玉井區南183鄉道74號,23.1434871,120.4427366
UN201707170357,"2017-07-17 19:50:00",永康區,違規停車,違規停車,"710台灣台南市永康區永正路81-5號對面 違規停車",710台灣台南市永康區永正路81-5號對面,23.0266467,120.2541667
UN201707170358,"2017-07-17 19:58:00",中西區,違規停車,違規停車,"中西區臨安路一段243號 違規停車",臺南市中西區臨安路一段243號,23.001678,120.193515
UN201707170361,"2017-07-17 20:02:00",北區,噪音舉發,妨害安寧,"北區武聖路138號  妨害安寧",臺南市北區武聖路138號,23.006549,120.190285
UN201707170367,"2017-07-17 20:18:00",永康區,違規停車,違規停車,"永康區永正路81-5號對面 違規停車",710台灣台南市永康區永正路81-5號,23.0281117,120.2538267
UN201707170371,"2017-07-17 20:24:00",永康區,路燈故障,10盞以上路燈故障,"永康區中正北路568號至蔦松一街間 路燈不亮",臺南市永康區中正北路568號,23.044669,120.260538
UN201707170372,"2017-07-17 20:14:00",北區,違規停車,違規停車,"北區公園路591之31號 違規停車",臺南市北區公園路591之31號,23.013198,120.211722
UN201707170373,"2017-07-17 20:38:00",官田區,道路維修,寬頻管線、孔蓋損壞,"官田區中山路一段168號 寬頻孔蓋鬆動",臺南市官田區中山路一段168號,23.193043,120.314251
UN201707170376,"2017-07-17 20:42:00",東區,路燈故障,9盞以下路燈故障,東區仁和路199巷34號路燈故障,臺南市東區仁和路199巷34號,22.967366,120.23679
UN201707170378,"2017-07-17 20:53:00",東區,違規停車,違規停車,"東區東寧路201巷30-6號旁紅線巷口 違規停車",臺南市東區東寧路201巷30-6號,22.992005,120.225865
UN201707170381,"2017-07-17 20:55:00",永康區,路燈故障,9盞以下路燈故障,"永康區勝利街2巷92弄33號 路燈故障",臺南市永康區勝利街2巷92弄33號,23.002845,120.230253
UN201707170392,"2017-07-17 21:57:00",東區,違規停車,違規停車,"台南市東區東寧路201巷30-6號旁 違規停車",臺南市東區東寧路201巷30-6號,22.992005,120.225865
UN201707170394,"2017-07-17 22:04:00",學甲區,髒亂及汙染,道路散落物,"學甲區寶發路232號  道路散落物",臺南市學甲區寶發路232號,23.226756,120.182364
UN201707170402,"2017-07-17 22:58:00",永康區,路燈故障,9盞以下路燈故障,永康區中山東路280號路燈故障,臺南市永康區中山東路280號,23.010408,120.237155
UN201707170403,"2017-07-17 23:03:00",南區,噪音舉發,妨害安寧,"南區中華西路一段155號4樓 妨害安寧",臺南市南區中華西路一段155號,22.981833,120.185705
UN201707170408,"2017-07-17 23:52:00",安平區,民生管線,漏水、停水、消防栓漏水或損壞,治水閥,"臺南市安平區慶平路713  743號",22.997327,120.164221
UN201707180002,"2017-07-18 00:03:00",安南區,道路維修,路面坑洞,"安南區海佃路一段126號之10 路面坑洞",臺南市安南區海佃路一段126號,23.023313,120.19201
UN201707180004,"2017-07-18 00:14:00",南區,髒亂及汙染,道路散落物,"南區健康路一段328號  道路散落物",臺南市南區健康路一段328號,22.981073,120.202276
UN201707180005,"2017-07-18 01:08:00",新化區,動物救援,犬貓急難救援,"新化區知母義102之12號   犬貓急難救援",臺南市新化區知母義102之12號,23.028062,120.314085
UN201707180006,"2017-07-18 01:18:00",安平區,違規停車,違規停車,"安平區文平路436號 汽車違停",臺南市安平區文平路436號,22.993516,120.178918
UN201707180008,"2017-07-18 02:06:00",仁德區,髒亂及汙染,空氣汙染,"仁德區中山路478號 空汙",臺南市仁德區中山路478號,22.971473,120.254648
UN201707180012,"2017-07-18 05:52:00",歸仁區,動物救援,遊蕩犬隻捕捉管制,"歸仁區保大路三段366巷22弄29號   遊蕩犬隻捕捉管制",臺南市歸仁區保大路三段366巷22弄29號,23.004568,120.278131
UN201707180013,"2017-07-18 06:10:00",東區,髒亂及汙染,空氣汙染,"東區立德十路23號 空汙",臺南市東區立德十路23號,22.977964,120.214647
UN201707180021,"2017-07-18 07:39:00",南區,道路維修,路面坑洞,"南區明興路730號 路面坑洞",南區明興路730號,22.9611651,120.1887336
UN201707180027,"2017-07-18 07:52:00",東區,違規停車,違規停車,"東區長榮路二段142號 違規停車",東區長榮路二段142號,22.98827,120.222984
UN201707180034,"2017-07-18 08:21:00",南區,髒亂及汙染,空氣汙染,"南區中華南路二段233巷155號 空氣污染",臺南市南區中華南路二段233巷155號,22.957105,120.191483
UN201707180048,"2017-07-18 08:50:00",仁德區,民生管線,電信孔蓋鬆動、電信線路掉落、電信桿傾倒,"仁德區中山路301號 電信孔蓋鬆動",臺南市仁德區中山路301號,22.970545,120.259948
