UN201707310035,"2017-07-31 02:43:00",安南區,動物救援,犬貓急難救援,"安南區安中路 動物救援",安南區安中路,23.03952,120.2016
UN201707310117,"2017-07-31 07:35:00",東區,民生管線,停電、漏電、電線掉落、孔蓋鬆動,"東區榮譽街84巷123號 停電",臺南市東區榮譽街84巷123號,22.97377,120.218072
UN201707310148,"2017-07-31 08:15:00",安南區,交通運輸,交通疏導,"安南區安中路一段856號 交通疏導",臺南市安南區安中路一段856號,23.044044,120.194119
UN201707310195,"2017-07-31 08:56:00",下營區,民生管線,漏水、停水、消防栓漏水或損壞,"下營區中山路二段363巷18號附近 停水",臺南市下營區中山路二段363巷18號,23.223025,120.267309
UN201707310200,"2017-07-31 09:00:00",新市區,路燈故障,9盞以下路燈故障,"新市區永就里84之2號 路燈不亮",臺南市新市區永就里84之2號,23.064423,120.293019
UN201707310218,"2017-07-31 09:16:00",官田區,民生管線,停電、漏電、電線掉落、孔蓋鬆動,"官田區勝利路48巷18號 停電",臺南市官田區勝利路48巷18號,23.194337,120.315324
UN201707310235,"2017-07-31 09:25:00",歸仁區,髒亂及汙染,空氣汙染,"歸仁區仁愛十街59號 空污",臺南市歸仁區仁愛十街59號,22.962658,120.299448
UN201707310252,"2017-07-31 09:36:00",左鎮區,道路維修,路樹傾倒,"左鎮區光和里85號附近 樹壓到電線",臺南市左鎮區光和里85號,23.05079,120.381403
UN201707310275,"2017-07-31 09:55:00",南區,道路維修,路面坑洞,"南區金華路一段92號 路面坑洞",臺南市南區金華路一段92號,22.963378,120.189691
UN201707310301,"2017-07-31 10:27:00",下營區,民生管線,漏水、停水、消防栓漏水或損壞,"下營區中山路二段322巷15號 停水",臺南市下營區中山路二段322巷15號,23.221767,120.265356
UN201707310330,"2017-07-31 10:50:00",安定區,交通運輸,號誌秒差調整,"安定區港口里244號附近路口 號誌故障",臺南市安定區港口里244號,23.09054,120.23469
UN201707310332,"2017-07-31 10:51:00",官田區,民生管線,停電、漏電、電線掉落、孔蓋鬆動,"官田區社子里六雙16之17號 停電",臺南市官田區社子里六雙16之17號,23.166371,120.363395
UN201707310355,"2017-07-31 11:21:00",新化區,違規停車,違規停車,"新化區中正路與中興路口 違規停車",臺南市新化區中正路與中興路口,23.0336515,120.308481
UN201707310376,"2017-07-31 11:42:00",中西區,違規停車,違規停車,"中西區西華南街42號 違規停車",中西區西華南街42號,22.9946816,120.2096086
UN201707310382,"2017-07-31 11:44:00",南區,民生管線,停電、漏電、電線掉落、孔蓋鬆動,"南區明興路631號 電線掉落",臺南市南區明興路631號,22.940076,120.181519
UN201707310406,"2017-07-31 12:31:00",中西區,違規停車,違規停車,"中西區中正路24號  違規停車",臺南市中正路24號,22.992254,120.203529
UN201707310418,"2017-07-31 12:51:00",中西區,違規停車,違規停車,"中西區民族路二段73/75號 違規停車",臺南市民族路二段73/75號,22.997331,120.200606
UN201707310447,"2017-07-31 13:05:00",下營區,民生管線,停電、漏電、電線掉落、孔蓋鬆動,"下營區紅厝里紅毛厝40號 民生管線",臺南市下營區紅厝里紅毛厝40號,23.246605,120.265807
UN201707310457,"2017-07-31 13:37:00",永康區,髒亂及汙染,其他汙染舉發,"永康區洲工街117號 其他汙染舉發",臺南市永康區洲工街117號,23.035858,120.225236
UN201707310458,"2017-07-31 13:39:00",仁德區,髒亂及汙染,空氣汙染,"仁德區太乙五街3號附近 空氣汙染",臺南市仁德區太乙五街3號,22.980016,120.251478
UN201707310471,"2017-07-31 13:49:00",下營區,民生管線,停電、漏電、電線掉落、孔蓋鬆動,"下營區紅厝里89之1號 停電",臺南市下營區紅厝里89之1號,23.245022,120.268312
UN201707310543,"2017-07-31 15:21:00",南區,路燈故障,9盞以下路燈故障,"南區國民路165巷7弄33號 路燈不亮",臺南市南區國民路165巷7弄33號,22.966768,120.213127
UN201707310552,"2017-07-31 15:31:00",北區,道路維修,路樹傾倒,"北區公園路758巷43號  路樹傾倒",臺南市北區公園路758巷43號,23.010681,120.212196
UN201707310567,"2017-07-31 15:57:00",北區,違規停車,違規停車,"北區成功路380號 違停",臺南市北區成功路380號,23.000208,120.20024
UN201707310568,"2017-07-31 15:58:00",北區,道路維修,路樹傾倒,"北區公園路591之37號 路樹傾倒",臺南市北區公園路591之37號,23.013198,120.211722
UN201707310595,"2017-07-31 16:22:00",安定區,天然災害,積水淹水問題,"安定區中沙里沙崙24號 天然災害",臺南市安定區中沙里沙崙24號,23.069164,120.204048
UN201707310614,"2017-07-31 16:58:00",安南區,民生管線,漏水、停水、消防栓漏水或損壞,"安南區安豐六街10巷71弄52號 民生管線",臺南市安南區安豐六街10巷71弄52號,23.044521,120.213318
UN201707310616,"2017-07-31 17:16:00",學甲區,髒亂及汙染,空氣汙染,"學甲區華宗路363號，家禾便當 空污",學甲區華宗路363號,23.2321352,120.1822109
UN201707310621,"2017-07-31 17:26:00",安平區,騎樓舉發,騎樓舉發,"安平區安平路70號 違規停車",臺南市台南市安平路70號,22.998242,120.18484
UN201707310623,"2017-07-31 17:24:00",永康區,道路維修,路面坑洞,"永康區國光五街7號與崑山街222巷路口 路面坑洞",永康區國光五街7號,23.0056201,120.259146
UN201707310625,"2017-07-31 17:29:00",永康區,騎樓舉發,騎樓舉發,"永康區中華西街250號 騎樓舉發",臺南市永康區中華西街250號,23.017968,120.2266
UN201707310644,"2017-07-31 18:06:00",東區,違規停車,違規停車,"東區裕農路448之1號 違規停車",臺南市裕農路448之1號,22.987909,120.231866
UN201707310646,"2017-07-31 18:10:00",中西區,違規停車,違規停車,"中西區西華南街10號 違規停車",臺南市西華南街10號,22.993195,120.20943
UN201707310648,"2017-07-31 18:12:00",安南區,民生管線,漏水、停水、消防栓漏水或損壞,"安南區府安路六段3號 民生管線",臺南市府安路六段3號,23.020293,120.192026
UN201707310649,"2017-07-31 18:11:00",北區,違規停車,違規停車,"北區勝利路206巷28號旁 違停",臺南市北區勝利路206巷28號,23.004797,120.219606
UN201707310673,"2017-07-31 18:55:00",安南區,路燈故障,9盞以下路燈故障,"安南區海佃路一段158巷168號 路燈故障",臺南市安南區海佃路一段158巷168號,23.025011,120.197528
UN201707310676,"2017-07-31 19:01:00",安南區,違規停車,違規停車,"安南區怡安路一段245號 違規停車",臺南市安南區怡安路一段245號,23.041195,120.210067
UN201707310680,"2017-07-31 19:01:00",白河區,路燈故障,9盞以下路燈故障,"白河區內角里85之32號前 路燈不亮",臺南市白河區內角里85之32號,23.397816,120.436447
UN201707310686,"2017-07-31 19:08:00",中西區,違規停車,違規停車,"中西區民權路二段靠忠義路 違規停車",中西區民權路二段忠義路,22.991382,120.202678
UN201707310689,"2017-07-31 19:10:00",中西區,違規停車,違規停車,"中西區衛民街131到137號 違規停車",臺南市中西區衛民街137號,22.993296,120.207525
UN201707310704,"2017-07-31 19:34:00",安平區,路燈故障,9盞以下路燈故障,"安平區漁光路89巷39-1號 路燈故障",臺南市安平區漁光路89巷39-1號,22.976815,120.159812
UN201707310706,"2017-07-31 19:41:00",白河區,髒亂及汙染,道路散落物,"白河區關子嶺11之12號 貓屍",臺南市白河區關子嶺11之12號,23.339403,120.505018
UN201707310708,"2017-07-31 19:48:00",永康區,路燈故障,9盞以下路燈故障,"永康區中正路229號之3 路燈故障",臺南市永康區中正路229號,23.031646,120.248773
UN201707310715,"2017-07-31 20:17:00",東區,路燈故障,9盞以下路燈故障,"東區東門路一段172巷15號 路燈故障",臺南市東區東門路一段172巷15號,22.987216,120.215131
UN201707310720,"2017-07-31 20:30:00",鹽水區,髒亂及汙染,空氣汙染,"鹽水區四維路*新中路 空氣汙染",鹽水區四維路*新中路,23.3077365,120.2767786
UN201707310721,"2017-07-31 20:39:00",東區,違規停車,違規停車,"東區裕豐街與裕豐街61巷 違規停車",東區裕豐街,22.986716,120.2270712
UN201707310725,"2017-07-31 20:56:00",東區,違規停車,違規停車,"東區裕農路後甲圓環 違規停車",東區裕農路後甲圓環,22.9884453,120.2340608
UN201707310726,"2017-07-31 20:58:00",六甲區,噪音舉發,妨害安寧,"六甲區龜港里281巷126弄23號 妨害安寧",六甲區龜港里281巷126弄23號,23.281496,120.264547
UN201707310728,"2017-07-31 21:02:00",北區,道路維修,路面下陷、凹陷,"北區育成路66號 道路維修",臺南市北區育成路66號,23.016972,120.209003
UN201707310738,"2017-07-31 22:04:00",中西區,路燈故障,9盞以下路燈故障,"中西區湖美二街62巷口、湖美二街106巷37號及39之1號 路燈故障",臺南市中西區湖美二街62巷口、湖美二街106巷37號,23.001643,120.182212
UN201707310741,"2017-07-31 22:18:00",安平區,噪音舉發,妨害安寧,"安平區建平七街726號 妨害安寧",臺南市安平區建平七街726號,22.990205,120.168896
UN201707310746,"2017-07-31 22:56:00",中西區,路燈故障,9盞以下路燈故障,"中西區永福路一段24巷4號 路燈故障",臺南市中西區永福路一段24巷4號,22.985678,120.200637
UN201707310748,"2017-07-31 23:16:00",安南區,路燈故障,9盞以下路燈故障,"安南區安寧街23巷14號 路燈故障",臺南市安南區安寧街23巷14號,23.021823,120.193893
UN201708010003,"2017-08-01 02:36:00",中西區,噪音舉發,妨害安寧,"中西區臨安路二段149號 妨害安寧",臺南市中西區臨安路二段149號,23.00031,120.191809
UN201708010004,"2017-08-01 02:41:00",南區,動物救援,犬貓急難救援,"南區明興路1391號 動物救援",臺南市南區明興路1391號,22.9217,120.184771
UN201708010074,"2017-08-01 08:28:00",新化區,路燈故障,9盞以下路燈故障,"新化區那拔里往潭頂方向(177線)由路燈編號0060至""尚元紡織""前 路燈故障",臺南市新化區那拔里往潭頂方向由路燈編號,23.037955,120.332724
UN201708010095,"2017-08-01 08:53:00",中西區,道路維修,人孔蓋或溝蓋聲響鬆動,"中西區公園路96號，健保局前 孔蓋位移",臺南市中西區公園路96號,22.99674,120.206536
UN201708010125,"2017-08-01 09:26:00",中西區,違規停車,違規停車,"中西區民族路二段63號及其周邊 違規停車",臺南市中西區民族路二段63號,22.994306,120.209873
UN201708010138,"2017-08-01 09:35:00",南區,民生管線,停電、漏電、電線掉落、孔蓋鬆動,南區德興路139巷44弄20號與22號,臺南市南區德興路139巷44弄20號,22.962997,120.194112
UN201708010141,"2017-08-01 09:42:00",歸仁區,髒亂及汙染,空氣汙染,"歸仁區保吉路73巷41號 空氣汙染",臺南市歸仁區保吉路73巷41號,23.006954,120.276392
UN201708010143,"2017-08-01 09:46:00",東區,道路維修,路面坑洞,"東區中華東路三段265號 坑洞",臺南市東區中華東路三段265號,22.974971,120.224367
UN201708010152,"2017-08-01 09:56:00",柳營區,髒亂及汙染,空氣汙染,"柳營區東昇里512之3號 空氣污染",臺南市柳營區東昇里512之3號,23.278318,120.321652
UN201708010160,"2017-08-01 10:07:00",安南區,髒亂及汙染,空氣汙染,"安南區永安路71巷8弄7號 空污",臺南市安南區永安路71巷8弄7號,23.044612,120.223309
UN201708010170,"2017-08-01 10:11:00",東區,違規停車,違規停車,"東區崇德三十街73號旁 紅線違停",臺南市東區崇德三十街73號,22.960987,120.229553
UN201708010187,"2017-08-01 10:40:00",安平區,髒亂及汙染,空氣汙染,"安平區安北路152巷7號電鍍廠 空氣污染",臺南市安平區安北路152巷7號,23.003728,120.161205
UN201708010189,"2017-08-01 10:41:00",白河區,民生管線,停電、漏電、電線掉落、孔蓋鬆動,"白河區崁頭里14-7號 民生管線",臺南市白河區崁頭里14-7號,23.327854,120.417886
UN201708010198,"2017-08-01 10:51:00",南區,民生管線,停電、漏電、電線掉落、孔蓋鬆動,"南區明興路631號 電線掉落",臺南市南區明興路631號,22.940076,120.181519
UN201708010203,"2017-08-01 10:54:00",中西區,違規停車,違規停車,"中西區正興街11號 違規停車",臺南市中西區正興街11號,22.993988,120.198422
UN201708010209,"2017-08-01 11:04:00",歸仁區,髒亂及汙染,空氣汙染,"歸仁區保吉路73巷41號 空氣汙染",臺南市歸仁區保吉路73巷41號,23.006954,120.276392
UN201708010212,"2017-08-01 11:12:00",永康區,違規停車,違規停車,"永康區新民街66巷左轉新民街16巷1弄 違規停車",新民街66巷,23.0403976,120.2424419
UN201708010223,"2017-08-01 11:27:00",中西區,違規停車,違規停車,"中西區民生路二段72號周遭 違規停車",臺南市民生路二段72號,22.995284,120.197191
UN201708010224,"2017-08-01 10:16:00",東區,道路維修,路面下陷、凹陷,"東區長榮路二段28號 道路維修",臺南市東區長榮路二段28號,22.987338,120.219238
UN201708010226,"2017-08-01 11:28:00",永康區,髒亂及汙染,其他汙染舉發,"永康區洲工街117號 其他汙染舉發",臺南市永康區洲工街117號,23.035858,120.225236
UN201708010233,"2017-08-01 11:37:00",安南區,道路維修,路面下陷、凹陷,"安南區安中路四段169號 路面凹陷",臺南市安南區安中路四段169號,23.049814,120.169254
UN201708010240,"2017-08-01 11:50:00",新營區,違規停車,違規停車,"新營區復興路163號 違規停車",730台灣台南市新營區復興路163號,23.302980462027186,120.30725329999996
UN201708010242,"2017-08-01 11:53:00",永康區,違規停車,違規停車,"永康區新中街與新街68巷路口 違規停車",永康區新中街,23.0376224,120.2423499
UN201708010247,"2017-08-01 12:06:00",安南區,違規停車,違規停車,"安南區安中路三段安南國中前 違規停車",安南區安中路三段安南國中,23.0486391,120.178044
UN201708010253,"2017-08-01 12:22:00",南區,髒亂及汙染,空氣汙染,"南區新都路256巷1號、新都路193號 愛心燒庫錢所",臺南市南區新都路256巷1號,22.969053,120.198465
UN201708010260,"2017-08-01 12:09:00",東區,道路維修,路面下陷、凹陷,"東區長榮路二段28號附近 道路維修",臺南市東區長榮路二段28號,22.987338,120.219238
UN201708010273,"2017-08-01 13:20:00",中西區,違規停車,違規停車,"中西區衛民街106之2號 違停",臺南市中西區衛民街106之2號,22.993346,120.208667
UN201708010289,"2017-08-01 13:52:00",東區,動物救援,犬貓急難救援,"東區光華街119巷7號 犬貓急難救援",臺南市東區光華街119巷7號,22.984964,120.217379
UN201708010297,"2017-08-01 14:21:00",北區,騎樓舉發,騎樓舉發,"北區東豐路22號 騎樓舉發",臺南市北區東豐路22號,23.003714,120.21439
UN201708010299,"2017-08-01 14:25:00",北區,違規停車,違規停車,"北區長榮路四段169號 違規停車",704台灣台南市北區長榮路四段169號,23.0053233,120.222085
UN201708010302,"2017-08-01 14:27:00",中西區,違規停車,違規停車,"中西區友愛街253號 違規停車",700台灣台南市中西區友愛街253號,22.992081714679383,120.19657697528599
UN201708010305,"2017-08-01 14:32:00",中西區,髒亂及汙染,環境髒亂,"中西區觀亭街100號隔壁 環境髒亂",臺南市中西區觀亭街100號,22.9975,120.205942
UN201708010324,"2017-08-01 14:49:00",永康區,違規停車,違規停車,"永康區新民街接新中街 違規停車",新民街接新中街,23.3783159,120.1513722
UN201708010328,"2017-08-01 14:53:00",東區,道路維修,路面坑洞,"東區裕農路985號 坑洞",臺南市東區裕農路985號,22.990674,120.247126
UN201708010331,"2017-08-01 14:58:00",中西區,違規停車,違規停車,"中西區民族路二段76/95號 違規停車",臺南市民族路二段95號,22.994481,120.209028
UN201708010333,"2017-08-01 15:00:00",中西區,噪音舉發,妨害安寧,"中西區西賢一街27巷28號 噪音舉發",臺南市中西區西賢一街27巷28號,22.999811,120.177017
UN201708010335,"2017-08-01 15:01:00",歸仁區,髒亂及汙染,空氣汙染,"歸仁區民生十街50巷517號 空氣汙染",臺南市歸仁區民生十街50巷517號,22.965269,120.272671
UN201708010340,"2017-08-01 15:11:00",中西區,違規停車,違規停車,"中西區民族路二段76號 規停車",中西區民族路二段76號,22.994673,120.209333
UN201708010345,"2017-08-01 15:23:00",新營區,違規停車,違規停車,"新營區建業路81巷 違規停車",新營區建業路81巷,23.2982301,120.3016052
UN201708010346,"2017-08-01 15:19:00",中西區,交通運輸,佔用道路,"中西區府前路二段192號 佔用道路",臺南市中西區府前路二段192號,22.991588,120.193119
UN201708010367,"2017-08-01 16:22:00",南區,髒亂及汙染,環境髒亂,"安平工業區新樂路68號之2門口 髒亂及汙染",臺南市新樂路68號,22.969874,120.175097
UN201708010373,"2017-08-01 16:33:00",中西區,噪音舉發,妨害安寧,"中西區民權路三段71號 妨害安寧",臺南市中西區民權路三段71號,22.996566,120.197755
UN201708010379,"2017-08-01 16:45:00",中西區,違規停車,違規停車,"中西區民族路二段227號 違規停車",臺南市中西區民族路二段227號,22.995847,120.204914
UN201708010380,"2017-08-01 16:47:00",中西區,違規停車,違規停車,"中西區西華南街43號 違規停車",臺南市西華南街43號,22.993998,120.209378
UN201708010384,"2017-08-01 16:49:00",永康區,違規停車,違規停車,"永康區中正七街 違規停車",中正七街千家軒麵包店前,23.0406852,120.2406428
UN201708010389,"2017-08-01 17:09:00",南區,髒亂及汙染,空氣汙染,"南區金華路二段76號四海遊龍 空氣汙染",臺南市南區金華路二段76號,22.977567,120.191301
UN201708010394,"2017-08-01 17:22:00",仁德區,道路維修,路面坑洞,"仁德區中正路一段60號對面跟66號對面 路面坑洞/道路散落物",臺南市仁德區中正路一段60號,22.919003,120.228747
UN201708010396,"2017-08-01 17:29:00",中西區,違規停車,違規停車,"中西區民族路二段76之7號 違規停車",臺南市中西區民族路二段76之7號,22.994726,120.20925
UN201708010399,"2017-08-01 17:34:00",中西區,違規停車,違規停車,"中西區民族路二段227號 違規停車",臺南市中西區民族路二段227號,22.995847,120.204914
UN201708010402,"2017-08-01 17:42:00",中西區,違規停車,違規停車,"中西區府緯街37號 違規停車",臺南市中西區府緯街37號,22.983784,120.198863
UN201708010403,"2017-08-01 17:41:00",安平區,民生管線,停電、漏電、電線掉落、孔蓋鬆動,"安平區平通路580巷102號 孔蓋",安平區平通路580巷102號,22.9961906,120.1707885
UN201708010404,"2017-08-01 17:45:00",中西區,違規停車,違規停車,"中西區府緯街24號 違規停車",臺南市中西區府緯街24號,22.983925,120.199348
UN201708010406,"2017-08-01 17:48:00",中西區,交通運輸,佔用道路,"中西區府緯街11號 交通運輸",臺南市中西區府緯街11號,22.983799,120.199525
UN201708010418,"2017-08-01 18:00:00",中西區,道路維修,路面坑洞,"中西區臨安路一段25號 路面坑洞",中西區臨安路一段25號,23.001494,120.193055
UN201708010430,"2017-08-01 18:28:00",中西區,違規停車,違規停車,"中西區民族路二段76/95號 違規停車",臺南市中西區民族路二段76號,22.994726,120.20925
UN201708010446,"2017-08-01 19:01:00",大內區,路燈故障,10盞以上路燈故障,"大內區環湖里1號到104號 路燈故障",臺南市大內區環湖里104號,23.147354,120.417954
UN201708010449,"2017-08-01 19:10:00",北區,違規停車,違規停車,"北區東豐路227巷24弄17號 違規停車",臺南市北區東豐路227巷24弄17號,23.004372,120.22209
UN201708010451,"2017-08-01 19:14:00",永康區,違規停車,違規停車,"永康區正強街222號  違停",臺南市永康區正強街222號,23.029048,120.251794
UN201708010452,"2017-08-01 19:16:00",安南區,路燈故障,9盞以下路燈故障,"安南區北安路二段35號 路燈故障",臺南市安南區北安路二段35號,23.025346,120.204825
UN201708010460,"2017-08-01 19:32:00",北區,路燈故障,9盞以下路燈故障,"北區海安路三段506號 路燈故障",臺南市北區海安路三段506號,23.010795,120.200982
UN201708010462,"2017-08-01 19:48:00",安平區,路燈故障,9盞以下路燈故障,"安平區府前三街102號 路燈故障",臺南市安平區府前三街102號,22.994277,120.185838
UN201708010463,"2017-08-01 19:52:00",南區,違規停車,違規停車,"南區體育路47號 對面 違停",臺南市南區體育路47號,22.980806,120.2072
