UN201709180020,"2017-09-18 07:10:00",永康區,違規停車,違規停車,"永康區勝華街140巷5號對面,紅線違停",臺南市永康區勝華街140巷5號,23.006849,120.231495
UN201709180025,"2017-09-18 08:02:00",柳營區,髒亂及汙染,道路散落物,"柳營區柳營路一段226號左前方 貓屍體",臺南市柳營區柳營路一段226號,23.263321,120.313396
UN201709180035,"2017-09-18 08:31:00",新營區,道路維修,人孔蓋或溝蓋聲響鬆動,"新營區三民路46-5號 孔蓋噪音",臺南市新營區三民路46-5號,23.307531,120.318892
UN201709180040,"2017-09-18 08:40:00",東區,違規停車,違規停車,"東區林森路一段153巷1弄 違規停車",東區林森路一段153巷1弄,22.9842614,120.215221
UN201709180044,"2017-09-18 08:46:00",安南區,動物救援,犬貓急難救援,"安南區長溪路三段373巷21弄166號附近 狗被捕獸夾夾到",臺南市安南區長溪路三段373巷21弄166號,23.065736,120.194409
UN201709180095,"2017-09-18 10:29:00",東區,違規停車,違規停車,"東區長榮路二段32巷140號 違規停車",701台灣台南市東區長榮路二段32巷140號,22.98779646943998,120.22167339920998
UN201709180100,"2017-09-18 10:38:00",中西區,違規停車,違規停車,"中西區民族路二段76之6號 違規停車",臺南市中西區民族路二段76之6號,22.994726,120.20925
UN201709180104,"2017-09-18 10:41:00",中西區,違規停車,違規停車,"中西區民族路二段84號 違規停車",臺南市中西區民族路二段84號,22.995552,120.2066
UN201709180111,"2017-09-18 10:45:00",安平區,路燈故障,9盞以下路燈故障,"安平區安北路121巷16弄2號 路燈不亮",臺南市安平區安北路121巷16弄2號,23.002042,120.16303
UN201709180116,"2017-09-18 10:48:00",北區,違規停車,違規停車,"北區臨安路二段221^235號   違停",臺南市北區臨安路二段221^235號,23.005163,120.202952
