UN201712040001,"2017-12-04 00:02:00",安平區,噪音舉發,妨害安寧,"安平區育平9街192巷 妨害安寧",育平9街192巷,22.9955703,120.1710282
UN201712040004,"2017-12-04 00:21:00",安定區,髒亂及汙染,市區道路路面油漬,"安定區港子尾37之28號 市區道路路面油漬",臺南市安定區港子尾37之28號,23.101904,120.236082
UN201712040011,"2017-12-04 03:48:00",南區,噪音舉發,妨害安寧,"南區中華南路2段233巷14號3樓 妨害安寧",臺南市南區中華南路2段233巷14號,22.960323,120.189559
UN201712040019,"2017-12-04 07:11:00",新化區,違規停車,違規停車,"新化區中山路234號 違規停車",臺南市新化區中山路234號,23.036102,120.308249
UN201712040020,"2017-12-04 07:15:00",歸仁區,髒亂及汙染,空氣汙染,"歸仁區中正南路二段258巷43號對面 髒亂及汙染",歸仁區中正南路二段258巷43號,22.9174202,120.2709093
UN201712040021,"2017-12-04 07:18:00",仁德區,動物救援,犬貓急難救援,"仁德區土庫一街811巷112號 狗救援",臺南市仁德區土庫一街811巷112號,22.983843,120.268905
UN201712040025,"2017-12-04 07:55:00",安平區,違規停車,違規停車,"安平區安平路618號 違規停車",臺南市安平區安平路618號,22.999018,120.168817
UN201712040026,"2017-12-04 07:54:00",安南區,動物救援,犬貓急難救援,"安南區安和路四段25巷72號後方 狗受困",臺南市安南區安和路四段25巷72號,23.051916,120.217084
UN201712040029,"2017-12-04 08:00:00",永康區,違規停車,違規停車,"永康區中山南路1042號  違停",臺南市永康區中山南路1042號,23.025379,120.255588
UN201712040036,"2017-12-04 08:19:00",南區,交通運輸,佔用道路,"南區金華路二段15巷77,81號對面 交通運輸",臺南市南區金華路二段15巷77號,22.976246,120.188354
