UN201712110007,"2017-12-11 02:12:00",南區,噪音舉發,妨害安寧,"南區中華南路二段233巷14號3樓 妨害安寧",臺南市南區中華南路二段233巷14號,22.960323,120.189559
UN201712110008,"2017-12-11 02:14:00",東區,噪音舉發,妨害安寧,"東區裕豐街268號(燒烤店) 妨害安寧",臺南市東區裕豐街268號,22.989432,120.227671
UN201712110012,"2017-12-11 03:35:00",中西區,噪音舉發,妨害安寧,"中西區開山路7號  妨害安寧",中西區開山路7號,22.9918068,120.2058291
UN201712110021,"2017-12-11 07:49:00",北區,民生管線,漏水、停水、消防栓漏水或損壞,"北區文成二路185號 路面水管破裂",臺南市北區文成二路185號,23.015015,120.203572
UN201712110027,"2017-12-11 08:05:00",南區,髒亂及汙染,空氣汙染,"南區永成路二段716號，南一昌瓦斯行 空污",臺南市南區永成路二段716號,22.95369,120.195706
UN201712110028,"2017-12-11 08:15:00",大內區,路燈故障,9盞以下路燈故障,"大內區石湖里6鄰274號旁的十字路口 路燈故障",臺南市大內區石湖里6鄰274號,23.126827,120.355467
UN201712110029,"2017-12-11 08:08:00",安平區,違規停車,違規停車,"安平區建平九街60巷50號  違停",臺南市安平區建平九街60巷50號,22.992096,120.18103
UN201712110036,"2017-12-11 08:41:00",永康區,違規停車,違規停車,"永康區大武街34號*正新街路口  違停",臺南市永康區大武街34號,23.020038,120.222695
UN201712110040,"2017-12-11 08:48:00",中西區,違規停車,違規停車,"中西區民族路二段63號 違規停車",臺南市中西區民族路二段63號,22.994306,120.209873
UN201712110055,"2017-12-11 09:14:00",中西區,違規停車,違規停車,"中西區西門路二段221號 騎樓舉發",臺南市中西區西門路二段221號,22.995094,120.199185
UN201712110064,"2017-12-11 09:22:00",新營區,髒亂及汙染,空氣汙染,"新營區八德路2號，東柏 空污",臺南市新營區八德路2號,23.30361,120.28542
UN201712110073,"2017-12-11 09:06:00",龍崎區,髒亂及汙染,環境髒亂,"龍崎區崎頂里13鄰14-5號 環境髒亂",臺南市龍崎區崎頂里13鄰14-5號,22.960882,120.364494
UN201712110076,"2017-12-11 09:42:00",永康區,動物救援,遊蕩犬隻捕捉管制,"永康區和平東路188號，海捷特 狗咬傷人",臺南市永康區和平東路188號,23.055219,120.261472
UN201712110083,"2017-12-11 09:25:00",北區,違規停車,違規停車,"北區開元路與開南街交叉口 違規停車",北區開元路,23.0076856,120.2208649
UN201712110088,"2017-12-11 10:02:00",南區,噪音舉發,妨害安寧,"南區灣裡路582號 妨害安寧",臺南市南區灣裡路582號,22.920197,120.183171
UN201712110114,"2017-12-11 10:52:00",安定區,髒亂及汙染,空氣汙染,"安定區新吉里19之3號 空氣汙染",臺南市安定區新吉里19之3號,23.088098,120.215419
UN201712110119,"2017-12-11 11:02:00",永康區,交通運輸,佔用道路,"永康區龍埔街8號-12號 佔用道路",永康區龍埔街8號,23.0337061,120.26685
UN201712110131,"2017-12-11 10:16:00",中西區,道路維修,人孔蓋或溝蓋聲響鬆動,"中西區臨安路一段35號與37號之間 道路維修",臺南市中西區臨安路一段35號,22.998317,120.189538
UN201712110138,"2017-12-11 12:02:00",東區,違規停車,違規停車,"東區崇德路46號 違規停車",東區崇德路46號,22.9814044,120.2175244
UN201712110140,"2017-12-11 12:11:00",麻豆區,髒亂及汙染,道路散落物,"麻豆區新生北路551號 狗屍",臺南市麻豆區新生北路551號,23.190309,120.248868
UN201712110160,"2017-12-11 13:17:00",永康區,違規停車,違規停車,"永康區六合路42巷1號。巷口  違規停車",臺南市永康區六合路42巷1號,23.00944,120.231408
UN201712110162,"2017-12-11 13:18:00",永康區,違規停車,違規停車,"永康區六合路42巷1號。巷口  違規停車",臺南市永康區六合路42巷1號,23.00944,120.231408
UN201712110165,"2017-12-11 13:19:00",南區,交通運輸,佔用道路,"南區金華路一段472號 佔用道路",臺南市南區金華路一段472號,22.972688,120.190849
UN201712110168,"2017-12-11 13:23:00",南化區,路燈故障,9盞以下路燈故障,"南化區南化里261之1號 路燈不亮",臺南市南化區南化里261之1號,23.038936,120.481328
UN201712110190,"2017-12-11 14:06:00",善化區,路燈故障,9盞以下路燈故障,"善化區蓮潭北三街17號  路燈故障",臺南市善化區蓮潭北三街17號,23.118197,120.310462
UN201712110201,"2017-12-11 14:23:00",永康區,髒亂及汙染,空氣汙染,"永康區立興街132號，全德 空污",臺南市永康區立興街132號,23.001939,120.262828
UN201712110208,"2017-12-11 14:38:00",永康區,髒亂及汙染,環境髒亂,"永康區中正路149號 環境髒亂",臺南市永康區中正路149號,23.030713,120.251698
UN201712110222,"2017-12-11 15:06:00",關廟區,噪音舉發,妨害安寧,"關廟區民族街56號與60號  噪音舉發",臺南市關廟區民族街56號,22.95804,120.332569
UN201712110234,"2017-12-11 15:26:00",永康區,噪音舉發,場所連續噪音,"永康區中山北路114號8樓之2 噪音",臺南市永康區中山北路114號,23.026845,120.260091
UN201712110239,"2017-12-11 15:35:00",關廟區,噪音舉發,場所連續噪音,"關廟區民族街76巷15號旁 噪音舉發",臺南市關廟區民族街76巷15號,22.958229,120.33235
UN201712110251,"2017-12-11 15:54:00",中西區,違規停車,違規停車,"中西區民生路一段107號 違停",臺南市中西區民生路一段107號,22.993514,120.201868
UN201712110255,"2017-12-11 16:04:00",安平區,違規停車,違規停車,"安平區永華路二段826號 違規停車",臺南市安平區永華路二段826號,22.991642,120.168534
UN201712110260,"2017-12-11 16:08:00",永康區,髒亂及汙染,空氣汙染,"永康區正南六街101號  空氣汙染",臺南市永康區正南六街101號,23.037605,120.227547
