UN201712110007,"2017-12-11 02:12:00",南區,噪音舉發,妨害安寧,"南區中華南路二段233巷14號3樓 妨害安寧",臺南市南區中華南路二段233巷14號,22.960323,120.189559
UN201712110008,"2017-12-11 02:14:00",東區,噪音舉發,妨害安寧,"東區裕豐街268號(燒烤店) 妨害安寧",臺南市東區裕豐街268號,22.989432,120.227671
UN201712110012,"2017-12-11 03:35:00",中西區,噪音舉發,妨害安寧,"中西區開山路7號  妨害安寧",中西區開山路7號,22.9918068,120.2058291
UN201712110021,"2017-12-11 07:49:00",北區,民生管線,漏水、停水、消防栓漏水或損壞,"北區文成二路185號 路面水管破裂",臺南市北區文成二路185號,23.015015,120.203572
UN201712110027,"2017-12-11 08:05:00",南區,髒亂及汙染,空氣汙染,"南區永成路二段716號，南一昌瓦斯行 空污",臺南市南區永成路二段716號,22.95369,120.195706
UN201712110028,"2017-12-11 08:15:00",大內區,路燈故障,9盞以下路燈故障,"大內區石湖里6鄰274號旁的十字路口 路燈故障",臺南市大內區石湖里6鄰274號,23.126827,120.355467
UN201712110029,"2017-12-11 08:08:00",安平區,違規停車,違規停車,"安平區建平九街60巷50號  違停",臺南市安平區建平九街60巷50號,22.992096,120.18103
UN201712110036,"2017-12-11 08:41:00",永康區,違規停車,違規停車,"永康區大武街34號*正新街路口  違停",臺南市永康區大武街34號,23.020038,120.222695
