UN201712250001,"2017-12-25 00:16:00",中西區,噪音舉發,場所連續噪音,"中西區金華新路43號3樓 連續噪音",台南市中西區金華新路43號3樓,22.9933157,120.1932024
UN201712250002,"2017-12-25 00:18:00",北區,噪音舉發,場所連續噪音,"和緯路附近萬象舞廳 連續噪音",臺南市北區武聖路246號,23.008577,120.187622
UN201712250003,"2017-12-25 00:38:00",南區,噪音舉發,妨害安寧,"第六分局對面的公園 妨害安寧",臺南市南區中華南路二段241號,22.961349,120.187882
UN201712250004,"2017-12-25 00:41:00",東區,噪音舉發,妨害安寧,"東區大學里大學路22巷25-1號純粹飛鏢本舖 妨害安寧",臺南市東區大學路22巷25之1號,22.994894,120.221429
UN201712250006,"2017-12-25 01:23:00",安南區,噪音舉發,妨害安寧,"安南區顯宮二街58巷1號 妨害安寧",臺南市安南區顯宮二街58巷1號,23.037497,120.126886
UN201712250012,"2017-12-25 01:45:00",中西區,噪音舉發,妨害安寧,"中西區大同路一段252號 妨害安寧",臺南市大同路一段252號,22.981566,120.211733
UN201712250015,"2017-12-25 02:04:00",中西區,噪音舉發,場所連續噪音,"中西區金華新路43號3樓 連續噪音",臺南市中西區金華新路43號,22.993256,120.19278
